|time|user|text
718|28.03.2020 11:51:10|Stock Exchange|в стан страха и ужаса
719|28.03.2020 11:51:33|Alex|ну это надо ебитда в мсфо тогда, В рсбу всякие прочие расходы, часто необходимые для жизнедеятельности, их нужно платить
721|28.03.2020 11:52:44|Harry Lime|У них огромные затраты на торговую сеть , если продажи упадут , вопрос только сколько протянут на марже
722|28.03.2020 11:52:48|Stock Exchange|ну там они в порядке очередности идут, по сути сначала выручка потом себестоимость потом ком. расходы, потом проценты а уж после всего этого налоги, то есть проценты платятся до налогов
724|28.03.2020 11:53:32|Harry Lime|Мне тоже нравилась , но по 105 глупо было не продать
725|28.03.2020 11:53:55|Stock Exchange|Я много чего с ВДО глупого сделал сейчас понимаю.....
726|28.03.2020 11:54:18|Harry Lime|Он у меня с размещения был
727|28.03.2020 11:54:54|Stock Exchange|особенно когда все по 103108 стояло колом не продавал.... ну кто занл, кто знал... опыт, теперь уже будем иначе...
729|28.03.2020 11:56:20|Harry Lime|При всем , что мы знаем про Шевч , он может еще неплохо выкрутиться в данной ситуации
731|28.03.2020 11:57:35|Alex|крупному инвестору понадобились деньги с
732|28.03.2020 11:57:50|Harry Lime|На второй день после размещения
733|28.03.2020 11:58:00|Stock Exchange|Думаешь выплывет Хохрин там в советах сидит не зря же....
734|28.03.2020 11:58:40|Aleksandr|Эх , почему Хохрин не Потанин.
735|28.03.2020 11:59:05|Stock Exchange|
736|28.03.2020 12:07:53|Arslan|А чзпсн с купоном 16 по 104 продавали бы
737|28.03.2020 12:13:04|Harry Lime|Продал по 107
740|28.03.2020 12:13:44|Arslan|Я дурак держал 
741|28.03.2020 12:14:34|Harry Lime|Я держал только ломики , мфошки и любимцев Юнисервиса и Септема
742|28.03.2020 12:16:17|Arslan|Еще вопросик, если правительство решит все таки ограничить передвижение по стране, как это повлияет на бизнес лизинга
743|28.03.2020 12:16:44|Stock Exchange|что думаешь про еврооблигации Фридом финанса
744|28.03.2020 12:18:51|Harry Lime|Есть у меня на 3 портфеля , не парюсь
745|28.03.2020 12:29:56|Dmitry Manzor|Да многие так попали кто знал что корона расползется и по нефти не договорятся. Теперь нужно вынимать бабки из рискового бизнеса. Могут быть несправедливые оферты и купоны
746|28.03.2020 12:48:19|Dm Vl|за несправедливый новый купон эмитент заплатит офертой по цене 100. Все будет гуд. 
747|28.03.2020 12:56:34|Sky|Ща за выходные ВДОшники снова себя страхами накачают...
748|28.03.2020 13:02:08|Viacheslav Petriaev|Только и оферта будет несправедливой и все
749|28.03.2020 13:03:51|Dm Vl|вы не поняли, по закону о РЦБ перед определением ставки нового купона эмитент должен выкупить бонды по номиналу у тех, кто не согласен со ставкой
750|28.03.2020 13:04:24|Viacheslav Petriaev|я то понял. Но он может попросту не смочь это сделать и будет дефолт
752|28.03.2020 13:05:33|Dm Vl|вы определитесь сначала либо купон и оферта, либо дефолт
754|28.03.2020 13:07:01|Dm Vl|точняк
756|28.03.2020 13:11:22|Andrey Hohrin|Официальное мнение от ГГ PRдиректор Владислав Шевнин  Как будет организована деятельность компании в период с 30 марта по 3 апреля, объявленный президентом нерабочими днями  Сложно представить, как могут остановиться предприятия, основанные на круглосуточном режиме работы. Мы являемся крупным агрохолдингом  поголовье на животноводческих объектах нужно кормить и обслуживать по расписанию, в этом деле каникул не бывает. Кроме того сейчас завершается подготовка к посевной кампании, где каждый час расписан. Допустив недельный простой, мы просто оставим население региона без продуктов питания в будущем. Во время вынужденных каникул продолжат работу продуктовые магазины и доставка. Само собой, офисные сотрудники, чье физическое нахождение на рабочем месте в период всеобщего карантина необоснованно, будут дистанцированы.
757|28.03.2020 13:26:16|Arslan|А почему пионер гк застрял в 90х У всех строек такое падение
758|28.03.2020 13:37:00|Paul Baikov|Интересно, а двойной оклад платят с учетом работы в выходные
759|28.03.2020 13:39:46|Zzz|Не платят, так как это выходными днями не считается
760|28.03.2020 13:40:48|Dmitry Manzor|А царь объявил неделю  выходную
761|28.03.2020 13:42:25|Zzz|Установить с 30 марта по 3 апреля 2020 г. нерабочие дни с сохранением за работниками заработной платы.
765|28.03.2020 13:44:40|Evgeniy Averchenkov|У нас двойной оклад, кто выходит на неделе
766|28.03.2020 13:46:03|Zzz|Можно только поздравить У меня в организации нет
768|28.03.2020 13:48:13|Paul Baikov|Ясно, у всех поразному
769|28.03.2020 13:48:58|Zzz|Опять же, интересная трактовкас сохранением зп, то есть только оклад заплатить могут, без премии
772|28.03.2020 13:55:46|Alex|застрял в 90х это как
773|28.03.2020 13:56:34|Алексей ayaye :)|котиры, видимо
774|28.03.2020 13:58:35|Harry Lime|Отлично , назад в будущее в 55й
775|28.03.2020 14:00:03|Alex|А так странно, там оферта в апреле, доходность должна быть конская при цене 90
776|28.03.2020 14:00:59|Harry Lime|Сыгранем в Пионер , как в старые добрые 
777|28.03.2020 14:01:04|Arslan|Котировки
778|28.03.2020 14:07:47|Alex|слишком старые для меня видимо
779|28.03.2020 14:14:00|Artem Maslakov|только вчера угарали с этой темы, когда увидели на пачке
780|28.03.2020 14:14:03|Arslan|Не прокатит. У выпуска с офертой в апреле котира 99.11 бид. 91 у пионер гк 4.
781|28.03.2020 14:18:54|Aleksei Tuv|Этого эмитента по 94 отдавали в 2018, взять или нет ещё думали
782|28.03.2020 14:19:45|Arslan|На ваш взгляд эмитент плохой
783|28.03.2020 14:21:09|Aleksei Tuv|Не худший, сейчас все плохие
784|28.03.2020 14:23:18|Arslan|Спрос на стальной профнастил в ситуации экономического кризиса, карантина и пандемии, и упадка в малом бизнесе думаете сохранится
785|28.03.2020 14:23:39|Harry Lime|Я вот только не пойму он халат одевает или снимает.
786|28.03.2020 14:24:28|Artem Maslakov|Если направился туда, то надевает конечно
787|28.03.2020 14:25:45|Harry Lime|Выиграй шопинг в Милане с личным реаниматологом
788|28.03.2020 14:26:18|Artem Maslakov|с ИВЛ и удобной реанимкроватью
789|28.03.2020 14:26:46|Aleksei Tuv|Этим летом да дальше посмотрим
791|28.03.2020 14:30:06|Alex|вот сейчас бы по капитализации мерять, может еще нераспредленную прибыль посмотреть в 10 ярдов
792|28.03.2020 14:34:09|Harry Lime|Да , это месседж фанатам нераспределенки
793|28.03.2020 14:35:15|Aleksei Tuv|Всё можно нарисовать при желании
794|28.03.2020 14:35:25|MММ🥕🐹|Это уже недоступно, опция по умолчанию паталогоанатомический мешок и мобильный крематорий 
795|28.03.2020 14:54:12|Artem Maslakov|ммм...и по желанию перед смертью развеять прах по морю
796|28.03.2020 14:58:02|Stock Exchange|меседж понятен, только никто так и не ответил нераспределенная прибыль это всё таки живые деньги или что то иное
798|28.03.2020 15:15:29|Harry Lime|Иное , это весьма эфемерная штука
799|28.03.2020 15:15:34|Alexi|Реклама канала про бухгалтерию очень в тему 
800|28.03.2020 15:19:21|Stock Exchange|Я так понял и еще прочитал на ресурсах, нераспределенку нельзя направить в случае необходимости на погашение займов.
801|28.03.2020 15:19:26|Harry Lime|Кэш и эквиваленты
803|28.03.2020 15:19:51|Stock Exchange|это безусловно, даже и не оспаривается
804|28.03.2020 15:20:40|Harry Lime|Сложно кудато направить то , что нельзя пощупать
805|28.03.2020 15:20:53|Stock Exchange|просто в моем воспаленном мозгу грезилось что нераспределёнка это деньги которые в случае чего можно взять и что нить перекрыть
806|28.03.2020 15:21:07|Harry Lime|Щаз
807|28.03.2020 15:21:18|Stock Exchange|ну ладно...
808|28.03.2020 15:21:36|Alexi|Все, что живое и можно пощупать, продать и потратить плюсминус  это активы. Пассивы  это за чей счёт куплены/получены те самые активы акционерные деньги, кредиты и в том числе прибыль от деятельности
809|28.03.2020 15:23:31|Stock Exchange|короче пасивы это то что уже потратили на то что будет прибыль приносить...
810|28.03.2020 15:27:16|Alexi|Получил прибыль, купил на неё майбах. Майбах щупаешь, кэша больше нет, а нераспределёнка в балансе остаётся висеть
811|28.03.2020 15:28:52|Harry Lime|Прекрасный пример , так оно и бывает как правило , а потом есть еще переоценка  майбах можно учесть не по 10 млн , а пересчитать по курсу 100 руб за евро и оценить в 25 .
812|28.03.2020 15:46:54|Paul Baikov|Мне вот интересно, в американском бухучете покупка программ/софта для компании реально учитывается как инвестиции Читал, но думал это шутка такая
813|28.03.2020 15:49:37|Arslan|
814|28.03.2020 15:51:43|Harry Lime|Я когда во Франции ходил кудато покушать , меня местные товарищи по оружию просили сохранять чеки , ведь их можно списать на представительские расходы
815|28.03.2020 16:01:29|Paul Baikov|Это и у нас бывает
817|28.03.2020 16:07:30|Ortemy Alexandrovich|А у нас нет
818|28.03.2020 16:09:24|Evgenii K|Ваша логика отчасти верна. В том плане, что нераспределенка  это самые лояльные пассивы, как правило. За большинством пассивов стоят менее лояльные кредиторы, чем акционеры, которые могут прибыль ждать всю вечность.
819|28.03.2020 16:19:00|Paul Baikov|Ну софт не является инвестицией же по идее, не
821|28.03.2020 16:19:34|А что ты сделал для котэ!?|Является И по форме и по сути Гугли НМА
822|28.03.2020 16:20:14|Paul Baikov|Серьезно, и в России тоже чтоль Ок, погуглю на неделе.
823|28.03.2020 16:57:34|🦠 Dvaops|Застройщики и рейтс неплохо щас лежат самое время брать
824|28.03.2020 17:09:02|Yevklid|Да
825|28.03.2020 17:09:28|Ksenita|Софт со сроком полезного использования выше 1 года входит в капекс у компаний
826|28.03.2020 17:13:30|Paul Baikov|Ясно, спасибо. Далек от бухучета, вот потихоньку образовываюсь
827|28.03.2020 17:14:15|Aleksandr|Коллеги, отвлекитесь, расслабьтесь. Впереди страшные цифры в портфелях, эпидемии и личные драмы. Мож передохнем до понедельника
828|28.03.2020 17:17:00|Ortemy Alexandrovich|Нет
829|28.03.2020 17:17:31|Paul Baikov|Думаете передОхнем
830|28.03.2020 17:19:59|Aleksandr|Интересная двусмысленность. Думаю все не передОхнем в такой короткий срок , но помрачнеть можем сильно. И потом мы то попадем в рай, а сдохнут не мы.
831|28.03.2020 17:21:11|А что ты сделал для котэ!?|До которого понедельника
832|28.03.2020 17:21:41|Aleksandr|Котяра, и ты туда же
833|28.03.2020 17:22:05|А что ты сделал для котэ!?|Чего Я просто уточнил ... выходные то длинные
834|28.03.2020 17:22:12|Paul Baikov|Да простите, так сказать самоизолировался с запасами рома на черный день.. Скучновато 
835|28.03.2020 17:23:25|Aleksandr|До ближайшего понедельника.А там уж веселье наше начнем по новой. Там и Калита и ожидание дефолтов и курс валюты и сообщения в СМИ о нарастающей эпидемии и смертях.
836|28.03.2020 17:24:18|А что ты сделал для котэ!?|Да ладно ... бывало и хуже Чо себя накручивать
837|28.03.2020 17:26:25|Aleksandr|Слушай, ну честно сказать я не так много кризисов экономики видел , но чтоб еще все по домам прятались, не летали самолеты и смерть во всех сми, такого не припомню.
838|28.03.2020 17:26:36|Paul Baikov|Калита скучная будет, даже же на вторичке не будут раздавать. Прям КО
839|28.03.2020 17:27:57|Zzz|Тьфу
840|28.03.2020 17:28:59|А что ты сделал для котэ!?|1998, 2008, 2014, с натяжкой  2004 Не говоря уж о 19901994  там ваще сплошной кризис был несколько лет На нашей памяти не мало А про смерть во всех СМИ  тут да, надо больше на исторические примеры смотреть
841|28.03.2020 17:53:56|Владимир Парцей|Нашли способ лечения короновируса Информация официальная, ссылка http//fmbaros.ru/presstsentr/novosti/detail/ELEMENT_ID38052 Научнопроизводственный центр Фармзащита, входящий в Федеральное медикобиологическое агентство ФМБА, разработал схему лечения коронавируса с помощью противомалярийного препарата мефлохина. Об этом сообщается на сайте ФМБА. Препарат с высокой селективностью блокирует цитопатический эффект коронавируса в культуре клеток и препятствует его репликации, а иммуносупрессивное действие мефлохина препятствует активации воспалительного ответа, вызванного вирусом,  объяснила руководитель ФМБА, бывший министр здравоохранения Вероника Скворцова. По ее словам, препарат обеспечит эффективное лечение пациентов с коронавирусом различной степени тяжести.
842|28.03.2020 17:55:10|Andrey Hohrin|есть один плюс меры господдержки рассматриваются уже сейчас. хотя внедрения пока не вижу. 2008й  год, когда о мерах задумались намного позже.
843|28.03.2020 17:58:37|Aleksandr|Но есть и минус, санкционный режим  не перекредитоваться корпам  , общая закостенелость властей , позади не прекрасные нефтяные годы, а 6 лет выживания и стагнации.
844|28.03.2020 17:59:14|Andrey Hohrin|как раз когда позади не хорошие, а сложные годы  это тоже плюс.
846|28.03.2020 18:00:04|Aleksandr|Ну да, ну да, тяжелые годы уходят , за ними еще тяжелей
848|28.03.2020 18:05:02|Mark O|Позади темное прошлое, впереди  светлое будущее, а сейчас серое настоящее
849|28.03.2020 18:07:19|Владимир Парцей|Что думаете о лекарстве Быстрое решение проблемы с вирусом может спасти малый и средний бизнес
850|28.03.2020 18:07:50|Harry Lime|Звони в Gilead , они могут сделать лекарство
851|28.03.2020 18:08:45|Mister X|ждем ракету в гилеаде, а она все никак....
852|28.03.2020 18:09:28|Harry Lime|Все в цене
853|28.03.2020 18:10:55|Alexey|Ни один регулятор мира даже в такой ситуации не даст пропустить или сократить колво стадий тестирования и их продолжительность
854|28.03.2020 18:11:35|Mister X|пока что похоже на проторговку, про ремдисивир уже из каждого утюга вещают, посмотрим что дальше будет.
855|28.03.2020 18:23:44|Шура SiberianRanger|Про это есть чудесный медицинский триллер Acceptable Risk
856|28.03.2020 18:25:25|Alexey|Положил в список кино на выходные
857|28.03.2020 18:26:08|Шура SiberianRanger|Это книжка 
858|28.03.2020 18:27:41|Alexey|Еще лучше
859|28.03.2020 18:27:46|А что ты сделал для котэ!?|Она не на русском Так не честно
860|28.03.2020 18:28:13|Шура SiberianRanger|Ну я читал в 1996 на английском, а есть ли она на русском я не знаю 
861|28.03.2020 18:31:58|Andrey Hohrin|Такие вот цифры. В мире ежедневно умирает около 150 тыс. людей. От Ковид19 за вчера  3,7 тыс. Чуть более 2 от общего числа.
863|28.03.2020 18:37:48|Sergey|Некорректно. На уровне, все, кто ели огурцы  умерли. Это дополнительные смерти. И не по миру, а по отдельным регионам. И боятся не цифр сегодня, а цифр послезавтра. Рост идёт экспоненциально, это столь же сильно как и сложные проценты
864|28.03.2020 19:07:51|Aleksandr|Даже если бы короновирус вызывал глобальномассовый не смертельный ,но безостановочный понос или паралич рук , то это уже был бы достаточный удар по экономике. А смерти  это моральнопсихологическая часть проблемы, не экономическая.
865|28.03.2020 19:20:18|Алексей ayaye :)|я думаю, что на фоне короны снизится смертность по другим причинам
866|28.03.2020 20:17:15|Aleksandr|Милкен часто любил повторять Не существует нехватки капитала, есть лишь недостаток таланта.
867|28.03.2020 20:21:08|Paul Baikov|Ну, в данном случае недостаток капитала, не проходит.
868|28.03.2020 20:22:18|Aleksandr|Возможно в данном случае его избыток, тк есть талант.
869|28.03.2020 20:23:29|Paul Baikov|Бесспорно
871|28.03.2020 20:37:26|Denis Ipatov|Талана
872|28.03.2020 20:38:20|Dmitry Manzor|Кто А.Х. Это русский Милкен или облигационный Баффет
873|28.03.2020 21:03:30|Aleksandr|
874|28.03.2020 21:04:41|Andrey Hohrin|С недостатком капитала все в порядке. Недостаток есть
875|28.03.2020 21:05:03|Aleksandr|Обычный русский гений из глубинки. Русская земля таких раз в 50 лет рождает ради великих миссий.
876|28.03.2020 21:07:37|Шура SiberianRanger|продать АПРИЖ и не умереть 
877|28.03.2020 21:09:37|Aleksandr|Слушайте, а ведь с этим карантином думаю число мошенюг в стране может сократится.Куда бежать то
879|28.03.2020 21:12:01|Шура SiberianRanger|Как звонили мы обнаружили списание с вашей банковской карты людям, так и звонят. Работают из дома так сказать.
880|28.03.2020 21:12:41|Aleksandr|Ну это не тот уровень чтоб со страны валить.
881|28.03.2020 21:22:55|Andrey Hohrin|В 2009м, по оценке Росстата, ВВП упал на 8. Во второй половине 2008 года  видимо, примерно на 2. Итого от пика  10. В 2009 году был вал дефолтов. Не думаю, что ситуация 2020 года выйдет за рамки 2008го. Т.е. эффект кризиса может быть сильнее. Но и реакция на него более оперативна. Готовим статистику, каковы были дефолты тогда, чтобы сделать предположение, какими они могут быть теперь.
882|28.03.2020 21:24:28|Aleksandr|Тогда цены на нефть быстро выросли.
883|28.03.2020 21:26:06|Andrey Hohrin|согласен с тем, что глубина сейчас может быть большей. но и реакция властей другая. первые осознанные действия в 2008 году Минфин и ЦБ стали проводить в октябре.
885|28.03.2020 21:27:09|Aleksandr|Тогда людской потенциал не выключался из игры. Не нарушалась система управления.
