|time|user|text
618|27.02.2020 19:48:51|Александр|Я вообще думал что примерно только в ноябре начнется, может это так чисто проверка сейчас перед бурей
620|27.02.2020 19:49:29|Salavat Sultanov|Земляк
621|27.02.2020 19:50:03|Harry Lime|Нет , там просто компания ПР простые решения лизинг базируется.
622|27.02.2020 19:50:20|Alexey|Так еще Берникоммунист номинацию не получил и первые поллы не показали что он в теории бьет Трампа. Зато про вирус забудут
623|27.02.2020 19:51:18|Александр|вирус чисто так для проверка фальши, посмотреть куда двигать народ или как поведет, так как народ развивается надо заранее предугадать что может быть.
625|27.02.2020 19:59:36|Святослав|Мамба это сайт знакомства что ли  
626|27.02.2020 20:01:16|Владимир Тутынин|Ага. Сегодня она познакомила тебя с фаллосом
627|27.02.2020 20:02:44|Александр (Саша-ААГ)|Епт
632|27.02.2020 20:05:45|Alexey|Скорее с жесткими практиками любви
633|27.02.2020 20:07:01|Владимир Тутынин|Ага. Это не дамочку танцевать.
634|27.02.2020 20:09:45|Soa|Ну ни кто не отменял продажи с дисконтом
635|27.02.2020 20:13:36|Владимир Тутынин|Это уже эмитентам не выгодно.
636|27.02.2020 20:16:41|Vadim Asanbaev|Мы да
637|27.02.2020 20:17:58|Dmitry Manzor|котировкам ПР тоже сегодня досталось, я разочарован. 
638|27.02.2020 20:18:57|Vadim Asanbaev|Не мы такие, рынок такой, на малых объёмах, если ситуация вернется котира тоже вернется
639|27.02.2020 20:21:06|Dmitry Manzor|Ваш третий выпуск привлекает безофертностью
640|27.02.2020 20:21:08|Andrey Hohrin|Поймите, что для ВДО 5 потери стоимости  это нормально
642|27.02.2020 20:21:52|Vadim Asanbaev|Конечно, это основной плюс
643|27.02.2020 20:22:23|Dmitry Manzor|Я думаю когда съезжаем к номиналу это норм, а вот ниже  боль. А если и опереться не на что ниже, то боль вдвойне
644|27.02.2020 20:25:40|Paul Baikov|По идее ниже 100 не должны, имхо люди просто забирают профит от перегретых бумаг. Хорошая возможность добрать чего хотелось
645|27.02.2020 20:33:25|Aleksandr|некоторым бумагам уже немного осталось и будет ниже ста
646|27.02.2020 20:36:30|Mikhail Evdokimov|значит есть шансы купить еще пониже
648|27.02.2020 20:47:02|Soa|Разместите с дисконтом в 5 проц
650|27.02.2020 20:47:16|Andrey Hohrin|э, нет
651|27.02.2020 20:47:33|Soa|блин..ну нормально же было бы
652|27.02.2020 20:50:23|Paul Baikov|ВысокоДисконтныеОблигации хотите 
653|27.02.2020 20:50:41|Soa|именно
654|27.02.2020 20:50:52|Andrey Belous|Хахахах
655|27.02.2020 20:51:23|Dmitry Manzor|там и купон будет с дисконтом тогда
656|27.02.2020 21:12:52|Dmitry Tarasov|Ктонить держит облиги ПЮДМ У них с 13 по 24 купон объявлена ставка 15. А дальше какая
657|27.02.2020 21:16:34|Даниил Иванов|будет раскрытие недели за 2
658|27.02.2020 21:26:57|Dmitry Tarasov|Ну там есть какаято мин. планка
659|27.02.2020 21:28:15|Dmitry Manzor|Сделают ставку, адекватную рынку и конъюнктуре коррелирующей с текущими клтировками
661|27.02.2020 21:48:11|Adviser|Лидеры сегодня
662|27.02.2020 22:41:59|Andrey Mayorov| ОРНУЛ, как говорится в классической литературе
663|27.02.2020 22:51:03|Alexander|Рубеж больше всех пострадал, интересно, этому есть логичное обоснование или просто так вышло
664|27.02.2020 22:57:21|Evgeny P|Оборот посмотрите
668|27.02.2020 23:10:22|Ilya|а есть набор цитат оттуда   клевый фильмец
669|27.02.2020 23:13:38|Владимир Тутынин|Классный анекдот на ютюбе Вася перевернулся.
670|27.02.2020 23:15:33|Шура SiberianRanger|
672|27.02.2020 23:16:11|nkdar|У Рубежа падающая в течение нескольких лет рентабельность и растущий долг. И зависимость от подсолнечника. Если интересно то можно подробнее узнать здесь
673|27.02.2020 23:18:02|Olly Milly|По рынку слил ктото на последних минутах. И объём не экстраординарный.
675|27.02.2020 23:19:59|Владимир Тутынин|Если фирма развивается, то у нее падает рентабельность и растет долг
676|27.02.2020 23:30:47|nkdar|Вот на этом невысказанном предположении и держится весь хрупкий механизм нашего вдорынка
677|27.02.2020 23:31:20|Владимир Тутынин|Давайте уже сливайте СЭЗ. Гарри инфу выложил что в промышленности тоска.
678|27.02.2020 23:39:38|YYY|
683|28.02.2020 01:53:06|sasha bav|Радует 
684|28.02.2020 02:17:37|Soa|Красиво
686|28.02.2020 06:04:30|Harry Lime|Рубеж тоже можно , лейте в пол уже  Есть проблема , у Рубежа, ЭкономЛизинга , СЭЗа есть проблема в виде большого процента держателей из Фридома. Там любители IPO , которые не знают о существовании лимитных заявок. Проводится раз,яснительная работа , но сливы по рынку по 300 , 500 , 1000 бумаг одного тикера в бумагах Фридома  это боль .
687|28.02.2020 06:10:19|Andrey Hohrin|Помоему, мы слишком оптимистичны и веселы. В январе  феврале рынки, включая нашу песочницу, оказались серьезно перегреты. Мы получаем быстрое охлаждение. Но это тоже инерционный процесс, который при нынешних темпах вряд ли может внезапно завершиться.
689|28.02.2020 06:17:18|Harry Lime|Именно , поэтому концепт death proof портфеля несколько тикеров до погашения взамен широкой диверсификации , взят на вооружение , хороший профит зафиксирован. Кэш для покупок готов.
690|28.02.2020 06:19:07|Andrey Hohrin|я не до конца понимаю смысла такого портфеля без иронии, но согласен с тем, что движения, причем любые, сейчас  это, в большинстве своем, вред.
691|28.02.2020 06:20:10|Harry Lime|Я готов получать 1215 купоном в стиле депозита , не волнуясь о цене бумаг .
692|28.02.2020 06:21:11|Andrey Hohrin|а понял. соглашусь. я в том же положении. как и клиенты.
693|28.02.2020 06:22:11|Harry Lime|Просто у каждого свои принципы в выборе бумаг в такой портфель , это тоже замечательно , плюрализм мнений должен быть и будет
694|28.02.2020 06:25:08|Nik Alex|Согласен с Вашим мнением Полностью Но вы не учитываете паники новичков. А их немало
695|28.02.2020 06:29:23|Harry Lime|Кончилось время брать все подряд с большим купоном. Надо изучать бизнесы и их перспективы. Вот я о чем.
696|28.02.2020 06:32:27|Mikhail FarEast|Доброе утро Илья, а какое количество бумаг эмитентов ВДО у Вас в портфеле Ну к примеру, 3 ломастера, БД и так далее. То есть не размер депо, а именно выпусков эмитентов
697|28.02.2020 06:33:29|Harry Lime|Пока много , точно больше 30
698|28.02.2020 06:33:33|Olly Milly|Какая разница кто как паникует, новички, старички Купили качественную бумагу, зафиксировали доходность к погашению и держите ее спокойно до конца, как бы цена не прыгала.
699|28.02.2020 06:33:38|Mikhail FarEast|У меня к примеру 6
701|28.02.2020 06:48:09|Harry Lime|Не , всех подряд
702|28.02.2020 06:48:43|Mikhail FarEast|А вдо только можно озвучить
703|28.02.2020 06:49:40|Harry Lime|Я с прошлого четверга в терминал не заглядывал
705|28.02.2020 06:51:21|Alexey 1987|Какие плюсы стратегии не заглядывать
706|28.02.2020 06:52:48|Harry Lime|Так делать ничего не надо. Между надо и не надо с моей точки зрения довольно существенная разница.
707|28.02.2020 06:53:02|Mikhail FarEast|2.890,56100,76 3,37 064923  Режим реального времени
710|28.02.2020 06:53:53|Alexey 1987|А как же управлять позицией, или в такой ситуации только дров наломаешь
711|28.02.2020 06:54:14|Harry Lime|Я уже всем чем надо было управил
712|28.02.2020 06:55:23|Mikhail FarEast|У Ильи облиги и судя по всему большинство коротких. Вдо ведь. Берешь на первичке и спокойно ждёшь погашение. Если апсайд приличный, то фиксируешь часть
713|28.02.2020 06:55:27|Alexey 1987|Ну тогда конечно, разумно. Просто может меняется конъюнктура в моменте
714|28.02.2020 06:56:30|Harry Lime|Мне вообще пофиг на нее , у меня облиги , меня интересуют купоны , я сделал большой тэйк профит в январе/феврале
715|28.02.2020 06:59:00|Степан Поделомников|В России подсчитали индекс блина. Получилось довольнотаки вдохновляюще стоимость приготовленного дома блинчика по сравнению с прошлым годом снизилась на 9. Из ингредиентов подорожало молоко на 3,57, а вот остальное подешевело, особенно сахар на 40, яйца на 14 и растительное масло на 7. Индекс считал сервис RateampGoods  мобильное приложение с 20 млн товаров. Пожалуй, их сложно обвинить в необъективности или ангажированности.
716|28.02.2020 07:21:53|"PRObonds | LIVE"|прогнозытренды повесткадня ОФЗ вдо Эффект паники. Рублевые облигации вчера снизились, и снизились третий день подряд. Как к этому относиться Если сравнивать с динамикой западных фондовых рынков, нефти, российских акций, где снижения за это время составили по 510 и более, в облигациях все в относительном порядке. Однако и радоваться снижению облигационных цен как возможности удачной покупки, наверно, рано. Индексы отечественных облигаций корректировались в последний раз более полутора лет назад, после чего испытали одно из самых впечатляющих ралли. Так что сейчас отделаться коррекцией в три дня вряд ли получится. Мало того, облигации  как правило, запаздывающий в своей динамике рынок. Сначала падают акции, потом облигации, хотя это не догма. Но какой бы болезненной коррекция не оказалась, в обвал она перейти имеет незначительные шансы. Когда в апреле 2018 года рухнули ОФЗ, это была закономерная реакция на обрушение пирамиды carry trade. Сегодня подобной проблемы нет, а отвязка России от мировой финансовой системы стала еще больше. Главная, пожалуй, проблема  нефть. Ее цена сейчас, объективно, непредсказуема. Россия при этом  страна внутреннего спроса и примитивного экспорта. Потерять в этой комбинации на ослаблении мировой торговли  сложно. Обстановка далека по последствиям от 20089 или 201416 годов, даже от весны 2018 года. Облигации, скорее всего, еще будет трясти, а доходности еще вырастут. Но все это весьма ограниченно.
717|28.02.2020 07:22:53|"PRObonds | LIVE"|прогнозытренды повесткадня ОФЗ вдо
719|28.02.2020 08:07:59|Владимир Тутынин|Что можете сказать насчет вагонов https//t.me/angrybonds/2758
720|28.02.2020 08:17:02|Vadim Asanbaev|в эту отрасль не заходили, опасения и ожидания думаю обоснованные. Но при этом мы готовы смотреть такие проекты если речь идет о финансовом лизинге с выкупом лизингополучателем имущества в конце срока лизинга и с крупными лизингополучателями
721|28.02.2020 08:43:45|Владимир Парцей|Информация по вирусу заражения 83373 смерти 2858 вылечено 36503 Вчера утром заражения 82164 смерти 2801 вылечено 32872 Объективно, не так страшен вирус, как реакция на него Призываю не паниковать. Сохранять здравомыслие. Планирую на следующей неделе опросить учёных  вирусологов из Иркутского государственного медицинского университета по поводу опасности вируса. А после, опубликовать их ответы на заданные вопросы.
722|28.02.2020 08:51:08|Aleksandr|Владимир Борисович, ты едь в институт Вектор , там опрос нужно делать. Какие вопросы будешь ставить Какая корреляция распространения вируса с доходностями облигаций Что будет если тебе скажут смертность  такая же как от других штаммов . Лечения как известно всегда лишь симптоматическое , возможна лишь профилактика когда будет вакцина . Какой вывод то будет 
723|28.02.2020 08:53:15|Harry Lime|Слата интересно , вирус неинтересно ...
724|28.02.2020 08:53:53|Владимир Парцей|По слате жду ответ
725|28.02.2020 08:59:25|Max|Слата  нормальный бизнес.  Магазины постоянно открываются новые, народ ходит, покупает, ассортимент тоже хороший. С одной стороны норм. Но посмотрим и на другую сторону медали.... Федералы все больше и больше заходят в Иркутск. Наценка на товары падает, конкуренция растет, покупательская способность населения падает. Сложно с федеральными сетями бодаться. Я лично мало в Слате покупаю продукты, только когда чтото нужно купить быстро по дороге домой. Лично я не готов покупать облиги Слаты.
726|28.02.2020 09:00:04|Алексей Мелехов|В Кольцово
727|28.02.2020 09:00:10|Aleksandr|Да
728|28.02.2020 09:00:34|Алексей Мелехов|Надо кста позвонить туда...хорошая идея
729|28.02.2020 09:00:47|Aleksandr|Только Кольцово официально , по поручению правва занимается вакциной.
730|28.02.2020 09:00:49|Алексей Мелехов|Знаю что вирус привезли ещё в январе им
731|28.02.2020 09:01:51|Aleksandr|Давай их облигационировать. Они щас такой хайп поймали.
732|28.02.2020 09:04:36|Кирилл|А Иволга еще и IPO проведёт. Вот радости всем будет
733|28.02.2020 09:05:44|Rost|Ой какой кошмар на рынке .... Может Серго нальют..
734|28.02.2020 09:05:46|Harry Lime|Купил облигацию  получи вакцину вне очереди. Каждый день будет планка вверх по облигам
735|28.02.2020 09:05:51|Aleksandr|Просто представил выезд Иволги к эмитенту с осмотром мощностей . И колво наших вирусологоврыночников в чате
737|28.02.2020 09:07:05|Harry Lime|Первая облига по 500 от номинала
738|28.02.2020 09:07:29|Владимир Парцей|Первый купон  собственная жизнь
739|28.02.2020 09:07:32|Aleksandr|И орги спасители народа , не иначе
740|28.02.2020 09:08:15|Кирилл|Ага. Подсчёт колб и пробирок, оценка центрифуги... и в чате Сегодня СНС Маша будет препарировать вирус с левой стороны... Просим прощения за флуд...
741|28.02.2020 09:08:51|Aleksandr|Там вход то для этого подсчета через несколько зон стерильных в скафандре.
742|28.02.2020 09:09:21|Harry Lime|Так на хрюшках в ОАЭ уже натренировались 
743|28.02.2020 09:10:20|Aleksandr|Ну да, в принципе . Если что на базе ГГ можно филиал сделать , стерильно же.
744|28.02.2020 09:10:54|Harry Lime|Хрюшки в ОАЭ както диковато звучит ...
745|28.02.2020 09:11:35|Aleksandr|А эпидемия свинного гриппа в ОАЭ 
746|28.02.2020 09:12:42|Кирилл|Отлично звучит. Положа лапу на сердце, перевожу ОАЭ, как эмираты...
747|28.02.2020 09:14:32|Aleksandr|ОАЭ просто обязаны были иметь своего нефтетрейдера. Просто назвать его нужно было MasnyshyAramco
748|28.02.2020 09:26:16|Andrey Hohrin|
749|28.02.2020 09:29:40|YYY|А что кто то брал всё подряд
750|28.02.2020 09:30:21|Aleksandr|Гарри брал. Опросы показывали что и большинство так делало.
751|28.02.2020 09:30:56|Harry Lime|Все с купонами 15 , разница только в доле в портфеле
752|28.02.2020 09:30:56|Aleksandr|Но Гарри брал и сваливал потом. А масса боюсь оставалась сидеть  в купоне
753|28.02.2020 09:31:49|Harry Lime|Я оставил по процентику , не тронул только ОМ , Быстро и Кармани . Это кэш кау.
754|28.02.2020 09:32:11|А что ты сделал для котэ!?|И ломабрд уже слил
755|28.02.2020 09:32:18|Harry Lime|Это святое
758|28.02.2020 09:32:59|Aleksandr|Что за проект
759|28.02.2020 09:33:08|А что ты сделал для котэ!?|Парни и девушки Сегодня рынок будет красненьким  а от красного нервы Вместо того, чтобы пялиться в монитор и ервничать  смотрите на котиков Серьезно https//t.me/cats_cats
760|28.02.2020 09:34:13|Светлана|И СЭЗ, да
761|28.02.2020 09:34:27|Harry Lime|Сэз осталось 0,5
763|28.02.2020 09:37:39|YYY|СЭЗ я не трогал , пусть живет ,че дёргаться. Мо тоже работает, апризда и хватит.
765|28.02.2020 09:40:21|Шура SiberianRanger|
766|28.02.2020 09:40:49|Aleksandr|Некоторые, более оборотистые , Обувь уже продали по 105 и снова купили.
767|28.02.2020 09:41:44|Шура SiberianRanger|3
768|28.02.2020 09:42:47|Aleksandr|Возможно ближайшее время вообще будет только красное и белое. Сухое.
770|28.02.2020 09:44:40|YYY|Если как в Гонконге на чела будут давать 1200 ,то и обувь будет интересна , а так просто дрочево.
771|28.02.2020 09:45:38|Rost|Мама родная мне даже пионера влили по .92 видно вчера было жарко
772|28.02.2020 09:46:04|Aleksandr Mukhin|сегодня будет ещё жарче
773|28.02.2020 09:46:06|Aleksandr|Ночью влили 
774|28.02.2020 09:46:18|Rost|не в рабочую сессию
775|28.02.2020 09:46:23|Шура SiberianRanger|внутривенно
776|28.02.2020 09:46:25|Rost|походу
777|28.02.2020 09:47:12|YYY|Брентяра полтос с хвостиком, нерезам по такому курсу не кисло
778|28.02.2020 09:47:13|Rost|Шура... это пионер3 а не паладий. пионерами не ширяются 
779|28.02.2020 09:48:57|Шура SiberianRanger|
780|28.02.2020 09:49:03|Rost|у меня лежат 26255 не 90, но чуть повыше ... рука не поднимется резать гуся
782|28.02.2020 09:52:29|Шура SiberianRanger|там ГО подняли, но если норму капитала соблюдаешь, то ничего страшного
783|28.02.2020 09:52:42|Aleksandr|На фьючах то да, там в основном бесстрашные и неЖадины
784|28.02.2020 09:52:54|Шура SiberianRanger|28.02.2020 0917 Об изменении рискпараметров на срочном и фондовом рынках до старта торгов https//www.moex.com/n27114/nt101
785|28.02.2020 09:53:13|Harry Lime|исследование Дорогие друзья Давно ожидаемое всем нашим сообществом исследование Сэра Гарри по ОАЭ в народе хрякрисёч наконецто опубликовано  Встречаем
786|28.02.2020 09:53:28|Harry Lime|Хряк ресерч
787|28.02.2020 09:53:54|Шура SiberianRanger|
788|28.02.2020 09:54:44|Rost|
789|28.02.2020 09:55:54|М|При выходе за границы приостановка торгов
790|28.02.2020 09:56:09|Evgeny P|В ссылке ошибка гдето
791|28.02.2020 09:57:12|Rost|непродать видно мне свои моторы, это жадность 
