|time|user|text
1|10.04.2020 18:15:44|Алексей ayaye :)|родственников не выбирают 
2|10.04.2020 18:17:11|In|Хорошо братья.
3|10.04.2020 18:18:54|Dmitry Tarasov|Ральф г.., 2 пары туфлей сносились за полтора года, не знаю, что там немецкого
5|10.04.2020 18:25:55|А что ты сделал для котэ!?|Я не замечал их открытия  Тот что на Тверской  так и остался Но я читал, что они много точек закрыли
6|10.04.2020 18:26:16|Marina Bardina|Ктонибудь знает, что за эйфория в Обуви и ЛизингТрейде
7|10.04.2020 18:26:37|А что ты сделал для котэ!?|Батальон Бранденбург
9|10.04.2020 18:28:00|Harry Lime|А вам что больше нравится  обувь или лизинг
10|10.04.2020 18:28:21|Marina Bardina|Я и там, и там застряла
11|10.04.2020 18:28:53|laslo Fish|Старик Хохрин гонит в бой резервные полки
12|10.04.2020 18:28:55|Harry Lime|Так надо было усреднить ... и потом куда бежать
13|10.04.2020 18:29:31|Marina Bardina|Усреднять страшно, ибо и так много.
14|10.04.2020 18:30:10|Andrey Hohrin|помоему, пятница, и когото попросту отпустило на фоне долгой алкотерапии
16|10.04.2020 18:31:05|Harry Lime|Ну ничего же не изменилось в моменте для Обуви или ЛТ , влияние начнет ощущаться через пару кварталов
17|10.04.2020 18:31:40|Marina Bardina|Через пару тоже не хочу сюрпризов
18|10.04.2020 18:32:00|Andrey Hohrin|раньше.
19|10.04.2020 18:32:05|Doctor|Кто нить обращал внимание на облигации АшинскийМЗ По 80 от номинала идут. Отчётность понравилась, я пока акции малость прикупил.
20|10.04.2020 18:32:38|Andrey Hohrin|отчетность понравилась  это как
21|10.04.2020 18:33:20|Marina Bardina|Чего вы пугаити 
22|10.04.2020 18:33:29|Doctor|Ну на мой субъективный взгляд очень хорошо все у эмитента. Но почемуто он по 80 идёт. Возможно я чтото не понял или не знаю.
23|10.04.2020 18:34:00|Harry Lime|Там много вопросов , Аша неоднократно обсуждалась
24|10.04.2020 18:34:56|Andrey Hohrin|я все про отчетность... интересное у Вас к ней отношение
25|10.04.2020 18:37:42|Doctor|Ну хорошо. Долг невысокий хоть и в евро, выручка растёт. Инвест проект вышел на стадию окупаемости, компания показала прибыль. Инвестиции профинансированы Чешским экспортный банком, что у меня уже доверие вызывает. Какого то негатива не вижу, который бы 20 дисконт на облиги дал.
26|10.04.2020 18:38:27|Andrey Hohrin|спасибо
29|10.04.2020 18:39:40|Doctor|Смутили только оговорки аудиторов в заключении. Но они не существенные с точки зрения бизнеса.
30|10.04.2020 18:45:06|Harry Lime|Кипрские собственники , вопросы с налоговой , копеечный купон привязанный к ключевой , старый длинный выпуск.
31|10.04.2020 18:45:16|TrendRadar| КартаРынка ВДО  Хуже рынка 1 2.25 КИСТФ БОП1 2 1.27 Атомстр 01 3 0.85 ГарИнв1P05 4 0.41 ЮниМетр01 5 0.37 ЛнССМУБ1P1  Лучше рынка 1 3.48 Кузина1P01 2 3.05 ДДёнерБОП2 3 2.53 ИСпетр1P1 4 2.44 АПРИФП БП2 5 2.35 КарМаниБ03
32|10.04.2020 18:49:34|Deni Le|НОВОСТИ КОМПАНИИ Публикуем результаты деятельности за I квартал 2020 года. По итогам квартала компания смогла сохранить ключевые портфельные показатели на уровне года. А это, с учетом текущей обстановки, говорит о стабильной устойчивости. Портфельные показатели Лизинговый портфель  1,92 млрд. руб. Сумма заключенных договоров лизинга  281,48 млн. руб. Колво заключенных договоров лизинга  30 шт. Колво предметов лизинга, переданных по договорам  45 шт. Средний срок договора лизинга  30 мес. Структура ссудной задолженности 932 млн. руб. Облигационные займы  411 млн. руб. Банковские кредиты  521 млн. руб. Коэффициент соотношения остатка лиз. платежей к ссудной задолженности  2,1 I квартал 2019 года, традиционно, для компаний является трамплином для будущих достижений. Компания Роделен показала хороший старт. Есть большие амбиции и большие проекты на 2, 3 и 4 кварталы. Мы собираемся в полном объеме выполнить поставленные планы лишь с небольшими корректировками в связи со сложившимися обстоятельствами. За последнюю неделю, произошло значительное увеличение обращений в компанию за услугами лизинга. А на следующей неделе мы ожидаем первые отгрузки в условиях самоизоляции. А это говорит о том, что Бизнес адаптируется и не стоит на месте. Современные проблемы требуют современных решений. И Лизинговая компания Роделен их предоставляет решения. Больше информации на сайте https//www.rodelen.ru/
33|10.04.2020 18:50:38|Алексей ayaye :)|Штирлиц знал, что запоминается только последняя фраза 
34|10.04.2020 18:52:35|Doctor|Спасибо.
35|10.04.2020 19:03:59|In|Под оферту лучше дэни пока нет.
36|10.04.2020 19:06:06|Rost|Сегодня страсть по пятнице у амеров и евро , а в пнд работают или нет  кто в курсе
37|10.04.2020 19:20:48|Dmitry Manzor|
39|10.04.2020 19:25:52|Балянов Вячеслав|Америка работает, Европа  нет
40|10.04.2020 19:30:05|MММ🥕🐹|Да отличная маза взять по 67 сдать по 69 
41|10.04.2020 19:31:47|In|В январе и по 100.
42|10.04.2020 19:33:13|MММ🥕🐹|Хочу в апреле 5 на оферте, а в январе не хочу по 100
43|10.04.2020 19:33:21|Aleksandr|Судя по почерку  Миха 
44|10.04.2020 19:35:45|MММ🥕🐹|Не это всезнающий Щурик он же голос народа
45|10.04.2020 19:41:25|Dmitry Manzor|Если бы не чат, спать бы лёг. А.Х надо иногда повышать голос и баксами размахивать в экран
46|10.04.2020 19:41:59|Aleksandr|Мих, ну чо ты задираешся Ну ты хейтер Иволги же. А я не всезнающий конечно, просто спорю по тем вопросам в которых разбираюсь. Люди ж порой настолько очевидно и авторитетно пишут ересь , что грех не сбить с них корону .
47|10.04.2020 19:46:42|MММ🥕🐹|Откуда бы не был RR и какие бы боты не клепал он все равно крупнейший российский производитель в отличии от того же ОРа
48|10.04.2020 19:47:27|Ruslandd|И многим удалось сбить корону
49|10.04.2020 19:47:58|Aleksandr|Нет. Некоторым просто поправить.
51|10.04.2020 19:50:38|MММ🥕🐹|ОР это чисто обувной Каскад да 
52|10.04.2020 19:51:02|Aleksandr|Мысль не понял твою.
53|10.04.2020 19:52:08|MММ🥕🐹|Купил в Китае  продал в РФ
54|10.04.2020 19:53:47|Aleksandr|Ну в целом да , но есть нюансы. Разработал модель , технологию, брендировал , отконтролировал процесс производства.
55|10.04.2020 20:03:16|Aleksandr| россия вирус контроль В Москве вводится пропускной режим  Собянин Пропускная система будет носить заявительный характер и будет вводиться постепенно. бизнес В Москве на неделю в принудительном порядке прекращается деятельность большинства предприятий
56|10.04.2020 20:03:39|Aleksandr|Приехали нах
57|10.04.2020 20:05:40|Rodan|А все потому, что много уверенных, что вирус фейк и ничего страшного...
58|10.04.2020 20:08:22|Aleksandr|Собянин объявил о введении в Москве спецпропусков На первом этапе будет введено ограничение для поездок на работу, заявил мэр. Ограничения будут введены на следующей неделе Подробнее на РБК
59|10.04.2020 20:09:29|Dmitry Manzor|Совсем там вольтанулся Ещё бы талоны на сахар ввёл
60|10.04.2020 20:09:54|Nik Alex|Все ещё впереди 
61|10.04.2020 20:10:36|Дмитрий Адамидов|давно уже. он помомеу просрал ситуацию с медициной. инфекционки закрыл, врачей разогнал, теперь вот судорожно пытается все запретить, чтобы заметно не было косяков
63|10.04.2020 20:11:11|MММ🥕🐹|Все правильно сделал Собянин  молодец  удачи владельцам хореки 
64|10.04.2020 20:13:52|In|Стройки с непрерывным циклом производства не останавливают. Остальные полностью стоп.
66|10.04.2020 20:14:59|Ruslandd|А что Москва потом от всей России отгородиться стеной В регионах подобных мер нет и распространение вируса прогрессирует с каждым днём
67|10.04.2020 20:16:08|MММ🥕🐹|Стройдеп ещё неделю назад выдал пропуска нам да 
68|10.04.2020 20:16:11|Ruslandd|Если сейчас основной очаг Москва, то скоро основной очаг станет вся страна
69|10.04.2020 20:16:29|In|Следущий шаг, да, стена. Остановят жд и авто сообщение из в мск.
70|10.04.2020 20:17:24|Ruslandd|Это будет отдельное государство Московия
71|10.04.2020 20:17:37|In|С глупым населением по другому никак.
72|10.04.2020 20:17:46|MММ🥕🐹|Если будет нужно остановят метро, автопоездки и введут комендантский час. Я лично вообще ещё удивлён мягкостью применяемых мер. Вообще в России мудрые власти  завидую.
73|10.04.2020 20:17:49|Алексей ayaye :)|я думаю, ни в одной стране нет медицины, готовой к масштабным эпидемиям. очень дорого это содержать. но должен быть план мобилизации и карантина. советский союз неплохо справлялся.
74|10.04.2020 20:18:07|In|Так давно уж как.
75|10.04.2020 20:18:37|Алексей ayaye :)|общественный транспорт  это вообще узкое место. со всем остальным можно както справиться, а вот как народ безопасно перевозить  непонятно. ну только всех в маски одевать
76|10.04.2020 20:18:42|Дмитрий Адамидов|В Москве сократили очень сильно в последние годы фонд койкомест. И как раз инфекционки в первую очередь. Там много чудес было
77|10.04.2020 20:19:11|Алексей ayaye :)|ну да, это эффективные менеджеры
78|10.04.2020 20:19:26|Дмитрий Адамидов|Самые эффективные
79|10.04.2020 20:19:42|In|Маски  это как мертвому припарки. Противогаз вот что нужно.
80|10.04.2020 20:20:07|laslo Fish|При входе в автобус  заставлять надевать ОЗК.
81|10.04.2020 20:20:30|In|При выходе из дома
82|10.04.2020 20:20:58|MММ🥕🐹|Я только за  ещё если введут публичные порки идиотов, то я вообще выпью за многие года Путину 
84|10.04.2020 20:21:40|In|Можно было апрелем ограничиться, теперь и май дома сидеть неразумным.
85|10.04.2020 20:22:35|laslo Fish|Режим повышенной готовности  это снова ни о чем. Ссытся
86|10.04.2020 20:24:24|Mark O|Все уже было описано в Москва 2042 Войновича
87|10.04.2020 20:25:58|Шура SiberianRanger|Первичка 10 апреля
88|10.04.2020 20:27:17|In|Пороть где предлагаете У памятника Достоевскому на Моховой
89|10.04.2020 20:28:02|Шура SiberianRanger|А где увидят, там и прут  анекдот про девушку и глуховатую бабку
90|10.04.2020 20:28:36|Шура SiberianRanger|TOP DNIWE 10 апреля
91|10.04.2020 20:33:35|MММ🥕🐹|Прямо на месте нарушения  вот как этого долбоеба Иисуса Воробьева например выпороли бы на Чистых  гладишь и подействовало бы 
92|10.04.2020 20:34:00|Harry Lime|Вчерашний день, часу в шестом,  Зашёл я на Сенную Там били женщину кнутом,  Крестьянку молодую.
93|10.04.2020 20:34:34|MММ🥕🐹|И ведь за дело били воровку 
94|10.04.2020 20:35:03|Harry Lime|Ни звука из ее груди,  Лишь бич свистал, играя И Музе я сказал Гляди  Сестра твоя родная
96|10.04.2020 20:36:02|MММ🥕🐹|А я думал она кричала Где мой Ломастер 
97|10.04.2020 20:36:37|Harry Lime|Лучше стоя , чем на коленях . Но это совсем другая история ...
98|10.04.2020 20:37:27|MММ🥕🐹|Гарри будут пороть стоя походу 
99|10.04.2020 20:39:04|Harry Lime|Пороть будут на первом же дефолте , причем во всех позах
100|10.04.2020 20:39:28|Dmitry Manzor|Медленно расползется и без ужесточения обойдется. Власти смотрят на столицу, только недавно додумались дать возможность губерам решать. Надо было сразу закрывать въезд и аэропорты и стране бы легче стало
101|10.04.2020 20:39:30|Harry Lime|ОХ уже всех послал нах
102|10.04.2020 20:39:55|MММ🥕🐹|Тсс  нельзя говорить о кисточках они же по 90 ещё 
103|10.04.2020 20:40:34|Harry Lime|Миха крепись , разведка донесла , пока кисти красят
104|10.04.2020 20:40:45|In|Это где купон по триста
105|10.04.2020 20:40:54|MММ🥕🐹|У меня все в шоколаде 
106|10.04.2020 20:41:04|Harry Lime|Все , нет купонов больше , кроссдефолт
107|10.04.2020 20:41:49|In|Там ещё мелочь какая то дефолтится.
109|10.04.2020 20:48:10|Владимир Тутынин|Тут фунт мяса лишний нарисовался.
110|10.04.2020 20:50:00|Dmitry Manzor|
111|10.04.2020 20:52:16|ОлегЕ.|Открытие Холдинг
112|10.04.2020 20:54:51|А что ты сделал для котэ!?|Читательница поделилась с нами уникальным предложением, которое ей сделал банк ВТБ письмо имеется в распоряжении редакции  возьмите, говорят, 2,5 млн, а через 9 месяцев отдайте 4 млн. Ну грех не воспользоваться. По этому поводу у нас куча вопросов к господину Костину, но есть ощущение, что все они останутся без ответов.  ѣѣ
113|10.04.2020 20:55:13|А что ты сделал для котэ!?|У кого карта в ВТБ  действительно такие предложения
114|10.04.2020 20:55:27|Владимир Тутынин|Блин. Парни, вы откуда Ровный поцик кроме адика и найка ничего ведь не натянет
115|10.04.2020 20:56:07|Evgenii K|Скорее всего точку забыли поставить после 8.
116|10.04.2020 20:56:29|Алексей ayaye :)|неа, даже мне 9.6 предлагают
117|10.04.2020 20:56:31|Ингода|А там ещё дополнение есть
118|10.04.2020 21:03:35|In|Втб самый глючный банк. На уровне с приложегием ржд.
119|10.04.2020 21:07:11|Andrey Hohrin|Это как
120|10.04.2020 21:08:40|S R|
121|10.04.2020 21:10:03|Владимир Тутынин|Там тоже один кричал Администратор . После чего оказался в безвыходном положении
122|10.04.2020 21:10:35|Andrey Hohrin|Я понял, мне за ней, конечно, не успеть
123|10.04.2020 21:15:30|Владимир Тутынин|Извините. Спасибо вам за работу. Но. Рынок сегодня 0.88. Поэтому ЮниМетр, например, не хуже рынка.
124|10.04.2020 21:16:56|Шура SiberianRanger|Это не тот рынок
125|10.04.2020 21:18:33|Mister X|парниш, абибаса рядом не было 
126|10.04.2020 21:29:17|S R|Нуну Потише, пожалуйста с такими штуками страшно же.
128|10.04.2020 21:33:26|Harry Lime|Рейтинг Райфу Фитч срезал , так что кроме шуток
129|10.04.2020 21:37:33|In|Естно, все обращения клиентов райфа сводятся к одному  дайте каникул, мне президент обещал. Выдач новых нет. У остальных думаю также плюсминус.
132|11.04.2020 00:54:25|Rost|не может быть помоему фейк
133|11.04.2020 01:45:40|Quantum Satis|1. Попробовал РР один раз в году этак 20072008, больше ни ногой туда
135|11.04.2020 02:37:37|Ilya|Нынче 1. Налоговая отстала, 2. На Кипр дивы нет смысл выводить, 3. купон может и вырасти, выпуск стал таким, каким все выпуски будут на следующий год. 4. Дисконт же позволяет через три года сэкономить на налоге.
136|11.04.2020 06:43:18|laslo Fish|Да, осталось узнать зачем эти страшилки тогда форсили. Они и тогда выглядели ...сомнительно. А уже типичный совет купил облиги  готовься к вопросам налоговой кроме улыбки ничего не вызывают.
137|11.04.2020 09:48:13|Harry Lime|Это повод присмотреться к бумаге после отчета за 6 или 9 месяцев. Драйверов роста цены я пока не вижу .
139|11.04.2020 09:50:16|Andrey Belous|Ашинский или я чтото недопонимаю
140|11.04.2020 09:53:20|Harry Lime|Да , Ашинский метзавод, это дисконтная облига до 24 года по факту . Хватать ее в нынешних реалиях не вижу смысла , а вот в вотчлист на 21й год пожалуй добавлю
141|11.04.2020 09:54:09|Andrey Belous|Я её на просадке прикупил, но не думал, что ктото на неё внимание обратит.
142|11.04.2020 09:54:55|Ilya|Я тоже не вижу
144|11.04.2020 09:56:26|Andrey Belous|Не захожу туда, но потенциал в бумаге вижу.
145|11.04.2020 09:58:11|Harry Lime|Надо отдавать себе отчет , что стать богатым в Аше можно только набрав много и продержав до погашения по номиналу 3 года. А это непростое решение , когда есть МФО/Ломастер под 1820
146|11.04.2020 10:00:36|Andrey Belous|Солидарен. Брал с расчётом взял и забыл, а вдруг...
147|11.04.2020 10:01:53|YYY|Кто то вдруг ,в тишине постучался в двери...
148|11.04.2020 10:03:28|Andrey Belous|есть такое. Лично я отдаю предпочтение реальному производству. С учетом всего негатива, но Аша пока по долгам платит
149|11.04.2020 10:06:51|Harry Lime|21.12.20 у Аши последний купон в этом году , ждите под елку большой рисерч про них от меня
150|11.04.2020 10:07:33|YYY|, пока решил присмотреться ко всему ....
151|11.04.2020 10:08:05|Балянов Вячеслав|По Аше получается ставка купона  ЦБ1.5 со следующего периода купон 7.5 если ставку ещё не снизят. Сейчас торгуется 80 от номинала, то есть дисконт 20 за 4 года погашение в июне 2024 Итого годовой дисконт 20 /4  5  купон 7.5  примерная доходность получается 12.5. Если правильно посчитал
152|11.04.2020 10:11:55|Mik Ter|Роснано думаю прикупить
153|11.04.2020 10:14:06|laslo Fish|А если купить сейчас и продать перед самым гашением, то получим три года владения.
154|11.04.2020 10:15:07|Балянов Вячеслав|Так вроде в июне 2024 погашение
156|11.04.2020 10:15:54|Andrey Belous|С удовольствием прочитаю, так как их не анализировал от слова вообще
158|11.04.2020 10:16:57|laslo Fish|три года  без налога, это имею в виду. Тоже есть для полноты рассчёта учитывать налог на рост тела, но если продать ближе к гашению  налог удастся избежать.
159|11.04.2020 10:18:45|Балянов Вячеслав|12.5 это уже без налога если
160|11.04.2020 10:19:04|laslo Fish|А так ещё лучше
161|11.04.2020 10:23:46|Владимир Тутынин|Так с 21го это отменят
162|11.04.2020 10:29:09|Балянов Вячеслав|Льготу на трёхлетнее владение пока с 21 года не отменяют
163|11.04.2020 10:31:39|MММ🥕🐹|Все впереди думаю 
164|11.04.2020 10:49:32|YYY|МФО/ломастер 1820 , ставки высокие  Инфляция на горизонте 
165|11.04.2020 11:29:16|Aleksandr|Здравствуйте Я думаю, Вам это будет интересно  http//ru.investing.com/analysis/article200268438
