|time|user|text
1|14.01.2020 22:01:09|G M|Некоторые в ПионерЛизинге, ктото в Бэлти 2,мне Калсбыт нравится.
2|14.01.2020 22:02:03|Paul Baikov|Хакас20132015  Для разнообразия
3|14.01.2020 22:02:53|Dmitry Manzor|ГрузЦ
4|14.01.2020 22:02:56|Алекс 21|Пусть  меньше но надёжней но не меньше 89
6|14.01.2020 22:03:36|А что ты сделал для котэ!?|Сначала было 79 Теперь уже 89 
7|14.01.2020 22:03:46|Алекс 21|Хакасия лежит в портфеле
10|14.01.2020 22:05:09|Soa|сколько сейчас хакасия дает
11|14.01.2020 22:05:53|Алекс 21|Ой не помню кажется 78
12|14.01.2020 22:07:10|А что ты сделал для котэ!?|Смотря какая
13|14.01.2020 22:08:22|Paul Baikov|1315 около 6. Зато по 200р, сдачу удобно держать там
14|14.01.2020 22:08:28|Soa|тогда уж хкх якутия
16|14.01.2020 22:10:24|А что ты сделал для котэ!?|Чо думаешь, куда уйдет
17|14.01.2020 22:11:01|Soa|да думаю так и будет бултыхаться 108109
18|14.01.2020 22:11:37|Paul Baikov|Так если 1k то проще действительно как писали, Бэлти2 до окончания размещения или Пионер маркетмейкер всегда в стакане, удобно
19|14.01.2020 22:12:19|А что ты сделал для котэ!?|Все таки идиотский у нас рынок Две одинаковых шлака  ЖКХ РЯ и калсбыт Но какая разница всдохе
20|14.01.2020 22:12:52|Soa|ну да..
22|15.01.2020 06:57:34|Sereja|Она даёт 5 годовых с копейками. Спред 0.1 и комса  14 дней купонов. Дрочилово это, а не сдачу пристроить.
23|15.01.2020 07:27:27|Владимир Парцей|Я начал использовать пионер лизинг в качестве парковки
24|15.01.2020 07:33:29|Шура SiberianRanger|
25|15.01.2020 07:44:39|Corax|На следующем заседании ЦБ ставку опять понизят  Кточто думает
26|15.01.2020 07:48:27|Yuriy Skopylatov|Когда оно
28|15.01.2020 07:59:51|Corax|7 февраля. Встречал мнение что вообще до 5 в этом году могут понизить, в связи с оф.инфляцией в 3. ЦБ как я понял смотрит также на доходности ОФЗ, и от них пляшет. А доходности сами знаете где сейчас
29|15.01.2020 08:35:22|"PRObonds | LIVE"|портфелиprobonds /1/ Время вспомнить о наших базовых портфеля  1, 2, ориентированных на высокодоходные облигации. За 2019 год портфель 1, состоящий исключительно из ВДО, принес не так много в сравнении с широким облигационным рынком  15,4, учитывая комиссионные издержки. Опережения индекса корпоративных облигаций МосБиржи составило всего около 1. Однако в начале нынешнего года разрыв резко увеличился большинство облигаций в портфеле серьезно выросло в цене. Ожидания на 2020 год  1215 годовых. И при этом постараемся избежать волатильности, связанной с возможными просадками рынков акций и облигаций. В прошлом октябреноябре хеджирование уже применялось в обоих портфелях и отработало хорошо. В этом году оно будет применено не раз.
32|15.01.2020 08:36:39|"PRObonds | LIVE"|портфелиprobonds /2/ Портфель 2 в просадке изза спекулятивной части шорт палладия  первая убыточная спекуляция портфеля хотя спекуляция еще не завершена. Итог 2019 года  14. 2020 год с высокой вероятностью станет для портфеля более удачным. Цель по доходности на год текущий  15 и выше. К хеджированию от падений рынков и отечественной валюты портфель также готов. AndreyHohrin
36|15.01.2020 08:40:20|Denis|А как именно захеджирован портфель от падения рынков и рубля
38|15.01.2020 08:48:50|А что ты сделал для котэ!?|Aleksandrov_Dmitry Дмитрий, возвращаясь к лизинг трейду Про 26 доходности по проекту. Все никак не могу понять. Ок, в доход включаются не только прямые проценты, но и всякие комиссии и тд Но если на круг выходит 26  клиент идиот что ли платить такие проценты И не могли бы дать инфу по принадлежащему ЛТ банку
39|15.01.2020 09:07:49|Dmitry Aleksandrov|Это не про лизингтрейд, это про лизинг в целом. Ставки ЛТ находятся примерно по середине уровня цен Сбербанк, ВТБ, Европлан, Балтлизинг дешевле, более маленькие компании  дороже. Почему клиент готов это платить Потому что лизинг  это ещё про налоги. То есть 26  не стоимость денег, это стоимость продукта, состоящего из скорости рассмотрения, удобства графика, налоговых оптимизаций, скидок от дилера техники и т.д.
40|15.01.2020 09:13:34|Андрей ☭ Емельянов|Да, кстати, про БАНК Казани Мы, по сути, рассматриваем чтото близкое к суборду банка, а о нем ни слова Логично предположить, что лишение лицензии гипотетически поставит на колени и ЛТ
41|15.01.2020 09:16:39|Dmitry Aleksandrov|В корне не согласен в утверждении. Ни о каком субординаций речи не идёт
43|15.01.2020 09:18:55|Андрей ☭ Емельянов|Ну почему же Серьёзные проблемы в банке приведут к проблемам ЛТ А очередность выплат если это для физиков со 100 облигациями имеет значение  не на уровне старшего банковского долга
44|15.01.2020 09:22:10|Alex|А что, при лишении лицензии банк будет по старшему долгу платить
45|15.01.2020 09:22:43|Dmitry Aleksandrov|Серьёзные проблемы в банке приведут к сложностям, если ЛТ придётся адски докапитализировать банк. Заниматься сумасбродством никто не хочет, понятно, что нужно резать косты, если перспектив нет. А по самому банку  ВВ от АКРА для банка весьма высокий рейтинг, все нормативы с запасом, на 40 банк принадлежит муниципалитету Казани
46|15.01.2020 09:23:31|Андрей ☭ Емельянов|Ну право хотя бы будет Просто небольшие региональные банки, раздающие вклады физиков в виде кредитов юр.лицам больше всех лишались лицензий
48|15.01.2020 09:25:02|Alex|В виде кредитов кому надо вот так соглашусь.
49|15.01.2020 09:25:21|Dmitry Aleksandrov|Так я и не аргументирую, что тут риск, как у ОФЗ. Но такой акционер  все равно плюс. Хотя бы как сдержка для ЛТ, так как все нужно согласовывать
50|15.01.2020 09:26:36|Андрей ☭ Емельянов|Даже если не докапитализировать, то придётся списать банк с баланса ЛТ То есть мы принимаем на себя риски не только ЛТ, но и БК
51|15.01.2020 09:30:12|Aleksandr|15.01 В.Путин обратится к Федеральному Собранию 1516.01 Гайдаровский Экономический Форум 15.01 в 1700 дискуссия по монетарной политике 17.01 ЦБР представит данные по платежному балансу за 4кв19
55|15.01.2020 09:32:37|Dmitry Aleksandrov|С другой стороны, банк даёт дополнительную надёжность. Два года подряд он выплачивает дивиденды по 19 году порядка 60 млн, и даёт ресурс по связям. При этом, несомненно, это разные бизнесы. Они находятся в разных местах, у них разный менеджмент. Банк не даёт сверхлимитов на ЛТ. Разумеется банк нельзя не учитывать. По моей оценке  это крепкий розничный банк, с хорошей диверсификацией и чистой историей. Мониторить состояние, несомненно, надо, но банк  не чтото особенное, это тоже бизнес
56|15.01.2020 09:35:25|Андрей ☭ Емельянов|Если вдруг найдётся что ещё сказать про БК, уделите этому время во время вебинара, пожалуйста
57|15.01.2020 09:36:13|Dmitry Aleksandrov|Разумеется, про банк расскажу. Но если будут вопросы, с удовольствием на них отвечу
58|15.01.2020 09:36:33|Diz|Ген дир лт, он же председатель набл совета бк
60|15.01.2020 09:38:17|Dmitry Aleksandrov|Разумеется, он же акционер
62|15.01.2020 09:40:58|Diz|Ну да, да. Как по мне все эти истории с банками Татарстана дурно пахнут. Это лично мое мнение и никому не навязываю
63|15.01.2020 09:42:50|Aleksandr|Банки Татарстана падали не больше банков в других регионах. Просто на Татфондбанк сильно много надежд возлагали.
64|15.01.2020 09:43:17|Dmitry Aleksandrov|Если судить о качестве бизнеса по нескольким дефолтам банков из региона, Москва далеко впереди по этому показателю. Не считаю регион дополнительным риском, как раз наоборот, Татарстан весьма богат
65|15.01.2020 09:46:40|Aleksandr|ВДО ВДОКалендарь
67|15.01.2020 09:47:44|Aleksandr|Слата какая то размещаться собралась .
68|15.01.2020 09:48:35|Kostya Kolesnikov|Продуктовый ритейлер в Иркутской области
69|15.01.2020 09:50:04|Alex|Посмотрите программу, кто организатор
70|15.01.2020 09:51:01|Yuriy Skopylatov|Да, это приличный продуктовый ритейлер из Иокутска. Магазинов много, несколько десятков точно
71|15.01.2020 09:54:23|А что ты сделал для котэ!?|Ну вот, а я уж было надеялся, что в России бордель вышел на рынок 
72|15.01.2020 09:57:56|Dmitry Aleksandrov|Кстати, мясные отделы у них от Мясничего
73|15.01.2020 10:09:23|Aleksandr|А обувные 
74|15.01.2020 10:10:18|Aleksandr| PRFN Борода Инвестора разбирает акции ЧЗПСН Продолжаю блуждания по темной стороне. Отчет ЧЗПСН по МСФО за 1 полугодие 2019 года. Без слез не взглянешь если честно, а ведь когдато это громко называлось сектором i Мосбиржи. Я глубоко не копался, потому что в основном это бессмысленная трата времени, но несколько вопросов при просмотре отчетности возникло. Вот что я увидел из беглого взгляда на отчетность показатели падают, но небольшая прибыль рисуется ежегодно явные манипуляции ценой акции, завешенная рыночная оценка закрытость, игнорирование миноритариев, отсутствие перспектив развития привлечение займов через бонды по ставкам намекающим на дефолт что за внеоборотные финансовые активы на 9 млрд рублей Подробнее https//smartlab.ru/blog/586940.php
75|15.01.2020 10:12:28|Yuriy Skopylatov|Не видел. А какая продукция у мясничего
76|15.01.2020 10:20:46|Dmitry Aleksandrov|Мясо
78|15.01.2020 10:29:32|Andrey Belous|AndreyHohrin чемто завершилось дело с письмом Дэни или так и осталось без ответа и они примолкли
79|15.01.2020 10:29:56|"PRObonds | LIVE"|лизингтрейд книгазаявок 23 января 2019  предварительная дата размещения дебютного выпуска ООО ЛизингТрейд. Организатор выпуска  Иволга Капитал. Предварительные параметры выпуска ООО ЛизингТрейд  Объем выпуска  500 000 000 р.  Купон  12,5 годовых YTM  13,1, выплата ежемесячно  Срок до погашения  3 года, амортизация в течение 3го года Как подать заявку на участие в размещении Пожалуйста, сообщите нам  Ваше имя,  Предполагаемый объем покупки минимальная заявка  300 000 р.,  Наименование Вашего брокера. Наши координаты  Ольга Киндиченко Kindichenko_Olga , kindichenkoivolgacap.com , 7 916 452 81 12  Иван Марков Markov1van , markovivolgacap.com , 7 929 509 65 50  Александр Бойчук AleksandrBoychuk , boychukivolgacap.com , 7 985 912 67 50  Наш общий почтовый ящик infoivolgacap.com  Наш общий телефон 7 495 748 61 07 С уважением, Иволга Капитал Презентация эмитента и выпуска облигаций https//www.probonds.ru/emitent/12ooolizingtreid.html Годовая отчетность https//leasingtrade.ru/okompanii/disclosure/ Сервер раскрытия информации https//www.edisclosure.ru/portal/company.aspxid38025
80|15.01.2020 10:30:36|Andrey Hohrin|оппонент нас в курсе дела не держит
82|15.01.2020 11:19:54|Alex|Aleksandrov_Dmitry
83|15.01.2020 11:21:16|Aleksandr|Новый год  традиционно становится временем подведения итогов. Мы изучили свежий Рэнкинг РАЭКСАналитики по рынку лизинга за 9 мес. 2019 года, опубликованный в конце декабря 2019 года. У нашей компании 71 место в общем рейтинге 63 место по полученным платежам 49 место по количеству сделок   30 место по легковым автомобилям balti_investor новости РАЭКСаналитика рэнкинг БЭЛТИГРАНД лизингавто лизингавтомобилей
84|15.01.2020 11:23:55|Владимир Парцей|Знаю их, сам в этот супермаркет хожу Так же родственники знакомы с их предыдущими собственниками. Если есть какие то интересные моменты  пишите
85|15.01.2020 11:35:21|Ekaterina V|Просьба все таки уточнить, чем отличается выложенная на сайте комбинированная отчетность по 2 компаниям от стандартной консолидированной отчётности по мсфо. Примечания в т ч то, на которое ссылается в своём заключении аудитор, не выложены
86|15.01.2020 11:54:34|Aleksandr|Промсвязьбанк Сегодняшние размещения ОФЗ удовлетворят большую часть отложенного спроса на бумаги рынок перейдет к консолидации на достигнутых уровнях.
87|15.01.2020 12:03:28|Dmitry Aleksandrov|https//www.edisclosure.ru/portal/event.aspxEventIdrIJxb2UuKUWUfC7wJnKLyABB Обувь России  ставка 10 на оферте
88|15.01.2020 12:05:46|Harry Lime|Отлично , ждем результаты выкупа , если они будут
89|15.01.2020 12:07:36|Corax|Мосбиржа зарегистрировала выпуск облигаций ООО Маяк на 400 млн рублей
90|15.01.2020 12:09:14|Андрей ☭ Емельянов|Цена выкупа 101,3
91|15.01.2020 12:09:14|Андрей ☭ Емельянов|Софтлайн Доп оферта на сумму не более 500 млн. руб. Цена не выше 101,30 Книга до 21 января 2020г.
93|15.01.2020 12:16:24|Harry Lime|Это и есть Слата , под 24 ярдов выручки , долг 2,6 ярда.
95|15.01.2020 12:21:41|Владимир Парцей|Слата в Иркутске есть Можно сходить, поснимать, пообщаться.
96|15.01.2020 12:29:32|Andrey Hohrin|круто
97|15.01.2020 12:30:52|Андрей ☭ Емельянов|Что мешало это сделать по ценам 95
98|15.01.2020 12:32:25|А что ты сделал для котэ!?|Предположу  денег не было
99|15.01.2020 12:37:52|Aleksandr|https//www.instagram.com/p/B7VWrdrJ5cX/igshidyvgwd1t9wo2z
100|15.01.2020 12:48:20|Yuriy Skopylatov|Как можно будет поучаствовать в первичке
101|15.01.2020 12:48:41|Harry Lime|Без понятия
102|15.01.2020 12:49:26|А что ты сделал для котэ!?|В спарке смотрели
103|15.01.2020 12:49:42|Yuriy Skopylatov|Будете участвовать Я планирую если все нормально будет по отчётности. Хотя постоянно ходят слухи что их будут поглощать более крупные федеральные сети
104|15.01.2020 12:50:02|Harry Lime|Да на руспрофайле за 18й год есть
105|15.01.2020 12:51:43|Alex|А помните в средневековье были деревянные башмаки...
106|15.01.2020 12:52:42|Aleksandr|Помню , я в 15м веке как раз такие носил
107|15.01.2020 13:03:04|Alex|Напомните сети, которые были поглощены, а не вытеснены
108|15.01.2020 13:04:40|Mikhail Saratov|господа, кто работает с финансовыми рынками
111|15.01.2020 13:05:41|Шура SiberianRanger|нет
114|15.01.2020 13:10:34|Deleted Account|Обувь какихто аристократов  не иначе...
115|15.01.2020 13:10:53|Eugeni Schukin|и до сих пор носить можно. Вот качество было 
116|15.01.2020 13:12:54|Harry Lime|Государственный исторический музей , Красная площадь 1 , там можно насладиться созерцанием
117|15.01.2020 13:13:43|Deleted Account|Реплика думаю 
118|15.01.2020 13:14:14|Harry Lime|Очень может быть
119|15.01.2020 13:14:16|Alexander|А то что низкая прибыль при такой выручке это нормально
120|15.01.2020 13:15:19|Harry Lime|В РФ у компании может вообще не быть прибыли толком , налоги никто не любит. Для ритейлера вполне норм прибыль
121|15.01.2020 13:16:01|Alexander|у той же Обуви в разы выше соотношение прибыль/выручка
122|15.01.2020 13:16:52|Aleksandr Boychuk|Доброго дня всем Второй выпуск облигаций Обувь России включен Московской биржей в Сектор Роста. https//www.moex.com/n26528utm_sourcewww.moex.comamputm_termD0BED0B1D183D0B2D18C
123|15.01.2020 13:17:05|Harry Lime|Выручку/запасы прикиньте у Слаты и Обуви , разница в оборачиваемости на порядки
125|15.01.2020 13:30:41|Maksim|Да это же слата из моего родного Иркутска  Они ж в регионе, как X5 Retail в нерезиновой. Даже косвенно имею представление о рукве. Риски политические максимально снижены это важно и для страны и, тем более, для замкадья На прибыль пофиг На прибыть нужно у всяких там эйплов, норникеля хотя б смотреть. В регионах то народ попроще.. Я б затарился
126|15.01.2020 13:32:07|Mikhail Saratov|мощная рекомендация 
127|15.01.2020 13:32:15|Andrey Hohrin|делали на века
128|15.01.2020 13:32:32|"PRObonds | LIVE"|Дмитрий Адамидов. Про ANGRY BONDS и по душам Дмитрий Адамидов, человек и пароход. Первопроходец и путеводитель рынка высокодоходных облигаций. Идеолог сообщества ANGRY BONDS. Сегодня в эфире нашего YouTubeканала. Об облигациях, о высоких доходностях, рисках, Банке России, людях и жизненном пути. 15 января, 1900. В диалоге с Андреем Хохриным и с Вами Чточто, а это  точно интересно  https//youtu.be/NMAjnkVGwBY
129|15.01.2020 13:33:21|Dmitry Manzor|Будет интересно, ждём
132|15.01.2020 13:37:33|Iriny|AndreyHohrin , день добрый Хотела бы Ваше отношение к Апри флай плэнинг узнать стОит взять в портфель Я новичок совсем
133|15.01.2020 13:38:56|Andrey Hohrin|все что могу сказать, АПРИ у нас в портфелях занимает 10 капитала. Что достаточно много. В пятницу я должен, если не будет какогото форсмажора, войти в совет директоров компании.
134|15.01.2020 13:39:58|Iriny|Я прочитала эту новость, поэтому спрашиваю . Спасибо за ответ и удачи
135|15.01.2020 14:01:02|Andrey Belous|Трансляция в каком формате будет Живое общение или по скайпу
136|15.01.2020 14:09:52|Aleksandr|https//www.moex.com/s2151
138|15.01.2020 14:11:29|А что ты сделал для котэ!?|Сказал Добрыня Владимиру Осмотрел пленных речь идёт о волжских болгарах, совр Казань все они в сапогах. Этим дани нам не давать,  пойдем, поищем себе лапотников
140|15.01.2020 14:12:58|Aleksandr|Кот , ну там же в ссылке все описано
141|15.01.2020 14:27:59|Андрей ☭ Емельянов|Можно это сделать путём невыплаты дивидендов банком, а со стороны ЛТ возместить это облигациями Такое возможно
142|15.01.2020 14:40:48|Yaroslav|Кстати не только облигации, акции тоже, вот это уже интересно.
