|time|user|text
758|09.03.2020 20:35:43|Mikhail Strovsky|Ну давайте продадим лукойл по 4300, который брали по 5700. Логично же
759|09.03.2020 20:35:53|А что ты сделал для котэ!?|По 4000
760|09.03.2020 20:36:16|Mikhail Strovsky|По 4000 надо брать акций 20
762|09.03.2020 20:38:10|Ivan Z|Может и будет, а может и нет, если в мировую рецессию свалимся и Брент до 20 дойдет на время
763|09.03.2020 20:38:13|А что ты сделал для котэ!?|Почему не 3000
764|09.03.2020 20:39:01|Mikhail Strovsky|Потому что люди продолжают ездить на автомобиле и летать на самолетах, вот почему
765|09.03.2020 20:39:18|А что ты сделал для котэ!?|Гениально 
766|09.03.2020 20:42:48|Harry Lime|Нормально , не прошел 2008 и 14 , научат в 2020м
768|09.03.2020 20:44:46|Ivan Z|Чем хуже ситуация, тем безопаснее покупать наверное. Сейчас разве хуже не может быть Люди то не перестанут ездить и летать, но нефти в мире довольно много, ОПЕК может и НЕ договориться снова  есть игрок который больше всех качает теперь  США от них непонятно что ждать. Которые могут нашу нефтянку санкциями подвинуть, например...
769|09.03.2020 20:47:03|А что ты сделал для котэ!?|Кстати  в ближайшее время люди будут меньше летать на самолётах 
770|09.03.2020 20:49:07|Soa|
771|09.03.2020 20:49:46|Harry Lime|Когда говорят о цене бумаг главный вопрос для меня  кто будет покупать Акции и бонды  это такой же товар , как пиво и вобла. Забытые истории
772|09.03.2020 20:49:52|Soa|У людей не будет денег на это
777|09.03.2020 20:59:47|Yevklid|Думаешь дадут
778|09.03.2020 21:02:35|Evgenii K|1. Какие завтра будут котировки по бондам, имхо, людям без кэша вообще не имеет значения. Плохо понимаю рациональную сторону смысла продажи именно завтра. Ну сходит в минус на 110 и что Отскочит назад. У облигаций есть купон, который фундаментально якорит цену. 2. Главное, что имеет значение, это бизнес эмитентов. А чтобы оценить его есть 13 месяца. Боитесь Продайте через неделю, месяц, но едва ли завтра. Это иррационально. 3. Сам завтра немного увеличу долю облигаций, если цены нырнут заметно ниже номинала у офз / муниципалов / голубых фишек. В вдо пока не полезу, посмотрю развитие событий дальше.
779|09.03.2020 21:04:34|🦠 Dvaops|Ниже сотки изи
780|09.03.2020 21:05:03|Yevklid|Присоединяюсь по 50 возьмём
781|09.03.2020 21:06:16|I G|Коллеги, ИИС имеет льготы по налогам на купоны от ВДО или как обычно  35 с всего что превышает ключевую5
782|09.03.2020 21:06:17|Vlad Vasilyev|Держать нельзя сбрасывать.
784|09.03.2020 21:07:32|Yaroslav| Правда просадка именно завтра может быть сильно больше 10 в моменте.
785|09.03.2020 21:07:44|I G|имеется в виду  если купон зачисляется на ИИС, то не облагается
786|09.03.2020 21:07:56|Vlad Vasilyev|Да
787|09.03.2020 21:08:11|🦠 Dvaops|Ребята завтра будут делаться ТОП бабки
788|09.03.2020 21:08:19|I G|то есть тот же купон зачисляемый на карту скажем уже будет облагаться
789|09.03.2020 21:09:11|Vlad Vasilyev|Если на карту то налог снимут конечно если он соответсвенно подподает под налог
790|09.03.2020 21:09:47|I G|ясно, спасибо
791|09.03.2020 21:13:50|ОлегЕ.|Пардон, а какая разница в данном случае между ИИС и брокерским счётом
792|09.03.2020 21:16:12|Paul Baikov|Хм, по ставке 35 облагается иис, оба варианта
794|09.03.2020 21:16:55|Vlad Vasilyev|Брокер не знает какой тип иис поэтому зачисляется купон на него без налога на обычный или карту налог снимут брокер Сбербанк 
795|09.03.2020 21:16:56|Владимир Тутынин|То где гэп больше. Хотя мы первый ещё не закрыли
796|09.03.2020 21:17:43|Paul Baikov|35 снимают сразу в любом случае. 13 да, при зачислении на иис приходит полностью
797|09.03.2020 21:18:05|Vlad Vasilyev|Не снимают
799|09.03.2020 21:18:24|Paul Baikov|ПСБ снимает. Кто у Вас брокер
800|09.03.2020 21:18:33|ОлегЕ.|Ну хз. В Тиньке снимают на ИИС 35
801|09.03.2020 21:18:38|Yevklid|А почему не телекомы
802|09.03.2020 21:20:05|Vlad Vasilyev|Уже написал сбербанк. Если купон зачисляется на иис приходит полностью без вычета налога. Если на карту или обычный брокерский счет, налог будет снят согласно правилам налогообложения
803|09.03.2020 21:20:12|Paul Baikov|Неужели 35 тоже брокерспецифик.. Вроде в законе все четко прописано. Удивительно
804|09.03.2020 21:20:25|ОлегЕ.|Возможно не снимают, если у вас сумма вычета меньше 1 рубля...
805|09.03.2020 21:20:51|Paul Baikov|Кстати Вы правы, у знакомого тоже ПСБ, и с двух бумаг округлялось до нуля. Есть такой момент
806|09.03.2020 21:21:26|Evgenii K|Ну, это только если какието ошибочные приказы, имхо. Облиги это не акции, которые завтра на 2030 вниз в моменте сходят. Облиги это совсем простая математика.
807|09.03.2020 21:22:03|Vlad Vasilyev|Больше 1 рубля 
809|09.03.2020 21:22:39|Paul Baikov|Удивительно както. Может и дивиденды полностью приходят Там опять же четко сказано, что с них ни вычет ни освобождение от налога нельзя получить
810|09.03.2020 21:22:57|Vlad Vasilyev|А вот дивиденды налог снимают
811|09.03.2020 21:23:31|ОлегЕ.|В ИИС 2 типа вычета А и Б. Сбербанк придумал третий
812|09.03.2020 21:23:45|Paul Baikov|Имхо косяк какойто брокера. В целом у всех свои косяки.. ВТБ помнится тело на мастерсчет по некоторым бумагам с ИИС гасил А тинек НКД не учитывает.. Хотя казалось бы, все довольно строго прописано в НК
813|09.03.2020 21:24:08|Сергей Костромеев| нефтянка корпораты бонды банки сша макро warning blackswan полное пике мусорных бондов в нефтянке США   как поступят США  ранее почти вся нефтянка США сидит на диком leverage перед банками очень большие долги перед банками  просто космический exposure Низкие цены на нефть  дефолты у сланцевиков  дефолты у банков США  катастрофа
814|09.03.2020 21:24:57|Vlad Vasilyev|Ну конкретно по дяде денеру налог на иис не снят на обычку снят, дивиденд мтс снят налог в обоих случаях
815|09.03.2020 21:26:42|М|Налог снимут при закрытии ИИС
817|09.03.2020 21:26:51|Paul Baikov|Это же БО Конкретно ДД нету
818|09.03.2020 21:27:38|ОлегЕ.|Возможно просто глюк. У меня по ПКБ тоже не сняли с последнего купона  пока не спрашивал у брокера почему
819|09.03.2020 21:27:40|Paul Baikov|Если КО то там другой вопрос
821|09.03.2020 21:29:31|Harry Lime|Коллеги докладают с мест боев , цены чутка пониже. SWN 26 около 64 , US Steel 26 74
822|09.03.2020 21:35:10|Yaroslav|Зависит от ликвидности. Завтра интересно будет смотреть на лютый неликвид  аккуратно смотреть. Там на пустых стаканах можно уехать на 40 не за день мб, но за несколько. Я не про облиги правда, а про акции, но в менее ликвидных облигациях тоже будет картина такая себе..
824|09.03.2020 21:37:01|Ivan Z|А помните тут пару дней был человек удачно взявший us steel по 90
825|09.03.2020 21:38:39|Aleksandr|Обувь уже жила при таком курсе бакса.Чо ей будет то сейчас
826|09.03.2020 21:38:48|Harry Lime|Это для него в первую очередь ...
827|09.03.2020 21:43:10|Yaroslav|Да я про момент сам. Так то за компанию я не волнуюсь. Все 4 компании я сохраняю в портфеле. Из купонов и дивов можно будет аккуратно докупать. Правда вот докупать мб уже не их Тот же сбер и т.д. . Если конечно цены не будут сверх приятными.
828|09.03.2020 21:43:24|MММ🥕🐹|Я в железном 100 холде оставшихся у меня ВДО завтра  буду ловить вкусняшки со счётов убитых МК на свободный кеш 
829|09.03.2020 21:43:35|Yaroslav|Точнее не волнуюсь настолько, чтобы фиксировать позиции, да еще и на панике
830|09.03.2020 21:43:47|Mikhail Strovsky|Что сделается с вдо
833|09.03.2020 21:45:33|Ivan Z|Обувь нескоро вырастет ещё. На нее всем было наплевать пока уже со всех мест рынка доходность не съели. Чтобы она стала снова интересна ещё мнооого времени должно пройти...
834|09.03.2020 21:46:15|Oleg Egorov|Ого, и про страну вспомнил сразу...
835|09.03.2020 21:50:52|Yaroslav|Вырастет мб и нескоро. Главное чтобы финансово все было ок у компании. Я привык некоторые позиции держать годами. В неликвиде это актуально. Зато выстреливают круто. В любом случае фиксировать уже не вариант. Тем более что я фиксировал и перезаходил по околотекущим. В этом наверное была ошибка  стоило дождаться налаживания ситуации.
836|09.03.2020 21:56:49|Evgenii K|В акциях третьего эшелона  может быть. Но вот за обувь совсем не беспокоюсь. На них текущий кризис только положительно повлияет. Мб только фондирование повысится. А так недорогая обувь от рос производителя  гууууд. По 3035 я их буду докупать.
837|09.03.2020 21:59:36|Yaroslav| Обувь раньше тоже была неликвидом, еще до Иволги
840|09.03.2020 22:00:23|MММ🥕🐹|Сбер по 100 лучше обуви по 20 
841|09.03.2020 22:02:37|Harry Lime|Я вполне верю в Обувь по 20 , но не очень в Сбер по 100 ...
842|09.03.2020 22:03:30|MММ🥕🐹|Не настаиваю на точности цифр  главное что вы поняли мою мысль 
843|09.03.2020 22:03:41|Владимир Тутынин|Вообщето облигации считаются сложнее акций. Если вникать как Гарри.
844|09.03.2020 22:04:49|Harry Lime|Мне нравится копаться в этом , но ВДО  это не легкая прогулка , завтра новоприбывшие в этом убедятся ...
845|09.03.2020 22:05:23|Mikhail Strovsky|Господи, вот чего вы тут строите трехэтажный интеграл Берем 15 разных эмитентов. Покупаем вдо. Получаем каждый месяц купон
846|09.03.2020 22:06:39|Harry Lime|У меня их куда больше 30 , я отдаю отчет , что 20 могут не получить рефинанс при погашении , не самых плохих компаний
847|09.03.2020 22:06:45|MММ🥕🐹|Ждем на планке в 6065 бонды плечевиков переборщивших со срочкой  а там посмотрим что в ассортименте 
848|09.03.2020 22:07:07|Mikhail Strovsky|У меня например большой пакет северстали и лукойла. Очевидно можно по 4300 и 810 прикупить и их
849|09.03.2020 22:08:22|Harry Lime|RIP
850|09.03.2020 22:08:32|Mikhail Strovsky|На адских минусах думать много не надо  это голубые фишки, был бы кэш, а бумага найдется
852|09.03.2020 22:08:54|MММ🥕🐹|Если с маржиналкой то однозначно 
853|09.03.2020 22:09:03|Harry Lime|5 стадий
854|09.03.2020 22:10:10|Paul Baikov|ВДО могут просесть, да, это выглядит страшно, но надо смотреть на здоровье эмитента, а не на цену бондов, имхо. С офертами могут быть сложности на панике, единственное
855|09.03.2020 22:10:20|MММ🥕🐹|Мне кстати очень интересно будет понаблюдать по сбросам бондов с МК что брали из ассортимента ВДО люди
856|09.03.2020 22:10:39|Mikhail Strovsky|Такое впечатление, что вы тут реально все верите, что биржу пора закрывать
858|09.03.2020 22:11:41|laslo Fish|И эффект тинька завтра сыграет маятником, обратно Домохозяйки, узнавшие, что инвестиции это просто, начнут лить кровь... Прямо в тазики Михе
859|09.03.2020 22:12:24|MММ🥕🐹|Дэнни по писят может раздадут бкэсники и ко 
860|09.03.2020 22:13:12|ОлегЕ.|Не все. Я из Тинька , но тазик готовлю
861|09.03.2020 22:13:29|Владимир Тутынин|Макетмейкеры будут с удовольствием скупать и работа, и приятно.
862|09.03.2020 22:14:29|Harry Lime|Хорошая идея , но их много , очень много
863|09.03.2020 22:14:34|Mikhail Strovsky|Короче, ясности нет ни у кого...
864|09.03.2020 22:14:34|MММ🥕🐹|Ну если больше вкусняшек не будет то одного коня, но воообще рассчитываю и на более вкусные конфетки 
865|09.03.2020 22:15:02|🦠 Dvaops|Поставил ведро на 55.6, завтра увидите меня в стакане
866|09.03.2020 22:15:25|Mikhail Strovsky|Это ж раз в квартал
867|09.03.2020 22:15:44|Владимир Тутынин|Завтра ничего не будет. Верхи не захотят, а низы не смогут.
868|09.03.2020 22:16:10|Harry Lime|Самое вероятное развитие собыиий в 90 ВДО к сожалению
869|09.03.2020 22:16:34|MММ🥕🐹|Как это не будут Торги не откроют что ли Больше вариантов не вижу.
870|09.03.2020 22:17:35|Владимир Тутынин|Не договорятся продавцы и покупатели. Меж ними большая жаба
872|09.03.2020 22:20:44|MММ🥕🐹|Так о них и речь  завтра появится убитых целое кладбище имени 10 марта
873|09.03.2020 22:22:19|Владимир Тутынин|Просто я подозреваю маржинкольщиков немного в ВДО. Не тот темперамент.
874|09.03.2020 22:23:46|А что ты сделал для котэ!?|Возможно я вас огорчу, но 810 по севе уже было ... и даже 800  на прошлой неделе
875|09.03.2020 22:24:55|MММ🥕🐹|Согласен, но это во первых не значит что их там не будет, во вторых избы МК будут крыть жестко и по рынку...в третьих изза низкой ликвидности многим бумагам и 300500 бумаг хватит чтобы до 6065 дойти 
876|09.03.2020 22:26:57|Mikhail Strovsky|И что, а через полгода все отыграется
879|09.03.2020 22:28:49|Ivan Z|Почему вы так уверены
880|09.03.2020 22:29:10|Harry Lime|Не видел как бывает просто
881|09.03.2020 22:29:13|MММ🥕🐹|Отберите у него стеклянный шар 
883|09.03.2020 22:30:04|R T|Газ ожил, по жиже какие мысли
884|09.03.2020 22:30:08|А что ты сделал для котэ!?|Просто меня удивило, чтотвы не знакомы с перформансом бумаги, которой владеете и собираетесь добирать
885|09.03.2020 22:31:29|nik|Как бы не получить рост до 390
886|09.03.2020 22:31:46|Mikhail Strovsky|Я сужу по одному простому принципу. Голубые фишки фосагро, втб, лукойл, северстальвдовтб в валюте облигации и можно спокойно подождать
889|09.03.2020 22:33:17|MММ🥕🐹|Хочешь жить не трогай ее  убьёт 
890|09.03.2020 22:33:20|Harry Lime|Японцы с 88 года 30 лет ждали
891|09.03.2020 22:33:53|R T|
892|09.03.2020 22:34:30|Harry Lime|Говорят в соседних чатах трейдеры по бренту уже пытались выпиливаться
893|09.03.2020 22:34:51|А что ты сделал для котэ!?|В каком смысле Из окна
894|09.03.2020 22:34:56|Harry Lime|Ага
895|09.03.2020 22:35:05|А что ты сделал для котэ!?|Эх, я бы посмотрел
896|09.03.2020 22:35:45|MММ🥕🐹|Ну это неизбежно  рынок убьёт всех плечевиков рано или поздно 
897|09.03.2020 22:37:03|Владимир Тутынин|Откуда С июля 2017 по март 2020 с 790 до 810 это 2,5 за 3,5 года
899|09.03.2020 22:40:09|А что ты сделал для котэ!?|Дивиденды забыл
900|09.03.2020 22:41:20|Владимир Тутынин|Нее. Цитата была без дивидендов.
902|09.03.2020 22:43:38|Александр Шумаков|Ну Капец . Сегодня эта нефть даже в непрофильных чатах. Страшно завтра просыпаться.
903|09.03.2020 22:44:13|Владимир Тутынин|Скинь хотябы в личку что у тебя там. Думаю о лонге нефти.
904|09.03.2020 22:45:29|Вrus|Можно не ложиться
905|09.03.2020 22:46:01|Александр Шумаков|Тоже вариант. В итоге , думаешь, хорошо что у тебя нет миллионов 
908|09.03.2020 22:49:26|Евгений|Откуда в ВДО МК Ни один брокер не даст плечо под ВДО. Крыть будут фьючи, опционы и голубые фишки, всякие неликвиды будут продаваться добровольно.
909|09.03.2020 22:49:55|Вrus|Вот вот. Тоже удивился про плечи в мусоре
910|09.03.2020 22:50:42|MММ🥕🐹|Кпур взявший газика с максимальным плечом и вдо не существует 
911|09.03.2020 22:51:04|Евгений|Ну так брокер газика и закроет
912|09.03.2020 22:51:51|MММ🥕🐹|Брокер сразу ливанет всю позу чтобы не уйти в минус 
914|09.03.2020 22:54:53|Евгений|Если газика даже 80 депо под пятым плечом, потребуется падение на 25, чтобы речь зашла об убытке брокера
915|09.03.2020 22:55:18|MММ🥕🐹|Ну так это вообще не проблема вроде 
916|09.03.2020 22:57:48|Виталий|И к чему эти репосты
917|09.03.2020 22:59:20|MММ🥕🐹|Поклонник наверн 
918|09.03.2020 23:00:16|YYY|Поклонник ВДО или веры
919|09.03.2020 23:00:25|Евгений|Да вобщемто не проблема, но сейчас при падении на 20 биржа включит дискретный аукцион, и все брокеры смогут марджинколиться об ЦБ на нем. Я так понял, задумка такая на завтра.По крайне мере по валюте это так должно работать
920|09.03.2020 23:03:08|А что ты сделал для котэ!?|Маржинколиться об ЦБ Переведи
921|09.03.2020 23:05:26|MММ🥕🐹|Изба автоматом воткнет все в рынок на большом минусе по счету и сортировать на вдо или невдо не будет
922|09.03.2020 23:07:12|Евгений|Дискретный аукцион по валюте  торги приостанавливают, 10 минут собираются заявки, выявляется единая цена. Потом еще 5 минут ЦБ ставит свою заявку, все сделки проходят по одной цене. Может быть тоже самое будет завтра по ценным бумагам, ЦБ выйдет на покупку с целью сбить панику. Иначе может быть бесконтрольный сброс институционалов с эффектом домино
924|09.03.2020 23:09:37|Paul Baikov|Это чтото типа аука закрытия получается
925|09.03.2020 23:09:43|YYY|Так минфин и сказал, что продаст в рынок , так что паниксел по возможности купируют как смогут, ну а дальше будет дальше. Так длинно у них никто не думает , госы решают текущие проблемы в основном.,ИМХО
926|09.03.2020 23:09:55|Евгений|Да. Это оно и есть. И завтра, похоже, мы в это окунемся
927|09.03.2020 23:10:21|MММ🥕🐹|Это если есть биды  а если их нет  то это просто пауза перед следующей планкой 
928|09.03.2020 23:10:30|Paul Baikov|Спасибо. Походу завтра квик лучше и не запускать
929|09.03.2020 23:11:39|Евгений|Понаблюдайте хотябы, такие дни это большая редкость на рынке
931|09.03.2020 23:13:44|Paul Baikov|В ридонли, да, посмотреть стоит наверное
933|09.03.2020 23:14:28|Алексей ayaye :)|потом диды будут рассказывать молодняку про 2020 
934|09.03.2020 23:15:19|Paul Baikov| видимо. Я вот 2008 пропустил, пора обучаться
