|time|user|text
576|01.03.2020 11:41:43|sasha bav|Янет. А вот чел, который открыл пут спрэд, наверное что то знает или на что то надеется. А продавцов времени на опционах,выносят с рынка вперед ногами с завидной регулярностью
577|01.03.2020 11:43:25|Mark O|Покупателей тоже
579|01.03.2020 11:46:37|sasha bav|Согласен 
580|01.03.2020 12:35:19|А что ты сделал для котэ!?|В понедельник Или вообще в марте
581|01.03.2020 12:43:00|Soa|На публикацию в чате, согласие на частное мнение врача
582|01.03.2020 12:46:08|Владимир Парцей|Частное мнение это мягко говоря не серьёзно. Я хочу получить официальный ответ
583|01.03.2020 12:46:53|Soa|Вы пишете ерунду..
585|01.03.2020 13:03:53|Владимир Парцей|Вот именно. Сейчас море неофициальной информации. Я хочу предоставить официальную
586|01.03.2020 13:07:32|Andrey Hohrin|Понедельник, думаю, не показателен. Как раз после сильного падения прошлой недели ждал бы повышения цен. А вот дальше у меня опасения.
587|01.03.2020 13:09:19|Aleksandr|Эмитенты Иволги при условии невозможности рефинанса с рынка ближайший год  два , спокойно выживут
588|01.03.2020 13:10:17|А что ты сделал для котэ!?|А у кого из них погашения/оферты в ближайшие 12 мес
589|01.03.2020 13:10:26|Andrey Hohrin|С учётом того, что у всех облигации не основа фондирования, да
590|01.03.2020 13:10:50|Дмитрий Адамидов|А почему вдруг невозможность рефинанса
593|01.03.2020 13:11:54|Alexey|В вдо ли свалят
594|01.03.2020 13:12:11|Дмитрий Адамидов|ну частично  нам тут много то не надо. миллиард другой
595|01.03.2020 13:12:15|Aleksandr|Стресс  тест
596|01.03.2020 13:12:24|Дмитрий Адамидов|ааа
598|01.03.2020 13:15:17|Aleksandr|Я скупал Сэтл и ЦППК на пустых стаканах в сентябре 2018 . Уж они то не ВДО . Бедные продавцы стояли все ниже и ниже . Хз куда девается спрос , но он просто исчезает даже не в ВДО .
599|01.03.2020 13:15:52|ОлегЕ.|Дохлый мартовский кот
600|01.03.2020 13:15:56|А что ты сделал для котэ!?|А чо было в сентябре 2018
601|01.03.2020 13:16:54|Aleksandr|Да ничего , в июле начали падать ОФЗ , а к сентябрю волна полноценно дошла до корпоратов.
605|01.03.2020 13:30:12|Владимир Тутынин|ВДО стоят как скала это в обе стороны.
609|01.03.2020 13:39:31|Andrey Hohrin|Солидарен
610|01.03.2020 13:43:06|Aleksandr|Погодите , еще не все хомяки приступили к распродажам.Особо упрямые верили что это не конец . Вот когда пробьет устойчиво номинал , тогда руки могут дрогнуть и со словами да ну его нах будут убиваться биды .
611|01.03.2020 13:44:21|Владимир Тутынин|Так они дораспродадут на первой коррекции
612|01.03.2020 13:44:37|Aleksandr|Которая возможна в понедельник.
613|01.03.2020 13:45:17|Владимир Тутынин|Да. Вдо же будет стоять как скала, а акции начнут рост
615|01.03.2020 13:48:11|Aleksandr|Каждую из этих скал снесут к чертовой бабушке обьемом 510 млн на стакан
616|01.03.2020 13:49:33|Владимир Тутынин|На коррекции, надеюсь, паники не будет. А потом не будет вариантов переложиться. Оставшиеся будут терпеть
617|01.03.2020 13:53:13|Светлана|предстоящие новые размещения интересно как будут проходить
618|01.03.2020 13:53:16|А что ты сделал для котэ!?|Я таки извиняюсь  в четверг и в пятницу коррекции не было Что вы ожидаете в понедельник  Страшный Суд
620|01.03.2020 13:54:49|Aleksandr|В понедельник , почитав тут умных людей , допускаю стабилизацию цен в ВДО . Но так же допускаю агрессивную разгрузку крупных держателей.
621|01.03.2020 13:55:07|Дмитрий Адамидов|так на разгрузке добирать
622|01.03.2020 13:55:13|Светлана|Не...ну несерьёзно ведь, нормально ж все было что все нагнетают тонабрала бережно кучу скриптов
623|01.03.2020 13:55:44|Владимир Тутынин|Сейчас все выровнялись вокруг 13,75. Андрею придется танцевать с бубном. Но он же профессиональный продавец
624|01.03.2020 13:58:37|Евгений Коломна|Ближайшая репитиция на моторных технологиях
625|01.03.2020 13:58:57|Alexey|Несколько вариантов. 1 будут ждать окошек в падении и пытаться впихнуть в них 2 будут повышать купон 3 будут действовать на авось 4 отложат до хотя бы долгой стабилизации. Каждый орг и эмитент будет выбирать свое
627|01.03.2020 14:00:56|Владимир Тутынин|Скоро замифологизируем как Баффета
628|01.03.2020 14:02:43|Светлана|Опрос ктонибудь про моторы тут может поставитьпожалуйстаИнтересно посмотреть наверно всем будет как моторы заведутся или ...будь проклят тот день, когда я сел за баранку этого пылесоса...
629|01.03.2020 14:37:53|С Б|Ну , а что моторы, жизнь же в стране не остановится, моторы будут работать
630|01.03.2020 14:42:05|Alexey|На небольшую сумму моторов оптимистов пока еще хватит
631|01.03.2020 14:58:31|laslo Fish|Если будет заливное на вдо, то зачем брать размещение по 100 моторов, если син или вставьте свой тикер, например, будет по 99
632|01.03.2020 14:59:20|Alexey|Сейлзы втюхают продадут тем кто живет в относительном вакууме. И таких очень много
633|01.03.2020 15:00:21|Andrey Belous|Затем что я например планирую взять моторов и держать, а сливать часть в стакан ниже 102 я не собираюсь
634|01.03.2020 15:00:38|Евгений Коломна|Ну это на любителя, сина у меня с первички много, а первые моторы продал давным давно
635|01.03.2020 15:01:07|laslo Fish|Думаю, что 102 можно долго ждать. Хотя хз
636|01.03.2020 15:05:10|Andrey Belous|Комуто ждать, комуто просто получать купоны
637|01.03.2020 15:15:59|С Б|Да уж, сколько людей столько и мнений, я вот тоже на змещении хочу взять и держать до конца, 13,5 хороший процент, понимаю, что может потом и дешевле может быть, а может и не быть
638|01.03.2020 15:18:44|laslo Fish|Син по 99 сегодня это к гашению сколько будет Я только о том, что без усилий сейлзов и/или нескольких якорных  разместится сейчас будет тяжело.
639|01.03.2020 15:19:08|Ivan Z|Я бы все таки смотрел на более старые выпуски, которые раньше погасятся и вероятность погашения выше, пусть даже с чуть более низкой ytm
640|01.03.2020 15:21:46|С Б|Логично, но лично мне бы хотелось иметь высокую доходность на более продолжительное время, а старые выпуски, вот именно, погасятся раньше, а что будет с доходностями
641|01.03.2020 15:27:03|Harry Lime|Ну будет какойнибудь Шевч размещаться пару месяцев , хуже ему точно не будет от этого
642|01.03.2020 15:30:10|С Б|Да и все равно, особо хоооший процент на капитал получить трудно, тем более ничего не делая. Поэтому лично я готова отдаться сейлзу в руки. Не сильно они наживутся на мне, но шанс иметь хорошую прибыль есть. Жизнь продолжаются и, думаю, с моторами все будет хорошо
643|01.03.2020 15:32:53|Балянов Вячеслав|А к чему вообще паника по ВДО В портфеле Андрея достойные компании, большей частью ориентированные на внутренний рынок. С хорошим кэш фло. Все будет в порядке. А ВДО просели думаю, так как люди начали продавать, чтобы не только купить просевшие акции, а ещё чтобы не допустить маржинколла. Многие на эйфории роста рынка необдуманно набрали плечей, теперь пришла расплата.
644|01.03.2020 15:33:03|laslo Fish|Думаю подобные мысли приходят и покупателям структурок у бкс. Или прекрасных страховых продуктов у Сбера.
645|01.03.2020 15:37:33|С Б|Ну структурки даже мой папа восьмидесяти лет не берет, ума хватает. Что то вы меня призадуматься заставляете. Беру разные вдо, пытаюсь дмверсифицироваться, все же помню, что и в лихие 90 е жизнь продолжалась
646|01.03.2020 15:38:34|Aleksandr|Какой кэш фло в Обуви
647|01.03.2020 15:41:02|Балянов Вячеслав|Зайди в отчетность и посмотри.
648|01.03.2020 15:41:29|Aleksandr|Ты то заходил сам
649|01.03.2020 15:41:35|Alexey|Продолжение жизни и платежи по долгам  часто вообще не пересекающиеся вещи 
650|01.03.2020 15:42:13|Балянов Вячеслав|Нет конечно. От нечего делать решил написать
651|01.03.2020 15:45:13|Aleksandr|При чем тут ориентация на внутренний рынок Какое преимущество это даетКэш фло отрицательный к примеру у некоторых эмитентов. Какие плечи, какие маржинколлы С чего вообще вывод что одна и та же публика с плечами торгует и в ВДО сидит
652|01.03.2020 15:48:37|Балянов Вячеслав|У каких эмитентов из портфеля Андрея отрицательный кэш фло
653|01.03.2020 15:48:43|Andrey Belous|Спекуляция всегда будет наказана
654|01.03.2020 15:48:57|Aleksandr|У Обуви
655|01.03.2020 15:50:36|Балянов Вячеслав|У Обуви средняя чистая прибыль за последние 4 года больше миллиарда, не говоря уже про операционный денежный поток
656|01.03.2020 15:51:16|Aleksandr|Ну ок, по Обуви ответ ясен. По остальным вопросам ответ будет
657|01.03.2020 15:51:52|laslo Fish|Именно. Как только вы начинаете думать Не сильно они наживутся на мне, но шанс иметь хорошую прибыль есть...  вот тут и пора остановится. И ещё раз подумать.
658|01.03.2020 15:52:23|Балянов Вячеслав|Если тебе этот ответ ясен, то вообще с чего нужно было говорить про отрицательный кэш фло у Обуви.
659|01.03.2020 15:53:21|Aleksandr|Настроение такое.Аналитики и эксперты утомили.
661|01.03.2020 15:54:55|laslo Fish|Так думали в СССР. И даже статью в УК держали. Спекулянты остались, а союз кончился. Не все спекулянты выживают, как и не все инвесторы.
662|01.03.2020 15:54:58|Andy|даже если есть отрицательный кешфлоу за счет открытия новых магазов, то развитие это с лихвой оправдывает
663|01.03.2020 15:55:12|Mikhail FarEast|Кто то попадает на дядю Колю, кто то просто сидит и ждёт. Вот и денежный дефицит
665|01.03.2020 15:56:08|Mikhail Evdokimov|Угроза санкций на ОФЗ
666|01.03.2020 15:57:39|Aleksandr|Нет спора в этом.Обувь я держу и верю в нее. Тут просто эксперт свои заявления на кэшфлоу и внутреннем рынке строит, а это примерно как увязать с наступлением солнечных дней в марте.
667|01.03.2020 15:59:02|Балянов Вячеслав|Понимаю Ориентация на внутренний рынок, на мой взгляд, в нынешних условиях даёт большую стабильность фин показателей. Нет санкционной риторики, нац проекты все же как никак думаю улучшат ситуацию в особенности сельское хозяйство  Голдман Групп. Ключевая ставка уменьшается  это поддержит ипотеку, спрос на жильё и, следовательно, застройщиков в нашем портфеле. Для лизинговых компаний нац проекты  тоже определённый положительный момент. Это мое мнение, я не претендую на истину.
668|01.03.2020 16:01:31|Aleksandr|Внутренний спрос стагнирует или снижается на сколько я помню, его все время пытаются простимулировать последний год. К примеру еслиб ГГ за валюту продавал свою тушенку, то было б как раз лучше .
669|01.03.2020 16:01:35|Harry Lime|Беда с сэйлзами , что им фиолетово , получите вы прибыль или нет . Продал пошел дальше.
671|01.03.2020 16:04:37|Aleksandr|А кэшфлоу то хоть положительный
672|01.03.2020 16:05:16|Harry Lime|Нет конечно и не был никогда на моей памяти , с 2017 года слежу за ними
673|01.03.2020 16:05:53|Aleksandr|Фигня какая то. А человек вот читал отчеты и видел положительный. Я запутался.
674|01.03.2020 16:06:16|Балянов Вячеслав|Саш, по выручке лучше. И по марже тоже. Только если диверсификация есть  внешний  внутренний. Без внутреннего рынка плохо, страховки нет от всяких вирусов и возможных запретов Россию в мире не особо любят
675|01.03.2020 16:06:26|Harry Lime|У меня очень плохое зрение , я всегда вижу какуюто каку в отчетностях
676|01.03.2020 16:07:25|С Б|Это понятно, но интуиция вроде гтвлрит покупать. Не знаю продает ли кто моторы дешево. Пока все что в Церихе брала не упало ни директлизинг, ни центр инвествроде так называется надеюсь что и моторы так же нк будцт падать
677|01.03.2020 16:08:08|Harry Lime|Первый директлизинг в апреле 18 плита по 97 валялась
678|01.03.2020 16:09:05|С Б|Все же компании, ориентированные на внутренний рынок сейчас надежнее, имею в виду локализацию и продажи
679|01.03.2020 16:09:11|Sergey S|Как я вас понимаю
680|01.03.2020 16:09:39|С Б|В обувь не сильно верю, как бы жизнь не сложилась у них покупать обувь не буду
681|01.03.2020 16:10:02|Aleksandr|Экспортеры зерна вроде процветают.
682|01.03.2020 16:10:26|С Б|А это кто из вдо
683|01.03.2020 16:10:57|Aleksandr|Вы в Obuv не верите или в качество тапок
684|01.03.2020 16:11:03|Harry Lime|По Директу Виктор Бочков проделал огромную работу за 19й год , но до этого годы отрицательного кэш фло , бешеный долг и погашение первого выпуска в этом году. Будем посмотреть.
685|01.03.2020 16:11:40|Aleksandr|А почему вы вопрос сужаете до ВДО  Ну наверняка там есть тоже. Я не изучал.
686|01.03.2020 16:11:58|С Б|В качество, у людей будет меньше денег, надеюсь будут искать качество, а в обуви оно никакое
688|01.03.2020 16:13:10|Aleksandr|Надо покопаться, но к примеру на юге РФ продавать морем зерно  это норма.
689|01.03.2020 16:14:16|С Б|Я с юга, морем норма, но легко только Краснодарскому краю, остальным не так легко, крас нодарцы все только для себя
690|01.03.2020 16:14:36|Aleksandr|А Ростов
691|01.03.2020 16:15:01|С Б|Там моря нет, там только на Украину
692|01.03.2020 16:16:56|Aleksandr|Там вообще рекаморе спокойно ходят до Турции
693|01.03.2020 16:17:58|С Б|Ну не знаю там Дон и Азов, как до Турции ходят, это же через Черное море, а это краснодар
696|01.03.2020 16:21:10|Harry Lime|Подсолнечник это в Рубеж . Саратовская область номер 1 по семечке в РФ
697|01.03.2020 16:21:26|Владимир Тутынин|Пора съездить отдохнуть в Макао
698|01.03.2020 16:22:14|Aleksandr|Ну вот по углю путь Таганрог  Керченский пролив  Турция .
699|01.03.2020 16:23:11|Harry Lime|Гонконгер говорит там теперь все в масках
700|01.03.2020 16:23:33|Aleksandr|Ростов не зерно Самые жирные фермеры там на зерне сидят.
704|01.03.2020 16:29:58|Владимир Тутынин|Я думаю нашим лизингам нац проекты фиолетовы. Сидеть никто не хочет.
705|01.03.2020 16:30:32|Aleksandr|Там маржи нет для них толком.Полезут в нац.проекты  проиграют большим конкурентам.
706|01.03.2020 16:31:46|Владимир Тутынин|А как ещё Продал машину, а потом ходишь в ней масло меняешь
707|01.03.2020 16:32:23|Aleksandr|Владимир, Христом Богом прошу , смени аватарку.
708|01.03.2020 16:33:11|Harry Lime|Ну люди то верят непойми во что
709|01.03.2020 16:33:52|А что ты сделал для котэ!?|Не меняй Она меня будет успокаивать в понедельник, когда все будет литься
710|01.03.2020 16:37:43|Владимир Тутынин|Прости, Александр. Котяра меня ещё вчера попросил.
711|01.03.2020 16:43:08|Виталий|На фоне текущей ситуации бруснику планирует ктонибудь покупать
712|01.03.2020 16:44:16|Владимир Тутынин|Соврал, каюсь Директ я в октябре 18 по 99.3 брал.
713|01.03.2020 16:44:37|Soa|На эту тему запасся покорном
714|01.03.2020 16:45:10|Harry Lime|Имхо событие недели не кризисы и штормы , а погашение Инфовотча
715|01.03.2020 16:45:31|Mikhail FarEast|Это же все рядом совсем, транспортные минимальны
716|01.03.2020 16:45:41|Виталий|Вот думаю, стоит или нет. А то может перевыпуск сделают, если не продадутся
718|01.03.2020 16:46:23|А что ты сделал для котэ!?|Sic transit gloria mundi 
719|01.03.2020 16:46:28|Harry Lime|В Бруснике орг БКС , может набрать на себя дофига
721|01.03.2020 16:47:13|А что ты сделал для котэ!?|Не станут Они же не дебилы
722|01.03.2020 16:47:21|Владимир Тутынин|То есть не торопись. Успеешь.
723|01.03.2020 16:47:35|Andrey Belous|Точно точно Если будет дефолт, то на фоне общих падений будет интересное событие
724|01.03.2020 16:48:04|Harry Lime|Мало не покажется , уверяю
725|01.03.2020 16:48:08|Владимир Тутынин|Интересно. А у юнисервиса намечается какойнибудь спринт
726|01.03.2020 16:48:24|Andrey Belous|Армагеддец
727|01.03.2020 16:48:29|А что ты сделал для котэ!?|Гарри, а вы помните, чо там с составом держателей. Мне кажется, у них там 75 своих вроде
728|01.03.2020 16:48:30|Harry Lime|Только юнисервис и биржа знают
730|01.03.2020 16:52:09|Владимир Тутынин|Второй выпуск не успевают
731|01.03.2020 16:52:28|Harry Lime|Было изначально ясно , без шансов
732|01.03.2020 16:53:28|Владимир Тутынин|Да... Могут поганку подкинуть.
733|01.03.2020 16:54:26|Andrey Belous|Плюс купон
734|01.03.2020 17:00:45|С Б|Краснодар дает своим зеленый свет, а остальным по остаточному принципу, не все так просто. КРА НОДАР, РОСТОВ И СТАВРОПОЛЬ, хоть и юг России, но очень разные
735|01.03.2020 17:01:00|А что ты сделал для котэ!?|Зачем Если 75 своих Можно рестракт и продолжать платить купон
736|01.03.2020 17:01:45|Harry Lime|Вот и посмотрим , может погасят четко , я в свете истории с Нэклис банком смотрю
737|01.03.2020 17:10:30|С Б|Подскажите, ну вот беру я первый выпуск дирккт лизинга по 1019. Выкуп в октябре 20 года. Я его так и беру по 1019 или еще что то плачу, там же кучу купонов выплатили, или меня это не касается. И потом я плачу налог только с тех купонов, что уже я получила
739|01.03.2020 17:19:15|Виталий|Да, налог только с получаемого дохода
