|time|user|text
1|19.02.2020 11:31:42|Балянов Вячеслав|По поводу налогообложения облиг есть хороший материал https//www.banki.ru/blog/BAY/9810.php
2|19.02.2020 11:32:47|Ruslandd|С какого времени видите апсайд 34 И почему именно этот апсайд берете
3|19.02.2020 11:33:37|Aleksandr Boychuk|По госам ни НКД ни сам купон в расчет НОБ вообще не включается. По корпоратам после 2017 НКД идет в базу ОРЦБ, купон считается отдельно. Если КС5 не превышен, то с купона налог не заплатите. А вот с НКД  13, так же как и с прироста курсовой стоимости если при продаже он есть.
4|19.02.2020 11:56:29|Yuriy Skopylatov|разница на графике
5|19.02.2020 12:01:22|Ruslandd|Бред. На разном временном интервале будет разный апсайд
9|19.02.2020 12:05:34|Светлана|Нукануканука
10|19.02.2020 12:11:46|Ruslandd|Вижу глобальный шорт гмк 
12|19.02.2020 12:40:51|Анатолий Бронников|Екатеринбургжцы берут Бруснику
16|19.02.2020 12:42:50|Harry Lime|А если по 103 сходу 
17|19.02.2020 12:44:03|Анатолий Бронников|Легенда тоже была в стакане помоему по 103 сходу
19|19.02.2020 12:44:49|Harry Lime|По 97 была через пару месяцев ...
21|19.02.2020 12:46:58|Владимир Тутынин|И потом так вяло болталась полгода
22|19.02.2020 12:47:31|Анатолий Бронников|ЛТрейд брал в стакане по 102 ни чего растёт пока
23|19.02.2020 12:47:55|Harry Lime|Надейся и жди , вся жизнь впереди 
24|19.02.2020 12:49:30|Анатолий Бронников|Ну не под подушку же ложит пусть в облигациях лежат есть пить не просят
25|19.02.2020 12:50:11|Harry Lime|Очень хорошо , будет куда разгружаться
26|19.02.2020 12:50:42|Анатолий Бронников|И купончик 22.02 у них
27|19.02.2020 12:51:15|Harry Lime|Больше мяса на рынок , пожалуйста
28|19.02.2020 12:51:25|o_nix|
29|19.02.2020 12:51:51|Владимир Тутынин|Интересная затея самому себе платить купончик
30|19.02.2020 12:53:05|Rost|Я стесняюсь спросить про дени ...
31|19.02.2020 12:53:21|Harry Lime|Если бы каждый приходящий купон у всех вызывал такой неподдельный восторг наркомания была бы побеждена давно
32|19.02.2020 12:54:38|Владимир Тутынин|ВДО бы размещали цыгане, и как всегда бы все усложнили
33|19.02.2020 12:55:31|Dmitry Tarasov|айнанэнанэ...подходим берем, милок гадание в подарок
34|19.02.2020 12:55:33|o_nix|Так уже  инфоцыгане 
35|19.02.2020 12:56:06|laslo Fish|С увеличением в индексе гамака  сначала вверх, фикс на хомячках и вниз. Я бы на месте кукла так сделал
37|19.02.2020 13:01:25|Владимир Тутынин|А Вот чем Андрей занимается
38|19.02.2020 13:21:41|Sergey S|Кстати про лизинг трейд. Хотел отчетность мсфо их посмотреть а на их сайте их отчетность без текста примечаний. где смотреть примечания к мсфо по лизинг трейд, ктонибудь в курсе
39|19.02.2020 13:35:03|Анатолий Бронников|Auditit.ru
40|19.02.2020 13:46:58|Alexander|Товарищи, может ктото всётаки знает как участвовать в первичке через книгу у сбербанка. В поддержке они говорят что надо подавать заявку в книгу агенту размещения и затем в день размещения выставлять заявку через QUIK. Это всё понятно, но вот как подавать заявку агенту размещения Вот, например, РОЛЬФ, кто там агент, как вообще этот процесс происходит, где эту информацию искать ....
41|19.02.2020 13:50:31|A K|Напишите в личку  попробую помочь
42|19.02.2020 13:53:55|Olly Milly|У меня не вышло. Агент шлёт обратно в Сбер. По итогам трёх итераций и переговоров  сказали, что никак, если Сбер не соорганизатор. Узнаете решение  поделитесь, пожалуйста
43|19.02.2020 13:54:37|Михаил|Что это значит для акций/облигаций Обуви, как думаете
44|19.02.2020 13:54:38|Михаил|Ритейл СМИ  Товарных запасов одежды и обуви на складах у Российских ритейлеров осталось на 1,52 месяца изза перебоев с поставками из Китая. На Китай приходится около 40 всего импорта одежды и обуви в Россию, а занимающий второе место Бангладеш отстает в 6,5 раз. Подробнее на Finanz.ru
45|19.02.2020 13:55:41|Aleksandr Boychuk|Александр, информацию по организаторам размещения можно смотреть на сайте русбондс. В случае с Рольфом ссылка тут https//www.rusbonds.ru/toolorg.asptool161389 раздел Организаторы. В Рольф выпуск относительно большой, на 3 млрд, предварительная книга не формируется и за день весь выпуск не уйдет. Если производится сбор, то организатор объявляет предварительно о сборе заявок и методах их подачи на многих профильных ресурсах, в том числе телеграмм каналах. В случае с Рольфом  просто выставляйте заявку на первичке через сбер самостоятельно и Вам ее удовлетворят после 14 часов в день размещения. Ну а далее пока книга не закроется.
46|19.02.2020 13:56:30|Sergey S|OrsonWelles AndreyHohrin Aleksandrov_Dmitry коллеги, вы не в курсе случайно
47|19.02.2020 13:56:45|Светлана|Организатор размещения Совкомбанк. Соответственно в голосовом поручении называет название облигации  Рольф серия 001Р02, купон и количество. Пусть выставляют заявку на Совкомбанк
48|19.02.2020 13:57:12|Alexander|Всем спасибо за ответы.
49|19.02.2020 13:57:55|Yuriy Skopylatov|Коллеги, обещали видео по АПРИ, ещё в начале февраля. Когда будет
50|19.02.2020 13:59:15|А что ты сделал для котэ!?|Разве в ходе букбилдинга не предполагается, что книга собирается за один день
51|19.02.2020 14:01:28|Aleksandr Boychuk|Тут не классическая книга, а открытая подписка. Способ размещения  адресные заявки. В классической книге Вы предварительно отправляете заявки своему брокеру, а уже он  андеррайтеру в день размещения. Плюс происходит аукцион по ставке. Ну и плюс это несет дополнительные расходы со стороны брокера примерно в 1500 рублей.
52|19.02.2020 14:01:40|Alexey Vishnyakov|
53|19.02.2020 14:01:56|А что ты сделал для котэ!?|Так и в рольфе то же самое Нет
54|19.02.2020 14:03:19|Aleksandr Boychuk|Простые адресные заявки. Не букбилдинг.
55|19.02.2020 14:04:09|А что ты сделал для котэ!?|Откуда эта информация Мне в альфе сказали что букбилдинг
56|19.02.2020 14:05:10|Aleksandr Boychuk|Хотя прошу пардон, в самом низу написано что размещаются одним днем и есть ориентир купона 99,25 Поэтому это конечно же классический букбилдинг.
57|19.02.2020 14:05:20|Olga Kindichenko|Рольф001Р02 Размещение 19 февраля. Дюрация  730 дней Купон 9.259.5 годовых, что соответствует эффективной доходности 9.589.84 годовых Рейтинг Эксперт ruA Для сравнения, первый выпуск с дюрацией 672 дня торгуется с доходностью 8.3 Стоит ли заходить в Рольф до погашения Однозначно, НЕТ Это автодилер  и этим все сказано. Да, у Рольфа самая большая среди дилеров доля выручки от операций, не связанных с продажей машин, да, он, пожалуй, лучший среди российских автодилеров. Но это означает лишь то, что Рольф  лучший из худших Стоит ли брать его на размещении На мой взгляд  да, доходность второго выпуска должна пойти к первому, что может дать апсайд 12 Из минусов  размещение через букбилдинг, деньги будут заморожены около недели.
58|19.02.2020 14:05:20|Манька Аблигация  19.02.2020 11:07:20|Выяснилось, что никто не знает, когда у Рольфа техническое размещение и на сколько блокировать деньги 
59|19.02.2020 14:14:00|Andrey M|Много эмоций, реального объяснения, почему не брать  ноль. Просто потому что автодилер, круть
60|19.02.2020 14:15:43|Aleksandr Boychuk|Андрей, Манька пишет что не стоит держать его до погашения. Брать как раз рекомендует.
61|19.02.2020 14:20:44|Andrey M|Плохо, что не объясняет, почему не держать до погашения. По сравнению со многими ВДО, у рольфа очень неплохие кредитные метрики. Вероятность дефолта в течение двух лет незначительна
62|19.02.2020 14:22:24|А что ты сделал для котэ!?|Потому что Рольф  это не ВДО Вдо он был несколько дней в июле А с дохой 9 можно найти более привлекательные варианты с точки зрения риск/надежность Но если вы считаете, что вероятность дефолта незначительна  держите до погашения, почему нет
63|19.02.2020 14:27:04|Andrey M|Я и держу первый выпуск но мне интересны другие мнения и объяснения . А тут нет объяснений  просто не держите, ведь это автодилер. Кредитный анализ 80 уровня
64|19.02.2020 14:28:03|А что ты сделал для котэ!?|Ну какой кредитный анализ вы хотите от воровки на доверии и дочери известного взломщика
65|19.02.2020 14:28:04|Andrey M|Врядли найдёте лучшее соотношение,здесь очень хорошее
66|19.02.2020 14:30:03|Антон|Андрей требует анализ Чего оправдываетесь
67|19.02.2020 14:31:28|Елена Коваленко|Волновойанализ Нефть Brent https//www.youtube.com/watchv9vQcKM11tbwampfeatureyoutu.be
68|19.02.2020 14:31:30|Andrey M|Я сколько ни искал, не нашёл. Наверно лизинг трейд не раскрывает примечаний к отчётности мсфо. Вот и думайте, почему. Может, есть что скрывать
70|19.02.2020 14:32:13|Eugeni Schukin|хех, да, ломбард мастер  мин 1 млн для входа  куда минифизикам то суваться  
71|19.02.2020 14:33:08|Антон|В 300 от Иволги минифизики набирают вес
72|19.02.2020 14:34:16|Alexey Vishnyakov|Да  Денис очень неприятно удивил. 300к сразу начало казаться не такой и большой суммой.
73|19.02.2020 14:42:44|Mikhail Saratov|Минифизики скоро свой рынок образуют  корифеи ВДО от нас отворачиваются
74|19.02.2020 14:44:17|Dmitry Manzor|трейдинг
75|19.02.2020 14:44:19|Dmitry Manzor|Теперь я понимаю, почему А.Хохрин не подходит к терминалу.
76|19.02.2020 14:44:21|Olly Milly|Так он еще осенью в какойто публикации говорил. Вчершняя статья в Бумине  еще звонок. И вот результат. Септем дрейфует, все по писаному. Или в Яного, или 1 млн. Но неприятно, согласен. Иволга последит за опытом, уверен.
78|19.02.2020 15:08:08|Rost|Да беда не в ляме, беда в том что на все провсе полчаса, и главное завтра деньги в септем загнать успеть ... да неходят они так быстро  в вечерку
79|19.02.2020 15:08:54|А что ты сделал для котэ!?|Почему в септем загнать Делаешь адресуню сделку через своего брокера
80|19.02.2020 15:09:25|Rost|это если лям найти свободный по сусекам ...
81|19.02.2020 15:09:45|А что ты сделал для котэ!?|Продай феррари
82|19.02.2020 15:11:11|Шура SiberianRanger|Мой феррари не стоит лям 
83|19.02.2020 15:11:20|Rost|нема, баксы припасены на IB кешь только в пятницу .. не плохой тон говорить завтра деньги ...
84|19.02.2020 15:11:31|Шура SiberianRanger|Несмотря на то что красный 
85|19.02.2020 15:12:46|Rost|Коня не продам.
86|19.02.2020 15:23:23|Владимир Тутынин|Почему полчаса За минуту задвинут.
87|19.02.2020 15:25:31|Kir|Ferrari всего лишь 177баксов
88|19.02.2020 15:27:36|Rost|в ЛизТ загнал бота  в цуцванг
89|19.02.2020 15:28:41|Владимир Тутынин|Парни. Помогите разобраться с ценами. Серебро. Фьючерс 18.37. Цена на спотовом рынке  profinance 18.30. Интерфакс дневной фиксинг на лондонской бирже 17.89. Исполнение фьючерса будет происходить по последнему
90|19.02.2020 15:29:13|Шура SiberianRanger|Исполнение фьючерса будет происходить по той цене, которая указана в спецификации фьючерса 
91|19.02.2020 15:30:46|Владимир Тутынин|Тогда непонятно почему он отталкивается от цены на profinance. Или чегото недогоняю.
92|19.02.2020 15:31:15|Kon$tantin|Благодарю за ответ.
93|19.02.2020 15:36:23|ANDREI|Откуда инфа Получил письмо от Септема, но не вижу там инфы по минимальной заявке.
94|19.02.2020 15:37:00|Ivan Z|ООО Ломбард Мастер объявило о сборе заявок на 7 выпуск биржевых облигаций Размещение облигаций ЛомбардМастер серии БОП07 планируется провести 20 февраля. Объем размещения 100 млн. руб. Ориентир по ставке 18 квартальных купонов составляет 14,0 годовых. Срок обращения  2 года, без оферты. Книга заявок открывается 19 февраля в 1600 и закрывается в 19 февраля 1630. Расчеты  20 февраля с 1000 до 1300 ориентировочно. Заявки необходимо направлять на электронную почту dcmseptemcapital.ru . В заявке надо указать  ФИО  вашего брокера  объем в штуках  мобильный телефон для связи Обращаем ваше внимание, что минимальный объем заявки для внесения в Книгу заявок составляет 1 млн руб. Пост информационный. Редакция канала не несет ответственности за результаты инвестиций в данные ценные бумаги.
95|19.02.2020 15:37:34|ANDREI|Спасибо. Странно, что в письме нет этой инфы
96|19.02.2020 15:45:23|Владимир Тутынин|Если ваш брокер Септем, величина заявки может не имеет значения.
97|19.02.2020 15:46:07|AngelicScale| Рольф  облигации Коллеги из Invest Heroes предложили индивидуальным инвесторам поучаствовать в очередном выходе на долговой рынок капитала компании Рольф . Меня эта история заинтересовала. Нужно вкладывать свежую порцию денег на ИИСе. А Рольф тут как тут, предлагает хорошую инвестиционную возможность. Срок обращения всего 2 года Дюрация около 1.84х года. Индикативный диапазон купонной ставки  9.259.50. Понятно, что Рольф крупнейший автодилер России и главный бенефициар консолидации рынка, но будь все так просто, ставка не была бы такой высокой. Надо понимать, что автодилерский бизнес в современной России  очень жесткая штука. Интересный факт  он убыточен уже на уровне валовой маржи. То есть дилеры покупают машины у производителей дороже, чем продают. Рольф  не исключение. Например, компания за 2018 год продала автомобилей на 190 млрд руб., а потратила на их закупку 195 млрд руб. В прибыль деятельность Рольфа выводят ретробонусы от производителей за объемы продаж и сопутствующие услуги сервисное обслуживание, продажа страховок и автокредитов. В итоге, бизнес крайне низкомаржинален. В 2019 компания прогнозирует рентабельность по EBITDA 3.9. Даже небольшой провал в продажах приведет к коллапсу. Но и это еще не все проблемы Рольфа. Акционер в бегах, на него и генерального директора заведено уголовное дело, а сам бизнес выставлен на продажу . Скорее всего, на новых держателях долга на прямую это не отразится, но, конечно, такие проблемы очень мешают бизнесу. Если же говорить о положительных моментах, то следует взглянуть более пристально на отчетность. Ее, в условиях сложившейся сложной ситуации, можно даже назвать не плохой см. картинку. Компания в целом справляется с долговой нагрузкой. По итогам 2П20181П2019 Чистый долг / EBITDA  2.8х Денежный поток / Процентные расходы  1.1х. Однако ситуация ухудшается. К сожалению, результаты 1П2019 очень плохие по сравнению с 1П2018, даже если сделать поправку на большие капитальные расходы. Учитывая, что по 2019 году компания прогнозирует EBITDA на уровне 9.3 млрд руб., значит 2П2019 также не удачный за последние 12 месяцев EBITDA 10.7 млрд. Вывод В данной случае нет однозначного решения. Пусть каждый решает покупать ему бонды или нет. В принципе, у компании есть запас. Банковские ковенанты обычно начинаются на уровне 3.5х Чистый долг / EBITDA, а до этого уровня Рольф может взять ещё около 7 млрд руб. Новые бонды короткие, поэтому возможно запаса и хватит. Авторский Россия Облигации
98|19.02.2020 15:46:24|AngelicScale|Вот есть анализ от инвест банкира Славы
99|19.02.2020 15:48:30|Andrey M|Круто, спасибо
100|19.02.2020 15:49:44|Владимир Тутынин|О И Шевченко продают. Ну ладно Апри
101|19.02.2020 15:54:09|Александр (Саша-ААГ)|Продают бизнес Шевченко и АПРИ
102|19.02.2020 15:54:42|Diz|Говорят Шевченко покупает апри
103|19.02.2020 15:55:23|Lizardking0808|И вывозит всех апров в лес
104|19.02.2020 15:55:27|Александр (Саша-ААГ)|
106|19.02.2020 15:56:42|Владимир Тутынин|https//t.me/probonds/3349 Исправляем положение вещей все ВДО  теперь ВДО
107|19.02.2020 15:56:42|Александр (Саша-ААГ)|И все вместе в бега в компанию к менеджменту и собственникам из рольфа Холдинг создавать будут
108|19.02.2020 15:57:36|Andrey Hohrin|я за
109|19.02.2020 15:58:37|Владимир Тутынин|Ставим тазик или это надолго
110|19.02.2020 15:58:57|Александр (Саша-ААГ)|Септем капитал заявили что книгу на полчаса открывают только по ломбарду
111|19.02.2020 16:00:18|Шура SiberianRanger|
112|19.02.2020 16:01:32|Rost|Пришлось срочно перетрясти ... рука на моторы не поднялась
113|19.02.2020 16:05:41|Владимир Тутынин|Давай Шевченко добивай. Я подберу
114|19.02.2020 16:07:06|Антон|По 100
115|19.02.2020 16:11:02|Владимир Тутынин|Да по людски, по 102
116|19.02.2020 16:16:14|Andrey Hohrin|мы немного прикупим, если получится. это я не для поддержки цены говорю, а вообще
117|19.02.2020 16:16:36|valentina|, на такой бумаге не то что без коня, без штанов останешься еще и в бегах, и в торгах умудряются выставляться на продажу
118|19.02.2020 16:18:06|Владимир Тутынин|Говорят ещё штаны можешь отдать
