|time|user|text
665|09.01.2020 14:32:00|Sergey S|Я понял вашу мысль я обратил внимание,что есть неплохие эмитенты,но не совсем безрисковые. Но доходность будет повыше, чем в депозите новички,которых вы описали,вероятно,не стали бы братьпросто навскидку автобанфинанс, ренессанс страхование или ресо лизинг. А недавно тот же ренессанс можно было почти под 9, что для эмитента такого рейтинга неплохо. Коротко золотая середина есть, вилка ВДОдепозит не совсем актуальна
666|09.01.2020 15:02:33|Alex|Посмотрите на объемы ежедневных торгов в ликвидных облигациях. Там миллиарды. А общий объем рынка 2025 триллионов рублей. Как думаете может ли наплыв депощитчиков изменить баланс спроса/предложения
668|09.01.2020 15:11:13|Andrey M|Кто на ВДО подсел, уже не хочет золотую середину
672|09.01.2020 15:15:15|Aleksandr|Да , я на игле уже больше года.Ломка страшная при покупке первого листа
673|09.01.2020 15:16:20|Alex|Поможет инъекция дефолтов в ягодицу
674|09.01.2020 15:25:01|VincenzoT|Но можно ведь совмещать Мечел, втб и альтрия хорошо сочетаются с обувью, апри и соксом.
675|09.01.2020 15:37:12|Privet|Плохо совмещаются. Мечел, ВТБ и альтрия тут явно лишние. 
676|09.01.2020 15:41:24|VincenzoT|Дык диверсификация
677|09.01.2020 15:50:41|Владимир Тутынин|Тогда уж удмуртия кчр мордовия
678|09.01.2020 15:52:52|Ortemy Alexandrovich|Какая деверсификация, если 5/6 инструментов из страны с кучей рисков, а рейтинг как минимум половины даже не инвестиционный
679|09.01.2020 16:11:05|Alex|Реферальную ссылку забыл оставить
680|09.01.2020 16:17:44|VincenzoT|Я стараюсь держать пропорциональный объем облигаций вдо и только для обеспечения стабильного потока кеша. Но крен пока в сторону акций. Растут акции  покупаем их, рынок начнет валится  буду больше в облигации. Все придумано до нас
681|09.01.2020 16:29:47|Egor Zagorskiy|а нельзя ведь купить Дэни по 76 и предъявить к выкупу по номиналу
682|09.01.2020 16:32:26|Aleksandr Boychuk|Можно, только выкупят у Вас 10 от объема. При успешном стечении обстоятельств.
683|09.01.2020 16:34:16|Mikhail Evdokimov|Как минимум 20
684|09.01.2020 16:34:34|Aleksandr Boychuk|Это если обе оферты пройдут успешно.
685|09.01.2020 16:34:38|Aleksandr|http//obuvrus.ru/press_center/news/707/45559/
686|09.01.2020 16:34:57|Egor Zagorskiy|т.е. если у меня 50 бумажек, выкупят не более 5 
687|09.01.2020 16:35:14|Aleksandr Boychuk|Да, за каждую оферту, а их планируется две.
688|09.01.2020 16:37:40|Dmitry Aleksandrov|Не совсем, не более 5, если на оферту принесут все
690|09.01.2020 16:38:00|A|А кто так сильно ОР поднял сегодня
691|09.01.2020 16:38:34|Egor Zagorskiy|спасибо за разъяснения
692|09.01.2020 16:38:51|Dmitry Aleksandrov|Не за что
693|09.01.2020 16:40:33|Aleksandr|ФИО в студию 
694|09.01.2020 16:41:50|A|Было 100,33 стало 100,84
695|09.01.2020 16:41:56|VincenzoT|...и чаще всего участие в оферте платное 15002000 р, примерно, у разных брокеров
696|09.01.2020 16:42:13|Egor Zagorskiy|да, у БКС 1000р
697|09.01.2020 16:47:37|А что ты сделал для котэ!?|Как максимум 20
699|09.01.2020 16:49:08|A|Можно конечно и по 100,84 немного взять 
702|09.01.2020 17:26:39|Роман Колыванов| держу в портфеле
703|09.01.2020 17:27:53|Alexey|Добрый день. Ждем обьектов в мск и новых выпусков
704|09.01.2020 17:28:01|Sasha Bolilaya ГК ЛЕГЕНДА|Роман, спасибо за доверие
706|09.01.2020 17:28:56|Артём Shcherbakov|Народ Всем привет С наступившими... Здоровья и профита  Родилась значит у меня идея. Пусть не нова, но всетаки. Собрать портфель с ежемесячным денежным потоком  дивиденды, купоны... Депозит пополнить кредитом под 8,5 годовых, а платить за счет этих выплат. Излишки реинвестируются, и метод сложного . Как вам Сработает Ктонибудь пробовал Заранее благодарен.
707|09.01.2020 17:29:38|Dmitry Manzor|Найдите кредит по 8.5 и вперед
708|09.01.2020 17:30:52|Артём Shcherbakov|Уже нашел. В том то и дело, что на этом фоне пришла в голову идея.
709|09.01.2020 17:31:22|Alexander|По кредиту платежи аннуитетные. Это всё портит сильно.
710|09.01.2020 17:32:12|Артём Shcherbakov|Да, но ни кто не мешает платить больше и писать заявление о частично досрочном.
711|09.01.2020 17:33:02|Alexander|Проблема не в этом. А в том, что купонов и дивидендов не хватит на платежи, потому что помимо процента надо платить тело.
712|09.01.2020 17:33:15|Dmitry Manzor|Вам нужно одобрительное от чата
713|09.01.2020 17:34:57|Артём Shcherbakov|Нет. Мне нужны мысли по этому поводу. Вдруг кто продклывал или проделывает такое. Грубо, если платеж 10000р/месяц, то с помощью дивидендов или купонов он снизится до 2000. Это тоже приемлемо.
714|09.01.2020 17:35:39|Egor Zagorskiy|если ктото дефолтнется, затея полетит ко всем чертям
715|09.01.2020 17:36:34|Артём Shcherbakov|Это да...
716|09.01.2020 17:36:48|Alexander|Ещё надо учесть, что портфель не будет генерировать кэш равномерно каждый месяц. А значит надо будет продавать бумаги, а значит платить налог и ещё спред.
717|09.01.2020 17:37:19|Артём Shcherbakov|Ну тут можно еще рассматривать квартальную курсовую разницу... может чаще, но в принципе.
718|09.01.2020 17:39:15|Alexander|Посчитайте итоговый доход с учётом всего вышенаписанного. Даже интересно сколько останется.
719|09.01.2020 17:40:18|Артём Shcherbakov|Да. Надо посчитать. Подобрать эмитенты и еще раз посчитать. Золотая середина должна быть.
720|09.01.2020 17:42:18|Kir|Это кто же даёт кредит под 8.5
721|09.01.2020 17:42:41|Артём Shcherbakov|ГПБ
722|09.01.2020 17:43:38|Kir|Нуну
723|09.01.2020 17:44:25|А что ты сделал для котэ!?|Ипотека
724|09.01.2020 17:44:48|Артём Shcherbakov|Идея то не в получении дохода как бы в явном виде, а взять деньги, и чтоб они работали. Если так платить 10000 5 лет, то с помощью всегл вышеперечисленного платить из Кармана 2000 и 1,5 года.
725|09.01.2020 17:45:23|Andrey M|Ребятки, выпуск пр лизинга2 почти по той же доходности, что и пионер лиз1 Можно переложиться с повышением кредитного качества, если кому надо
726|09.01.2020 17:45:55|Kir|Я смотрел на сайте гпб в декабре  15.5 было без страховки И при этом со страховкой платеж был все равно больше
728|09.01.2020 17:46:29|Dmitry Manzor|Договор выложите, на сайте там напишут...
729|09.01.2020 17:47:29|Артём Shcherbakov|Вот без страховки
730|09.01.2020 17:48:13|Kir|Ладно не тема этого чата, посчитайте доходрасход в Ексель и поймёте, что овчинка не стоит выделки
731|09.01.2020 17:48:33|Артём Shcherbakov|Надо посчитать.
732|09.01.2020 17:55:50|Paul Baikov|Имхо не лучшая идея инвестировать кредитные деньги. Я бы не стал связываться
733|09.01.2020 18:02:34|К& Б:))🍷|Так вы сами всё выложили. Минимально 13.5. В реале будет больше, т к это скорее всего спец ставка для работников или зарплатных клиентов. Даже с минимальными 13.5 овчинка выделки не стоит... Со страховкой ПСК будет выше 14
734|09.01.2020 18:09:25|會及Q及刄み會|Мое первое Вдо....ещё даже тут не присутствовал Пересмотрел кучу облиг и выбрал Легенду...
735|09.01.2020 18:31:07|VincenzoT|1. Считайте реальную ставку. 2. Только часть портфеля, меньше половины. 3. Увидите выгоду более 2.53 процентов  пробуйте. Но. Есть ньюансы. Год назад, примерно, я прошёл через такой же опыт. В какойто момент сумма кредитных составляла четверть депо. Для решения сошлись ряд моментов. Мне предложили реально чистые 13.5 по паспорту, ВТБ, у нас давние отношения и стала понятна тенденция на снижение общей ставки по вдо. То есть, сегодня есть ставка 15.516, а завтра не будет. Но у меня стабильный кешфлоу, есть крупные активы и плюс добровольные медстраховки на значимые суммы. И опыт на рынке более 10 лет. То есть, при любом форсмажоре кредит закроется без каких либо траблов для оставшихся. Есть предположение, что в вашем случае риски выше, чем возможный профит.
736|09.01.2020 18:33:28|Alex|Последние слова трейдера 
738|09.01.2020 18:48:59|Шура SiberianRanger|Первичка 9 января
739|09.01.2020 18:55:50|Oleg Klyuch|В FAQ вопрос N6
740|09.01.2020 18:56:07|Сергей|Инструменты разошлись
741|09.01.2020 18:59:11|VincenzoT|Плечи не использую, брокеру ничего не должен. Если завтра уеду в БаденБаден, попаду под трамвай или похитят рептилоиды  со счётом ничего не случится. А в случае плечей  они за полгода счёт сожрут. upd. И поступление купонов  на банковский, то есть кредит перекрывается даже в пассивном режиме.
742|09.01.2020 19:02:06|Alex|Кредит это плечо
743|09.01.2020 19:10:45|VincenzoT|Хорошо
744|09.01.2020 19:12:29|Шура SiberianRanger|Классическая идея как эпично соснуть если чтото пойдёт не так D
745|09.01.2020 19:44:27|Dmitry Manzor|есть мысли по ГГ
746|09.01.2020 19:44:37|Andrey Hohrin|давайте не будем превращать чат в мелкие спекуляции
747|09.01.2020 19:45:20|Alex|20 рублей за кило
748|09.01.2020 19:47:42|Andrey Hohrin|быдыщ
749|09.01.2020 19:48:01|Владимир|А что тогда крупно
750|09.01.2020 19:48:15|Paul Young|Посмотрел эфир и прям расстроился. Иволга нашла свою нишу на рынке ВДО, и главное, что радовало нас физиков, частые размещения небольших компаний. Теперь, когда озвучена новая стратегия компании, у меня сложилось впечатление, что во первых ребята частично разочаровались в ВДО, ну а во вторых, переориентация на работу с фондовом рынком может служить сигналом, что иволга станет просто равной инвест.компаней среди прочих
751|09.01.2020 19:48:47|Andrey Hohrin|зря Вы расстроились. Объем эмиссий вырастет, доходности не снизятся
754|09.01.2020 19:51:55|Кирилл|Мне не показалось это сменой курса Это развитие параллельных направлений, прежде всего. Так, что ИволгаМОЛОДЕЦ. 
755|09.01.2020 19:53:07|Andrey Hohrin|молодцы мы или нет, покажет время. возможно вся логика развития порочна. а возможно  выигрышна. посмотрим.
756|09.01.2020 19:55:40|A P|Эфир понравился, для физиков, не являющихся профессионалами в инвестициях, язык который используется достаточно понятен и ясны тренды. Будем наблюдать
757|09.01.2020 19:56:41|Diz|Главное качество а не количество. Лично для меня
758|09.01.2020 19:56:51|A P|Был в акциях ОР летом 19го года, скажу сразу в надежде на байпэк, он состоялся. После сегодняшнего эфира подумываю зайти на долгую
759|09.01.2020 19:58:15|Кирилл|Безусловно время покажет. Но мое, чисто субъективное мнение, что Вы работу ведете в правильном направлении. Лично я деньги бы Вам доверил Поверьте,я человек достаточно повидавший в жизни. И достаточно привередливый... Удачи
760|09.01.2020 20:07:56|Paul Baikov|А примерное количество новых эмитентов не подскажете
761|09.01.2020 20:14:52|Andrey Hohrin|около 10 новых
762|09.01.2020 20:15:46|Paul Baikov|Благодарю
763|09.01.2020 20:15:46|VincenzoT|Предварительно, выпуски равномерно по году, или ...
764|09.01.2020 20:18:13|Andrey Hohrin|равномерно /
766|09.01.2020 20:19:20|Oleg|Минималка на размещении в 100к остаётся по прежнему
768|09.01.2020 20:19:51|Paul Baikov|И в стакане по 100.05 по прежнему 
769|09.01.2020 20:20:26|Andrey Hohrin|пока так. это и так не низкий порог.
771|09.01.2020 20:22:24|Paul Baikov|На размещении, понятное дело. Отлично, на первичку меня не будет хватать и этот год тоже. Keep up the good work как говорится
772|09.01.2020 20:48:14|Mister X|когда это байбэк у обувки состоялся
773|09.01.2020 22:09:58|Eugeni Schukin|Уважаемые соканальцы  Есть у меня в портфеле такие бумажки iСЛТ 1Р1 АПРИФП БП2 БалтЛизБП1 ВЦЗ 1P1R ГрузЦ БОП1 ЖКИнвБО01 ИСпетр1P1 ЛевенгукБ1 ЛЕГЕНДА1P1 МаниМенБ1 ОАЭ БОП1 ОбувьРо1Р2 ПИК БОП02 Пионер 1P3 ПионЛизБП2 РедСофт1P1 РСГФинБ10 СолЛизБО01 СэтлГрБ1P1 ТаксФ БП1 ТАЛАНФБ1P1 УльтраБ1P1 ЧЗПСНП Б1 ЧЗПСНП БП1 Шевченк1Р1 ЭБИС Б1P02 Хочу еще добавить в него такой список Роделен Бэлти ВсеИнструменты ИТЦТр1Р01 ПРЛиз 1P3 Кузина Мясничий Б0П03 как думаете, нормально или чтото лишнее 
774|09.01.2020 22:12:57|Andrey Hohrin|Я слишком ангажирован, чтобы советовать тут лучше мнения инвесторов
775|09.01.2020 22:13:34|Eugeni Schukin|ну это понятно 
776|09.01.2020 22:14:58|Mister X|в портфеле нет дени  не чистокровный вдошник 
777|09.01.2020 22:15:02|Григорий Мошорин|Хорошо хоть Дэнникол нет
779|09.01.2020 22:15:24|Harry Lime|Не хватает системы , и если бы АФК
780|09.01.2020 22:16:01|Paul Baikov|Лично у меня Роделен, Бэлти, ПРЛиз3 есть, Мяснич сменил на ИСпетр. Остальные не знаю
781|09.01.2020 22:16:12|А что ты сделал для котэ!?|А чо с ней
782|09.01.2020 22:16:14|Eugeni Schukin|так и знал, что будут шуточки про то, кого нельзя называть 
783|09.01.2020 22:16:54|Harry Lime|Недавно родила на глазах Дениса Козлова
785|09.01.2020 22:17:32|Eugeni Schukin|просто надо во чтото вложиться, пока жду новых размещений от Иволги 
787|09.01.2020 22:18:30|Mister X|прлизинг, коли лизингом не брезгуете
788|09.01.2020 22:19:03|Eugeni Schukin|а это не он  ПРЛиз 1P3
789|09.01.2020 22:20:08|Mister X|сорь, концовку не увидел 
790|09.01.2020 22:20:28|Eugeni Schukin|а просто их П  лизингов много , подумал, может еще какой.
791|09.01.2020 22:21:29|Mister X|начало с буквы П дает 100 к узнаваемости 
792|09.01.2020 22:22:15|Наталия К|А я хочу ВДО прикупить какие рекомендуете
794|09.01.2020 22:22:56|Mister X|чуть выше список есть 
796|09.01.2020 22:28:27|Наталия К|У меня в портфеле офз есть, спасибо нужны исключительно вдо. Несколько видов есть, еще хочется
797|09.01.2020 22:30:11|Mister X|вряд ли тут ктото осмелится давать рекомендации по конкретным именам 
799|09.01.2020 22:30:39|Dmitry Manzor|Зачем тарить Кузю Монета поезжена
800|09.01.2020 22:31:40|Den|Ого как много всего
801|09.01.2020 22:31:48|Максим Воробьев|Причем чем больше вопросов у начинающего, тем короче срок ОФЗ ему следует покупать... 
802|09.01.2020 22:32:02|Den|
803|09.01.2020 22:37:05|Kir|Ребалансить пора. Мое имхо вцз, груз, жки, редсофт,Сол,такс,Талан убрать. Бэлти рано, кузину, мясо поздно докупать. Много эммитентов за которыми нужно следить
804|09.01.2020 22:41:58|Шура SiberianRanger|
805|09.01.2020 22:43:22|Максим Воробьев|Ну или перефразируя отличнейший тезис, звучавший в чате Если есть вопросы по ВДО  купи ОФЗ, если вопросов про ВДО много  купи короткие ОФЗ 
806|09.01.2020 22:45:00|Александр|Взял под конец года нефтегазхолдинг за 92
809|09.01.2020 22:45:48|Mister X|всё правильно сделал
810|09.01.2020 22:46:51|Александр|По 5 процентов от портфеля
811|09.01.2020 22:47:32|Harry Lime|Это похожая история кстати , они практически отцы обрезной оферты
812|09.01.2020 22:49:45|Александр|А есть смысл просмотреть на фоне акций Мечела облигации иных компаний по данной отрасли
813|09.01.2020 22:50:15|Harry Lime|Кокс
814|09.01.2020 22:51:27|Александр|И вообще понимание соотношения повышения стоимости акций и облигаций
815|09.01.2020 22:51:45|Eugeni Schukin|ух.. спасибо, но как то насторожило то, что нужно много убирать 
816|09.01.2020 22:52:12|Harry Lime|Его нет
817|09.01.2020 22:52:51|Александр|Так почему же рынок аналогично реагирует
818|09.01.2020 22:54:09|Mister X|мечел  отдельная история с докторами, неподъемным долгом и выкупом втб
819|09.01.2020 22:54:52|Александр|А девелопмент
820|09.01.2020 22:55:08|Harry Lime|Я наблюдаю облиги Мечела последние 5 лет , как ваши успехи
821|09.01.2020 22:55:25|YYY|Ребалансировка портфелей до конца января и начало февраля и движуха ажиотажная в некоторых...
822|09.01.2020 22:56:34|Александр|Опыт в десятки раз меньше. Хотелось понимания
823|09.01.2020 22:57:06|Harry Lime|Там два года как ничего не осталось от доходности , я помню их еще по 50 .
825|09.01.2020 22:58:42|Mikhail Evdokimov|Сейчас только ПРЛиз и Бэлти по разумной цене. Остальное дороговато
826|09.01.2020 23:05:19|Александр|Так что имеет смысл докупить
827|09.01.2020 23:06:48|Harry Lime|Что касается Мечела , ну нафиг оно надо , облиги старые до 17 года , там 13 НДФЛ с купона, купоны переменные , ставки снижаются . Растет сейчас все с дохой выше ОФЗ
828|09.01.2020 23:07:05|Александр|А лучше, видимо, до конца января подождать, и не откликается на ажиотаж ют
829|09.01.2020 23:08:05|А что ты сделал для котэ!?|До конца февраля
830|09.01.2020 23:08:26|Harry Lime|Более реалистично
831|09.01.2020 23:09:51|Александр|За это время можно и подзаработать
832|09.01.2020 23:11:13|Harry Lime|Проще всего это сделать можно было закупившись в декабре , ну очень много было предложений , последний раз такой жир был в июне
833|09.01.2020 23:12:46|Александр|В декабре закуплен весь портфель на иис. Осталось 15 к. Втягиваюсь. Ну не до июня же ждать
834|09.01.2020 23:13:50|Eugeni Schukin|а я тупанул. сделал ИИС, думал, под вариант Б, но на ИИС только облиги. И толку то  
836|09.01.2020 23:17:37|Александр|В целом очень интересный вопрос Иис открыт в ноябре 19, внесено 400, портфель сформирован. Когда лучше вносить на текущий год Поэтапно или на депозите до октября ноября подержать
837|09.01.2020 23:17:58|Mister X|если на первичке будете закупать и потом раздавать по 100 в стакане  сэкономите на ндфл 
840|09.01.2020 23:19:32|Eugeni Schukin|это нужно 5,2 на росте стоимости делать от миллиона если  чтобы сранилось с вычетом по А
842|09.01.2020 23:20:36|Mister X|не у всех есть зряплаты  я вот на типе Б перебиваюсь
