|time|user|text
1|24.02.2020 19:24:17|Евгения|Ну да... уж точно не пассивный доход
2|24.02.2020 19:24:38|Soa|А вот кому предлагался выбор между облигами и недвигой Человеку хорошо разбирающемуся в обоих рынках или обывателю
4|24.02.2020 19:25:48|Евгения|Не могу сказать. Не знаю.
5|24.02.2020 19:28:43|Soa|Господа облигационеры, вы доходность своего портфеля считали хотя бы за последние пару месяцев На недвиге за год не всегда. А если вы бабушка не имеющая компьютера то выбор очевиден. И не надо мне объяснять сколько минут мне понадобится выйти из актива и с какими издержками если это недвижимость
7|24.02.2020 19:30:25|Евгения|Речь об этом вообще не шла. Пролистайте выше и ознакомьтесь с сообщениями, милейший
8|24.02.2020 19:31:21|Soa|Да что читать когда я не знаю когда недвижимость в рубле ополовинится
10|24.02.2020 19:32:31|Евгения|Ну так и писать нужно по существу, ведь правда Причём тут бабушка без компьютера, ей Богу не поняла
11|24.02.2020 19:33:10|Soa|Да не напрягайтесь..зачем вам понимать.
12|24.02.2020 19:33:26|Евгения|Да и то верно
13|24.02.2020 19:34:08|Soa|Что лучше купить бонды долларовые или вдо рублевые на год Кто подскажетбуду благодарен.
14|24.02.2020 19:35:32|Ruslandd|VTBH
15|24.02.2020 19:35:59|Soa|или в золото вложиться
16|24.02.2020 19:36:07|Alexey Vishnyakov|Так это нужно динамику курса доллара знать. Так что неизвестно.
17|24.02.2020 19:36:40|Шура SiberianRanger|
18|24.02.2020 19:36:47|Soa|динамику на недвижимость тоже
19|24.02.2020 19:37:27|Alexey Vishnyakov|Нужен опытный ясновидящий с даром предвидения на год вперёд
20|24.02.2020 19:37:39|Soa|именно
23|24.02.2020 19:43:16|valentina|Ну вот и девушку обидел... сегодня все нервные
24|24.02.2020 19:43:49|Soa|Извиняюсь перед девушкой Не сердитесь..
25|24.02.2020 19:47:53|Евгения|Да неее... я могу быть и бабушкой
27|24.02.2020 19:50:04|Soa|
29|24.02.2020 20:15:00|Dmitry Manzor|Фи
30|24.02.2020 20:16:07|Ruslandd|Два в одном
31|24.02.2020 20:17:56|Dmitry Manzor|Изучал, хотел купить, но понял, что это рискованная затея да ещё и комиссию платить ничего там хорошего не будет
32|24.02.2020 20:20:14|Ruslandd|Нормальная затея vtbh падает, а доллар растет
33|24.02.2020 20:20:39|Dmitry Manzor|
34|24.02.2020 20:56:50|Владимир Тутынин|Вечером выпустили чтобы мы увидели завтра как они любят Россию
35|24.02.2020 21:06:35|YYY|Весьма ,весьма затратный и не та уже маржа . Локация и цены , а предложений дофига и всякие Марфы Васильевны уже встрой встали.
36|24.02.2020 21:08:07|Евгения|Ага, точно
38|24.02.2020 21:17:45|Andrey|Интересно завтра просядем вместе со всем рынком
39|24.02.2020 21:18:10|Dmitry Manzor|Присядем
40|24.02.2020 21:18:31|YYY|трейдинг  lucky u
41|24.02.2020 21:20:33|Vadim|завтра просядем побольше чем весь рынок
42|24.02.2020 21:45:47|Soa|Почему больше
43|24.02.2020 22:01:43|Светлана|На первый взгляд, очевидным однозначно кажется оргазм фееричней с брюнеткой/недвижимость, у неё ж с собой кокаин есть/налоговый вычет, только репутация сомнительна по этой же причине может стать больной/неликвидной
44|24.02.2020 22:03:34|С Б|Хорошая, качественная недвижимость в хорошей локации в любые времена найдет покупателей
45|24.02.2020 22:06:06|Vadim|бегство от риска. из наших активов нерезиденты шустро побегут
46|24.02.2020 22:07:52|Soa|А если в проценте мы меньше штатов упадём это будет значить что мы менее рискованные
47|24.02.2020 22:09:19|Vadim|смотря как этот процент считать. если долларовый ртс, то с учетом того, что бакс уже 65.31, то вряд ли упадем меньше американцев
48|24.02.2020 22:10:07|laslo Fish|Так гавань же. Тишь да блажь, в смысле благодать...
49|24.02.2020 22:10:35|Alexey Vishnyakov|Сегодня на мосбирже торгов небыло  завтра курс может быть сильно другой.
50|24.02.2020 22:11:49|Dm Vl|Бежатьто куда В РФ самые высокие реальные ставки. Почитайте статью от Блюма или, просто, последний абзац The global spread of coronavirus will hurt global growth, which is likely to be good for rates globally. Так что ищите лонгпозишен в офз
51|24.02.2020 22:12:06|Владимир|
52|24.02.2020 22:12:09|Vadim|зато на форексе были 
53|24.02.2020 22:12:59|Alexey Vishnyakov|Про форекс я знаю, и тем не менее основные торги в паре доллар/рубль происходят у нас.
54|24.02.2020 22:13:13|Soa|Он будет другой однозначно на мой взгляд..
56|24.02.2020 22:14:36|Alexey Vishnyakov|Я тоже считаю так. Но тут впечатлительные натуры перевозбудились от форекса
57|24.02.2020 22:15:24|YYY|Офз 10 и дальнии чуток просядут, но не сильно ,думаю, не та тема. В корпораты можно посмотреть ,ИМХО.
58|24.02.2020 22:16:07|Vadim|конечно будет другой. вопрос насколько другой и как быстро цб начнет вмешиваться. как вариант, завтра может быть еще хуже. ближе к 66
59|24.02.2020 22:16:31|Soa|скорее всего.. По корпоратам думаю ни чего не будет или будут выкупаться быстро..
60|24.02.2020 22:16:52|Alexey|Завтра перед открытием долгового рынке в России мы подходим с настроением сильного ухода от риска, однако динамика локальных облигаций развитых и развивающихся стран в широком смысле свидетельствует, что инвесторы голосуют за спокойствие внутренних облигаций, несмотря на девальвацию валют, особенно развивающихся стран, против доллара. Пока реализуется сценарий прошлого года, когда финансовые потоки ищут убежище через инвестирование в локальные бондовые истории типа будут стимулы и так далее. Аналогичная ситуация наблюдается на денежном рынке  ставки по межвалютным свопам преимущественно снижаются, хотя про Россию так не сказать, был небольшой рост, но изза закрытия основного рынка выводы сделать трудно. Тем не менее мы не знаем как будет дальше разворачиваться ситуация с вирусом, а это напрямую влияет на стоимость товарных ресурсов, которые и так сказываются негативно на российском торговом балансе год к году. Понятно, что наш бюджет свёрстан из комфортной цены  пока сильные фундаментальные макроплюшки, но всегда есть но. В настоящий момент для сектора складывается осторожный умереннонегативный фон без паники, то есть без ощутимых продаж, особенно со стороны русских. Однако глобальный капитал не голосует продажами в бондах  этот фактор доминирующий для принятия решения на краткосрочном горизонте. стратегия облигации
61|24.02.2020 22:17:29|Dm Vl|После слива, все будет гуд
62|24.02.2020 22:17:49|YYY|Если офз просядут, то потянут и других. Ток в офз сидят кажись  железные яйки.
63|24.02.2020 22:18:21|Soa|Значит евробонды некоторые возможно просядут..я бы слил бакс по такой цене.. Т раздражает в такие моменты
65|24.02.2020 22:20:10|YYY|Рынок нам покажет, посмотрим.
66|24.02.2020 22:20:17|Alexey|Тоже думаю не сократить ли валютную позицию
67|24.02.2020 22:20:19|Soa|но гадать дело не благодарное
69|24.02.2020 22:23:11|Soa|Завтра перед открытием долгового рынке в России мы подходим с настроением сильного ухода от риска, однако динамика локальных облигаций развитых и развивающихся стран в широком смысле свидетельствует, что инвесторы голосуют за спокойствие внутренних облигаций, несмотря на девальвацию валют, особенно развивающихся стран, против доллара. Пока реализуется сценарий прошлого года, когда финансовые потоки ищут убежище через инвестирование в локальные бондовые истории типа будут стимулы и так далее. Аналогичная ситуация наблюдается на денежном рынке  ставки по межвалютным свопам преимущественно снижаются, хотя про Россию так не сказать, был небольшой рост, но изза закрытия основного рынка выводы сделать трудно. Тем не менее мы не знаем как будет дальше разворачиваться ситуация с вирусом, а это напрямую влияет на стоимость товарных ресурсов, которые и так сказываются негативно на российском торговом балансе год к году. Понятно, что наш бюджет свёрстан из комфортной цены  пока сильные фундаментальные макроплюшки, но всегда есть но. В настоящий момент для сектора складывается осторожный умереннонегативный фон без паники, то есть без ощутимых продаж, особенно со стороны русских. Однако глобальный капитал не голосует продажами в бондах  этот фактор доминирующий для принятия решения на краткосрочном горизонте. стратегия облигации
70|24.02.2020 22:39:36|YYY|Копипасты пошли одни и те же,читайте ленту.
72|25.02.2020 00:42:02|Владимир Тутынин|Ставка же не на доллар, а на рубль. Это как раньше лозунг был Ставку сделать былью
74|25.02.2020 00:46:16|Кирилл|Вирус бродит по планете... Вирус коммуниз... ой, там был призрак...
75|25.02.2020 00:47:34|Владимир Тутынин|Ага. Эппл не захочет жить по старому, а Китай не сможет
77|25.02.2020 07:21:03|Alex|Я думаю что ты постоянно спамишь
78|25.02.2020 07:47:56|Алексей ayaye :)|druz_svid
79|25.02.2020 08:07:15|"PRObonds | LIVE"|прогнозытренды портфелиprobonds сделки Рынки и позиции упругая деформация В понедельник рынки обвалились. Очевидной причиной стали вирусные опасения. В особенности, видимо, на нервы глобальному инвестсообществу подействовал резкий рост заболевших в Италии, сопровождаемый карантинными мерами досрочное завершение венецианского карнавала, прекращение работы Ла Скала и т.д.. Отлично отразил ситуацию главный экономист MUFG Union Bank Крис Рупки.  Сейчас инвесторам надо быстрее продавать и только после этого углубляться в изучение того, что происходит в Поднебесной. И все же истерия выглядит излишней, а деформация рынков  упругой. Неплохие индикаторы  золото и евро. В понедельник золото приблизилось к 1 700 долл./унц., но уровней не удержало на утро 1 655 долл./унц.. Аналогично вела себя пара EUR/USD, которая в начале недели почти достигла 1,08, но уже сегодня ближе к 1,09. Подобное ценовое поведение можно объяснить массовым и опережающим спросом на защитные инструменты, который при этом не носит долговременного характера. Делаю ставку на восстановление цен фондовых и товарных активов и на фиксацию прибыли в драгметаллах и валютахубежищах. Сохраняю длинную позицию в индексе SampP500 и в нефти. К короткой позиции в паре USD/RUB добавляю длинную позицию в паре EUR/USD в течение 5 последних месяцев играл в этой паре на понижение. Золото в трендовом портфеле PRObonds 3 в течение более чем месяца было в покупке, но теперь переворачивается в продажу. Исключение в ставке на риск остается отечественный рынок акций в индексе МосБиржи продолжится игра на понижение. Полагаю, рынок отечественных облигаций и гос, и корпсектор, вслед за низким открытием рынка акций, испытает коррекцию, которая вряд ли завершится на этой неделе. Ожидания дальнейшего смягчения ДКП Банка России пока не вполне оправданны, а в сравнении с нынешней ключевой ставкой 6,0 рублевые облигации дороги. Основания для охлаждения рынка есть. В наших портфелях высокодоходных облигаций PRObonds 1, 2 есть небольшое хеджирование в первом портфеле 5 активов  это деньги, на которые, в частности, и тоже на 5 открыта короткая позиция во фьючерсе на индекс МосБиржи во втором портфеле короткая позиция та же по величине, но денежная позиция  10 от активов. Возможно, хеджирование окажется недолгим. И напоследок о палладии. В портфеле 2 есть все еще неудачная короткая позиция во фьючерсе на этот металл. Несмотря на свою проигрышность, урон портфелю позиция нанесла относительно небольшой. И позиция может быть увеличена на наступившей рабочей неделе. AndreyHohrin https//www.probonds.ru/posts/289rynkiipoziciiuprugajadeformacija.html
80|25.02.2020 08:07:42|"PRObonds | LIVE"|прогнозытренды портфелиprobonds сделки
84|25.02.2020 08:25:32|YYY|А смысл держать палладий Отбить потёри или вера в грузовик с пряниками
85|25.02.2020 08:33:48|"PRObonds | LIVE"|портфелиprobonds сделки обувьроссии Отдельно несколько слов об экспериментальном портфеле 3.1, на треть состоящем из акций Обуви России. Не думаю, что сегодняшний день будет для него какимто особенным. Ожидается низкое открытие рынка российских акций, а с ним вместе, наверно, и акций Обуви России. Дальше арифметика акций Обуви в портфеле на 34, короткой позиции во фьючерсе на индекс Мосбиржи  на 22 сама позиция и хедж. Нужно мощное падение, чтобы для портфеля оно стало заметным. Тогда как с начала года у акций Обуви и индекса корреляция вряд ли наблюдается в 2020 году рост акций на 18 против роста индекса на 2. Портфель задумывался как потенциально наиболее доходный в линейке, и несмотря на свои риски, таковым остается. AndreyHohrin
87|25.02.2020 08:47:38|Andrey Hohrin|смысл в том, что ошибка в ходе сделки  это тактическая, а не принципиальная ошибка
88|25.02.2020 08:49:46|YYY|Ясно, подходы конечно разные бывают.
90|25.02.2020 09:32:20|La Fayett|Извините, но кроме того что вы делаете отличную работу по размещениям и ведению портфелей, запомним мы вас палладиевыми шортами. Обсуждал тут не связанную с финансами на работе тему, и один коллега брякнул  в любой непонятно ситуации Шорти палладий. Страна знает своих героев
91|25.02.2020 09:34:58|Andrey Hohrin|любая ситуация запоминается ее итогом. итога пока нет. рано для воспоминаний 
92|25.02.2020 09:45:19|laslo Fish|Даже интересно. Когда поза становится явно прибыльной  недовольные будут чем Так будто рынок заодно и Хохрин с Иволгой людям должны профит всегда и двузначный.
93|25.02.2020 10:02:21|Дэн Иванов|во время размещения второго выпуска была такая ситуация, никуда цена не падала
95|25.02.2020 11:19:56|"PRObonds | LIVE"|Cегодня в 1900 по МСК в прямом эфире PRObonds Андрей Хохрин выступит с темой Биржевая паника  это возможность Коронавирус спровоцировал обвал нефти и фондовых рынков и ажиотажный спрос на драгметаллы и доллар. Долгим ли будет панический эффект И как лучше действовать в сложившейся ситуации Что планируем покупать и продавать мы И почему вирусная турбулентность не должна заметно сказаться на высокодоходных облигациях Ссылка на трансляцию  https//youtu.be/_AWLDn94cF8
96|25.02.2020 11:59:20|Alex|Что то все притихли
97|25.02.2020 12:00:25|Fin Partner|Отходняк
98|25.02.2020 12:18:59|Soa|Есть мыслиподелитесь
100|25.02.2020 12:21:32|Mikhail Strovsky|Поясните каков состав 1, 2 и 3 портфеля
101|25.02.2020 12:23:27|Кирилл|Делюсь мысли есть
102|25.02.2020 12:36:26|Rost|Попробуйте в основном канале поискать
103|25.02.2020 12:43:01|Andrey Hohrin|по хэштегу портфелиprobonds в телеграмканале Вы сможете найти всю историю и составы портфелей. будут вопросы  пишите, в т.ч. и лично
104|25.02.2020 12:43:45|Владимир Тутынин|Меня сбер сегодня решил в Квик не пускать. Наверное бережет нервы.
105|25.02.2020 12:44:39|Alexander|Сбер сломан утром был  это точно. Сейчас вроде работает...
106|25.02.2020 12:46:16|Владимир Тутынин|На бинанс можно положить депозит на суррогатный доллар под 5,59. Вопрос.Как можно завести туда деньги выгодно, чтоб не терять на вхдвыход по 3
107|25.02.2020 12:49:22|YYY|Да нет, сберушка мёртвый
108|25.02.2020 12:50:25|Alexander|У меня работает, но без графиков. Стаканы показывает.
109|25.02.2020 12:50:32|YYY|Втб средства зачислил, но никак не может отобразить на счету.говорят, что специалисты работают.
112|25.02.2020 12:53:17|Artem|напишите timtim66 он подскажет. в чате энгри присутствует
113|25.02.2020 12:58:07|А Б|Заработал
114|25.02.2020 13:15:09|YYY|Вошёл тоже , но через сбер id через обычный пароль входа нет , у меня так.
115|25.02.2020 13:50:05|Serg|Там вроде запустили сервис покупки крипты с рублёвых карт без процентов
116|25.02.2020 13:54:39|Dmitry|Вы что, одновременно лонгуете сишку и ришку
118|25.02.2020 13:58:59|Andrey Hohrin|потому что я не делаю ставки на обрушение рубля
119|25.02.2020 14:02:00|AP۞S✞LE (Евгений)|Шансов больше что он обрушится чем укрепится верно
121|25.02.2020 14:05:42|Dmitry|Выбор в сторону рублёвого индекса это не просто отсутствие ставки на обрушение или нейтральный прогноз по курсу, это инвесторс вью на укрепление То есть модельно закладывается падение фонды при одновременном укреплении рубля
123|25.02.2020 14:34:53|Reincarnation Man|Вита подтверждает Атонстайл
124|25.02.2020 14:53:41|Harry Lime|Ничто не ново под луной ...
125|25.02.2020 14:57:34|Reincarnation Man|хорошо пошла 
126|25.02.2020 14:57:59|Rost|Кто несмог войти раньше по хорошим ценам, есть шанс
