|time|user|text
426|01.03.2020 01:51:49|🦠 Dvaops|Что в понедельник будете откупать по скидкам
427|01.03.2020 01:53:47|sasha bav|ИМХО Я думаю в этом супермаркете сезон скидок еще не закончен. Есть смысл подождать.
428|01.03.2020 01:54:38|🦠 Dvaops|По облигахам реально что цена будет долгое время под 100 У меня опыта кризисного не было, но чёт не верится
429|01.03.2020 01:56:21|sasha bav|Про какой эшелон Вы спрашиваете и даже если и так , то что в этом плохого.
430|01.03.2020 01:56:47|А что ты сделал для котэ!?|Если будет кризис  она и 60 может быть на небольших объемах Или вообще без бидов ПРАДАВААААЙ
431|01.03.2020 01:57:21|🦠 Dvaops|Априфп обувь Шевченко и т.д.
432|01.03.2020 01:57:22|А что ты сделал для котэ!?|БУДЕМ ПАДАТЬ ЛЕЙТЕ ТУПАНЫ ГАЗПРОМ ПО 50 КОПЕЕК
433|01.03.2020 01:57:41|🦠 Dvaops|Я наоборот откупаю
434|01.03.2020 01:58:40|А что ты сделал для котэ!?|Зря Земля налетела на земную ось Из моря вышел царь фараон Последние дни наступают Грядет Антихрист
435|01.03.2020 02:00:05|sasha bav|Орентируйтесь на цену второго эшелона. Если доха там будет расти то и 3ий эшелон подтянется
436|01.03.2020 02:00:56|🦠 Dvaops|3 ий это кто  Последний  Я думал последний это и так мусорный тип как эти
437|01.03.2020 02:01:17|sasha bav|В этой парадигме с 90х живем
439|01.03.2020 02:04:36|🦠 Dvaops|Как определил
440|01.03.2020 02:05:51|Михаил|Мосбиржа определила
441|01.03.2020 02:06:11|🦠 Dvaops|Дайте ссылочку
442|01.03.2020 02:06:16|sasha bav|И старик Хохрин
443|01.03.2020 02:09:11|Михаил|Moexобувьновости, не
445|01.03.2020 02:11:58|🦠 Dvaops|То есть 3 уровень во время кризиса весьма может скамануть
446|01.03.2020 02:12:58|Михаил|Да, распродавайте в понедельник все вдо, что не успели. 3 уровень  чёрная метка
447|01.03.2020 02:13:32|🦠 Dvaops|Финансовый совет
448|01.03.2020 02:13:38|Михаил|А Обувь по любому скала, ведь второй уровень же
449|01.03.2020 02:13:52|sasha bav|И не только 3.. Посмотрите графики офз и разных сберов в 2008
450|01.03.2020 02:14:07|Михаил|Совет анонима в телеграме
451|01.03.2020 02:14:22|А что ты сделал для котэ!?|Да чего вы спрашиваете Решили продавать  продавайте, решили держать  держите Деньги то ваши, а не советчиков
452|01.03.2020 02:14:36|🦠 Dvaops|Михаил, почему вы говорите от анонима
454|01.03.2020 02:16:28|Сергей|Газпром сказали лить, а про обувь умалчивают
455|01.03.2020 02:17:03|Михаил|Ну, я даже не знаю, что ответить
456|01.03.2020 02:17:31|А что ты сделал для котэ!?|Риски эмитента  Они за день не изменились Риски пролива на 50 Вам никто не ответит
457|01.03.2020 02:17:41|Михаил|Вы риски хотите понять исходя из уровня листинга Тогда я вам написал, что делать
458|01.03.2020 02:18:17|А что ты сделал для котэ!?|Ну ты еще Дэни предложи продать Совсем то уж на святое зачем покушаться
459|01.03.2020 02:18:51|🦠 Dvaops|Это про то что чёрная метка А где фундамент этих слов
460|01.03.2020 02:20:35|Михаил|Мдэээ
461|01.03.2020 02:21:15|sasha bav|У китайцев иероглиф риск и возможность пишутся одинаково . Если Вы пришли на биржу только за возможностью и не понимаете риски или не воспринимаете их , то это печально..
462|01.03.2020 02:26:43|Sergey S|Появилась значительная неопределенность  относительно будущего же роста,а значит работы многих компаний,их прибыли и все такое. неопреленность  один из факторов риска. больше неопределенности  больше риска. Очевидно, экономическая ситуация ухудшается. очевидно также,что финансово слабые,а также маленькие компании больше подвержены изменению макроэкономических условий. Вот турфирмы  потеряли кучу денег из за отказов людей от Китая,Италии, Кореи. Турфирмы обычно маленькие  могут и закрыться от такого Могут. хорошо,бонды они,кажется не выпускают. Аэрофлот тоже потерял деньги, но это ему не сильно повредит, хотя акции упали, и еще упадут.но мы же не про акции. Вот вам лишь малая часть рисков и простейший пример
463|01.03.2020 02:28:03|Михаил|Блджад, пришёл апостол рисков и рейтинговых покрытий
465|01.03.2020 02:29:21|Mister X|не так немного. Кризис состоит из двух кандзи , первый обозначает риск, второй, с большой натяжкой возможность хоть это и не верно, но красиво 
466|01.03.2020 02:29:21|Михаил|Но нет, рискихуиски блабла
468|01.03.2020 02:30:20|Владимир Тутынин|Все хотят понять. Как поймут, так начнется
469|01.03.2020 02:30:31|Mister X|почти все круизники резко превратились в вдо после даймонд принцесс 
470|01.03.2020 02:31:41|Сергей|Те, кто сидят в Дени сильны верой и проверяются каждый месяц
471|01.03.2020 02:31:58|Владимир Тутынин|С дядя племянник
472|01.03.2020 02:33:21|sasha bav|Звиняйте, языкам не обучен. Что вычитал, то и написал
473|01.03.2020 02:34:17|Владимир Тутынин|Просто я думаю. Может у Китайцев нет никакого коронавируса. Может просто неправильно прочитали иероглиф
474|01.03.2020 02:34:48|Mister X|я больше по японскому, благо, в свое время экзамен сдавал  иероглифика там одинаковая. Пояпонски кстати, кризис  кики, т.е. два кандзи читаются одинаково 
475|01.03.2020 02:35:29|sasha bav|А может и Китая нет Мы в МАТРИЦЕ 
476|01.03.2020 02:36:00|Mister X|в разных частях китая один и тот же иероглиф прочитают совершенно поразному, единым останется только смысл. Там куча диалектов разных
477|01.03.2020 02:36:22|Ivan Z|Не, ну экономика в целом может повлиять, сворачивание спроса, например. Рольф тот же... Много будет продаж новых авто в кризис А у них долг приличный, маржинальность маленькая, легко им будет Или ломбард... Там же не только отчаявшиеся физики клиенты, но и всякие мутные личности с садовода, Люблино и так далее, которым кредит не взять по простому. С одной стороны, они может сперва ломануться когда понадобятся срочно деньги, а как экономическая активность сожмется, так и не пойдут, а просто закроются, это не завод тем более, а какой нибудь экспортимпорт серый, торговля. Хз как это на бизнес ломбарда повлияет. Чисто на любительском уровне даже без цифр очевидно что лучше им не будет всем в кризис
478|01.03.2020 02:36:32|Владимир Тутынин|Веселая мы туса. Как про Дэни закончили, так Китай изобрели.
479|01.03.2020 02:39:28|Михаил|Экономическая активность у нас безотносительно коронавируса живет. Не, ну если прям совсем все плохо будет и мы умрем  тогда да. Но тут уже не до вдо позиций будет.
481|01.03.2020 02:41:18|sasha bav|В отношении Ломбардов и прочих ОМ,БД я полностью солидарен с Гарри. Кризис для них это золотое время.
482|01.03.2020 02:42:27|Sergey S|А вы вообще никакой сентенции нормальной создать не можете, одни эмоции. Кто во что горазд
484|01.03.2020 02:43:05|Ivan Z|Не, короновирус влияет на цены на нефть, те на рубль, высокий курс  не будут ставку снижать  замедление роста экономики  меньше потребление  меньше потребность в экспорте  торговцы с садоводы сокращают операции  меньше берут денег в ломбарде, а просто домой едут. Ну как пример, может вон как выше пишут, поток отчаявшихся перекроет падение и все будет ок. Это в любом случае скажется както, а изменения всегда риск.
485|01.03.2020 02:45:11|Михаил|Я не могу и не пишу поэтому херни. Вы же пердите в лужу постоянно. Даже мне человеку далекому от финансов и даже тупо от бухгалтерской отчетности очевидно, что ваши рассуждения не несут никакой новой информации.
487|01.03.2020 02:46:54|Ivan Z|Не очень понял, почему Наоборот меньше будет продаж же, плюс стоимость этого импорта вырастет..
488|01.03.2020 02:48:15|Михаил|Больше народа переориентируется на самый дешевый ширпотреб. Поскольку остальной импорт станет запретительно дорогим
490|01.03.2020 02:50:11|sasha bav|Цена на товары и услуги в кризис конечно просядет. Но отложенный спрос и предложение может сыграть злую шутку с шортистами. Это как тянуть резинку все ниже и ниже. А потом она вырывается из слабых ручек .
491|01.03.2020 02:50:40|Ivan Z|Возможно, чтото в этом есть. А может часть просто от покупок откажется ну или ещё больше на Али перейдёт, до 200 евро беспошлинный пока потолок. Может обувь запасы распродаст
492|01.03.2020 02:53:54|sasha bav|Привычки меняются не за один час. Вот тут то и наступает звезднй час Ломбарда.
493|01.03.2020 02:56:50|sasha bav|Китай PMI Просто отвратительные новости из Китая  PMI просто рухнул до 35 пунктов  я лично такого низкого показателя вообще не помню  Отгрузка товаров Output рухнула до 28 пунктов  Новые заказы new orders упали до 29 пунктов, экспортные заказы также примерно до этих же значений  Уровень покупок рухнул до 29,3 пунктов Похоже понедельник будет Чёрным ....
494|01.03.2020 02:57:45|Михаил|Про ломбард не знаю, я его практически не держу. Вот более значительным фактором может быть аномально тёплая зима и ее влияние на ОР. Вот это посерьёзнее коронавируса.
496|01.03.2020 03:09:24|Владимир Тутынин|Ставка же вроде не зависит от курса, а от инфляции
497|01.03.2020 03:10:16|Михаил|А инфляция не зависит от курса
498|01.03.2020 03:10:36|Владимир Тутынин|Нет
499|01.03.2020 03:11:11|Михаил|У нас зависит
500|01.03.2020 03:13:05|sasha bav|Это Вам надо было Набиулинойдай бог памяти в 2008 сказать 
501|01.03.2020 03:16:53|Владимир Тутынин|В инфляционное время же бизнес оживает, правда социалка херится и люмпены начинают бухать.
503|01.03.2020 03:27:55|sasha bav|Я конечно тож не экономист так...дурака валяю , но 90е на своей шкуре прочувствовал. Тогда бизнес возродился при полном отсутствии регулирования со стороны государства. И только благодаря этому смогли наполнить прилавки по всей стране. Сейчас совсем другие условия игры. И в возрождение бизнеса мне очень сложно верится
504|01.03.2020 03:29:51|Denis|Пусть сильнее грянет буря Больше ужаса
505|01.03.2020 06:50:05|Andrey Hohrin|Оценивал рынки. Вывод скорее всего, ещё попадаем. В ВДО, видимо, тоже.
506|01.03.2020 06:57:37|Mikhail FarEast|Это просто от нищеты. Страна наша бедная, вот такое и творят люди.
509|01.03.2020 07:06:58|Andrey Hohrin|Не утверждаю. Но шансов достаточно.
510|01.03.2020 07:09:06|Ruslandd|Ставлю на отскок в понедельник, либо около ноля
512|01.03.2020 07:16:10|Mikhail FarEast|Хреново, привыкли уже, что вдо стоит как скала. Но это были иллюзии
513|01.03.2020 07:19:07|Andrey Hohrin|Ну, какая скала Здесь много неподготовленных держателей, у которых отношение к ВДО как к депозиту в Сбербанке. Но за доходность нужно платить и нервами, и ликвидностью.
516|01.03.2020 07:25:44|Mikhail FarEast|2018 вспомнил. Тогда вообще не дрогнул. Но тогда мы были совсем маленькой песочницей, а сейчас видно сильно выросли. Ну что же, придется в ПНД слить чуток и мне
517|01.03.2020 07:25:51|laslo Fish|А вы, Иволга, планируете поддержку котировок своих эмитентов Грубо  выкупать будете Какие, вообще, если не секрет, планы по работе со своими бумагами при условном падении 51015 от номинала
518|01.03.2020 07:26:16|Andrey Hohrin|А вот зачем сливать, скажите
519|01.03.2020 07:26:49|Mikhail FarEast|Куплю более интересные папиры
520|01.03.2020 07:27:26|Andrey Hohrin|Наблюдение и подбор, если будет интерес. Спасать  нет, поживиться  да. Дефолтных рисков я у себя в портфелях не вижу.
521|01.03.2020 07:27:32|Mikhail FarEast|У меня иволги нет, других организаторов держу.
522|01.03.2020 07:27:34|Andrey Hohrin|Какие
523|01.03.2020 07:27:57|Mikhail FarEast|Андрей Ну акции же конечно
524|01.03.2020 07:28:20|Andrey Hohrin|А, понятно. Не стрррашно
525|01.03.2020 07:29:28|Mikhail FarEast|Страшно,поэтому и куплю чуток. Падающие ножи это не просто термин, это кровавый опыт
526|01.03.2020 07:30:09|laslo Fish|Спасибо. Я пока тоже рисков у ваших не вижу потому ту же обувь планирую разве что увеличить. С целью поживиться
528|01.03.2020 07:31:15|Harry Lime|Put in с вами не согласен , огромный об,ем путов со страйком 40 прошел в пятницу
529|01.03.2020 07:31:21|Mikhail FarEast|Вы правы, очень много тех, кто не видел падения. А если ещё отношение к облигам, как к депозиту, то просто беда. Сложно им сейчас, точно ливанут
531|01.03.2020 07:36:03|С Б|Ну , и новенькие не все дилетанты, падения видели, держать будем, зачем сливать, а вот кто какие овд считает достойными к покупке, было бы интересно услышать и новичкам. Дени, как я поняла, покупать не стоит, а вот ломбард, если конечно можно на маленькие суммы его покупать
532|01.03.2020 07:39:53|Mikhail FarEast|Ломастер уже просел прилично тоже. Я просто думаю, что если такая херь ещё даже два дня будет с падением, то ничто не устоит. Сказали же, что типа такого падения мамбы не было с 2008. Я там тогда не был, не могу прокомментировать
533|01.03.2020 07:50:44|Harry Lime|Майские путы со страйком 40 прошли
535|01.03.2020 07:54:53|laslo Fish|Достойных к покупке сами определяйте, из своих предпочтений и представлений, в том числе о рисках.
536|01.03.2020 07:57:51|Евгений Коломна|Мартовские размещения не будете переносить может быть повышением доходности порадуете
537|01.03.2020 08:05:40|Andrey Hohrin|Повышение будет, отмены пока не планируется
539|01.03.2020 08:52:08|laslo Fish|Америка в пятницу на постмаркете по многим давала плюс. Но шоу может в понедельник быть пожестче пятничного на мамбе
540|01.03.2020 08:55:39|ОлегЕ.|Ждём дохлого мартовского кота 
541|01.03.2020 09:00:41|laslo Fish|Пауэлл с Дональдом хором сказали, что затмят славу Бернанке. И вместо апача возьмут Боинг, изза вместимости
542|01.03.2020 09:02:29|Владимир Тутынин|Андрей Витальевич не спит. Думу думает.
545|01.03.2020 09:13:11|YYY|Не сыпьте соль на рыны....
546|01.03.2020 09:17:14|Владимир Тутынин|26221 буду скидывать. Смотреть буду ломбард, пр, лтрейд, сэз
547|01.03.2020 09:18:39|YYY|К ломбарду присмотрюсь, а по остальным пока на заборе 
549|01.03.2020 09:30:42|ОлегЕ.|Почему Магадан муник почти по номиналу идёт Какието особые риски у него
550|01.03.2020 09:51:52|Yuriy Skopylatov|Размещения, планируемые в марте, переносятся
551|01.03.2020 09:52:44|Andrey Hohrin|Нет, 17 марта планируем, с купоном в районе 13,5, подробно скажем на наступающей неделе
552|01.03.2020 09:53:53|Yuriy Skopylatov|Ясно спасибо.
553|01.03.2020 09:55:56|Mikhail Evdokimov|Падение 2008 года безоткатно продолжалось с мая по октябрь
554|01.03.2020 09:56:34|Yuriy Skopylatov|Коллеги вопрос не совсем по теме но думаю что сможете подсказать. Кто держит Ен гдр ENPL, по ним я так понял делистинг в апреле, вместо них сейчас выпустили на мосбиржу обычные акции Ен ENPG. Будет какой то автоматический обмен расписок на акции Задал вопрос своему брокеру  они ничего не знают, отправили к эмитенту. А тот молчит. Вот сижу думаю что делать  или ждать пока автоматом поменяют или слить в рынок. Но сливать не хочу...
555|01.03.2020 10:00:58|Анатолий Бронников|Тоже держу и тоже сливать не хочу
559|01.03.2020 10:28:52|Mark O|Это пустое Если путы ктото купил, то их ктото и продал. По опционам направление не определяется.
560|01.03.2020 10:29:39|С Б|Спасибо
561|01.03.2020 10:31:08|Harry Lime|Он же еще и продал 20к по путов со страйком 49 , купил 60 к с 40м. Примерно такая же история была с путами на ришку на 28 февраля. Я зову его наш Рэй . А так пустое конечно.
562|01.03.2020 11:13:16|Yuriy Skopylatov|Для чайника расскажите о каких путах идёт речь
563|01.03.2020 11:16:32|Harry Lime|Очень большая ставка на падение нефти до 40 или ниже
565|01.03.2020 11:20:30|YYY|Как понимаю, ставка может и не сработать
566|01.03.2020 11:21:22|Yuriy Skopylatov|Что означает он продал 20к путов со страйком 49, купил 60к с 40м Проще говоря встал в шорт до 40
567|01.03.2020 11:22:51|Harry Lime|Не совсем , 20 к опционов со страйком 49 стоят как 60к с 40. Если нефть пойдет ниже его 40е подорожают в разы.
568|01.03.2020 11:25:26|Alexey|Это если эту ставку сделал не ктото знающий позицию рф по снижению добычи 
569|01.03.2020 11:27:58|Harry Lime|ГО 55 млн . руб так то
570|01.03.2020 11:29:35|Mark O|Нет там никакой ставки. Нормальный опционщик торгует волатильностью, а не направлением. Ставку делает только самоубийца.
571|01.03.2020 11:30:11|Alexey|Или инсайдер
572|01.03.2020 11:32:07|Mark O|А правильный опциощик торгует временем. В отличие от других активов, только время изменяется в одну сторону
573|01.03.2020 11:36:31|sasha bav|При направленном рынке,еще как торгуется. Другое дело что смотреть колво открытых позиций по нефти на ММВБ, то еще удовольствие....
574|01.03.2020 11:37:44|Mark O|Ха Вы знаете будущее Какое направление
575|01.03.2020 11:41:13|YYY|Будущего не знаю, посмотрим открытие недели. Дед лютует на ФРС , говорят, что они сдадутся и ликвидности добавят в рынок, тем самым спасут Wall Street.
