|time|user|text
183|11.08.2019 10:30:07|Pavel|Друзья, не поделитесь аналитикой свежей втб по Евробондам Спредами Ценами
185|11.08.2019 10:48:04|Kir|Софт первичка по обычным тарифам в бкс
186|11.08.2019 11:07:58|Alexey Vishnyakov|Бкс берет 100 рублей за РПС. Уже много раз это обсуждали в друзе. Берёз не сразу. Но через некоторое время в отчётах эта строка появляется.
188|11.08.2019 11:34:38|Sergey eSKon|Несколько голосовых заявок в месяц в втб, насколько я помню, бесплатно
189|11.08.2019 11:34:59|Александр Шумаков|Но не на мой онлайн
190|11.08.2019 11:36:40|Alexey Vishnyakov|В сумме плюсов обычный тариф на втб вне конкуренции. 105 рублей в месяц немного.
191|11.08.2019 11:43:58|Dmitry_FI|В день, не в месяц
192|11.08.2019 11:45:15|Sergey eSKon|возможно, но столько размещений чтобы исчерпать весь ресурс я не помню чтобы было
193|11.08.2019 11:48:22|Dmitry_FI|Верно
195|11.08.2019 18:24:50|Olly Milly|
196|11.08.2019 18:30:34|Andrey Hohrin|В основном мы ведь вещаем на своем Ютьюбе
198|11.08.2019 19:04:14|Andrey Hohrin|Я не подумал про платность на циркуле. Впредь тогда будем компенсировать затраты, Вам или циркулю. Нам эти деньги не нужны, а Вам затраты кажутся мелочными, и это верно. Пусть циркуль заработает, коль таковы правила, а мы с Вами не потеряем контакта.
199|11.08.2019 19:16:35|Dmitry Manzor|Ваш ютуб канал очень инфрмативный в этом плане. Короткие 30 минут, пробежались по темам за неделю, красота
200|11.08.2019 19:21:05|Andrey Hohrin|Спасибо, Дмитрий
201|11.08.2019 20:18:48|Nicholas|Киньте ссылочку на канал
206|11.08.2019 22:40:45|Serg|
207|11.08.2019 22:47:03|Denis Nitchenkov|Согласен, спасибо большое за канал
210|12.08.2019 08:53:19|Андрей Хатаев|AndreyHohrin по золоту, правильно ли я понял, что сделка открывается при откате до указанной цены Т.е не с самого пика
211|12.08.2019 08:53:20|Андрей Хатаев|/1/ портфелиprobonds сделки золото Сегодня выставляется стопприказ на продажу золотого фьючерсного контракта GDU9. Цена условия  1 489,5 п. Сделка совершается на 10 от активов портфеля PRObonds 2 или на 50 от чистой спекулятивной позиции . Помним, что в портфеле с пятницы уже куплены контракты на нефть. Нефтяную позицию увеличивать не предполагается. Тогда как продажа фьючерса на золото может быть увеличена до 20 от портфеля PRObonds 2 или до 100 от чистой спекулятивной позиции. Ожидания от падения цены  1 300  1 400 долл./унц.
214|12.08.2019 08:54:13|Андрей Хатаев|Торга вроде на 1500 завершились в пятницу
215|12.08.2019 08:55:39|Andrey Hohrin|Доброго дня Да. Если цена коснется 1489.5
217|12.08.2019 08:57:09|Андрей Хатаев|Это примерная поддержка текущего импульса роста
218|12.08.2019 08:57:44|Andrey Hohrin|это избегание лишнего риска при входе в позицию.
219|12.08.2019 09:10:46|Шура SiberianRanger| золото cot smartmoney Net short банками в золоте  второй по величине в истории экстремум. Если это не остановит рост золота, то ничто не остановит...
220|12.08.2019 09:19:41|Andrey Hohrin|короче, выносят меня вперед ногами
221|12.08.2019 09:20:14|Шура SiberianRanger|Наоборот, умные деньги стоят вместе с нами в шорте 
222|12.08.2019 09:20:44|Andrey Hohrin|чъорт поберъи
223|12.08.2019 09:33:01|Владимир Тутынин|Нефть
224|12.08.2019 09:47:09|Andrey Hohrin|мсблизинг ходразмещения Второй выпуск облигаций МСБЛизинга в прошлые среду и четверг продавался более чем на 10 млн.р. за сессию. Если темп сохранится, сегодня размещение будет завершено. Первый выпуск МСБ сейчас торгуется выше 101 от номинала. https//t.me/probonds/2227  это как купить на первичном рынке . Хотя пока изет размещение, покупка и на основных торгах будет близка к номиналу.
225|12.08.2019 09:51:19|Andrey Belous|Только по первому АПРИ купон наверно, а ее по второму
226|12.08.2019 09:53:24|Olga Kindichenko|Андрей, благодарю Сейчас исправлю
228|12.08.2019 09:56:27|Aleksandr Boychuk|В АПРИ есть определенного рода путаница...Первый выпуск уже погашен, сейчас торгуются второй и третий если брать по счету...В таком порядке выплата купона как раз будет по второму
229|12.08.2019 10:06:11|Andrey Belous|Если только так
230|12.08.2019 10:25:10|Alex|Просьба указывать автора этого материала
232|12.08.2019 10:33:10|Vladimir|Ламбум 16го
233|12.08.2019 10:35:05|Dmitry Manzor|точно
235|12.08.2019 10:49:26|Владимир Тутынин|Ну что вы, в самом деле. Тут золото с валидолом. А вы про какието купоны
236|12.08.2019 10:53:40|Roman Gorodnev|золото даже от 1485 может отскочить вверх прилично, сижу думаю над точкой входа Андрея
237|12.08.2019 11:00:46|Olga Kindichenko|Спасибо
238|12.08.2019 11:06:52|Vladimir|По мяснич3 у вас уже есть инфа о перечислении купона
239|12.08.2019 11:24:32|Dmitry Manzor|а у нрд есть инфа
240|12.08.2019 11:25:48|Котов Иван|Вот это золотишко развернулось
241|12.08.2019 11:26:38|Scorpio76Spb|Подскажите, а как принять участие в доп.выпуске
242|12.08.2019 11:30:51|Denis Nitchenkov|Да и нефть
243|12.08.2019 11:34:59|Владимир Тутынин|Ну меня стоп сработал на 1500. Как говороится не ссы против тренда
245|12.08.2019 11:36:20|Ooo Riemann|А куда оно развернулось то по вашему  Вверх или вниз  хотелось бы конткретики
246|12.08.2019 11:38:28|Andrey Hohrin|оно разворачивалось, разворачивалось, разворачивалось
247|12.08.2019 11:39:38|Евгений Шатов|Вниз пойдёт, только сначало к 1520 сходит, а потом вниз
248|12.08.2019 11:40:33|Владимир Тутынин|.
249|12.08.2019 11:41:22|Ramil Raymanov|можно вопрос
251|12.08.2019 11:42:02|Владимир Тутынин|Надо наверное отдельный канальчик. А то Алекс Петров наверное в гробу переворачивается
252|12.08.2019 11:42:19|Harry Lime|Андрей , у вас уже 10к подписчиков в канале , это серьезно , поздравляю 
253|12.08.2019 11:42:37|Ramil Raymanov|я с утра глянул их коэффиценты и показатели на инвестинге. они же все дышут на ладан. это по сути пирамиды... вам не страшно их покупать
255|12.08.2019 11:43:19|Владимир Тутынин|Страшно. Но надо чемто покрывать убытки от фьючерсов.
256|12.08.2019 11:43:22|Vladimir|По пионеру уже есть, мясо нет.
257|12.08.2019 11:43:59|Harry Lime|Страшно , но это проходит
258|12.08.2019 11:44:18|Ramil Raymanov|они в любой момент могут перестать платить
259|12.08.2019 11:44:31|Владимир Тутынин|Как и все ВДО в мире. Для мусора это нормально.
260|12.08.2019 11:44:34|Andrey Hohrin|Спасибо, Гарри Спасибо Вы в Красноярск как соберетесь  скажите, чтобы запланировать и поездку, и мероприятия.
261|12.08.2019 11:44:46|Ramil Raymanov|как можно давать человеку который не работает
263|12.08.2019 11:47:54|Harry Lime|А кто призывает жениться на этих эмитентах , получил рост тела купон и давай , досвиданья.
264|12.08.2019 11:48:28|Ramil Raymanov|у меня например пик облигации, я точно знаю что дела у них нормально идут , квартиры как горячие пирожки продаются
266|12.08.2019 11:49:27|Владимир Тутынин|Точно знать это слишком хорошо.
267|12.08.2019 11:49:29|Ramil Raymanov|я не осуждаю просто не понимаю сути
268|12.08.2019 11:49:45|Alex|Сколько доходность у пика 8,5
269|12.08.2019 11:49:54|Harry Lime|У меня тоже был ПИК , когда он давал 1314 годовых. Сейчас 8 , на Апри я делаю 2 Пика.
270|12.08.2019 11:50:16|Ramil Raymanov|но апри может может не вренуть
272|12.08.2019 11:50:41|Владимир Тутынин|ПИК тоже.
273|12.08.2019 11:50:46|Harry Lime|Да пофиг , его доля в портфеле 1,5 , это вообще ни на чем не скажется
274|12.08.2019 11:50:53|Ramil Raymanov|может я не правильно считаю но у мен яполучает что 10 годовых у пика
277|12.08.2019 11:51:22|Harry Lime|Давно нет 10
279|12.08.2019 11:52:04|Ramil Raymanov|да они все банкроты
283|12.08.2019 11:53:24|Alex|Очередной срыватель покровов
284|12.08.2019 11:53:36|Harry Lime|Могу только послать на три буквы , в ОФЗ
285|12.08.2019 11:53:38|Ramil Raymanov|ни в коем ради, мне просто интересно
286|12.08.2019 11:53:39|BoRo DA|Банкноты бабки купонами не платят
287|12.08.2019 11:53:42|Dimasik|Несёт свет и радость людям
288|12.08.2019 11:54:14|Ooo Riemann|Если принять близко к сердцу и разуму ТА то практически все видят в золоте Флаг , кто то вымпел , но флаг отчетливее был , а это фигура продолжения тренда и выстрел до 1550 , потом фиксация прибыли и вот тогда серьёзная коррекция , и это может все случиться прям ща ,а может ещё и пару месяцев поболтать  , а уж если и амеры просядут, то и в золото понабегут покупатели ... это я к тому что разворота пока нет
289|12.08.2019 11:54:36|Harry Lime|Давайте зарубу по Мясничему , я их МСФО разобрал от корки до корки.
290|12.08.2019 11:54:40|Dimasik|Так и у входа в казино всегда можно поинтересоваться или у опционщиков..
291|12.08.2019 11:54:56|Ramil Raymanov|и...
293|12.08.2019 11:55:02|Aleksandr|Есть решение суда о банкротстве Или иск о банкротстве хотяб 
294|12.08.2019 11:55:36|Harry Lime|агроэлита мясничий аналитика Под занавес размещения облигаций ОбъединенияАгроЭлита  краткие, но с цифрами и выводами ресерчи от властителя умов владельцев облигаций  сэра Гарри  OrsonWelles  https//t.me/chat_angrybonds/130567  про АгроЭлиту https//t.me/c/1350246314/35202  про ТД Мясничий Без купюр. Для чистоты эксперимента.
295|12.08.2019 11:55:47|Harry Lime|Почитайте
297|12.08.2019 11:57:11|Ramil Raymanov|долг / ебитда 3
298|12.08.2019 11:58:29|Harry Lime|Кошмар , есть куча компаний BB Moodys где 5
299|12.08.2019 11:59:00|Елена Филякина|
300|12.08.2019 11:59:08|Aleksandr|Это здоровое соотношения считается даже при рейтинге А
301|12.08.2019 11:59:19|Владимир Тутынин|Придется снова брать долг.
302|12.08.2019 11:59:26|Ramil Raymanov|Показатель отношения долга к EBITDA  достаточно популярный среди аналитиков коэффициент, очищенный от влияния неденежных статей амортизации. При нормально финансовом состоянии организации, значение данного коэффициента не должно превышать 2
303|12.08.2019 11:59:31|Harry Lime|На Азбуку Вкуса посмотрите там А и 4
304|12.08.2019 11:59:45|Aleksandr|Википедия
305|12.08.2019 11:59:56|Harry Lime|Учебник
306|12.08.2019 11:59:58|Ramil Raymanov|да нет учебник по экономике хазина
308|12.08.2019 12:00:15|Harry Lime|Вам в ОФЗ и там трястись от страха
309|12.08.2019 12:00:41|Aleksandr|https//www.auditit.ru/finanaliz/terms/solvency/debt_to_ebitda.html
310|12.08.2019 12:00:42|Ramil Raymanov|Если значение коэффициента превышает 2, это говорит о слишком большой долговой нагрузке на предприятие и вероятных проблемах с погашением своих долгов. Для предприятий с таким высоким значение коэффициента проблематично привлечь дополнительные заемные средства.
311|12.08.2019 12:00:45|Andrey Hohrin|не вижу смысла спорить. отчасти и поэтому открывают позичию всегдя частями.
312|12.08.2019 12:01:08|Aleksandr|И это указывает что эмитент банкрот
313|12.08.2019 12:01:15|Ramil Raymanov|ну не знаю
314|12.08.2019 12:01:31|Harry Lime|Да и ПИК тогда походу того , при смерти
316|12.08.2019 12:02:00|Aleksandr|Ну так практика говорит что эмитент спокойно привлекает доп.заемные средства . Мы рассуждаем о свершившемся факте
317|12.08.2019 12:03:06|Harry Lime|С учебником в ВДО лучше вообще не соваться , подтверждения , что все плохо на каждом шагу
318|12.08.2019 12:03:31|Ramil Raymanov|https//smartlab.ru/q/PIKK/f/q/MSFO/debt_ebitda/
320|12.08.2019 12:04:44|Harry Lime|Поэтлму и 8
321|12.08.2019 12:04:47|Ramil Raymanov|2018Q4  0,11
323|12.08.2019 12:05:29|Aleksandr|Давайте не сбиваться с курса.Банкрот или не банкрот 
324|12.08.2019 12:05:56|Harry Lime|Зная , как формируется отчетность застройщика , может быть любая цифра. Но так приятно увидеть и поверить , правда же
325|12.08.2019 12:06:25|Ooo Riemann|Ни в коем случае не спорим  а просто делимся мнением
326|12.08.2019 12:06:41|Aleksandr|Пик держится за счет ВТБ . Если бы эта стенка отьехала , была бы печаль
327|12.08.2019 12:06:41|Ramil Raymanov|и я о том же
328|12.08.2019 12:06:47|Alexandr Starostin|Они все не банкроты пока есть кредиты и субсидии
329|12.08.2019 12:06:50|Ramil Raymanov|я не спорить пришел, я пришел учится у вас
330|12.08.2019 12:07:03|Alexandr Starostin|но так во всем мире
332|12.08.2019 12:07:30|Aleksandr|Welkome . В споре родим истину
333|12.08.2019 12:08:54|Alex|Вы с порога объявили эмитентов банкротами. Не похоже, что пришли учиться
334|12.08.2019 12:09:08|Harry Lime|Тут все просто , жадность  это хорошо , если вам не надо 16 годовых и достаточно 8 можно вполне оставаться в ПИКе. И ничего в этом страшного нет.
335|12.08.2019 12:11:16|Dimasik|Аргументов кроме вики пока не было же. В пример только пик и непонимание почему он даёт 8, а вы банкротом под 1516..
336|12.08.2019 12:12:27|Владимир Тутынин|Вот посмотрел сейчас. У ПИК за 2018 превышает 5.
337|12.08.2019 12:13:02|Harry Lime|Это ближе к истине , но 0,11 клево же звучит. Во многом знании много печали.
338|12.08.2019 12:13:36|Владимир Тутынин|Долгов 96000000. Валовая прибыль 18000000
339|12.08.2019 12:13:58|Alex|Это не ебитда
340|12.08.2019 12:15:35|Владимир Тутынин|Ну там на 100000 больше. У них отрицательные коммерчекие расходы
341|12.08.2019 12:18:18|Егор Пупкин|Забавно рассуждать про долг/Ebitda у Пик после новостей, что кредитующий банк покупает долю в компнии
342|12.08.2019 12:18:40|Harry Lime|Дальше обычно идет история , что купон 1618 можно отработать только на оружии и наркотиках. Это классика жанра.
343|12.08.2019 12:18:57|Alex|Считать долг/ебитда дело неблагодарное. Проще подсмотреть в мсфо и уповать, что там все посчитано
344|12.08.2019 12:19:10|Егор Пупкин|Это я к тому, что делать выводы нужно из комплекса показателей и информации.
345|12.08.2019 12:20:22|Владимир Тутынин|Ну я ещё вебинар не купил. Прошу простить.
346|12.08.2019 12:20:50|Harry Lime|Конечно , со всякой фигней типа CAGR и ROI возиться много чести
347|12.08.2019 12:24:03|Alex|Почувствовал иронию, не понятно почему
348|12.08.2019 12:24:52|Harry Lime|Это был сарказм
349|12.08.2019 12:26:27|Дэн Иванов|Сегодня был выплачен 5й купон по второму выпуску биржевых облигаций ООО ПионерЛизинг ПионЛизБП2. Напоминаем  размер купона по второму выпуску рассчитывается по формуле КС  6,25. С первой по пятую выплату купон составлял 14. На 6ю выплату определен купон в размере 13,75. Раскрытие выплаты
350|12.08.2019 12:26:29|Harry Lime|Человек , хоть раз готовивший отчетность по РСБУ знает , что прибыли там грош цена . Если нет кредитов у юрлица ее может и не быть , а иначе банк требует.
351|12.08.2019 12:29:39|Владимир Тутынин|Ну и нафиг ПИК, если на размещении дают 14
352|12.08.2019 12:31:47|Harry Lime|Когдато в 1617 гг Пик был добрым , 1314 купон и букбилдинг по 100. Если пропустил это время горевать бесполезно
353|12.08.2019 12:33:00|Alexandr Starostin|так и депо в Сбере по 20 вспомним
354|12.08.2019 12:33:27|Harry Lime|Это на пару лет раньше
355|12.08.2019 12:33:47|Alex Petroff|Вопервых я вполне себе жив. Вовторых мне фиолетово что вы здесь обсуждаете Извините, что какимито своими действиями отвлек вас от разумных мыслей
356|12.08.2019 12:34:47|Harry Lime|Жиза
357|12.08.2019 12:36:45|Ramil Raymanov|где написано
358|12.08.2019 12:37:17|Владимир Тутынин|Отчетность на дискложе
359|12.08.2019 12:38:02|Ramil Raymanov|https//www.pik.ru/about/financialperformance/mainindicators
361|12.08.2019 12:40:51|Alex|Так я и писал, что надо мсфо смотреть для хоть какихто данных. А уж за неимением хоть на РСБУ посмотреть.
362|12.08.2019 12:41:00|Владимир Тутынин|Если хоть раз был барыгой  должен понимать. Если квартиры, как ты заметил  расходятся как горячие пирожки, то нужно занимать, занимать и занимать, чтобы с помощью плеча успеть вынуть с рынка как можно больше. Если не получится, делаешь ОСВО из России
363|12.08.2019 12:43:51|Ramil Raymanov|там немного не так. они главные получатели выгоды отреновации и они работают по сути под заказ.
366|12.08.2019 12:45:33|Владимир Тутынин|Почему то на сайте в долгах они не указали кредиторскую задолженность в 37000000
368|12.08.2019 12:47:13|Alex|Потому что так правильно. Текущих обязательств там нет
369|12.08.2019 12:47:51|Ramil Raymanov|чтобы участвовать в девелоперских проекта  например в реновациях
371|12.08.2019 12:50:44|sergei begreater|А зачем в стакане МСБЛиз2 стоит покупка на 2.2 млн по 100.02 если можно отгрызть от плиты по 100.03 В чем смысл стоять и ждать с таким объемом изза одной сотой процента
372|12.08.2019 12:50:55|Владимир Тутынин|Не спорю. А почему Их будут выплачивать не из прибыли
373|12.08.2019 12:51:54|Ramil Raymanov|думаю для них это капля в море
375|12.08.2019 12:52:34|Andrey Hohrin|азарт
376|12.08.2019 12:52:50|Шура SiberianRanger|А почему бы и нет 
377|12.08.2019 12:53:36|Ramil Raymanov|стоп, это ... стоит заявка маркера что ли или кого... короче орагнизаии которая обеспечивает ликвидность на рынке
379|12.08.2019 12:54:14|Шура SiberianRanger|Это 220 рублей, считай депозитарку за 2 месяца можно сэкономить 
380|12.08.2019 12:54:22|Alex|Для ответа надо понимать, что такое кредиторская задолженность. Это вполне может быть оплата за ещё непоставленные товары. В данном случае выплачивать будут путем поставки из запасов.
381|12.08.2019 12:55:12|Владимир Тутынин|А как Андрей может сам у себя отгрызть
382|12.08.2019 12:55:58|sergei begreater|Если честно ни один из ответов не убедил. Подозреваю это ускорение размещения от организатора.
383|12.08.2019 12:56:05|Ramil Raymanov|такие вопросы нужно задавать не в этом чате
384|12.08.2019 12:56:33|Alex|Как будто чтото плохое.
