|time|user|text
127|25.02.2020 15:03:16|Harry Lime|Да ну реально , если поднять проблему ликвидности в ВДО выяснится , что жизнь есть в десятке бумаг , тяжело быть большим ...
130|25.02.2020 15:08:11|Александр Емельянцев|Коллеги по опасному бизнесу, а собсна купон по ЛизингТрейд, ктонить получил У меня Сбер тишина...
131|25.02.2020 15:08:59|Кирилл|Получит у обоих брокеровОткрытие и ВТБ.
132|25.02.2020 15:11:06|Eugeni Schukin|получил, ВТБ.
133|25.02.2020 15:12:56|Yaroslav|Дублирую с инвестинга OBUV Временно вышел из позы. Буду смотреть дальше. Паникселл не локальный. РТС  4, возможно закрою большую часть позиций для перезахода. Цели все еще остались 60 Буду смотреть результаты недели. p.s. Имхо сейчас лучше в кеше и облигах посидеть, причем где готовность есть до погашения. Ну и с апсайдом фиксирую потихоньку.
134|25.02.2020 15:12:58|Антон|Сберу не хватило
135|25.02.2020 15:17:59|Владимир Тутынин|Сбер все ещё бухает
136|25.02.2020 15:18:55|G M|Докупаю.
137|25.02.2020 15:21:11|Владимир Тутынин|Нужно быть либо облигационером, либо акцинером. Быть самому себе ростовщиком достоевщина
138|25.02.2020 15:23:47|Yaroslav|У меня кстати зашел с 10 попытки, сейчас снова мертв.
139|25.02.2020 15:25:48|Alexander|Умер окончательно. Факт...
141|25.02.2020 15:26:32|G M|Выбрал,буду акционером.
142|25.02.2020 15:28:16|Maks|А ведь точно 
143|25.02.2020 15:36:12|Ruslan Alimov|почему так категорично
144|25.02.2020 15:37:54|Сергей Костромеев|Всем добрый день. Купон по Лтрейд упал кому
145|25.02.2020 15:39:06|Olly Milly|Второй писатель
146|25.02.2020 15:39:46|Сергей Костромеев|Я прошу прощения, это вы к чему
147|25.02.2020 15:40:22|Шура SiberianRanger|Это намек на то, что в чат можно не только писать, но и читать его.
148|25.02.2020 15:40:46|valentina|Упал в ВТБ
149|25.02.2020 15:42:06|Сергей Костромеев|Ребят, я конечно могу быть и не прав, но не надо показывать своё остроумие в чате. Показывайте в другом месте. Можно просто, по доброму помочь или ответить. имхо
151|25.02.2020 15:43:10|Soa|Если ОСТОумие то можно..
152|25.02.2020 15:43:18|Владимир Парцей|Сбербанк целый день плохо работает. Захожу по часу в терминал
153|25.02.2020 15:44:18|Ivan Z|Да, вы не правы, прежде чем задавать вопрос можно потратить 10 секунд на поиск. Вовторых, вопрос бессмысленный, если бы также чат удосужились почитать поняли бы почему.
154|25.02.2020 15:44:26|Alexander|Небольшая коррекция на фоне вируса и сбербанк выключился, что же будет когда будет настоящий паникселл 
155|25.02.2020 15:45:31|Галина Наумова|Я вообще не могу в Сбер зайти
156|25.02.2020 15:45:35|Сергей Костромеев|Хахааааа
157|25.02.2020 15:45:46|Olly Milly|Норм. Не обижайтесь. Но и я не прав тоже, похоже. Коллеги, кажется. потерли всем надоевшие вопросы про поиски купонов.
158|25.02.2020 15:46:46|Владимир Парцей|Мне помогает 1 открываю приложение 2 жду 10 минут 3 захожу Работает правда через раз
159|25.02.2020 15:47:25|Сергей Костромеев|
160|25.02.2020 15:47:42|Галина Наумова|Попробую, СП
161|25.02.2020 15:49:00|Владимир Парцей|Кто следит за развитием ситуации с акциями обувь России
162|25.02.2020 15:49:36|Privet|Я слежу. Падают.
163|25.02.2020 15:49:43|Санек|Иволга капитале же 
164|25.02.2020 15:50:20|Шура SiberianRanger|Когда он спрашивал, вопросы и ответы ещё были в чате.
165|25.02.2020 15:50:24|Владимир Парцей|В точку. Причём что то сильно упали
166|25.02.2020 15:52:03|Maksim|они до сих пор не научились сохранять настройки с учетом нескольких серверов если пользоваться веб квик, то вам нужно раз пять сделать релогин, чтобы попасть на сервер на котором вы в прошлый раз работали и сохраняли свои настройки  я хз как они работают.. Я всегда говорил, что сбер  это банк, которым не пользуется его топ менеджмент
167|25.02.2020 15:53:21|Olly Milly|Ну ладно, Если у кого про купоны ЛизингТрейда будут еще вопросы, можно писать мне в приват. Я держу бумагу, отвечу 
168|25.02.2020 15:54:21|Ivan Z|Пора продавать все, встаём в шорт, обуви конец
169|25.02.2020 15:54:43|Шура SiberianRanger|
170|25.02.2020 15:56:22|Владимир Парцей|Ммм, а я думаю. Когда докупать будет пора
171|25.02.2020 15:57:06|Ivan Z|Упало на пять процентов, срочно усредняемся, с плечами
172|25.02.2020 15:57:38|Владимир Парцей|Плечи х100 activated 
173|25.02.2020 15:58:08|Privet|Усредняемся палладием 
174|25.02.2020 15:59:30|Ivan Z|Главное чтобы не свинцом в голову потом а то люди уж очень впечатлительные пошли на такие мелкие колебания
175|25.02.2020 16:03:48|Галина Наумова|Владимир, спасибо Вам получилось  без графиков правда, но хоть стакан есть
176|25.02.2020 16:04:14|Andrey Mayorov|
177|25.02.2020 16:04:46|Владимир Парцей|Рад помочь
178|25.02.2020 16:09:54|Сергей Костромеев|Стою в позе по Мечелу. Думал поседею на открытии . Сбер жжёт. В 12 смог зайти.
182|25.02.2020 16:12:11|Владимир Парцей|Используй мой метод
183|25.02.2020 16:12:23|Владимир Парцей|Мне помогает 1 открываю приложение 2 жду 10 минут 3 захожу Работает правда через раз
184|25.02.2020 16:12:49|Сергей Костромеев|Спасибо. Уже опробовал, стопы проверил.
186|25.02.2020 16:59:27|Владимир Тутынин|Да даже если бы и потерли. Если так важны происки купонов  не закрывай чат, сиди онлайн.
187|25.02.2020 17:13:39|Илья|тинькоф подарил мне премиум на месяц и прислал критику имеющихся бумаг, в т.ч. по обуви россии вот какие они, те самые аналитики ухудшающие прогнозы
188|25.02.2020 17:15:16|Ivan Z|Сами прислали или с менеджером общались
189|25.02.2020 17:15:51|Илья|ну менеджер мне все написывает вовсю, но я не могу сказать что сам с ним сильно общаюсь
190|25.02.2020 17:16:08|Dmitry Manzor|Самое главное то что это получили не только вы а другие домохозяйки тоже
191|25.02.2020 17:16:50|Илья|домохозяйки на премиуме, ага
193|25.02.2020 17:20:37|Dmitry Manzor|Так там ничего нового не сказали
194|25.02.2020 17:24:10|Владимир Парцей|Самое интересное, что обувь начала отрастать
195|25.02.2020 17:24:17|Soa|Кому это интересно может быть
196|25.02.2020 17:27:51|Илья|Кстати Тинькоф сегодня объявил что на всех тарифах даст доступ к первичному размещению.
198|25.02.2020 17:28:29|Andrey Hohrin|это огромный прыжок для всего человечества 
199|25.02.2020 17:29:09|Илья|Революция, о необходимости которой все время говорили большевики, совершилась
200|25.02.2020 17:30:40|Алексей ayaye :)|Три года страна стояла на краю пропасти... и вот наконец мы сделали шаг вперед
201|25.02.2020 17:30:40|Dmitry Manzor|Титов позвонил на Пресненскую, 12
202|25.02.2020 17:31:50|Andrey Hohrin|аргументы, по счастью, не новы. а мы точно будем повышать целевую цену по акции.
204|25.02.2020 17:32:30|G M|Хорошо
205|25.02.2020 17:32:41|Илья|но.. запасы продукции.. копятся.. мем где чувак напивается
207|25.02.2020 17:33:23|Andrey Hohrin|они уже и не копятся. не думаю, что отчетность 2019 года отразит их рост
209|25.02.2020 17:47:23|"PRObonds | LIVE"|библиотека Стоимостное инвестирование в наше время уже понятная концепция основываясь на фундаментальном анализе, инвестиции направляются в акции жизнеспособных и недооцененных компаний на долгий срок. Однако, не всегда эта аксиома была так очевидна для участников рынка. Мало кто и представлял как работать с этой концепцией. Первым человеком, кто действительно смог ее понять и реализовать, стал Джон Темплтон. Мы собрали для вас пять главных принципов стоимостного инвестирования Темплтона и примеров к ним от самого успешного скупщика акций прошлого столетия. Пилигримы финансового мира Принципы инвестирования Джона Темплтона https//www.probonds.ru/posts/291piligrimyfinansovogomiraprincipyinvestirovanijadzhonatempltona.html GeorgyDobrinskiy
211|25.02.2020 17:53:31|Andrew Petrov|А почему вам пишет
212|25.02.2020 17:54:02|Илья|очевидно что хочет показать как круто на премиуме, чтоб я его оплачивал
213|25.02.2020 17:54:58|Andrew Petrov|Интересен выбор, кому пишет. Мне не писали...
214|25.02.2020 17:55:46|Илья|а вы прем
215|25.02.2020 17:56:00|Andrew Petrov|Нет
216|25.02.2020 17:56:04|Илья|ну и вот
217|25.02.2020 17:56:36|Andrew Petrov|Теперь понятно
219|25.02.2020 18:13:38|Владимир Парцей|Не выдержал. Удвоил позицию по обуви
221|25.02.2020 18:18:18|Илья|по технике может еще на пару рублей упасть
222|25.02.2020 18:21:03|Владимир Парцей|Это было бы грустно
223|25.02.2020 18:24:49|Илья|всего лишь небольшая разминка перед стартом на 80
224|25.02.2020 18:28:37|Denis Nitchenkov|Как думаете, по какой цене стоит покупать обувь
225|25.02.2020 18:29:20|Владимир Парцей|48,8
226|25.02.2020 18:34:39|laslo Fish|Я увидел сигнал на покупку Обувь в списке сразу после Амазона.
227|25.02.2020 18:38:35|Илья|я попробую поймать в диапазоне 4647
230|25.02.2020 18:39:32|Yaroslav|Годится, тоже ориентируюсь перезайти по 4547, если дадут. Если дадут ниже  можно добавлять
231|25.02.2020 18:39:33|Ivan Z|А по сколько брали За пару лет он вырос вроде б
232|25.02.2020 18:39:56|Илья|хуже него только перспективный first solar
235|25.02.2020 18:40:41|Dmitry Manzor|По 40
236|25.02.2020 18:41:16|laslo Fish|Теперь они равны с Обувью России
237|25.02.2020 18:41:43|Илья|осталось понять, это успех обуви или неудача амазона
239|25.02.2020 18:42:44|Aleksandr|это у клиента бумаги этих эмитентов в портфеле
240|25.02.2020 18:43:00|Илья|да, и клиент этот я
241|25.02.2020 18:43:27|Aleksandr|Ну то есть успеха и неудачи тут не увидеть никак.
242|25.02.2020 18:49:50|Andrey Mayorov|Предлагаю сменить название канала на proOBUV
243|25.02.2020 18:50:43|Aleksandr|лишь бы не ProEb...
244|25.02.2020 18:52:23|Maksim|
245|25.02.2020 18:52:39|Andrey Mayorov|Новый эмитент
246|25.02.2020 18:53:23|Aleksandr|скорей одна из вероятностей на рынке
247|25.02.2020 19:01:26|"PRObonds | LIVE"| Друзья, Андрей Хохрин принимает участие в уникальном событии, присоединяйтесь C 3 по 6 марта пройдет ПЕРВАЯ ОНЛАЙН КОНФЕРЕНЦИЯ ПО ФОНДОВОМУ РЫНКУ СРЕДИ КАНАЛОВ TELEGRAM Представители 16 отличных Телеграмканалов об инвестициях выступят с интересными темами. По вечерам, 4 дня подряд, встречаемся в вебинарной комнате и слушаем 4 выступления. Особенности конференции Ничего продавать не будем, рассказываем только полезный материал. Широкий охват тем, разносторонний подход. Возможность пообщаться с нами лично. Уникальные бонусы от выступающих в рассылке. Бесплатное онлайн участие. Возможность получить конференцию в записи. Подробности и регистрация по этой ссылке
250|25.02.2020 20:30:38|Шура SiberianRanger|Первичка 25 февраля
251|25.02.2020 21:31:28|Andrey Hohrin|Потихоньку
253|25.02.2020 22:29:58|Кирилл|Наблюдаю за палладием вообще не очень понятно за что он сейчасто держится Это же промышленный металл. Большей частью используется в автопромышленности, которая и так последнее время показывает себя не очень, везде продажи падают. Плюс вирусная истерия, все на юга полетели. А Pd стоит как скала
256|25.02.2020 22:53:55|Кирилл|Норникель сегодня норм полетел вместе со всеми
257|25.02.2020 22:56:03|YYY|Pd не даст сильно пасть 
258|25.02.2020 23:04:40|Sergey|Рэй Далио чтото знал
259|25.02.2020 23:04:40|Sergey| акции сша европа SPX smartmoney трейд макро BridgeWater Ray Dalio делает ставку на падение американских и европейских акций к марту 2020г. Купил путов на 1.5млрд BRIDGEWATER BETS SampP 500,EURO STOXX 50 COULD FALL BY MARCH DJ BRIDGEWATER PAID ROUGHLY 1.5 B FOR OPTIONS CONTRACTS DJ
260|25.02.2020 23:42:15|Alexey|Если в палладии некий консорциум действительно играет в очень крупную игру на повышение  корнер  то эта игра уже не имеет обратного хода  в нее будут закачивать столько сколько нужно  пока либо не достигнут целей корнера  либо пока не прилетит нерешаемая имеющимися ресурсами проблема. Если интересно  почитайте про корнеры металлами в истории. Например по серебру
263|26.02.2020 01:02:00|Kir|А какие корнеры кроме серебра были Можете поделиться ссылками, если есть. По серебру очень интересная история
264|26.02.2020 01:15:37|Alexey|Из тех что были в уже настоящее время  классика  VW
266|26.02.2020 06:03:01|Владимир Парцей|Дмитрий Адамидов, частный инвестор, основатель сообщества частных инвесторов, каналов angrybonds и mazuts_ru дал интервью и ответил на вопросы 1 Сколько лет работаете с рынком ценных бумаг Первый раз на рынок вышел в 1998 году, постоянно  с 2006 года. В облигациях с 2011го. 2 Как вы считаете, можно ли рассматривать биржу как основной источник дохода Кому как. Для меня это скорее хобби и дополнительный доход. Но я активно не спекулирую и в мониторе, что называется, не живу. 3 Как у вас проходил процесс первоначального накопления капитала Были временно свободные деньги. Вложил. Чтото заработал, еще вложил. Но я бы не назвал это капиталом  не тот размер. 4 Как относитесь к стратегии откладывания части дохода от работы на брокерский счёт Я  индивидуальный предприниматель, у меня проектная работа и потому нет понятия постоянный доход. Заработал  отложил. Понадобилось  вынул. 5 Для вас доход от биржы сейчас является основным Нет. 6 Какой у вас любимый класс активов Способные принести высокий доход. ВДО и акции. Во фьючерсы и опционы не лезу  мало опыта. 7 У вас был опыт работы с внебиржевыми инструментами Да, но ограниченный. Пару сделок не более. Не считаю себя тут специалистом. 8 Какой у вас риск профиль С точки зрения классического подхода я склонен к риску. Но мне кажется, что в действительности как раз всё наоборот  мейнстрим неверно оценивает риски, особенно в сфере госбумаг. 9 Как вы оцениваете уровень риска при выборе эмитента Да, в общем на основе собственного профессионального и рыночного опыта. Стараюсь не брать некоторые отрасли вообще и эмитентов бизнес которых не понимаю. Или брать их по минимуму. 10 Какой для вас максимальный убыток по сделке В каких случаях вы готовы закрыть сделку и зафиксировать убыток По облигациям СУ155 убыток был 100. По облигациям Открытия Холдинга возможно будет таким же. Но, слава богу, объемы были не критчины для общего депо. 11 Как вы понимаете, когда пора фиксировать прибыль Я как раз очень часто не понимаю этого фиксирую не тогда когда нужно. 12 Какой  от вашего портфеля занимают облигации, а вдо У меня только ВДО, других облигаций сейчас нет. Жесткого процента в портфеле тоже нет  зависит от идеи. Можно вообще набрать 100 портфеля ВДО, если я буду верить в то, что это наилучший вариант. Но в последние годы ВДО занимают 2030 моего инвестиционного портфеля. 13 как оцениваете перспективу роста рынка российских высокодоходных облигаций 2020 год, на мой взгляд, будет пиком популярности ВДО. Дальше и ставки купонов сильно упадут и могут начаться дефолты, что существенно отрезвит инвесторов и может быть даже они будут шарахаться в другую крайность. 14 Как вы относитесь к поговоркам на бирже главное не заработать, а не потерять, хочешь зарабатывать на бирже  научись не терять Мне больше нравится другая поговорка КАЖДЫЙ трейдер 3 из 4 сделок делает плохие убыточные или нулевые и только одну хорошую. Но ХОРОШИЙ трейдер отличается от плохого тем, что его прибыль по этой сделке с лихвой перекрывает все потери по плохим сделкам.
267|26.02.2020 06:34:41|laslo Fish|Хороший набор вопросов. Отлично получилось. Интересно читать. Спасибо.
268|26.02.2020 07:15:32|Светлана|Тот энтузиазм с которым ведётся новый канал вызывает исключительно положительные эмоции  Один нюанс интересует можете посчитать и выложить с начала этого года сколько личного профита получилось от покупок/продаж бумаг в публичном портфеле в соотношении с теми комиссиями, что ушли брокеру и бирже, получится это сделать
269|26.02.2020 07:30:42|Владимир Парцей|В соотношении  не знаю. А вот чистую прибыль подсчитать можно. Достаточно много выйдет. Сделаю пост на эту тему в пятницу
270|26.02.2020 07:33:12|Светлана|Любопытно именно соотношение комиссий с прибыльюну и прибыль собственно само собой интересно узнать за вычетом всех комиссий и налогов
