|time|user|text
374|11.04.2020 16:48:28|А что ты сделал для котэ!?|Посмотрите на Сбербанк Europe
375|11.04.2020 16:48:41|Reincarnation Man|Боль уже месяца 23 как должна утихнуть. Имхо, дело Калви будет спущено на тормозах. И не исключаю появление дела Аветисяна
376|11.04.2020 16:49:35|Harry Lime|Есть вероятность материальных претензий к ПКБ на 2,5 ярда. Для них это много. ПКБ не Система...
377|11.04.2020 16:49:48|А что ты сделал для котэ!?|Ну вот смотрю на чешский Коммерчни банк дочка сосеете женераль Ни фига ни Тиньков, не Альфа и не Сбер с точки зрения цифры Где то на уровне российского Юникредит
378|11.04.2020 16:49:53|Rodan|Ок, берем Турцию, были отличные результаты, в Европе были отличные результаты. Но изза санкций существенно осложнилось фондирование и пришлось продать. И я бы не сказал, что в РФ слабая конкуренция в банковской сфере
379|11.04.2020 16:50:13|А что ты сделал для котэ!?|Где в Турции и в Европе отличные результаты
380|11.04.2020 16:50:21|Andrey Hohrin|Как и мосбиржа прочие биржи. Это нормально, мы позже занялись финбизнесом. Не было основы, которая у них строилась едва ли не веками. Но это не про эффективность все же
381|11.04.2020 16:50:25|Владимир Тутынин|Я отчетности не глядел. Но стратегически создание экосистем, и менплейсмента даст ему будущее, в отличие от классического банкинга. Поэтому все расходы на завоевание онлайн технологий считаю оправданными.
382|11.04.2020 16:50:37|Rodan|Это да, западные банки отстают в своей массе
383|11.04.2020 16:51:20|Harry Lime|Но есть и Китай , где ВиЧат заменяет вообще все ...
384|11.04.2020 16:51:43|Reincarnation Man|Оцениваю эту вероятность в 12. Аветисян негласно уже признал стоимость бумаг выше 2.5 млрд
385|11.04.2020 16:51:45|Rodan|У нас сберонлайн 
386|11.04.2020 16:52:32|Harry Lime|Проникает , но не настолько
387|11.04.2020 16:52:32|Andrey Hohrin|Окэй. Есть, действительно, очень талантливый Греф. Но теперь ему говорят не банкроть должников, ты госбанк, теперь помогаешь государству. Газпром так раньше использовался, как дубинка для Европы. Тоже все помогал, и стоил 2 прибыли.
388|11.04.2020 16:53:27|Rodan|Блин наша фонда ни о чем не говорит. Когда Убер по капитализации больше Газпрома, это всем понятно, что полная дичь.
389|11.04.2020 16:53:42|Andrey Hohrin|Я строю суждения на простых причинноследственных связях. Чтоб крупно не проиграть.
390|11.04.2020 16:54:34|Harry Lime|В вас державная гордость говорит , надо просто признать , что Убер просто больше заработет потенциально
391|11.04.2020 16:56:00|Rodan|Потенциально  А пока плановоубыточное гавно, которое на бесконечных QE ушло в небеса
392|11.04.2020 16:56:25|In|Аветисяна разве уже не нагибают в западных юрисдикциях
393|11.04.2020 16:56:34|Harry Lime|Газпром как бизнес не меньший трэш
394|11.04.2020 16:57:06|Rodan|Соглашусь. Плюс там дофига политики...
395|11.04.2020 16:58:24|In|А в госбанках полно скелетов в шкафу. Как в минбе. ВЭБ и ко так вообще чудовище.
396|11.04.2020 16:59:04|Rodan|А дойче а сосьете вообще мертые на мой взгляд
397|11.04.2020 16:59:34|Harry Lime|Вот и выясняется , что на российском рынке то реально посмотреть не на что  Норникель , Новатэк , Полюс с Полиметаллом , Лукойл да и все на этом примерно
398|11.04.2020 16:59:38|In|У нас нет филиалов ин. банков.
399|11.04.2020 16:59:46|Aleksandr|Это не отмазка , а единственный критерий который может четко показать госво ли там так эффективно управляло или Греф.
400|11.04.2020 17:01:03|Rodan|Блин, Греф госчиновник. Государство это люди, а не некоторая абстрактная тема
402|11.04.2020 17:03:11|Harry Lime|Ну да , чтото типа пол твиттера по капитализации
403|11.04.2020 17:03:17|In|Со сбера уже уволился
404|11.04.2020 17:03:25|Aleksandr|Ок. Тогда это госво в целом не эффективно управляет своим бизнесом. Тк из всей массы вы смогли выудить одного госчиновника.
405|11.04.2020 17:08:53|Владимир Тутынин|Так это не относится к эффективности. Можно эффективно и неэффективно управлять при данных вводных. При таких условиях многие бы западные эффективные банки соскамились
406|11.04.2020 17:09:54|Andrey Hohrin|Кстати, лизинг мы продолжим постепенно сокращать в портфеле, строителей тоже. АПРИ останется, будучи под пристальным вниманием
407|11.04.2020 17:10:24|Aleksandr|ЛТ будете сокращать
408|11.04.2020 17:10:25|Владимир Тутынин|При этом будь сбер частным, ему бы так же могли сказать не требовать долги.
409|11.04.2020 17:10:58|Andrey Hohrin|Не решил. 12,5 ат активов много. Скорее, да
410|11.04.2020 17:11:07|Mik Ter|Не подскажите, где можно посмотреть плановый вариант будущего портфеля
411|11.04.2020 17:11:32|Andrey Hohrin|Доля стройки в портфеле 20, лизинга  25. И то, и это сократится вдвое
413|11.04.2020 17:12:40|Rodan|я еще могу привести примеры, только там тоже начнутся отмазки.... 
414|11.04.2020 17:12:48|Владимир Тутынин|По стройке резать лося будете
415|11.04.2020 17:12:54|Aleksandr|А как будете диверсифицироваться то  Где возьмете имена Вам же еще ГГ сократить нужно
417|11.04.2020 17:14:39|Rodan|Не буду, это получается разговор из разряда ты докажи, а я так уж быть подумаю. При желании сами найдете
418|11.04.2020 17:15:24|Aleksandr|Помоему со Сбером Вам аргументированно опровергли Ваш пример.
419|11.04.2020 17:15:30|Владимир Тутынин|Опять Александру кровь свернут
420|11.04.2020 17:15:46|Rodan|Как опровергли что Греф единичный случай
421|11.04.2020 17:16:13|Andrey Hohrin|Сельхоз, новые отрасли
422|11.04.2020 17:16:36|Владимир Тутынин|Где вы их возьмете
423|11.04.2020 17:17:02|Aleksandr|Мне приятно, что Вы читаете только мои посты. Попробуйте и остальные ответы почитать.
424|11.04.2020 17:17:18|Andrey Hohrin|Все в процессе. Сделку мы готовим обычно около года. 2 почти готовы.
425|11.04.2020 17:18:01|Rodan|я на все ответил. Единственно что было по теме, это про западную экспансию, я на нее ответил
426|11.04.2020 17:18:03|Aleksandr|ого, Иволге вроде всего год.
427|11.04.2020 17:18:48|Владимир Тутынин|Так к тому времени может и сокращать будет нечего.
429|11.04.2020 17:22:16|Aleksandr|Ответить и опровергнуть это немного разное. В Сбер загнали всех бюджетников с получением пенсий, зарплат, пособий. Это ничто иное как дешевое фондирование банка , который итак имел это фондирование исторически , тк в народе убеждение о его надежности.Кроме того советская филиальная сеть дала огромный охват территорий. Это факторы который дают сейчас хорошему менеджеру Грефу иметь более менее вменяемые показатели отчетности.
430|11.04.2020 17:24:24|Владимир Тутынин|Так с него поэтому с первого и требуют.
431|11.04.2020 17:25:27|Aleksandr|Это резонно. И сам Греф молодец. Иные гос.чиновники имея базово все козыри умудряются все проЕ
432|11.04.2020 17:26:38|Владимир Тутынин|Интересно. Он хлопнет дверью, если минфин начнет копаться у него на кухне
433|11.04.2020 17:26:48|Rodan|Много раз эта тема разбиралась, и насчет гигантской сети, которая на самом деле была дико затратной, и насчет ЗП для бюджетников, где деньги сразу снимались с карточек и это тоже были прямые убытки на поддержание данных проектов. И не забывайте про кучу социальных функций, от которых Сбер не может отказаться. И при этом всем балласте, сейчас по эффективности использования капитала, он на первых местах. И это никак не связано с советских наследием
436|11.04.2020 17:27:54|Andrey Hohrin|Нет, конечно. Я пока ничего, кроме третьего директлизинга в убыток не продал.
438|11.04.2020 17:28:22|Aleksandr|Вы отрицаете дешевое фондирование этого банка в силу его государственности
439|11.04.2020 17:28:30|Harry Lime|Лучший вариант избежать дефолта в портфеле  вовремя выкинуть дефолтника из портфеля 
440|11.04.2020 17:29:07|Владимир Тутынин|Останется только Тинек тогда, из тех где готов держать бабки.
441|11.04.2020 17:29:28|Aleksandr|Железобетонный вариант.Непотопляемый.
442|11.04.2020 17:30:22|Rodan|Да, до 14го года сбер привлекал кредиты на западе существенно дешевле чем вклады населения.
443|11.04.2020 17:30:25|Владимир Тутынин|Если все делать вовремя  и коронавирус не страшен.
444|11.04.2020 17:31:28|Soa|уж лучше дефолт чем коронавирус
445|11.04.2020 17:31:31|Aleksandr|До 14го года вообще в валюте было фондироваться дешевле.
446|11.04.2020 17:33:43|Алексей ayaye :)|если у вас нет портфеля  его у вас не отберут
447|11.04.2020 17:33:44|Владимир Тутынин|Зарплатные проекты самипосебе приносят деньги, независимо от того, сразу снимается зарплата или нет. Плюс оведрафт
448|11.04.2020 17:34:08|Алексей ayaye :)|за счет чего
449|11.04.2020 17:34:11|Rodan|С вами дискутировать нельзя. Вы все время пытаетесь перевести стрелки на чтото еще. Живете в некоторой либеральная парадигме и все что в нее не вписывается, отвергается
450|11.04.2020 17:35:02|Aleksandr|Вы слишком широко трактуете мои ответы.
451|11.04.2020 17:35:17|Andrey Hohrin|Иногда с потерями. Важно сохранять доходность общую
452|11.04.2020 17:35:26|Владимир Тутынин|Овердрафт, операционка. Мнение, конечно, дилетанта
453|11.04.2020 17:35:33|Rodan|Нет. ЗП затратная фигня в чистом виде. Это скорее как основа кросспродаж. И тут уже зависит в целом от эффективности банка, как он этим пользуется
454|11.04.2020 17:35:57|Harry Lime|Если у вас нету тети ...
455|11.04.2020 17:38:07|Aleksandr|Может быть это сохранит общую доходность , но точно не сотрет память о организаторе размещений этих эмитентов. Не прошло даже года как эти имена в портфеле . В случае их дефолта , логические цепочки выстроятся автоматически.
456|11.04.2020 17:38:09|А что ты сделал для котэ!?|То то банки за эту затратную фигню больше всего грызутся
457|11.04.2020 17:38:30|Алексей ayaye :)|так сняли же сразу всё. вот у меня в ВТБ ЗП. Раньше был кэшбек нормальный по карточкам, процент по депозитам и накопительным счетам  оставлял деньги. Сейчас проще по используемым карточкам раскидать и остаток стянуть на тинькова. а ВТБ  фигу, ибо жадины, да и кривые местами.
458|11.04.2020 17:39:44|Rodan|Кросспродажи Мало получить зарплатника, надо ему продать кредит, страховку, депозит и т.д. В этом весь цимес ЗП.
459|11.04.2020 17:40:00|Владимир Тутынин|Ну не на тебе. Я полагал на работодателе. Но тут утверждают обратное
460|11.04.2020 17:40:16|Andrey Hohrin|Не согласен. Всего лишь достаточно повторять операции. Избежать всех рисков нельзя. Месяц назад никто в карантин не верил. А он пришел
461|11.04.2020 17:41:47|Владимир Тутынин|Ну если Андрей выйдет за день до дефолта, ему будут аплодировать, даже если он орг.
462|11.04.2020 17:42:15|Andrey Hohrin|За день до дефолта  это иллюзия. За полгода, скорее.
463|11.04.2020 17:42:21|Aleksandr|Повторять операции  Серьезно То есть если я не хочу набирать себе условную Калиту , через 5 месяцев после покупки другого выпуска , то в моей памяти сотрется все что Иволга говорила при размещениях
464|11.04.2020 17:42:21|Rodan|Хм, а это не инсайд тогда
465|11.04.2020 17:43:01|Andrey Hohrin|И это будет общедоступная информация. Нет задачи когото переиграть. Но сама игра есть
467|11.04.2020 17:43:29|Владимир Тутынин|За день  я взял в кавычки
468|11.04.2020 17:44:35|Andrey Hohrin|Я могу лишь оперировать актуальным портфелем. И рекомендовать держать его не более чем на 40 от капитала в деньгах и ценных бумагах
469|11.04.2020 17:44:57|Aleksandr|Можно и доиграться. Мне эта игра не кажется реальной для всей массы веривших в Иволгу.
470|11.04.2020 17:45:22|Andrey Hohrin|Не мой случай. Деревья в нашем лесу сначала скрипят, потом коренятся, и уже после этого падают
472|11.04.2020 17:46:16|Владимир Тутынин|За 5 месяцев после размещения, даже ковид может закончится. Будем надеяться что нас заблоговременно предупредят
473|11.04.2020 17:48:10|Aleksandr|Кто и сколько держит от портфеля влияет лишь на силу боли. Потеряю я лимон или пять лимонов на каком то выпуске Иволги все равно я вспомню как Иволга говорила о том как эмитент изучен вдоль и поперек и какой он молодец. Вспомню и то как Иволга говорила , что скакать из выпуска в выпуск вообще неправильно и раз уж эмитент качественный то и сидеть в нем можно до погашения.
474|11.04.2020 17:50:24|Владимир Тутынин| Это Гарри говорил
475|11.04.2020 17:50:25|Andrey Hohrin|В этом речитативе несколько мыслей, которые я никогда не мог сказать.
476|11.04.2020 17:50:35|Aleksandr|Воспринимаю эти разговоры как мягкую подготовку к дефолтам какихто эмитентов размещенных Иволгой за последний год.
477|11.04.2020 17:50:46|Andrey Hohrin|С богом
478|11.04.2020 17:50:59|Владимир Тутынин| А Андрей соглашался
479|11.04.2020 17:51:54|Andrey Hohrin|Просто, степень шизы и шпиономании с сидением дома, видимо, возрастает у публики. Что естественно
480|11.04.2020 17:52:14|А что ты сделал для котэ!?|Ну никакой инвестбанкир не мог предсказать коронавируса И Иволга не могла
481|11.04.2020 17:53:05|Владимир Тутынин|А ты нашёл неплохую отмазку
482|11.04.2020 17:55:02|Andrey Hohrin|Судить, господа, будем те по делам. А пока тут смесь страха с жадностью.
483|11.04.2020 17:55:50|Harry Lime|И это только первая стадия. Вслед за дефолтами компаний изза последствий остановки экономики последуют дефолты по облигациям, если ФРС решит ПОВЫСИТЬ ставку гденибудь через год или после выборов в США. Даже при незначительном повышении ставки, долговая нагрузка раздавит компаниизомби. По большому счету альтернативы повышения ставки и нет. Только прямой выкуп акций... Про компании зомби https//t.me/bloomberg_insights/2832 bloomberg_insights
484|11.04.2020 17:56:13|Andrey Hohrin|Впрочем, это сильно лучше од Ломастеру. Так что все равно очень хорошо
485|11.04.2020 17:56:47|Ivan Z|Ну Андрей говорил, что может быть проблема, от самих мер ограничительных, а не от самого вируса и что ее недооценивают. Но, видимо, сам не думал что так может быть все быстро, из портфеля не спешил бумаги продавать. Может по какойто ещё причине, если он скажет
486|11.04.2020 17:56:51|Andrey Hohrin|Отличная иллюстрация
489|11.04.2020 17:59:29|Ivan Z|Ну для физика, можно было выйти из бумаг, уйти в доллар, такой проблемы ж не было бы в плане ликвидности, суммы небольшие. Не все это сделали, мышление инерционно, не хочет верить человек, что все плохо вот уже прям сейчас будет, пока все было хорошо, рынок шел в верх.
491|11.04.2020 18:01:29|Andrey Hohrin|У меня нет задачи получить приз зрительских симпатий. Есть продукт, его нужно вести.
493|11.04.2020 18:03:16|Алексей ayaye :)|это же всё в этом чате было в чём проблема  подтвердите свои утверждения цитатами
494|11.04.2020 18:03:47|Ivan Z|Ну, извините, если чтото не так сказал просто вы вполне резонно опасались проблем, были правы в итоге, но портфель не стали менять. Я предположил почему
495|11.04.2020 18:07:08|Aleksandr|Кому подтвердить Своим ушам 
496|11.04.2020 18:07:55|Алексей ayaye :)|ойвсё
497|11.04.2020 18:08:57|Aleksandr|Чо все  Я говорил за себя . Или захотелось судьей побыть
499|11.04.2020 18:21:05|Lizardking0808|Андрей, не пропускаю ни одного Вашего эфира, с удовольствием учусь потихоньку. Ваше неприятие мфо только эстетически моральное Или есть серьёзные опасения У очень многих испорчена ки, для них мфо единственный шанс решить свои проблемы. Многим банки отказывают в кредитах, и здесь снова время мфо. Не было желания разместить кого то из них
500|11.04.2020 18:21:52|Andrey Hohrin|Во вторник напишу об этом материал
501|11.04.2020 18:22:08|Lizardking0808|
502|11.04.2020 18:22:30|laslo Fish|Вы когда говорите о плановом сокращении стройки и лизинга, то предстоящая амортизация талана учтена в этих планах, или это дополнительным плюсом уменьшение доли
503|11.04.2020 18:26:26|Andrey Hohrin|Да
505|11.04.2020 18:28:08|Алексей ayaye :)|Да понял я, понял. ни одно доброе дело не останется безнаказанным. Не мешаю далее сотрясать воздух. А без пруфов это именно оно.
506|11.04.2020 18:30:45|Aleksandr|Если сильно охота для самого себя что то выяснить, то берите все видеообзоры по каждому эмитенту и просмотрите. Ну и да, в чате тоже можно почитать. Даты себе выпишите начала размещений , будет проще найти.
508|11.04.2020 18:32:17|Алексей ayaye :)|Зачем Я тут никому никаких слов не приписываю. Понадобится  найду, кто что говорил. Важное могу и сразу заскринить.
509|11.04.2020 18:33:42|Aleksandr|Послушайте, я никому тут тоже ничего не приписываю . Не переживайте за Хохрина или Иволгу в целом , они если что меня на дуэль вызовут.Ваша честь не задета.
