|time|user|text
1|28.02.2020 14:59:09|Dmitry Manzor|Размещений нет подходящих, вот и держал понятное дело, что это недополученная прибыль, а не убыток.
2|28.02.2020 15:01:28|Andrey Belous|Упущенная выгода знаю, а недополученная прибыль не знаю А так понятное дело, кто зачем пришёл на рынок...
3|28.02.2020 15:01:37|Eugeni Schukin|в моменте и такси было 8 
5|28.02.2020 15:07:54|Dmitry Manzor|Недополученная прибыль это разновидность упущенной выгоды. Но не суть. Проблема вся в том, что я всегда старался сливать выше номинала и брать около.. но в виду отсутствия размещений этой возможности не было и всё начало расти как на дрожжах.. пузырь лопнул, бывает. Будем свои купоны получать и не жаловаться на жизнь. Ниже номинала ушли только лизинги, остальное откупили быстро
6|28.02.2020 15:08:43|Andrey Belous|КЭС уходил и ещё ктото
7|28.02.2020 15:09:41|Dmitry Manzor|да там на 38 лямов иск придавит не дай бог.. я его продал хотят всё миром решить, посмотрим.
8|28.02.2020 15:10:44|Andrey Belous|Посмотрим. Думаю выкарабкаются, но его доля маленькая и большая часть планируется к продаже апосля первого купона
9|28.02.2020 15:11:12|Андрей|За пару дней прибыль из 19 годовых превратилась в 14,5, обидно, хорошо хоть на прошлой неделе слил 25 облигаций по хорошим ценам под новые размещения, а так бы совсем плохо было.
10|28.02.2020 15:12:34|Andrey Belous|Поболе
11|28.02.2020 15:12:54|old_guy|С половинкой
12|28.02.2020 15:13:05|🦠 Dvaops|А что такого
13|28.02.2020 15:14:20|Andrey Belous|Я думаю он хочет сказать, что я юный максималист и нахожусь в периоде максимализма в розовых очках
14|28.02.2020 15:15:55|Dmitry Manzor| я с этой фразы детство вспомнил
15|28.02.2020 15:17:44|Aleksandr|юридически эмитент ВДО ничем не отличается от эмитента первого эшелона
16|28.02.2020 15:17:52|Andrey Belous|Никаких обид. Я уже слышал про себя такое.
17|28.02.2020 15:31:08|Soa|поздно
18|28.02.2020 15:33:33|Aleksandr|То есть если вы понимаете в целом значение слова облигация , то применяйте его в полной мере и к ВДО. А еще проспект разный порой , там нужно читать каждый раз о ответсвенности.В основном конечно это беззалоговое кредитование.
19|28.02.2020 15:41:19|Eugeni Schukin|а Манька это кто  
20|28.02.2020 15:41:45|Aleksandr|сказочный персонаж
21|28.02.2020 15:42:05|Eugeni Schukin|но ктото за этим скрывается 
22|28.02.2020 15:42:44|Ivan Z|Есть отчётность, есть кредитные метрики, есть история эмитента, можно смотреть кто владелец, на что займ, кто поручитель и тп. Типа как банк, который решает давать кредит или нет, смотришь. Насколько такой анализ будет точен  вопрос дискуссионный. Есть рейтинг от агентств как российских, так и иностранных но не у вдо, а у эмитентов типа Рольф
23|28.02.2020 15:48:23|Александр Нечаев|Кто подавался на легенду через приложение втб, у вас деньги заблокировали
24|28.02.2020 15:52:48|Aleksandr|да
25|28.02.2020 15:53:25|Harry Lime|И сразу об,яву в чат , разблокирую деньги с первичек за 2
26|28.02.2020 15:53:38|Aleksandr|
27|28.02.2020 15:55:53|Ivan Z|Да, типа того, хочешь лишнюю доходность  рискуй, трать время, имей квалификацию.
28|28.02.2020 16:15:52|Deni Le|Эксперт РА опубликовал рэнкинги лизинговых компаний по итогам 2019 года. Из ключевых показателей НОВЫЙ БИЗНЕС В СанктПетербурге  26 место В СЗФО без СПБ  24 место Оборудование для ЖКХ  ТОП 5 по России Телеком.оборудование  ТОП 10 по России. ПОРТФЕЛЬ Итоговое  63 место ЖКХ и Энергетическое оборудование  ТОП 10 по России. Больше информации о компании Роделен в приложенном отчете 2 файла. Так же полные таблицы рэнкингов доступны по ссылке https//raexpert.ru/rankings/leasing/2019 ЭкспертРА рэнкинги лизинг Роделен raexpert
29|28.02.2020 16:26:45|Iriny|А Пионер какой лучше У них там оферта близко...
30|28.02.2020 16:27:47|🦠 Dvaops|А что плохого в оферте
31|28.02.2020 16:33:01|Кирилл|Александр, а как блокировка выглядит А то я подал вчера а изменений не наблюдаю... Спасибо.
32|28.02.2020 16:33:45|Aleksandr|https//lk.olb.ru/
33|28.02.2020 16:34:41|Кирилл|Это в мобильном или в вэбверсии
34|28.02.2020 16:34:50|Aleksandr|https//lk.olb.ru/
35|28.02.2020 16:34:56|Кирилл|Спасибо. Понял.
36|28.02.2020 16:58:33|Владимир Тутынин|Это евреи так протроллили арабов
38|28.02.2020 17:06:00|Женя|Какойто Кот в сапогах
40|28.02.2020 17:15:25|Алексей K|AndreyHohrin Подскажите пожалуйста, а как вы шортите SPXL, если он не является маржинальным инструментом
41|28.02.2020 17:15:52|Andrey Hohrin|через ETF
44|28.02.2020 17:18:07|Dmitry Manzor|по заветам Трампа не выкупают падение
46|28.02.2020 17:20:38|Алексей K|Получается SPXL на buy, а SPXS на SELL, но через buy
47|28.02.2020 17:20:47|Capricious|Далио VS Трамп . Далио WiNS
48|28.02.2020 17:21:03|Andrey Hohrin|оба можно только купить. но один будет выигрывать от роста, второй от падения
49|28.02.2020 17:24:24|Ivan Z|Кстати, Андрей, а не подскажете нереально же чтобы новые етф СПб биржа добавляла, да Я там читал , что в связи с проспектами самих етф вроде как нельзя, тк прописаны биржи где они крутятся и СПб нет соответственно.
50|28.02.2020 17:24:35|Georgii|главный минус мало кто из Российских брокеров с etf на СПБ работает. Санкт Питербурская биржа говорит мол многие планируют, но пока в процессе
52|28.02.2020 17:25:48|Andrey Hohrin|нам дали возможность торговать на СПБ
53|28.02.2020 17:26:13|Ivan Z|Честно говоря, не в курсе, поэтому и спрашиваю. Давно смотрю на tqqq, tecl, но там конские условия на внебиржевом у ру брокеров, а счёт в ib не хочу открывать.
54|28.02.2020 17:26:33|Andrey Hohrin|а где взять фьючи на их индекс на российской площадке
56|28.02.2020 17:27:04|Ivan Z|Я немного про другое, эти етф на СПб доступны для квалов это понятно. Я про то чтобы биржа список доступных етф расширила
57|28.02.2020 17:27:30|Andrey Hohrin|в этом я не очень понимаю
58|28.02.2020 17:27:37|Georgii|в ib etf куда больше. на порядки \
59|28.02.2020 17:27:37|Алексей K|Спасибо. А то думаю, как его шортите. Открытие на Кипр отправляет счёт открывать. Для данных ETF. А через СПб вариантов нет
60|28.02.2020 17:28:14|Andrey Hohrin|Стоп, СПБ и дает ими торговать. Квалифицируйтесь, получайте доступ и торгуйте
61|28.02.2020 17:28:31|Алексей K|Кстати, а как на Кипре нормально торговля в плане ликвидности и спреда по этим ETf
63|28.02.2020 17:31:00|Georgii|Кроме иволги доступ дают только Церих и Универ капитал информация от самой биржи. В теории можно и через Россиийского брокера в квике работать с фьючами бирж США. но вот неуверен что это дешевле выйдет чем ib
64|28.02.2020 17:31:37|Andrey Hohrin|у нас это стоит примерно ноль, ну, чуть больше
66|28.02.2020 17:32:55|Georgii|у вас плата ежемесячная за депозитарку и квик  и нет тарифов без неё 
67|28.02.2020 17:33:36|Алексей K|Если будет возможность, пришлите пожалуйста потом стакан. Очень важно понимать, какое расхождение в спреде. Для торговли внутри дня
69|28.02.2020 17:35:10|Georgii|Ещё при наличие квала можно покупать через внебиржу. Но тут опять траблы у сбера если покупать на сумму менее 50 тыс у е комиссия 1.5. у втб комиссия меньше но минималка для внебиржи либо 10 тыс, либо 50 в зависимости от наличие бумаги в их списке
70|28.02.2020 17:36:03|Andrey Hohrin|не отменяется хотя... расходы, которые выставляют нам, мы перевыставим клиенту.
71|28.02.2020 17:36:09|Алексей K|Церих нормальный Брокер Сюрпризов, как со сбером нет
72|28.02.2020 17:36:55|Georgii|не знаю. не было опыта работы с ними
73|28.02.2020 17:38:08|Dmitry Manzor|Трамп проснулся
74|28.02.2020 17:39:37|Алексей K|Спасибо. А то не очень желание есть, пополнять счёт ради того, чтобы узнать, какой там спред
75|28.02.2020 17:40:33|Georgii|Андрей, вопрос такой в портфелях 23 Вы работайте на недельных таймфреймах. Почему именно так а допустим не ежедневное выставление позиции 
76|28.02.2020 17:41:01|"PRObonds | LIVE"|новостиэмитентов лизинг Рейтинговое агентство Эксперт опубликовало ежегодный рэнкинг лизинговых компаний России за 2019 год . В отличие от предыдущих лет, теперь результаты не сводятся в единый рейтинг, а подразделяются на несколько в зависимости от конкретного показателя, объектов лизинга и даже региона деятельности компаний. Это позволяет нам иметь более точное представление о месте компаний относительно прямых конкурентов. По объему портфеля лизинговые компании, облигации которых входят в портфели PRObonds, показали улучшение и выглядят солидно относительно своих конкурентов. А по числу заключенных сделок все компании заняли более высокое место по сравнению с рейтингом портфелей, что можно интерпретировать как увеличение ими продаж и лизингового портфеля темпами выше рыночных. По объему портфеля ЛизингТрейд  48 место 49 Роделен  63 место 74 МСБЛизинг  76 место 79 БЭЛТИГРАНД 84 место 91 ТЕХНО Лизинг  86 место 103 По числу заключенных сделок ведется отдельно впервые ЛизингТрейд  25 место ТЕХНО Лизинг  36 место БЭЛТИГРАНД 44 место МСБЛизинг  66 место Роделен  60 место
77|28.02.2020 17:41:05|Алексей K|Фьючерс SP500. Вот думаю, надо гдето алго запускать, а то чтото напряжно.
78|28.02.2020 17:42:27|Georgii|а в чем бэктестить робота планируйте 
81|28.02.2020 17:47:07|Andy|последний рубеж
82|28.02.2020 17:55:21|Алексей K|Неа. У меня алгоритм простой. Поэтому проблем в написании кемто не было. Ну и нашёл толкового програмера для Quik не дорого с его движком.
84|28.02.2020 17:57:55|Алексей K|Робот давно протесчен. Проблема в том, что нету Брокера, где это можно реализовать. Нужен Фьючерс SPamp500, чтобы премаркет был доступен. А к сожалению у SPXL и SPXS отсутствует премаркет, на сколько мне известно. Единственное, это только IB, но мне туда доступ закрыт
85|28.02.2020 17:58:32|Georgii|закрыт 
86|28.02.2020 17:59:38|Алексей K|Не открывают IB счёт граждам РБ
87|28.02.2020 18:29:16|Владимир Тутынин|Оказалось  палладий полностью бесполезный металл
90|28.02.2020 18:40:39|Владимир Тутынин|Это через Московский офис
93|28.02.2020 18:45:39|Владимир Тутынин|Все. Мы остались без Андрея.
94|28.02.2020 18:46:25|Aleksandr|Хохрин свалил Палладий. Ради этого пришлось обвалить весь рынок.
95|28.02.2020 18:46:47|Владимир Тутынин|
96|28.02.2020 18:47:13|Dmitry Manzor|Осталось понять, на сколько он ещё должен упасть, чтобы получить прибыль
97|28.02.2020 18:47:27|Paul Baikov|Вроде по ВДО выровнялось под закрытие, смотрю на цену последних сделок, большинство выше 100 стало, обувь аж 102,88, жаль не успел откупить
98|28.02.2020 18:47:37|Владимир Тутынин|Андрейхакер. Замутил вирус
99|28.02.2020 18:47:53|Aleksandr|Мне уже страшно. Ради правоты одного человека, страдает весь мир и наша песочница.
100|28.02.2020 18:48:02|Andrey Hohrin|не виноватая я
101|28.02.2020 18:48:03|Dmitry Manzor|
102|28.02.2020 18:48:22|Paul Baikov|Он вирус сам пришел, ага..
103|28.02.2020 18:48:36|Владимир Тутынин|В Китае могут расстрелять
105|28.02.2020 18:51:57|Alexey|Думаю стоит потерпеть до понедельника. Все будет
106|28.02.2020 18:52:45|Paul Baikov|Будет в смысле вверх или вниз 
107|28.02.2020 18:53:25|Alexey|Очень удивлюсь если не вниз
109|28.02.2020 18:54:25|Владимир Тутынин|Все по 100 это выровнялись Нас в Fixprice сдали
110|28.02.2020 18:55:49|Paul Baikov|Да, за выходные еще куча всего может случиться
111|28.02.2020 18:56:23|Сергей|Да любая доха по номиналу
112|28.02.2020 18:56:48|Alexey|Пытаюсь себе представить что нибудь хорошее Дед даже твитить перестал
113|28.02.2020 18:57:15|Paul Baikov|Ну не по 80 же
115|28.02.2020 18:58:06|Dmitry Manzor|Дед сам в шорт встал небось ну надо компаниям дать фиксануть прибыль об и дальше с новой силой поедут магическим образом будут выходить сообщения, что вирус контролируемый и вакцина уже рядом
116|28.02.2020 19:04:49|Ruslandd|Глобально тренд восходящий, ложный пробой
117|28.02.2020 19:05:53|Rost|Выкупили ироды пролив, страх и жадность
118|28.02.2020 19:06:33|Ruslandd|Да, всего одна положительная новость может угнать рынок на новые хаи
120|28.02.2020 19:21:00|Alex Zest|Других брокеров нет кроме ib или там тоже не открывают
121|28.02.2020 19:26:30|Алексей K|Ну только не надежные или форекс конторы с CME. Пока альтернатива только Etoro.
122|28.02.2020 19:30:05|Alex Zest|Dorman, shwab
123|28.02.2020 19:37:35|🦠 Dvaops|В понедельник будем по 99 откупать все облигахи
125|28.02.2020 19:40:38|Ivan Z|Зачем только, если есть акции которые сильнее упали и стали понадежнее, им ещё на 1015 будет посложнее упасть.
126|28.02.2020 20:07:15|laslo Fish|Северсталь, например, с ВТБ, по текущим дадут дивдоху сопоставимую с доходностью свежих выпусков вдо. Спорный аргумент  просадки. Акции, конечно, сесть могут круче. Но как сегодня все уже убедились  ещё не совсем шухер, а ликвидность в стаканах вдошных схлынула. То есть. Акции просядут, но из облиг вдо без дисконта тоже при шухере не выйти. Вот в результате и получим, что доходность  вся разница. А по акциям она сегодня прилично поднялась.
127|28.02.2020 20:07:20|Наташа|Вот это сюрприз на акциях Русагро стоял тейкпрофит  улетели сегодня . Максималка 733 за день, закрытие 574.
128|28.02.2020 20:09:47|Шура SiberianRanger|Первичка 28 февраля
129|28.02.2020 20:10:07|Harry Lime|Не думаете , что дивы могут того , резануть через кварьальчик
130|28.02.2020 20:11:48|laslo Fish|Могут, и это тоже риск. Но у госов с этим будет сложнее. Им сверху делают атата.
131|28.02.2020 20:12:12|Harry Lime|Я про Северсталь
132|28.02.2020 20:14:47|Dmitry Manzor|Конечно, везде пишут потенциальную доху. Я это уже в Алросе прошел
133|28.02.2020 20:15:26|Harry Lime|Я знаю купон , я вижу ориентир ...
134|28.02.2020 20:16:01|Dmitry Manzor| абсолютно точно я остаюсь верен ВДО, просто таких шоков я еще не видел теперь будет опыт
135|28.02.2020 20:16:17|Harry Lime|Все только начинается
136|28.02.2020 20:16:58|Alexander|Что там с моторами лучше скажите, есть шанс поучаствовать и есть ли вообще смысл в текущей ситуации
137|28.02.2020 20:17:26|Сергей|Мир ВДО уже не будет прежним
138|28.02.2020 20:19:18|Harry Lime|Выбирайте друзей эмитентов правильно  чтобы были умные с хорошим , а лучше уникальным бизнесом , щедрые  не жались с купоном и верные . Вот и весь секрет.
139|28.02.2020 20:22:14|Ivan Z|А в 2018 вы также ситуацию видели или была уверенность что все будет хорошо Или в 2014
140|28.02.2020 20:22:37|Harry Lime|В 18м я даже докупался , сегодня нет
142|28.02.2020 20:23:27|laslo Fish|Компания движется в сторону дивидендной аристократии, валютная выручка, относительно высокая стабильность выплат... Плюсы, как и минусы, находятся
143|28.02.2020 20:24:05|Александр Шумаков|Диваристокоат в рф
144|28.02.2020 20:26:02|laslo Fish|Полагаете зря Доход ведёт индексы стабильности выплат Просто если там это 25 лет, то тут  хотя бы пять
145|28.02.2020 20:27:22|"PRObonds | LIVE"|В конце января Дмитрий Александров посетил Челябинск, чтобы посмотреть, как был использован третий биржевой облигационный займ АПРИ Флай Плэнинг. В сегодняшнем видео  Комментарии директора проекта Алексея Салтыкова  Захватывающие съемки с квадрокоптера  Ход строительства поселка Приятного просмотра  https//youtu.be/IjUF35TWvQ
146|28.02.2020 20:36:26|Сергей|Недавний опыт показал, что во время перетряг некомфортно держать сомнительных эмитентов более 1 депо.
148|28.02.2020 20:37:54|Евгений|В 2008 начало было похожим. Мировые рынки валились, РФ стояла как скала, все говорили мол, тихая гавань потом в процессе сменили название на тихая говень. Помню ещё толькотолько ipo ВТБ прошло, он уже начал валиться, а остальной рынок РФ игнорил мировой негатив, какоето время. Зато потом дали гари, до этого свежие рекорды были у Китая с его 7 в 2006ом, ну а мамба с ртс к сентябрю 2008 запросто делали двузначные цифры в течении дня. Но ВДО тогда не существовало в нынешнем понимании, в облигах сидели только институционалы, облиги все были с рейтингами и крупных компаний. Надо полагать что ВДО это всётаки риск, но непохоже пока что он раскрылся и это довольно странно выглядит в условиях глобального рискофф.
149|28.02.2020 20:40:08|Alexey|Rgbi пока только дрогнул, hy мировой тоже пока только испугался. Продолжаю считать что даже в этой панике все уверены что это такой просто страшноватый dip. А потом  снова в космос. Ну посмотрим. Может и правы.
150|28.02.2020 20:41:12|ОлегЕ.|Главное, чтобы этот космос не оказался просто отскоком дохлой кошки
151|28.02.2020 20:41:51|Paul Baikov|Простите, а текстом хотя б тезисного рассказа нельзя 
