|time|user|text
385|12.08.2019 12:56:38|Ramil Raymanov|ну может быть. а там естьпокупатели вообще
387|12.08.2019 12:57:51|Владимир Тутынин|Да это просто намек, что нехорошо такому маленькому кончику так долго болтаться.
388|12.08.2019 12:58:25|Ramil Raymanov|система продает лидер инвест
392|12.08.2019 13:04:53|Ramil Raymanov|ЖКХ Республики Саха Якутия, RU000A100PB0
394|12.08.2019 13:05:31|Alexandr Starostin|если даже банкрот, то все равно заплатит
395|12.08.2019 13:05:48|Максим Кочнев|С Якутами поведешься, до добра не доведешься. Как прослуживший армию в Якутии вам говорю
396|12.08.2019 13:06:27|Ramil Raymanov|для гос организации супер доходность
397|12.08.2019 13:07:03|Maksim|если взглянуть на отчетность, то только вера искренняя и безответная может замотивировать вписаться.. но можно задать вопрос по другому жкх якутии или дэни колл
398|12.08.2019 13:11:37|Harry Lime|Ищет лоха Саха ЖКХ
399|12.08.2019 13:12:01|Алексей Мелехов|
400|12.08.2019 13:12:08|Harry Lime|Государственная , но легко кидающая
401|12.08.2019 13:12:34|Владимир Тутынин|Короче. Пусть Дмитрий Александров считает. Я не способен понять как 18м поРСБУ преврещается в 37м поМСФО
402|12.08.2019 13:13:04|Ramil Raymanov|точно
403|12.08.2019 13:13:14|Harry Lime|Там 75 размещения на крупняке , это верный признак ОСВОбождения через 3 года
404|12.08.2019 13:13:38|Ramil Raymanov|это вы про че
405|12.08.2019 13:13:49|Alex|с пробуждением
406|12.08.2019 13:13:57|Шура SiberianRanger|
407|12.08.2019 13:14:00|Ramil Raymanov|я только прочитал
410|12.08.2019 13:14:38|Harry Lime|Рестрахнут облигационеров и дело с концом , кейс ФинАвиа или Пересвета поизучайте
411|12.08.2019 13:14:42|Ramil Raymanov|это я для попиздеть кинул
412|12.08.2019 13:15:01|Harry Lime|Надобрать
413|12.08.2019 13:15:11|Ramil Raymanov|вы серьезено
415|12.08.2019 13:15:31|Andrey Hohrin|давайтека без подобных словечек
416|12.08.2019 13:15:44|Harry Lime|Пророчество сбылось , пипл готов путать региональное ЖКХ с субфедом
417|12.08.2019 13:15:46|Ramil Raymanov|ой извините... воспитание
419|12.08.2019 13:17:39|Harry Lime|Схема такая , большая часть может быть сгружена пенсам. Потом через 3 года рестракт перед офертой лет на 30 , это нынче модно. Пенсы все с,едят им не привыкать.
420|12.08.2019 13:18:37|Ramil Raymanov|сегодня читал что гос во озабочено тем, как помочь людям не потерять свои пенсии при переходах
421|12.08.2019 13:19:07|Harry Lime|Государство озабочено , а из НПФ как перли так и прут , дело Минца живет
422|12.08.2019 13:19:42|Владимир Тутынин|Дак они и не потеряют. Через 30 лет им все вернут
423|12.08.2019 13:19:43|Ramil Raymanov|ну вот так вот
425|12.08.2019 13:20:22|Harry Lime|Если вам годик подержать  вполне норм , но есть более доходные варианты
426|12.08.2019 13:21:01|Harry Lime| Последние выпуски облигаций  ТЕХНО Лизинг, RU000A100DM3 Срок  1,8 года, доходность 14,3, премия к ОФЗ 7,4 ТЕХНО Лизинг является универсальной лизинговой компанией, работающей в сегменте малого и среднего бизнеса, преимущественно с автотранспортом. По объему лизингового портфеля на 1 января 2019 года занимает 103 место среди 123 компаний рейтинг banki.ru . Компания не имеет рейтингов от агентств. По выпуску предусмотрена амортизация.  АФК Система, RU000A100N12 Срок  4 года, доходность 9,4, премия к ОФЗ 2,3 Акционерная финансовая корпорация Система осуществляет инвестиции в российские компании различных секторов экономики. Имеет рейтинги от агентств SampP B, Fitch BB, Эксперт ruBBB. По нашей методологии итоговый рейтинг составляет 4 из 10 букв B, что соответствует кредитному качеству ниже среднего.  ЕвразХолдинг Финанс, RU000A100P85 Срок  5 лет, доходность 8,1, премия к ОФЗ 1,0 ООО ЕвразХолдинг Финанс входит в состав международной металлургической и горнодобывающей компании Евраз. Компания создана для привлечения финансирования путем выпуска ценных бумаг и предоставления займов компаниям, входящим в Группу Евраз. Имеет рейтинги от агентств SampP BB, Эксперт ruAA. По нашей методологии итоговый рейтинг составляет 7 из 10 букв BB, что соответствует кредитному качеству выше среднего.  ЖКХ Республики Саха Якутия, RU000A100PB0 Срок  3 года, доходность 12,4, премия к ОФЗ 3,0 ГУП Жилищнокоммунальное хозяйство Республики Саха Якутия создано путем присоединения действовавших в районах республики предприятий ЖКХ. Находится в ведомственном подчинении Министерства ЖКХ и энергетики Республики. Имеет рейтинг от агентства Эксперт ruBBB. По нашей методологии итоговый рейтинг составляет 3 из 10 букв С, что соответствует низкому кредитному качеству.  Республика Беларусь, RU000A100D63, RU000A100D30 Срок  3 года, доходность 8,5, премия к ОФЗ 1,5 Беларусь имеет рейтинг от агентств SampPB и Fitch B. По нашей методологии итоговый рейтинг составляет 3 из 10 букв С, что соответствует низкому кредитному качеству.  АльфаБанк, RU000A100PQ8 Срок  3 года, доходность 7,9, премия к ОФЗ 0,9 АО АльфаБанк  один из крупнейших универсальных банков России, принадлежащий консорциуму АльфаГрупп. По размеру активов Банк занимает 5 место, по чистой прибыли  8 место  banki.ru на 1 июля 2019г. Согласно нашей методологии, рейтинги от агентств формируют итоговую оценку 8 из 10 букв A. Соответствует высокому кредитному качеству. облигации
427|12.08.2019 13:21:18|Harry Lime|Доход пишет качество низкое
429|12.08.2019 13:22:20|Arslan|Дамы и господа, подскажите, а где можно найти квартальный и полугодовой отчет ОАЭ и Мясничего за 19 год
430|12.08.2019 13:22:24|Harry Lime|И Беларусь низкое качество , какая низость
431|12.08.2019 13:22:26|Andrey Belous|Каскад берёте
432|12.08.2019 13:22:50|Harry Lime|Безусловно , думаю увидим 102 еще до конца месяца
433|12.08.2019 13:22:51|Ramil Raymanov|да уж... вооще кто нибудь берет беларусь...
434|12.08.2019 13:23:01|Harry Lime|Толпа
435|12.08.2019 13:23:42|Ramil Raymanov|лучше офз, они опять в гору пошли, особенно дальние выпуски, 26225, 26230
437|12.08.2019 13:25:04|Harry Lime|А потом санкции , заштормит в штатах и камнем вниз , проходили уже
438|12.08.2019 13:26:12|Ramil Raymanov|ну не знаю...
441|12.08.2019 13:26:43|Harry Lime|А я проходил ,  20 в ОФЗ за неделю в декабре 14.
442|12.08.2019 13:27:08|Ramil Raymanov|я покупал по 600700
445|12.08.2019 13:27:51|Harry Lime|Будет , не переживайте
446|12.08.2019 13:28:48|Ramil Raymanov|думаю не скоро
447|12.08.2019 13:30:50|Harry Lime|В августе 14 тоже в ус никто не дул , два месяца и привет
448|12.08.2019 13:31:34|Ramil Raymanov|да знали уе все. фонды у выхода танцевали
449|12.08.2019 13:31:58|Harry Lime|Масоны и иллюминаты еще , да я слышал
450|12.08.2019 13:32:14|Ramil Raymanov|
452|12.08.2019 13:36:06|Dmitry Manzor|Матершина в чате должна удаляться. То дефолт мясничего, то словечки.. Рамиль есть что по делу
453|12.08.2019 13:37:48|Dimasik|А разве сразу не понятно, зачем пришёл человек Ещё один, кто ищет общение в сети.. 
454|12.08.2019 13:40:40|Ramil Raymanov|я извинился
458|12.08.2019 14:08:06|Andrey Belous|https//www.banki.ru/news/lenta/id10903554
459|12.08.2019 14:12:42|Александр Шумаков|Как бы за 19й 0 не сделали
460|12.08.2019 14:13:26|Andrey Belous|Посмотрим
461|12.08.2019 14:55:41|Sergey|Вопрос к Андрею и его команде похоже что золото и америка имеют обратную корреляцию по крайней мере в последнее время. играя на понижение золота вы допускаете возможность роста американских индексов
462|12.08.2019 15:07:32|Dmitry|портфелиprobonds сделки В портфеле 3 на текущую неделю 2 изменения позиций переворачиваем из продажи в покупку американский фондовый индекс и из покупки в продажу золото. Прошедшая неделя не принесла плюса, лишь остановила снижение портфеля. Шансы на плюс на новой неделе, даже чисто статистически, выросли.
463|12.08.2019 15:07:43|Dmitry|допускают
464|12.08.2019 16:11:20|Sergey Koryagin|Андрей, есть мнение, что объем мировой торговли золотом около 70 трлн это все беспоставочные фьючерсы, что намного превышает само золото, и поэтому как защитный актив это сомнительная история в том плане, что очень спекулятивная Как вы считаете в этом разрезе
465|12.08.2019 16:17:07|Andrey Hohrin|полностью поддерживаю. я н разу не покупал и не продавал поставочное золото. а бумагой на него торгую с 2010 года
466|12.08.2019 16:19:42|Dmitry Manzor|А если не закрывать фьючерс где золото ждать
467|12.08.2019 16:20:41|Andrey Hohrin|это как
470|12.08.2019 16:42:01|Елена Филякина|С почином, с кем не бывает. Платное обучение оно очень эффективное. 
471|12.08.2019 16:45:46|Andrey Hohrin|дадите деньги на благие цели зато
472|12.08.2019 16:52:08|Sergey|Запомните главное  рынок никогда не заканчивается, новые возможности появляются все время. Расстраиваться, что чтото прошло мимо вас не нужно.
473|12.08.2019 16:53:35|Sereja|Нужно ждать сентября или фьючерс можно продать Кто купил.
474|12.08.2019 16:55:13|Andrey Hohrin|Мне эта история нравится. Т.к. есть 2 гарантии от эмитента и ЧЗПСН.
476|12.08.2019 17:01:20|Sereja|А какой план Я думал, перед входом в позицию нужно фиксировать условия выхода
477|12.08.2019 17:02:38|Andrey Hohrin|план рисуется по ходу. Вы, возможно, будете смеяться, но я не верю в стройные конструкции и планы на рынке. он слишком сложен для этого. нужно просто постараться, расслабившись, плыть по течению. что я и делаю, в основном.
478|12.08.2019 17:03:51|Елена Филякина|Осторожно, затягивает
479|12.08.2019 17:16:01|Максим Воробьев|Расслабившись, плыть по течению  моя мечта. А то пока получается только напряженно стоять на берегу... 
480|12.08.2019 17:17:18|Sereja|Зная себя, мне нужно сразу написать убыток, при котором я выйду. Играй, да не отыгрывайся
481|12.08.2019 17:21:05|Andrey Hohrin|я считаю 3 просадки драмой, 45  трагедией.
482|12.08.2019 17:21:36|Sereja|Спасибо за ответ
483|12.08.2019 17:28:29|Evgeniia Bushunova|Кто в курсе по мсблизингу заявку можно подать в любое время Или только с 1645 после тех перерыва
484|12.08.2019 17:29:30|Aleksandr Boychuk|Евгения, перерыв с 1730 до 1745 и далее первичный рынок открыт до 1830
485|12.08.2019 17:29:58|Evgeniia Bushunova|Спасибо
486|12.08.2019 17:34:28|Artem|
487|12.08.2019 17:39:31|Маржинколл Байбекович|К акциям это тоже относится Или мы про облигации говорим
488|12.08.2019 17:39:44|Andrey Hohrin|это про спекулятивные позиции.
492|12.08.2019 18:20:00|Sergey eSKon|Или ещё лучше, радостно плыть по течению, а потом обнаружить, что течение было не в ту сторону
493|12.08.2019 18:22:44|Alexey Vishnyakov|А что тогда не участвовали в книге Все, кто хотел, поучамьвовали. Зачем её брать куча со смешной доходностью
494|12.08.2019 18:23:09|Ramil Raymanov|Не нравится
495|12.08.2019 19:36:12|Владимир Тутынин|Что, так и не раздали
497|12.08.2019 21:53:28|Serg|Подскажите, мясничий 3 выплатил сегодня купон
498|12.08.2019 22:08:57|Why Aye Man|https//www.edisclosure.ru/portal/event.aspxEventIdAFTxd4XhUEOpWudfQ0CLtgBB
499|12.08.2019 22:16:55|Oleg Kuzmin|я открыл брокерский договор с псб онлайн. без местной регистрации. у меня правда счёт уже был открыт в их банке.
500|12.08.2019 22:23:16|Serg|Спасибо конечно за ссылку  Задам вопрос по другому, кому либо купон дошёл сегодня
501|12.08.2019 22:24:14|Maksim Noikin|Да. Открытие
502|12.08.2019 22:24:41|Serg|Спасибо. Значит Альфа тормозит
503|12.08.2019 22:48:51|Виталий B|В Открытие брокер в тот же день купоны по всем эмитентам приходит. В Сбере на следующий день.
504|12.08.2019 22:49:41|Serg|В альфе обычно тоже в тот же день, но сегодня не пришёл
526|13.08.2019 09:24:30|Илья Григорьев|Мы собрали для Вас несколько каналов и чатов на общую тему . Из списка ниже вы найдете сообщества на такие темы как ВДО, Опционы, IPO, Нейросети, Акции, Спекуляции, Инвестиции . Высокодоходные облигации  PRObonds  LIVE младший брат PRObonds, канала о высокодоходных облигациях, трендах и экспериментах на фондовом рынке России. Место для рефлексии о текущих финансовых новостях и шпаргалка для тех, кто только начинает открывать для себя ВДО. Добро пожаловать, знающие люди помогут Опционы  Дневничок опционного ламера Канал по торговле акциями на американской бирже. Торговли в кавычках, так как главная идея  акции НЕ покупать, но регулярно получать комиссию с проданных на них опционов. А если уж акции есть в портфеле  то опять же, продавать на них опционы, и... получать неплохую добавку к дивидендам. Опционы  OPTION Чат с профессиональным уклоном на тему опционов, для тех кто устал от линейного рынка и хочет развиваться дальше. Новые возможности торговли, используя нелинейность инструмента. Опционы и Акции  TIL Group  Трейдинг, Инвестиции, Обучение Тут парни торгуют американские акции и опционы. Торгуешь, или планируешь начать  Тебе сюда IPO  IPO Обсуждение предстоящих и прошедших IPO.Сотни компаний выходят на фондовые рынки каждый год. От малоизвестных ITкомпаний до гигантов современности вроде Facebook и Uber. Зарабатывайте вне зависимости от их размера Присоединяйтесь к чату, задавайте вопросы и зарабатывайте вместе с командой профи Нейросети  Диванные аналитики и нейронные сети Канал для тех кто хочет узнать о трейдинге от практика. Уникальный формат канала / реальные примеры торговых сделок. Сложные вещи  доступно Авторские приложения для формирования инвест портфеля. Софт, книги, инструкции  все это есть у нас... Спекуляции  MagTrading_chat Чат на тему спекулирования на ммвб рынке. Те кто скальпирует приглашаем в наше сообщество. Вас жду интересные идеи для скальпинга и продуктивный диалог с таварищами по рынку. Инвестиции  Инвестиции Косаря Инвестирую каждый день по 1000 или близкой к тысяче сумму в дивидендные акции. Посмотрим что будет Инвестиции  Фондовый рынок Чат 1 Инвестиции на фондовом рынке. Делимся новостями, идеями и стратегиями инвестирования. Бесплатные семинары и вебинары. Помощь по выбору фондового брокера и рефбэк
530|13.08.2019 09:37:43|Artem|На ВТБ тоже еще не пришел мяс3 
532|13.08.2019 09:42:39|Artem|На открывашке подтверждаю пришел
538|13.08.2019 09:57:52|Кирилл Малявин|Обычно после обеда, часов в 1415 мск
546|13.08.2019 10:18:08|Vadim Asanbaev|Подробный скрипт
547|13.08.2019 10:18:08|Vadim Asanbaev|Скрипт приобретения биржевых облигаций ООО ПРЛизинг третьего выпуска необходимо подать заявку своему Брокеру посредством  голосового поручения  либо поручения в торговой системе в порядке, установленном Брокером и предоставить следующую информацию Режим торгов Размещение адресные заявки  в торговых системах брокеров возможны варианты, например, первичное размещение  или РПС первичное размещение Наименование облигации ООО ПРЛизинг серия 001Р03 ISIN RU000A100Q35 Контрагент ПАО БАНК УРАЛСИБ, идентификатор MC0016000000, краткое наименование УралСиб_Мос Код расчетов Z0 Покупка необходимого количества бумаг. Минимальный лот 1 облигация, номинал 1 облигации  1000 рублей. Цена 100. Со 2го дня размещения покупатель также уплачивает НКД за количество дней с даты начала размещения облигаций. Возможно потребуется идентификационный номер выпуска 4B020300371R001P от 07.08.19 Время подачи заявок в день начала размещения  13.08.2019 с 10.00 по 13.30 и с 16.45 по 17.29 , время удовлетворения заявок с 14.00 по 16.30 и с 17.30 до 18.30. В последующие дни с 10.00 по 17.29, удовлетворение до 18.30. Время московское. Параметры выпуска https//t.me/prleasing/121
549|13.08.2019 10:20:30|Котов Иван|Сегодня уже понятнее...но поздно
561|13.08.2019 10:57:09|Ooo Riemann|Да и вчера было понятно честно говоря , но я золото не торгую , ну и до 1550 ещё есть возм входа
562|13.08.2019 11:06:39|Котов Иван|Есть,конечно,но роста не бывает в золоте без коррекции,очень важно не набрать длинную позицию перед откатом
564|13.08.2019 11:08:41|AP۞S✞LE (Евгений)|Стоит вообще приобретать себе 3 выпуск 
565|13.08.2019 11:08:45|Котов Иван|Риск огромный,но 30 к портфелю за месяц того стоят
566|13.08.2019 11:10:47|Ooo Riemann|Главное потом не торговать месяц и не расторговать прибыль попусту ожидая неизвестно чего  берегите депо 
567|13.08.2019 11:12:00|Котов Иван|Тоже верноСпасибо.И Вы берегите.
570|13.08.2019 11:18:18|Vadim Asanbaev|Презентацию нашу смотрели аналитику angry думаю надо брать
571|13.08.2019 11:20:53|AP۞S✞LE (Евгений)|Почему говорят 2 выпуск не очень  3 темболее значит не  я просто не разбираюсь в этом
574|13.08.2019 11:23:30|Vadim Asanbaev|Не видел таких отзывов, не знаю, могут быть разные мнения, давайте конкретику тогда почему не очень
575|13.08.2019 11:28:08|AP۞S✞LE (Евгений)|Подскажите знающие вот решил я следовать портфелю пробондс а чтобы войти сейчас везде облигации взлетели. и другие тоже Как быть 
