|time|user|text
165|07.03.2020 12:54:02|Olly Milly|Крайности не обязательно исключают друг друга например, коктейльчик из 95  ОФЗ, 5 ВДО. И риск терпим, и доходность повыше.
166|07.03.2020 12:56:43|Adviser|И плюс  который остался за кадром. Очень хороший пример для подражания
167|07.03.2020 12:57:57|Шура SiberianRanger|П А Л Л А Д И Й
169|07.03.2020 13:04:41|Adviser|А можно для полноты картины про будущее В прошлом тут половина чата линейки сейчас с гордостью достанет
170|07.03.2020 13:07:34|MММ🥕🐹|
171|07.03.2020 13:09:25|Ivan Z|У человека секретная система, которую он не покажет, но если есть плюс, то отчитается об этом и смайлик вот такой поставит  
172|07.03.2020 13:10:48|Adviser|Тут сомнений нет... Я скорее о вашем видении. Если вы понимаете рынок, то интересно услышать субъективную оценку
173|07.03.2020 13:19:51|Ivan Z|Просто система работает за вас, да 
174|07.03.2020 13:22:00|YYY|если система, да ещё не ваша и рубит рубасы нафиг , нафиг ....
175|07.03.2020 13:22:37|Adviser|В чем тогда идея делиться прошлыми итогами системы принципы работы, который вы не знаете Причастность В чем отличие от фотки на фоне Теслы
176|07.03.2020 13:22:37|Ivan Z|Какой вы полезный постер Спасибо что даёте почти каждый день знать, что у вас есть система, извиняюсь, Система. И более ничего. Что бы я делал без этой информации
177|07.03.2020 13:26:35|Capricious|Грааль есть
178|07.03.2020 13:35:52|Ivan Z|То есть предлагаете рассказать вам, дать бесплатно наши бесценные системы В то время как вы свою не будете раскрывать. Вопрос  зачем
179|07.03.2020 13:40:18|MММ🥕🐹|У меня простая система бьют  беги, дают  бери 
180|07.03.2020 13:41:32|Ivan Z|Похоже Грааль только что найден.
181|07.03.2020 14:02:52|Sergey S|Конечно, анализировать лучше чем не анализировать Но многие ли смогут, многим ли хватит знаний и навыков Дальше  тем, кто готов копать, не всегда есть что копать. Взять,к примеру, мфо и лизинги, по которым нет мсфо отчетности. Полагаю, нельзя хорошо их прокопать, не увидив как минимум того, что должно быть в мсфо и примечаниях. Это я к тому, что лучше скептически оценивать возможности качественного анализа таких российских компаний
183|07.03.2020 14:09:40|Владимир Тутынин|В ВДО тоже дефолтов в ближайшее время не будет пусть не годполтора, а полгодагод. Проблема что их, возможно, как впрочем и корпоратов, трудно будет скинуть без убытка.
184|07.03.2020 14:11:38|Adviser|Даже если у них 78, то на промежутке 36 мес это разница в 0.51.0 Он ведь не стратегию меняет с вдо на ОФЗ, а хочет понять меняются ли правила игры. И тут рисковать 100 ради 0.5 не логично Но не спора ради, интереса для обратил внимание
185|07.03.2020 14:14:31|А что ты сделал для котэ!?|Ага Для начала бы неплохо понять, будут ли ставки повышать рф
186|07.03.2020 14:14:56|Sergey S|Вот видите, в этом и ошибка. вы не рискуете там на 100
187|07.03.2020 14:16:02|Владимир Тутынин|Есть система. В начале февраля вишел из ВДО. Закупился баксом. Подождал пока не отцветет черемуха. Купил дешевые ВДО с Котяра.
189|07.03.2020 14:17:10|MММ🥕🐹|Вторая часть плана под вопросом  дешевых ВДО шо то не видать
190|07.03.2020 14:17:11|Sergey S|Я вот не уверен, что в секторе вдо не будет
191|07.03.2020 14:17:53|А что ты сделал для котэ!?|Я, к счастью, не занимаю высокий пост Президента РФ и не могу ответить на этот вопрос
192|07.03.2020 14:18:52|Владимир Тутынин|Я тоже пока не Набиуллина, и не знаю будут ли повышать ставку.  как видишь я гораздо красивее
193|07.03.2020 14:20:00|А что ты сделал для котэ!?|Поэтому лучше иметь хороший запас в коротких ликвидных бумагах и посмотреть
195|07.03.2020 14:21:09|Дмитрий Адамидов|потом уже не быть мне Набиуллиной
196|07.03.2020 14:21:17|Владимир Тутынин|Вот мы и обсуждаем. Что у нас есть короткое и ликвидное
198|07.03.2020 14:22:12|А что ты сделал для котэ!?|Офз 26214
199|07.03.2020 14:22:59|Владимир Тутынин|Хотелось бы диверсификации
200|07.03.2020 14:33:59|Andrey Belous|Калита размещение будет и биржа, и краундлейдинг
201|07.03.2020 14:35:49|Adviser|Втб б126 сентябрь Гпб бо15 декабрь Риск почти равен 26214, а доходность на 11.5 больше Обе после 1.1.17
202|07.03.2020 14:36:38|А что ты сделал для котэ!?|Это не короткое
204|07.03.2020 14:38:43|Adviser|Я в горизонте выборов в США  Для меня после можно стратегию новую закладывать Весна имхо ещё период неопределенности
205|07.03.2020 14:39:47|Владимир Тутынин|Хочу пока скинуть 26221. Несколько бумаг ВДО. Это около пары штук. А что брать незнаю.
206|07.03.2020 14:40:55|Alexey|Да Условный Байден может показать всем и особенно нам ту самую Кузькину
208|07.03.2020 14:43:24|Arslan|Уважаемые коллеги, а кто знает, когда у ОАЭ выходит отчётность
209|07.03.2020 14:48:59|Harry Lime|В конце марта /началн апреля , жду с нетерпением
210|07.03.2020 18:27:35|Andrey Mayorov|Втб 127, втб 128 и так далее, с периодичностью в месяцдва погашение, доха чуть выше офз.
212|08.03.2020 00:21:38|Andrey M|Ливан объявил дефолт по суверенному долгу
213|08.03.2020 00:27:20|Сергей Батраков|Международный женский день родился в горниле русской революции. Он стал символом эмансипированных социалисток, борющихся за политические права женщин по всему миру. Сегодня феминистки пеняют нам, что, дескать, 8 марта из дня борьбы за равенство превратился в рассадник сексизма и цисгендерного шовинизма, вот эти вот ваши тюльпаны вообще фу. Словно сказать, как там в мире, но у нас в стране женщины ставили рекорды воздухоплаванья, а эскадрильи Ночных ведьм громили нацистские эшелоны, когда нынешних феминисток еще даже в проекте не было. Сегодня 40 всего топменеджмента в страны  это женщины. Они руководят корпорациями, министерствами. 44,5 тыс. женщин служит в армии России. Пожалуй, в России женщины могут строить карьеру, работать в самых разных сферах, руководить мужчинами и при этом оставаться женщинами. Оттого и праздник больше не несет отпечатков революционного надрыва и радикальных перегибов. С праздником вас, милые женщины, девушки, девочки С 8 марта
214|08.03.2020 06:51:16|valentina|Спасибо
215|08.03.2020 13:45:26|Ortemy Alexandrovich|В по воскресеньям набрасывать на вентилятор можно
217|08.03.2020 13:52:18|ЛК «ДиректЛизинг» Всеволожский пер. 2, стр. 2|С 8 МАРТА ЛК ДиректЛизинг поздравляет с нежным весеннем днем девушек и женщин Гармонии и вечной весны в душе Со Всемирным Женским Днём С 8 МАРТА ЛК ДиректЛизинг раскрывает информацию на странице ООО ИнтерфаксЦРКИ тут Самые последние новости компании Вы найдёте на нашем сайте, в telegram канале и в Instagram лизинг leasing ДиректЛизинг директлизинг лизингмосква
218|08.03.2020 14:05:38|valentina|Спасибо
219|08.03.2020 14:54:28|Deni Le|Лизинговая компания Роделен поздравляет прекрасную половину человечества с Международным женским днем Вдохновенья, радости, творчества, моря цветов, настоящей любви и искренних слов
220|08.03.2020 14:57:23|Aleksandr|Как Роделен переживет если будет взлет ставок и валюты вверх
221|08.03.2020 14:58:33|Deni Le|Валюта не влияет, т.к. все в рублях. Со ставками поборемся , как в 2014
222|08.03.2020 14:58:55|Aleksandr|Не встанет рынок лизинга
223|08.03.2020 14:59:43|Alexey|Стоп. А западная техника Ее будут благотворительно продавать по курсу 62
224|08.03.2020 15:00:13|Deni Le|Все возможно конечно. Но думаем, что безумно расти не будет. Но мы всегда консервативно относимся
225|08.03.2020 15:03:16|Aleksandr|Особенно если она уже в контракте , но не оплачена
226|08.03.2020 15:57:57|Yuriy Skopylatov|Они торгуют по воскресеньям
227|08.03.2020 16:04:58|Сергей Конев|Уже раздражать начинает этот гений срочного рынка
228|08.03.2020 16:07:40|Иван|Ну он радуется, что нефть в шортах...
229|08.03.2020 16:10:03|Dm Vl|а что у него какието великие результаты
231|08.03.2020 16:27:05|Ivan Z|Так за этот год сколько было персонажей, но они довольно толсто писали и торговцы по Фибоначчи и торговцы див гепов, каких только не было типов. В оснвоном свои ТГ каналы пиарили. Очевидная реклама была, которая не встречала понимания и проводила к бану. Товарищ выше пока держится ещё.
232|08.03.2020 16:28:29|Сергей Конев|Чат про бонды, зачем эти шортисты тут Ну ведь должны быть свои чаты для них
234|08.03.2020 16:31:21|kell|Я все делаю по стратегии 
235|08.03.2020 16:31:26|Dm Vl|конкретно я не про него но осторожно надо смотреть на результаты задним числом
237|08.03.2020 16:46:26|Soa|О Братья евреи решили сжалиться над человечеством. Падение индекса ТА 35 уже всего 3,2. Оле, оле оле оле. Еврейцы. Вперед. Можно сказать, мир спасен. bitkogan
238|08.03.2020 16:49:33|Alexey| Петр тоже считает что не всех еще засадили  может и не сразу минус 50
239|08.03.2020 16:52:05|Владимир Тутынин|Петр у нас кто Бондовик
240|08.03.2020 16:53:15|Ruslandd|РФ это не поможет. Нефть в пол, распродажа звр
241|08.03.2020 16:58:29|Alexey|Рсхб и Инвестнавигатор. Глава фикс деска в рсхб я так понимаю
242|08.03.2020 17:02:31|Владимир Тутынин|А мы споем песню  О Йемен Йемен Стань свободным Хочешь скинем тебе пару ракет
243|08.03.2020 17:02:40|Kotov|ДядяДенер на вторичке уже во вторник будет
244|08.03.2020 17:03:35|А что ты сделал для котэ!?|Пётр тёр Аванесян это инвнстнавигатор, управляющий в Рсхб
245|08.03.2020 17:06:31|Владимир Тутынин|Спасибо. Я помнил что ктото из профиков
246|08.03.2020 17:12:25|Даниил Иванов|в среду после обеда
247|08.03.2020 17:21:29|Ruslandd|Ну насколько страны увлеклись наращиванием своих золотых запасов, то вполне вероятно придется петь такую песенку
249|08.03.2020 17:24:20|laslo Fish|А как же палладий и акции обуви
250|08.03.2020 17:25:28|Alexey|Акции обуви 
251|08.03.2020 17:26:18|Paul Baikov|Мало упали, вот Газпром 
252|08.03.2020 17:26:53|Владимир Парцей|У меня по ним сейчас убыток в 15 Жду роста
254|08.03.2020 17:37:19|Alexey|Зависит от размера девала который будет
255|08.03.2020 17:39:54|Soa|Будут глубинные тектонические подвижки
256|08.03.2020 17:41:36|Alexey|Чуток иволга не успела разместиться
257|08.03.2020 17:41:53|Soa|это точно..
258|08.03.2020 17:43:11|Alexey|Рольф наверное пожизни Септему теперь должен. Надо было не 1,5 лишних ярда кинуть в толпу а все 10. Конец маний должен быть ярким
259|08.03.2020 17:47:09|Soa|почему Септему
260|08.03.2020 17:47:33|Alexey|Септем успел протащить их и еще и 1,5 лишних кинуть в рынок
262|08.03.2020 17:48:00|Soa|да
264|08.03.2020 17:49:15|Alexey|Примерно одинаковая ягода от кредитных денег физиков зависящая. Только у Рольфа еще и валютное все включая запчасти
265|08.03.2020 17:59:50|Dmitry Aleksandrov|Кстати, Калите и ИСП дешевая Нефть выгодна. Ибо покупатели  конечные пользователи топлива или другого нефтепродукта, и для них чем дешевле, тем лучше выше спрос. Ну и стоимость закупки соответствующе подешевеет
266|08.03.2020 18:00:31|Владимир Парцей|Резкое колебание стоимости серьёзного ущерба не нанесёт
267|08.03.2020 18:01:34|Dmitry Aleksandrov|Любое резкое колебание неприятно. Но оба нефтетрейдера уже пережили кризис 1416, и в целом готовились к возможным скачкам. В этом бизнесе нельзя быть не готовым
268|08.03.2020 18:02:33|Ruslandd|Конечные пользователи  это обычные автолюбители
269|08.03.2020 18:03:05|Dmitry Aleksandrov|Нет, в основном  сельхозники, грузоперевозчики, промышленные производители
271|08.03.2020 18:03:43|Сергей Конев|В России при падении цены на нефть цена на ГСМ точно не будет снижаться 
272|08.03.2020 18:04:27|Dmitry Aleksandrov|Ну это на колонках, тут немного другой нефтетрейдинг
274|08.03.2020 18:05:10|Ruslandd|Почему цены на бензин выросли Так цены на нефть высокие. Почему цены на бензин ещё сильнее выросли Так цена на нефть упала
275|08.03.2020 18:05:51|Сергей Конев|Это Россия, детка 
277|08.03.2020 18:07:26|Soa|А какая связь с ценой на нефть у акцизов
278|08.03.2020 18:07:38|Сергей Конев|Хотя конкретно у Калиты проблем от изменничества оптовых цен на нефтебазе не должно быть
279|08.03.2020 18:07:57|Soa|Табак или спирт подешевеютсигареты и водка тоже
281|08.03.2020 18:20:17|Ivan Moore|Буду ждать открытия фьючей амеров. Они покажу что можно будет ожидать на нашем рынке и облиг тоже.
283|08.03.2020 19:39:58|Evgenii K|Открывшийся Тель авив, имхо четко показывает направление
284|08.03.2020 20:02:05|Aleksandr|Калита и ИСП за валюту покупают нефть Или у них рублевая цена тоже упадет
285|08.03.2020 20:03:22|Dmitry Aleksandrov|Все в рублях, валютного риска нет
286|08.03.2020 20:13:46|Alexey|В общем у всех все будет хорошо. Надеюсь в это поверят все хотя бы до 10.30 вторника. 30 минут должно хватить
287|08.03.2020 20:20:51|Evgenii K| Алексей, ктото пакует вещички В целом, при хорошей сноровке и быстром клике, минуты 2 распродавать весь портфель
288|08.03.2020 20:22:43|Alexey|Допаковывает Иволга  любезно до сих принимала всю Обувь. Надеюсь и дальше продолжит делать то же самое. Удачи нам всем и нашим эмитентам без шуток.
289|08.03.2020 20:33:38|Evgenii K|А что значит принимала Обувь Я из облиг обуви давно ушел, а вот в акциях на 8 депо сижу.
291|08.03.2020 20:37:26|Alexey|Кто то очень благородно скупает бонды Обуви при любом приближении к номиналу.
292|08.03.2020 20:38:19|Ruslandd|Эту связь я не понимаю. Объясните
293|08.03.2020 20:38:36|Alexey|Вы большой молодец раз смогли удержаться когда вокруг была экзальтация. Без шуток. Осторожно не спалите эти 70 проц раньше времени. Будет много бычьих ловушек.
294|08.03.2020 20:39:36|Capricious|Всем нам надо не спалить.
295|08.03.2020 20:39:40|Soa|1 показатель влияющий на стоимость налог на добычу полезных ископаемых 30,59 2 показатель Акциз косвенный налог на товары, пользующиеся повышенным спросом 20,28 3 показатель НДС налог на добавленную стоимость 18,27 4 показатель себестоимость добычи нефти 6,85 5 показатель Прибыль продавцов в розничном и оптовом секторе  7,35 6 показатель Переработка, транспорт, хранение  9,61 7 показатель Затраты на содержание АЗС7,05 Данные согласно показателям, опубликованным Российским топливным союзом
298|08.03.2020 20:43:33|Ortemy Alexandrovich|Почему тогда при уменьшении цены ингридиента с удельным весом в 30 не падает стоимость конечного продукта
299|08.03.2020 20:44:20|Soa|вы думаете акцизы не умеют увеличивать
300|08.03.2020 20:44:55|Ortemy Alexandrovich|Нене, умеют конечно.
303|08.03.2020 20:46:46|Soa|вы цены на заправках видите
305|08.03.2020 20:48:56|Ortemy Alexandrovich|Вот хороший вопрос жеж
306|08.03.2020 20:52:11|Soa|все от туда же
308|08.03.2020 20:59:13|Evgenii K|Да, спасибо. Всю осень своего брокера слал на все его призывы прыгнуть в ралли словами  я жду кризис / я жду кризис. Про напутствие  спасибо. Вы полностью правы. В чт уже впрыгнул на несколь процентов в рынок,в пт уже списал убытки, не закрыв позиции. Во вторник еще будем падать. Мне урок, что все только начинается, а я должен еще затаиться хотя бы до середины апреля.
309|08.03.2020 21:00:56|Владимир Тутынин|
311|08.03.2020 21:03:36|Ortemy Alexandrovich|Т.е. весь рост 2019 просидели в кеше
313|08.03.2020 21:05:03|Alexey|Та35
314|08.03.2020 21:13:10|Владимир Тутынин|Вот же ж дожили принуждают старика из шавермнолизинговова мира смотреть всякие та35
316|08.03.2020 21:15:47|А что ты сделал для котэ!?|Писец  в стране бензоколонке И таки во вторник они им с нами поделятся
317|08.03.2020 21:16:44|Владимир Тутынин|Ты умный Кот, у тебя доллары есть
318|08.03.2020 21:18:30|MММ🥕🐹|на самом деле кот дегенерат подзастрявший в лонге но это секрет 
319|08.03.2020 21:19:48|А что ты сделал для котэ!?|Миха, ты вроде позиционируешь себя каксерьезный человек Зачем оскорблять друг друга
320|08.03.2020 21:20:30|MММ🥕🐹|Всегда отвечаю взаимностью  такие у меня принципы. 
321|08.03.2020 21:21:44|А что ты сделал для котэ!?|Спасибо, вопросов больше не имею
322|08.03.2020 21:26:23|Aleksandr|Кот, чо ты на него реагируешь Админам если даже пох на него, уж при том что он их поливал и в хвост и в гриву. Врач на больных не обижается.
323|08.03.2020 21:27:10|А что ты сделал для котэ!?|Я и не реагирую  просто уточнил причину столь неадекватного поведения На это дискуссия закрыта
324|08.03.2020 21:30:11|MММ🥕🐹|Удивительные животные эти коты  насрут под дверью и удивляются за шо тапкой по морде 
325|08.03.2020 21:31:27|Владимир Тутынин|Можно не в чате Даже если даже цветочка сегодня не подарили.
326|08.03.2020 21:55:46|Mikhail FarEast|То есть весь бычий тренд прошел мимо
328|08.03.2020 22:09:55|Alexey|Это был не тренд Теперь то мы это знаем
329|08.03.2020 22:14:54|Soa|Тренд, но он сломался
