|time|user|text
209|27.03.2020 08:58:00|Aleksandr|https//amp.rbc.ru/rbcnews/economics/27/03/2020/5e7c68c09a794763e902f6e8 
210|27.03.2020 08:58:29|Andrey Hohrin|не вопрос. 15 от ВВП  реальная перспектива
212|27.03.2020 08:59:56|Алексей ayaye :)|а чойто мы не цивилизованные 
213|27.03.2020 09:00:04|Andrey Hohrin|то, что они нас отрезали от внешнего финансирования в 2014 году  чуть ли не подарок, если оценивать ситуацию сейчас
215|27.03.2020 09:00:32|Aleksandr|А мне кажется что у нас может быть свой персональный кризис, связанный с ценами на нефть и возможными санкциями открытыми и скрытыми.
216|27.03.2020 09:01:18|Andrey Hohrin|санкций новых уже не придумать. да, и не время. нефть да, с ней засада. но отсутствие долга  слишком большой козырь
217|27.03.2020 09:01:30|Aleksandr|Ну это в том плане, что сейчас нам плохо, а могли бы и вообще в коллапс впасть. Положили бы наш финасовый сектор, это да.
218|27.03.2020 09:01:58|Andrey Hohrin|меня, на самом деле интересуют только 2 вещи инфляция и возвратность долгов.
219|27.03.2020 09:02:42|Harry Lime|1 вцелом решаемо , 2 не возможно повлиять
220|27.03.2020 09:02:55|Andrey Hohrin|пока не готов утверждать, если с этим значимая проблема или нет
221|27.03.2020 09:03:01|Aleksandr|Супер. А меня даже только возвратность долгов эмитентами Иволги. А инфляция уже как дождь за окном, принимаю как неизбежность.
222|27.03.2020 09:03:07|Andrey Hohrin|2. не соглашусь
223|27.03.2020 09:03:11|Tati A|Экономисты просчитали одну не рабочую неделю.... но есть уверенность, что она дальше не продлиться ещё на одну.. и ещё на одну... в Европе Италия и Франция, Испаниия уже продлевают карантин. Период инкубации вируса 2 недели, а президент обьявлает недельные каникулы...
224|27.03.2020 09:03:13|Andrey Hohrin|но пока не знаю, как
226|27.03.2020 09:04:09|Aleksandr|В подводной.
227|27.03.2020 09:04:38|Andrey Hohrin|герметичная посудина  в данном случае неплохой транспорт
228|27.03.2020 09:06:36|Aleksandr|К19
229|27.03.2020 09:06:45|Алексей ayaye :)|главное, чтоб кислорода хватило
230|27.03.2020 09:07:50|Harry Lime|Вы отчетность эмитентов почитывайте , только не на ночь , забудете про вирусы с карантинами.
231|27.03.2020 09:08:53|Andrey Hohrin|я все понимаю. и все же. именно сейчас или через пару месяцев даже при нынешней опе с большой буквы Ж никто в наших портфелях не грохнется. Это время для принятия антикризисных мер. Каких Я пока не знаю.
232|27.03.2020 09:10:01|Aleksandr|Скажите, капитан. У Вашей лодки есть какой то реальный шанс дойти на базу без дефолтов и рестрактов 
233|27.03.2020 09:10:48|Harry Lime|О , надо перечитать Реквием каравану PQ17.
234|27.03.2020 09:11:43|Andrey Hohrin|конечно.
235|27.03.2020 09:14:10|Zzz|Частникине связаны с общепитом, аптеками и тпв замкадье пока не все планируют отдыхать. Интересно, будут заставлять закрываться
236|27.03.2020 09:21:51|Евген Б| Тем временем, США обогнали Китай по количеству заболевших. Трамп утверждает, что это связано с массовым тестированием населения.
237|27.03.2020 09:22:17|Евген Б|USA is fist again
238|27.03.2020 09:39:50|Yaroslav|Очень интересно что по факту лизинги почти в конце рисковых отраслей вышли, как мне кажется в конце уже экзотика, например про медицинские компании.
239|27.03.2020 09:43:47|Paul Baikov|Дефолты по отраслям  это в процентах же
240|27.03.2020 09:43:52|Alexi|Это всётаки количество в штуках, не в  от общего числа компаний в секторе
241|27.03.2020 09:44:07|Paul Baikov|У. В штуках совсем не показательно
242|27.03.2020 09:44:15|Alexi|Манипуляции 
243|27.03.2020 09:44:44|Александр Шумаков|Ну, я думаю так, если элиты это не монолитное зло, а кланы, почему нет Большой передел
244|27.03.2020 09:46:19|Yaroslav|Аа Тогда возможно лизингов просто меньше. Хотя вот на вскидку сейчас в ВДО полно лизингов
245|27.03.2020 09:46:59|Alexi|Андрей, поясните пжлст. Дефолты в штуках или в 
246|27.03.2020 09:59:18|Andrey Hohrin|В штуках
247|27.03.2020 10:34:28|Aleksandr|Промсвязьбанк На текущий момент потенциал снижения кривой ОФЗ составляет еще порядка 5030 б.п. Вместе с тем, сегодня не исключаем сокращения длинных позиций на рынке после существенного роста за неделю.В случае ухудшения внешней конъюнктуры в рамках сегодняшних торгов американская валюта к концу дня попытается сделать шаг в сторону верхней границы диапазона 7580 рублей
248|27.03.2020 10:40:23|Александр Нечаев|А что за вчера с апри случилось Почему сегодня все двинулись на выход
249|27.03.2020 10:41:17|Dmitry Manzor|Не знаю. Сказали неделю дома сидеть, кто в коммуналках  начнут тарить квартиры со страшной силой после этой недельки. Плюс для АПРИ
250|27.03.2020 10:50:15|MММ🥕🐹|20 строек уже остановилось у всех застроев 
251|27.03.2020 10:52:24|Denis Ipatov|Из коммуналок в загородное жильё премиум класса не переезжают
252|27.03.2020 10:52:26|Andrey Hohrin|как раз про АПРИ. у них запас сданных квартир в апреле массовая сдача будет около 30 тыс.метров. Там что можно даже и не строить
253|27.03.2020 10:53:24|Aleksandr|Можно не строить чтоб обслуживать долг  Сдача квартир уже проданных
254|27.03.2020 10:53:24|MММ🥕🐹|Это в плюс, тем более сильнее всего пострадает сегмент премиума и бизнеса в жильё  уже продажи обвалились...
255|27.03.2020 10:54:15|Aleksandr|К тебе царь то приехал
256|27.03.2020 10:54:22|Andrey Hohrin|конечно.
258|27.03.2020 10:55:19|MММ🥕🐹|Нет  он отменил поездку на БКЛ и МЦД 
259|27.03.2020 10:55:32|Andrey Hohrin|я не подтверждаю. мне про бизнес и премиум говорят противоположное очень близкие люди. но провал будет. в этом я не сомневаюсь
260|27.03.2020 10:56:02|ОлегЕ.|не горизонт этого года звучало бы както пооптимистичнее
261|27.03.2020 10:56:19|Andrey Hohrin|дефолт  следствие накопленных убытков, избыточных кредитов, невозможности перекредитовки.
263|27.03.2020 10:57:23|MММ🥕🐹|Провал где то уже наступил а где то коварно поджидает, но от него никто не убежит. Я смотрю данные с контор типа Баркли и ещё ряда подобных им застроев.
264|27.03.2020 10:57:33|Aleksandr|Ситуация оказалась странно неоднородной по регионам.Именно в МСК бизнес раскупили, продажи выросли на 40
265|27.03.2020 10:58:31|Andrey Hohrin|та же информация. но это как про премиум продукт Пятерочки  гречку
267|27.03.2020 10:59:45|MММ🥕🐹|Если где у отдельных контор и выросли то это временно, потом будет пустота надолго.
268|27.03.2020 11:00:40|ОлегЕ.|там еще было  кашлял новый учитель Сергей Саныч. Актуально как никогда
269|27.03.2020 11:00:42|Aleksandr|На месте Апри , если допустим предположить остановку новой стройки , имеет смысл как то скопить кэш с продаж и откупить свой долг.Экономия то приличная выйдет.
270|27.03.2020 11:01:57|Andrey Hohrin| длинный долг откупать  это на рынке, где куча денег.
271|27.03.2020 11:02:45|Aleksandr|Я не понял мысль.
272|27.03.2020 11:03:37|MММ🥕🐹|Лучше всего устроился Дэнни  выкупает свой долг с дисконтом  сплошная халява 
273|27.03.2020 11:03:45|Andrey Hohrin|смысл в том, что облигации  длинное и безотзывное фондирование. которому сейчас конкуренты только позавидуют
275|27.03.2020 11:05:03|Aleksandr|Вопросов нет. Их можно выкупать с дисконтом.И долг этот дороговат. Ну если деньги в деле то ок, а если все встанет колом 
276|27.03.2020 11:05:25|MММ🥕🐹|Согласен  я их уважаю, особенно того кто придумал эту хитрую схему...
277|27.03.2020 11:05:43|Andrey Hohrin|встать могут только продажи. причины две банки убили ипотеку, продажники не продают. второе решается, первое решается через второе
278|27.03.2020 11:05:48|Aleksandr|Пашка Биленко наверно и придумал
279|27.03.2020 11:06:10|Andrey Hohrin|вот он, гений возможно, злой рынка ВДО
280|27.03.2020 11:07:29|Aleksandr|Отбивать затраты на покатушки в Краснодар тоже как то нужно было. Если б всех в Сочи позвали в сезон, то боюсь оферты были бы по 70
281|27.03.2020 11:08:07|MММ🥕🐹|12 Лямов только лишь с одного выкупа хороший бонус 
282|27.03.2020 11:08:52|Aleksandr|Расширенное толкование отчетности ждем сегодня 
283|27.03.2020 11:12:47|Andrey Hohrin|мы ждем, не могу утверждать. но напомнил уже коллегам из АПРИ
284|27.03.2020 11:15:57|Dmitry Manzor|У них есть эконом класс у Озера
285|27.03.2020 12:09:09|Aleksandr|ВТБ Капитал Учитывая вчерашнее ралли на всех долговых рынках стран ЕМ и опережающую динамику длинных ОФЗ, можно предположить, что в четверг неттопродажи иностранцев в ОФЗ могли смениться неттопокупками. Так это или нет, мы узнаем сегодня, когда выйдут свежие данные НРД.
286|27.03.2020 12:14:54|Alexander|Что значит слово нетто в данном контексте
287|27.03.2020 12:16:50|Aleksandr|Просадка  https//mobile.reuters.com/article/amp/idUSKBN21D0S8taid5e7dc0bcef5fb4000146a11bamputm_campaigntrueAnthem3A20Trending20Contentamputm_mediumtrueAnthemamputm_source
289|27.03.2020 12:23:11|MММ🥕🐹|Норвеги попали  Слава царю тупо копящему злато в мрачных подвалах ЦБ 
290|27.03.2020 12:26:31|Максим Воробьев|Потому что остались на всем свете лишь зима и война  из времен года... 
291|27.03.2020 13:24:18|會及Q及刄み會|Товарищи подскажите Неожиданно прилетела амортизация КАМАЗа на приличную сумму Что из облигаций можно прикупит корпораты в районе 9 по купону Вдо не предлогать...этого добра хватает 
292|27.03.2020 13:26:19|Иван|Мне РСХБ БО6Р нравится
293|27.03.2020 13:28:59|Rodan|я бы в банки сейчас на лез
294|27.03.2020 13:29:50|會及Q及刄み會|У меня есть Тинькофф Алфа и КамАЗ....все вроде норм пока держатся 
297|27.03.2020 13:30:25|Sergey Kozmin|Мечел16.
298|27.03.2020 13:32:13|Rodan|мечел почти банкрот... уж лучше шевченко какой 
299|27.03.2020 13:33:49|Sergey Kozmin|Мечел системообразующий, с ним ничего не случится.
300|27.03.2020 13:34:30|Дмитрий Федоров|А можно расшифровать для начинающего, это что за бумага
301|27.03.2020 13:35:16|Rodan|рестракт легко 
302|27.03.2020 13:52:51|Rost|Хаха ха
303|27.03.2020 13:55:49|Sergey Kozmin|Погашение меньше чем через год, все будет нормально с ним.
304|27.03.2020 13:57:21|Rost|редкая птица долетит до середины Днепра Я просто про уверенность, он в лучшие годы дышал как с пневмонией а сейчас нужно быть сильно уверенным что его кто то будет спасать в этом аду
305|27.03.2020 14:54:18|laslo Fish|Я это с другой стороны смотрю. Многие конторы выгоняют дивиденды за бугор. И текущий год  последний, предварительно, когда это можно сделать дёшево. Значит, даже с оглядкой на разрешенные отсрочки, есть высокие шансы на дивиденды как в последний раз. Но это только шансы. А вопрос зачем это государству  ну они периодически стреляют себе в ноги или фигачат по Воронежу  там своя логика, не всегда доступная
307|27.03.2020 14:57:48|Andrey Hohrin|так что уже прореживать в стране 350 банков осталось, кажись, всего
308|27.03.2020 14:58:33|Rodan|а не 590
309|27.03.2020 14:58:46|laslo Fish|Кругляком трюм набейте. И на плаву, без оглядки на дыры. А кругляк, похоже  бакс.
310|27.03.2020 15:00:07|Harry Lime|Так без бакса никуда в этой стране
311|27.03.2020 15:02:42|laslo Fish|У Сбера и ВТБ, на двоих, триллион прибыли. А так будет два. Два лучше одного Вполне хороший кусок, как цель.
313|27.03.2020 15:10:09|Rost|хитро 17 но оферта через год ломБ8
314|27.03.2020 15:10:20|Evgenii K|ОФФТОП по поводу поддержки бизнеса. Сегодня фейсбук покупал через них рекламу прислал сообщение, что они понимают как сложно СМП сегодня, и они пересчитали свои прошлые тарифы задним числом в пользу бизнеса, так как считают, что они были не совсем корректны, и особенно сейчас это своевременно. На счет упал почти 1М рублей. Грустно признать, но Фб поддержал бизнес больше чем собственное государство. Купить их акций что ли сегодня как спасибо
316|27.03.2020 15:14:16|Ortemy Alexandrovich|Хорошие бюджеты у вас
317|27.03.2020 15:15:07|Yevklid|Я бы так поправил  USA is fisted again
318|27.03.2020 15:16:10|Evgenii K|Да, 19 год был хороший. До конца с партнерами сами не верим такому подарку и все думаем, что мб какаято ошибка. Вернули все таки не 1 и не 2 от затрат.
319|27.03.2020 15:19:49|Евген Б|Почему так не понял, просвятите
320|27.03.2020 15:21:56|Yevklid|Прочтите, что Вы написали перепутали first первый и fist  кулак. Я немного поправил в контексте Вашей ошибки
321|27.03.2020 15:24:32|Евген Б|Да, first хотел
322|27.03.2020 15:28:20|Evgenii K| даже не буду говорить как это звучит на сленге
323|27.03.2020 15:40:41|Aleksandr|Напишите им , что так то вообще в суд хотели подавать на них за несправедливые тарифы. Пусть доплатят еще лям, раз осознали.
324|27.03.2020 15:43:06|Dmitry Manzor|это очень много. Нужна первая сотня
325|27.03.2020 15:43:21|Andrey Hohrin|типун Вам на язык
327|27.03.2020 15:52:00|Evgenii K| ну вот, теперь хотя бы знаем, кто оплатит неделю выходных
328|27.03.2020 15:52:01|Yevklid|Агонь же
329|27.03.2020 15:52:23|Evgenii K|ну да, опечатка смешная
330|27.03.2020 16:08:23|Mikhail Strovsky|Как раз купил немного Апри
331|27.03.2020 16:12:10|Dima Seleznev|Я знаю какой банк точно не разорится
333|27.03.2020 16:39:39|Andrey Hohrin|какой
334|27.03.2020 16:39:56|Dmitry Durandin|ЦБ
335|27.03.2020 16:40:05|Alexander Peshkov CEO TEHNOLEASING|
336|27.03.2020 16:40:06|Andrey Hohrin|мы тоже, кстати, покупаем. в пн планирую выпустить рекомендацию по этим бумагам
337|27.03.2020 16:40:12|Dima Seleznev|ПСБ
338|27.03.2020 16:40:18|Andrey Hohrin|ибо цены не там совсем
339|27.03.2020 16:40:18|Dima Seleznev|ПромСвязь
340|27.03.2020 16:40:28|Andrey Hohrin|почему
341|27.03.2020 16:40:31|Aleksandr|МОСКВА, 27 мар  РИА Новости/Прайм. Банк России предлагает распространить программу кредитных каникул для малого и среднего бизнеса на лизинговые сделки, заявила глава регулятора Эльвира Набиллиуна. Безусловно, мы поддерживаем и участвовали вместе с Минэкономразвития в разработке программы кредитных каникул, и здесь реструктурированные займы не будут признаваться таковыми. Мы предложили бы рассмотреть, чтобы распространить эту программу и на лизинговые сделки,  сказала она на заседании правкомиссии по вопросам конкуренции и развития малого и среднего предпринимательства. Глава ЦБ отметила, что многие предприятия малого и среднего бизнеса пользуются оборудованием, приобретенным в лизинг. По лизинговым обязательствам было бы возможно рассмотреть такую же возможность по отсрочке платежей, как и по кредитам. К нам тоже многие предприятия малого бизнеса обращались. Хотела бы, чтобы мы такое направление поддержали,  добавила Набиуллина.
342|27.03.2020 16:40:56|Andrey Hohrin|дальше, нужно субсидировать лизинги. и так  по кругу
343|27.03.2020 16:41:04|Dima Seleznev|Все наши военные заказы через него. Карманный.
344|27.03.2020 16:41:08|Mikhail Strovsky|Можно в целом уточнить, покупать далее рекомендуется
345|27.03.2020 16:41:52|Andrey Hohrin|ага, вопрос, какой выпуск и на какую долю, и за счет чего ибо для покупки нужно чтото продать
346|27.03.2020 16:41:53|Aleksandr|Дело в том , что кто то должен умереть , а кто то должен выжить безусловно
347|27.03.2020 16:42:03|Deni Le|Уважаемые Партнеры Сейчас, когда ситуация, связанная с вирусом COVID19 стремительно развивается, мы бы хотели обозначить свою позицию. Прежде всего мы говорим, что в сложившихся обстоятельствах нет ничего важнее Вашего здоровья и здоровья близких Вам людей. Пожалуйста берегите себя и будьте осторожны Вместе с тем мы понимаем, как важно обеспечить жизнедеятельность компании. Поэтому мы предпринимаем комплекс мер, чтобы создать для Вас максимально комфортные условия в этот не простой период. Мы попрежнему доступны для вас как и раньше. Деятельность компании, в связи с объявленными предстоящими выходными, не останавливается Мы выстроили свою работу таким образом, что сотрудники компании продолжат осуществлять свою деятельность, но при этом будут максимально защищены от вирусных заболеваний. Денежные средства для выплаты купонных доходов держателям облигаций БО 001P02, ISIN RU000A100W29, которая запланирована на 30.03.2020г. были направлены уже сегодня в национальный расчетный депозитарий НРД. Мы понимаем, как важно сохранить доверительные отношения, исполняя свои обязательства вовремя. Мы очень высоко ценим Ваше доверие нам. Команда Роделен и дальше будет делать все возможное в сложившихся обстоятельствах для того, чтобы сохранять партнерские доверительные отношения на высоком уровне, которые позволят Вам ощущать комфорт и спокойствие. С уважением, команда Лизинговой компании Роделен
348|27.03.2020 16:42:25|Andrey Hohrin|смерть финансовой системы  это общая смерть
349|27.03.2020 16:43:16|Mikhail Strovsky|Купил апри, которые каждый месяц купон дают, средства свежие внес
350|27.03.2020 16:44:02|Andrey Hohrin|ЗдОрово, Денис У меня, вообще, ощущение, что в как бы выходные никто отдыхатьто и не собирается. И это  отлично
