|time|user|text
271|26.02.2020 07:51:11|Olly Milly|Итак, для тех, кто не смотрел вчерашний вебинар Андрея Хохрина,  Иволга планирует два размещения на март. Оба размещения на 300 млн. Каждое размещение продлиться примерно неделю, в один день размещаться не планируют. Один из эмитентов, скорее всего, АО им. Т.Г. Шевченко. Для Шевченко это будет последний займ, так как, по словам Андрея, компания больше одного небольшого размещения позволить себе не может. Второй эмитент  новый. Это нефтетрейдер, не ИС Петролеум. крупнее ИС Петролеума раза в четыре. Одно размещение уже согласовано с биржей на 17 марта. Дата второго  пока не установлена. Может раньше 17го, может  позже. Более подробная информация от Иволги будет через пару дней.
272|26.02.2020 07:55:51|Anton M|Спасибо
273|26.02.2020 07:56:23|Andrey Belous|Благодарствую.
274|26.02.2020 07:57:42|laslo Fish|Для любителей лм ко15 фраза последний займ будет звучать подозрительно.
275|26.02.2020 08:02:35|Olly Milly|разная природа бизнеса, разные возможности 
276|26.02.2020 08:08:18|Владимир Парцей|Объективно. Ограничивать заимствования эмитента  отличная идея.
277|26.02.2020 08:10:41|"PRObonds | LIVE"|прогнозытренды повесткадня И всетаки коррекция Волна неприятностей дошла и до российских биржевых активов. С начала недели индекс гособлигаций снизился на 0,2, индекс корпоративных облигаций  на 0,1, сектор высокодоходных облигаций  на 0,3. Не впечатляет. Другое дело, акции. Здесь падение по индексу МосБиржи  3,3, до 3 003 п., по индексу РТС  5,1, до 1 446 п. Все это на фоне снижения нефти в понедельниквторник с 57 до 55 долл./барр. для сорта Brent и в законном сопровождении ослабления рубля до 65,3 единиц за доллар с 64,2. Как реагировали участники на происходящее, и, собственно, что произошло https//www.probonds.ru/posts/292ivsetakikorrekcija.html
279|26.02.2020 08:14:11|Ruslandd|Что произошло Да пар чуток спустили. Сегодня подрастём
280|26.02.2020 08:16:54|Sheld|Не рано
281|26.02.2020 08:17:35|Andrey Hohrin|Мне кажется, сейчас никто не будет прав ни тек, кто предрекают падение, ни те, кто ожидает роста. Получим нервную такую волатильность.
284|26.02.2020 08:19:08|Александр Глебов|Можем в боковик уйти до хороших времен.
285|26.02.2020 08:19:53|Ruslandd|Жду отскок
286|26.02.2020 08:20:06|#Любопытный|Пассажиров ссаживают перед див сезоном. Пермэергосбыт ап 4вчера,до 7доходил в моменте
287|26.02.2020 08:20:17|Olly Milly|а я еще крестиком вышивать умею.  пользуйтесь
289|26.02.2020 08:21:35|Sheld|Кстати, подскажите, вчера доходности вдо подросли или только акции падали
290|26.02.2020 08:21:55|Andrey Hohrin|выросли и доходности
291|26.02.2020 08:23:00|Alex|Вряд ли Шевченко. Андрей обещал только один выпуск. Не обманывает же в концов концов
292|26.02.2020 08:23:25|Georgii|на оскоке корекци если сегоднязавтра будет стоит из лонгов по акциям выходить что бы войти через недельку на следующей волне
293|26.02.2020 08:23:28|Sheld|Не заметил сразу ссылку на статью https//www.probonds.ru/posts/292ivsetakikorrekcija.html 
294|26.02.2020 08:24:07|Andrey Hohrin|Пока ориентируемся на 2 выпуска в течение марта. Раскроемся чуть позднее, когда будут все детали согласованы.
297|26.02.2020 08:25:19|Andrey Belous|Минималка по всем выпускам будет
298|26.02.2020 08:27:26|Andrey Hohrin|300 бумаг на первичном рынке. Но я думаю, на вторичном будет нормальная возможность к покупке.
300|26.02.2020 08:31:58|Andrey Belous|Благодарствую
301|26.02.2020 08:40:59|Serge R.|За вторичку уважаю Иволгу. 
302|26.02.2020 08:41:42|Andrey Hohrin|Стараемся
303|26.02.2020 08:43:04|Rost|Вы глупости говорите, ломаете саму облигационную парадигму.
304|26.02.2020 08:46:28|Olly Milly|подскажите, пожалуйста, ктонибудь ЛизингТрейд в FlashTraderNews2Bot видит Не могу найти компанию не по названию, не по id.
307|26.02.2020 08:58:43|laslo Fish|А через недельку будет дешевле или дороже
308|26.02.2020 09:02:04|Georgii|Хороший вопрос. Насколько понял Ответ Андрея вчера  не заходить ли в акции сейчас пока просадка шансы неплохие что будет дешевле. Знать бы хоть распределение вероятностей иначе прямо непонятно что делать покупать/продавать/держать закрыв терминал и отключив новости сказав что разумный инвестор, а не спекулянт не должен суетится из за колебаний
309|26.02.2020 09:06:52|Владимир Парцей|Почему Можете в личку написать
310|26.02.2020 09:11:54|laslo Fish|Так зайдите на треть предполагаемой позиции
311|26.02.2020 09:48:43|Шура SiberianRanger|Спасибо за инфу 
313|26.02.2020 10:32:17|Yuriy Skopylatov|Странно, в рамках логики увеличения объемов выпусков всего 300 млн на каждый. Учитывая дефицит размещений, должны быстро разобрать.
315|26.02.2020 11:05:23|Alex|Звоните своему брокера и выясняйте  сайт раскрытия информации Брусники.
316|26.02.2020 11:49:37|Soa|В сегодняшней ситуации и неделя оптимистично.. Даже интересно.
317|26.02.2020 12:13:55|YYY|Брусника интересна, а вот нефтетрейдеры не очень.
318|26.02.2020 12:20:38|Alexey|И есть шанс что переподписки закончились
319|26.02.2020 12:22:43|YYY|Не знаю , ни сбер, втб, бкс ничего не дают
320|26.02.2020 12:41:27|"PRObonds | LIVE"|обувьроссии Мы повышаем свою оценку справедливой стоимости акций ГК Обувь России. С учетом предварительных итогов деятельности группы компаний за 2019 год. Цена повышена с 80 до 86 рублей, на 7,5. Следующий пересмотр справедливой стоимости ожидается в конце марта, по факту публикации стратегии развития Группы.
324|26.02.2020 13:09:08|Rost|Ну вот, размещения пошли косяком, грачи прилетели уже три от двух ВДО трейдеров Где деньги Зин
325|26.02.2020 13:11:19|Soa|полная уверенность
326|26.02.2020 13:19:56|Dmitry Manzor|Обычно оценку понижают при неблагоприятной конъюнктуре, а тут повышение
327|26.02.2020 13:25:58|Harry Lime|Художественное литье в стаканах , а минздрав предупреждал
328|26.02.2020 13:27:15|Andrey Mayorov|и 5 марта, тот кто не успел купить Ломастера имеет шанс на вторичке собрать хороший портфельчик
329|26.02.2020 13:27:39|Alexey|Еще неск дней паники на рынках и премию мусору придется повысить чтобы разместиться
330|26.02.2020 13:27:41|Harry Lime|Се ля ви
331|26.02.2020 13:29:49|Andrey Mayorov|ориентиром будут завтра книги самолета и легенды, по их результатам будут ориентироваться остальные
332|26.02.2020 13:29:54|Rost|Да все разместится .. даже FF а вот про кал тема для обсуждений 
334|26.02.2020 13:36:15|YYY|Если ценник будет интересный , почему бы и нет. Бодяга с вирусом возможно яйки кому то и прижмёт 
335|26.02.2020 13:47:17|Alexey|Как узнаем что орги взяли на себя а потом в стакан польют
336|26.02.2020 13:51:13|Andrey Mayorov|по максимальным сделкам и количеству сделок.
338|26.02.2020 14:57:53|Evgeniy Averchenkov|А что размещается 5 марта
339|26.02.2020 15:09:19|Mikhail Saratov|Самое главное, чтобы не оказалось, что палладий помогает от короновируса
340|26.02.2020 15:32:28|#Любопытный| НОРНИКЕЛЬ ОЖИДАЕТ В 2020 Г ДЕФИЦИТА НА РЫНКЕ ПАЛЛАДИЯ В ОБЪЕМЕ 0,9 МЛН УНЦИЙ  КОМПАНИЯ
341|26.02.2020 15:49:27|Dmitry Manzor|Конечно ожидает, надо же свой продукт подороже продать
342|26.02.2020 16:06:38|Rinad|Народ что думаете про облигацию легенда которая сейчас размещается Под 11
343|26.02.2020 16:08:44|Harry Lime|Поиск по чату реально рулит
344|26.02.2020 16:08:51|Rost|Думаю легенда .
345|26.02.2020 16:09:19|Harry Lime|Как тут не вспомнить прекрасный зомбихоррор Ялегенда.
347|26.02.2020 16:10:10|Rost|только вчера показывали по ТВ6 , но где мой купон круче
348|26.02.2020 16:10:58|Harry Lime|Предлагаю отобрать название ГМК у Норникеля и закрепить за где мой купон
350|26.02.2020 16:16:35|Rost|Кстати о птичках,  Вкусвил сегодня из каждого утюга льется, отжег Ритейлер Вкусвилл впервые получил более 1 млрд выручки за год  1,28 млрд в 2019 году
351|26.02.2020 16:17:45|Andrey Mayorov|и куча претензий со стороны антимонопольных комитетов сша и европы
353|26.02.2020 16:48:30|Владимир Тутынин|И сейчас бы он был как Русал под внешним управлением
355|26.02.2020 18:24:38|Rost|А что Потанин тоже личный банкир Пэже Вообще я восторгаюсь им, так грамотно построить права собственности, что даже Высокий суд жену послал на 50 
356|26.02.2020 19:22:20|Шура SiberianRanger|Первичка 26 февраля
357|26.02.2020 19:45:12|Илья|если слишком небольшой, то тебе не дадут. тинькоф
358|26.02.2020 19:46:27|Harry Lime|И не надо , он в надежных руках
359|26.02.2020 19:46:31|Владимир Тутынин|Атеисты
360|26.02.2020 19:47:14|Dmitry Manzor|
361|26.02.2020 19:47:50|Илья|а чо легенды нет я уже заявки в тиньке заявку подал
363|26.02.2020 19:48:29|Harry Lime|Так даже даты техразмещения вроде нет
364|26.02.2020 19:49:05|Владимир Тутынин|Можешь вписать пустую строчку
366|26.02.2020 20:11:12|Harry Lime|Мне кажется тиньку в скрипт общения после есть ISIN  надо добавить  а если найду 
368|26.02.2020 23:25:24|Александр|если бы не Тинькоф было бы иногда скучно, особенно когда сбер не работает пол дня и можно хоть переключиться на приколы с тиньковым
370|27.02.2020 00:03:45|İldar Rafikov|Грёбаный Тинькофф, украл у меня в банкомате пол пачки купюр. Благо хоть номиналом в 50 р. Все обращения в поддержку не дали эффекта. Типа по итогам инкассации денег в купюроприемнике не обнаружено А если бы я пачку 5 тысячных туда сунул Даже плюшевый Татфондбанк в подобной ситуации по камерам нашёл человека который забрал деньги и вернул их. Делаем выводы господа Тинькофф банк не для крупных сумм. Всё остальное чз кассу других банков.
371|27.02.2020 00:07:02|Илья|кучу раз вносил сотни тысяч и все было норм
372|27.02.2020 00:10:27|Vadim|мутная история какаято. а как произошло, можно подробнее
373|27.02.2020 00:11:34|Soa|тоже самое..и через их банкомат и через партнеров
374|27.02.2020 00:20:23|İldar Rafikov|Просто денег пачкой сунул, на брокерку хотел закинуть. Аппарат долго их там крутил, потом написал ошибка. Звонок в поддержку, ожидание... Разберемся и тд. Тянули неделю, потом отписались что они из 200 купюр типа обнаружили только 164. 36 купюр типа нет. Вот весь разговор. По камерам типа мы не можем видить что вы там клали, а инженеру нашему мы доверяем больше чем вам. И да, я тоже много раз клал много тысяч в эти банкоматы. Но теперь не буду этой мостурбиной заниматься
376|27.02.2020 01:57:26|ALIEN|На то и существует Олежка банк
379|27.02.2020 06:22:02|"PRObonds | LIVE"|портфелиprobonds вдо Нельзя сказать, что коррекция фондового рынка не отразилась на высокодоходном облигационном секторе. Отразилась. Это неплохо видно по накопленным доходностям изменение цены тела и накопленный купон входящих в портфель PRObonds 1 облигаций. Впрочем, сам портфель реагировал на просадку спокойнее. Хеджирующая позиция, пусть и совсем небольшая, частично компенсировала снижение. Пока портфель остается без изменений. Но после 10 марта начнутся перестановки добавится 2 новых выпуска, уменьшатся доли имеющихся. Доходность последних 12 месяцев  15,8. Ориентир будущей доходности  1214 годовых.
384|27.02.2020 09:58:44|Paul Baikov|По облигациям предусмотрена возможность досрочного погашения по усмотрению эмитента в дату окончания 6го, 9го, 12го, 18го, 24го купонных периодов. CALLоферта, как я понимаю
386|27.02.2020 10:18:06|Olly Milly|Интересно, какое настроение у ИС ПЕтролеум , не планирует ли он воспользоваться грядущей офертой, AndreyHohrin 
387|27.02.2020 10:19:32|Dmitry Aleksandrov|Пока планов таких нет. Оферта планировалась под IPO, соответственно до формализации сроков и планов по нему оферт никаких не будет
388|27.02.2020 10:19:47|Andrey Hohrin|Это будет зависеть от готовности к IPO. Точнее сказать нельзя.
389|27.02.2020 10:20:22|Olly Milly|спасибо. волнительно сидеть на крючке каждый квартал
390|27.02.2020 10:36:16|Paul Baikov|Юниметр01 вообще каждый месяц такая оферта с июня
391|27.02.2020 11:03:59|Alexander|А что за калита и mizotty И может быть уже известно когда будет Шевченко
392|27.02.2020 11:07:04|Oleg|Калита из краудлендинга приходит, подросла значит
394|27.02.2020 11:08:14|Aleksandr|Ну вот у них одна из целей выпускагашение займов от физиков
395|27.02.2020 11:09:12|Alexander|А ещё такой вопрос, не маленький ли купон для Шевченко Текущий 13.4 доходность, а тут 12.5
396|27.02.2020 11:09:14|Ирина|С языка сняли
397|27.02.2020 11:09:15|Oleg|ну там займ копеечный  три штуки на 10 млн тотально
398|27.02.2020 11:09:33|YYY|брусника в ВТБ на размещении появилась 10
399|27.02.2020 11:11:35|Harry Lime|Маленький , но физики же все с,едят , правда 
400|27.02.2020 11:11:48|Dmitry Manzor|А когда ориентировочно будут ответы от эмитента Есть какаянибудь инфа
401|27.02.2020 11:11:53|Capricious|это которая вся из себя эскроу уже давно
402|27.02.2020 11:12:23|Harry Lime|Ass crow
403|27.02.2020 11:12:55|YYY|это святая правда
404|27.02.2020 11:12:59|Alexander|Что за компаниято, можете ссылку на их сайт дать
405|27.02.2020 11:13:41|Oleg|http//kalitagroup.ru/
406|27.02.2020 11:13:47|Harry Lime|Спасибо , а мы с коллегами мозг сломали , не могли вспомнить , где видели их презу
407|27.02.2020 11:13:47|Dmitry Manzor|Самый привлекательный выпуск пока у ДядиДё, 13.5 купон
410|27.02.2020 11:15:16|Harry Lime|Оно
411|27.02.2020 11:15:59|Oleg|бухотчётность ещё есть на 3кв 19г
413|27.02.2020 11:16:49|YYY|у Гарри с обзора Джилида выходит закономерность, чтоб фармацевтика была прибыльной, она не должна делать суппер эффективные лекарства
415|27.02.2020 11:17:41|Harry Lime|Джаст бизнес
416|27.02.2020 11:17:52|Oleg|а МОТОРНЫЕ ТЕХНОЛОГИИ001Р02 планируются когда в табличке пока их не видно...
417|27.02.2020 11:18:07|Harry Lime|А они есть
419|27.02.2020 11:20:11|Alexander|Mizotty это моторы 
420|27.02.2020 11:20:33|Oleg|Чёрт С лупой нужно смотреть
421|27.02.2020 11:21:05|Capricious|вопрос что из этого стрельнет , не в ногу 
422|27.02.2020 11:21:15|Vadim Brohkin|https//penzapost.ru/news/17122019/52076
423|27.02.2020 11:21:34|Oleg|Народ начал дербанить Калсбыт  собирает кубышку потихоньку
424|27.02.2020 11:21:42|Harry Lime|Мэйк май дэй 
425|27.02.2020 11:24:14|Михаил|Когда уже наши смогут в нейминг
426|27.02.2020 11:26:48|Harry Lime|А чем Калсбыт и Калита не устраивают 
427|27.02.2020 11:27:57|Михаил|Уж лучше быть Калсбытом, чем Мизотти
428|27.02.2020 11:33:52|Владимир Парцей|Вопросы уже отправил. Представитель подготавливает ответы.
429|27.02.2020 11:34:43|Eugeni Schukin|да, тоже там ее видел
430|27.02.2020 11:34:57|Sergey S|То есть ктото в текущих условиях берет фридом на размещении Да уж..
431|27.02.2020 11:44:17|Светлана|Доброе утро, и какие выводы по компании для себя сделали В портфель зайдёт или не Альфа
432|27.02.2020 11:44:53|Harry Lime|Все зависит от ставки , но риск немалый там
433|27.02.2020 11:56:33|Светлана|На чем основано такое мнениеочень удивленно
434|27.02.2020 11:57:01|Михаил|Я про названия, не про эмитентов
435|27.02.2020 11:58:32|Светлана|Это знАчимое уточнение
436|27.02.2020 12:02:34|Кирилл|Никель, Палладий
437|27.02.2020 12:02:34|Кирилл| никель индонезия вирус металлы The Press власти Индонезии вследствие вспышки заболевания коронавирусом в Китае будет, вероятно, задержано развитие никелевых проектов стоимостью около 11 млрд.
438|27.02.2020 12:02:47|YYY|Тут один канадец задался вопросом а вы думали куда пойдут деньги с облигационного рынка, их же там пропасть  Интересны вопросик 
439|27.02.2020 12:22:13|Даниил Иванов|Можете прокомментировать, почему не нужно брать
440|27.02.2020 12:53:29|sasha bav|Тоже интересно ....
441|27.02.2020 12:56:41|Владимир Тутынин|Ну, если коррекция и дальше будет так шагать , то такую доходность и рейтинговые дадут
442|27.02.2020 12:59:26|Alex|А что не так Я беру.
443|27.02.2020 13:01:06|Harry Lime|Я вижу это подругому. Не дадут . Или точнее дадут , но далеко не все. Сейчас принято лечить кризис ликвидностью , так что увидим скорее снижение доходности. Кроме того мировой тренд  бегство в бондовое качество , другое дело оно может местами оказаться не очень. Какогонибудь ОКея или Азбуки я бы избегал в любом варианте
444|27.02.2020 13:03:19|Владимир Тутынин|Мне очень обидно за ОМ. Как полагаешь, снизят ставку
445|27.02.2020 13:03:58|Harry Lime|Полагаю до 14 или даже ниже
