|time|user|text
520|08.01.2020 17:49:14|Paul Baikov|Не, смысл что гдето у Вас ещё будет прибыль, а тут убыток, они сальдироваться будут
521|08.01.2020 17:49:16|Dm Vl|Берем первую, она короче
522|08.01.2020 17:52:44|coolfire|А понял спасибо
523|08.01.2020 17:53:26|Yaroslav|Кстати очень интересная, хотя и простая мысль. Спасибо Мне пока рано париться за налоги  не так их много, но на будущее пригодится.
524|08.01.2020 17:53:38|coolfire|Разобью запланированных под эту облигацию сумму на 2 части и куплю обе 
525|08.01.2020 17:54:02|會及Q及刄み會|Капец сработали стопы по Мечел преф....акций все меньше и меньше Вот что теперь купить товарищи  С лета в минусе немалом был
526|08.01.2020 17:56:35|Dm Vl|Это тейкпрофит называется
527|08.01.2020 17:56:40|Oleg|6 января в БКС Роделен купон свалился
528|08.01.2020 17:57:46|Paul Baikov|Это который от 31.12 же
529|08.01.2020 17:57:47|Марк Цало|нужно было указать брокера. у меня Открытие.
530|08.01.2020 17:58:44|Dm Vl|Зачем Смысла ни какого, тем более один эмитент
531|08.01.2020 17:59:17|Марк Цало|кстати, а этот Роделен в Открывашке упал на счет 30 декабря в момент закрытия сессии.
532|08.01.2020 17:59:30|Oleg|так написано было  БКС 
533|08.01.2020 17:59:48|Paul Baikov|А в ПСБ 31.12 и упал, день в день, первый раз на моей памяти такое
534|08.01.2020 18:02:11|Oleg|Если написано Предусмотрена возможность досрочного погашения облигаций по усмотрению эмитента в дату окончания 6го, 8го и 10го купонных периодов. и эмитент принимает решение по досрочному погашению  значит ли это, что любой желающий с любым количеством может заявиться и сдать облигации по номиналу Или эмитент сам выбирает, или брокер какая практика
535|08.01.2020 18:03:26|Dm Vl|Любой с любым Если так и ничего больше не написано
536|08.01.2020 18:04:12|Шура SiberianRanger|Даже заявляться не нужно, облигации отберут, денег напихают
537|08.01.2020 18:05:01|Oleg|а если эмитент решит досрочно гасить, то он гасит 100 выпуска, или могут быть варианты
538|08.01.2020 18:07:23|Olly Milly|Народ, просветите, как Мосбиржа купон считает Для примера Шевченко в табличке выше  вариант Мосбиржи в Квике 33,66 р., а расчетный  34,75 или 34,28 в зависимости от базиса 360/365 дней.
539|08.01.2020 18:09:07|Dmitry Manzor|я смотрю на выходных кто чем загоняется
540|08.01.2020 18:10:25|Olly Milly|Ну не всё же купоны пришлине пришли жевать. Хотя.... те же купоны, только в профиль.
541|08.01.2020 18:10:46|Шура SiberianRanger|там 13.5
542|08.01.2020 18:11:18|Oleg|у меня в Квике 28.11 НКД кажет
543|08.01.2020 18:11:36|Paul Baikov|Это текущий же, не
545|08.01.2020 18:11:47|Paul Baikov|А так 33.66, 13.5
546|08.01.2020 18:12:00|Oleg|да, теущий
547|08.01.2020 18:12:30|Paul Baikov|Вроде бы тут раньше писали, что 100 должен погасить
548|08.01.2020 18:14:35|Olly Milly|Верно. 13,5.... Ох уж эти праздники..... Сошлось.
549|08.01.2020 18:15:12|Paul Baikov|А прям интересно, почему Вы рассматривали вариант с 360 дней в году
550|08.01.2020 18:15:22|Шура SiberianRanger|Такое бывает
551|08.01.2020 18:15:49|Paul Baikov|В облигациях именно Однако.. Ни разу не встречал
552|08.01.2020 18:16:18|Шура SiberianRanger|http//cbonds.ru/glossary/actual360
553|08.01.2020 18:17:27|Paul Baikov|Понял, спасибо, для еврооблигаций значит, не добирался до них
554|08.01.2020 18:17:38|Olly Milly|Базисов больше чем два.
555|08.01.2020 18:18:04|Paul Baikov|Ага вижу, там по ссылке в pdf расписано
556|08.01.2020 18:18:31|Шура SiberianRanger|Тут можно почитать как оно вообще бывает https//en.wikipedia.org/wiki/Day_count_convention
557|08.01.2020 18:19:01|Olly Milly|Или вот еще варианты
558|08.01.2020 18:20:13|Paul Baikov|Каждый день чтото новое узнаю 
559|08.01.2020 18:24:55|Olly Milly|Кстати, ограничение Эксела. Финансовые функции в нем не работают с бумагами с периодичностью купона чаще чем 4. Вот и приходится для бумаг с месячными выплатами формулы громоздить. B13VLOOKUPTradingLogC13Спр_БумагиA7S1016FALSEROUNDDOWNB13VLOOKUPTradingLogC13Спр_БумагиA7S1016FALSE /VLOOKUP TradingLogC13Спр_БумагиA7S1014FALSE0VLOOKUPTradingLogC13Спр_БумагиA7S1014FALSEVLOOKUPTradingLogC13Спр_БумагиA7S1012FALSEVLOOKUPTradingLogC13Спр_БумагиA7S1013FALSE /365 
560|08.01.2020 18:26:11|Светлана|Обратите внимание на дату выпуска бумаги/налогообложение по купону у них разное
561|08.01.2020 18:35:23|coolfire|От налога освобождаются только после 17 года
562|08.01.2020 18:51:41|Шура SiberianRanger|Первичка 8 января
563|08.01.2020 20:16:34|Sky|Который вроде растет...
564|08.01.2020 21:58:27|Alex|Кстати крутая задачка. В зависимости от стратегии держателя решение получается разным
565|08.01.2020 22:08:08|Светлана|Почему в этом вопросе Вы полагаетесь на ответ совершенно незнакомого Вам человека вместо поиска полной информации из официальных источников , начиная от сайта налоговой и заканчивая своим брокеромнесколько недоумевая ...кстати, с брокером лучше всего общаться по теме налогообложения именно в письменном виде и сохранять всю историю перепискидоброжелательно
566|08.01.2020 22:13:40|Soa|А если брокер письменно введет вас в заблуждение по налогообложению Вы думаете что то изменится
567|08.01.2020 22:14:38|Светлана|Чувствую разговор не по теме идёт...
568|08.01.2020 22:15:32|Soa|зачёт
569|08.01.2020 22:19:46|Paul Baikov|Вообще некоторые части НК разные брокеры трактуют поразному, и по факту в ФНС у них все нормально. Не этот вариант выше, конечно на том же банкиру были варианты Смысл есть уточнить у своего брокера по тонким вопросам
570|08.01.2020 22:21:07|Eugeni Schukin|я бы посмотрел в сторону SBMX ..
571|08.01.2020 22:21:56|Ortemy Alexandrovich|gtНизкая комиссия  не более 1,1 бугагага
572|08.01.2020 22:36:00|Eugeni Schukin|чую, это мне  ну да, а что делать. у нас у всех она  1 ..
576|09.01.2020 04:37:52|Anatoly Chernov|8.01 вроде бы должны были упасть купоны от АПРИ 2 но чтото не вижу. Может ктото прояснить ситуацию. Брокер Тинькофф
577|09.01.2020 04:39:28|會及Q及刄み會|Так может выходные... У моего брокера точно....я и не парюсь
578|09.01.2020 04:42:21|Viacheslav Petriaev|Сто раз было и вот опять. Купоны с 1 по 8 января начиная с 9 числа будут приходить. И по этим бумагам торги не работали в праздники тоже
579|09.01.2020 07:26:51|"PRObonds | LIVE"|Начать трудовые будни нового года хочется с юридической защиты владельцев облигаций. В отличие от кредитного анализа или управления капиталом, в этом вопросе мы весьма слабы. Тогда как критику а в адрес представителей владельцев или проведения общих собраний владельцев облигаций слышим периодически. Давайте разберем технологии разумного поведения на случай облигационных проблем, да и просто разберемся с правами владельцев и их эффективной защитой . И своими силами, и с привлечением специалистов от юриспруденции и регулятора. Чтобы не наговорить лишнего и ненужного, будем опираться на Ваши вопросы. Для этого, пожалуйста, на пришлите нам эти вопросы, а также истории из собственной практики, требующие разбора или давшие важный опыт, на адрес hohrinivolgacap.com 910 января собираем Ваши сообщения. С 1315 января приступаем к методологии защиты.
581|09.01.2020 08:22:18|"PRObonds | LIVE"|Еще раз приглашаем Вас на нашу YouTubeплощадку . Нас там уже почти 3 000 В наступившем году мы меняем сетку видеоконтента. До сих пор здесь проводились онлайнобзоры наших портфелей, иногда  разбирались технические вопросы инвестирования в ценные бумаги. Плюс мы интервьюировали наших облигационных эмитентов. И это останется. Но добавится много нового. Из нового в январе  Интервью с идеологом российских высокодоходных облигаций Дмитрием Адамидовым,  Документалистика о становлении и современности мирового рынка мусорных облигаций,  Истории жизни выдающихся инвесторов Джона Темплтона, Майкла Милкена, Джорджа Сороса,  Антирейтинг биржевых прогнозов и биржевых аналитиков. Подписка  здесь https//www.youtube.com/c/PRObonds
583|09.01.2020 08:38:04|Владимир Тутынин|Даже FlashTraderNews8Bot не спасает
586|09.01.2020 08:58:05|Andrey Hohrin|насколько тут подходит ирония... хотя считаю, что с офертами Дэни справится.
587|09.01.2020 09:00:45|Aleksandr|https//www.shoesreport.ru/articles/prodazhi/vsya_pravda_o_skidkakh_kogda_skidki_opasny_i_pochemu_obuvnomu_reteylu_ne_stoit_imi_uvlekatsya/
588|09.01.2020 09:01:08|Владимир Тутынин|Это первая такая история за тот год с небольшим который я с вами. Мне интересны были бы комментарии, особенно, если на январской тишине котировки восстановятся
589|09.01.2020 09:56:10|!|AndreyHohrin как лонг палладия поживает
590|09.01.2020 09:57:05|Andrey Hohrin|шорт т.е. так себе поживает. Портфель ПРОбондс 2 потерял на этой сделке около 1,2
591|09.01.2020 09:57:36|Privet|Не пора закрывать позицию
592|09.01.2020 09:58:23|Andrey Hohrin|я никого ни к чему не призываю. но я или буду ее увеличивать, или сохранять. ошибка есть. но важен результат. а результат всегда должен быть положительным.
593|09.01.2020 10:02:39|Privet|Первый выпуск обуви ктото 100 лотов по 115 взял. Оголодали за праздники 
594|09.01.2020 10:05:55|Светлана|Это тот, кто ИИС по типу А в прошлом году открыл и не успел закупиться. Именно эти люди в 2020году снизят доходность по всем бондам в два разасубъективно...С обычным брокерским счётом останется выбирать или первичка ВДО , или депозит
595|09.01.2020 10:06:42|Serg|Игрища США с Ираном к сожалению были непредсказуемы
596|09.01.2020 10:07:28|Andrey Hohrin|бОльшая часть моих позиций от этого выиграла
597|09.01.2020 10:14:11|Вrus|Тинькофф косячит немного с купонами. У меня вообще пропали сегодня погоню их искать
598|09.01.2020 10:47:50|Владимир Тутынин|Умение резать тоже умение
599|09.01.2020 10:48:28|Andrey Hohrin|Пока до этого далеко
601|09.01.2020 11:35:45|"PRObonds | LIVE"|Сегодня в 1900 по МСК в прямом эфире PRObonds Андрей Хохрин с темой Портфели PRObonds итоги 2019 года и антирейтинг биржевых прогнозов  Результаты портфелей PRObonds 1, 2, 3  Какими будут новые портфели  Полезные и вредные прогнозы биржевых аналитиков  https//youtu.be/ZdzUeMpVYEY
602|09.01.2020 11:35:53|Alex|объемы которые принесут эти люди на рынок облигаций голубых фишек кажутся мизерными рассуждая. А вот в третьем эшелоне могут и порезвиться...
603|09.01.2020 12:35:56|Olly Milly|https//yandex.ru/search/textD0BED0B1D18AD0B5D0BC20D0BED184D0B720D0B220D0BED0B1D180D0B0D189D0B5D0BDD0B8D0B8202019amplr213 Яндекс еще работает
604|09.01.2020 12:37:37|Антон|
605|09.01.2020 12:39:47|Kir|О, Владимир хотел спросить сколько процентов годовых получили по вашей див стратегии за прошлый год
606|09.01.2020 12:40:13|Шура SiberianRanger|
607|09.01.2020 12:43:36|Владимир Тутынин|Прошлый год не является показательным
608|09.01.2020 12:44:35|Andrey Hohrin|а всётаки
609|09.01.2020 12:57:03|Владимир Тутынин|Тогда divitrader
611|09.01.2020 13:01:26|Dmitry Manzor|дивидендный урожай по принципам fightMan
612|09.01.2020 13:05:46|Владимир Тутынин|А зачем так усложнили Взяли бы стратегию того у кого выше доходность и не парились
613|09.01.2020 13:06:38|Bugsy|По морковникову не планируете торговать
614|09.01.2020 13:09:19|Olly Milly|ненавязчивая реклама
615|09.01.2020 13:09:59|Bugsy|Не могу, секретная стратегия. Поспрашивайте у моих коллег
616|09.01.2020 13:10:22|Aleksandr|Такая , со стопятого . А я еще думаю зачем мужчина в чате появился
618|09.01.2020 13:12:39|Антон|У нас тут стратегия от Иволги только работает исправно
620|09.01.2020 13:12:50|Olly Milly|Да вы второй день уже отвечаете на то, что интересно людям. Как вчера зарегистрировались, так и пошли нахраписто так интерес поджигать. С места в карьерс.
621|09.01.2020 13:13:05|Владимир Тутынин|Я с этими господами не знаком. Но с точки зрения множеств, остается Морозова.
622|09.01.2020 13:13:24|Aleksandr|Я против рекламы.Я обычный участник желающий только нужно информации
623|09.01.2020 13:14:22|Антон|probonds
624|09.01.2020 13:15:09|Владимир Тутынин|У нас женский чат
625|09.01.2020 13:15:44|Aleksandr|нет, мужчина  новый пользователь.Была бы женщина , написал бы женщина
627|09.01.2020 13:17:33|Антон|Сейчас опять зальют колхоз, только дышать начал
628|09.01.2020 13:18:07|Владимир Тутынин|А что случилось
629|09.01.2020 13:18:39|Aleksandr|Какие ВДО держите в портфеле у себя 
631|09.01.2020 13:22:09|Владимир Тутынин|Там не было ВДО
632|09.01.2020 13:22:23|Dmitry Manzor|О как, попадос
633|09.01.2020 13:23:56|Владимир Тутынин|Так что там с Шевченко
634|09.01.2020 13:24:24|Антон|http//sugar.ru/node/29931
637|09.01.2020 13:27:40|Dmitry Aleksandrov|Не вижу причин для опасений. На свеклу идет порядка 20 земель, при необходимости их легко перепрофилировать
638|09.01.2020 13:29:19|Soa|и что
639|09.01.2020 13:29:41|Антон|Ничего
640|09.01.2020 13:29:52|Aleksandr|Падение выручки , не 
641|09.01.2020 13:32:01|Владимир Тутынин|На перепрофилирование нужен кэшфлоу, который нужен нам
642|09.01.2020 13:32:12|Dmitry Aleksandrov|Нет причин для этого, по 3 кв как по выручке, так и по прибыли положительная динамика, а колебания цен по продуктам  обычное явление. Если это долгосрочный тренд  площади перераспределтся под другие культуры. Как колхоз поступит в конкретной ситуации  зададим вопрос
644|09.01.2020 13:34:08|Виталий|А это про кого обсуждение
645|09.01.2020 13:34:15|Dmitry Aleksandrov|Шевченко
646|09.01.2020 13:41:57|Владимир Тутынин|Бот сообщает что обувь вошла в МФК. А зачем
647|09.01.2020 13:47:20|Olly Milly|Да всё просто. Мне не нравится, когда злоупотребляя либеральностью владельцев чата, некоторые пользователи используют его для рекламы собственных проектов. Я в этом чате относительно давно, ценю его за полезную информацию и не люблю, когда под видом такой информации и дискуссий мне начинают впаривать рекламу. Такого рода псевдодискуссии, начинающиеся с элементарных вопросов об объемах ОФЗ, как сегодня, засоряют чат и затрудняют мне пользование этим чатом. Вот это и не нравится. Здесь, кстати, есть участники, имеющие собственные проекты и ссылающиеся на них. Но, в отличие от вас, эти пользователи уже годдва приносят пользу сообществу ВДО бескорыстно делясь знаниями и информацией. Кроме того, их проекты дополняют тему ВДО, а не уводят в сторону. И, насколько я знаю, ссылки на эти проекты размещаются здесь с разрешения владельцев чата.
648|09.01.2020 13:50:03|Антон|Дмитрий, планируются ли в январе размещения от вас
649|09.01.2020 13:50:27|Dmitry Aleksandrov|Планируется, уже была в чате информация о регистрации
651|09.01.2020 13:51:15|Harry Lime|Да , будет Оскар
652|09.01.2020 13:52:17|Антон|Ничего не находит в чате по этому слову, спасибо за подсказку
653|09.01.2020 13:53:47|Aleksandr Boychuk|Антон, немного терпения, скоро раскроем информацию. И слова Оскар в наименовании эмитента нет, можете не искать...А то бы Дикаприо все выкупил
654|09.01.2020 13:54:36|Антон|Понял уже, что афоризм от Гарри
655|09.01.2020 13:57:25|Владимир Тутынин|А зачем вы его разозлили странным вопросом про объём ОФЗ
656|09.01.2020 13:59:06|Sergey S|Уважаемый,вам бы остановиться претензиито по существу, в целом
657|09.01.2020 14:00:02|Olly Milly|Ну что ж, успехов вам тогда. И в пользованиями Яндексом тоже. 
658|09.01.2020 14:01:03|Sergey S|Согласен
659|09.01.2020 14:02:25|Светлана|Впервые кто приходит на рынок берут по названиям, которые на слуху и узнаваемы это будут ОФЗ, Сбер, РЖД и далее по всем голубым ...хотя Ваш вариант , безусловно, хотелось бы 
660|09.01.2020 14:05:23|Владимир Тутынин|Почему Этот вариант породит новые выпуски с меньшими купонами. Имхо.
661|09.01.2020 14:09:30|Sergey S|Зачем такие крайности  либо ВДО, либо депозит Есть же нормальные корпоративные облигации, с меньшей доходностью чем у ВДО, но зато с меньшим кредитным риском. Ими можно разбавлять либо портфель ВДО, либо портфель, условно,ОФЗ добиваясь требуемого уровня риска и доходности
662|09.01.2020 14:20:06|Светлана|Речь о предположительном прогнозе из расчёта что произойдёт если ИИСОВЦЫ типа А  новичкивойдут на рынок это, возможно, повлечёт втаптывание голубых до доходности ноль, так как налоговый вычет в голове новеньких автоматически ошибочно естественно прибавляет к текущей доходности в стакане плюс 13 с первого же года и из соображений безрисковости будут брать именно известные бренды  соответственно с обычным брокерским счётом останется или ВДО, или депозит. предполагаю субъективно исходя из общения с теми,кто приходит учиться инвестировать
663|09.01.2020 14:24:10|Владимир Тутынин|На ИИС столько денег нет чтоб верх втоптать. Да и наличие вычета спровоцирует к риску. За себя говорю.
664|09.01.2020 14:24:33|Виталий|С учетом всех статей в интернете  это будут массовые закупки ОФЗ
