|time|user|text
696|19.01.2020 22:12:01|Dmitry Aleksandrov|1 У этого нет задней мысли, примечания раскроем, проблем нет 2 Банк туда не консолидирован, это другое направление. Аудитор это подробно описывает в заключении бизнесы независимы, ЛТ никаким образом операционно с банком не пересекается, только получает дивиденды. Внутренних расчетов нет. Поэтому и отчетности нужно рассматривать отдельно 3 Все кредиты привязаны к лизинговым сделкам, прямо график раскрывать не планировали, во многом изза того, что он динамичный управление денежными потоками  главная работа любого лизинга и равномерный 4 Исключительно на лизинговые сделки, это принципиальный момент. Банк не может быть профинансирован по нескольким причинам  График таков, что при намерении отдать в банк, он не удобен ежемесячный купон и погашение  Ковенанты по банковским кредитам не позволяют делать дальнейшие финвложения  Компания планирует рейтингование и долгую работу с облигациями план  30 от портфеля пассивов в облигациях, если компания начнёт с невыполнения своих обещаний, долгой работы не построить
697|19.01.2020 22:15:02|Максим Воробьев|Основной оборот по лизинговым сделкам ЛТ проводит через свой банк
698|19.01.2020 22:28:20|Dmitry Aleksandrov|Нет, банк сильно ограничен лимитом по ЛТ, 5 от портфеля ЛТ. А операции всегда проводятся через кредитующий банк.
699|19.01.2020 22:32:29|YYY|А кто входит в кредитующие Лимиты можно указать 
700|19.01.2020 22:33:05|Dmitry Aleksandrov|Конечно, все есть в презентации
701|19.01.2020 22:33:21|YYY|Ок
704|19.01.2020 22:42:33|Максим Воробьев|Не слайд а наглядное пособие по диверсификации источников фондирования. 
705|19.01.2020 22:50:20|YYY|Рентабельность за 18 15,87 ,госбанки в фондирования 10  Я правильно понял
706|19.01.2020 22:52:34|Dmitry Aleksandrov|Рентабельность чего Про госбанки  около того, и это хорошо. Для меня, например, очень важно, что их японцы кредитуют. Не часто у эмитентов ВДО встретишь дочки иностранных банков в кредиторах. Это и диверсификация, и качество
707|19.01.2020 22:55:13|YYY|Рентабельность бизнеса, ну а японцы тоже разные есть, фиг знает где они фонду получили их тоже могут резануть .
708|19.01.2020 22:57:07|Иван|Кстати по поводу учёта сделок и ведения портфеля есть неплохой бесплатный инструмент, который я проверял на своей табличке в екселе   wealthadviser.ru .
710|19.01.2020 23:04:45|Eugeni Schukin|Дмитрий, посмотрел ролик и возник вопрос если на данный момент кредиты от банков дешевле, чем облигации, зачем облигации нужны ЛТ 
713|19.01.2020 23:09:17|Vladimir Nabatchikov|Закрыть в январе 21 можно. Требование придёт, деньги выводить с ИСС до закрытия нельзя.
714|19.01.2020 23:09:57|Eugeni Schukin|ага, т.е. если закрывать в январе 21, то требование не придет, так 
715|19.01.2020 23:10:09|Vladimir Nabatchikov|Верно.
716|19.01.2020 23:10:17|Eugeni Schukin|благодарю
719|20.01.2020 00:35:43|Eugeni Schukin|а вот такой вопрос еще  если я в конце этого года внесу 400к, то на след. год можно будет вычет сделать  И если да, то когда тогда закрывать ИИС в январе или после вычета 
720|20.01.2020 01:05:53|Nik Alex|Вычет сделать можно. ИИС можно закрывать через три года после открытия. Например открыли 05.12.20, закрыть можно 06.12.23.
721|20.01.2020 06:29:00|Denis|Это точно Вроде же по календарным годам считается.
722|20.01.2020 07:08:55|Alexey Z|По календарным годам считаются суммы внесения и вычет, положенный по ним. А закрытие счета, как выше указано.
724|20.01.2020 08:01:54|Dmitry Aleksandrov|SBI Bank принадлежит японскому SBI Holding. Весьма респектабельная группа. А по рентабельности все же не понял. Прибыль выросла, выручка тоже. Какой именно показатель падает
726|20.01.2020 08:29:01|"PRObonds | LIVE"|прогнозытренды Всё выше, всё тревожнее Кризисное мышление предполагает, что в большинстве финансовых явлений обладатель этого мышления видит предпосылки к будущим проблемам. Сейчас кризисное мышление присуще большинству участников глобального финансового рынка, российским участникам в особенности. И пусть эксперты говорят о фондовой эйфории. Это слова на ветер, пока нет подтверждений. Фондовый рост есть, а подтверждений эйфории нет. Впрочем, беспечность способна прийти на смену тревожности в течение всего нескольких дней. А тяготение к тому, чтобы, наконецто расслабиться, спокойно покупать фондовые активы и получать от этого удовлетворение, есть. Учитывая ценовые уровни, а большинство биржевых инструментов растут в цене не менее года, спокойствие, беспечность и, возможно, та самая эйфория сыграют злую шутку с покупателями. Однако смены эмоциональной полярности все еще не произошло. Кризисное мышление превалирует. Соответственно, менять направления трендовых прогнозов по большинству прогнозируемых активов рано. Ставки на продолжение роста сохраняются для индексов SampP500 и IMOEX аналогично, для RTS. Сохраняются ожидания дальнейшего укрепления рубля к доллару и евро. Есть ощущение, и ощущением можно ограничиться, что продолжение роста индексов и укрепления рубля будет недолгим и серьезно не отклонит цены от нынешних значений. Парадоксальной по отношению к отечественному фондовому рынку и рублю остается оценка динамики нефти. Дальнейшее снижение ее котировок все еще является наиболее вероятным сценарием ближайших дней. Инерция есть и в прогнозировании пары EURUSD. За отсутствием достаточной аргументации можно ограничиться ожиданием продолжения главенствующего тренда. А тренд последних двух лет  нисходящий. Пересмотр оценки касается золота. Металл находится в тенденции роста с середины 2018 года, постепенно накапливает перекупленность, но ставки на разворот тенденции до сих пор давали отрицательный результат золото, наряду с палладием  единственные биржевые инструменты, прогнозирование которых принесло убытки. Возможно и вероятно, момент смены тенденции с растущей на падающую для золота еще не наступил. Рублевые облигации. Рынок, от ОФЗ до высокодоходного корпоративного сегмента остается здоровым и спокойным. Ценовой сдвиг вверх в конце декабря  начале января создал предпосылки для ухода облигаций в боковую динамику котировок и доходностей. AndreyHohrin https//www.probonds.ru/posts/245prognozynanedelyuvsyovyshevsyotrevozhnee.html
727|20.01.2020 08:54:34|"PRObonds | LIVE"|портфелиprobonds сделки Спекулятивный портфель 3 держит реальную доналоговую доходность выше 19 годовых. Теперь даже просадка в 4, что уже случалось, не упустит доходность ниже 12 годовых. Доля прибыльных сделок и недель тоже радует. Сегодня позиции сохраняются неизменными за исключением золота здесь короткая позиция меняется на длинную.
728|20.01.2020 09:01:18|"PRObonds | LIVE"|портфелиprobonds сделки торговыйэксперимент обувьроссии Экспериментальный портфель 3.1, куда на треть капитала включены акции Обуви России тоже завершил неделю в плюсе. Коэффициенты качества прогнозирования здесь выше, чем у портфелядонора 3, в силу безубыточных недель по акциям Обуви России. Доходность пока оценивать рано, слишком короток срок. Но началось ведение портфеля очень удачно.
729|20.01.2020 09:05:40|Kotov|Дэниколл оферта сегодня должна быть
730|20.01.2020 09:09:07|Григорий Мошорин|21 вроде
731|20.01.2020 09:21:30|Иван|А что если, учитывая моду на отставки, завтра состоится импичмент Трампу, тогда минипаника на рынках, индексы вниз, доллар вверх, золотопалладий в космические дали.
732|20.01.2020 09:38:20|Aleksandr|Nordea предлагает продавать EURRUB, чтобы максимизировать кэрри, с целью 66.15 и стопом 69.70, учитывая сильную сезонную составляющую для рубля с 15.01 по 31.03, благоприятную ситуацию с долларовой ликвидностью для кэрри трейд
734|20.01.2020 09:46:16|#Любопытный|Это про бабушку и вторичные половые признаки.
735|20.01.2020 09:51:55|А что ты сделал для котэ!?|Считаете, что Путин отправит Трампа в отставку В Ясенево, мемуары писать А кого на место Трампа назначит
736|20.01.2020 09:52:41|Иван|Ну тут многоходовочка напрашивается
737|20.01.2020 09:55:15|Aleksandr|Хохрина. Там нужен человек со знанием рынка.
738|20.01.2020 09:57:46|Шура SiberianRanger|
739|20.01.2020 09:59:33|А что ты сделал для котэ!?|Полонского
740|20.01.2020 10:00:48|Aleksandr|Он судим же , там незя помоему. А на изменение конституции США ушлоб много сил и времени у Путина. Поэтому все таки Хохрин оптимальней.
742|20.01.2020 10:05:14|Alex|Вам вроде и не предлагают
743|20.01.2020 10:06:18|Ruslandd|Нужно уметь читать между строк
744|20.01.2020 10:13:45|Aleksandr|Да , между строк сильно расширяет возможность интерпретаций. Можно Хохрина затюкать за фразу доброго дня , главное между строк нужное вычитать, не отвертится.
745|20.01.2020 10:34:52|Ortemy Alexandrovich|AleksandrBoychuk AndreyHohrin кажется стоит попросить товарища успокоится
746|20.01.2020 10:36:06|Dmitry Manzor|За рекламку то надо отбашлять
747|20.01.2020 10:51:10|"PRObonds | LIVE"|априфлай АО АПРИ Флай Плэнинг раскрыло существенный факт  решения общего собрания акционеров. ...По вопросу 4 повестки дня принято решение Избрать Совет директоров Акционерного общества АПРИ Флай Плэнинг в следующем составе 1. Букреев Александр Сергеевич 2. Володарчук Сергей Анатольевич 3. Карабинцев Дмитрий Анатольевич 4. Овакимян Алексей Дмитриевич 5. Савченков Владимир Васильевич 6. Хохрин Андрей Витальевич. .. Взаимодействие с эмитентом со стороны Иволги Капитал стало более тесным. Оцениваем это как плюс для надежности и развития эмитента http//www.edisclosure.ru/portal/event.aspxEventIdftaw79Pq9EmtkPHb2bGpAwBB
749|20.01.2020 11:23:02|Dmitry Manzor|Пока палладий растет со все большим ускорением каждый день, физические лица на ФОРТС преимущественно шортят это движение.
750|20.01.2020 11:23:56|Шура SiberianRanger|П А Л Л А Д И Й 
751|20.01.2020 11:26:44|Alexi|Нельзя не отметить, что А.Хохрин набрал больше всех голосов 
752|20.01.2020 11:45:16|Doctor|Надеюсь иволга понимает, что помимо взаимодействия, она ещё получила и ответственность за деятельность компании. Члены совета директоров могут привлекаться к субсидиарной ответственности в случае банкротстве эмитента. Ни в коем случае не прогноз, но чтоб в курсе были...
753|20.01.2020 11:47:53|Aleksandr|А там Хохрин как физ.лицо или как представитель Иволги 
754|20.01.2020 11:50:10|"PRObonds | LIVE"|портфелиprobonds В портфелях высокодоходных облигаций  1, 2  все еще без изменений. Портфель 1, состоящий исключительно из ВДО, в годовых, подступил к 16. Портфель 2, имеющий спекулятивную короткую позицию во фьючерсе на палладий, опустился в годовой доходности до 13 годовых. На наступающей неделе или в начале следующей недели в портфелях появятся облигации дебютного выпуска ООО ЛизингТрейд. Доля выпусков других лизинговых компаний при этом уменьшится. Скорее всего, уменьшение долей коснется облигаций всех входящих сейчас в портфели лизингодателей.
759|20.01.2020 11:52:59|"PRObonds | LIVE"|аналитика лизинг лизингтрейд Сравнение показателей лизингов из сектора ВДО На этот раз  без интерпретаций, только цифры. Данные приведены за 6 мес. 2019, чтобы была сопоставимость показателей между всеми компаниями и с Рэнкингом Эксперт РА  https//www.raexpert.ru/ratings/leasing/1h2019 . Так как данные приведены за половину года, отношение выручки к портфелю само по себе ничего не говорит, задача  сравнить показатели в секторе, и с ней показатель вполне справляется. По Лизинг Трейду приведена начальная доходность к погашению при покупке бумаги на размещении. /Размещение облигаций ООО Лизинг Трейд запланировано на 23 января/ Aleksandrov_Dmitry
760|20.01.2020 12:18:47|Aleksandr|ING  сальдо тек счета в 2020 г может составить 45 млрд против валютных интервенций в объеме 50 млрд и чистого оттока капитала в 20 млрд.
762|20.01.2020 12:23:37|Andrey Hohrin|эх
763|20.01.2020 12:50:44|Rost|Но тем не менее, следует отметить с долей юмора, что номер в списке 6 
764|20.01.2020 12:55:28|Andrey Hohrin|доля юмора есть, согласен 
765|20.01.2020 13:13:39|Aleksandr| палладий мнение металлы пузыри макро warning Палладий начинает смахивать на ПУЗЫРЬ  https//t.me/MarketDumki/1522   палладий и все остальные товары   аналитики уверены  ВНИМАНИЕ ПУЗЫРЬ НЕ ЗНАЧИТ, ЧТО ЦЕНЫ НЕ МОГУТ ВЫРАСТИ ЕЩЕ НА 100200300  вспомните биткоин
766|20.01.2020 13:14:23|Aleksandr|Цены на палладий развивают новый виток ралли Палладий продолжает расти в цене. К понедельнику, 20 января, стоимость металла составляет 2286, что является очередным максимумом. Помимо ключевого драйвера, о котором мы говорим не первый месяц  повышенный спрос на палладий со стороны сектора автомобильной промышленности создает ажиотажный интерес к металлу  появляется и вытекающий из него драйвер. На рынке расширяется дефицит предложения палладия, что вполне закономерно. Кроме того, поставщики палладия обращают внимание, что производство металла снижается. Один из основных игроков в мире палладия  Южная Африка  отчитался о снижении производства металлов платиновой группы. В ноябре эта группа металлов, куда входит палладий, демонстрировала снижение выпуска на 13,5 в годовом сопоставлении. Спрос же на тот же палладий растет, например, в среднем на 30 в год. Тот факт, что Китай и США все же подписали первую фазу торговой сделки, тоже сработал в пользу роста цен на палладий. Поднебесная отметила, что продажи автомобилей больше не будут падать так, как это происходило ранее. В то же время, в Китае вступают в силу новые требования к стандартам автомобильных выбросов, и это также поддерживает цены на палладий. Ориентиром сейчас выступает область 2350 для палладия, но если рынок продолжит получать столь позитивные новости, новой целью роста станет 2500.
767|20.01.2020 13:18:51|Dmitry Manzor|Андрей, а вы на какой цене закроете шорт
768|20.01.2020 13:19:44|Aleksandr|Ему нужна победа, одна на всех, он за ценой не постоит
769|20.01.2020 13:20:35|Dmitry Manzor|постоит 10 надо держать доху портфеля.. не меньше
770|20.01.2020 13:23:17|Максим Воробьев|Тогда gmkn в лонг придется взять 
771|20.01.2020 13:30:44|Иван|Судя по всему при достижении целевого показателя в 4 гдето 2533.33
772|20.01.2020 13:32:41|Soa|Давайте уж лучше про Дэни...
773|20.01.2020 13:34:18|Andrey Hohrin|Я сегодня еще раз взглянул на портфель 2. нет там пока никакой трагедии
774|20.01.2020 13:49:06|А что ты сделал для котэ!?|Завтра
775|20.01.2020 14:12:27|Aleksandr|ING ожидает паузы 7.02 от ЦБР. Новый премьер не исключил смягчения бюджет правила,что на практике будет означать снижение при проч равных условий обьема интервенций.Не исключаем повышения отсечки на 5,что сократит годовой обьем интервенций примерно на 10 млрдс 50 до 40 млрд . ING говорит , что может улучшить ожидания по курсу рубля примерно на 12/барр. При этом слабый текущий счет указывает на то, что даже в этом сценарии риски ослабления рубля во 23 кв 2020 сохраняются.
776|20.01.2020 14:19:39|Дмитрий Адамидов|Так если выкупа со стороны ЦБ валюты будет меньше, почему бы рублю падать наоборот, предложение валюты вырастет
777|20.01.2020 14:25:17|Aleksandr|Вероятно ожидается что продажи выручки упадут еще сильней. Есть мнение что валюты мы зарабатываем меньше год от года
778|20.01.2020 14:26:27|Дмитрий Адамидов|непонятно на чем основанное
780|20.01.2020 14:33:53|Aleksandr|А отток капитала нужно учесть еще
781|20.01.2020 14:37:28|Дмитрий Адамидов|ну это такое же ... почти пальцем в небо. Набор исходных предпосылок определяет результат. Никто не знает какой будет цена на нефть, никто не знает какой будет отток капитала или вообще приток и т.д.
782|20.01.2020 14:45:17|Ivan Moore|Всем привет. Ктото смотрел нафтатранс Обнаружил в тиньке,13 ,месячный купон,стоимость 10к.
783|20.01.2020 14:49:51|Rost|У нас нет Тинька, к счастью
784|20.01.2020 14:53:05|Ivan Moore|почему к счастью
785|20.01.2020 14:53:50|Harry Lime|А что вам больше нравится  нафта или транс 
