|time|user|text
1|06.03.2020 14:05:33|Harry Lime|Фабоцци норм , какие вопросы 
3|06.03.2020 14:10:15|Andrew Kozacha|Коллеги, привет Подскажите пожалуйста, в чем фишка Есть бумага ВЭБа выпуск 9 ru000a0jrcx7, с датой выплаты купона 19.03.20 и НКД...0 рублей. Почему так
4|06.03.2020 14:19:20|Andrey Yurtaykin|периодически вижу такие баги именно с НКД, поскольку они во всех источниках  то источник биржа а не брокер
5|06.03.2020 14:21:40|Andrew Kozacha|Да, я перепроверил информацию на МОЕХ. И там тоже самое. Т.е. это не какая то хитрая схема раньше заплатили купон или проблема эмитента, а просто некорректная информация
6|06.03.2020 14:29:02|Rost|А чё такое, где паника, почему не продают, всех первой волной убило
7|06.03.2020 14:31:13|Dmitry Manzor|А где лучше
8|06.03.2020 14:32:12|Rost|вот у амеров 14 потфеля в акциях и половина ДД на их совести
9|06.03.2020 14:38:54|Даниил Иванов|До конца дочитали 
10|06.03.2020 14:39:18|Sergey|Гляньте на дату отсечения  по некоторым бумагам она на 2 недели раньше даты выплаты
11|06.03.2020 14:44:57|Paul Baikov|На bonds.finam.ru вроде все нормально показывает по ней, 40.96 НКД, торгуется Т
13|06.03.2020 14:51:57|Harry Lime|Рынок облигаций да , в случае проблем со сном принимать по 5 страниц
14|06.03.2020 15:01:53|Andrew Kozacha|Может они не тянут информацию с биржи, а рассчитывают сами Но вобщем выглядит странненько. Спасибо за инфу
15|06.03.2020 15:02:22|Paul Baikov|Ну там итоги торгов, не сами они их придумывают же 
16|06.03.2020 15:40:15|Andrey Hohrin|P.S. подумал  и открыл терминал Шевченко тоже продал 
17|06.03.2020 15:40:27|Andrey Hohrin|Есть такое слово паника. Оно.
19|06.03.2020 15:45:01|Владимир Парцей|Скоро будет два размещения Шевченко и ООО КАЛИТА. Опубликовал гайд по покупке облигаций на первичном размещении. Прочитать можете по ссылке https//t.me/RuBonds/166 Если ссылка не открывается можете найти его вручную, зайдя на канал RuBus1997
20|06.03.2020 15:46:24|Paul Baikov|Эх опять не дождаться паники, не дают по 95 закупиться
21|06.03.2020 15:47:13|А что ты сделал для котэ!?|Слова не мальчика но мужа. Вот в ттомтчто в понедельник не будет в РФ дяди Коли мы точно можем быть уверены 
22|06.03.2020 15:52:44|Dmitry Manzor|а Шевченко то чем жмёт то новый выпуск на дворе, рефинанс
23|06.03.2020 15:56:51|IURII D.|
24|06.03.2020 15:58:38|Dmitry Manzor|что за мода делать выходные в понедельник уже второй раз наблюдаю
25|06.03.2020 16:00:56|Pavel|Бумага с 10го по 19ое число в приостановке вероятно, дата фиксации списков, а 9го выходной. НКД Биржа показывает на дату исполнения сделки, но не более, чем на несколько 1012 дней вперед. поэтому НКД на дату исполнения нулевой на сайте, хотя на самом деле он не такой. считайте сами
26|06.03.2020 16:23:17|Владимир Тутынин|Это лучше, чем запрещать шорт
27|06.03.2020 16:23:59|Alexey|Мы еще не там
28|06.03.2020 18:05:42|А что ты сделал для котэ!?|Цветы тарим
29|06.03.2020 19:04:06|Шура SiberianRanger|Первичка 6 марта
30|06.03.2020 19:07:32|А что ты сделал для котэ!?|Интересно, что Калсбыт сделал с полученными 616 млн
31|06.03.2020 19:08:26|Aleksandr|Сбыл
32|06.03.2020 19:41:05|Владимир Тутынин|Парни кто сталкивался Вот закрыли FxUk. Финекс сообщил что 18февраля проводит расчеты. Когда средства окажутся у российского брокера
33|06.03.2020 19:53:05|Kir|С таким ещё в РФ никто не сталкивался. В етф чате прикидывали дней двадцать что ли
34|06.03.2020 19:53:33|Шура SiberianRanger|
35|06.03.2020 19:53:50|Kir|Лучше всего у техподдержки финекса спросить
36|06.03.2020 20:03:47|il drago|PIKK Группа ПИК продала первые франшизы на свои технологии. Группа получила более 200 заявок от компаний из России и других стран.  Ведомости
37|06.03.2020 20:21:16|Evgenii K|похоже в этих бумагах нет анерезидентов институционалов б очкующих инвесторов, которые из приложения Тинька покупают и продают на эмоциях. Как вывод, те кто сидел на проценте так и продолжают сидеть, не суетясь. Главное, чтобы у этих ребят с бизнесом все ок было.
38|06.03.2020 20:24:36|Harry Lime|Бинго , вся идеология ВДО в одном посте 
39|06.03.2020 20:25:20|Алексей ayaye :)|я думаю, влияние на бизнес будет, но отложенное. еще немножко можно посидеть. в валюту всё равно поздно перекладываться, акции  рано 
40|06.03.2020 20:27:00|Andrey Belous|Добавлю. Не всегда всё так, но в теории это так.
41|06.03.2020 20:28:09|Evgenii K|к сожалению, соглашусь, что рано или поздно прилетит и этим бизнесам, даже если они решительно из других индустрий. В нашу рашу последствия больших событий в азиях и америках обычно через 612 месяц прилетают . Что в 97, то в 2007/8, что кажется, даже сейчас.
42|06.03.2020 20:30:43|Andrey Belous|Почему поздно и почему рано
43|06.03.2020 20:32:18|Алексей ayaye :)|ну сомневаюсь, что доллар сильно вырастет. и как раз думаю, что много плохих новостей для акций впереди, попадают еще
44|06.03.2020 20:34:30|Andrey Belous|Доллар же будет расти, если акции будут падать или наоборот
45|06.03.2020 20:36:23|Алексей ayaye :)|сомневаюсь, что все можно так просто описать 
46|06.03.2020 20:38:19|Andrey Belous|Я думаю, что не стоит сравнивать ВДО и волатильность на рынке нефти, доллара и т.д.
47|06.03.2020 20:42:43|Владимир Тутынин|В ВДО испытанием будет третья волна. Потому что основа ВДО рефинанс. Вот тут будет и нефть и доллар при чём.
48|06.03.2020 20:44:16|Ilia|У меня были, д/с упали в личный кабинет и отражаются на брокерское счета в фунтах 
49|06.03.2020 20:45:22|Владимир Тутынин|А валютный счет сбербанка позволяет иметь фунты
50|06.03.2020 20:47:50|Ilia|Невкурсе, у меня ВТБ
51|06.03.2020 20:48:24|"PRObonds | LIVE"|новостиэмитентов февраль Февраль получился не самым ярким месяцем для эмитентов с точки зрения инфоповодов, но важным для оценки деятельности в прошлом году и создания планов на будущее. Рыночная негативная динамика не помешала компаниям идти в нормальном русле развития бизнеса, а также развивать его и выходить на новые направления деятельности.
59|06.03.2020 20:48:38|Шура SiberianRanger|СПРАВЕДЛИВО
63|06.03.2020 22:02:44|А что ты сделал для котэ!?|Кому нибудь попадалось простое объяснение системы налогообложения российской нефтянки в плане добычи Сколько и при какой цене бочки забирает  и сколько остаётся НК
65|06.03.2020 22:10:11|Dmitry Manzor|Там чёрт ногу сломит, они же преференции по месторождениям выпрашивают вечно
66|06.03.2020 22:11:47|А что ты сделал для котэ!?|Возможно Но я в начале февраля вышел из ВДО Потом пару недель подождал  и опять начал входить потихоньку. Хорошо, что не успел много войти. Получил хороший урок Пусть я паникёр, но я лучше месяц посижу в малорисковых инструментах с небольшой дохой и волатилтностью. Кончится шухер  опять куплю Шевченко дороже, чем продал Не кончится  останусь с нищенской дохой в 5 по ОФЗ и 7 по мордве без просадки по телу и с наличием ликвидности
67|06.03.2020 22:16:17|Sereja|Так а доллары есть
68|06.03.2020 22:17:02|А что ты сделал для котэ!?|А чо
69|06.03.2020 22:17:49|Ivan Z|А позвонить есть А мелочь есть
70|06.03.2020 22:18:16|А что ты сделал для котэ!?|А если найду
71|06.03.2020 22:19:07|Sereja|Волнуюсь за Ваш портфель
72|06.03.2020 22:19:18|А что ты сделал для котэ!?|Спасибо 
73|06.03.2020 22:30:02|Aleksandr|Есть у него все. Он грамотней многих тут
74|06.03.2020 22:49:12|YYY|Да, когда под подушкой ОФЗ с дохой 5, то спится очень леГко
75|06.03.2020 22:52:08|Sereja|СпитЬся
76|06.03.2020 22:53:00|ОлегЕ.|Добрый вечер. Если примут закон о квалификации инвесторов и запретят им покупать ВДО, что будет с уже имеющимися ВДО у неквалов Заставят продать
77|06.03.2020 22:55:58|Владимир Тутынин|Мордовия 3 тоже сползает
78|06.03.2020 22:58:23|Harry Lime|Скорее всего будет 2 опции  продать или держать до погашения
79|06.03.2020 22:59:35|ОлегЕ.|Спасибо. Тоже думаю, что насильно не изымут закон обратной силы не имеет...
80|06.03.2020 22:59:51|Ivan Z|Кстати.. считаете есть смысл в таких инструментах сидеть И ОФЗ и регионалы будут дешеветь, при падении рубля, нефти, бегстве нерезов. Вы с них думаете выйдете без потерь, когда захотите купить чтото Не проще наличный доллар вместо этого А для доходности вдо
81|06.03.2020 23:02:24|Harry Lime|Тут речь не в из,ятии конечно , принудительно тоже никто не заставит продавать  будут 3 проблемы  1 сокращение возможности рефинанса и повышение рисков дефолтов 2 отсутствие ценовой поддержки за счет мелких покупателей 3 потеря и так тухлой ликвидности. В сумме эффект может быть хуже нефти и коронавируса.
82|06.03.2020 23:05:56|ОлегЕ.|Может хватит ума просто ввести тестирование с простыми вопросами типа вы понимаете, что покупаете высокорискованный продукт 
83|06.03.2020 23:08:39|Harry Lime|Даже в этом случае 2/3 клиентов решат , что это ненужно или слишком сложно
84|06.03.2020 23:10:05|Alexey|Если все упростить то так все что выше 43  отдают вообще все. Кроме этого отдают стандартные корпоративные налоги
85|06.03.2020 23:10:40|А что ты сделал для котэ!?|Конечно сползает  купон 11.7, доха 6.5, в сентябре половину по номиналу погасят
87|06.03.2020 23:17:47|Ivan Z|Это да. Но там доха получается совсем крошечная... Хотя доллар вчера, сегодня поздновато покупать было, кроме момента после того как объявили о снижении ставки на 1
88|06.03.2020 23:18:30|А что ты сделал для котэ!?|5,5 годовых  аналог безрискового депозита
89|06.03.2020 23:20:42|Ivan Z|Да, я понимаю, просто... Смысла не вижу для себя в этом. Типа акции рублёвые купить потом дешёвле Зачем вам рубли будут нужны, если они доходность не будут давать хорошую. А на случай реального кризиса лучше валюта, чтобы менять ее на акции или евробонды, которые спустятся далеко от номинала. Я не настаиваю, мне интересны ваши аргументы просто, может я чтото не понимаю
90|06.03.2020 23:36:44|YYY|а счас не реальный кризис или просто репетиция к нему
91|06.03.2020 23:42:56|Ivan Z|Пока репетиция
92|06.03.2020 23:43:54|YYY|Вот знающий чел нашелся, спасибо
93|06.03.2020 23:44:17|Сергей|Когда офз будут лить, тогда реальный
94|06.03.2020 23:52:21|Soa|так длинные уже...
96|06.03.2020 23:53:58|Александр Шумаков|Например..
97|06.03.2020 23:55:07|Сергей|Это по мелочи, доходность чуть подросла.
98|06.03.2020 23:55:21|Alexey|Настоящий придет когда джинна инфляции наконец то выпустят из бутылки. И никаких трех желаний он выполнять не будет
100|06.03.2020 23:55:48|Sergey|Хороший формат, спасибо
101|06.03.2020 23:56:09|Soa|хай на 118
102|06.03.2020 23:56:49|Александр Шумаков|Интересно будет наблюдать, когда ставку ключевую поднимать начнут
103|06.03.2020 23:57:04|Soa|допускаете
104|06.03.2020 23:57:20|Alexey|Не будим лихо
105|06.03.2020 23:57:44|Александр Шумаков|Хз. Не исключаю.
107|07.03.2020 00:00:25|Александр Шумаков|Итак хомяков погапугали, что же будет при настоящем кризисе
108|07.03.2020 00:07:38|Alexey|Как всегда  кто то опытный уйдет со всеми деньгами неопытных
109|07.03.2020 00:17:25|А что ты сделал для котэ!?|Вот что будет 
111|07.03.2020 00:31:46|Владимир Тутынин|Сцуко. Даже доллары не помогли
112|07.03.2020 00:42:58|Soa|в смысле
113|07.03.2020 00:45:55|Сергей|Все красное кроме доллара и евро
115|07.03.2020 00:52:22|Soa|Аналитики, опрошенные Forbes, допускают в случае дальнейшего падения цен на нефть ослабление рубля до 80 руб./, а если к нему добавится спровоцированная эпидемией коронавируса глобальная рецессия  до 90 руб./.
116|07.03.2020 00:56:15|Andrey M|Цб отреагирует и все будет хорошо с рублем. Только со ставкой повыше 6
117|07.03.2020 01:11:26|Владимир Тутынин|Не зря длинные падали
118|07.03.2020 01:17:24|А что ты сделал для котэ!?|Только бюджету нужно хотябы 3.2 тыс руб за бочку При цене 40 баксов рубль должен стоить 80 До этого наверное не дойдет Но 7275 вполне возможно И ставка в районе 6.5
119|07.03.2020 01:35:38|Soa|это без учета кери
120|07.03.2020 01:36:25|А что ты сделал для котэ!?|Раскрой мысль
121|07.03.2020 01:36:26|Soa|хотя возможно 70 новая реальность
126|07.03.2020 01:38:26|А что ты сделал для котэ!?|Да хер его знает чо будет Но я часть баксов с депозита по 71 продам
127|07.03.2020 01:38:51|Soa|да многие продадут уже по 70
131|07.03.2020 03:33:48|YYY|нефть федун лукойл рф Вицепрезидент Лукойла Леонид Федун о разрыве сделки с ОПЕК Стране это обойдется в 100150 миллионов долларов в день. Такие потери складываются из ожидаемого падения цен на нефть с уровня от 60 долларов за баррель при сохранении сделки с ОПЕК до примерно 40 долларов за баррель при объеме российского экспорта в 5 миллионов баррелей в день. Это неожиданное и нерациональное решение. Пока я в легком шоке . Источник The Bell
132|07.03.2020 05:25:46|Шура SiberianRanger|
133|07.03.2020 06:06:01|Harry Lime|Я думаю не отреагирует , с трежерями дохой меньше 1 наш рубль  подарок , даже если инфляция удвоится  спасибо , если не снизят. Когда все начнет валиться , просто вспомните про ОФЗ ИН , в 15м помогло . У меня даже презентация первого выпуска осталась с тех пор , могу поискать в архиве
135|07.03.2020 08:06:26|YYY|ОФЗ ИН помним и надеемся. Есть чуток в портфеле , вчерась даже штуку прикупил 
138|07.03.2020 08:20:17|YYY|спб
140|07.03.2020 08:22:44|Harry Lime|Я помню с 96 до 103 за месяц эта штука пульнула
144|07.03.2020 08:31:54|Alexander|Их вроде два всего
146|07.03.2020 08:32:07|Harry Lime|С 15 года и не причащался
147|07.03.2020 08:32:52|Alexander|А их индексируют на инфляцию, которую росстат считает
148|07.03.2020 08:33:44|Harry Lime|Ага , там в презентации все , но учтите , что он и сейчас 2,3 видит ...
149|07.03.2020 08:34:56|YYY|так они не то чтоб словить кучу денег, а типа а вдруг....
151|07.03.2020 08:38:44|Harry Lime|Не , банальный расчет  была инфляция 2 стала 4 , посчитайте , на сколько вырастет доха ...
153|07.03.2020 08:41:21|YYY|это другая, но это тоже квазигосударств типа ОФЗ ток еще плюсом , если шухер на ОФЗ тоже рост
155|07.03.2020 10:24:00|Sergey S|Не самая плохая стратегия. В целом,при ухудшении условий спреды к бескупонной кривой у мусорных растут сильнее,чем у бумаг инвест грейда. Иногда офз, как и качественные корпораты могут показать доходность за определенный период выше, чем вдо. Простой пример  2019г, даже без активного управления кроме того,зачем вам именно короткое офз Возьмите короткие надежные корпораты, доходность будет повыше, а вероятность дефолта все равно очень мала  что еще надо Но у меня еще вопрос возник так паникером назвали себя отчего Потому что смущает просадка облигаций в цене Если вы облигационер, это фигня. но если вы согласны с рынком,что риск значительно вырос и сами рассчитали, что вероятность дефолта выросла,то вы сделали правильно. другое дело,что расчет может быть ошибочным
157|07.03.2020 10:48:56|Sergey S|В зависимости от предпочтения по риску и дюрации список выпусков может быть разный. Вот навскидку эмитенты, в порядке убывания надежности вэб, рн банк, совкомбанк, тинькоф. у всех есть болееменее ликвидные выпуски и все не допустят дефолта в ближайшее время это мое мнение
158|07.03.2020 10:51:09|Alex|Заменить ОФЗ на совком, Тинькофф ну такое себе. Ладно Сбербанк или Газпром. Но совок это уже джанк
159|07.03.2020 10:52:53|sergey|Рено
160|07.03.2020 11:09:37|Sergey S|Все что я перечислилкроме вэб, по нормальной классификации, это junk bonds. Но если понимаешь,что по коротким выпускам никто из них не допустит дефолт, можно выбрать те, что подоходнее. И это не про сбер
161|07.03.2020 11:13:37|Alex|если бы было очевидно, что никто из джанков не допустит дефолт, то и спреда бы не было
162|07.03.2020 11:21:28|Sergey S|Я обозначил свое мнение  по ним дефолтов в ближайшее время годполтора не будет. Просто такие две крайности  когда либо сначала берут только вдо там же доходность , а потом только офз там же нет риска очнь вредят итоговой доходности портфеля на длительном промежутке времени. Хотя между этими крайностями много чего интересного
163|07.03.2020 11:54:37|Harry Lime|ВДО ВДО рознь , надо глубже копать эмитентов  это имхо единственный путь в русском хай йилде
164|07.03.2020 12:49:47|Adviser|Но если говорить о дистанции в 36 мес период неопределенности, то выбор между ОФЗ с 5.5 и квазигос с 6.5. очевиден  разница доходности и рисков разная Другое дело, что по сути обозначены три точки зрения  кота с ОФЗ  ваша с квазигос  Гарри с избранными Прекрасная интерпритация отношения к рискам Ещё бы сюда  диверсификация  условный палладий с плечом для полноты картины 
