|time|user|text
392|20.02.2020 19:00:13|"PRObonds | LIVE"|Команда RocketUP представляет подборку лучших каналов в телеграм. Каждый из них достоин Вашего внимания  skybond  авторский канал от одного из первого в России инвестиционного советника Константина Балабушко. Всё о том, как анализировать и инвестировать в еврооблигации. Подписчикам доступны инвестиционные идеи и обучающие вебинары.  iRukovoditel  авторский блог об управлении персоналом для руководителей и тех, кто хочет ими стать. Всё о постановке задач, контроле и мотивации, а также ответы на вопросы подписчиков.  investfuture  здесь освещают самые важные события, которые влияют на текущее состояние инвестпортфеля и помогают принимать новые решения. Хотите разобраться в услугах и сервисах брокеров и не попасть на финансовых мошенников Подписывайтесь на InvestFuture, чтобы быть разумным инвестором.  BizLike  Кубышка  пожалуй, единственный канал, который публикует портфели в открытом доступе. Доходность в прошлом году 34, а с начала года уже 7 и это в долларах. Автор канала публикует самые топовые инвестиционные идеи и учит как собирать правильно портфели.
394|20.02.2020 19:01:38|А что ты сделал для котэ!?|Что именно
395|20.02.2020 19:10:53|Святослав|Ну что они предложат нам, почти каждый месяц разные салаты заправляют и мы покупаем
396|20.02.2020 19:12:39|Dmitry Manzor|Нынешний салатик был от шеф повара, не всем
397|20.02.2020 19:15:47|Святослав|Вот для меня вкусный салат ЛТРЕЙД , думаю с начинкой Брусник еще добавить , но пока я сытый сейчас, в марте как раз буду брать
398|20.02.2020 19:21:19|Александр Тестов|Ломмастер 7 неплохо разместился за 10 минут.. и уже 103,3. Точно голод по вдо, со вторички уже не дадут купить по хорошей цене..
399|20.02.2020 19:33:50|laslo Fish|Следующий ломбард М будет врядли больше 1212.5  сегодняшний экспириенс подтверждение. А уменьшат планку входа  тем более.
400|20.02.2020 19:36:31|Sereja|У 6 ломастера оферта в июле. Дох.в терминале показывает 12
402|20.02.2020 19:45:49|Harry Lime|Там оферта без смены купона , можно расслабиться
403|20.02.2020 19:46:49|Egor Zagorskiy|тут за Дэни ещё не банят, надеюсь а то я месяц чат вообще не читал. Чо по дэни, кто знает Оферту 12го февраля исполнили Почему продолжается слив
404|20.02.2020 19:48:33|Olly Milly|о пользе чтения эмиссионных документов 
405|20.02.2020 19:48:59|Sereja| муха
406|20.02.2020 19:49:03|Harry Lime|Почему продолжается слив  вопрос вопросов. Загадка покруче египетских пирамид
407|20.02.2020 19:49:08|Sereja|
408|20.02.2020 19:49:16|Шура SiberianRanger|Первичка 20 февраля
409|20.02.2020 19:49:26|Dmitry Manzor|гуру. но Вас никто не услышит доха, показанная в приложении  рулит
410|20.02.2020 19:50:39|Andrey Hohrin|присоединюсь к Гарри. вопрос вопросов.
411|20.02.2020 19:50:53|Harry Lime|Я думаю 13 то еще будет
412|20.02.2020 19:51:26|Egor Zagorskiy|ну то бишь к дефолту вот прям конкретно ничто не располагает
413|20.02.2020 19:51:54|Harry Lime|Вам возбудиться или успокоиться
414|20.02.2020 19:52:23|Alex|По Дени оферта завтра.
415|20.02.2020 19:52:28|Egor Zagorskiy|понять, стоит ли немного усредниться или забить
416|20.02.2020 19:57:00|Alex|Может опять отскочит.
417|20.02.2020 20:00:30|Sergey Tokarev|так там же дефолт вроде, нет
418|20.02.2020 20:00:36|Egor Zagorskiy|где
420|20.02.2020 20:00:57|Sergey Tokarev|ну шутка бро . просто надоело про дэни та
421|20.02.2020 20:01:25|Egor Zagorskiy|а  да верю, что надоело. говорю ж, месяц в чат не заходил. а где ещё обстановку узнать, как не тут
423|20.02.2020 20:17:38|А что ты сделал для котэ!?|В друзе
424|20.02.2020 20:17:50|Egor Zagorskiy|гдегде
425|20.02.2020 20:19:33|А что ты сделал для котэ!?|druz_svid
426|20.02.2020 21:08:46|Владимир Тутынин|В 25 нужно жить на все
428|20.02.2020 21:11:48|Harry Lime|Так может , если захочет , кто ж ему запретит, вот в чем дело
429|20.02.2020 21:13:56|laslo Fish|Разве только в целях поставим новый рекорд
430|20.02.2020 21:15:49|Harry Lime|Сейчас сушь , когда под 13 выходят промышленный эмитент и ломбард  это неэффективность рынка
431|20.02.2020 23:14:15|Sergey S|Ребят, вы меня,конечно,извините, но все это общение насчет дэни, всеобщий к нему интерес и надежда многих чуток подзаработать мне напоминает вот ту сцену из фильма чернобыль, когда все вышли на мост смотреть, как красиво горит. Неужели так скучно инвестировать, что вы в этом всем участвуете, тратите время на обсуждение Дэни забирает не только деньги, но и время, которое можно было потратить, например, на чтение литературы про облигациям, что в будущем даст вам больший эффект, чем потенциальный выигрыш в дэни сейчас
432|20.02.2020 23:16:27|Alexey|Канзас сити шаффл скорее Погодите  будет время  Дени будем вспоминать добрыми словами. Оферты, розыгрыши, поездки в Краснодар.
433|20.02.2020 23:17:29|Dmitry Manzor|Завтра тарю Дэни, не мешайте если конечно припадет ещё
434|20.02.2020 23:18:24|Alexey|
435|20.02.2020 23:19:40|Dmitry Manzor|Кстати кто знает Дэни зачем переезжает Кто из Краснодара  чем отличается Новокузнечная от Фрунзе, какая разница где офис снимать
436|20.02.2020 23:20:18|Кирилл|Ждем бумагу на 120
437|20.02.2020 23:21:09|Dmitry Manzor|Оптимистично
438|20.02.2020 23:22:45|Ivan Z|Так и есть, рационального в этом ничего особо нет. Но все поразному развлекаются это ещё не самый плохой способ провести время.
439|20.02.2020 23:24:40|Soa|Какой эффект Порекомендуйте литературу..
440|20.02.2020 23:35:49|Sergey S|Вам в первую очередь  Как перестать троллить и начать инвестировать
442|20.02.2020 23:36:33|А что ты сделал для котэ!?|Позор пьянице и дебоширу SOA
443|20.02.2020 23:36:34|Soa|Кто автор Ну мне нужно что бы прям эффект был, как вы обещали
445|20.02.2020 23:40:46|А что ты сделал для котэ!?|Ну а серьезно, что кроме Фабоцци вы порекомендуете по рынку облигаций И зачем
446|20.02.2020 23:42:44|Soa|Наверное Незнайка на Луне
448|20.02.2020 23:46:00|А что ты сделал для котэ!?|Моя была трилогия желания Драйзера про Фрэнка Каупервуда Классная вещь 150 лет прошло  а рынки не изменились
449|20.02.2020 23:46:22|Soa|Титан, Стоик, Финансист
451|20.02.2020 23:47:22|А что ты сделал для котэ!?|Ну да 
452|20.02.2020 23:55:01|Елена Филякина|
456|21.02.2020 00:09:02|Sergey S|Учебники по подготовке к экзамену CFA 1,2,3  разделы fixed income, risk management. Но если вы уже прочитали всего фабоцци, новых концепций для себя не очень много там найдете. Зачем  наверно у каждого свой будет ответ да, ктото вообще ничего не читает,но за отдельный период заработает побольше, чем профи, знающий наизусть Фабоцци. вот только успех этот вряд ли удержит
457|21.02.2020 00:10:42|Ivan Z|А из Фабоцци кстати что стоит читать
458|21.02.2020 00:22:41|YYY|О, Боже, я даже не знаю кто такой Фаббоцций
459|21.02.2020 00:51:57|Alexey|Друг дал почитать в школе. И жизнь уже не была прежней
460|21.02.2020 02:12:40|Сергей Батраков|Западные СМИ облетала новость  в британский ВДВ впервые прошла девушка. Казалось бы, вот оно, торжество гендерного равноправия, не то что в несвободной России. Хотя стоп, подождите. В России же в ВДВ служат по контракту 2 тыс. женщин, из них 200 офицеров. Но ладно, британские десантники малочисленны и очень элитарны у них жесткий конкурс с маршбросками и мордобоем. Однако ж в России девушки служат даже в спецназе, где тоже отбор тот еще с курсом выживания, психологическими тестами и теми же маршбросками в боевой выкладке. И вот эти британцы учат нас гендерному равноправию
462|21.02.2020 06:43:54|Владимир Тутынин|Что интересно. Каупервуд не любил читать книги. Зато любил живопись.
463|21.02.2020 07:24:01|Mark O|И правильно. Все ж просто или лей в стакан или потребляй из него
465|21.02.2020 07:31:41|laslo Fish|Это ведь аксиома, выведенная коренным народом читатель и писатель  разные люди.
467|21.02.2020 07:39:16|А что ты сделал для котэ!?|Сфа 1,2,3 Вы серьезно 
468|21.02.2020 08:14:46|Владимир Парцей|Веду публичный портфель, изучаю эмитентов задаю вопросы, изучаю, публикую новости. Ссылка на канал RuBus1997
469|21.02.2020 08:28:22|#Любопытный|Айс поло легализовался
470|21.02.2020 08:31:07|Санек|так то, новый Много их молодых, злых и голодных c 
471|21.02.2020 08:39:34|Aleksandr|Тов . Прокурор да ты ли это
472|21.02.2020 08:40:07|Владимир Парцей|Я не прокурор, я только учусь Я конечно
474|21.02.2020 08:46:32|Санек|не признал богатым будешь Успехов
475|21.02.2020 08:54:42|ОлегЕ.|Фрунзе это почти центр города. Новокузнечная  чуть чуть дальше
476|21.02.2020 08:57:27|Aleksandr|Это важно для мобильного оператора. Ведь их основные клиенты с пешеходного трафика центра Краснодара 
477|21.02.2020 09:03:12|"PRObonds | LIVE"|прогнозытренды рубль eurusd /1/ Доллар покоряет рубеж за рубежом. Это отражается и на рубле, впрочем, мы привычны, и на евро, и на иене. С рублем все болееменее понятно против глобального спроса на доллары ни одна даже очень крепкая региональная валюта выстоять неспособна. А вот на глобальном уровне индекс доллара, наполовину состоящий из оценки доллара в евро, приблизился к многолетним максимумам. Евро к доллару  к не менее многолетним минимумам. Сколь долгим будет ралли доллара Скорее всего, недолгим, ибо оно уже состоялось. В нашем трендовом портфеле короткая позиция по паре EURUSD неизменно удерживается с начала сентября. И готовится к закрытию.
478|21.02.2020 09:06:16|"PRObonds | LIVE"|прогнозытренды рубль eurusd /2/ Причина слабости резервных валют против доллара, скорее всего, банальна  это разница процентных ставок. Валюта, дающая бОльшу внутреннюю доходность ключевая ставка или ставка по гособлигациям за минусом инфляции, рано или поздно, оказывается дороже конкурентов с меньшей доходностью. На практике это работает так продаешь евро или иены, покупая при этом доллары или прочие, в т.ч. высокодоходные валют, разницу ставок берешь себе. Если евро или иена при этом дешевеют, а доллар против них дорожает, игра становится сильно интереснее. А интерес притягивает спекулятивный капитал. Навес продаж над евро растет, параллельно с навесом покупок доллара.
479|21.02.2020 09:08:28|"PRObonds | LIVE"|прогнозытренды рубль eurusd /3/ Почему я думаю, что падение евро в первую очередь все же ненадолго Керритрейд между долларом и евро или между долларовыми активами и евро имеет слишком маленькую разницу в ставках. Хотите доходностей  наращивайте финансовый рычаг. И наращивание идет. Но это как любая пирамида. Рост доллара в этой игре может продолжать только за счет привлечения в игру все большего количества участников и денег. Приостановка притока резко разворачивает ценовые тренды. Т.к. тут же начинается бегство спекулятивного капитала. Мы наблюдали подобное в ходе схлопывания операций керритрейд в рубле веснойлетом 2018 года. В паре EURUSD точка разворота в потоке спекулятивного капитала, вероятно, близка. Возможно, это произойдет в районе 1,07, возможно, чуть ниже. Но вряд ли пара дотянет даже до 1,05. А вот дальше можно подумать и о 1,15 , невзирая на то, что внутренняя доходность евро отрицательная. Что это дает рублю Мы привыкли рубль измерять в долларах. Глядя на пару USDRUB сейчас 64, кажется, что пошли на влет. Но сползающая вниз пара EURRUB 69, заставляет задуматься, настолько ли плоха российская валюта. Взвешивая ожидаемую динамику базовых валют, я бы пока остановился на целевых диапазонах в 6064 рубля за доллар и 6871 рубль за евро. Источник иллюстраций profinance.ru AndreyHohrin
480|21.02.2020 09:20:15|Санек|AndreyHohrin , вы продолжаете держать позицию каков ваш горизонт До победного
481|21.02.2020 09:20:15|Санек| палладий металлы Палладий за последние три года подорожал почти в четыре раза, превратившись из побочного продукта в ходе добычи платины в основной источник выручки крупнейших компаний отрасли, в том числе ГМК Норильский никель. Это стало возможным благодаря резкому росту спроса на металл как катализатор в бензиновых двигателях. Но, вопреки рыночным законам, структурный дефицит палладия в ближайшие годы не исчезнет новых крупных проектов по его добыче в мире почти нет, а автопроизводители продолжают наращивать закупки.  Ъ
482|21.02.2020 09:21:20|Andrey Hohrin|нам нужна одна победа. позиция открыта на 60 небольшим от номинального объема. потеря портфеля от позиции  около 4
483|21.02.2020 09:22:08|Санек|спасибо за ОС. Наблюдаю за экспериментом, интересно
484|21.02.2020 09:22:22|Andrey Hohrin|ОС
485|21.02.2020 09:22:27|Санек|обратная связь
486|21.02.2020 09:22:40|Andrey Hohrin|это не единственный эксперимент. есть и положительные. их больше.
487|21.02.2020 09:23:21|Владимир Парцей|Как оцениваете потенциал роста акций ОР
488|21.02.2020 09:23:50|Санек|ну сами знаете что чужие ошибки, както привлекательнее чем успехи а за ваши публичные портфели и подход к их ведению вам поклон
490|21.02.2020 09:28:30|yuri_che|Вчера по РБК передача прошла про грядущую с 01.07.2020 легализацию обуви. Передвинули срок ввдения акцизных марок или как их там, на обувь, на несколько месяцев. Коротко  перспективы у легальных обувщиков грандиозные, на мой взгляд.
492|21.02.2020 09:31:26|Serg|Доброе утро. А хитрый Коган вчера вроде объявил, что становится в sell палладия...
493|21.02.2020 09:33:01|Andrey Hohrin|он еще и быстрый. чего не могу сказать о себе
494|21.02.2020 09:34:01|Serg|Это не наш метод, Андрей Витальевич
495|21.02.2020 09:34:30|Andrey Hohrin|на высоких скоростях мы потеряем гораздо больше конечностей
496|21.02.2020 09:34:52|Serg|О 
497|21.02.2020 09:48:52|Rost|шортить растущий и выкупать падающий, два смертных греха, третьий это усредняться  Но в качестве любопытства почему не попробовать запретный плод. Главное чтоб адепты последователи понимали что они делают.
498|21.02.2020 09:49:01|"PRObonds | LIVE"|колумнистика вдо Чем хороши ВДО Тем, что на этом рынке есть правила которые понимают и разделяют как сами заемщики, так и инвесторы. Рыночная логика ценообразования, контроль инвестсообщества за эмитентом, некулуарный характер сделок  все это уже есть в ВДО, хотя рынок еще сравнительно молодой. Всего этого пока не достает прямому конкуренту ВДО  краудлендингу. Несмотря на то, что краундлендинг появился раньше и им занимаются крупные институционалы например, Сбербанк и Озон, эффективных и понятных механизмов взаимодействия с инвесторами и ответственности заемщиков в отрасли не появилось. Поэтому средний бизнес продолжит и дальше приходить на фондовый рынок за финансированием, а инвесторы  за высокими доходностями. С количеством успешных имен будет расти и качество всего сектора, риски станут более понятными, а ставки  оправданными. Гандикап перед краундлендингом у ВДО есть, и с большой вероятностью он будет расти. https//www.vedomosti.ru/personal_finance/articles/2020/02/20/823549davatdengi
500|21.02.2020 10:09:02|Paul Baikov|Простите за некоторый оффтоп, но когда должна запись о поступлении денег на выплату купона появляться на nsddata.ru  До конца рабочего дня выплаты Чтото по МСБЛиз2Р02 не вижу там. А тот же ЛизингТрейд уже есть, например
501|21.02.2020 10:09:48|Andrey Hohrin|До 1600 дня выплаты, если не изменяет память
502|21.02.2020 10:10:37|Harry Lime|Иногда бывает и на следующий , а с выходными так просто ужас , ужас
503|21.02.2020 10:10:43|Paul Baikov|А, понял, спасибо  Недавно начал там искать, все перечисляли днем раньше, обычно, чутка заволновался
505|21.02.2020 10:12:18|Harry Lime|Далеко не всегда сообщение о получении и передаче выплаты размещается в день выплаты . Особенно если в один день это происходит. Держите валидол наготове.
506|21.02.2020 10:12:43|Sergey S|Есть двухтомник на русском справочник по ценным бумагам с фикс.доходностью   старое издание, но очень подробное
507|21.02.2020 10:13:50|Paul Baikov|Ясно, собственно и решил уточнить, и не офтопить больше по этому поводу
508|21.02.2020 10:15:00|Harry Lime|С Фабоцци другая беда , если у вас проблемы со сном  Фабоцци  ваш выбор
509|21.02.2020 10:16:47|Alexey|Больше живописи он любил женщин
510|21.02.2020 10:17:19|Sergey S|Да, это очень продвинутый уровень. но может ктото его и ищет Но замечу, что в cfa 1 по бондам чуть ли не с нуля все расписывается. но только на английском
