|time|user|text
1|09.08.2019 09:46:10|Alexey Z|спасибо
3|09.08.2019 10:36:19|Елена|Подскажите, какие риски в бумагах Белоруссии Сегодня в стакане появились.
4|09.08.2019 10:42:21|Sereja|А как этот чатик найти
5|09.08.2019 10:42:59|Dmitry Manzor|там скучно даже не ищите
7|09.08.2019 10:43:39|Sereja|Тогда вопрос снимается
8|09.08.2019 10:44:04|Dmitry Manzor|https//t.me/fintraining_link
11|09.08.2019 10:47:47|Sereja|Посмотрим
12|09.08.2019 10:49:57|Nadya Nadya|Etf_chat, чтото ссылку у них не нахожу
13|09.08.2019 10:51:19|AntoN|t.me/druz_svid
14|09.08.2019 10:51:19|Шура SiberianRanger|Он не публичный, ссылку можно попросить в техподдержке FinEx_ETF_bot
15|09.08.2019 13:11:58|Andrey Belous|Апри смотрю всё улетает и улетает по чуть
16|09.08.2019 13:14:53|Roman Gorodnev|а нефть штурмует 58
18|09.08.2019 13:21:08|Andrey Hohrin|ну, все, вот я и в Хопре
19|09.08.2019 13:21:36|Scorpio76Spb|Теперь к 62 без остановки
20|09.08.2019 13:24:37|Завирюха Александр (МСХ Чувашия)|60.5 быстрее всего
22|09.08.2019 13:26:22|Dmitry Manzor|Ждём Твит деда и на 70
25|09.08.2019 13:27:32|Roman Gorodnev|Я неделю назад только разобрался, что такое фьючерс, и что с ним можно делать... а что лучше не делать  В сбере еще ими можно торговать только через quik, в итоге и в этом разобрался.... А когда здесь задал вопрос что значит стоппокупка на 58,01, мне добрый человек сказал, что уже все купил Поэтому я реально был в Хопре вчера 
26|09.08.2019 13:28:10|Andrey Hohrin|надо сделать уже эфир на тему фьючерсов и стопприказов
27|09.08.2019 13:28:29|Завирюха Александр (МСХ Чувашия)|можно и акций 
28|09.08.2019 13:29:00|Roman|будет очень полезно
29|09.08.2019 13:29:29|Шура SiberianRanger|Каждый раз ору с кода сентябрьского фьючерса на Сбербанк
30|09.08.2019 13:29:29|Andrey Hohrin|тогад у нас 2 ближайшие темы 1. смерть и налоги. 2. фьючерсы и стопприказы
31|09.08.2019 13:29:44|Завирюха Александр (МСХ Чувашия)|через год как откотаюет Иволга сразу можно сделать платным канал по фьючам 
32|09.08.2019 13:30:19|Andrey Hohrin|вряд ли. вот 57  это вполне
34|09.08.2019 13:30:47|Шура SiberianRanger| Без стопа, как обычно 
35|09.08.2019 13:30:50|Roman Gorodnev|Было бы полезно, так как я прошлую неделю гуглил как шортить золото на ммвб.... инфы в гугле 0, продирался через такие леса в итоге
36|09.08.2019 13:31:36|Andrey Hohrin|я не очень понимаю, зачем его ставить. точнее, понимаю, но не в данном случае.
37|09.08.2019 13:31:43|Завирюха Александр (МСХ Чувашия)|как небольшой доп доходт
38|09.08.2019 13:32:23|Andrey Hohrin|не. давайте зарабатывать там, где это не вызывает отторжения у плательщика
40|09.08.2019 13:33:26|Sergey Trenin|Нефть пошла вверх, а золотишко както не хочет падать
41|09.08.2019 13:34:02|Roman Gorodnev|но спекульский то инструментарий поминимуму то должен быть, иначе большинство кто сюда придет, не поймут как им третий портфель собрать 
42|09.08.2019 13:34:20|Aleksandr|С ГГ не получится что он хроманет после IPO  А то есть впечатление что трудно ему , роста выручки нэма , по крайней мере у ОАЭ . Инвесторы волнуются.
43|09.08.2019 13:34:30|Scorpio76Spb|А можно подробнее про сберовской квик Как там деньги на срочный рынок завести
44|09.08.2019 13:36:15|Завирюха Александр (МСХ Чувашия)|на срочный через сбер онлай андроид приложение
46|09.08.2019 13:36:28|Andrey Hohrin|год к году с рост выручки и прибыли есть. к сожалению, консолидированные полугодовые данные за 2019 будут только после объединения. и когда именно, сказать не берусь. возможно, в августе. насчет хромоты остаюсь при мнении, что ГГ  лучший пример на ВДОшном рынке
48|09.08.2019 13:36:54|Завирюха Александр (МСХ Чувашия)|или проще можно сделать, завести на фондовый и через квик сделать перевод на срочный
49|09.08.2019 13:37:36|Roman Gorodnev|Сперва на сайте в договоре на брокерское обслуживание нужно срочный подключить. Потом при пополнении указываем, что деньги на срочный рынок ФОРТС
50|09.08.2019 13:38:15|Завирюха Александр (МСХ Чувашия)|Расширение  Неторговые поручения  Перевод ДС / Через квик
51|09.08.2019 13:38:58|Scorpio76Spb|Вот, у меня значит просто не подключен ФОРТС. Спасибо за информацию.
52|09.08.2019 13:39:46|Roman Gorodnev|за 12 рабочих дня подключают после заявления, никуда ходить не нужно, просто на сайте внести изменения в договор
54|09.08.2019 14:14:13|Roman Gorodnev|Вопрос по фьючерсу нефти  сколько резерва деньгами в процентах от позиции лучше держать
55|09.08.2019 14:20:41|Dmitry Manzor|USDRUB vs НЕФТЬ today  ктото неправ
56|09.08.2019 14:20:50|Владимир Тутынин|В личном кабинете сбербанк онлайн переходишь в брокерские услуги. Подключаешь в договоре срочный рынок. Через деньдва появляется срочный счет. В неторговых поручениях в quik делаешь перевод необходимой для ГО суммы  с учетом ее пересчета с брокерского счета на срочный. Вуаля.
58|09.08.2019 14:23:00|AntoN|t.me/druz_svid
59|09.08.2019 14:24:50|Владимир Тутынин|В сбербанк онлайн также можно в договоре открыть досуп к валюте и ОТС. И прикрепить валютные счета
60|09.08.2019 14:25:44|Ooo Riemann|Графики бывают похожи а бывают нет , влияние одних инструментов на другие безусловно имеет место быть , но корреляций нет  и потом нефть идет в отскок или разворот после затяжного обвала а доллрубль из расход треугольника на вершине пытается выйти в сходящийся , но спекулянт и цб укрепление рубля пока не выгодно , вот рубль и болтает 
61|09.08.2019 14:27:28|Владимир Тутынин|Троллинг не уместен.
62|09.08.2019 14:27:45|Маржинколл Байбекович|Отличные новости. Надеемся, что с вами на борту будут активнее с рынком общаться.
63|09.08.2019 14:27:58|AntoN|Нет конечно. Но чарт тут тоже
64|09.08.2019 14:28:57|Andrey Hohrin|да, там есть сложности с коммункацией. они есть у всех. самые открытые из относительно крупных  АПРИ. Но ГГ, повторюсь, это, по моему мнению. наиболее устойчивый бизнес из всего, что я размещал или положил в портфель.
65|09.08.2019 14:29:33|Владимир Тутынин|Остальные не очень
67|09.08.2019 14:32:07|Dmitry Manzor|Ваш прогноз на рубалёк какой в ближайшей перспективе Я знаю, что нынешние 3800р за бочку невыгодно для РФ. Бюджет на 4к стоит, придётся брать из резерва, что наши не захотят
68|09.08.2019 14:33:04|Roman Gorodnev|Ок, получается около 20, они же и как стоплос сработают при падении правильно
69|09.08.2019 14:33:52|Andrey Hohrin|знаете, мне неспокойнее, чем Вам, пока считаю, что все, что куплено  будет жить. как потянет от когото холодком, будем продавать. понимая, что с нынешними объемами продать даже 1 портфеля  уже нагрузка на рынок.
70|09.08.2019 14:37:45|Ooo Riemann|Прогнозы делают аналитики а я учусь быть трейдером  ...а это разные профессии  и тк слишком много разных факторов влияет на курс рубля то хз , но я лично за укрепление рубля и считаю что пойдём вниз , вопрос когда и через какие новые хаи  или проболтаемся сегодня понед и потом вниз на 64,5 как первая цель
71|09.08.2019 14:41:41|Владимир Тутынин|Я кстати хотел уже два дня с предыдущего Мсб в Новый. Но он стал падать...
72|09.08.2019 14:44:33|Andrey Hohrin|видимо, не только вы...
73|09.08.2019 14:54:55|Ooo Riemann|Есть ГО  которое забирают как залог  а есть ещё плечо с которым вы торгуете или собираетесь торговать , к примеру на нефти это 1011 плечо на срочке, плечо можно смотреть в квике и тогда вы точно будете знать какое ГО в пересчете на одни контракт вам нужно оставить на счёте
74|09.08.2019 15:17:37|DIM|Отправлено из Яндекс Дзена https//yandex.ru/turbotexthttps3A2F2Ffinance.rambler.ru2Feconomics2F42633697novyykrizisbudettyazheleepredyduschih2Famppromonavbaramputm_referrerhttps3A2F2Fzen.yandex.com
76|09.08.2019 15:19:19|Andrey Hohrin|Говорят, что Леонид Ильич своих книг не писал. Но когда читал, плакал
77|09.08.2019 15:28:12|Шура SiberianRanger|
78|09.08.2019 15:29:33|DIM|  
79|09.08.2019 16:21:52|Владимир Тутынин|Андрей. А на выходные не стоит закрывать нефть
80|09.08.2019 16:29:57|Andrey Hohrin|а зачем
81|09.08.2019 16:31:47|Владимир Тутынин|Незнаю. Может идут накладные расходы. Нет
82|09.08.2019 16:32:58|Andrey Hohrin|если нефть в лонге на фьючерсе  то это накладные доходы
84|09.08.2019 17:10:58|Виктор|Бэквардация кого с кем
87|09.08.2019 17:14:36|Aleksandr Boychuk|Фьючерсного контракта и спотового актива на нефть. Фьючерс эксперируется каждый месяц, бэквордация распределена по времени практически равномерно.
88|09.08.2019 17:15:31|Виктор|Согласен В этом контракте просто не вижу бэквардации
89|09.08.2019 17:34:02|Владимир|На уровне статистической погрешности.
91|09.08.2019 17:46:06|Владимир|Евроторг готовит допвыпуск облигаций 1й серии на 5 млрд рублей Размещение бумаг пройдет по открытой подписке, номинал  1 тыс. рублей. Сбор заявок на основной выпуск объемом 5 млрд рублей прошел 5 июля.
92|09.08.2019 17:46:30|Замполит Aleks Kib|Понравилось брацьям такое размещение
93|09.08.2019 17:52:12|Владимир|Если на ура расходится , почему бы и нет. . А доп.выпуск сколько раз можно делать 
94|09.08.2019 17:53:53|Михаил|Т.е. ставка та же Или при допе опять букбилдинг
95|09.08.2019 17:57:41|Владимир|Французский депутат Национального собрания Франсис Веркамер вновь поднял тему возмещения долгов по облигациям царской России перед потомками французских инвесторов. Он попросил правительство Франции принять меры, чтобы заставить Россию выплатить дополнительные средства по облигациям 1867 года, которые были аннулированы в 1918 году.
97|09.08.2019 18:00:40|Максим Кочнев|вобщето уже вернули еще в 1997 году. Все закрыто, долг официально считается погашеным
99|09.08.2019 18:01:21|Roman Gorodnev|Владимир наверно хочет казаков в париж вернуть 
101|09.08.2019 18:08:29|Владимир|
104|09.08.2019 18:14:54|Andrey Hohrin|вроде нет
105|09.08.2019 18:16:35|Serge R.|Или я смотрю не тот мсб. Квик показывает купон 10,48 и ставку 13,51 при 100,03 Как ни кручу, выйти на 12,75 не могу...
106|09.08.2019 18:18:31|Aleksandr Boychuk|Тот МСБ смотрите. В Quik в информации об инструменте купон указывается в рублях.
108|09.08.2019 18:20:21|Serge R.|10,48руб. в месяц. Это же 12,576
113|09.08.2019 18:26:09|Aleksandr Boychuk|Нет, реинвестирование не учитывается. Разница возникает, т.к. правильно учитывать купонный период, а не календарный месяц. В МСБ2 купонный период 30 дней. Поэтому немного не корректно умножать размер купона в августе, где 31 день на 12
115|09.08.2019 18:31:10|Aleksandr Boychuk|Квик именно доходность считает с учетом реинвестирования, верно.
116|09.08.2019 18:31:26|Serge R.|На сайте мосбиржи посмотрел график выплат, ага, 12,75. И дата сдвигается, как вы говорите. Спасибо 12,75 посчиталась
117|09.08.2019 18:31:49|Aleksandr Boychuk|Пожалуйста
120|09.08.2019 21:13:51|AP۞S✞LE (Евгений)|Кто знает квик на линукс работает
122|09.08.2019 21:15:57|Alexey Z|Через wine
123|09.08.2019 21:16:26|Roman Gorodnev|https//arqatech.com/upload/iblock/713/quik_to_linux_instruction.doc
127|10.08.2019 01:53:59|Anton Moiseev|Зачем эти извращения, если есть виртуалки
129|10.08.2019 08:03:02|Alexey Z|А виртуалка в этом случае это не извращение Через вайн вы просто запускаете одну нужную программу, а не целую ОС, которая вам вобщемто в данном случае не нужна. Плюс виртуалка  установка винды gt покупка лицензии на винду. Quik и wine бесплатны, как и линукс. А так же, если комп не мощный, тормоза на виртуалке обеспечены. Это уже жуткий оффтоп пошёл. Закончим на этом.
130|10.08.2019 08:29:11|Elen Troyanskaya|https//youtu.be/Mbv0UKqYrkk
131|10.08.2019 08:37:46|Владимир Тутынин|Видимо воздух холодный. Аллигатор подмерзает.
134|10.08.2019 11:18:42|Denis Nitchenkov|Подскажите, а в вебквике на первичное размещение нельзя подать заявку
135|10.08.2019 11:22:29|Aleksandr Boychuk|К сожалению, нет...Такая возможность есть только в полноценном Квике, да и то, как показала практика, только у брокеров Сбербанк и Открытие. У остальных голосовая заявка по звонку брокеру.
136|10.08.2019 11:23:14|Denis Nitchenkov|Хорошо, спасибо, как раз Открытие
137|10.08.2019 11:23:37|Sheld|Режим РПС подключен должен быть
138|10.08.2019 11:24:09|Aleksandr Boychuk|Мы тут инструкцию подготовили...https// static.wixstatic.com/ugd/807b7f_f7e9606d469b4f9b823e499c0615574b.pdf
139|10.08.2019 11:25:03|Sheld|Спасибо
140|10.08.2019 11:25:16|Sebastian Pareiro|Здравствуйте. Посмотрел вебинары по ВДО. большое спасибо за ценную информацию. Есть вопрос мне послышалось или в вебинаре реально была информация о том, что портфели 1 и 2 виртуальные
141|10.08.2019 11:25:26|Ooo Riemann|Какой ужас 
142|10.08.2019 11:26:49|Aleksandr Boychuk|Да...когда такой возможности нет Квик Вам всеравно найдет данный класс, но при попытке выставить заявку  поле будет не активным...Мы естественно в рамках брокера Иволга Капитал дадим клиентам возможность покупать облигации через Квик на размещении.
143|10.08.2019 11:26:52|Arslan|Эх, придётся всётаки настраивать Quick под мой Linux
144|10.08.2019 11:29:00|Dmitry Manzor|Может Хохрин тоже не настоящий
145|10.08.2019 11:29:12|Aleksandr Boychuk|Не послышалось. По этой ссылке описание наших портфелей и стратегия управления ими https//www.ivolgacap.com/post/D0BFD0BED180D182D184D0B5D0BBD0B8probonds
147|10.08.2019 11:32:11|Dmitry Manzor| Спасибо
148|10.08.2019 11:35:55|Maksim|а чем веб версия квика так сильно проигрывает
149|10.08.2019 11:36:11|Шура SiberianRanger|
150|10.08.2019 11:36:37|Arslan|Ну вот возможностью приобретения на первичном размещении
151|10.08.2019 11:37:53|Sheld|
152|10.08.2019 11:47:09|Александр Нечаев|Я чуть опоздал к обсуждению иволгиброкера, но интересно, букбилдинг и оферты по облигациям, случаем, не планируются бесплатными
153|10.08.2019 11:48:43|Aleksandr Boychuk|Сделаем все возможное для минимизации кастов.
154|10.08.2019 11:54:26|Александр Нечаев|Просто тут выше говорили про фишки. Почему бы не позиционировать как брокера для облигационеров, где учтены нюансы именно для работы с облигациями. Как по мне это бесплатная книга, бесплатная оферта, заявка на первичку через квик но про это уже писали вроде, рпс на вторичке. Это из того что в голову пришло, может коллеги по чату еще накидают таких нюансов
155|10.08.2019 11:57:45|Anton Moiseev|А на что жить иволга будет Андрей четко сказал бесплатно не будет, но демпинговать планируют 
156|10.08.2019 11:59:38|Aleksandr Boychuk|Для инвесторов в облигации, естественно, будут лучшие условия на рынке.
157|10.08.2019 12:00:10|Александр Нечаев|Так я же ничего не говорил про комиссии за сделку и депозитарку. Если будет в районе 0,05 за сделки и рублей 100 депозитарки в месяц плюс вышеперечисленное то по мне это уже отличный вариант.
159|10.08.2019 15:37:02|Kir|Псб по таким условиям, единственно первичка по телефону
160|10.08.2019 15:45:10|Александр Нечаев|Еврооблигации мимо и фиг пойми когда зачисление купона, вот кстати еще одно полезное свойство для облигационного брокера
161|10.08.2019 15:58:06|Kir|Не без минусов, но меня устраивает. Лишняя конкуренция не помешает, посмотрим на условия от иволги
162|10.08.2019 17:33:52|Владимир Тутынин|По комиссиям особо не поконкурируешь. Важное качество интерфейс. Удобство. Полноценный чат, работающий телефон, новости без ненужного спама. Оповещения о возможностях для разных риск профилей.
164|10.08.2019 17:40:02|Arslan|Уважаемые коллеги, кто знает, когда выйдет полугодовой отчет ЧЗПСН
166|10.08.2019 17:53:32|Arslan|Спасибо, в соседнем чате тоже ответили 
167|10.08.2019 20:38:35|Александр Шумаков|Господа. А вдо иволги в промсвязьбанк доступны
168|10.08.2019 20:39:22|Сергей Т|Да
169|10.08.2019 20:48:29|Andrey Hohrin|Промсвязьбанк один из дискаунтеров по тарифам. Первичка там доступна точно
170|10.08.2019 20:51:58|Александр Шумаков|Отлично. Ищу второго брокера под первичку на вдо
171|10.08.2019 21:12:34|Damir Sakhipov|Подтверждаю, заявка голосом бесплатно.
172|10.08.2019 21:26:06|Александр Шумаков|Ура
175|11.08.2019 08:23:51|Maksim|учитывайте, что регистрация по месту жительства должна быть.. ПСБ по организации бизнеся  хелло 1989 
176|11.08.2019 08:27:19|Александр Шумаков|В провинции проще с этим. Еще альфу просматриваю. Я так понимаю депозитарка там 0.06 в год. Дешевле чем тот же втб 105 мес, на моих объемах.
177|11.08.2019 08:29:43|Шура SiberianRanger|У ВТБ 0 на новом тарифе Мой онлайн
178|11.08.2019 08:30:22|Александр Шумаков|Да. Но первичка 150р заявка голосом. Я под первичку вдо присматриваю второго брокера
179|11.08.2019 08:30:46|Шура SiberianRanger|А, тогда невыгодно, да.
181|11.08.2019 09:49:17|Alexey Vishnyakov|Первичных размещений не так и много бывает  июнь и июль получились аномальными. Апри и Эмираты я вообще взял из стакана по 100,02  на первичку подавать в бкс накладно. А в втб можно раз  2 в месяц послушать иузыку
182|11.08.2019 10:28:49|Александр Шумаков|Там вопрос не в музыке а в тарифе. На мой онлайн первичка платная . А так, свиней и пионера я вообще на вторичке по номиналу почти брал.
