|time|user|text
145|21.01.2019 19:24:53|Helena Yakh|Возьмите измором. Все обращения письменно с аргументацией и контактами менеджера вашего и человека из техподдержкипосле 2 писем мне дали персонально ответственных , кто вашим вопросом занимается. У меня с Финам только так удалось решить эти вопросы по первичному размещению и РПС. Причём в процессе переговоров размещения Светофора в октябре ещё и 6 видов непонятных комиссии отменили. Теперь вполне адекватные сборы 0.0177 и 0.234  от сделки
147|21.01.2019 19:25:53|Сергей Ковалев|а исин по ломастеру известен
148|21.01.2019 19:26:42|Harry Lime|Да
149|21.01.2019 19:27:09|Максим Кочнев|RU000A1001K7
151|21.01.2019 19:27:30|Сергей Ковалев|спасибо
152|21.01.2019 19:28:31|Aleksandr|Люди , вы какими обьемами Ломастер брать собираетесь  Заруба с ВТБ имеет смысл наверно чтоб хоть что то путнее сэкономить . ВТБ то так просто не отступит
154|21.01.2019 19:29:44|Konstantin Permyakov|https//m.vedomosti.ru/business/articles/2019/01/21/792002krasnoeibeloe
155|21.01.2019 19:30:01|Harry Lime|Обсудили уже
156|21.01.2019 19:30:07|Konstantin Permyakov|А смотрите ка, что в ритейле
158|21.01.2019 19:30:20|А что ты сделал для котэ!?|А кто владелец Бристоль
159|21.01.2019 19:30:28|Harry Lime|Кесаев
161|21.01.2019 19:32:27|Максим Кочнев|Denis у вас есть какаято договорённость в итоге с втб или проще с утра в стакан
162|21.01.2019 19:34:24|А что ты сделал для котэ!?|Он владелец Дикси И Бристоля тоже
163|21.01.2019 19:34:41|Harry Lime|Ага
165|21.01.2019 19:35:40|Zuev Aleksandr|7 континент не сдох ещё
166|21.01.2019 19:36:06|Harry Lime|Все это крайне низкомаржинальный закредитованный бизнес. Но если посмотреть на него как на продавца сигарет , открываются отличные возможности.
168|21.01.2019 19:36:59|Zuev Aleksandr|Аминь, туда ему и дорога
169|21.01.2019 19:38:14|Harry Lime|Даже до создателей Сибца дошло , что понастоящему озолотиться можно только на IPO.
170|21.01.2019 19:39:05|Zuev Aleksandr|И всё по честному
171|21.01.2019 19:44:42|Savel|Грустно это все
173|21.01.2019 19:45:16|Nikolay Pavlov|Инвестиции в облигации  Coursera https//www.coursera.org/learn/investiciiobligacii
174|21.01.2019 19:57:44|Harry Lime|КиБ старается позиционировать себя как магазин у дома , не как алкомаркет.
176|21.01.2019 20:08:41|Ilya|Он уже окешился на миллиарды, у него все ок
177|21.01.2019 20:09:21|Harry Lime|Галицкий  молодец , но от хорошей идеи отказался.
178|21.01.2019 20:10:45|Ilya|Эта идея большой вопрос Ведь она типа курения.
180|21.01.2019 20:11:17|Harry Lime|В таком варианте КиБ , Бристоль и Дикси крайне опасные конкуренты для Магнита и Х5. Очень опасные.
182|21.01.2019 20:12:37|Ilya|В Дикси люди ходят от безисходности. Чего они там сливают вообще не ясно
183|21.01.2019 20:12:46|Harry Lime|Сила КиБа в том , что туда человек приходит за батлом пива , цепляет десяток яиц и батон . Все для выручки КиБа предел мечтаний выполнен , а в Магнит ему идти уже не надо.
185|21.01.2019 20:13:31|Ilya|Вооот Крутой формат, и он часто ближе, чем остальные
186|21.01.2019 20:14:09|Harry Lime|Да там площади до 100 м многие , ну не надо 500 чтобы пивом с яйцами торговать.
188|21.01.2019 20:14:47|Ilya|У меня он под окном, всегда пойду в пятерку чуть подальше. Ничего там не дёшево, никакой он не дискаунтер. АтакАшан если уж нетто пошло.
190|21.01.2019 20:15:49|Harry Lime|Таких трэшаков типа Lidl и ED у нас и нет толком.
191|21.01.2019 20:16:08|Ilya|Spar видел
192|21.01.2019 20:16:43|Harry Lime|Spar  это суперпупер по сравнению с Europa Discount
194|21.01.2019 20:17:16|Ilya|Имхо, КиБу пришлось под крышу идти. Челяба, че
195|21.01.2019 20:17:37|Harry Lime|Безусловно
197|21.01.2019 20:18:44|Ilya|КиБ круче и динамичней был. Про атаку  да уже и все равно
198|21.01.2019 20:19:52|Harry Lime|У нас нет дискаунтеров с стеллажами из уголка и опилками на полу. Во Франции есть , в Германии есть , у нас нет.
199|21.01.2019 20:21:13|Aleksandr|Знаю одного сотрудника СК который SPAR ставил на уши за обнал , в 2017 году
200|21.01.2019 20:21:15|Harry Lime|Там маржи нет , кредитное плечо огромное.
203|21.01.2019 20:40:50|Ilya|А есть отчетность
204|21.01.2019 20:41:49|Alexey Vishnyakov|Так у магнита водка продаётся в магазинах  большего основной части клиентов и не надо
205|21.01.2019 20:43:08|Harry Lime|Для этого не нужно 300500 метров площади , хватит 100.
207|21.01.2019 20:46:40|Alexey Vishnyakov|Да ну  мне кажется те, кто водку из пьяных дворов брали все по вымерли в 90. Последние, может, в начале 2000. Сейчас и в магазинах водка стоит дёшево
208|21.01.2019 20:47:39|Harry Lime|В РФ параллельный оборот алкоголя , легальные продажи упали в пять раз за 10 лет
210|21.01.2019 20:49:33|Aleksandr|У меня чехи знакомые всю жизнь сидят на этой водке с завода . Три тарифа всегда было акциз оригинал акциз левый без акциза . Сама водка одна и таже
211|21.01.2019 20:53:42|Harry Lime|Вот она правда жизни.
212|21.01.2019 21:03:07|YK911|Мне кажется пописят сейчас может быть только водка разлитая в том же гараже и то очень в этом сомневаюсь, т к 5 литров медицинского спирта, беглым поиском дало 1000р, вот и считайте
214|21.01.2019 21:07:44|Aleksandr|А кто ж ее из медицинского то делает Спирт то китайский в основном
215|21.01.2019 21:08:14|YK911|А медицинский думаете люкс или экстра
216|21.01.2019 21:08:19|Сергей Ковалев|https//vk.com/wall72973891_66243
217|21.01.2019 21:08:54|Harry Lime|ВО , мое детство прошло на ЛВЗ
218|21.01.2019 21:08:56|Сергей Ковалев|может все таки пропихнут
219|21.01.2019 21:09:23|Aleksandr|Думаю просто дороже.Ну и надеюсь что качественней
220|21.01.2019 21:09:31|Harry Lime|ВО  высшей очистки
222|21.01.2019 21:09:57|Aleksandr|ну врачи пьют, они то знают
223|21.01.2019 21:10:10|Harry Lime|Да норм там все , главное сырье
224|21.01.2019 21:10:17|Aleksandr|ах, молодость 
225|21.01.2019 21:10:30|YK911|Вот и я том же, что мед спирт не самый дорогой
226|21.01.2019 21:10:40|Aleksandr|Это вообще афоризм прям
227|21.01.2019 21:10:53|Harry Lime|Все мы вышли из гетто
228|21.01.2019 21:11:08|Aleksandr|вышли ли 
229|21.01.2019 21:11:30|Harry Lime|Кто смог и хотел  вышел
231|21.01.2019 21:13:49|YK911|Ну если украл забеслатно, то да, выгодно и по 30 руб продать
232|21.01.2019 21:14:19|Harry Lime|Без акциза рублей 30 и выходит.
233|21.01.2019 21:15:42|YK911|А если купил спирт, бутылку, подготовил воду, оплатил коммуналку, зп, аморт оборудования, то думаю больше 50р выходит гораздо
234|21.01.2019 21:16:05|Aleksandr|Щас админ нападет
235|21.01.2019 21:16:08|Harry Lime|Я боюсь мы слишком отклонились от темы чата.
236|21.01.2019 21:16:13|YK911|Да
237|21.01.2019 21:16:26|Harry Lime|Но поверьте , экономика там есть .
238|21.01.2019 21:16:40|Aleksandr|Остановитесь или я опрос прикреплю какой нибудь и тогда админ точно прийдет
239|21.01.2019 21:32:14|Ilya|Наконецто....уже лет 10 МФЦ пытаются сделать, а золото только сейчас подключают..
240|21.01.2019 21:33:16|AirB|как относитесь к ВДО микрофинансовых контор покупаете или боитесь что подвиг ДД повторят
241|21.01.2019 21:38:15|Максим Кочнев|Ну по идее из облигаций есть только манимен
245|21.01.2019 21:43:13|Savel|Микрофинансовые конторы делятся на 2 больших типа зарабатывающие на вкладчикам и на клиентах. Определив, какого типа контора, мы можем понять, стоит ли о ней думать дальше.
246|21.01.2019 21:45:06|Oleg Egorov|...и если б водку гнать не из опилок, то чтоб нам было с трехчетырех бутылок...с
247|21.01.2019 21:45:07|Savel|По кармани вот, например, пока неясно. Судя по убытку, пока она первого типа. Но некоторые и я втч поверили красивым словам владельца  и теперь у нас их облиги.
248|21.01.2019 21:46:10|Oleg Egorov|Интересно, почему на рынок ВДО не выходят какиенибудь производители инновационных самогонных аппаратов  Время еще не пришло 
249|21.01.2019 21:46:47|Alex Petroff|Эта ситуация сегодня обсуждалась здесь
252|21.01.2019 21:50:24|Aleksandr|Ура 
253|21.01.2019 21:51:05|Oleg Egorov|Логично было бы от срока существования брокерского счета отталкиваться и оборотов.
254|21.01.2019 21:51:24|Savel|Это идиотизм. Вот есть студент экономфака с богатым папой. И папа даёт ему 400 косарей со словамиони твои, сынок.ты ж экономист, преумножай. И сынок вместо походов в клубы или покупки подержанного таза решает проверить знания вузовские. На бирже. Так вот. Тут бы ему самые адские инструменты попробовать. А низя. Глупость.
255|21.01.2019 21:51:43|Максим Кочнев|Логично вобще чьи деньги тот и решает что с ними делать
256|21.01.2019 21:52:09|Savel|Именно. Какое дело брокеру, если я решил все посадить
258|21.01.2019 21:52:37|Aleksandr|а зачем казино запретили 
259|21.01.2019 21:53:02|Savel|Оно слишком доступно
260|21.01.2019 21:53:05|Oleg Egorov|Вообще чувствуется, что пытаются убрать любые поводы для потенциального обострения соц.напряженности
261|21.01.2019 21:53:12|Savel|А квик поди установи
262|21.01.2019 21:53:31|Oleg Egorov|Казино  это чистый криминал и отмывание
263|21.01.2019 21:54:06|Максим Кочнев|Не надо тут стереотипов
264|21.01.2019 21:58:03|Harry Lime|Ну да , а разве это плохо.
267|21.01.2019 22:00:26|Alex Petroff|С одной стороны я вижу некую концепцию уберечь субъектов, не имеющих знаний и опыта от необдуманных действий на рынке, принудительно ограничив их риски. А потом, с ростом суммы и опыта и после сдачи экзаменов типа велкам. А с другой стороны субъекты, почувствовавшие вкус крови ВДО, взвоют...
268|21.01.2019 22:00:50|Deleted Account|Наверняка это будет пустая формальность
269|21.01.2019 22:01:54|Harry Lime|В смысле , я так понял это касается только новоприбывших.
270|21.01.2019 22:02:59|Максим Кочнев|Да ничего не делается просто так. От излишней любви и заботы всегда только хуже
271|21.01.2019 22:03:18|Alex Petroff|В силу норм ГК закон не распространяется на более ранние правоотношения, если ухудшает их. Но могут придумать хитрость гатскую какуюнибудь...типа все сначала, прежние заслуги долой, т.к. новые правоотношения.
272|21.01.2019 22:03:28|Harry Lime|У меня на финкреде мой преподаватель по РЦБ слил депо в 1998 году. Это к кейсу о студенте эконома.
273|21.01.2019 22:03:57|Максим Кочнев|Главное понимать что начало всегда лёгкое и простое
276|21.01.2019 22:06:05|YK911|Инициатива из разряда идей цк кпсс, никого не пущать, ато это, как бы чего не было. Если уж хотят повысить фин грамотность, сделать на базе ММВБ, бесплатный онлайн курс, обучение месяц или быстрее если осилишь, интересный, познавательный с видосами и примерами, в конце экзамен, все иди торгуй
277|21.01.2019 22:06:34|Максим Кочнев|У нас только методом запретов чтото делать умеют
279|21.01.2019 22:08:02|YK911|Как же не хватает креативных и талантливых людей в управлении отчизной. Но опять же, запретить легче, а что то там придумывать, как бы чего, это...
280|21.01.2019 22:09:08|Nikolay Pavlov|Вот я выше скинул курс
281|21.01.2019 22:10:03|Harry Lime|Будет сдача экзаменов за клиентов сотрудниками брокеров .
282|21.01.2019 22:11:01|Максим Кочнев|Новый тип заработка. Репититор по подготовке к сдаче экзамена на бирже
284|21.01.2019 22:11:54|Aleksandr|Там же написано , СРО будет . В чате будем аттестаты давать
285|21.01.2019 22:13:00|Pavel Bilenko|Я Васю видел. Все в порядке у них 
286|21.01.2019 22:13:10|YK911|Не соглашусь, подобный курс, мог бы значительно облегчить жизнь этих самых сотрудников, вы думаете отвечать по телефону или в чате брокера на одни и те же вопросы пачками доставляет удовольствие. Легче отправить учиться, и дать офз в придачу
287|21.01.2019 22:13:23|Aleksandr|Есть тут Агроэлитчики  Мнение скажите про интервью Гольдмана.
288|21.01.2019 22:13:37|Harry Lime|Это не поможет
289|21.01.2019 22:13:59|Aleksandr|Вася  это бородач 
290|21.01.2019 22:14:32|Pavel Bilenko|Селиванов. Из Легенды
291|21.01.2019 22:14:50|YK911|А нынешнее ограничение в 6млн чем лучше А если 3млн, а если 5 млн Откуда вообще эти цифры
292|21.01.2019 22:14:51|Harry Lime|Завтра посмотрю , напишу
293|21.01.2019 22:15:59|Aleksandr|Все, никому пока не говорите ничего . Докуплю завтра , потом расскажете подробней про У Васи все ок . А то знаю , вон про обувь идею подкинул , плиту в 23 млн сьели за 3 часа.
294|21.01.2019 22:17:02|YK911|Твиты трампа, не
295|21.01.2019 22:17:39|Aleksandr|Трамп из чата спер идеи 
296|21.01.2019 22:17:39|Alex Petroff|Да мы же и вниз могем
297|21.01.2019 22:18:48|Aleksandr|Ну , да вниз это примерно так   Видел Васю , не очень конечно у них дела там .
298|21.01.2019 22:19:24|YK911|Вы поаккуратней, с манипуляциями рынком 
299|21.01.2019 22:19:38|Максим Кочнев|Уверен чат в сумме и 1 от размещения не насоберет
302|21.01.2019 22:19:49|Aleksandr|Америка с нами 
304|21.01.2019 22:20:44|Максим Кочнев|Ну да
305|21.01.2019 22:21:05|Aleksandr|Чат может процентов 5 потянуть
307|21.01.2019 22:21:43|Максим Кочнев|100 млн Типа по 100 тыс на участника
309|21.01.2019 22:22:07|Aleksandr|А Легенда недоразместилась так то
311|21.01.2019 22:23:06|Максим Кочнев|Ну ок. Но я более чем уверен что у нас нет ни одного с млн в легенде максимум 1
312|21.01.2019 22:23:14|Aleksandr|Так что выпуск лимонов на 50  70 спокойно сьест
313|21.01.2019 22:23:18|Максим Кочнев|Но не в легенде же
314|21.01.2019 22:23:42|Harry Lime|Давала бы Легенда 18 , вышел бы Вася и сказал все отдам без базара. Минимум 5 процентов выпуска ушло бы в чат. Даже завтрак в Ритце бы не потребовался.
315|21.01.2019 22:24:44|Максим Кочнев|Ну я пишу максимум 1
316|21.01.2019 22:24:46|Aleksandr|есть один псих
317|21.01.2019 22:25:07|Максим Кочнев|Да не псих. Если размеры депо позволяют
319|21.01.2019 22:25:40|Aleksandr| 100
323|21.01.2019 22:29:13|Denis Kozlov Septem|Вставайте в стакан по 100,25 как можно раньше. Если мы сможем договориться утром с ВТБ, то мы дадим контакты правильного трейдера  отмените заявку в стакане и поставите РПС
324|21.01.2019 22:30:26|Максим Кочнев|Ок, спасибо. Буду вставать. Так что если что извиняйте у кого заберу из стакана
325|21.01.2019 22:31:00|Denis Kozlov Septem|Там много заявок и есть большие заявки... Большие по нашим меркам. Для ВТБ, возможно, это копейки
326|21.01.2019 22:32:18|Aleksandr|ВТБ непробиваемая контора.Я файлик PDF с отчетами ежедневными брокера не могу добится 2 года .
328|21.01.2019 22:33:22|Дмитрий Адамидов|мне отчеты в Сбере приходят. иной раз даже дублируют
329|21.01.2019 22:33:48|Aleksandr|да , Сбер в двух форматах шлет.У него свои тупизмы
330|21.01.2019 22:33:54|Максим Кочнев|Тут проблема в том что они приходят в ворде и только так
331|21.01.2019 22:34:36|Дмитрий Адамидов|ну сбер обещал с 15 числа присылать только в ПДФ. но на всякий шлет и в хтмл. вот она  двойная запись
332|21.01.2019 22:35:25|Aleksandr|видимо им лицензию продлили на Word или взломали 
333|21.01.2019 22:35:45|Alex Petroff|Надо понимать математику процесса. Если выпуск 50 млн. Допустим 40 вы размещаете среди больших людей по 4 млн на первичке. Или иную сумму кратную 4. Грубо говоря остается на вторичку от 2 до 6 млн. И все. Иной размер на себя вы брать не будете. Это и пойдет в стакан под раздачу. Либо ВТБ пойдет на встречу, но это не точно. Я в такой ситуации вижу дополнительный резерв таким ставить заявку, заранее оговоренную с Денисом и отличающуюся от 100.25. К примеру 100.25001 или иную необычную, вплоть до 100.26 и т.д. И лот подтверждать ему, что заявка ваша. Он его видит, что это ваш лот и его взяли в работу. Только если стакан к тому времени не выйдет выше 101...
334|21.01.2019 22:35:46|Дмитрий Адамидов|не в ворде не было. тхт был
335|21.01.2019 22:35:58|Denis Kozlov Septem|Обсудим на вебинаре. Там есть нюансы. Для ВДО есть решение
336|21.01.2019 22:36:37|Sergey Sidorov|50 чел проголосовавших весили 356 млн оценка по медиане диапазона шага. Жаль, что админ психанул, хотя он у нас в общемто демократ...
337|21.01.2019 22:36:50|Alexey Z|Кстати, ктото днём спрашивал про купон МСБ. Пришёл сегодня открывашка.
338|21.01.2019 22:37:35|Максим Кочнев|Да понятно что придёт
339|21.01.2019 22:37:36|Aleksandr|да я колхозник , разницы толком незнаю.У меня давным давно Mac Os
340|21.01.2019 22:37:41|Максим Кочнев|Куда он денется
341|21.01.2019 22:37:49|Denis Kozlov Septem|ЕБЭ  Будем использовать
342|21.01.2019 22:38:36|Alexey Z|Просто вроде ктото волновался, вот успокаиваю 
343|21.01.2019 22:39:30|Pavel Bilenko|Вот на нашем следующем размещении и посмотрим, сколько чат съест
344|21.01.2019 22:39:49|Aleksandr|Вот бы у нас организатор какойнить вышел бы в чат и сказал как Гарри советует  Ребята , отвечаю , во все вник , кидка не будет , люди расчитаются . Купон 17 
345|21.01.2019 22:40:31|Максим Кочнев|Ломбард
346|21.01.2019 22:40:32|Alex Petroff|Бернштам примерно так и собирал людей во второй проект...
347|21.01.2019 22:40:36|Harry Lime|А когда ждать  февраль или уже март
348|21.01.2019 22:40:54|Aleksandr|а что у нас следующее после свинины и десертиков в пакетах 
349|21.01.2019 22:40:59|Дмитрий Адамидов|Котофэ так делал на МФД по СУ155. не очень хорошо вышло в итоге
350|21.01.2019 22:41:06|Pavel Bilenko|следующая неделя
351|21.01.2019 22:41:09|Denis Kozlov Septem|23 января
352|21.01.2019 22:41:17|Максим Кочнев|Это бэлти
354|21.01.2019 22:41:36|Giovanni Goudini|Сейчас будет обзвон как в дд прошлой весной
