|time|user|text
380|18.06.2018 23:42:29|Alex Petroff|Про публикацию о проблемах в пиндосовской экономике выскажу мнение. Статья весьма поверхностна и в ней показана информация уровня газеты Комсомольская правда. Взаимосвязь между повышением госдолга с одновременным увеличением стоимости заимствований и его обслуживания лежит на поверхности и видна, как мне кажется, даже студенту 1 курса эконом.факультета. Если копнуть глубже, то можно обнаружить более серьезные проблемы. Как ни странно в пендосии большие социальные обязательства. Огромные. Это пенсии выплаты военным, полиции, пожарным. Различные выходные пособия. Охрененно раздутая программа медикэир. Ее еще называют обамакэир. 1.5 трл. долларов в год, если не ошибаюсь. И от нее пока никак не получается отказаться. Добавьте сюда терки с конгрессом каждые 810 месяцев по повышению гос.долга. Дико раздутый военный бюждет. Они же обеспечивают свое физическое присутствие почти во всех регионах планеты. Да еще и войну ведут. Это огромные бабосы. И это по сути все за счет займов. У них в конституции написано нет денежков в бюджете займи. Еще проблемы с региональными бюждетами, они социальные функции во многих штатах поддерживать не могут в полной мере. Содержать управленческий аппарат. Это все не шутки. И с моей точки зрения...пендосия уверенно шагает к прощению своего внешего долга всем и введению некой новой денежной еденицы. А в более отдаленной перспективе к скатыванию до уровня региональной державы. Сугубо мое мнение.
382|19.06.2018 00:35:24|Дмитрий Адамидов|сам факт примечателен появленя такой статьи. не было раньше такого
384|19.06.2018 00:37:23|Nick Nick|100 несогласен. Долги есть. Но они внутренние на 90. В Японии все тоже самое но цифры ещё выше. Сами себя банкротить никто не будет. И вообще современные финансы  это по определению вечная и бесконечная пирамида. Все понимают что отдать долги нельзя , но это и не потребуется . Обслуживают долг и этого достаточно. Казалось бы абсурд , а работает и дальше так и будет.
385|19.06.2018 00:37:42|Harry Lime|Когда уже будут жечь доллары на Красной площади
386|19.06.2018 00:38:56|Дмитрий Адамидов|как можно сжечь доллары, выпущенные в безбумажном виде
391|19.06.2018 10:09:16|Сергей Ковалев|кто то скупает грузовичкофф, до 104 цена улетелп
392|19.06.2018 10:14:06|Harry Lime|Хотим следующий купон 13 это называется.
395|19.06.2018 10:22:51|Сергей Ковалев|рубль скакнул до 64, офз длинные падают....
396|19.06.2018 10:23:05|Harry Lime|И это только начало...
397|19.06.2018 10:34:01|А что ты сделал для котэ!?|А дивиденды в июле  Не успел
398|19.06.2018 10:52:36|Giovanni Goudini|Ребята, а почему никто не высказывает версию, что просто продали старые выпуски
400|19.06.2018 10:58:34|Harry Lime|Посмотрим статистику за май , если мыслить категориями нашего ЦБ они накупили золота на всю катушку. Золотодобытчикам надо радоваться  рэйт хайк за рэйт хайком , а золото стабильно.
401|19.06.2018 10:59:51|J T|Отличный план на исходе суперцикла
404|19.06.2018 11:00:37|Harry Lime|Поставят золотую статую вождя в каждом городе.
405|19.06.2018 11:11:10|Дмитрий Адамидов|Интуристы валят из ОФЗ. Золотая статуя  хорошая мысль
406|19.06.2018 11:11:45|Harry Lime|Вот они, ваши пенсии...
407|19.06.2018 11:13:32|Сергей Ковалев|в моей старости ее вообще не будет...
408|19.06.2018 11:15:07|Harry Lime|ОФЗП надо Минфину выпустить, покупаете сейчас , купон с 2040 года.
409|19.06.2018 11:16:43|Сергей Ковалев|лучше ничего государству вообще не отдавать а копить спмому
411|19.06.2018 11:17:48|Harry Lime|Я чувствую ктото давно не перечитывал книгу Как мы проводили обмен облигаций.
412|19.06.2018 12:00:45|Дмитрий Адамидов|да, это непростительно
413|19.06.2018 12:17:12|Konstantin Permyakov|Офзсг
415|19.06.2018 12:19:10|Harry Lime|Минфин ещё систему выигрышей вернёт. В каком году какой выпуск получит купон.
416|19.06.2018 12:21:06|Alex Petroff|Такими темпами выплату купонов скоро увяжут с пенсионным возрастом. Дожил до 65  получи купон и возрадуйся
417|19.06.2018 12:21:24|Harry Lime|А я о чем.
420|19.06.2018 12:30:55|А что ты сделал для котэ!?|Подскажите пжл  есть где то в сети график не цены офз, а график доходности Не по одной офз, а в целом И такой же вопрос  по корп бондам 1 и 2 уровня
421|19.06.2018 12:32:43|Konstantin Permyakov|Да
426|19.06.2018 12:35:03|Alex Petroff|Я смотрю это в онлайнброкере. Все ОФЗ в одной вкладке списком и упорядочить по дохе. Все в реальном времени.
427|19.06.2018 12:36:04|Oleg Lvov|Гарри, уже CNBC магеДональдом с утра пугает, а Вы выигрышами. Коньяк по утрам в капельных дозах станет необходим  А впечатлительные люди реально на всё золотом физическим затарятся. Можно же по идее купить доллар или крону, и положить её да хоть в например Прагу. Если нет дохода по счету, можно даже избежать уведомления и заплатить 5 тысяч рублей. Тогда организаторы тиража точно не доберутся.
428|19.06.2018 12:45:30|А что ты сделал для котэ!?|В каком У меня альфа директ  ам вроде нет такой функции
429|19.06.2018 12:52:12|Alex Petroff|У меня брокер ВТБ. Квиком пока не пользуюсь. Работаю в указанной проге, мне так удобнее.
430|19.06.2018 13:00:57|Harry Lime|Хороший вопрос про кривые доходности в ОФЗ и корпоратах , посмотрел обзоры , что есть в открытом доступе Райф, Зенит , Велес , Локо, все не то. Самый информативный на мой взгляд ежедневный обзор у ГПБ , на сайте не обновляют сто лет  если есть доступ у кого  выкладывайте смело
431|19.06.2018 13:34:26|Harry Lime|Бум корпоративных облагаций объясняется исключительноучастием госкомпанийРоснефть и Газпром.Чуда развития и доступности корпоративного привлечения нет https//bit.ly/2lkplG2 MarketOverview
432|19.06.2018 13:35:21|Harry Lime|Интересна этимология слова облагация произв. от лажа, облажаться.
433|19.06.2018 13:45:36|Konstantin Permyakov|По корпоративным облигациям я смарт лабом пользуюсь https//smartlab.ru/q/bonds/
434|19.06.2018 13:46:41|А что ты сделал для котэ!?|Я типа этого имел в виду https//m.ru.investing.com/ratesbonds/russia10yearbondyield
435|19.06.2018 13:47:41|Harry Lime|Скока людей заехало в РЖД32 благодаря этому графику , не счесть.
436|19.06.2018 13:48:00|Konstantin Permyakov|Есть такое
442|19.06.2018 14:44:16|Konstantin Permyakov|Святой Илон объявил о саботаже одним из сотрудников
443|19.06.2018 14:54:08|Дмитрий Адамидов|Великолепно сформулировано
447|19.06.2018 14:58:11|Harry Lime|На смену атлантам Рэнд пришли герои комиксов...
448|19.06.2018 15:12:47|Konstantin Permyakov|https//www.google.com/amp/s/amp.rbc.ru/rbcnews/business/19/06/2018/5b288c129a794742c84e407e
450|19.06.2018 15:15:24|ААА|Он лох, а можно просто статистику пром. производства переписать как тебе надо.
451|19.06.2018 15:18:27|Harry Lime|Маск не может ошибаться , если только враги введут его в заблуждение.
453|19.06.2018 15:26:48|Konstantin Permyakov|Он за модель 3 депозиты собрал, так что так просто переписать не получится
454|19.06.2018 15:27:23|Дмитрий Адамидов|депозиты надо объявить пожертвованиями
455|19.06.2018 15:28:11|Harry Lime|Есть ещё святой мученик Стивен Джобс, блаженные Билл Гейтс и Марк Цукерберг , целый пантеон.
456|19.06.2018 15:28:49|Konstantin Permyakov|И выпустить облигации на производство сушёных ягод на Аляске
457|19.06.2018 15:30:02|Giovanni Goudini|На investing.com
460|19.06.2018 15:30:58|А что ты сделал для котэ!?|Троцкисты плетут заговоры
463|19.06.2018 15:32:11|Harry Lime|Структурников под это дело настрогали...
464|19.06.2018 15:34:46|Alex Petroff|АПРИ по состоянию на тудэй разместился в объеме 188.5 из 200.
465|19.06.2018 15:35:41|Giovanni Goudini|А облигации  индульгенциями
466|19.06.2018 15:39:29|Denis Kozlov Septem|Я тоже сейчас их анализировал. До сих пор размещается по номиналу, на бирже торги 9798. Такое впечатление, что андеррайтер продает в рынок с дисконтом, набирает 4 млн. руб. и покупает очередной лот по номиналу и так по кругу
467|19.06.2018 15:41:19|Harry Lime|Эти же ребята планируют размещать такой известный бренд как ЧЗПСН , пожелаем им удачи после веселого размещения Флая.
468|19.06.2018 15:43:08|Giovanni Goudini|Наверное пул с мфд переподписку устроит в чзпсн
469|19.06.2018 15:43:47|Harry Lime|Да по 1й бумаге каждому мфдшнику  вот все и разбежалось.
470|19.06.2018 16:42:09|Oleg Lvov|
471|19.06.2018 16:49:19|Harry Lime|БОНДЫ США  ЗОЛОТО  РОССИЯ Россия накапливает золото, избавляется от бондов США https//t.me/markettwits/10942
472|19.06.2018 16:49:37|Harry Lime|Ну шо я говорил
473|19.06.2018 16:53:42|Сергей Ковалев|золотым статуям быть
474|19.06.2018 16:56:23|Дмитрий Адамидов|а считаю надо ворота делать золотые. Как у ТуркменБаши
475|19.06.2018 16:56:47|Сергей Ковалев|туалет не забыть золотой
476|19.06.2018 17:01:57|Oleg Lvov|Святой Илон уже отбичевал грехи общественного транспортана нём много other people and one of who might be a serial killer, OK. Пока его святейшество изволит платить 7 в валюте, его можно даже терпеть
477|19.06.2018 17:03:33|Дмитрий Адамидов|вас послушаешь, так и чат хочется переименовать в свидетелей святого Илона
484|19.06.2018 17:50:05|Konstantin Permyakov|Съедят
486|19.06.2018 17:55:33|Giovanni Goudini|Вот именно, его хотя бы с чаем можно
487|19.06.2018 17:59:40|Harry Lime|А у нас активничает ННК , скупает нефтегазодобывающую мелочь на сэкономленные на облигационерах деньги.
489|19.06.2018 18:06:32|Дмитрий Адамидов|а что им еще делать запасов нормальных им не дадут все равно
493|19.06.2018 18:14:53|Harry Lime|ГТЛК  5,95
495|19.06.2018 18:37:13|Harry Lime|ГТЛК 5  таргет 99.
496|19.06.2018 19:37:16|Denis Kozlov Septem|200 млн за 2,5 месяца. Неплохая скорость
500|19.06.2018 19:39:07|Harry Lime|ПЮДМ судя по всему весь год будет размещаться.
501|19.06.2018 19:39:31|Denis Kozlov Septem|Вроде нормальная скорость
503|19.06.2018 19:39:59|Harry Lime|Такое ощущение , что толкают чисто рознице.
505|19.06.2018 19:40:52|Denis Kozlov Septem|Весь high yield толкают рознице. Другим инвесторам на балансе нельзя это держать
508|19.06.2018 19:41:51|Harry Lime|Пока есть желающие в стакане.
513|19.06.2018 19:49:17|Denis Kozlov Septem|ДД был рейтингованным эмитентом. Это он потом свалился в пике
514|19.06.2018 19:50:06|Harry Lime|Когда размещался тысяче рублёвый выпуск рейтинга у него уже не было.
515|19.06.2018 19:50:19|Denis Kozlov Septem|Так этот выпуск банки и не брали
517|19.06.2018 19:51:18|Harry Lime|Ну както он оказался у ОК банка. 20 процентов. Сидельцы в ДД подтвердят, здесь неоднократно обсуждали.
520|19.06.2018 19:53:58|Denis Kozlov Septem|Прямого запрета на покупку высокодоходных облигаций у банков и НПФ нет. Но такие бумаги взвешиваются с коэфф. 0. Поэтому эти бумаги вычитают из капитала
521|19.06.2018 19:54:29|Harry Lime|Видимо демон жадности приходит и к банкирам.
522|19.06.2018 19:55:38|Denis Kozlov Septem|Не могу утверждать точно, но, насколько мне известно, институционалов там нет. Есть крупные частные инвесторы  на десятки миллионов руб. Такие инвесторы, конечно, купили не в стакане, а по прямым рекомендациям организаторов
524|19.06.2018 19:56:38|Harry Lime|Ну ПЮДМ то толкают жёсткому ритейлу.
525|19.06.2018 19:57:05|Denis Kozlov Septem|Я знаю два банка, как минимум, которые держат у себя на балансе такие бумаги. Но даже они стараются скинуть эти бумаги до отчетной даты
526|19.06.2018 19:57:41|Harry Lime|А разве это сложно, сдал на техничку , потом откупил.
527|19.06.2018 19:58:22|Denis Kozlov Septem|Для этой цели размещение сделали объемом 190 млн руб., чтобы не превысить планку в 200 млн. Это позволяет при первичном размещении не формировать лоты по 4 млн руб.
528|19.06.2018 19:58:38|Harry Lime|Безусловно
529|19.06.2018 19:58:58|Denis Kozlov Septem|ЦБ это видит. Такие схемы давно не канают
532|19.06.2018 20:00:26|Harry Lime|Кстати , вы определились с купоном Ломастера Или все 21го.
533|19.06.2018 20:00:35|Deleted Account|Они и кредитовали дд напрямую и Облигации были Наверное какой то схематоз как обычно
534|19.06.2018 20:00:52|Harry Lime|Конечно схематоз.
535|19.06.2018 20:05:41|Denis Kozlov Septem|Ориентир 19. Будем смотреть на спрос. Возможно, будет ниже
538|19.06.2018 20:07:11|Harry Lime|Я же говорил , Рояль надо было сначала , все правильно , сначала закуска, потом основное блюдо.
539|19.06.2018 20:07:41|Denis Kozlov Septem|Параллельно идет Мясничий от Цериха, но там 13.5 купон
541|19.06.2018 20:09:11|Harry Lime|У Цериха ещё будут стекольщики , но финанс , и какието аграрии. Видимо купоны будут ещё ниже.
542|19.06.2018 20:10:01|Deleted Account|19 купон это лихо
543|19.06.2018 20:10:46|Harry Lime|Предыдущие выпуски были 22 , так что вполне помоему.
547|19.06.2018 20:14:45|Denis Kozlov Septem|А что за стекольщики
548|19.06.2018 20:15:53|Harry Lime|Да чуть ли не Савер гласс российский. Было в презентации Директ Лизинга в разделе творческих планов.
550|19.06.2018 20:25:22|Denis Kozlov Septem|Не могу знатьс
555|19.06.2018 20:28:48|Harry Lime|Черным по белому написано  развитие сети по франшизе. Только если их стукнуло по голове выкупить недвижимость под своими магазинами. В рефинанс кредита я не верю  была бы программа , почитал  посмотрел.
556|19.06.2018 20:29:11|Denis Kozlov Septem|Для франшизы не нужны деньги
558|19.06.2018 20:29:33|Harry Lime|Нет конечно , вот я и строю предположения куда их деть.
559|19.06.2018 20:31:18|Denis Kozlov Septem|Если честно, пока из конкурентов мне нравится только грузовик
560|19.06.2018 20:31:37|Harry Lime|С заявленными показателями  оборот 500 , 30 процентов рентабельности их бы легко прокредитовали 1012 процентов Сбер, ВТБ .
561|19.06.2018 20:32:43|Denis Kozlov Septem|Кстати, после ухода Полетаева Сбербанк проводит внутреннее расследование по выданным кредитам. По слухам, сбербанк на три месяца остановил всё кредитование. Если это правда, то на рынке кредитования будет коллапс
562|19.06.2018 20:32:44|Oleg Lvov|А возможно что комплекс уже в залоге. Выбрали ёмкость залоговуюпошли на рынок high yieldпродали много мяса китайцам. Видимо магеДональд сейчас расширит емкость китайского рынка для всех кроме США. Ну а худший вариант  торговый дом Эрлан
563|19.06.2018 20:33:26|Denis Kozlov Septem|Эрлан
565|19.06.2018 20:35:00|Harry Lime|На самом деле и РедСофт и Мясничий думаю банально  это деньги в аренду навсегда. Это и привлекает .
566|19.06.2018 20:46:19|Denis Kozlov Septem|Ладно, хорош трепаться. Болеем за наших
568|19.06.2018 20:47:05|Morkoy|Но ставим на Египет
570|19.06.2018 20:51:00|Harry Lime|А нет такого , но с Бернштамом
572|19.06.2018 21:39:31|Oleg Lvov|В 95м году внезапно убежали от кредиторов за границу. Большой торговый дом был, по телеку рекламил, в один день 10 марта сбежали от долга в 130 миллионов. Тогда это были очень большие деньги 
574|19.06.2018 21:41:56|Harry Lime|Я почитал сейчас ветку высоходоходов на мфд , все плакають по упавшим ОФЗ. Тьфу , гадость. У меня они были когда доха там была 15 то бишь в 15м году .
576|19.06.2018 21:52:19|Denis Kozlov Septem|Завтра иду к ним на завтрак. Послушаю, что к чему
579|19.06.2018 21:54:58|Harry Lime|Легенда  это ПЮДМ человека с тугим кошельком. Он хочет 14 процентов купон, но Флай или ПЮДМ предложить ему стыдно.
580|19.06.2018 22:20:15|А что ты сделал для котэ!?|Кажется все проданные трежеря ушли на откаты соперникам сборной россии 
583|19.06.2018 22:38:53|K G|ждем НДС 25
584|19.06.2018 22:56:57|Denis Kozlov Septem|Молодцы
585|19.06.2018 22:59:04|J T|стикеры огонь
587|19.06.2018 23:27:15|Denis Kozlov Septem|Я был прав. Три мячика закатили 
589|19.06.2018 23:50:35|Сергей Ковалев|
591|20.06.2018 00:22:01|Giovanni Goudini|Если речь про свинину, то ввоз российской свинины в Китай запрещён. И даже русагро не может пролоббировать вопрос уже несколько лет,поэтому дальневосточный проект строится на 60 тысяч тонн, с возможностью расширения до 300, а не на 300 сразу . Китай импортирует свинину из США
598|20.06.2018 00:29:33|Pasha V|откуда ты так сечешь в свинине
599|20.06.2018 00:48:42|Giovanni Goudini|Аланизирую 3 компании из ашросектора сам
603|20.06.2018 00:49:30|Pasha V|а за украинскимм наблюдаешь
604|20.06.2018 00:49:41|Giovanni Goudini|Конечно, за мхп
606|20.06.2018 00:49:55|Pasha V|че скажешь
607|20.06.2018 00:50:02|Giovanni Goudini|58 экспортной выручки, круче газпрома
608|20.06.2018 00:50:03|Pasha V|покупатт
609|20.06.2018 00:50:10|Giovanni Goudini|Надо брать хули
610|20.06.2018 00:50:21|Pasha V|у тебя ib есть
611|20.06.2018 00:50:25|Giovanni Goudini|Особенно после того как офис с Люксембурга на Кипр перенесли
614|20.06.2018 00:51:05|Pasha V|а чем кипр лучше там же shareholderov наебать проще некуда
615|20.06.2018 00:51:12|Giovanni Goudini|Нет, можно через российского брокера, мхп в Лондоне торгуется
617|20.06.2018 00:51:16|Pasha V|понял
618|20.06.2018 00:51:22|Giovanni Goudini|Правда в Киеве расписки
621|20.06.2018 00:52:13|Pasha V|я и так в киеве физически нахожусь
622|20.06.2018 00:52:22|Giovanni Goudini|Societe Europe
623|20.06.2018 00:52:32|Pasha V|шо это
624|20.06.2018 00:52:55|Giovanni Goudini|Учи матчасть, это знает гугл
628|20.06.2018 00:55:22|Pasha V|они там с с дисконтном торгуются
