|time|user|text
713|19.06.2019 18:33:12|Andrey Hohrin|под подозрением в чем, Максим
714|19.06.2019 18:33:27|Максим Кочнев|ну посомтрите сообщение 20 вверх
715|19.06.2019 18:33:28|George Goognin|в общем, моя задача  не сказать, что ктото плохой или хороший, а разобраться, в чем принципиальная разница со стороны инвестора между ВДО и краудлэндингом 
716|19.06.2019 18:33:40|Михаил|Страшнее Афекса
717|19.06.2019 18:33:47|Максим Кочнев|ну я надеюсь мы вам объяснили свою точку зрения
718|19.06.2019 18:34:18|George Goognin|пока могу выделить . ликвидность . возможность доп.заработка на спекуляциях . налоговые льготы через ИИС
719|19.06.2019 18:34:39|Максим Кочнев|да, и получаем по итгу доходность примерно равна вашей официальной что на сайте
720|19.06.2019 18:34:56|Alex|. контрагентпрослойка, исчезающий в любой момент
721|19.06.2019 18:35:05|Andrey Hohrin|посмотрел. но ничего не понял. сравнивать облигации и краудлендинг я б не стал. разные деньги.
722|19.06.2019 18:35:12|Максим Кочнев|те имеем примерно ту же доходность, ну ок, для кого на пару процентов ниже и при этом такие плюшки как вот то что вы выделили
724|19.06.2019 18:36:00|George Goognin|в Карме инвесторы заключают договора с заемщиками, и мы даже сделали опцию доставки бумажных версий договоров с печатями для тех, кто не верит в силу электронных подписей 
726|19.06.2019 18:36:30|Harry Lime|А правда , что Директ новый выпуск рожает
727|19.06.2019 18:36:55|Максим Кочнев|ну я же попросил вас список, вы сказали что большинство ВДО  это как бы не очень
728|19.06.2019 18:37:02|Andrey Hohrin|мнений много. автор заинтересован в своем сегменте.
729|19.06.2019 18:37:06|George Goognin|я просто скинул скриншот инпрогресс 
730|19.06.2019 18:37:29|Alex|За последние два месяца произошло так много событий на рынке ВДО, что мы приняли решение обновлять волшебнаятаблица каждый месяц
731|19.06.2019 18:37:35|Alex|держите, не мучайтесь
732|19.06.2019 18:37:42|Максим Кочнев|ну вы можете список неблагонадежных компаний скинуть или нет. Вы же сами написали что смотрели и большая часть как бы не очень
733|19.06.2019 18:37:54|George Goognin|вот это прекрасно, спасибо
735|19.06.2019 18:38:54|Andrey Hohrin|я не против краудлендинга. я его пока не понимаю. и не понимаю, как туда засунуть даже 100 млн.р., а уж про миллиард совсем сложно, наверно. да и не понимаю пока, как объяснить инвестору, что такой продукт можно купить. пойму  тоже подключусь.
736|19.06.2019 18:38:59|Максим Кочнев|я про это
737|19.06.2019 18:39:18|George Goognin|да, я говорю, что с ходу не вижу какогото вауотличия между топуровнем заемщиков на краудлэндинге с доходностью 20 до налогов и лоулевелом на ВДО с доходностью 1415 естественно, надо копать глубже
739|19.06.2019 18:39:55|Anton|Сегодня вечер агитации за краудлендинг
740|19.06.2019 18:40:02|Andrey Hohrin|обоснуйте. на примерах. заявлението достаточно смелое.
741|19.06.2019 18:40:11|Максим Кочнев|как идет выплата долга. В конце срока проценты ежемесячно  тело потом или как
742|19.06.2019 18:40:34|George Goognin|в краудлендинге выплата долга в конце, проценты  ежемесячно
744|19.06.2019 18:42:59|Andrey Hohrin|отлично. после этого ваши замечания будут приняты. пока это просто заявление. не думаю, что участники чата сейчас прониклись вашими словами и подачей материала по типу они плохие, мы хорошие
745|19.06.2019 18:43:00|Harry Lime|Мне если честно плевать на прибыль , долг / выручка и CAGR , то есть прирост выручки , все крутится вокруг кэш флоу.
746|19.06.2019 18:43:12|George Goognin|опять же, повторюсь, наша задача  не сказать, что какойто сегмент рынка лучше или хуже, а разобраться, каких свойств не хватает инвесторам для радостного использования краудлэндинга 
747|19.06.2019 18:43:26|Максим Кочнев|отличие в том что те кто под 1415 както смогли пройти и отсев организаторов и отсев биржи и попоасть в ВДО, а те кто 20  те не могут, да у нихи размеры не сопоставимы как правило, на бирже компании большего размера, не всегда но как правило
748|19.06.2019 18:43:45|Andrey Hohrin|почитав ваши сообщения, я вижу только это и именно это.
749|19.06.2019 18:43:50|Михаил|Ну, так раз уровень один пускай идут на биржу регистрирую программы, велкам А то вы изобретаете какойто велосипед и убеждаете, что инвесторам надо тоже вместе с вами участвовать в этом бесполезном занятии. Биржа давно придумана, про преимущества вам уже много раз написали, а они огромные по сути. В конце концов есть КО. А если совсем стартап  пожалуйте к венчурным дядям.
750|19.06.2019 18:44:15|Михаил|ну вот, а продать свой долг другому можно у вас же нет вторички. и если мне понядобятся деньги, то в случае с облигациями их можно продать, а у вас как
751|19.06.2019 18:45:00|George Goognin|вторички на Карме для рыночных инвесторов пока нет, мы тестировали цессию от самой Кармы  в сторону инвесторов, и она работает теперь в очереди задач  полноценный вторичный рынок между инвесторами
753|19.06.2019 18:45:31|Михаил|Вот я и говорю изобретаете велосипед.
754|19.06.2019 18:45:53|Dmitry Manzor|надо попросить специалистов Кармы сделать скоринг наших эмитентов
755|19.06.2019 18:46:09|George Goognin|кстати, ради интереса, можно провести эксперимент 
756|19.06.2019 18:46:23|Михаил|А ребята решившие замутить линию обуви афекс, пускай у родителей/друзей занимают.
757|19.06.2019 18:46:30|Dmitry Manzor|Было бы интересно на самом деле
758|19.06.2019 18:47:12|George Goognin|компании, которым нужно до 100М, на биржу не пойдут, потому что брокерам невозможно на них заработать 
761|19.06.2019 18:47:47|Andrey Hohrin|теперь еще и брокеры виноваты. ну, вы  мастак по поиску друзей в диалоге
762|19.06.2019 18:47:55|George Goognin|я не обвинял брокеров 
763|19.06.2019 18:47:55|Максим Кочнев|ну вот Кисточки же заняли 40 млн, Трейдберри 40 млн и тд
767|19.06.2019 18:48:40|George Goognin|у Кисточек, вроде, написано про 300М в плане, но мы еще в процессе изучения
768|19.06.2019 18:48:41|Dmitry Manzor|Кисти 40, Груз 50
769|19.06.2019 18:48:50|Andrey Hohrin|наличие смайликов в конце каждой фразы  это проявление дружелюбия. я понял. но я не дружелюбен. я раздражен сейчас.
770|19.06.2019 18:48:53|Максим Кочнев|это план, этот план на десятилетия
771|19.06.2019 18:49:15|Dmitry Manzor|А почему у вас конечный бенефициар в Эстонии
772|19.06.2019 18:49:28|Alex Petroff|Немножко открою вам глаза. В чате есть представитель Мосбиржи, брокера ВТБ, представители эмитентов примерно 15, представители андеррайтеров не менее 10. И еще есть умные и образованные инвесторы в ВДО.
773|19.06.2019 18:50:06|Harry Lime|Разоблачение магии скорее
774|19.06.2019 18:50:10|George Goognin|у нас в команде бывший СТО ММВБ трудится, так что, мы только рады старым коллегам 
777|19.06.2019 18:51:00|Alex|СТО это где эмитентов проверяют
778|19.06.2019 18:51:12|George Goognin|СТО  это которые пишут программный код 
779|19.06.2019 18:51:35|Alex Petroff|Зачем нам ММВБ...Мосбиржа наше все...и немного СПБбиржа.
780|19.06.2019 18:51:42|George Goognin|в третий раз вынужден повториться, что мы не говорим, что ктото плохо делает свою работу, а пытаемся разобраться, как улучшить свой продукт
781|19.06.2019 18:52:05|Alex|ММВБ это мосбиржа так то
782|19.06.2019 18:52:08|George Goognin|т.е. понять, чего хотят инвесторы в нестандартные активы
783|19.06.2019 18:52:12|Алексей ayaye :)|интернетмагазин у них тоже есть. канал в телеграмме и почтовая рассылка, которую интересно читать. но, подозреваю, настолки гораздо хуже продаются без оффлайна.
784|19.06.2019 18:52:25|Alex Petroff|Мне Мосбиржа вкуснее
785|19.06.2019 18:52:35|George Goognin|я был одним из участников этого дикого ребрендинга из Майсекса в MOEX и слияния в РТС, поэтому я уже запутался, как их называть
787|19.06.2019 18:53:29|Alex|Предлагаю сосредоточится на достижениях кармы.
788|19.06.2019 18:53:44|Harry Lime|Майсекс  это общение кредитора с заемщикомдефолтником . Патентуйте крутой нэйм
789|19.06.2019 18:54:12|Alex|У вас там в достижениях и критовалюта даже. А не рассказываете про это, удалось продать альткоинов
790|19.06.2019 18:54:23|Михаил|Меня не покидает ощущение, что Дмитрий может вместе с сообщниками решили дико угареть и устроить этот капустник краудлендинг продавцов в чате. И что скоро появится надпись Улыбнитесь, вас снимают
791|19.06.2019 18:54:46|Дмитрий Адамидов|Коллеги, я на всякий случай призываю к корректности. Если есть обоснованные сомнения в фин. устойчивости, надёжности итд. в отношении кого бы то ни было, пусть они будут подкреплены аналитикой и документально. Биться на кулаках не стоит. Если коллеги готовы проанализировать своих клиентов и ВДО эмитентов  давайте дождемся результатов.
792|19.06.2019 18:54:58|Harry Lime|Я вполсилы сегодня тк угорел в другом месте
793|19.06.2019 18:55:18|George Goognin|мы честно говорим, что у нас  стартап, и что нам прямо сегодня не надо загружать миллиардов  краудфандинг  это . возможность заработать в ленивом режиме больше, чем 1215 . повышенные риски, по сравнению с рейтингованными эмитентами . низкая ликвидность
795|19.06.2019 18:56:43|Максим Кочнев|Как подтвердите выше 1215 аналоги типа Пенензы и ПОтока дают меньше По вашей компании статистику смотреть глупо ибо колво займов пока смешное
797|19.06.2019 18:57:59|Dmitry Manzor|А почему у вас конечный бенефициар в Эстонии
798|19.06.2019 18:59:03|George Goognin|Пока подтвердить можем только теми историческими данными, которые есть 
799|19.06.2019 18:59:03|Alex|Здорово. а собственную отчетность раскрываете, например у оффшора или главной кармы
800|19.06.2019 18:59:25|Максим Кочнев|. возможность заработать в ленивом режиме больше, чем 1215 слово возможность  это как понимать что может да а модет и нет Дак на бирже также. Купи акций на всю котлету и у тебя будет возможность заработать выше а может и нет Т.е.ю это совсем не гарантия и ладно гарантия, это даже не ожидаемый доход
801|19.06.2019 19:00:13|George Goognin|я так понимаю, что гарантий и в бондах тоже нет, ибо залогов по многим выпускам нет, АСВ нет, и любой эмитент может задефолтиться
803|19.06.2019 19:00:42|Максим Кочнев|в ВДО я могу сказать что у меня ожидаемых доход в БО 1516 и могу обосновать если хотите, речь не про гаранти, это понятно все ерунда, речь про ожидание
804|19.06.2019 19:00:58|George Goognin|надеюсь, что за месяцдва сделаем, ибо скорость зависит не только от нас
805|19.06.2019 19:01:01|Максим Кочнев|про гарантии это я ляпнул не то
806|19.06.2019 19:02:13|George Goognin|потому что проект международный, а к российским компаниям за границей относятся, мягко говоря, очень настороженно, увы
807|19.06.2019 19:03:33|Максим Кочнев|я вам просто приведу пример моего участия в потоке ПОКа заемщиков было мало  все было в шоколаде. И пока сроки были маленькие. Но как пошел рост заемщиков и рост сроков так потихой пошли проблемы, а потом все больше и больше Получаем тоже возможно и у вас. ПОка заемщиков мало  это да. Но надо же понимать что с ростом их числа проблемы появятся, а значит эти самые 17 чистыми будут уменьшаться ибо сейчас это в случае 100 успеха
808|19.06.2019 19:03:43|Дмитрий Адамидов|Вообще из всей дискуссии меня лично заинтересовал вопрос кредитного качества. Я более чем уверен, что некоторые наши ВДО гораздо качественнее многих рейтинговых компаний. Коллеги тут говорят что их заёмщики не хуже ВДО.
810|19.06.2019 19:04:43|Максим Кочнев|Меня в целом все устраивает в подобных платформах, кроме одного большого пункта  ликвиност. Поэтому в свое время свернул свое участие в них
811|19.06.2019 19:04:55|George Goognin|вполне возможно, надо экспериментировать  например, в Штатах альтернативные МСБкредиторы берут с заемщиков 2090 годовых, а инвесторам дают 57 все в USD
812|19.06.2019 19:04:57|Дмитрий Адамидов|Какие критерии на что смотреть итд
813|19.06.2019 19:05:20|Максим Кочнев|да. И может пусть проведут анализ для примера своих и некоторых ВДО эмитентов Тогда мы будем видеть наглядно
814|19.06.2019 19:05:28|Сергей Ковалев|понятные всем и закрепленные законом правила игры, по моему в этом
815|19.06.2019 19:05:30|George Goognin|да, я уже поставил себе напоминалку 
816|19.06.2019 19:06:23|Дмитрий Адамидов|Отлично. Я обязуюсь этот материал повесить в канале 
817|19.06.2019 19:07:57|Максим Кочнев|Давайте я вам даже подкину свой лиск хотелок Роял Капитал МСБ Лизинг Мясничий Кармани можете свой, можете чтото использовать из моего
819|19.06.2019 19:09:28|Alex Petroff|И у нас есть рояль в кустах по этим эмитентам. Как говорится, сравним полученные результаты
820|19.06.2019 19:09:37|George Goognin|основные критерии на мой взгляд наши ботаныэксперты дополнят потом, конечно же . рентабельность на капитал т.е. с учетом нескольких циклов оборота в год заметно выше ставки привлечения денег . диверсификация клиентов/покупателей . методичный рост 23 года подряд . прозрачность отчетности . хотя бы один фаундер с публичной репутацией . соотношение прибыли на капитал с долговой нагрузкой . наличие залога это все реже встречается
822|19.06.2019 19:10:30|Максим Кочнев|для меня лично главное  это отдаст компани долг или нет. Если компания должна отдать долг через год, мне все равно что с ней будет через 2, главное чтобы смогла отдать когда надо
823|19.06.2019 19:11:17|George Goognin|а как вы это поймете хватит ли чистой прибыли на покрытие долга   за этот год
824|19.06.2019 19:11:34|Alex Petroff|Есть еще хитрая и очень важная характеристика любого эмитента ВДО денежный поток. Даже в условиях дикой закредитованности только денежный поток дает нам веру, надежду и любовь к нему.
825|19.06.2019 19:13:00|Максим Кочнев|я это к слову скаал, что вы написали  это все более мнее правильно
826|19.06.2019 19:13:23|George Goognin|Ну ок, прибыль  это бухгалтерская заморочка, которую даже в белых странах считают как хотят
828|19.06.2019 19:14:29|Dmitry Manzor|Проанализируйте Ломбард, я хочу увидеть батл СептемКарма
829|19.06.2019 19:15:10|Alex Petroff|Бот раскрытия индифферентен к поиску Синновации. Блд.
830|19.06.2019 19:16:22|Dmitry Manzor|Лично для меня Ваша платформа закрыта, т.к. государство возвращает уплаченный ранее налог при вложении на Московскую биржу. Когда начнут возвращать с других мест будем думать
831|19.06.2019 19:16:45|George Goognin|А это только для ИИС, которые бетонируются на 3 года
832|19.06.2019 19:17:36|Dmitry Manzor|Да, но слово бетонируются не очень подходит
833|19.06.2019 19:18:39|Alex Petroff|Есть такое понятие  купонный комбайн. Но это для опытных судовладельцев. Им можно опустошить ИИС на абсотютно законных основаниях.
834|19.06.2019 19:18:51|Максим Кочнев|купоны с ИИС можно вывоить. Всякие схемы типа купонного комбайна  работают до сих пор
835|19.06.2019 19:20:46|George Goognin|Если у меня нет большого количества НДФЛ, то налоговую льготу я смогу получить только с прибыли от моих активов на ИИСе, и через 3 года
837|19.06.2019 19:22:03|Максим Кочнев|и вот тут то и вспоминаем про КО. На ИИС типа б весь купон с КО не облагается налогом
838|19.06.2019 19:22:23|Alex|Прорезюмирую тогда, что бы хотелось увидеть от вас 1. История займов в проекте. Каким компаниям выдавались заемы, когда, в какой форме и сколько. Желательно статистика по годам. 2. Отчетность головной компании Карма и/или оффшора Karma Development OÜ 3. Аналитика и пояснение что такое качественный заемщик.по вашему мнению. Возможно получится оценить какогото эмитента ВДО.
839|19.06.2019 19:22:24|Максим Кочнев|у меня нет НДФЛ  но у меня есть ИИС типа Б и там только КО
840|19.06.2019 19:22:53|Михаил|Ну так и с БО, разве нет
841|19.06.2019 19:23:11|Максим Кочнев|нет, с купона БО берется налог
842|19.06.2019 19:24:00|Dmitry Manzor|до 2017г 13, потом КС5 35 нет
845|19.06.2019 19:24:32|Dmitry Manzor|Компания Иволга капитал сделала табличку, сейчас скину
846|19.06.2019 19:24:55|Максим Кочнев|ммм вы про что сейчас про купонный комбайн или про КО
847|19.06.2019 19:25:09|George Goognin|Про комбайн
848|19.06.2019 19:25:18|Михаил|Это понятно. Я думал превышение на иис типа б не облагается и по ко и по бо.
849|19.06.2019 19:25:25|Максим Кочнев|ну да, там несколько брокеров. Открываем ИИС там и выводим
851|19.06.2019 19:26:01|Михаил|Да, спасибо.
852|19.06.2019 19:26:08|George Goognin|КО  это корпоративные облигации
853|19.06.2019 19:26:25|Михаил|Коммерческие
