|time|user|text
182|06.09.2018 22:43:48|Vladimir Sotnikov|вспомнилась шутка 20142015 Нет такого события, на которое рубль не отреагировал бы падением. Вот я последние 2 недели без позиции, хотя в заключительный день влез, порадовался, далее цб меня наказал немного  И я довольный ходил две недели, даже не заглядывал в терминал, только вечерком на РБК итоги
184|06.09.2018 22:45:08|Oleg Lvov|Вот именно. 1.5 в день это не мамины трейдеры, здесь нога акинфеева какаято.
185|06.09.2018 22:46:59|Vladimir Sotnikov|ну, ответов в интернете нет, но на то они и ответы, чтоб их постить на фактический фактовый факт. Типа а почему, а там 1. ну, Скрипали 2. Ну в ООН без нас, да санкции против нас 3. нуу, обсуждение новых санкций в США в онлайне
193|06.09.2018 22:58:59|А что ты сделал для котэ!?|Доллар стоит 69.3 Главное сохранять юмор и самоиронию. Сегодня для нас с ребятами это видео дня. Никакой политики и отношения, только юмор от всего. https//m.youtube.com/watchfeatureyoutu.beampvD8Pj7KDTijU
194|06.09.2018 22:59:05|А что ты сделал для котэ!?|Бывает и хуже
196|07.09.2018 00:21:40|ААА|Мы что реально должны отрезать Сбербанк Чем закончились слушания в Сенате США по санкциям На состоявшемся в Вашингтоне заседании банковского комитета Сената США практически единодушно эксперты выступили за введение санкций против новых выпусков российских гособлигаций и расширение списка олигархов, которые должны быть наказаны за российскую внешнюю политику. А бывший посол США в России Майкл Макфол даже пообещал передать сенаторам список из 12 претендентов, которые, по его мнению, близки к Путину гораздо больше уже попавшего под санкции Виктора Вексельберга. Детали Заседание началось в 1700 по Москве. Больше двух часов сенаторы консультировались о том, какие именно санкции нужны для борьбы с режимом Владимира Путина, с экспертами по России, в том числе с Макфолом и Дэниэлом Фридом, который на протяжении долгих лет отвечал в минфине США за санкционную политику. Все выступавшие  и сенаторы, и эксперты  говорили о необходимости новых жестких мер. Если вы паркуетесь в неправильном месте, вы найдете квитанцию о штрафе на лобовом стекле, а если вы продолжаете там стоять, на следующий день вам выпишут новый,  провел аналогию Макфол. Цитата Мы что реально должны отрезать Сбербанк от американской финансовой системы,  допытывался у экспертов глава сенатского комитета по иностранным делам Боб Коркер. К счастью, никто из выступавших не ответил утвердительно, но Макфол допустил, что в качестве угрозы такая мера вполне может быть прописана в законе. Цитата Я хорошо знаю Грефа, Костина, Шувалова  руководителей трех крупнейших государственных банков,  убеждал сенаторов бывший посол.  Мы должны вовлекать их в переговорный процесс до введения санкций, а не после. Когда санкции уже введены, они не могут повлиять на Путина. Если Сбербанк получит подобное предупреждение, Грефу проще будет проще влиять на решения президента, считает Макфол. По его словам, цель США в том, чтобы сменить Путина и его соратников, а для этого бессмысленно вводить санкции против ЦБ, Сбербанка или отключать Россию от SWIFT. Фрид говорил, что наиболее действенным сейчас было бы ввести санкции против новых выпусков российских гособлигаций и продолжить наказывать бизнесменов из окружения Владимира Путина, а заодно изучить его собственные активы. Старший вицепрезидент Центра стратегических и международных исследований Хезер Конли подсчитала, что уже сейчас против России действует 56 видов различных санкций, но этого, по ее мнению, все еще недостаточно благодаря высоким ценам на нефть и грамотной финансовоэкономической политике российский ВВП в этом году вырастет на 1,5. Режим Путина, считает она, не собирается сдаваться, а демонстрирует, что готов к затяжной осаде. Среди необходимых мер она назвала усиление глобальной борьбы с отмыванием  только через один эстонский Danske Bank из России выводились миллиарды долларов, напомнила Конли. Еще одно предложение  поработать над мерами, которые окажут влияние на объемы российской нефтедобычи, но не сейчас чтобы не вызвать панику на рынке, а в будущем. Наконец, все выступавшие говорили о том, что США должны настаивать, чтобы к санкциям против России присоединялись союзники во главе с ЕС. В том, что согласованные действия будут и, вероятно, скоро сомнений мало параллельно со слушаниями в сенате США, Канада, Франция и Германия выпустили совместное заявление по делу Скрипалей. В нем говорится, что лидеры этих стран полностью уверены в британской версии о том, что отравившие Скрипалей служили в ГРУ, и что сама операция почти точно была одобрена на высоком правительственном уровне.
197|07.09.2018 08:45:32|Александр Воронов|Цель США ... сменить режим  кто там про вмешательство во внутренние дела последние несколько лет рассказывал
198|07.09.2018 08:53:18|А что ты сделал для котэ!?|Понеслось https//m.vedomosti.ru/finance/articles/2018/09/06/780181neotkrivatrublevievkladi Если уже до газет дошло  скоро массы подключатся. Тогда бакс еще до санкций до 75 улетит
199|07.09.2018 08:57:11|Иг|Если онтон скажет все в порядке тогда на все тарить бакс
200|07.09.2018 10:02:49|Kir|Только бы не новый Вьетнам
201|07.09.2018 10:36:14|А что ты сделал для котэ!?|Шорти бакс надо, если 68,5 вниз пробьёт
202|07.09.2018 11:22:16|Oleg Lvov|Интересно прайсинг сложился... МТС06 погаш2025 доха 9.17, 26207 погаш февр 2027 доха 9.16... То ли ОФЗ перепродали иностранцы, то ли на дохлом рынке МТС06 просто не нужен никому. Если ставочку повысят, мало не покажется никому так думаю.
203|07.09.2018 11:40:23|Евгений|Купон мани мен уже получил ктонибудь
204|07.09.2018 11:44:53|А что ты сделал для котэ!?|Да ладно Мтс У гидромашсервиса доха 9.1  Имхо, рынку нужно пару недель, чтобы прийти в себя и разобраться, где правильная доза по какому инструменту
205|07.09.2018 12:21:59|Сергей Ковалев|может ужп насать покупать
206|07.09.2018 12:26:16|А что ты сделал для котэ!?|Переведи на наш с
207|07.09.2018 12:26:32|Alex Petroff|Нас рать с покупать
208|07.09.2018 12:27:01|Сергей Ковалев|
210|07.09.2018 12:27:08|Harry Lime|Золотой дождь покупок
211|07.09.2018 12:28:40|Oleg Lvov|Рынок мне кажется ждёт когда приедет обратно лесник Подруга Антона из Вашингтона и куданибудь проинтервенствует. Надеюсь что Дед не станет сегодня рубить тарифной шашкой на 200 ярдов а сделает это в понедельничек. Но, скрипя зубами, немного Si прикупил со стопами.
212|07.09.2018 12:50:38|А что ты сделал для котэ!?|
213|07.09.2018 13:56:58|Alexander Kozhevnikov|думаю в какие облиги переложиться появилось немного свободного кэша... наращить долю в уралкалии не очень хочется 
215|07.09.2018 13:58:57|Denis Kozlov Septem|какой самолет
216|07.09.2018 13:59:43|Konstantin|Наверное самолёт девелопмент, который затрагивает в московской области
217|07.09.2018 14:00:52|Alexander Kozhevnikov|группа компаний самолет
220|07.09.2018 14:03:18|Denis Kozlov Septem|самолет девелопмент  риск внутриполических разборок, останется Воробьев, то еще поживут. если Воробьева снимут, самолет полетит вниз
224|07.09.2018 14:21:54|Alexander Kozhevnikov|похоже я какойто не тот самолет находил
226|07.09.2018 15:00:29|Alex|Денис, вы както обещали сводный материал про девелоперов Я его пропустил
227|07.09.2018 15:03:47|Denis Kozlov Septem|к сожалению, не могу сделать толковый обзор  не могу получить консолидированное мнение участников рынка до сих нет общей позиции, как использовать ДДУ, эксроусчета и спецсчета. ни банки, ни девелоперы не понимают пока как это работает. Сбербанк говорит, что он готов это делать и регламенты готовы, но нашел только общие фразы
229|07.09.2018 15:07:35|А что ты сделал для котэ!?| Интересно, а как на Западе с этим
230|07.09.2018 15:08:13|Denis Kozlov Septem|там проектное финансирование развито, ДДУ на западе нет
233|07.09.2018 15:09:53|Дмитрий Адамидов|самое главное  банки дают до 80 ну хотя бы 70. а не 49
235|07.09.2018 15:10:26|Denis Kozlov Septem|на западе нет бюрократических и адмнистративных рисков
236|07.09.2018 15:11:05|Дмитрий Адамидов|я думаю есть  просто не такие как у нас
237|07.09.2018 15:11:10|А что ты сделал для котэ!?|ДДУ есть  знакомый квартиру в Чехии покупал Но деньги ложатся на эксплуатации счёт Банк давал кредит в коронах под 2.5 девелоперу Вопрос был про капитал  как на западе с этим у девелоперов
238|07.09.2018 15:11:13|Denis Kozlov Septem|главная проблема в россии  нарушение сроков строительства изза проблем с подключениями к сетями, проблем с документами или проблем с госприемкой
239|07.09.2018 15:12:04|Дмитрий Адамидов|например в Москве можно войти для точечной застрйоки на участок с ГПЗУ уже согласованным вроде как риски сняты, мощности есть но там тебе такое согласуют, что это потом эксплуатировать нельзя вообще. или не очень понятно как.
240|07.09.2018 15:12:09|Denis Kozlov Septem|Думаю, это не ДДУ в нашем понимании, когда деньги за непостроенную квартиру получает застройщик. Это, скорее всего, то, что у нас теперь будет в виде эскроусчетов
242|07.09.2018 15:14:11|J T|Что такое мезонинный капитал, Денис В двух словах
243|07.09.2018 15:14:53|Denis Kozlov Septem|Вот, например, размещение старшего долга  облигации под 11 годовых в евро
246|07.09.2018 15:43:40|Oleg Lvov|Tesla TSLA  TESLA CHIEF ACCOUNTING OFFICER DAVE MORTON RESIGNS tsla
247|07.09.2018 15:43:40|Oleg Lvov|Лютый шорт можно делать. За 2 недели до 9месяцев бухгалтеры уходят только если всё совсем 420.
248|07.09.2018 15:47:01|Дмитрий Адамидов|ну если бухгалтер несет уголовную отвественность у них реальную, то может загодя свалил, увидев перспективы. может и за полгода
249|07.09.2018 15:49:15|Harry Lime|Маск  мастер западни для шортистов, все делают самое очевидное.
251|07.09.2018 15:51:53|Дмитрий Адамидов|ну да, сначала обрушим фейсбук, а потом уже самого Илона
252|07.09.2018 15:52:28|Harry Lime|Илон легко сходит на 200, ему не привыкать.
255|07.09.2018 16:05:29|Harry Lime|Роскосмос заявил, что Илон Маск украл наработки советских инженеров Об этом заявил главный конструктор России по средствам выведения ракетам, заместитель генерального директора головного научного института Роскосмоса ЦНИИмаш, один из идеологов и главных конструкторов ракет семейства Ангара Александр Медведев.  Читать полностью
256|07.09.2018 16:05:34|Oleg Lvov|Бухгалтерлицо подписывающее отчетность несёт, и реальную, они после Энрона/Ворлдкома спец.закон для этого приняли. После этого колво русских компаний с IPO на NYSE упало почти до нуля, что как бы намекает. Добраться в США до такой высокой позиции очень сложно, трава не помогает на ней, поэтому спекули будут рады новой волатильности. Интересна ситуация с бондами и особенно долгами поставщикам. Мой клиент курит дурь в эфиреэто любому поставщику должно понравиться...
257|07.09.2018 16:06:22|Дмитрий Адамидов|
258|07.09.2018 16:10:03|Harry Lime|РОССИЯ  ЗОЛОТО  НАЛОГИ Минфин будет предлагать полную отмену НДС для золота  Моисеев золото золоторф налогирф
259|07.09.2018 16:10:23|Harry Lime|Россия  вперёд
263|07.09.2018 16:18:12|Denis Kozlov Septem|Оле
264|07.09.2018 16:18:39|А что ты сделал для котэ!?|Да, Т9 слово исправил Имелся в виду эскроу счёт
265|07.09.2018 16:19:08|Harry Lime|Tesla TSLA второе увольнение за день TESLAS CHIEF PEOPLE OFFICER GABY TOLEDANO TO LEAVE tsla
266|07.09.2018 16:19:16|Harry Lime|Жара
267|07.09.2018 16:19:34|K G|всё
269|07.09.2018 16:20:12|Harry Lime|Не дождетесь
270|07.09.2018 16:20:30|Denis Kozlov Septem|Никуда Тесла не денется. Если котиры обвалятся  будет поиск стратега. Мерседес, Тойта, GM  там очередь будет
271|07.09.2018 16:20:38|K G|Где то я это уже слышал
273|07.09.2018 16:21:07|Denis Kozlov Septem|А еще есть рейдер Карл Айкен, который скупал облигации Теслы, чтобы при обвале конвертировать их в акции
274|07.09.2018 16:21:56|Harry Lime|Да это классическая западня. Сейчас все шортанут , а в понедельник появится какойнибудь сингапурский суверенный фонд с 20 процентами.
275|07.09.2018 16:23:02|Denis Kozlov Septem|Тесла  это не только убытки, но несколько доведенных до ума моделей и сеть заправок. Инфраструктура  это большой актив. А еще у Теслы есть завод
276|07.09.2018 16:24:37|Harry Lime|Маск скажет , что вычистил вредителей и саботажников, которые мешали выполнению Великого плана.
279|07.09.2018 16:26:04|Дмитрий Адамидов|Вышел на оперативный простор
280|07.09.2018 16:26:53|Denis Kozlov Septem|Бизнес Tesla. Причины роста  выход в прибыль. Илон Маск твердо намерен достичь этой цели в конце 2018 года. Считаю, что вероятность получения прибыли в 4м квартале текущего года не превышает 47, зато шансы на это в 1м квартале 2019го составляют уже 88. Это случится благодаря сокращению расходов, временному снижению CapEx и получению отсрочек от поставщиков по нескольким крупным проектам, которые стартовали еще в 2016 году. производство. В конце июня Tesla достигла объема выпуска 5000 Model 3 в неделю, а к первому июля вышла на показатель 7000, причем это произошло в течение семи дней. спрос. Новый тренд в спросе на легковые и грузовые автомобили до 7 тонн. На фоне роста цен на бензин продажи машин с мощным двигателем, которые потребляют больше бензина, падают. Тенденция к переходу на альтернативные источники энергии благоприятна для Tesla. К 2035 году тренд еще ускорится 35 продаж на авторынке будет приходиться на электрокары. лояльность потребителей. Вовлеченность потребителей в историю Tesla и их высокая лояльность являются сильными факторами для будущего роста компании. конкурентоспособность. Безусловно, такие гиганты, как Volkswagen Group, Toyota и RenaultNissan, выпускающие и продающие более 10 млн машин ежегодно, знакомы со всеми производственными проблемами Tesla. Однако компания учится на своих ошибках и приобретает уникальный для индустрии опыт по разработке и производству электрокаров. Постепенно этот процесс нормализуется, и тогда остальные представители сектора окажутся в роли догоняющих. Особенно если учесть тот факт, что Tesla получает эксклюзивные контракты с производителями электроаккумуляторов и добывающими компаниями, специализирующимися на сырье, необходимом для выпуска электрических батарей. Tesla будет на пике роста продаж электрокаров в 20302035 годах и получит 10 всего рынка, или  в абсолютных числах  10 млн машин.
281|07.09.2018 16:27:07|Denis Kozlov Septem|Церих жжот
282|07.09.2018 16:28:00|Harry Lime|Ну таки будет длинный купон по Ох
283|07.09.2018 16:35:13|Oleg Lvov| Сегодня в Тесле приход  бухгалтер всего месяц поработал 
284|07.09.2018 16:36:31|Дмитрий Адамидов|Красное бревно поперек экрана
285|07.09.2018 16:37:11|Denis Kozlov Septem|Tesla сыпется. Ждем падение FAANG Слишком много домохозяек туда вложились...
286|07.09.2018 16:38:01|Alex|FANGS уже давно MAGA
287|07.09.2018 16:38:28|А что ты сделал для котэ!?|Чиво Теперь они будут учить и корпоратов тоже, какой долговой политики придерживаться Пусть с Игоря Иваныча начнут
288|07.09.2018 16:39:15|Oleg Lvov|Apple до 12го падать не будет. 12го у них сеанс околдовывания любителей китаефонов.
289|07.09.2018 16:57:14|Евгений Коломна|Ого, налили мне всеж таки гидромаша чутка по 100,05
290|07.09.2018 17:42:03|А что ты сделал для котэ!?|Кстати, про девелоперов А чего ЛСР который день подряд падает Акции
291|07.09.2018 18:10:37|А что ты сделал для котэ!?|Все, разобрался Выход из индекса
292|07.09.2018 18:12:51|Oleg Lvov|Бухгалтеру Мортону полагался signing bonus на 10 млн.долл. акциями TSLA, но он уволился и отказался от него. Я достаточно наобщался по денежным вопросам с жителями  чтобы прийти к выводу воронья слободка не могла не сгореть. 2 конца есть, надо ещё четыре    
293|07.09.2018 18:36:18|Harry Lime|Tesla всего минус 5. Это мелочи.
294|07.09.2018 19:14:37|Сергей Ковалев|ребят, если серьезно я так и понял стоит щас покупать офз или корпоратов или мы ждать светофор от Дениса и сидеть на попе ровно
