|time|user|text
617|21.04.2020 17:38:16|Дмитрий Адамидов|Согласно циркулирующему в интернете проекту разъяснений Верховного суда РФ установление нерабочих дней в период с 30 марта по 30 апреля 2020 г. основанием для переноса срока исполнения обязательства исходя из положений ст. 193 Гражданского кодекса Российской Федерации не является.
619|21.04.2020 17:40:00|А что ты сделал для котэ!?|Где Брось ссылку
620|21.04.2020 17:50:10|Alexi|Раскрытие по Дэни Количество полученных Заявлений в Период предъявления Биржевых облигаций к приобретению 363 Заявления. Количество поступивших заявок в ТС, соответствующих Решению Эмитента 11
621|21.04.2020 17:53:35|Alex|По моим наблюдениям уже 3 эмитента этим пользуются.
623|21.04.2020 17:56:52|Denis Ipatov|Международной она называется потому что в неё вошла армянская консалтинговая фирма Ширакамут
624|21.04.2020 17:57:24|Dmitry Manzor|из 363 выкупили 11
626|21.04.2020 17:58:38|Alexi|После объявления цены желающих поубавилось
627|21.04.2020 17:59:40|Дмитрий Адамидов|Это может быть основанием для признания дефолта или нет
628|21.04.2020 18:00:47|Alexey|Имхо после офиц публикаций разъяснений  да
629|21.04.2020 18:03:41|Viacheslav Petriaev|Уже поздно ж. Подаёшь когда цену говоришь. Брокер же все делает.
630|21.04.2020 18:04:05|А что ты сделал для котэ!?|29 страниц Можно коротенечко, для тех, у кого лапки
631|21.04.2020 18:05:19|Olga|По ситуации ОР на мой взгляд нет
632|21.04.2020 18:05:42|Дмитрий Адамидов|это хорошо
633|21.04.2020 18:05:43|Olga|Не получается коротенечко
634|21.04.2020 18:06:39|Alexey|Нельзя не платить прикрываясь выходными днями. Тчк.
635|21.04.2020 18:07:03|Evgeniy|https//finexpertiza.ru/about/networkfinexpertiza/
636|21.04.2020 18:08:17|Olga|Если уж совсем сжато  обязательства должны исполняться, сроки исполнения нужно рассматривать отдельно в каждой ситуации
637|21.04.2020 18:08:51|А что ты сделал для котэ!?|Алексей выше уже ответил Спасибо
638|21.04.2020 18:08:59|Дмитрий Адамидов|в общем это от мастерства юриста зависит
640|21.04.2020 18:10:09|Alexey|Имхо плохой прецедент будет создан в случае принятия судом положительного решения. Так можно очень много придумать причин не заплатить
643|21.04.2020 18:11:34|Дмитрий Адамидов|в нашем случае все же есть решение президента
644|21.04.2020 18:12:15|Privet|Кот, смотри  стр.6 С учётом изложенного при отсутствии иных оснований для освобождения от ответственности за неисполнение обязательства статья 401 ГК РФ установление нерабочих дней в период с 30 марта по 30 апреля 2020 г. основанием для переноса срока исполнения обязательства исходя из положений ст. 193 ГК РФ не является.
646|21.04.2020 18:12:36|Alexey|Сейчас подумал. Может и к лучшему. Разделит эмитентов на тех кто чудит и кто нет.
647|21.04.2020 18:13:15|Privet|так что как написали  все будет зависит от юриста  сможет он доказать что были обстоятельства непреодолимой силы  то молодец
648|21.04.2020 18:13:58|Alexey|Будут у нас свои купонные аристократы
649|21.04.2020 18:14:04|Olga|Это зависит не от юриста, а от наличия сертификата о форсмажоре, который выдает тпп
650|21.04.2020 18:14:26|Privet|но есть 1 момент, а именно ГК РФ ст. 401 Если иное не предусмотрено законом или договором, лицо, не исполнившее или ненадлежащим образом исполнившее обязательство при осуществлении предпринимательской деятельности, несет ответственность, если не докажет, что надлежащее исполнение оказалось невозможным вследствие непреодолимой силы, то есть чрезвычайных и непредотвратимых при данных условиях обстоятельств. К таким обстоятельствам не относятся, в частности, нарушение обязанностей со стороны контрагентов должника, отсутствие на рынке нужных для исполнения товаров, отсутствие у должника необходимых денежных средств.
652|21.04.2020 18:19:25|Olga|Судилась. Выигрывала. Неправда, что верят только юристам застроев
653|21.04.2020 18:23:03|Nikolay Pavlov|Сертификат не подменяет собой судебную власть и решение суда
654|21.04.2020 18:23:24|Olga|Само собой
655|21.04.2020 18:23:51|Privet|значит тебе везло. судился, приносили распечатки с форумов , не относящихся к делу  и принимались в качестве доказательств. То же выигрывал. Так что если ты не сталкивалась  не надо говорить, что неправда
656|21.04.2020 18:24:46|Nikolay Pavlov|Уже есть не проект на сайте вс рф  утром вывесили
657|21.04.2020 18:25:46|Alexey|Те это уже официально
658|21.04.2020 18:26:09|Nikolay Pavlov|Да
660|21.04.2020 18:26:45|Olga|Нет в суде такого понятия как везло. Если не удалось донести до суда свою позицию, это не означает, что он на стороне оппонента. Давайте на этом поставим точку
661|21.04.2020 18:27:08|Andrey|Простите. Сохраню этот пост, меня ещё никто так хорошо не называл 
662|21.04.2020 18:27:44|Olga|Ты че Я выше документ кинула, мы его обсуждаем
663|21.04.2020 18:28:13|Alexey|Я читал что это пока проект. Ну ок
664|21.04.2020 18:29:01|Olga|Был проект немного другого содержания, сегодня вышел официальный
665|21.04.2020 18:29:28|Alexey|Тогда тем более смотрим за руками эмитентов внимательно
666|21.04.2020 18:31:51|Anatoly Yudin|Ребята, всем привет Вопрос где найти цель выпуска облигаций СЭЗ. имени Орджоникидзе
667|21.04.2020 18:52:44|Шура SiberianRanger|Первичка 21 апреля
669|21.04.2020 18:57:07|А что ты сделал для котэ!?|Какие сегодня по Дэни обороты были Пардон, не за терминалом
670|21.04.2020 18:57:21|Alexander Kozhevnikov|о. дени пописят 
671|21.04.2020 18:57:34|Дмитрий Адамидов|57 тыс штук почти
673|21.04.2020 18:58:22|Lizardking0808|Не продавали свои в эту неделю
674|21.04.2020 18:58:37|Дмитрий Адамидов|неа.
675|21.04.2020 18:59:03|Lizardking0808|И я. Сюр какой то
676|21.04.2020 18:59:19|Дмитрий Адамидов|думаете больше некому продать 57 тыс штук
677|21.04.2020 19:03:31|Pavel Bilenko|Это точно бред Теле 2 бумагами не взял бы
678|21.04.2020 19:04:08|Oleg Kuzmin|то, что это бред, не отменяет, что такая теория была  Теория не моя, если что. Осенью тут обсуждалась.
679|21.04.2020 19:04:22|Pavel Bilenko|Я знаю коекого с именно таким пакетом... Может совпадение 
680|21.04.2020 19:04:48|Дмитрий Адамидов|Это ты чтоли
682|21.04.2020 19:05:01|Lizardking0808|Вы нас тоже поймите ситуация фиалками не пахнет, внятных объяснений происходящему нет. Как и МСФО
683|21.04.2020 19:06:02|Pavel Bilenko|Мсфо будет, не волнуйтесь. Я его видел уже. Просто специфика работы аудиторов в условиях карантина...
684|21.04.2020 19:10:36|Pavel|Сегодня по 48 ещё докупил
685|21.04.2020 19:11:23|Rodan|Кто
686|21.04.2020 19:14:06|Антон|Не было таких цен сегодня
687|21.04.2020 19:17:27|Pavel|Да, ошибся По 50 исполнилась заявка Значит завтра будет 48
688|21.04.2020 19:26:14|Mikhail Evdokimov|https//t.me/Bonds_lab/3480
689|21.04.2020 19:32:07|Кот Базил|Ага, 49,28..
690|21.04.2020 19:44:10|Alexey Vishnyakov|Я усреднился по 50. Было 2 штуки по 78. Теперь стало 4. В следующий раз усрелнюсь по 40  куплю 1 штуку. На брокерском счету осталось 450 рублей.
691|21.04.2020 19:51:56|Олег|Хех у меня 400 штук по 80
692|21.04.2020 20:20:06|Дмитрий Виноградов|Нету здесь Михи, он бы потряс своим пакетом. Кстати, может он лил
693|21.04.2020 20:21:03|Harry Lime|Он из тех , кто покупает на лоях и сдает на хаях . Думаю давно вышел.
694|21.04.2020 20:22:27|DIM|Ну у меня есть обувь 2, так и по мей к маю сказать можно, ждите
695|21.04.2020 20:22:28|Дмитрий Виноградов|он хотел на 4ую оферту купить по 67 и сдать по 70. а отсечка была 65,5  не вписался
696|21.04.2020 20:22:57|Aleksandr|Обещали так не делать
697|21.04.2020 20:23:02|Дмитрий Виноградов|он наверно по 80 сдал вчера
698|21.04.2020 20:24:19|DIM|Обещали, дык вон есть же ситуация со смещениями
700|21.04.2020 20:42:38|Расим Киямов|Вечер добрый, уважаемые инвесторы.
704|21.04.2020 20:52:11|Vera|Успехов
705|21.04.2020 20:52:43|Расим Киямов|Спасибо
706|21.04.2020 21:03:26|Alex|Добрый вечер. Когда можно ждать отчётность за 1кв20 по рсбу В апреле я так полагаю ситуация по продажам похожа на март
707|21.04.2020 21:06:21|Расим Киямов|Вечер добрый, отчетность планируем к концу мая собрать. Апрель должен быть на уровне 75, в начале месяца начали отгружать крупный заказ сотовому оператору и договорились о снижении отсрочки с 90 до 10ти дней. Да и в целом, клиенты из шока начали выходить.
708|21.04.2020 21:17:25|Alex|Позитивно, спасибо
710|21.04.2020 23:29:26|Aleksandr Mukhin|добрый вечер. контракт c теле2 до отгрузки дошёл
713|22.04.2020 06:08:43|Расим Киямов|Доброе утро, да  его и имел ввиду. Там NDA по договору и пока ее могу напрямую упоминать их
714|22.04.2020 06:12:49|Aleksandr Mukhin|отлично. спасибо
715|22.04.2020 06:24:36|Lizardking0808|Калсбыт перевели в третий список
716|22.04.2020 06:43:07|Кот Базил|Это плохо
717|22.04.2020 06:44:33|Lizardking0808|Пока на пир не попал, уже хорошо
718|22.04.2020 07:05:40|Reincarnation Man|уже почти 3 недели назад, новость давно протухла
719|22.04.2020 08:14:54|Vladimir Kulagin|Памятка по всем ETF на МосБирже Карта ETF пригодится при формировании портфеля. На ней визуализированы основные группы etf в разрезе активов и стран с дополнительной информацией об эмитентах.
720|22.04.2020 09:38:53|Alec|Дэни КОшки досвидос
721|22.04.2020 09:43:43|Dmitry Manzor|не будет КО
722|22.04.2020 09:44:36|Harry Lime|Утвердили выпуск , все будет , все разместят. На 3 оферты по БО по 50, 30 и 20 хватит
723|22.04.2020 09:45:30|Dmitry Manzor|можно так каждый месяц принимать на грудь на понижение, а самые стойкие пару человек сдадут в январе по 100
724|22.04.2020 09:46:48|Alexi|Я так понял срок КО поменяли с 3 лет на 1 год
725|22.04.2020 09:47:06|Alec|Отмена, за ней последовало утверждение новой программы, условия поменяли
726|22.04.2020 09:47:06|Alec|0937 ООО ДЭНИ КОЛЛ Сведения, оказывающие, по мнению эмитента, существенное влияние на стоимость его эмиссионных ценных бумаг id37709 
727|22.04.2020 09:47:25|Harry Lime|Учитывая , что эмитент умен и хитер есть масса методов психологического воздействия на держателей , както суды , техдефолты , осво без цели рестуктуризации. Вообщем интересно.
728|22.04.2020 09:48:42|Dmitry Manzor|там ещё суды в Краснодаре на их стороне как сказал их представитель
729|22.04.2020 09:48:46|Oleg Kuzmin|и только один человек додержит до погашения
730|22.04.2020 09:49:06|Dmitry Manzor|согласны ли вы с тем, что они нас  математиков  бондистов  переиграли
731|22.04.2020 09:49:35|Alec|Вот куда пошёл облигационный заём
732|22.04.2020 09:49:52|Harry Lime|Если Миха взял по 60 , сдал на первой оферте и выбежал . Он выиграл больше всех пока.
735|22.04.2020 09:54:10|Александр Нечаев|Выкупили же 20 куда он там убежал. Остальное сдавалось в безубыток.
736|22.04.2020 09:54:38|Harry Lime|Ну там были цены 80 в стакане какоето время
737|22.04.2020 09:55:47|Иван Хз|Миха пропал, боюсь за него.
738|22.04.2020 09:56:24|Harry Lime|Он тоже дерзкий , молодец , под стать эмитенту
739|22.04.2020 09:57:41|Rodan|Не подсказывай 
740|22.04.2020 09:57:56|Harry Lime|Там поопытнее нас ребята
741|22.04.2020 09:58:59|Иван Хз|Миха офилирован с Дэни
742|22.04.2020 09:59:12|Harry Lime|При этом эмитент спокойно выкупит все у оставшихся в живых защитников Брестской крепости в январе
743|22.04.2020 10:06:13|Dmitry Manzor|Миха скупает физ.золото. Ему не до нас
744|22.04.2020 10:06:22|Иван Хз|Людей со стальными кокушками
745|22.04.2020 10:07:03|Harry Lime|Седых , но непобежденных
746|22.04.2020 10:07:32|Rodan|Я держу, только об одном желею, что зашел по 80, а не по 50
747|22.04.2020 10:07:56|Harry Lime|Думайте о возможностях по 2030
748|22.04.2020 10:09:48|Rodan|Буду усреднять 
749|22.04.2020 10:11:54|Dmitry Manzor|Добрый день. На каждую жалобу будет ответ. Тем более, что нарушений нет. Тут дело в другом. Вы хотите/требуете новых оферт Ок, мы не против. Даже всеми руками за. Как раз сегодня об этом говорили на планерке. Давайте поговорим с лично Вами, если это серъезное предложение в нашу сторону. Вопрос 1. После каждой оферты, в том числе в январе и феврале, котировки падали. Так какой смысл их проводить
750|22.04.2020 10:16:09|Dmitry Manzor|Единственный вариант сейчас объявить внеочередную оферту по 100
751|22.04.2020 10:16:09|Pavel Bilenko 22.04.2020 10:15:26|может сразу по 200 Имейте совесть  эмитент и так 40 выпуска убрал с рынка досрочно, а мог бы наплевать и ждать до января 2021 года. И теперь вместо восхищения и радости какието претензии. Да, эмитент неопытный, многое делает кривовато, но деньги инвесторам платит исправно
752|22.04.2020 10:17:04|Harry Lime|Перечитайте знаменитую речь Николая II про бессмысленные мечтанья
753|22.04.2020 10:17:45|Vladimir|Можно мечтать о дени по 10
754|22.04.2020 10:18:29|Harry Lime|Кто ж вам запретит , мечтайте на здоровье
755|22.04.2020 10:19:17|Denis Gordeev|Он плохо закончил. Я предпочитаю живых классиков.
756|22.04.2020 10:20:12|Harry Lime|Не досидел до оферты в январе и слился уже в июле
757|22.04.2020 10:20:39|Denis Gordeev|Поздравляю.
758|22.04.2020 10:21:17|Harry Lime|Не я , Николай II
759|22.04.2020 10:21:41|Denis Gordeev|да, юмор это не Ваше.
760|22.04.2020 10:22:18|Алексей Мелехов|А мне нравится как Гарри шутит
761|22.04.2020 10:22:31|Harry Lime|Paint it black
762|22.04.2020 10:24:42|Алексей Мелехов|Денис, а можете дать личный прогноз, когда закончится Дэни пописят В мае может После карантина
763|22.04.2020 10:25:53|Шура SiberianRanger|Например когда начнётся по сорок 
764|22.04.2020 10:28:28|Григорий Мошорин|По 40 или 30 
765|22.04.2020 10:38:50|Andrey Mayorov|Шура тоже норм шуткует
766|22.04.2020 10:49:25|Corax|Закончится когда его в этом чате перестанут пиарить 
767|22.04.2020 11:03:33|Дмитрий Виноградов|Софтлайн по 93, эмитент мы не причем, наверно ктото выходит, мы не знаем кто. Дэни по 50, эмитент мы знаем, кто продает, но не хотим им мешать
769|22.04.2020 11:06:40|r.alex|Всетаки отменили КО
770|22.04.2020 11:06:52|Denis Gordeev|нет
771|22.04.2020 11:06:59|Harry Lime|Там видимо есть тайное знание , ктото продал по 90 , купивший узнал чтото , сразу же продал по 80 , потом новый обладатель узнал и перепродал по 65 , следующий до 50 . Может проще сразу написать , в чем секрет.
772|22.04.2020 11:07:17|r.alex|Я просто не врубился, что там так мудрено написано
773|22.04.2020 11:08:17|Дмитрий Виноградов|Тайное знание переходит вместе с большим пакетом бумаг
774|22.04.2020 11:09:14|Harry Lime|И на четких уровнях , прям все забрали ровненько по 4950 . В принципе могло и на 20 уехать таким об,емом сразу.
775|22.04.2020 11:09:51|Mister X|на бумагах наложено сильное финансовое колдунство  подолгу в одних руках не задерживаются
776|22.04.2020 11:10:18|Дмитрий Виноградов|значит ктото запланированно хотел подобрать на этом уровне. объем то прошел большой
777|22.04.2020 11:10:30|Harry Lime|На уровнях 85 , 75 , 65 , 50 были такие же мощные покупки
778|22.04.2020 11:10:32|Oleg Kuzmin|А както можно понять, ну не знаю по косвенным признакам, стоит айсберг заявка или это правда единичками весь стакан забит
780|22.04.2020 11:11:16|Дмитрий Адамидов|Да, коллеги, я вижу, что Дэни не может обсуждаться спокойно никак. В связи с этим предлагаю следующее 1. Сегодня обещали МСФО. Все вопросы по отчетности, судам и прочее задаем централизовано нa angrybonds18gmail.com , Евгений централизовано на них отвечает. 2. Конспирологию и ПМС перемещаем в Друзя.
782|22.04.2020 11:12:43|Harry Lime|Или расходимся по частным чатам , ОК
783|22.04.2020 11:13:07|Дмитрий Адамидов|Именно. потому что рецидивы задолбали
785|22.04.2020 11:15:58|Harry Lime|Он давным давно есть. Пишите качественную аналитику , отчеты по эмитентам , совет рассмотрит вашу заявку на участие .
786|22.04.2020 11:16:17|Ivan Z|Так тут у 40 что ли есть бумаги Дэни судя по опросу вчерашнему
787|22.04.2020 11:16:55|Дмитрий Адамидов|Ну почему бы вам не пойти с этим в друзя или в любой другой чат
790|22.04.2020 11:19:29|Александр Нечаев|Это шутка
791|22.04.2020 11:20:10|Harry Lime|Нет
792|22.04.2020 11:21:36|Дмитрий Виноградов|ГК Пионер 1Р3 как думаете сколько принесут на оферту Мне кажется эмитент собирался 0.01 ставить рефинансировав 4ым выпуском с меньшей ставкой, но в текущих условиях коронакризиса решил подольше не отдавать долг
793|22.04.2020 11:28:56|Ivan Z|Ок Спасибо что позвали ребят в чат.
794|22.04.2020 11:29:26|Дмитрий Адамидов|в Друзе они же есть и там можно
795|22.04.2020 11:32:08|Alex|судя по цене около 100 мелкие игроки не понесут, но поведение институционалов может быть любое.
796|22.04.2020 11:41:54|Дмитрий Виноградов|Интересно вообще как эмитент себя чувствует. Вроде закредитованности у него большой не наблюдалось, объекты строит вполне нормальные, плюс управляет ими. Доха 4го выпуска сейчас около 15
797|22.04.2020 11:47:20|Mikhail Falileev|Варшавка life их топовый проект. Много уже было распродано до эксроу. Думаю все у них будет нормально. По крайней мере пока
798|22.04.2020 11:51:05|ОлегЕ.|Нету пока
800|22.04.2020 11:59:43|Алексей ayaye :)|гарри уж сто лет как писал про это. медленновато доходит 
