|time|user|text
631|15.09.2019 23:34:48|Harry Lime|А если не пройдут , Манимену принесли 50 выпуска в прошлом декабре
633|15.09.2019 23:36:51|Sanek|сочувствую
634|15.09.2019 23:37:12|Владимир Тутынин|Так никто и не посоветует, брать или не брать. Здесь мало кто умеет читать отчетность. Как правило перед размещением ей долго и остервенело подтираются, а на размещении если покажут заветные 15, разбирают за 2 минуты так что главное в факе как успеть БЫСТРО отправить заявку. Поэтому сходи на Пробондс, следуй их портфелю, а потом, по мере выстраивания собственной точки зрения, расширяй свои действия.
635|15.09.2019 23:37:23|Vladimir|в чате нет финансовых советников. Только инвесторы, организаторы размещений и представители компаний
636|15.09.2019 23:38:38|Sanek|спасибо
637|15.09.2019 23:39:14|Harry Lime|Кстати отличный совет , по крайней мере убережет депо до поры до времени
638|15.09.2019 23:40:12|Владимир Тутынин|За что Ты возьмешь курсы скоростной печати
639|15.09.2019 23:41:11|Sanek|за то что написали по делу а не на тему какие смешные эти новички
640|15.09.2019 23:41:41|Harry Lime|Я слежу за отчетностью МаниМена. Там все прелести и просрочки огромные и завязка на один ТКБ с возможным схематозом . И ликвидность слабая в бумаге.
641|15.09.2019 23:42:05|Maison|Этот совет в фак даже можно занести. Чуть меньше года назад с копии портфеля начинал и полет нормальный
642|15.09.2019 23:43:36|Harry Lime|У Андрея кроме перевеса ОАЭ_Мяса и отсутствия Ломбарда и МФК я особых проблем не вижу . Можно элементарно снизить риски Голдман Групп и повысить доху за счет Ломбарда и делов то.
643|15.09.2019 23:44:15|Владимир Тутынин|Так ещё раз повторю. Читай фак, его специально написали, чтоб не раздражали одними и теми же вопросами.
644|15.09.2019 23:44:36|Maison|Вот вы плавно новичку портфель и собрали
645|15.09.2019 23:45:35|Harry Lime|Да я переживаю , купит ОМа на всю котлету , через квартал их хватит кондрат и привет . Оферта  это всегда стресс.
646|15.09.2019 23:46:13|Владимир Тутынин|Вроде сейчас будет гг сокращаться.
647|15.09.2019 23:46:40|Harry Lime|Главное не нахапать щита/чзпсна много
648|15.09.2019 23:50:49|Владимир Тутынин|Утром Андрей проснулся, Эврика У оаэ доходность больше, чем в мясничем, при одинаковых рисках. Короче. Пошатнул стаканы. Только почемуто не приснилось что с щитом и чзпснпсп та же история.
649|15.09.2019 23:52:53|Сергей Ковалев|завтра манимен польют
650|15.09.2019 23:54:14|Владимир Тутынин|Вместо того, чтоб тоже глянуть в отчетность.
651|15.09.2019 23:55:24|Harry Lime|Манимен польют в день любого размещения . Завтра Кузина  польют.
653|15.09.2019 23:57:30|Сергей Ковалев|чат завтра не участвует кроме Шуры...
654|15.09.2019 23:58:26|Владимир Тутынин|Гугол молчит
655|15.09.2019 23:59:12|Потапыч|Если это он по 25 кило лотов берёт на размещении, то всё закончится печалькой.
657|16.09.2019 00:00:20|Владимир Тутынин|Это он берет на своих клиентов. Имхо.
658|16.09.2019 00:03:04|Alexey|Народ миллионы несет в займы мфо до сих пор Чтож. Стерилизация избыточный денежной массы
659|16.09.2019 00:04:03|Harry Lime|Они все придут в ВДО , вопрос времени
661|16.09.2019 00:05:20|Alexey|Там морковка что в первой очереди кредиторов физлица
663|16.09.2019 00:06:46|Harry Lime|Я бы ограничился первой частью высказывания  там морковка
664|16.09.2019 00:06:53|Alexey|
666|16.09.2019 00:11:35|Владимир Тутынин|Может на них печать проклятия. И лучше, чтоб не приходили
668|16.09.2019 00:14:10|Alexey|Вы имели ввиду придут мфо или физики те что им займы дают
669|16.09.2019 00:14:15|Harry Lime|У нас в отличие от IPO в штатах все наоборот , компания , кажущаяся неплохой в реале может перестать платить и превратиться в тыкву
671|16.09.2019 00:15:09|Alexey|По сути если взять наши дефолты последних лет  кто был неплохим в реале
676|16.09.2019 00:18:39|Потапыч|Директор ГринМани не ожидал. Так наверно ЦБ кучу предписаний писал прежде.
677|16.09.2019 00:18:47|Harry Lime|Хороший вопрос , надо подумать . Я скорее о другом , тот же СТТ и в какойто мере ДД могли гнить еще годами , но сдохли резко.
679|16.09.2019 00:19:57|Alexey|Стт да кейс резкий
680|16.09.2019 00:20:13|Harry Lime|Я думаю все новые дефолты будут такими
681|16.09.2019 00:20:27|Alexey|Наверное худший кейс да для текущих выпусков
682|16.09.2019 00:20:47|Harry Lime|Цена 110 не панацея
683|16.09.2019 00:21:27|Alexey|Я вот опасаюсь очень оч сильной волативности нынешних выпусков перед офертами
685|16.09.2019 00:22:14|Harry Lime|Сибгост занял в ноябре 17го 2,5 млн долларов , я поверил , что под оферту заняли , но напрасно, сразу вышел без потерь по телу , накрылся только купон.
686|16.09.2019 00:22:24|Владимир Тутынин|Особенно если инсайд не набирает 75 и все решает скормить рынку.
687|16.09.2019 00:23:57|Alexey|Там где стата размещений показывала большие куски на первичке  вот их надо выделить и это самые рискованные
688|16.09.2019 00:24:33|Harry Lime|Или наоборот распылитель  все скормили плотве
689|16.09.2019 00:25:51|Alexey|Если вспомнить опять же задним числом. Кто даже не пытался освободить Немногие. Стт Кто то еще
694|16.09.2019 00:28:17|Владимир Тутынин|Ну здесь хоть риск предсказуемый офертой или погашением. А инсайд может захотеть слиться в межсезонье.
695|16.09.2019 00:29:06|Alexey|Даже финавиа докупал до 75 позволяя выйти и даже заработать
698|16.09.2019 10:16:19|Алексей|Сегодня мини боевое крещение  Видимо многие из облигаций решили выйти поспикулировать на нефти/рублях. С утра во многих облигах просадочки.
699|16.09.2019 10:17:44|Григорий Мошорин|Ломбард
700|16.09.2019 10:19:24|Denis Kozlov Septem|Какой выпуск
703|16.09.2019 10:24:02|Alex|Ну видно пролив до 100 на 700 бумагах. Может дядю Колю ктото прогоняет.
704|16.09.2019 10:25:34|Harry Lime|Все под Кузину ломанулись походу
705|16.09.2019 10:27:39|Оксана|Подскажите, пж, как стать клиентом Септем Капитал
706|16.09.2019 10:30:30|Harry Lime|Самый простой способ  написать Денису Козлову , контакт несколькими постами выше
707|16.09.2019 10:34:56|Оксана|Срасибо, нашла
708|16.09.2019 10:39:18|Mikhail|Я как увидел это сообщение, сразу Квик бросился разогревать
710|16.09.2019 10:42:46|Oleg Egorov|То ли еще будет, после принятия закона 4К...
712|16.09.2019 11:03:28|Scorpio76Spb|А Каскад между тем уже к 101,05 спустили с 101.9...
713|16.09.2019 11:15:22|Aleksandr Mukhin|ООО БЭЛТИГРАНД объявляет о начале размещения 17.09.2019г. второго выпуска облигационного займа БОП02. Облигации компании обеспечивают уровень доходности, превышающий среднюю ставку по депозитам. Параметры выпуска 1. Объём займа 300 млн. 2. Номинал 1000 р. 3. Ставка купона  12,5 годовых YTM 13,24. 4. Ежемесячный купон. 5. Через 2 года амортизация основной суммы по 7,7 в квартал. 6. Срок размещения 270 дней. Скрипт приобретения БЭЛТИ БОП02 Размещение адресные заявки Z0 ISIN  RU000A100TT4 Контрагент ПАО БАНК УРАЛСИБ, идент. MC0016000000, УралСиб_Мос Цена 100. Подробный https//yadi.sk/d/5wmULH_aRCiBQg Телеграмм канал для инвесторов https//t.me/Balti_investor Сайт http//www.balti.ru balti_investor
714|16.09.2019 11:18:03|Harry Lime|В онлайне проходит как всегда интересная конференция Кармани
718|16.09.2019 11:54:28|Scorpio76Spb|Кому  как, лично мне, как тому Вите надо выйти
719|16.09.2019 11:56:56|Maison|Нет повести печальнее на свете, чем повесть о пустом стакане этом...
721|16.09.2019 11:57:08|Alex Petroff|Так пишите не стесняйтесь, из какого инструмента надо выйти и каким лотом. Глядишь стукнется кто в личку и договоритесь по времени. Я так Ломастера пытался купить
722|16.09.2019 11:57:23|Dmitry Manzor|там по 10к
723|16.09.2019 11:57:38|Maison|Стакан то пустой
724|16.09.2019 11:58:15|Alex Petroff|Так она же только размещается сегодня. В чем смысл вашего сообщения
725|16.09.2019 11:58:22|Scorpio76Spb|Спасибо , не подумал о такой возможности
726|16.09.2019 11:58:34|Maison|Что не наливают, может кто лишку скинет
728|16.09.2019 11:58:50|Alexey|Поправьте но как раз спрос то появляется сразу
729|16.09.2019 11:59:52|Pavel|ну так в стакане спрос только и висит
730|16.09.2019 11:59:57|Alex Petroff|Наливать начнут, когда у людей будет что налить, а не сразу с утра. Заявки на первичку удовлетворяться будут частями. Первая до 14 час, вторая до 18.30. Поэтому и стакан оживет только после раздачи.
731|16.09.2019 12:00:23|Maison|Спасибо большое за разъяснения, будем ждать
733|16.09.2019 12:03:58|Alexey|Верно. Не посмотрел. Ну пока спрос не агрессивен скажем так
734|16.09.2019 12:08:30|Sky|Прекрасное утро, особенно кисти с 0 нкд понравились
735|16.09.2019 12:08:32|Kirill|А от сокса ещё и дюрация интересна
736|16.09.2019 12:13:33|Kir|Я думаю соксу не поставят 15
737|16.09.2019 12:15:28|Kir|Новые размещения Дорогие инвесторы, осень  жаркое время размещений. Мы подготовили для вас небольшой дайджест новых выпусков. Сегодня, 16 сентября проводит размещение дебютного выпуска биржевых облигаций ООО Кузина   сеть кафеен из Новосибирска  55 млн руб. объем размещения  15 годовых ставка купонов  ежемесячные купоны  4 года срок обращения  амортизация по 3,4, начиная с 19го купона  10 000 руб. номинал  ЮниСервис Капитал  организатор  Юнилайн Капитал Менеджмент  ПВО Книга заявок уже закрыта, первичное размещение доступно только для подавших заявку в Книгу. Завтра, 17 сентября лизинговая компания БэлтиГранд  начинает размещение второго выпуска биржевых облигаций  300 млн руб. объем размещения  12,5 годовых ставка всех купонов  ежемесячная выплата купонов  5 лет срок обращения  ежеквартальная амортизация по 7,7, начиная с 25го купона  Банк Уралсиб  организатор  ТревечПредставитель  ПВО Данный выпуск будет доступен для приобретения через Адресные заявки по номиналу в течение нескольких недель или месяцев. Заявленная ставка явно ниже остальных размещений. Среди планируемых размещений, условия и даты размещений которых ожидаются в ближайшие дни, отметим  ЭБИС  БОП01, 150 млн руб.  ОФИР  КОП01, 50 млн руб.  СуперОкс  БОП01, 200 млн руб.  ИТЦТрейд  БОП01, 50 млн руб.  Левенгук  БО02, 200 млн руб.  Лесные технологии  БО01, 200 млн руб.  Нафтатранс Плюс  БО02, 250 млн руб.  Сибстекло  БОП01, 200 млн руб. Размещение коммерческих облигаций ООО Офир начнется со дня на день, но будет осуществляться по закрытой подписке среди клиентов ООО ИК Септем Капитал. Ожидается регистрация выпусков ООО Эбис и ООО СуперОкс. Размещение облигаций Лесных Технологий и Сибстекла были заявлены уже давно, и мы в который раз упоминаем их в качестве ожидаемых. Пост информационный. Не является инвестиционной рекомендацией. Редакция канала не несет ответственности за результаты инвестиций в данные ценные бумаги.
738|16.09.2019 12:15:51|Kir|Хотя размещений опять вагон и тележка
740|16.09.2019 12:24:26|Sky|У них, к слову, довольно высокая корреляция
742|16.09.2019 12:30:49|Sky|Да ну, они вообще разные. И хоть какая их синхронность интересна, ибо значит они в какомто портфеле/рекомендательном списке одновременно сосоят
744|16.09.2019 12:48:33|Dimasik|Я как и обещал, по 102 так и быть часть вам отдам
745|16.09.2019 12:49:39|Maison|Не, нафиг такую щедрость
746|16.09.2019 12:57:11|Дмитрий Адамидов|анонс_размещения ООО БЭЛТИГРАНД объявляет о начале размещения 17.09.2019г. второго выпуска облигационного займа БОП02. Облигации компании обеспечивают уровень доходности, превышающий среднюю ставку по депозитам. Параметры выпуска 1. Объём займа 300 млн. 2. Номинал 1000 р. 3. Ставка купона  12,5 годовых YTM 13,24. 4. Ежемесячный купон. 5. Через 2 года амортизация основной суммы по 7,7 в квартал. 6. Срок размещения 270 дней. Скрипт приобретения БЭЛТИ БОП02 Размещение адресные заявки Z0 ISIN  RU000A100TT4 Контрагент ПАО БАНК УРАЛСИБ, идент. MC0016000000, УралСиб_Мос Цена 100. Подробный https//yadi.sk/d/5wmULH_aRCiBQg Телеграмм канал для инвесторов https//t.me/Balti_investor Сайт http//www.balti.ru
747|16.09.2019 13:12:59|Savel|Думаю, у сокса ждать более 14,5  пустое дело. 15  уже мега подарок.
748|16.09.2019 13:13:58|Максим Кочнев|поэтому будет 15
749|16.09.2019 13:15:08|Anatol M| Вот именно, добрый чел раздает, мы забираем, зачем нам сокс
750|16.09.2019 13:15:30|Savel|А кто знает, что там с моторными технологиями Или надо самому звонить
751|16.09.2019 13:18:29|Максим Кочнев|я ксати в втб дозвонился за 10 сек
752|16.09.2019 13:32:39|Harry Lime|Ориентир купона евробондов Сибура с погашением в сентябре 2024г составляет 3,75 евробонд
753|16.09.2019 13:32:48|Harry Lime|Для больших
754|16.09.2019 13:34:12|Елена Филякина|Так только вам с Шурой Кузина досталась ой, еще Елене, но у неё Финам
755|16.09.2019 13:34:31|Mozg Company|Реально же по 101.5 стоят ждут 
756|16.09.2019 13:38:31|Sky|Дык там физиков почти и нет
757|16.09.2019 13:47:29|Kir|Хочу узнать результаты размещения bondlab приучил к хорошему
758|16.09.2019 13:55:41|Наталья|А какая сумма входа 
759|16.09.2019 13:56:31|Anatol M|ага, тот кто Ломастер по номиналу сегодня скинул
760|16.09.2019 14:00:34|Harry Lime|1 миллион долларов
761|16.09.2019 14:01:18|Даниил Иванов|Даже не 200к
762|16.09.2019 14:01:44|Harry Lime|200к номинал , точнее минимальный лот
763|16.09.2019 14:02:56|Даниил Иванов|Аааа, типа на первичку в книгу 1 млн
764|16.09.2019 14:02:57|Harry Lime|Для китов
766|16.09.2019 14:03:47|Елена Филякина|У нас водятся киты  это радует
767|16.09.2019 14:07:06|Harry Lime|ОРИЕНТИР ДОХОДНОСТИ 5ЛЕТНИХ ЕВРОБОНДОВ СИБУРА СНИЖЕН ДО 3,625
768|16.09.2019 14:07:17|Harry Lime|Вру , почти догнали Северсталь
769|16.09.2019 14:07:47|Harry Lime|СЕВЕРСТАЛЬ РАЗМЕЩАЕТ 5Л ЕВРОБОНДЫ НА 800 МЛН ПОД 3,15
770|16.09.2019 14:09:29|Harry Lime|ЧТПЗ 4,5  на 5 лет
771|16.09.2019 14:13:41|Максим Кочнев|давайте все же про евробонды в друзя, ну это ни как не ВДО даже рядом. Даже в рамках общения про снижение ставки
774|16.09.2019 14:50:56|Valery Chistyakov|Чтото Кузину не наливают 
775|16.09.2019 14:55:04|Soa|айсин подскажите
776|16.09.2019 14:55:25|Valery Chistyakov|Айсин был в скрипте
777|16.09.2019 14:55:33|Sergey Komarov|В моторы какого числа размещаются
778|16.09.2019 14:55:37|Valery Chistyakov|Можно расшифровать
779|16.09.2019 14:56:06|Шура SiberianRanger|RU000A100TL1
780|16.09.2019 14:56:20|Soa|спасибо
781|16.09.2019 14:57:48|Шура SiberianRanger|https//www.zerich.com/promo/MotorTechnology
782|16.09.2019 15:08:10|Valery Chistyakov|А заявки уже собирали Я чтото пропустил
783|16.09.2019 15:08:48|Шура SiberianRanger|Народ вроде писал/звонил/оставлял заявки на сайте
784|16.09.2019 15:14:59|Harry Lime|Да нет решения о выпуске даже, окститесь
786|16.09.2019 15:18:32|Сергей Т|Так там тоже 50 лямов всего
790|16.09.2019 15:49:46|Сергей Ковалев|кузину сразу на 101,5 утянули
791|16.09.2019 15:50:10|Valery Chistyakov|Даваха
792|16.09.2019 15:50:54|А что ты сделал для котэ!?|Это чо за бумага Стакан подозрительно на софтлайн похож
793|16.09.2019 15:52:09|Anton Serdobov|Он и есть
794|16.09.2019 15:54:55|Andrey Mayorov|ВДО 101,50 // 102,00
795|16.09.2019 15:55:48|Andrey Mayorov|Максимальная заявочку прям 
797|16.09.2019 15:59:46|Kirill|3900 тыс.руб  это не 72, а 7 , не пугайте народ
798|16.09.2019 16:01:45|Андрей|Да, и половину выпуска из 50 млн Моторов себе забирает мсп, так что облом
799|16.09.2019 16:02:09|Andrey Mayorov|Может быть повезло не попасть в кузину
800|16.09.2019 16:02:15|Harry Lime|ВДО 101,50 // 102,00
801|16.09.2019 16:02:46|Andrey Mayorov|Там лот 10 тыс
802|16.09.2019 16:03:03|Kirill|прочитайте таблицу внимательно
803|16.09.2019 16:03:37|Harry Lime|12 смелых от миллиона до 4х собрали блок
805|16.09.2019 16:04:16|Andrey Mayorov|Сорри, ошибся, не увидел
806|16.09.2019 16:05:02|Потапыч|9 самых крупных заявок в аккурат на 35 миллионов.
807|16.09.2019 16:07:14|Kirill|102  чегото мало, небольшой излишек пока придержу 
808|16.09.2019 16:07:23|Потапыч|Орги читают нас и делают выводы вместо одной на 3500 лотов 9 по 380  399. Типа мы не догадаемся.
809|16.09.2019 16:08:46|Harry Lime|Фрифлоат Кузины  15 млн от силы. Если титаны не проснутся, но им не за чем
810|16.09.2019 16:10:23|Kirill|Нефальсифицируемая теория. Оргам и 4125 заявок по одной бумаге вполне по силам сделать. Кругом мерещатся призраки ОСВО 
811|16.09.2019 16:11:52|Harry Lime|Вообщем размещение было обречено , если бы оно было полностью рыночным , как нппример у Кистей , было бы минимум вдвое больше заявок.
812|16.09.2019 16:12:45|Потапыч|Всего смогли поучаствовать 70 граждан включая 9 самых крупных.
813|16.09.2019 16:12:52|S.P.|какая красота. Но доверия конечно к эмитенту не добавляет. Боюсь что это было последнее размещение Софтлайна
814|16.09.2019 16:15:51|Harry Lime| На 4 квартал 2019 года запланировано начало поэтапного перевода торгов корпоративными облигациями и рублевыми еврооблигациями Минфина из режима торгов с расчётами Т0 в режим с расчётами Т1.
815|16.09.2019 16:16:02|Harry Lime|Беда не приходит одна
816|16.09.2019 16:17:13|Дмитрий Адамидов|Как они задрали
817|16.09.2019 16:17:13|Maison|А смысл Все гайки закручивают
