|time|user|text
599|12.05.2020 11:16:05|Harry Lime|Он не нуждается в рекламе
600|12.05.2020 11:16:46|Alexey Vishnyakov|Нам бы такой оптимизм  при цене 52 Бо каскада 64, а у них дефолт по ко и выплата купона по бо завтра. И она туманна
601|12.05.2020 11:17:01|Dmitry Manzor|Интересно, потребуется ли свой чат по Каскаду
602|12.05.2020 11:23:21|Harry Lime|И название есть  Каскадеры ВДО
603|12.05.2020 11:23:43|Grigoriy Vakhmistrov|Коллеги, а есть какойнибудь бот по раскрытию информации в НРД По аналогии с дискложей
604|12.05.2020 11:23:54|Дмитрий Виноградов|Нужно создать чат каждому эмитенту, кому за 60 
605|12.05.2020 11:28:49|Dmitry Manzor| хорошая идея
606|12.05.2020 11:34:51|Igor Sugrobov|FlashTraderNewsBot
607|12.05.2020 11:37:11|Alexey Spitsyn|Кто под 60
608|12.05.2020 11:38:35|Grigoriy Vakhmistrov|Там не всё. В частности, не было раскрытия о запросе информации в НРД от того, кого нельзя называть
610|12.05.2020 11:39:49|Igor Sugrobov|Как говорит классик, остальное ручками
611|12.05.2020 11:40:20|Grigoriy Vakhmistrov|Услышал, спасибо
612|12.05.2020 11:47:03|Alex|Очень интересно, это сбор информации о всех владельцах облигаций. Очевидно чтото готовится.
613|12.05.2020 11:48:16|Grigoriy Vakhmistrov|Да, поэтому вопрос и возник. Так как это существенный факт, хотелось получать такую информацию автоматом. И я был уверен, что бот раскрытия мне её пришлёт, но нет
614|12.05.2020 11:48:34|Harry Lime|Пару раз в год все эмитенты делают , вот если эмитент зачастил. Я бы на Каскад посмотрел , например.
615|12.05.2020 11:51:43|Ilya|на дату оферты
616|12.05.2020 11:53:32|Alex|тогда рассуждения на тему мы не знаем ничего про владельцев не валидны. кстати, это оффтоп, заканчиваю
617|12.05.2020 12:07:42|DIM|Бот вышеуказанных ток к дискложе помоему привязан, ниразу не присылал со ссылками на нрд
618|12.05.2020 12:12:13|Stan P|AFLT Бонды Аэрофлот перенес сбор заявок на бонды с 13 на 20 мая
620|12.05.2020 12:24:48|Grigoriy Vakhmistrov|Да, помоему тоже. Поэтому и спросил у коллег про аналоги для НРД
622|12.05.2020 12:42:46|Harry Lime|Denis Kozlov Septem Поздравляю с Днем Рождения  Здоровья и удачи.
623|12.05.2020 12:43:18|Denis Kozlov Septem|Спасибо, Илья 
624|12.05.2020 12:43:20|Alexey Vishnyakov|Присоединяюсь к поздравлениям
625|12.05.2020 12:43:53|nik|Денис, поздравляю Вас. Здоровья и сил
626|12.05.2020 12:45:57|Mikhail FarEast|Поздравляем Спасибо, что Вы есть вообще и а нашей песочнице в частности
627|12.05.2020 12:47:39|Сергей|С Днем Рождения, Денис
628|12.05.2020 12:49:10|Grigoriy Vakhmistrov|Присоединяюсь С днём рождения, Денис И спасибо за Вашу работу
629|12.05.2020 12:50:21|Dmitry Manzor|Поздравляю Денис Надёжных эмитентов и верных инвесторов
630|12.05.2020 12:51:30|К& Б:))🍷|С Днём рождения Хорошо отпраздновать
631|12.05.2020 12:51:31|Denis Kozlov Septem|Коллеги, спасибо за поздравления Очень приятно 
632|12.05.2020 12:51:43|Ilya|С Днем, Рождения, Денис Здоровья и купонов
633|12.05.2020 12:53:17|Rodan|Денис, с днем рождения Больше размещений и никаких дефолтов 
634|12.05.2020 12:53:57|Евгений Коломна|Присоединяюсь к поздравлениям
635|12.05.2020 12:58:31|Сергей Ковалев|Присоединяюсь к поздравлениям С днем рождения Терпения вам
636|12.05.2020 13:00:03|DIM|Блин, не знал, присоединяюсь, главноездоровье, чтобы тылы всегда были прикрыты, ну и конечно удачи во всех начинаниях и продолжениях
637|12.05.2020 13:02:22|Антон|Денис, с днём рождения вас Ураа
638|12.05.2020 13:16:40|o_nix|Обувь расплатилась 
639|12.05.2020 13:18:08|Dmitry Matveev|Ждём каскад...
640|12.05.2020 13:38:59|Victor|Дэни прибыль выросла в 2 раза
642|12.05.2020 13:39:19|Ilya|в Друзя го го
643|12.05.2020 13:41:54|Rodan|Ура дэнихолдеры
644|12.05.2020 13:44:07|ААА|Пояснительная записка к балансу где
646|12.05.2020 13:47:49|Rodan|Утюг и паяльник творят чудеса 
647|12.05.2020 13:47:58|ААА|Наверное.
648|12.05.2020 13:51:23|Dmitry Manzor|Выручка упала на 12.5, ярд долга ушло в другие активы
649|12.05.2020 13:54:41|Evgeniy|Изменился принцип формирования выручки по некоторым партнерам. Раньше по части операторов прогоняли в виде выручки поступления целиком, теперь идёт зачет с себестоимостью, и в выручку попадает только разница, что убирает лишние взаимные пересылки денежных средств и сокращает расходы на РКО
650|12.05.2020 13:54:59|AndreyKa|Денис, поздравляю с Днём Рождения Здоровья, удачи, благополучия Спасибо за работу.
651|12.05.2020 13:55:28|Evgeniy|И стоит учесть, что валовая прибыль выросла на 37
652|12.05.2020 13:55:31|ААА|И на сколько сократились выручка в результате этих действий
654|12.05.2020 13:57:39|Evgeniy|Принцип формирования изменился. Вместо отнесения всего платежа партнера по межоператорскому взаимодействию сейчас в выручку падает разница между взаимно выставленными счетами.
657|12.05.2020 14:07:50|Denis Ipatov|Можно считать состоявшимся https//nsddata.ru/ru/news/view/613224
658|12.05.2020 14:07:56|Oleg Kuzmin|patsak9876 вы ведь все это обсуждение неназыванмого тоже всё сотрете, да
659|12.05.2020 14:08:04|Ilya|Не не в курсе напишите в друзе плз
660|12.05.2020 14:08:06|Кирилл Лунев|dengordeev Iron1984 Господа, аудитор Дэникомо выбирался на тендере
661|12.05.2020 14:09:52|Denis Kozlov Septem|Отлично Спасибо
662|12.05.2020 14:13:04|Evgeniy|Выбор аудиторской организации проводился Эмитентом на основании мониторинга аудиторских услуг, предлагаемых различными аудиторскими фирмами. Основные условия отбора аудиторской организации  анализ деловой и профессиональной репутации аудиторов, а также размер оплаты предлагаемых услуг аудиторской организации. Наличие процедуры тендера, связанного с выбором аудитора, не предусмотрено. Выбор осуществлялся путем сопоставления условий, предлагаемых аудиторскими компаниями.
663|12.05.2020 14:13:48|Margo|Денис, с днем рождения Успехов во всех начинаниях
664|12.05.2020 14:17:17|Stan P|Присоединяюсь к поздравлениям
665|12.05.2020 14:29:05|Алексей Мелехов|Денис, с днём рождения Всех благ
666|12.05.2020 14:31:53|Дмитрий Адамидов|А правда коллеги, давайте в стрим переместимся
669|12.05.2020 14:32:52|Oleg Egorov|Денис, с ДР Здоровья, терпения, много денег 
670|12.05.2020 14:33:56|Ilya|
671|12.05.2020 14:36:29|Kira Zabrodskaya|Денис, с большим удовольствием присоединяюсь к поздравлениям Успехов во всех сферах жизни, поводов для радости и интересных проектов
672|12.05.2020 14:37:44|Oleg Kuzmin|будем делать деньги в тишине, а то вдруг все накинутся на доходность 200 и мне не хватит
673|12.05.2020 14:51:48|Alexander V. Ivanov|Каскад как будто опять к планке собрался, но теперь с другой стороны...
674|12.05.2020 14:56:52|Denis Kozlov Septem|Да, Каскад сегодня звезда. Ред Софт погасился без накладок  отличная новость. Инфовотч в марте держал интригу до последнего 
675|12.05.2020 15:01:38|Alexander V. Ivanov|Ага, и даже неназываемый на 6 фигур вверх уже сдвинулся... кругом позитив, сам рынок поздравляет вас с днем рожденья 
676|12.05.2020 15:01:41|Oleg Kuzmin|кто не зассал в пятницу и купил пописят а сегодня продал по 80 респект тому
677|12.05.2020 15:02:20|Andrey Belous|Главное чтобы завтра эта звезда не упала...
679|12.05.2020 15:03:32|Alexander V. Ivanov|3.8 млн сегодня
680|12.05.2020 15:04:15|Oleg Kuzmin|для ВДО  очень даже
681|12.05.2020 15:04:37|Andrey Belous|Благодарствую
683|12.05.2020 15:05:02|Oleg Kuzmin|вообще странно, что котировки растут сегодня, а не завтра после купона /
685|12.05.2020 15:06:09|Andrey Belous|На опережение
686|12.05.2020 15:06:34|Oleg Kuzmin|типа взять перед купоном дёшево, пооучить купон и продать дорого. ну или не получить и обнулиться
688|12.05.2020 15:06:56|Andrey Belous|Кто не рискует
689|12.05.2020 15:07:36|Mikhail FarEast|Именно эта купонная доходность зашкаливает на всех ресурсах. Народ и берет
690|12.05.2020 15:08:29|Oleg Kuzmin|мне кажется после купона может быть обратное заливное. такой аля купонгэп 
691|12.05.2020 15:08:30|Alexey Vishnyakov|Ещё и заплатить налог
692|12.05.2020 15:09:05|Andrey Belous|Купонгэп
693|12.05.2020 15:11:37|Oleg Kuzmin|ну а что, облигация которая ведёт себя как акция делая по / 20 за пару дней у нас есть. теперь вот купогэпы будут долой границы между долговым и акционным рынком
694|12.05.2020 15:13:09|Kirill|Вообще конечно сложно найти какойлибо смысл в Каскаде по 80, безумие какоето
696|12.05.2020 15:13:54|K V|уже 790 
697|12.05.2020 15:14:37|Kirill|Те, кто измеряет цену не в , в аду будут вариться в отдельном неметрическом котле 
698|12.05.2020 15:14:57|K V|согласен, вырвалось
699|12.05.2020 15:15:19|Oleg Kuzmin|это тинёк  у них свой котел
700|12.05.2020 15:17:40|Kirill|На фоне К по 80 другой эмитент, с деньгами но на другую букву, по 56 выглядит совсем уж высшим пилотажем. Отдел антимаркетинга этого неназванного эмитента  просто гении.
702|12.05.2020 15:19:49|DIM|Видимо ктото чтото знает и решил поспекулировать
703|12.05.2020 15:22:56|Ilya|Как раз на счёте пятёрочка оставалась
704|12.05.2020 15:23:15|Kirill|Что же тут можно знать  Что дефолта не было  Что в августе не жопа а чтото противоположное 
705|12.05.2020 15:25:48|Vitaliy Klimenko|Надежда на мягкий рестракт с ежемесячной амортизацией в 1
706|12.05.2020 15:27:00|Oleg Kuzmin|а может это все просто манипулирование, с целью выкупить свой долг подешевле. правда обороты для этого маловаты /
707|12.05.2020 15:31:18|Harry Lime|Нужен техдефолт по БО для такого
708|12.05.2020 15:35:44|DIM|Что завтра будет купон все изи будет купон, позитив рост возможность срубить доп бабло
709|12.05.2020 15:37:36|Григорий Мошорин|Не будет купона и начнется 
710|12.05.2020 15:38:20|Dmitry Manzor|Проблемы никуда не делись, а котиры сделали 20
711|12.05.2020 15:38:51|Kirill|Хомячок пошел лютый, отмороженный. Может не проканать. Организуют техдефолт, а оно продолжит торговаться по 70
712|12.05.2020 15:39:26|Сергей|хомячок по ко не читает
713|12.05.2020 15:39:27|DIM|Ну если ктото вкурсе выплаты завтра, то че б не прикупить на низах и слить завтра на росте вот и берут или брали что ценник поднялся достаточно высоко
714|12.05.2020 15:42:23|Dmitry Manzor|Тинёк отключил у себя Каскад, там  других мастей
716|12.05.2020 15:46:33|DIM|Это понятно, я щас про спекуляции на каскаде
717|12.05.2020 16:04:52|Alex|как будто осво это чтото плохое, отложить оферту и продолжить получать купон 16
718|12.05.2020 16:05:47|Harry Lime|Как вариант кстати
719|12.05.2020 16:06:39|IURII D.|Не будем превращать канал в чат предсказателей и манипуляторов ВДО  обсуждаем документы и факты.
720|12.05.2020 16:07:47|Andrey Mayorov|Вечная облига с 16 купоном
721|12.05.2020 16:15:51|Alexey Vishnyakov|Это было бы неплохо. Через 7 лет деньги вернутся. Но я сомневаюсь, что будет все так красиво
722|12.05.2020 16:20:29|Rondo alla Turka|В новых стандартах эмиссии цб, вчера вступили, зеленые облиги отдельной главой прописаны. Вот заживем Возможно отдельный чат понадобится, предлагаю название Энгригрин
724|12.05.2020 16:51:21|Сергей Ковалев|Прым как в дд
726|12.05.2020 17:14:32|Ilya|Ссылка на Друзь опять сломалась 
727|12.05.2020 17:16:01|Дмитрий Адамидов|мущщины  в чат стрима или в Друзя по Дени
728|12.05.2020 17:16:41|Mister X|дэнистрём 
730|12.05.2020 17:53:50|Vladimir Kulagin|Как менялись доходности ОФЗ с 2015го года Из предыдущего поста мы выяснили, что от процентных ставок зависят БПИФ на корп. долги  SBRB , GPBS , VTBB , GPBM  и госдолги  SBGB . Когда доходность ОФЗ падает, цены на долговые БПИФ быстро взлетают, но дальнейший потенциал их роста уменьшается. Наглядное представление исторической динамики доходности ОФЗ в зависимости от сроков погашения дюрации за 5 лет. Видеоряд на YouTube или Интерактивный график осторожно, долгая загрузка
732|12.05.2020 17:58:19|Privet|Здравствуйте. Эдуард, а какая информация на текущий момент
733|12.05.2020 18:00:00|nik|Эдуард с 8го мая не был в сети 
734|12.05.2020 18:08:15|Dmitry Matveev|Завтра все узнаем...
735|12.05.2020 18:11:41|Eduard|Здравствуйте, уважаемые инвесторы Сообщаю вам, что сумма, необходимая для выполнения обязательств по погашению купона по БО  11 967 000 подготовлена
736|12.05.2020 18:13:10|Mark|Отлично
737|12.05.2020 18:13:46|Andrey Belous|Это подтвержденная информация или исключительно со слов Каскада
738|12.05.2020 18:14:53|Alexander V. Ivanov|это Каскад и говорит...
739|12.05.2020 18:15:07|Harry Lime|Отлично , удачи в борьбе  Теперь задача как можно быстрее прийти к околономиналу , иначе оферту не пройти.
740|12.05.2020 18:16:30|Ilya|поздравления БОдержателям Каскада, или КаскаБОдерам по простому
741|12.05.2020 18:20:38|Eugene Petrov|Алилуя
742|12.05.2020 18:21:20|Andrey Belous|Понял
743|12.05.2020 18:27:00|К& Б:))🍷|Спасибо. Успешного бизнеса
748|12.05.2020 19:21:17|Астория|Сегодня первый день как торговлю открыли. Народ прям изголодался, прёт. Очень радостно. И видеть и чувствовать. Расторгуется Каскад  пойдут денежки у него. Время немножко нужно.
749|12.05.2020 19:45:31|Mikhail FarEast|У вас какой регион ЮФО закрыто до сих пор
750|12.05.2020 19:47:19|And|Похоже в пятницу и сегодня, инсайдеры на Каскаде неплохо прокатились, уж слишком бодро восстанавливались котировки, а позитивные новости только вечером появились.
751|12.05.2020 19:48:18|Астория|Кострома, Иваново, Ярославль. Щас и до вас волна дойдёт. Монтажным организациям тоже разрешили работать. Уже вотвот все начнет восстанавливаться.
752|12.05.2020 19:51:23|Witold Radulescu|Вышли данные по продажам Талана сумма ДДУ Апрель 2019  576 300 394 Апрель 2020  514 952 998
753|12.05.2020 19:51:37|Mikhail FarEast|Не надо считать чужие деньги, все по Каскаду ещё впереди
754|12.05.2020 19:55:10|And|Все впереди для тех кто будет держать, а тот кто взял за 55 в пятницу и сдал сегодня по 84, уже положил прибыль себе в карман.
755|12.05.2020 19:55:59|Mikhail FarEast|Ну тут да,не поспоришь. И ведь ктото точно брал вчера по 55
756|12.05.2020 19:58:50|And|Ага
757|12.05.2020 20:01:08|nik|Каюсь... Брал
765|12.05.2020 20:14:00|Alex|мсфо
766|12.05.2020 20:14:47|Witold Radulescu|на сайте выкладывают ежемесячные данные по продажам
767|12.05.2020 20:14:47|Witold Radulescu|мсфо
768|12.05.2020 20:17:30|Alex|ок, спасибо, талан редко консолидацией балует, жду её за 2019
769|12.05.2020 20:18:07|Евгений Коломна|Если до конца месяца не выплатят по оферте КО, то будет повтор
771|12.05.2020 20:26:09|Aleksandr Mukhin|эбис отчитался об использовании средств. всё ушло на линии переработки. аж на 8 штук
772|12.05.2020 20:31:06|Sergey Burdov|Добрый день, есть смысл в покупке облигаций Миг кредит в нынешних условиях Может быть чтонибудь посоветуете Интересуют также облигации таксовичков. Может быть есть еще на какие стоит обратить внимание с помесячной выплатой купона
773|12.05.2020 20:32:51|Vitaliy Klimenko|Ищите по чату
774|12.05.2020 20:33:13|Alex|Миг держать, такси продавать
775|12.05.2020 20:33:50|Harry Lime|Так , а кому тогда продавать Такси
776|12.05.2020 20:34:12|Евгений Коломна|Смысл есть тогда, когда величина купона отражает риск эмитента
777|12.05.2020 20:34:26|Sergey Burdov|Спасибо, может посоветуете что из высокодоходных облигаций прикупить
779|12.05.2020 20:34:51|Harry Lime|Это в страну Советов вам надобно , белым ходоком
780|12.05.2020 20:35:13|Sergey Burdov|
781|12.05.2020 20:35:30|Kir|У кого то ещё есть такси
782|12.05.2020 20:36:06|Harry Lime|Есть непроверенный слух , что Таксовичкофф планирует купить Fake Taxi .
784|12.05.2020 20:37:00|Kir|волшебнаятаблица Обновлённый список ВДО  биржевых и коммерческих  доступен на Google.Docs. В обращении сейчас находятся ровно 100 биржевых выпусков и 19 коммерческих. Объем биржевых выпусков составляет 23,18 млрд руб., коммерческих  0,95 млрд руб. Можете копировать себе, оставлять вопросы и комментарии. Список ВДО подготовлен в информационных целях. Не является инвестиционной рекомендацией. Редакция канала не несёт ответственности за результаты инвестиций в данные ценные бумаги.
785|12.05.2020 20:37:43|Kir|Выше список, выбирайте что понравится
786|12.05.2020 20:39:01|Mikhail FarEast| Есть только МиГ, между Каскадом и Кисточками
788|12.05.2020 20:40:42|Dmitry Matveev|Каскад
789|12.05.2020 20:44:26|Виталий Яковлев|Каскад с плечем   Ежели брокер даст  
790|12.05.2020 20:44:32|Viacheslav Sofikor|В Каскаде прям развод какой то ... чего то дурно пахнет
792|12.05.2020 20:45:40|Alex|Обосновать сможете
793|12.05.2020 20:46:00|Mikhail FarEast|Ты сам попробуй портфель составить, это же твои деньги. А то счас тебе насоветуют здесь Но Каскад уже допустил тех.дефолт по ко, а кисти на осво подаются. Пока из плохих новостей все
794|12.05.2020 20:46:26|Andrew Jazz|Вы табличку сарказм не забыли 
796|12.05.2020 20:49:27|Sergey Burdov|Это да, хотелось немного разбавить портфель высокорискованными облигациями, пока присматриваюсь. Каскад доверия не внушил
797|12.05.2020 20:49:42|Witold Radulescu|я по соотношению доха/риск выбрал талан и легенду 1 выпуск  это стройка
798|12.05.2020 20:49:43|Witold Radulescu|Спасибо, может посоветуете что из высокодоходных облигаций прикупить
799|12.05.2020 20:51:08|G M|Лизинг  Трейд ежемесячно 12.5, котировки постепенно восстанавливаются. Надеюсь на 100 в течение месяца трёх. Хохрин из ProBonds ратует за них.
