|time|user|text
443|21.04.2020 15:39:30|Полина Кузнецова|https//www.edisclosure.ru/portal/files.aspxid37709amptype4 а когда будет отчетность за 1 квартал очень хочется увидеть Это к Дени
444|21.04.2020 15:39:31|Andrey|а кто их владелец фактический Ваша компания То есть вы сами себе купон платите
445|21.04.2020 15:39:34|Дмитрий Виноградов|О, можно в свидетельство канарейки поиграть 
446|21.04.2020 15:39:49|Ilya|Я про бумаги говорил, а не про вас
447|21.04.2020 15:40:01|Дмитрий Виноградов|Льет физик
448|21.04.2020 15:40:22|Denis Gordeev|я же ответил  про бумаги не знаю что думают. Если думают вообще.
449|21.04.2020 15:40:39|Denis Zimin|Да откуда у физика столько денег то Ну разве что этот физик ген директор и взял размещение на себя
450|21.04.2020 15:41:09|Дмитрий Виноградов|можно 30 лямов тудасюда гонять вполне. Уронил цену, подобрал и т.д.
451|21.04.2020 15:42:29|Полина Кузнецова|Дени, а если не секрет, почему вышли на рынок облигаций у вас такая отчетность, что можно получить вполне нормально линию регионального банка, если она нужна. По отчетности вам деньги заемные вообще не нужны.
453|21.04.2020 15:43:52|DIM|Две
454|21.04.2020 15:43:56|Кот Базил|Тут я... И Буратино тоже где то купил дэни
455|21.04.2020 15:44:08|Denis Zimin|
456|21.04.2020 15:44:29|Полина Кузнецова|Кота нашли значит. Не к добру.
457|21.04.2020 15:44:47|Потапыч|Они уже ответили это реклама.
458|21.04.2020 15:45:18|Denis Zimin|То есть падеж был спланирован
459|21.04.2020 15:45:18|Полина Кузнецова|реклама  взять кредит с 9 нулями... класс
461|21.04.2020 15:46:24|Dmitry Manzor|А4069208/2020 АС города Москвы 21.04.2020 Исковое Заявление  б/н от 21.04.2020 . Сумма исковых требований 69963378 ООО СМС ТРАФИК к ООО ДЭНИ КОЛЛ dengordeev а что за иск на крупную сумму
462|21.04.2020 15:46:42|Потапыч|На каждого Перельмана найдётся свой Мориарти
463|21.04.2020 15:46:53|Denis Gordeev|реклама и продвижение это про оферты было. Одна из причин  ужесточение по трансграничным платежам.
464|21.04.2020 15:47:59|Кот Базил|Конечно не к добру, что бы я ни прикупил, тому писец... А Дени я взял много... И когти и зубы острые.. доведут, у меня крыша на жаре съезжает быстро
465|21.04.2020 15:48:13|Denis Gordeev|там встречный иск от нас на бОльшую сумму.
466|21.04.2020 15:48:21|Harry Lime|Это вероятно плановый иск
467|21.04.2020 15:48:23|Dmitry Manzor|пока не увидел
468|21.04.2020 15:48:45|Ivan Ivanov|Ссылку на номер в картотеке дайте, пожалуйста
469|21.04.2020 15:48:47|Denis Gordeev|и подсудность Краснодар, здесь иск к ним
470|21.04.2020 15:48:47|Ivan Z|Посмотрите Яндекс вордстат, там запросы Дени Колл облигации сопоставимы если по бренду дэником поискать. Количество запросов выросло, люди о них узнали, были публикации были в СМИ о падении котировок бумаг. Правда пиар не белый получился но я не специалист в пиаре, не знаю, насколько это повлияет позитивно на узнаваемость бренда и тд
471|21.04.2020 15:49:08|Denis Gordeev|запрошу у юристов
472|21.04.2020 15:49:17|Leo Stats|Ну такто, все кто интересуется ВДО теперь в курсе про Дэни. А если еще и оферта в январе пройдет без сучка и задоринки, таки кейс будет более чем достойный
473|21.04.2020 15:49:36|Ivan Ivanov|Спасибо. Это буквально минуту у них займёт
474|21.04.2020 15:49:39|Полина Кузнецова|Причем тут трансграничные платежи, если деньги все равно из России были бы.
475|21.04.2020 15:49:46|Dmitry Manzor|Сэр, планы нам не говорят.
476|21.04.2020 15:50:11|Harry Lime|Угадывать бесполезно , жизнь всегда интереснее
477|21.04.2020 15:50:46|Denis Gordeev|нет, основная выручка не в России у нас
478|21.04.2020 15:50:51|Полина Кузнецова|Классное мнение.
479|21.04.2020 15:50:57|Алексей Чернушевич|Разбудили аксакала. Спекулятивнонастроенная молодежь, уясните, что задачи у эмитента только две в период вторичного обращения его облигационного выпуска платить купоны и погасить в рамках законного требования обязательной оферты и/или погашения. Эмитент не обязан давать заработок спекулянтам на росте его котировок. Выбейте это себе в голову. На вторичка выпуск живёт СВОЕЙ жизнью. Таковы правила игры.
480|21.04.2020 15:50:59|Harry Lime|Сумма иска небольшая , всего 69 млн. , купоны за 2 квартала
481|21.04.2020 15:51:14|Ilya|Дыра в дебиторской намечается 
482|21.04.2020 15:51:33|Denis Gordeev|нет, у них деньги есть.
483|21.04.2020 15:51:45|Иван Хз|Зачем, тогда Вам облиги в РФ
484|21.04.2020 15:51:47|Ilya|А чего тогда бодаетесь
485|21.04.2020 15:51:50|Denis Gordeev|такой у них способ не платить нам
486|21.04.2020 15:52:09|Harry Lime|Черные дыры  это прям Интерстеллар уже
487|21.04.2020 15:52:40|Denis Gordeev|косят под вирус и задержку изза этого платежей, ссылаясь на технические сбои и неправильно выставленные счета с нашей стороны. Там в иске можно все увидеть.
488|21.04.2020 15:52:58|Ilya|Ждём ссылку
489|21.04.2020 15:53:21|Harry Lime|Возможно даже каторгу
490|21.04.2020 15:53:39|Dmitry Manzor|
491|21.04.2020 15:54:15|Ilya|А гн Хохрин переживает за котировки эмитентов своих вроде как пример
492|21.04.2020 15:54:35|Denis Gordeev|и вовторых они только подали, но суд не принял еще, так как подсудность Краснодар по договору, отправят по подсудности. А в Краснодаре всегда все ок.
493|21.04.2020 15:54:43|Ilya|Не нада, лучше баррель в минусну вы поняли
494|21.04.2020 15:55:08|Ivan Ivanov|А ваш то где
495|21.04.2020 15:55:14|Ilya|Инвесторы, поняли намёк
496|21.04.2020 15:55:15|Nikolay Surkov|Какая доля России в вашей выручке Полную структуру выручки сможете раскрыть
497|21.04.2020 15:55:30|Dmitry Manzor|всё на мази
498|21.04.2020 15:55:40|Denis Gordeev|всегда
499|21.04.2020 15:55:48|Evgeniy|Отчетность планируется закрыть до конца текущей недели. Опубликуют, скорее всего, на следующей неделе.
500|21.04.2020 15:55:53|Ivan Ivanov|Не боитесь
501|21.04.2020 15:56:32|Полина Кузнецова|Ждемс. А что за цифры там ярд профита
502|21.04.2020 15:56:59|Evgeniy|Что вы имеете в виду под профитом
504|21.04.2020 15:57:07|Dmitry Manzor|намёк на правильные суды в Краснодаре
505|21.04.2020 15:57:44|Полина Кузнецова|Прибыль за период, да
506|21.04.2020 15:58:08|Dmitry Manzor|Они давно работают друг с другом, видно обычный хозяйственный иск, сумма для компании небольшая. Но хочется узнать детали. В чём там дело
507|21.04.2020 15:59:09|nik|Прочитал с интересом Все почти логично кроме стоковых фото и отсутствия подтверждения полномочий рассказчиков.
508|21.04.2020 15:59:18|Dmitry Manzor|СМС любит судиться и всегда истец
510|21.04.2020 16:00:31|Denis Gordeev|они платить не любят
511|21.04.2020 16:01:14|Evgeniy|Как закроют будет понятно. Думаю признавать в Росии прибыль на миллиард  так себе идея
512|21.04.2020 16:01:17|Ivan Ivanov|Ссылка на встречку
513|21.04.2020 16:02:54|Evgeniy|Предварительный расчет доли выручки за границей по неутвержденному МСФО 81 от совокупной. Более подробно после утверждения аудиторского заключения.
514|21.04.2020 16:03:07|Oleg Kuzmin|вы уверены сможете запросить благодарственное письмо у Теле2
516|21.04.2020 16:03:55|Denis Zimin|Олег, ща скажут  попозже
517|21.04.2020 16:03:56|Denis Gordeev|как будет информация выложу обязательно
519|21.04.2020 16:04:22|Dmitry Manzor|с тех пор про МСФО никто не слышал
520|21.04.2020 16:04:22|Dmitry Manzor|Обещали ПОСЛЕ 10го. В понедельниквторник будет
521|21.04.2020 16:04:38|Сергей Ковалев|До 30 числа вы хотели сказать
522|21.04.2020 16:04:56|А что ты сделал для котэ!?|Чего это не к добру
523|21.04.2020 16:05:01|Ivan Ivanov|Не будет Потому что нет
524|21.04.2020 16:05:02|Oleg Kuzmin|ну иск же подали на 300млн
525|21.04.2020 16:05:08|Evgeniy|Финэкспертиза работает удаленно. есть небольшие задержки.
526|21.04.2020 16:05:14|Kirill|Интересная получилась переписка. Хорошо читается совместно с просмотром графика котировок, 5минуткой с 12 до 15. Верхний пилотаж.
527|21.04.2020 16:05:15|Denis Gordeev|Т2 не дает таких писем
528|21.04.2020 16:05:28|Dmitry Manzor|ИП Лошаков
529|21.04.2020 16:05:53|Denis Gordeev|год назад, обычные споры
530|21.04.2020 16:06:02|Evgeniy|Никто не мешает закрыть её раньше.
532|21.04.2020 16:06:41|А что ты сделал для котэ!?|Ктулху пробудился Всем кранты  прячься кто может
533|21.04.2020 16:06:47|Алексей Чернушевич|Как кисло будет выглядеть стебущаяся здесь ватага и кусать ногти от потерянной возможности заработка от самоподначиваемости, когда этимент исполнит все свои обязательные требования и все погасит.
534|21.04.2020 16:07:55|Oleg Kuzmin|бьёт  значит любит ладно,не будем углубляться в эту ему. итого обоснованных подтверждений,что теле2 относится хорошо к дэником нет.
535|21.04.2020 16:08:15|Dmitry Manzor|а что по иску, так же мировое будет
536|21.04.2020 16:08:36|Andrey Hohrin|Вы сейчас прям на сторону силы встали.
537|21.04.2020 16:08:37|Paul Young|Админ темам про Дени уже не сопротивляется
538|21.04.2020 16:09:03|Алексей Чернушевич|Я на стороне опыта стою.
539|21.04.2020 16:09:15|Andrey Hohrin|Меня, вообще, удивляет умение ряда эмитентов заигрывать с инвесторами.
540|21.04.2020 16:09:35|А что ты сделал для котэ!?|Кстати, смех смехом, но СЕЙЧАС и последние полгода у меня тоже есть ощущение что эмитент вполне может погасить. Сейчас  это дисклэймер, поскольку кто его знает, может в январе деньги отменят и биржу закроют. Но то что Дэни, при желании, сможет погасить  сомнений нет P. S. При желании это тоже дисклэймер
541|21.04.2020 16:09:38|Oleg Kuzmin|одна из теорий заговоров гласит о том, что Дэни расплатился по иску с Теле2 облигами и теле2 эти облиги льёт, т.к.им нужен кеш а не облиги. но это не точно
543|21.04.2020 16:09:49|Потапыч|dengordeev Денис, в рамках рекламной кампании, погасите весь выпуск ко дню победы. Сильный был бы ход, во время самоизоляции.
544|21.04.2020 16:10:20|Кот Базил|Поддержу
545|21.04.2020 16:10:22|Aleksandr|Это да , я тоже страдаю , когда вовремя не поставил на черное , а оно выпало.
546|21.04.2020 16:10:36|Алексей ayaye :)|я понял. это просто смм. дэни так продвигает себя в топ по доходности
547|21.04.2020 16:10:40|Dmitry Manzor|не учитесь плохому
548|21.04.2020 16:10:49|Ivan Ivanov|Там в мировом не предусмотрен такой способ исполнения
549|21.04.2020 16:11:03|Andrey Hohrin|Эмитенты, которые пытаются выговаривать инвесторам  хреновые эмитенты. Вот и весь тезис.
550|21.04.2020 16:11:03|Denis Gordeev|работаем много лет  это не подтверждение MVNO просто так Т2 также не дает кому попало. Ваши фантазии абсолютно беспочвенны. Как и про облигации, которые льет Т2. Может быть стоит подумать прежде чем чтолибо писать
551|21.04.2020 16:11:12|Сергей Ковалев|Раньше модно, позже нет
552|21.04.2020 16:12:08|Кот Базил|С нами надо не заигрывать эмитенту, а отвечать нормально.. а играют в казино, некоторые путают.. но это пока
553|21.04.2020 16:12:42|Andrey Hohrin|я в свойственной манере пытался иронизировать
554|21.04.2020 16:13:10|Кот Базил|Верно
555|21.04.2020 16:13:19|Dmitry Manzor|поэтому есть вы, организаторы. Эмитенты не всегда могут правильно донести мысли
556|21.04.2020 16:13:34|Алексей Чернушевич|Какая хорошая фраза. Запомню.
557|21.04.2020 16:13:59|Andrey Hohrin|как раз, для усиления опыта
558|21.04.2020 16:14:09|Ivan Ivanov|Если возможно, когда заявляете о встречном иске для начала его надо подать.
559|21.04.2020 16:16:41|Oleg Kuzmin|почему кисло порадуемся за людей сделали ставку и выиграли явсегда радуюськогда ктото выигрывает в лотерейку миллиард
560|21.04.2020 16:17:45|Alec|Из плюсов пока только футболка и бесплатный акционный тариф, из минусов бумажный убыток. А забыл ...ещё купон
561|21.04.2020 16:18:17|Кот Базил|По объему торгов сегодня явный лидер... Как гтлк вместе взятые...
562|21.04.2020 16:18:34|Oleg Kuzmin|а жаль, красивая была теория
563|21.04.2020 16:19:49|Кот Базил|А если вам БКС как промежуточное звено вставить.... но тут чисто эмитента проделки..
564|21.04.2020 16:20:07|Ilya|Алексей, стебутся те, в том числе кто взял по 9080706050 и офигевает сидит. Слова говорятся ораторами  правильные. И Денис и Евгений и Павел да все нормально все говорят. Но если цена 50 значит для внешнего наблюдателя  что то не так и словам верить сложно. Вроде простая психология. И если вдруг эти инвесторы заработают, то выдохнут они и все, кусать ничего не будут.
565|21.04.2020 16:20:42|Ivan Ivanov|А как это влияет на способ исполнения
566|21.04.2020 16:21:09|Ilya|А... так все ирония Предупреждать надо. Мы же записываем все.
568|21.04.2020 16:23:23|Oleg Kuzmin|вы с смстрафик давно работаете
569|21.04.2020 16:23:37|Andrey Hohrin|тезис
570|21.04.2020 16:24:15|Alex|Работаем много лет, это вы считаете со времён Жёлтых страниц Деминского и Шмыриной И десятка других схем
571|21.04.2020 16:25:16|Dmitry Manzor|кстати говоря, если Т2 вам отключит рубильник, как быстро вы сможете договориться с другими операторами на предоставление линий
572|21.04.2020 16:25:28|Кот Базил|Да фиг бы просто мировое с Теле2 обещанием дэни какими то облигами рассчитаться в Теле2 кто то бы подписал.. а вот когда серьезная контора подписалась.. там варианты уже есть.. но все куда проще.. БКС давно нет, а облиги льют
573|21.04.2020 16:25:34|Alex|Деминский не исполняет обязательных требований, и уже получил за это срока. Зачем снова верить
574|21.04.2020 16:26:20|Ivan Ivanov|Ну да
575|21.04.2020 16:26:34|Алексей Чернушевич|Добро пожаловать в рынок Рынок страха и жадности. На вашем месте меня интересовало бы только опция фин состояния и платежеспособности ликвидности эмитента.
576|21.04.2020 16:26:43|Denis Gordeev|вопервых не отключит, им выгодно. вовторых у нас есть договоренности с другими операторами, мы их используем там, гед нет зоны покрытия Т2. Перейти гдето одна неделя.
577|21.04.2020 16:27:28|Lizardking0808|Выложите МСФО, и всё это сразу закончится
578|21.04.2020 16:29:01|Ilya|А меня только это и волнует.
580|21.04.2020 16:29:55|Dmitry Manzor|МСФО не панацея
581|21.04.2020 16:30:38|Кот Базил|Зачем, они пылесосят по низу...на друж. лиц. Потом по оферте сдают эмитенту. Так же нельзя напрямую покупать из стакана. Им выгодно низкие котировки..
582|21.04.2020 16:31:14|Алексей Чернушевич|Тогда вцепитесь в Евгения больше и Дениса опционально и включайте свои мозги.
583|21.04.2020 16:31:22|Viacheslav Petriaev|Потом в январе по 100 купят, но будет уже всего ничего
584|21.04.2020 16:32:36|Evgeniy|ФинЭкспертиза  аудитор заслуживший доверие. Мы тоже ждём в подписанном виде.
585|21.04.2020 16:33:00|Rodan|Когда
586|21.04.2020 16:33:30|Алексей Чернушевич|Пора, кстати, Диму patsak9876 звать и прибраться здесь, а эмоции вынести в Друзя.
587|21.04.2020 16:34:05|Ilya|Пока ни тот ни другой ничего нового не сказали, что в общем то и хорошо. Я выше написал, что все что они говорят вполне ок. Дополнительно в них вцепляться смысла нет, у них своих денег нет нам погашать. Если к нам, стебунам, какие то претензии  тут извините, цена говно, мы продолжим.
588|21.04.2020 16:34:42|Evgeniy|По информации от эмитента  Аудиторское заключение сформировано и находится на подписи. Ожидают подписания в самое ближайшее время.
589|21.04.2020 16:35:57|Дмитрий Адамидов|Коллеги, давайте правда перерыв сделаем. Про Дэни сил уже нет. Сменим тему
591|21.04.2020 16:37:33|Mikhail Evdokimov|
592|21.04.2020 16:39:27|Ilya|Начальника пришел
593|21.04.2020 16:40:02|Дмитрий Адамидов|да, я дал 100500 комментариев про нефть и меня заставили задать вопросы Гуриеву
595|21.04.2020 16:40:52|Andrew Jazz|зачем больше смысла моему коту задавать вопросы 
596|21.04.2020 16:40:54|Dmitry Manzor|Гуриев ещё давно говорил о том, что цена на нефть упадёт. Не слушали
597|21.04.2020 16:41:44|Дмитрий Адамидов|рынок нефти таков что любой прогноз сбывается рано или поздно
601|21.04.2020 16:42:38|Ilya|Кидай ссылку 
602|21.04.2020 16:43:15|Дмитрий Адамидов|да ну их 
603|21.04.2020 16:49:52|Evgeniia Bushunova|_
604|21.04.2020 16:53:01|Alexey Vishnyakov|Что то похожее уже один раз было. Котировки по сорок, обещания эмитента исполнить все обязательства... А сейчас котировки как раз 50 пробили.
605|21.04.2020 16:55:19|Дмитрий Адамидов|История вообще повторяется. А потом я всех выгнал в Друзя
607|21.04.2020 16:56:47|Полина Кузнецова|По Обуви России как связан перенос с вирусом
608|21.04.2020 17:04:01|In|Одни эффективные, другие скребут по сусекам https//www.retail.ru/news/wildberriesudvoilprodazhiv1kvartale2020g21aprelya2020193567/
609|21.04.2020 17:12:40|DIM|Однако купон 10 апреля они платили без ссылок на этот закон, речь про обувь 2
611|21.04.2020 17:15:54|Ilya|Это в пробондсе обсудили вроде
612|21.04.2020 17:20:36|Aleksandr|А зачем Вам ожидать Купон то не Вам адресован. А Банк все устраивает.
613|21.04.2020 17:33:29|Alex|Мне вот интересно как купон без ОСВО перенесли
614|21.04.2020 17:33:59|Aleksandr|По решению Путина о нерабочих днях
615|21.04.2020 17:35:57|Alex|Ага, ну это оспоримый момент. Главное в непубличном выпуске.
616|21.04.2020 17:36:36|Aleksandr|Неоспоримых аргументов вообще не бывает
