|time|user|text
224|30.09.2019 21:04:38|Дмитрий Адамидов|через месяц очень вряд ли.
228|30.09.2019 21:06:34|Сергей Ковалев|продаем всю валюту и покупаем деревянные на всю котлету
229|30.09.2019 21:07:07|Дмитрий Адамидов|ну это как хотите  а вообще по 80 надо было сдавать или сколько он там был в 2015 году
232|30.09.2019 21:17:31|Olga|
233|30.09.2019 21:20:50|Alexey|Строго имхо  дисрапторов стало больше. Могут и вне расписания прилететь
235|30.09.2019 21:26:56|Aleksandr| россия фининдустрия брокеры База данных о сданных инвесторами квалификационных экзаменах будет создана в течение 23 лет на основе Маркетплейса  Швецов
236|30.09.2019 21:27:30|Alexey|Будет ли бизнес как на егэ
237|30.09.2019 21:31:15|Alexander|200 млн. разместили сегодня . верно
238|30.09.2019 21:31:43|Aleksandr|нет, это вторичка
239|30.09.2019 21:32:54|Алексей ayaye :)|права купил. ездить не купил. депо, прощай 
240|30.09.2019 21:36:32|Дмитрий Адамидов|У саудитов уже все это было и ни к чему не привело  при наличии неограниченной эмиссии резервной валюты демпингуй не демпингуй ... ничего не получишь толком. Посмотрим  время покажет
241|30.09.2019 21:37:20|Alexey|Еще и ставки некстати низкие  не дадут сдохнуть им
242|30.09.2019 21:54:55|Sky|Вы ж вроде ждали его
244|30.09.2019 23:17:23|Denis Kozlov Septem|Коллеги, всё гораздо проще. Не переживайте, пожалуйста. Расскажем чуть позже
247|01.10.2019 06:42:00|Александр|Скажите, а заявку брокеру подавать с 10 до 13 по местному времени или по Москве Первый раз участвую.
248|01.10.2019 06:42:49|Шура SiberianRanger|по Москве
249|01.10.2019 06:43:48|Александр|Благодарю.
250|01.10.2019 06:53:14|Антон|А куда делся 2008 в Вашей теории
251|01.10.2019 06:54:48|Alexey Vishnyakov|В 2008 сильного ослабления рубля не было.
252|01.10.2019 06:55:24|Максим Кочнев|в 2008 было просто возвращение в 2000
254|01.10.2019 06:55:47|Антон|Ну если так
255|01.10.2019 06:55:53|Максим Кочнев|но я тоже хз почему именно 14 должно быть в будущем
256|01.10.2019 06:56:53|Антон|Роснефть прижмут и снова будет 2014
257|01.10.2019 07:15:11|Антон|Прогноз с упором на кофейную гущу по поводу 14
260|01.10.2019 08:34:45|Denis| брокеры фининдустрия регулирование россия ЦБ может рассмотреть возможность допуска непрофессиональных инвесторов на рынок Forex при ограничении размеров заемных средств, которые трейдеры могут использовать для увеличения торговой позиции  Швецов
261|01.10.2019 08:35:08|Denis|Похоже вот кто закон лоббирует
262|01.10.2019 08:37:26|Екатерина Н|Интересно, на Форекс допускать можно, а на рынок иностранных ценных бумаг, да ещё на СПБ бирже, нельзя. Там риски ниже, чем на Форексе.
263|01.10.2019 08:42:21|Bugsy|у мну тоже ничего нет
264|01.10.2019 08:42:57|Вики|Я Денису написала,он ответил все пришло
265|01.10.2019 08:43:28|Bugsy|Тоже сейчас написал, жду
266|01.10.2019 08:50:40|Александр|Что то в терминале Эбис не вижу. Или ещё рано
267|01.10.2019 08:51:03|Aleksandr Mukhin|биржа начинает работу в 10 по москве
268|01.10.2019 09:14:03|Даниил Иванов|Раздавать будут после 14.00, если после 18.00 не придут, то можно будет начинать волноваться
269|01.10.2019 09:18:19|Александр|Спасибо.
270|01.10.2019 09:35:09|Sergey Sidorov|У Эбис БОП01 первый купон 31.12.19 
271|01.10.2019 09:35:37|Шура SiberianRanger|это на новый год 
272|01.10.2019 09:40:52|Dmitry Manzor|На новый год пропить не все успеют. Зависит от вашего брокера
273|01.10.2019 09:42:24|Елена Филякина|
274|01.10.2019 09:44:42|Mozg Company|Впереди размещение Ультры. Кто нибудь смотрел отчетность Сам не успел еще. Люблю промышленников с высоким купоном. Кратко ООО Ультра  управляющая компания, занимающаяся разработкой, производством и продвижением на рынке продуктов из металла. Основная продукция компании  металлическая сетка, профиль и стеллажи. Компания имеет распределительные склады в Москве, Краснодаре, Новосибирске и Челябинске. Среди клиентов компании  одна из ведущих DIYсетей в России  Леруа Мерлен.
277|01.10.2019 09:59:29|Savel|Звучит интересно. Может и в сектор роста попасть, и мсбэхой быть поддержанной
278|01.10.2019 10:01:30|Mozg Company|Читаете мыслм 
280|01.10.2019 10:03:06|Denis|Юнисервис
281|01.10.2019 10:09:32|First Last|Пора робота писать
282|01.10.2019 10:10:03|Alex Petroff|И чего этому гражданину с таким лотом не податься было на первичку...
283|01.10.2019 10:13:12|Alex S|лень человеческая не знает предела  этож надо звонить, писать... проще ляпнуть заявку и ждать чуда
284|01.10.2019 10:13:25|Denis|Какаято неопытная девушка сегодня в БКС была....подтормаживала чутка.
285|01.10.2019 10:13:44|Oleg Egorov|Возможно, что это группа граждан, чьи ценовые запросы совпали
286|01.10.2019 10:16:51|Mozg Company| факт. При 70 лямах опять 60 сек есть у всех.
287|01.10.2019 10:21:42|Елена Филякина|Может там 10 тысяч граждан
288|01.10.2019 10:24:01|Дмитрий Адамидов|Никуда не делся. Но там ослабление было все же не таким сильным. Да и скорее на 23 до кризиса рубль ходил изза нефти по 120140. В целом же курс и был в коридоре 3036
289|01.10.2019 10:37:29|Harry Lime|Да ладно , я ее разогрел уже с утра , может другую
290|01.10.2019 10:38:50|Денис|Кто в БКС на ЭБИС подавался, Вам трейдер говорил выпуск бо 1 р. По исину совпадает почему то в квике у них по другому отражается
292|01.10.2019 10:39:33|Dmitry Manzor|сейчас звонил в БКС. Уже знает всё про Эбис БОП01
293|01.10.2019 10:39:41|Шура SiberianRanger|Эбис Б1Р01 в квике ВТБ
294|01.10.2019 10:40:25|Елена Филякина|Вот это у вас, в ВТБ  скукота, монотонно и по делу.
295|01.10.2019 10:40:26|Денис|Я в 5 минут 11 по Мск звонил
296|01.10.2019 10:41:25|Шура SiberianRanger|зато у нас в ВТБ мальчики красивые  девушкатрейдер один раз за всё время попалась
297|01.10.2019 10:42:11|Елена Филякина|И мне один раз, я помню кофе подавилась
298|01.10.2019 10:43:52|Harry Lime|первичка Итоги первичных размещений за Сентябрь По росту цен облигаций 14 место занимают представители из сектора ВДО  ПНППК  Кузина  Моторные технологии  ИТЦ трейд  5 Место  возвращение на долговой рынок Хомяка  Итоги за Август bonds_lab
302|01.10.2019 11:00:22|Даниил Иванов|ITI считает что у бондов Jaguar есть апсайд
305|01.10.2019 11:04:52|Harry Lime|Про Ягу только плохое , сейчас смотрю отчет Мудис  негативный кэш фло 1,4 млрд фунтов Долг/ебитда above 5x , negative margin 3,4 Просто проговорите эти страшные цифры.
310|01.10.2019 11:11:57|Даниил Иванов|Спасибо Меня на самом деле смущает что ее все рекмендуют
311|01.10.2019 11:12:43|Harry Lime|TurkTelekom25 , Unifin 23 и 28 , Petropavlovsk на улучшении метрик. Вот пожалуй с чем согласен.
312|01.10.2019 11:12:54|Даниил Иванов|А по долларовым бондам по 100010000 как думаете будет какоето предложение
313|01.10.2019 11:13:05|Harry Lime|Будет , ждем
314|01.10.2019 11:13:14|Даниил Иванов|Petropavlovsk есть у Когана
317|01.10.2019 12:25:28|Алексей Кузьмин|death hand approaching
318|01.10.2019 12:29:40|Harry Lime| MOEX рынки россия На Московской бирже зарегистрировались 3 млн частных инвесторов Физические лица активно торгуют на биржевых рынках их доля в общем объеме торгов акциями составляет в 2019 году 33,5, облигациями  8,7, биржевые фонды  31,4. Частные инвесторы  активные участники размещений облигаций  за прошедший период 2019 года они выкупили новых корпоративных облигаций на 360 млрд рублей свыше 20 от всего объема и государственных облигаций на 56 млрд рублей 3,7 всего объема.
319|01.10.2019 12:30:01|Harry Lime|Народ массово научился в первичку
320|01.10.2019 12:32:00|Andrey Mayorov|Пока бабло будет идти на биржу, можно смело рассчитывать на апсайды. Вопрос лишь в том, сколько времени он будет длиться
321|01.10.2019 12:33:12|Oleg Egorov|До вступления в силу закона 3К
322|01.10.2019 12:33:23|Harry Lime|По идее да , купил и buy and hold
323|01.10.2019 12:33:58|Alex|Апсайды исчезнут при смене трендов.
324|01.10.2019 12:34:27|Harry Lime|Апсайды бывают фундаментальные и рукотворные. Где какой сами смотрите.
325|01.10.2019 12:34:46|G M|Хорошо. Больше, больше ликвидности Главное темп не терять. А то как новые эмитенты с 15м купоном, то никакой ТехноЛизинг 2 Иволги не выдерживает.
326|01.10.2019 12:36:44|Aleksandr|Техно2 адекватен по купону на фоне новых выпусков под 12 
327|01.10.2019 12:37:39|Andrey Mayorov|Очень тонкое замечание На волне всеобщего хайпа и энтузиазма легко поддаться эйфории. Правило одно покупать качество
328|01.10.2019 12:39:06|Harry Lime|Апсайд в Обуви будет фундаментальным , если будет , а в бумагах с маленьким флоатом сами смотрите
330|01.10.2019 12:40:43|Aleksandr|В малых выпусках апсайд часто рукотворный
331|01.10.2019 12:42:35|Harry Lime|Можно сказать и чисто рукотворный
332|01.10.2019 12:43:42|Alex Petroff|Топлист Тинька с сайта.
333|01.10.2019 12:44:07|Aleksandr|Я вообще беру в портфель только те бумаги которые готов долго держать без всяких апсайдов . И да , поэтому я не ходил в эти всеми любимые кисти , грузовики , такси
335|01.10.2019 12:45:35|Denis Ipatov|Ну вот чё они Каскад Роспромавто не назвали  Такой бы маркетинговый ход получился
336|01.10.2019 12:47:33|Aleksandr|Да и вообще , что такое апсайд   это неверная оценка рынка эмитентом.Нагрузил значит себя ставкой выше рыночной, выходит на капельку стал менее конкурентен в своем бизнесе.А может и не на капельку.
338|01.10.2019 12:54:11|Сергей|есть ещё тинькофтворный апсайд
339|01.10.2019 12:56:15|Harry Lime|В сложных и запущенных случаях  ПКБ , Софтлайн , да даже Легенда не помогает
341|01.10.2019 12:58:11|Сергей|с большими выпусками не работает и ну с заливными тоже
342|01.10.2019 12:58:30|Harry Lime|Вот 300 млн максимум
343|01.10.2019 13:00:33|Vitaliy Klimenko|Тинек помагает только с раскрученными именами, которые на слуху. Кармани все слышали а о легенде никто не знает
344|01.10.2019 13:01:14|Harry Lime|Не , похоже размер здесь имеет значение
345|01.10.2019 13:03:47|Vitaliy Klimenko|Вангую из за тинька и в каскад апсайда не будет, никто каскад не знает, русбондс вообще по нему дефолт выдает, а кармани снова отрастает
346|01.10.2019 13:13:56|DIM|Думаю тоже размер к сожалению решает
348|01.10.2019 13:14:44|Harry Lime|Каскадов полсотни разных
349|01.10.2019 13:15:21|DIM|Ну я про наш недавно разместившийся
350|01.10.2019 13:15:50|Harry Lime|Первого выдает дефолтника из Нижнего везде
351|01.10.2019 13:16:34|DIM|Мдэ, конечно бабушку с тинькова сразу отпугнет
354|01.10.2019 13:57:53|Soa|Квик как раз рулит
357|01.10.2019 14:04:59|sergei begreater|Тоже не понимаю постоянных нападок на Квик. Нормальный софт.
358|01.10.2019 14:05:21|Ruslan|по Светофору купон новый уже определен 
359|01.10.2019 14:09:50|Шура SiberianRanger|Скажем так, он функциональней мобильных приложенек российских брокеров.
360|01.10.2019 14:09:54|Vadim Brohkin|Quik софт профессиональный, не заточенный разрабами для  обычного пользователя . Зато самостоятельно ручками можно, чего нет и не будет в мобильных приложениях.
361|01.10.2019 14:10:47|Шура SiberianRanger|Хотите нормальный софт посмотреть, попробуйте tws от IB или thinkorswim
362|01.10.2019 14:11:30|Harry Lime|Это забава следующая после мне налили Эбис и СуперОкс ...
363|01.10.2019 14:12:58|Ruslan|надо понять, нести ли на оферту
364|01.10.2019 14:13:59|Harry Lime|Безусловно
365|01.10.2019 14:25:22|sergei begreater|Те кто в Квике не могут разобраться, и в TWS не разберутся. Там тоже не все сразу понятно. Особенно разнообразные типы заявок.
366|01.10.2019 14:30:48|Sky|Чьято элитная прям заявка на эбис на 361 бум  первая и с хорошей паузой к другим.
367|01.10.2019 14:32:15|Шура SiberianRanger|Меж тем Обувь встаёт с колен
369|01.10.2019 14:33:52|Aleksandr|Она просто шнурки завязывала
370|01.10.2019 14:36:02|Alex Petroff|В телеге есть великолепная функция правки собственных сообщений. Чтобы не генерить флуд. Пальчиком на сообщение, исправить, профит.
371|01.10.2019 14:37:06|Sky|О, ктото взял чутка на первичке даже
373|01.10.2019 14:48:21|Елена Филякина|Так у нас есть герои, стабильно сливающие по 120, правда встречных героев мы не знаем в лицо.
374|01.10.2019 14:53:16|Даниил Иванов|Думаю на дне петербуржского инвестора узнаем и про IPO думаю тоже
375|01.10.2019 14:56:20|Максим Кочнев|Друзь вас утешит
378|01.10.2019 15:14:42|Evgeny P|эбис налили, но ажиотажа в стакане нету.
379|01.10.2019 15:16:40|Максим Кочнев|Ибо его берут не для перепродажи 
380|01.10.2019 15:17:15|Evgeny P|ну в отличии от кузины и моторов желающих по 103 чето не видно купить 
381|01.10.2019 15:19:34|Bugsy|Давно было, уже полгода прошло, там шарага была а не эдвайзер
382|01.10.2019 15:21:42|Евгений Инвестор|Ну так процитированное сообщение Гарри в марте было написано 
383|01.10.2019 15:21:55|Aleksei Tuv|Выпуск gt50 и апсайда уже нет
384|01.10.2019 15:22:20|Bugsy|Ой, не посмотрел соряныч
385|01.10.2019 15:25:07|Harry Lime|Но из песни слова не выкинешь , история действительно была и многие клиенты получили пару недель блокировки аккаунтов
386|01.10.2019 15:25:58|Bugsy|Я тоже переводил от них, три дня блокировки было
388|01.10.2019 15:26:18|Mikhail Saratov|Господа, может быть глупый вопрос. А на Т_сколько мне надо смотреть, чтобы увидеть Эбис налитый
389|01.10.2019 15:26:43|Harry Lime|Т0
390|01.10.2019 15:30:01|Dimasik|Всё будет, не надо паники
391|01.10.2019 15:40:03|Harry Lime|Сеть коворкингов WeWork отложила IPO после того как оценка компании снизилась с 47 млрд до 20 млрд в ходе подготовке к выпуску акций. В 2000 году продать бизнес с убытком в 60 от выручки по мультипликатору Цена/Выручка  30 было пожалуй реально, но сейчас нет. Падают в стоимости и долги компании. Облигации WeWork с погашением в 2025 году дают доходность уже в 12 в долларах.
392|01.10.2019 15:40:27|Harry Lime|High Yeild , который мы заслужили ...
394|01.10.2019 15:41:56|Виталий Яковлев|Купил эбис в стакане по 100.32. брокер за заявку голосом берет 0,3 . ...
395|01.10.2019 15:42:17|Roman|Пару месяцев назад ТКС активно предлагал их брать для валютной диверсификации
397|01.10.2019 15:42:41|Harry Lime|Это адище покруче Ягуара
398|01.10.2019 16:01:01|Savel|дно петербургского инвестора Хм... Будут бернштрама в клетке показывать И организаторов кешберри
399|01.10.2019 16:04:08|Aleksandr Mukhin|isin СуперОкс RU000A100W52
400|01.10.2019 16:16:38|Rifnur|Каскад помаленьку растёт
401|01.10.2019 16:17:39|Soa|прогнозы по эбису
403|01.10.2019 16:19:53|Rifnur|Ставлю 101 в течении пару недель, затем плавно на 100.8. Долгосрочно 102
404|01.10.2019 16:21:07|Soa|будет техлиз и элщит...
405|01.10.2019 16:21:57|Alex|Я вдруг подумал что вопрос про фундаментал. А нет, показалось.
406|01.10.2019 16:22:18|Rifnur|Почему так пессимистично
407|01.10.2019 16:24:33|Soa|а в чем особая разница Одни и те же деньги
408|01.10.2019 16:30:52|Denis Kozlov Septem|Коллеги, мы закончили удовлетворение заявок на первичном размещении по Эбис БОП01. Если вы получили подтверждение от нас о том, что ваша заявка внесена в Книгу, но сегодня не получили облигации, пожалуйста, свяжитесь со мной.
409|01.10.2019 16:33:43|Artem Bogdashev|Добрый день, Денис. Не получил, брокерский счёт в Yango
410|01.10.2019 16:34:10|Людмила|Я тоже не получила. БКС
411|01.10.2019 16:35:40|Harry Lime|Стартовало голосование в номинациях Cbonds Awards  2019 По традиции выбираем лучших среди DCM, эмитентов, сделок, sales, trading и многих других  всего 22 номинации. В этом году мы добавили еще одну   Лучший аналитический Telegramканал по финансовым рынкам   проголосуйте за самую качественную аналитику на просторах Telegram. Голосование продлится до 1 ноября. Вручение Cbonds Awards пройдет 6 декабря в СанктПетербурге на галаужине XVII Российского облигационного конгресса . Оставьте свой голос http//cbonds.ru/votes/263
412|01.10.2019 16:35:53|Harry Lime|Голосуй , или проиграешь ...
413|01.10.2019 16:37:47|Денис|Позвоните трейдера. У меня в приложухе не кажет. А брокер сказал удовлетворена
414|01.10.2019 16:38:11|Denis Kozlov Septem|Уже все пожаловались на БКС. На нашей стороне все закрыто  другие брокеры уже отразили бумаги
416|01.10.2019 16:48:53|Евгений Ефанов|Аналогично. Трейдеры бкс подтвердили исполнение.
417|01.10.2019 16:51:37|Kregg|Кто не видит Эбис в БКС  смотрите в Квике. Мобильное не показывает, в саппорте сказали что всё будет по окончанию размещения
418|01.10.2019 16:52:09|Vadim Brohkin|И теперь свершится рассылка скриптов для СУПЕРОКС
419|01.10.2019 16:52:30|Rifnur|Купон
420|01.10.2019 16:52:37|Bugsy|Пока нету
421|01.10.2019 17:00:13|Denis Kozlov Septem|В течение пары часов разошлем
422|01.10.2019 17:19:55|!|Он с финама вестимо
423|01.10.2019 17:21:57|Kregg|Прикол в том, что первичка ещё даже недоразместилась 
424|01.10.2019 17:22:15|Sky|Доха решает. В техлизе и не было апсайда. Это было видно заранее.
425|01.10.2019 17:23:11|!|Так в финаме со стакана дешевле брать изза комиссий на первичку. Поэтому многие ей не пользуются, тем более при таких объемах
426|01.10.2019 17:24:27|Sergey Sidorov|Гарри, предложите умное голосование в нашей тематике номинаций CBonds.
