|time|user|text
1|05.03.2020 21:56:25|Елена Филякина|Если передумаете, намекните над какими бумагами будете экспериментировать
2|05.03.2020 21:58:22|Helena Yakh|, подбирать будем Мистер по 60 возвращается как в Легенде 60 и Кармани по 71
3|05.03.2020 22:00:55|Елена Филякина|Так уже сколько можно ждать Легенду по 70.
4|05.03.2020 22:03:25|Helena Yakh|Была же по 71, но не ждали. Теперь готовы
5|05.03.2020 22:03:39|Soa|да да..мне тоже интересно, чисто посмотреть
6|05.03.2020 22:05:09|Ivan Z|Думаете много наловите Там же объемы проливов небольшие, а ловит много кто уже. Чемто советскую очередь напоминает в Макдональдс, как на известном фото
7|05.03.2020 22:06:42|Soa|меня всегда умиляют ловцы по 60 и т.п. И любители по 1 бумаге огород городить
8|05.03.2020 22:07:37|Dmitry Aleksandrov|Сходу не помню, местный
11|05.03.2020 22:11:27|Елена Филякина|Да мы всей командой подтянемся
13|05.03.2020 22:15:19|Sky|Если бидов нет совсем то заявка по рынку будет отменена.
14|05.03.2020 22:20:55|Ivan Z|Это да ну может автоматом заявки кто проставляет везде, руками это довольно безумно делать
15|05.03.2020 22:22:00|Evgeny P|бывало и по 50 наливали
17|05.03.2020 22:29:12|Evgeny P|если портфель небольшой то это очень недолго. Выставляешь и ждешь. Редко, но срабатывает. Но не по 60 конечно. Это наверное действительно почти нереально поймать, хотя в ноябре ктото чихнул в Рубеж и там как раз пробивало на 40
20|06.03.2020 07:57:38|Andrey|Тариф мой онлайн, голосовое 150 р/шт. Остальные тарифы 5 шт безплатно, далее платно.
21|06.03.2020 08:03:45|Мирошниченко Алексей|Подача на оферту через брокера ВТБ  1000 руб. Так ответили на вопрос по эл.почте
22|06.03.2020 08:07:32|Александр Нечаев|В день 5 бесплатно
23|06.03.2020 08:13:20|Кот Базил|Это не оферта через депозитарий За такую, да 1000р. Это через рпс выкуп, тариф как у обычной сделки, плюс компа за заявку по телефону, если есть..
24|06.03.2020 08:14:45|Александр|Это у вас ВТБ получается не берет комсу как за оферту Бкс например берет полную комиссию, им не важно, что там рпс
25|06.03.2020 08:15:25|Andrey|Ответил в друзе.
26|06.03.2020 09:06:45|MММ🥕🐹|Письмо по шаурме пришло кому
27|06.03.2020 09:09:19|Dmitry Manzor|нет, но обещают до 1000 прислать
28|06.03.2020 09:09:47|MММ🥕🐹|50 минут осталось 
29|06.03.2020 09:30:58|Evgeniia Bushunova|Новости до открытия торгов 6 марта 1 По итогам вчерашних торгов доллар вырос до 67,6 рубля. Нефть Brent снова торгуется ниже 50. 2 Олегу Тинькову грозит до 6 лет тюрьмы за уклонение от налогов. Власти США обвиняют его в сокрытии активов на сумму не менее чем на 1 млрд. 3 В штате калифорния объявлено чрезвычайное положение изза COVID19. Индекс SampP500 обвалился почти на 3,5. 4 Эмитенты откладывают размещение облигаций спекулятивного уровня изза коронавируса. Свои выпуски уже отменили ЕвроХим и Минфин Белоруссии. 5 Команда 2Stock объявляет антивирусный вебинар, на котором инвесторы смогут повысить свой иммунитет. Его проведет основатель Alenka Capital Элвис Марламов. Регистрация по ссылке 
30|06.03.2020 09:31:34|Evgeniia Bushunova|См пункт 4. Неплохо так облигации Белоруссии в спекулятивные бонды записали 
31|06.03.2020 09:33:59|Harry Lime|В 2012м году бонды Белоруссии в рублях на ММВБ упали до 80 от номинала  белодэнни такое было
33|06.03.2020 09:37:38|Evgeniia Bushunova|Теперь буду знать 
34|06.03.2020 09:56:16|Oleg Egorov|Богатый белый мужчина в тюрьме не сидит с Американская народная мудрость.
35|06.03.2020 10:06:32|Артем|Доброе утро Без паники, идет отчаянная борьба с рассылкой. Скоро все будет.
36|06.03.2020 10:08:06|MММ🥕🐹|Можно просто объявить аллокацию И боритесь дальше с рассылкой сколько душе угодно
37|06.03.2020 10:13:45|Артем|Ненадежный вариант кто как посчитает, кто как округлит. Каждому должна прийти точная итоговая сумма на почту. Всем спокойней будет
38|06.03.2020 10:13:47|Alex|Это самый настоящий мусор, но не Аргентина конечно
39|06.03.2020 10:15:51|MММ🥕🐹|Тогда старайтесь... просто без информации непонятно сколько кэша доставать из кармана 
40|06.03.2020 10:38:19|Евгений Б|Если судить по данным из ЛК . то аллокация 76
41|06.03.2020 10:39:55|Артем|Кстати, да в личном кабинете обновленные данные уже вполне доступны и им можно верить. А вот письма застряли на почте.
43|06.03.2020 10:43:14|Harry Lime|Да , видно , но почты нет , брокер указан неверно , можно его поменять  Я теперь знаю какой он должен быть
44|06.03.2020 10:44:23|Max|Я тоже указа брокера БКС Банк.
45|06.03.2020 10:44:59|MММ🥕🐹|Выставлять то заявки то на размещение надо будет на полный сайз или на скорректированный в ЛК
46|06.03.2020 10:45:21|Max|И тоже письма не получил
47|06.03.2020 10:46:07|Евгений Б|Пришло письмо с подтверждением и в нем подтверждено 30 , в ЛК 75, Чему верить 
48|06.03.2020 10:46:07|Alexander|А у меня ничего не уменьшилось, так и висит ровно та сумма которую ставил и статус в обработке
49|06.03.2020 10:46:34|Артем|Все нормально с брокерами, менять ничего не надо. И заявки больше не редактируются
50|06.03.2020 10:47:13|Max|Письмо подтверждение будет  И какое колво указывать 
51|06.03.2020 10:47:48|Артем|В день размещения 11 марта заявки надо выставлять на скорректированный размер, разумеется.
54|06.03.2020 10:57:23|Alexander|Z0 скорее всего. На почту должны скрипт прислать. Адресные заявки это.
55|06.03.2020 10:58:14|MММ🥕🐹|А когда примерно разошлёте спецификации выпуска по депозитариям избушек
56|06.03.2020 10:58:36|Boris|вопрос 14 в факе
57|06.03.2020 11:03:41|Артем|Рассылку вроде прорвало. Сейчас всем придет по 2 письма вероятно первое на ту сумму, что подавали, второе на скорректированную. Отменить процесс не имеем возможности. Поэтому просим в день размещения выставлять заявки на скорректированные суммы их всегда можно сверить с теми, что указаны в личном кабинете. Заявки менее 5 шт не корректировались и остались без изменений.
58|06.03.2020 11:07:57|Alexander G|Подавал 2 заявки пришло 3 подтверждения  запутали
59|06.03.2020 11:09:54|Артем|Сейчас четвертое придет
60|06.03.2020 11:10:53|Alexander G|Крутяк 
61|06.03.2020 11:13:30|Boris|https//t.me/faq_angrybonds
62|06.03.2020 11:14:02|Павел|boomin подхватил коронавирус
63|06.03.2020 11:15:18|Артем|А этот вопрос вообще не понял. Может я тоже вирус подхватил
64|06.03.2020 11:16:54|Ilia|Перехвалили систему вчера. Отправил заявку одну, сначала пришло письмо с большим количеством, потом с меньшим
65|06.03.2020 11:17:28|Paul Baikov|Усредняйтесь 
66|06.03.2020 11:20:35|Артем|Там в другом вопрос никогда нельзя отпускать программиста в отпуск. Пусть врастает в рабочее место Ориентир на уменьшенное число.
67|06.03.2020 11:25:11|Ilia|Да уже сравнил с личным кабинетом, меньшее число бьется
68|06.03.2020 11:26:19|MММ🥕🐹|У некоторых брокеров можно заранее выставить заявку на первичку, но только после того как у них будет спецификация на выпуск
69|06.03.2020 11:28:14|Артем|Во вторник, 10.03 разошлем скрипт, но не раньше чем ISIN присвоят.
70|06.03.2020 11:38:56|Sereja|похитили Дмитрия
72|06.03.2020 11:42:46|Dmitry Manzor|Е65К находятся рядом, явно кот наступил
74|06.03.2020 12:11:51|Максим Воробьев|Жаль, я уж подумал  наконец то сакральное знание Но себе на всякий случай записал 21111...  Кот кстати не бегал, а стоял на 1 
75|06.03.2020 12:18:06|Дмитрий Адамидов|ладно все  котов удаляем, как будто ничего не было
77|06.03.2020 12:19:52|Max|Зато в акциях весело  Все валится штопором.
79|06.03.2020 12:21:38|Снежко Сергей|Появляется много папир с двухзначной дивдохой Я почти все вдо на той неделе сдал Ждемс....
80|06.03.2020 12:37:09|Дмитрий Адамидов|мне кажется на следующей неделе все должно выправиться. идет просто какойто торг большой, вот на бирже и куканище
82|06.03.2020 12:59:13|Andrey|Вы про нефть
83|06.03.2020 13:12:17|Дмитрий Адамидов|Про нефть тоже. Но я думаю, что про всё сразу
85|06.03.2020 13:21:58|Soa|обувь скоро
93|06.03.2020 13:42:40|Λέων|А разве Кримсон ведет тот же автор
95|06.03.2020 13:47:56|Kregg|Анонимусы обычно тырят всё подряд. Кримсон не аноним, случаем
96|06.03.2020 13:48:34|Λέων|Аноним, но его цитирует на этом канале с ссылкой часто
97|06.03.2020 13:51:42|Denis Kozlov Septem|Кримсон не аноним
98|06.03.2020 13:53:18|Kregg|Ну тогда всё проще, два неанонима всегда смогут разобраться кто ссылку забыл 
99|06.03.2020 14:01:23|Дмитрий Адамидов|Вы обратили внимание что там перепост И это я перепостил
101|06.03.2020 14:03:24|Soa|в условиях эпидемии я бы не заявлял так уверенно
102|06.03.2020 14:03:51|Дмитрий Адамидов|Он еще на ваших похоронах прстудится, как говорится
103|06.03.2020 14:08:46|Λέων|Действительно...
105|06.03.2020 14:35:13|Dmitry Manzor|как будет 99.99, тогда поговорим
106|06.03.2020 14:35:28|Mikhail Saratov|пока ждём купонов наполучаем как раз
107|06.03.2020 14:35:37|Dmitry Manzor|считаю эту тему отвлечением вниманмя от Дэни
108|06.03.2020 14:35:56|Mikhail Saratov|надо поискать, ездила ли делегация Краснодарского края в Ухань
110|06.03.2020 14:38:08|Владимир Парцей|Опубликовал гайд по покупке облигаций на первичном размещении. Прочитать можете по ссылке https//t.me/RuBonds/166 Если ссылка не открывается можете найти его вручную, зайдя на канал RuBus1997
111|06.03.2020 14:40:15|Sky|Это ж Ивогла ещё на размещении этого эщита публиковала
112|06.03.2020 14:49:50|Kir|Тихо взял и пошёл называется нашёл
113|06.03.2020 14:54:46|Denis Ipatov|В Тиньке бумагу не считают ценной
114|06.03.2020 14:58:26|Dmitry K|Там давно этот косяк
115|06.03.2020 15:01:15|Denis Ipatov|И Тиньков может быть ещё лет 6 не будет обращать на него внимания
116|06.03.2020 15:02:34|Soa|наоборот, сможет сосредоточиться на деталях..
117|06.03.2020 15:09:38|Alexey|Манька села на забор
118|06.03.2020 15:13:21|Тимур Ксёнз|Коллеги, приветствую Меня зовут Тимур Ксёнз, я СЕО краудлендинговой платформы Money Friends. Увидел обсуждение нашего клиента Калита, который готовится выйти с первым облигационным займом и хотел поделиться комментарием. Всего компания привлекла у нас 13 млн. Начинала и правда с 28 годовых, но последний займ был под 21. Был у них в Омске у нас выезд  обязательный этап проверки всех заёмщиков. Оценил работу, прошел по кабинетам, пообщался с сотрудниками. Нареканий не было. Всем инвесторам Калита платит день в день, исправно и без задержек. Правильно было замечено, что крауд для компании был скорее эксперимент. У нас в канале есть информация о них, на днях опубликуем более подробный лонгрид с деталями.
119|06.03.2020 15:14:16|Harry Lime|Отлично , спасибо  Жду лонгрид , может и схожу в Калиту.
121|06.03.2020 15:29:20|Сергей|за 20
122|06.03.2020 15:45:50|Тимур Ксёнз|Работаем над этим. Скоро прикрутим эквайринг
123|06.03.2020 16:04:57|G M|Спасибо за информацию.
124|06.03.2020 17:20:41|Harry Lime|Денис Козлов , Септем Капитал , почти 2 года назад
126|06.03.2020 17:30:43|Alexander|Да чёто не особо распродаютто. Шевченко только к номиналу прижали, а что ещё
127|06.03.2020 17:31:16|Даниил Иванов|Кривая ещё удобнее
128|06.03.2020 17:31:56|Denis Kozlov Septem|Сомнительно, что будет ниже номинала  на рынке вдо нет шортов, маржиналки и репо, поэтому принудительной распродажи не будет
129|06.03.2020 17:32:53|Alexey|Профессионалы не будут распродавать. Но ведь люди  не профессионалы
131|06.03.2020 17:34:38|aleksey|ЮАИЗ но там объём копейки
132|06.03.2020 17:36:28|Adviser|Если есть такие мысли, то никто не мешает разделить бюджет на несколько частей, а пропорции как раз будут характеризовать веру в снижения
133|06.03.2020 17:36:51|Dmitry Manzor|ну кто продаст условный ПР по 98 давайте, я подберу у нас в ВДО психологическая граница номинал и начнётся всё сначала
134|06.03.2020 17:37:52|Capricious|шел март 20го, инвесторы все хорохорились и хорохорились 
135|06.03.2020 17:39:05|Dmitry Manzor|психологическая граница была, но быстро отскочила
136|06.03.2020 17:39:23|Aleksandr|Хорохорились или хохрились
137|06.03.2020 17:40:54|Adviser|Так я не предлагаю его увеличить... Разделите на 34 части. Например,  20 текущие варианты  30 вторая волна в которую верите  30 третья волна  20 на консервы
138|06.03.2020 17:41:03|Capricious|прошу заметить , это Вы предложили такой вариант 
139|06.03.2020 17:45:37|Adviser|Ктото пристраивает остатки, ктото высвобождает...
140|06.03.2020 17:53:10|Тимур Ксёнз| так пишут наши конкуренты хотя я проработал в Сбербанке и Сбербанклизинге несколько лет
141|06.03.2020 17:55:54|Dmitry Manzor|порежут
142|06.03.2020 17:56:49|Harry Lime|Первичка первичке рознь. Есть условная массовка и есть ламповые выпуски по 50100 млн. Хотите верьте , хотите нет , во многих таких выпусках приличные доли держателей общаются друг с другом . Они не льют и докупают.
145|06.03.2020 18:01:11|Soa|Смелое заявление
146|06.03.2020 18:01:26|Harry Lime|Всем пофиг
148|06.03.2020 18:05:51|Soa|на то есть причины, плечи помогают, маржин коллы..
150|06.03.2020 18:07:20|Capricious|а мы с баффетом в кэше посидим 
151|06.03.2020 18:07:36|Soa|Буду ждать пописят после первого дефолта
152|06.03.2020 18:07:59|Serg sv|Облигации U.S. STEEL сейчас торгуются с доходностью 10.7  в долларах. Вот это ВДО  Держу немного давно уже. А тут по такой ставке одни мелкие лизинги  и мелкие строители 
153|06.03.2020 18:08:34|Alexander|Кстати, как низкая цена на нефть влияет на бизнес Калиты
154|06.03.2020 18:08:51|А что ты сделал для котэ!?|Как покупали
155|06.03.2020 18:09:11|Serg sv|как и все  на Interactive Brokers
157|06.03.2020 18:10:28|Harry Lime|Скоро по писят ...
158|06.03.2020 18:11:49|Serg sv|ну все таки там нормальные финансовые показатели. Я к тому что риск то есть , но как это сравнивать с нашими корпоратами которые дают по 6 7  в рублях 
159|06.03.2020 18:11:53|Ivan Z|Но Баффет не сидит в кэше...
160|06.03.2020 18:12:23|Harry Lime|Удачи
161|06.03.2020 18:12:57|Serg sv|да я немного  я же не на всю котлету. у меня в них 3 от порфеля по америке.
162|06.03.2020 18:13:49|Harry Lime|Смотрел на них в мае 19 года , полная жопа ...
163|06.03.2020 18:13:59|Denis Kozlov Septem|Есть отчетность и презентация
164|06.03.2020 18:14:11|Serg sv|просто я не понимаю когда наши корпораты, которые дышат наладом дают 6 и их скупают . у нас вообще разница между ОФЗ и корпоратами минимальная.
165|06.03.2020 18:14:13|Denis Kozlov Septem|Я ничего по Калите не видел. Это бо или ко Кто орг
166|06.03.2020 18:14:24|Alexander|Иволга, бо
167|06.03.2020 18:14:57|А что ты сделал для котэ!?|Презентация ходит по рукам С орфографическими ошибками 
168|06.03.2020 18:15:56|Denis Kozlov Septem|тогда о чем вы сейчас нас просите
171|06.03.2020 18:18:46|Ivan Z|Вы финансовые показатели us steel смотрели, изучали почему там такая доходность
172|06.03.2020 18:20:09|Serg sv|когда покупал, смотрел  нормальные показатели. но я покупал по 92 94 от номинала. Сегодня паника на рынках  многое проливают. просто вот увидел цену 84 и решил написать в чат. Это Америка. там движения покруче чем у нас 
174|06.03.2020 18:58:52|Andrey Solyanik|У US Steel маржинальность производства стали мизерная даже в сравнении с демпингующими китайцами. И Америка не Россия, в плане искусственной поддержки убыточных, но социально важных преприятий. US Steel не будут спасать как Путин спасал Мечел.
175|06.03.2020 19:00:05|Harry Lime|Все так , в случае рецессии умрут практически безболезненно
176|06.03.2020 19:00:22|Serg sv|я никого не агитирую. у них на момент изучения моего была и подушка денежная и много чего . и выроятность падения US STEEL лично для меня раз в десять ниже веростности падения ГТЛК или какого нибудь УРАЛКАЛИЯ. Все сугубо ИМХО,
177|06.03.2020 19:00:53|Ilya|может и будут спасать, но сначала побреют кредиторов
178|06.03.2020 19:01:52|Harry Lime|Там просто упадет цена до 4050 , вопрос времени
179|06.03.2020 19:02:47|Andrey Solyanik|Илья, а Вы не изучали предметно, смогли ли держатели акций/бондов Дженерал Моторс в 2008 году хоть чтото получить Или вообще с нулем остались
180|06.03.2020 19:02:54|Serg sv|зачем я это сказал.. конечно . Обувь россии на порядок надежнее или Талан 
182|06.03.2020 19:03:54|Шура SiberianRanger|Первичка 6 марта
183|06.03.2020 19:04:04|Serg sv|а в случае рецессии где будут все Лизинги и Мясничии с ломбардом  И сколько будет курс рубля. Еще раз  я держу и российские ВДО и акции, и много чего 
184|06.03.2020 19:04:23|Ilya|все норм. мнения разные у всех.
185|06.03.2020 19:04:53|Harry Lime|Можно посмотреть рекавери на сайте аукционов кредитных событий.
186|06.03.2020 19:04:57|Serg sv|у меня 50 в рублевых активах 50 в долларах. из рублевых 70 акции , 30 ВДО.
187|06.03.2020 19:05:36|Harry Lime|С Ломбардом все будет хорошо , ломбарды кормятся в кризис
188|06.03.2020 19:07:55|Ilya|а вот в этом сообщении нет действительно смысла. если 2966 участников такое напишут  да и какая разница какой у вас портфель, разбираем эмитентов
