|time|user|text
714|02.10.2019 11:55:30|Alex Petroff|Суборды списываются безвозвратно при снижении капитала банка ниже определенного уровня достаточности. Вам никто ничего не будет должен. Совсем.
715|02.10.2019 11:55:53|Sasha Bolilaya ГК ЛЕГЕНДА|Елена, для удобства, прошу в личном сообщении указать имэйл. Вышлю туда план действий.
717|02.10.2019 11:56:41|Harry Lime|Вас не пугает вероятная цена 80 через 3 года , мне было бы страшно до жути
719|02.10.2019 11:58:50|Marina Kabanets|При сентименте на повышение ставок  вот эту фразу я не поняла. Сентимент  прочитала что такое  настроение торговли повышение ставок чего
720|02.10.2019 11:59:09|Alex Petroff|Согласен Оба риска внутри.
721|02.10.2019 11:59:42|Harry Lime|Если ЦБ установит ставку 17 , как он сделал в декабре 14 года , его цена уполовинится , так понятнее
722|02.10.2019 11:59:59|Marina Kabanets|про риски субордов поняла теперь четко, спасибо
723|02.10.2019 12:00:00|Alexey Vishnyakov|А я с инноваций ещё набрал  решил продать онлайн микрофинанс и переложиться. Сегодня как раз без купона. Отдали по 100.22
724|02.10.2019 12:00:22|Marina Kabanets|и вам спасибо в двух фразах объяснили статью википедии
726|02.10.2019 12:02:31|Aleksandr Mukhin|и суборды могут списать совсем при введении внешнего управления. банкротство не обязательно
727|02.10.2019 12:02:56|Harry Lime|Я хочу сказать , что цена этого суборда имеет потенциал роста пару процентов , а падения  20 , это неэквивалентная сделка
728|02.10.2019 12:03:37|Alex Petroff|Давайте пожалуйста в Друзя druz_svid , чтобы не засорять профильный чат отвлеченными темами. Тем более в дни размещений В чате Друзя те же спикеры, что и здесь, только более расслабленная атмосфера.
729|02.10.2019 12:03:37|Alexey Vishnyakov|Может лучше легенду Возьмите роделен или пр3
731|02.10.2019 12:07:31|Sergey|Талан, Такси в Тинькове Всем пристегнуть ремни
732|02.10.2019 12:07:56|Harry Lime|Такси да , Талан велик для расшевеливания
733|02.10.2019 12:09:54|Sergey|Такси на подлёте к стратосфере
734|02.10.2019 12:09:58|Alexey Vishnyakov|Такси и до этого был 1,5. Переименование пошло явно на пользу
735|02.10.2019 12:12:57|Reincarnation Man|Здрасьте всем. Сам не ожидал, забрали у меня Такси ао 101.89. Талана кому не жалко еще налейте
736|02.10.2019 12:15:26|Sasha Bolilaya ГК ЛЕГЕНДА|Елена, добрый день Для удобства, прошу прислать Вам имэйл, мы вышлем подробную инструкцию.
737|02.10.2019 12:17:22|Павел|Ещё ламбумиз
738|02.10.2019 12:22:04|Alex|С присоединением Чтобы налили Талана, надо разжечь огонь в сердцах слабых.
739|02.10.2019 12:44:36|Helena Yakh|Спасибо. Информация уже не актуальна. Размещение выше номинала, нет смысла брать по цене выше на данный момент.
740|02.10.2019 12:52:11|Михаил|Легенда сейчас в районе 100,25 болтается. Почему ориентир 100,5 Допразмещения должны же давать небольшую скидку к рынку, разве не так
741|02.10.2019 12:53:46|Sasha Bolilaya ГК ЛЕГЕНДА|Да, размещение выше номинала по пожеланиям институциональных инвесторов, готовых купить больший обьем.
742|02.10.2019 12:56:18|sergei begreater|Инвесторы не хотят платить меньше, но хотят платить больше Ок.
743|02.10.2019 13:00:38|Alexey|В стакане на сотни миллионов по 100.2 не собрать При такой попытке цена станет в стакане далеко не 100.5
744|02.10.2019 13:24:07|Aleksandr|по разному бывает, бывает и с дисконтом берут к рынку
745|02.10.2019 13:47:04|Andrew|Только продажи будут в ближайшее время с убытком.
746|02.10.2019 13:53:06|Andrey Mayorov|Подтверждаю, вчера и сегодня у меня он тоже заявки принимал. До этого тоже частенько его слышал
747|02.10.2019 13:53:16|sergei begreater|Продавец может требовать премию. Но не по просьбе же самих инвесторов
748|02.10.2019 13:57:31|Andrey Mayorov|Интересно, а какой объём МСП заберёт То что останется будет достаточно для снижения до номинала
749|02.10.2019 14:20:47|Andrey Hohrin|Эмитенты Апри АПРИ Флай Плэнинг впереди планеты всей опубликовали отчетность за 9 мес. 2019 года  https//t.me/aprifl/132 . Отчетность, объективно, позитивную. Баланс подрос почти на миллиард, продажи Привилегии идут, прибыль за 3 квартала составила примерно 75 млн рублей. Искренне радуемся за компанию и продолжаем за ней оперативное наблюдение. Подробный разбор отчетности  позднее в канале Aleksandrov_Dmitry
750|02.10.2019 14:31:20|Alec|Дорогие инвесторы Предвосхищая ваши вопросы и дабы предотвратить панику имеем сообщить следующее. Так получилось, что размещение Эбис  и СуперОкс  проходит в одно время. Суммы для рынка ВДО немаленькие, но уже вполне подъемные. Скажем больше, наша песочница официально объявлена Дюной . Итог III квартала  рост рынка ВДО до 17 млрд руб.  О Дюне подробно поговорим 8 октября на новом вебинаре . Обязательно подписываемся. Это бесплатно. А теперь Coming out . Мы рассчитывали, что оба размещения будут проходить в формате Адресные заявки. Режим торгов Z0 и все желающие смогут поставить заявки в течение нескольких дней, поэтому собирали Книги так быстро. У нас не было задачи собрать Книги на 100. Однако спрос на Эбис оказался высоким и Книгу собрали за день. Да, вот такой у нас теперь рынок. Книгу по СОксу собрали на 110 млн руб., что тоже очень хороший результат. В связи с этим сообщаем, что расчеты по Эбису проходят только для тех, кто подал заявку в Книгу, а в СуперОксе еще несколько дней будет доступен для всех желающих в режиме Z0. Скрипт по СуперОксу прилагается. Пост информационный. Не является инвестиционной рекомендацией. Редакция канала не несет ответственности за результаты инвестиций в данные ценные бумаги.
751|02.10.2019 14:32:11|Alec|Ну вот, а мне тут санкциями угрожали, а достаточно было скрипт прочитать и понять, что будут всем наливать
752|02.10.2019 14:35:10|Mikhail Saratov|хоть участвуй в размещениях хоть нет  портфель вдо просел 
753|02.10.2019 14:36:27|Valery Chistyakov|Хм, СуперОкс лишний остался
755|02.10.2019 14:36:41|Максим Кочнев|Да
756|02.10.2019 14:36:55|Valery Chistyakov|Обалдеть
758|02.10.2019 14:38:04|Savel|Никому не нужен суперокс
759|02.10.2019 14:38:23|Mikhail Saratov|ща доберём, по сто грех не взять
760|02.10.2019 14:39:34|Savel|По 100.3
761|02.10.2019 14:40:29|Denis Kozlov Septem|Возобновление приема заявок по СОксу будет после 1645 и до 1729
762|02.10.2019 14:40:42|Savel|Кстати, почему он называется Б1Р1, а не БОП01
763|02.10.2019 14:40:43|Denis Kozlov Septem|Завтра с 1000 до 1729
764|02.10.2019 14:40:49|Mikhail Saratov|без минимального пакета
765|02.10.2019 14:40:57|Denis Kozlov Septem|Не знаю. Эбис тоже Б1Р1 обозвали
768|02.10.2019 14:42:37|Savel|Б  это биржевая, понятно. 1  первая программа А Р Последняя единица  номер выпуска в программе, как понимаю.
771|02.10.2019 14:44:03|Denis Kozlov Septem|Ага, а для Эбиса Р  это рост
773|02.10.2019 14:46:33|Savel|А П  простые, стало быть
774|02.10.2019 14:48:20|Владимир Тутынин|Так Вы нам продайте по 99, а мы уж им потом по 100,5 нальем
775|02.10.2019 14:48:54|Evgeniy Averchenkov|Обувь попала в рекомендации Открытия
777|02.10.2019 14:50:49|Aleksandr|Подождите , еще ВТБ должен добавить вроде
778|02.10.2019 14:52:46|Evgeny P|Сокс как бы налили но както странно и инструмента в облигациях нету и стакана не показывает
779|02.10.2019 14:55:30|Savel|Сокс както прям жутко быстро налили. Даром что сверхпроводники.
780|02.10.2019 14:56:05|Evgeny P|у меня в альфадиректе он криво както висит. без цены и стакана
781|02.10.2019 14:56:35|Savel|Брокеры из банков так себе потому что.
782|02.10.2019 14:57:24|Evgeny P|ага только что и роделен также встал криво, видимо это глюк брокера
783|02.10.2019 14:57:32|Сергей|В Легенде прошла покупка в стакане на 9 млн
784|02.10.2019 14:58:31|Sky|ЧОрт. Сокс никому на деле не нужен, ничего уже под него не льют, Син по номиналу с низким нкд не раздают 
785|02.10.2019 14:59:10|Alexey|Арбитраж продадут крупняку по 100,5
786|02.10.2019 14:59:39|Сергей|Покупали до цены 100.5
787|02.10.2019 15:02:00|Evgeny P|да лан, много чего просело
788|02.10.2019 15:02:28|Sky|Сину ещё хотелось...
789|02.10.2019 15:03:05|Evgeny P|да и так почти до номинала опустили
792|02.10.2019 15:17:26|Aleksei Zzzz|Так надо кипиш в сине организовать, как в талане, и затариться  делов то
793|02.10.2019 15:17:49|Harry Lime|Добрые люди дали пристроить купон по rus 30 по 113,55
794|02.10.2019 15:22:19|Evgeny P|талан неплохо провалили. Но сообщение про займ афиллированному колхозу очко сжало. тамне было больше новостей
795|02.10.2019 15:24:03|Aleksei Zzzz|судя по стакану плохих  нет, да и Андрей своей репутацией рискнул, всех успокоив
796|02.10.2019 15:24:31|Denis Kozlov Septem|Мы так с клиентом любого брокера поступаем.
797|02.10.2019 15:25:22|Aleksandr|Талон уже восстанавливается . Но я вышел с него все равно от греха подальше .Пусть растет без меня
798|02.10.2019 15:27:23|Aleksei Zzzz|Ну как таким пугливым в ВДО быть Там ведь два бида неплохих выше номинала стояло
799|02.10.2019 15:29:03|Aleksandr|ну и  Я и вышел выше 100.5 . Есть куда преложиться и не думать о колхозе
800|02.10.2019 15:29:33|Aleksei Zzzz|гуру ведь говорили, пока цена выше 97  подгузники не портим
801|02.10.2019 15:31:37|Aleksandr|гуры сами свинтили с Талона
804|02.10.2019 15:36:29|Шура SiberianRanger|К У П О Н О М
805|02.10.2019 15:37:14|Aleksandr|Да мне этот купон с его разницей после вычета всех налогов вообще не кажется таким уж фактором в пользу нервов
806|02.10.2019 15:38:25|Dimasik|Это для домохозяек аргумент
807|02.10.2019 15:38:32|Aleksandr|Купить недоцененную историю это одно , а купить ушедшего в себя эмитента с непонятными движениями  это другое
809|02.10.2019 15:41:22|Alex|Ну я бы выводы не торопился делать насчёт  ушел в себя
810|02.10.2019 15:42:54|Aleksandr|Да дай Бог , чтоб все у них хорошо было .Ибо если чо это на всем секторе ВДО отразится . Еще и чатлане потеряют.Всего наилучшего этому Талану . Мое мнение что биды там искусственные , это не спрос с улицы.
811|02.10.2019 15:45:45|Dmitry Kravchenko|Коллеги, для подачи заявки на Легенду надо ее оформить на бумаге, отправить в Бкс скан и обязательно по почте оригинал на бумаге. За пару десятков размещений Вдо с таким сталкиваюсь впервые. Может лучше в стакане взять 
812|02.10.2019 15:46:53|Максим Кочнев|В стакане она еще и дешевле
813|02.10.2019 15:47:03|Aleksandr|я просрочкой не разбавляю качественные продукты  Диверсифицируюсь только в рамках допустимого качества Для меня лично
815|02.10.2019 15:47:57|Максим Кочнев|Диверсификация бывает и излишней и тогла уже вредной
816|02.10.2019 15:51:55|DIM|Сокс то не разместился весь видать не верят в него инвесторы
817|02.10.2019 15:52:18|Андрей|Движений в Талане много. Но нас интересует именно ТаланФинанс. А там перекладывают из кармана в карман. Судя по всему, набирают финансы на ТаланУфа.
818|02.10.2019 16:01:52|Сергей Т|А книгу по нему раньше закрыли, чем по эбис
819|02.10.2019 16:03:01|Alex|Откуда такая информация Да и консолидированной отчётности нет, как понять что там происходит хз
820|02.10.2019 16:18:02|Alexey Vishnyakov|Я возму ещё, как заявки принимать начнут.
821|02.10.2019 16:19:10|Андрей|По раскрытию посмотрел, Созидание выдала займ 700млн, а.. нет.. не Уфе, Набережным Челнам. Запомнилось, что тоже Уфе. Извиняюсь
822|02.10.2019 16:20:39|Evgeny P|вы думаете Сокс дадут добрать вне заявки
823|02.10.2019 16:20:53|Xnk|В данный момент в Набережных Челнах они строят два ЖК. Один поменьше другой побольше
824|02.10.2019 16:22:26|Андрей|Да сомнений, что они строят, нет никаких. Как при этом будет платить именно ТаланФинанс, вот вопрос.
825|02.10.2019 16:24:30|Konstantin|Было объявление от организаторов, что будут раздавать всем кто желает.
826|02.10.2019 16:25:43|Alexey Vishnyakov|Ну так Денис написал же, что разместили 110 миллионов. Остальные может взять кто захочет. Сегодня с 16.45 и завтра с 10 утра.
827|02.10.2019 16:30:58|Alex|А там оферта и поручительства от кого
828|02.10.2019 16:34:14|Evgeny P|спасибо
830|02.10.2019 16:53:10|Sergey|По Обуви комуто удовлетворили сегодня заявке на первичке
831|02.10.2019 16:53:42|Aleksandr|да
833|02.10.2019 16:55:55|Sergey|Мою заявку не удовлетворили
834|02.10.2019 16:56:09|Alexey Vishnyakov|Добавку СуперОкса уже налили. Как только я подал заявку
835|02.10.2019 16:57:33|Aleksandr|отклонили или висит в системе
836|02.10.2019 16:57:54|Sergey|Висит неисполнена
837|02.10.2019 16:58:39|Aleksandr|написал эмитенту . Пнут БКСа . Незнаю уже что БКС мутит какой день
838|02.10.2019 16:59:23|Sergey|Напишу по результатам
839|02.10.2019 17:11:15|Kirill Streblyanskiy|Во сколько подавали заявку
840|02.10.2019 17:12:00|Sergey|Ответил в личку
841|02.10.2019 17:12:30|Alexey Vishnyakov|С инновации по номинал раздают
842|02.10.2019 17:13:12|Harry Lime|Ожидаемо
843|02.10.2019 17:18:57|Шура SiberianRanger|100,08 мин. цена это таки почти по номиналу, а не по номиналу
844|02.10.2019 17:32:29|Замполит Aleks Kib|Это я продал по 100.08, в СОкс доложился
845|02.10.2019 17:34:34|Aleksandr|Не пойму . То ли софтлайн вверх погнали опять
846|02.10.2019 17:35:20|Harry Lime|Встал с колен
848|02.10.2019 17:36:06|Sky|Почти  понятие растяжимое 
849|02.10.2019 17:36:10|Максим Кочнев|Я не продаю СИн
852|02.10.2019 17:36:44|Sky|Ыщо есть 
853|02.10.2019 17:38:10|Замполит Aleks Kib|СИн остался, только чуть уменьшил его, раз ещё остался СОкс на размещении Z0  то докупил его к ранее купленной по заявке позиции
854|02.10.2019 17:38:58|Шура SiberianRanger|Там ктото купил от души, и верхнюю плитку поставили повыше после этого наверное
855|02.10.2019 17:41:59|Sky|Продай Талан  купи Софт. Мутность там и там, но в Софте Доха выше 
856|02.10.2019 17:57:19|Denis Kozlov Septem|Молодой человек, держите себя в руках. Сегодня СОкса размещено на 124 млн руб. Это один из лучших результатов для первого дня размещения. Про стартап вы явно погорячились. Почитайте про компанию внимательнее. Срок  3 года. Есть дюрация длиннее
857|02.10.2019 17:58:45|Alex S| да там ключевое слово видимо было апсайда люди от облигаций ждут гэпов какие нефть вон там рисует, ппц
858|02.10.2019 17:59:21|Максим Кочнев|если сразу нет 102  скам
859|02.10.2019 18:01:54|G M|Согласен
860|02.10.2019 18:22:53|Aleksandr|Какое то новое слово в размещении Обувь .На вторичке конские обороты , а на первичке БКС не видит заявок чатлан . И все ни в чем не виноваты как говорил Жванецкий.
861|02.10.2019 18:23:19|Alex|Встаёт с колен. Можно перестать смотреть
862|02.10.2019 18:26:01|DIM|В смысле раньше закрыли Все по срокам было чётко помоему, септем в плане договорённостей только радует
863|02.10.2019 18:49:07|VV|ВДО Роделен1Р2 первыйденьторгов
864|02.10.2019 18:49:24|DIM|Сегодня таксовик бьёт все лимиты по ростунаконец пошёл нормально вверх, ждём как грузовик 104
865|02.10.2019 18:51:25|Шура SiberianRanger|Чот не помогло кажись 
866|02.10.2019 18:52:02|Aleksandr|непомогло , да . Дождемся комментария эмитента .Я слышал что там идет разбор ситуации
868|02.10.2019 18:58:44|Roman|думаете БКС сам на вторичке льет, не давая на РПС
869|02.10.2019 19:00:17|Aleksandr|Думаю что льет , да , а про вторичку нужно дождаться разбора полетов . Вроде какие то технические проблемы у него.И ничего что эмитент нервно курит в недоумении четыре дня
871|02.10.2019 19:03:06|Roman|Цирк, конечно. Обувь  серьезный эмитент, приличные объемы. Неудивительно, что БКС оказался на задворках рынка. С таким подходом к размещению непонятно кто дальше будет с ними работать.
872|02.10.2019 19:04:00|Sergey|Мне тоже так и не налили
873|02.10.2019 19:07:16|Шура SiberianRanger|СуперОкс 272 сделки 3 крупнейших 28 500 000  21 500 000  18 180 000  от 1000 до 2500 бумаг 8 сделок на сумму 11 860 000 , средняя 1 482 500  от 499 до 951 бумаг 22 сделки на сумму 13 721 000 , средняя 623 682  от 247 до 470 бумаг 37 сделок на сумму 12 244 000 , средняя 330 919  от 2 до 232 бумаг 202 сделки на сумму 17 476 000 , средняя 86 515 
874|02.10.2019 19:22:20|Ilya|Нижний сегмент от 2х бумаг занял 4 место
875|02.10.2019 19:26:24|Шура SiberianRanger|Да, потому что мне лень было раздробить и я просто сделал категории от слона, от полслона, от четвертислона, иные 
876|02.10.2019 19:32:23|Ilya|Надо подкрутить  третье будет
877|02.10.2019 19:39:06|Андрей|По Талану поручительство от Созидание
879|02.10.2019 20:01:46|Сергей Бацаца|Оставлял два дня подряд заявки на покупку Обуви с первички, оба раза не налили, плюнул взял по 100.05. Странная организация размещения.
880|02.10.2019 20:23:17|Konstantin|Сегодня взял со стакана по 100
881|02.10.2019 20:30:34|Евгений Коломна|А сколько Ультры на первичку дадут 20 опять
883|02.10.2019 20:37:38|Alex|Таришь ли эмитента, про которого ничего не знаешь
884|02.10.2019 20:40:17|Сергей Ковалев|если в  то я пойму, но не штуках же
885|02.10.2019 20:41:54|Евгений Коломна|Да какие штуки и проценты, тут главное успеть заявку подать за 10 сек
886|02.10.2019 20:43:51|Шура SiberianRanger|Я надеваю свой волшебный плащ и волшебную шляпу и достаю заявкомёт... 
