|time|user|text
702|22.07.2019 15:02:06|Aleksandr|С 1100 мск 24 июля до 1500 мск 26 июля ЖКХ Республики Саха Якутия проведет букбилдинг по облигациям серии БО01, сообщается в материалах организатора. Номинальный объем выпуска  3 млрд рублей. Номинальная стоимость одной бумаги  1 000 рублей. Цена размещения  100 от номинала. Срок обращения  7 лет. Предусмотрена оферта через 3 года с даты размещения. Купонный период  91 день. Ориентир по ставке купона  12.512.75 годовых, что соответствует эффективной доходности уровне 13.113.37 годовых. Предварительная дата размещения  6 августа.
703|22.07.2019 15:04:36|Алексей RM|хм... а как вариант купить на первичке и потом со стакана раздавать типа надёжный эмитент и должен вырасти в цене... вот только как в эту книгу попасть и стоит ли всётаки долгов там ойойой
704|22.07.2019 15:07:55|A G msk|Поясните, почему эффективная доходность выше купонной, если размещаются по 100 номиналу
705|22.07.2019 15:08:17|Максим Кочнев|Ну а как иначе Это же реинвест
706|22.07.2019 15:08:26|Aleksandr|потому что считается что купон будет реинвестирован
707|22.07.2019 15:08:46|A G msk|Спасибо
709|22.07.2019 15:12:55|Bugsy|Втб, автоваз
710|22.07.2019 15:16:50|Михаил|Это 2й
711|22.07.2019 15:21:12|Alex Petroff|
713|22.07.2019 15:21:18|r.alex|У ВТБ был дефолт
714|22.07.2019 15:26:34|DIM|Агонь
715|22.07.2019 15:29:32|Alexi|В 2008 был громкий случай с московским ипотечным агентством оао на 100 принадлежащая московской области. После дефолта по облигациям вроде бы даже рейтинг региона понизили от SampP. На русбондсе пишут, что организация ликвидирована, облигации списаны
716|22.07.2019 15:45:33|А что ты сделал для котэ!?|По Мсфо все выглядит не так стремно
717|22.07.2019 15:45:33|А что ты сделал для котэ!?|МСФО за 2018г. Много интересного. В компании много долгов 25 млрд.. Особенно краткосрочных кредитов 13 млрд.. Ставки по кредитам от 2 до 17. за 2018год процентов накапало  на 1,9 млрд руб. Много гос субсидий как и у республики Саха почти на 3 млрд. руб. Выручка 22 млрд. Валюта баланса 37,5 млрд. EBITDA 7 млрд. gt риски есть, но премия к бумагам рейтингом BBB высокая
718|22.07.2019 15:50:35|Григорий Мошорин|Вопрос только есть тут представители чтобы в книгу записаться 
719|22.07.2019 15:51:25|Aleksandr|запишитесь через своего брокера
721|22.07.2019 15:52:26|Alexey|Дайте совет плз. Первый раз через свой счет в сбере буду на первичку подаваться  Как это у сбера делается
722|22.07.2019 15:53:01|Григорий Мошорин|Да это я уже понял
723|22.07.2019 15:53:02|Aleksandr|уточните для начала , будет ли Сбер их принимать.
724|22.07.2019 15:53:36|Alexey|Какой канал связи у сбера самый оперативный
725|22.07.2019 15:54:05|Aleksandr|Сбербанк 1 и Сбер Private
726|22.07.2019 15:55:19|Alexey|
727|22.07.2019 16:02:21|Alex Petroff|1. Посмотрите сайт Сбера и найдите там телефоны. 2. Если не работает вариант по п.1, то сходите туда ногами. 3. Если вас там не понимают, то идите в чат Друзя druz_svid и расскажите там о ваших приключениях и проблемах коммутации с брокером. 4. Первые два варианта не рабочие, равно как спрашивать эту информацию в чате. 5. Механизм участия в первичке эмитентов ВДО расписан в факе, faq_angrybonds , вопрос 14 на самом деле 12. Купить облиги субфеда можно на стадии книги, путем подачи соответствующей заявки своему брокеру с оплатой участия в книге и акцептуацией на счете от 1.4кк руб. В общем...идите вы в Сбер
728|22.07.2019 16:03:17|Alexey|Спс. Я думал возможно у кого то под рукой телефон их деска есть
729|22.07.2019 16:06:45|Aleksandr|минимальная заявка в данной книге 1,4 млн будет
730|22.07.2019 16:07:12|Alex Petroff|Точно
732|22.07.2019 17:22:06|Sky|Орг не принимает заявок в книгу напрямую я понимаю, что софтзаявок нет
733|22.07.2019 17:24:53|Alex Petroff|Вы блин соизмеряйте размер нашей песочницы и размер выпуска в 3 млрд.руб. Хотя...вы напрямую оргам позвоните и все сразу узнаете.
734|22.07.2019 17:25:45|Sky|Позвоню. Но вдруг кто уже позвонил.
737|22.07.2019 17:34:53|Максим Кочнев|Куда интереснее вот так
739|22.07.2019 17:37:45|Sheld|Это чье приложениеброкер
740|22.07.2019 17:38:19|Alex Petroff|Мобильное приложение Мои инвестиции от ВТБ.
741|22.07.2019 17:38:43|Sheld|Спасибо
742|22.07.2019 17:44:25|Dmitry Manzor|Думаете сейчас не делают
743|22.07.2019 17:47:36|Alexey Z|Нам срочно в чат нужен инсайдер из Тинькова, чтобы тоже закупаться вовремя... 
744|22.07.2019 17:50:48|Alex Petroff|Представитель Тинька был в чате. Полемизировали на тему о включении всех бумаг из категории ВДО в листинг. Но к консенсусу не пришли.
745|22.07.2019 17:52:17|Lizardking0808|Сегодня закончил выходить из кармани2 в пользу онлмкф. В итоге смотрю 90 от продажи в онлмкф, 10 оказалось в пионер лиз2. Цена одинакова, стаканы перепутал решил, пусть будет пионер2 у меня ушёл ранее в син
746|22.07.2019 18:02:34|Andrey Hohrin|Нет еще, осталось около 130 млн.р. из 300.
749|22.07.2019 18:18:52|Елена Филякина|Надо достопочтенного сэра попросить он же планировал наладить связь с инопланетянами Тинькофф а можно в чате голосовалку запилить. Тут наверняка много у кого Тинькофф брокер. Будут нам отсталым ВТБшникам и БКСникам инсайд сливать.
750|22.07.2019 18:20:33|Vitaliy Klimenko|Недавно там азбука вкуса городской супермаркет появилась и тоже рост начался
753|22.07.2019 19:23:56|Mozg Company|где можно смотреть оперативно предстоящие размещения по ВДО
754|22.07.2019 19:25:54|Alex Petroff|https//www.rusbonds.ru в разделе ближайшие размещения на главной странице. Либо просто читать чат.
755|22.07.2019 19:27:19|Константин Цехмистренко|Отличная идея Нужно ее всем эмитентам предложить. Пусть делятся своей продукцией
756|22.07.2019 19:27:59|Pavel Bilenko|Я бы тогда Мясничего прикупил 
757|22.07.2019 19:28:29|Константин Цехмистренко|
758|22.07.2019 19:29:30|Mozg Company|спасибо.
759|22.07.2019 19:33:09|Владимир Тутынин|интерфакс пишет  На прошлой неделе ЮТэйр сообщила, что сумела договориться о реструктуризации двух облигационных займов на 13,3 млрд руб.... Сумела
761|22.07.2019 19:36:07|dimakarp1996|У меня вопрос
762|22.07.2019 19:36:14|dimakarp1996|Про старика Хохрина из сферы, не связанной с ВДО, мне до сегодняшнего дня было известно, что он шортил Сбербанк. А тут ставки повышаются  теперь он кошмарит Китай . И знаете  это правильно. Я бы только высказался определеннее китайцы просто рисуют ВВП, точно также как Росстат, но более бесстыдно. И кстати это лучше срабатывает они просто никому не говорят как считали, посылают всех любопытных. Есть вот рост 6 и всё. Как получили  не ваше дело. Между тем, обычный здравый смысл подсказывает, что если все покупатели китайской продукции растут 02 в год, то жёстко экспорториентированной экономике невозможно расти ежегодно на 68 в течении 10 лет. Фуфло это. И реально там рост так и был 234 , а остальное  рисование и художественный свист. Но когда ты пишешь для Вестифинанс, конечно приходится соблюдать политес.
763|22.07.2019 19:36:48|dimakarp1996|Если статистика реально подделывалась много лет, то отставание реальных показателей от нарисованных должно стать огого каким
765|22.07.2019 19:37:54|Alexander Balezin|https//bonds.finam.ru/news/item/nrdprovelspisanieobligaciiymosoblgazaserii01/
766|22.07.2019 19:39:09|Alex Petroff|И Что дальше В чем взаимосвязь с тематикой чата
767|22.07.2019 19:39:36|dimakarp1996|Ну есть взаимосвязь с постом в канале.
768|22.07.2019 19:39:55|Владимир Тутынин|А как Китай можно шортить, если он может всегда нарисовать себе рост
769|22.07.2019 19:40:40|Alex Petroff|Сюда шагайте это все обсуждать druz_svid . Китай, крипта и т.д., в том чате онли профи уровня квала.
770|22.07.2019 19:40:57|dimakarp1996|Ок
771|22.07.2019 19:40:57|Alexander Balezin|МОИТК Админы ссылки трут
772|22.07.2019 19:41:24|Alex Petroff|О чем была ваша ссылка. Своими словами донесите мысль.
773|22.07.2019 19:43:17|Ilya|Ну значит ошибаюсь, вы никаких разъяснений и приветствий не делали, название ввело меня в заблуждение, не обессудьте.
775|22.07.2019 20:07:33|Lizardking0808|Что добавили
781|22.07.2019 20:40:26|Denis Kozlov Septem|Коллеги, слушаю семинар Олег usertrader Харитонов на opentrainer. 214 слушателей. Отличный результат. Предлагаю объявить благодарность за очередной шаг в распространении информации о ВДО 
782|22.07.2019 20:44:50|Павел Мартынов|Про матвыгоду Открытия совсем невнятно было сказано
783|22.07.2019 20:45:17|Denis Kozlov Septem|Спорный вопрос. Тут много копий было сломано.
784|22.07.2019 20:47:36|Павел Мартынов|Около 200 участников в вебинаре
786|22.07.2019 21:09:37|Evgeniy Averchenkov|Я надеюсь, позже выдержат запись
789|22.07.2019 21:12:18|Evgeniy Averchenkov|Вообще, на разных сайтах начинаю встречать упоминания ВДО. Видимо, тренд пошел, скоро народ новый появится. Цены на вторичке вырастут 
790|22.07.2019 21:13:05|Григорий Мошорин|Маловато только размещений предстоит
791|22.07.2019 21:27:32|Denis Kozlov Septem|Не гонитесь за размещениями, нахватаете хлам. Организаторы каждого эмитента внимательно тестируют. Я могу делать по два новых эмитента каждый месяц. Оно вам надо
792|22.07.2019 21:29:04|Максим Кочнев|конечно надо, только чур без дефолтов
793|22.07.2019 21:29:54|Alex Petroff|И это правильная точка зрения
794|22.07.2019 21:31:33|Kharitonov Oleg|она есть  сам долго вникал в суть но она существует . Сам был в шоке . Не знаю для чего правда ее сдлеали что за цимус получило государство. ЦБ от КИКов еще понятно, но вот зачем мат.выгоду приплели хз. Вообще по жизни была история с НДФЛ по опционам  тогда старой команде от РТС удалось все это развернуть в обратку  но там было сильное движение  на сайте РТС на форуме это была самая читаемая тема. Тогда был явный косяк который нашел Атон. А десь вроде все верно, но криво.
795|22.07.2019 22:07:27|Ilya|Денис, не забирайте веру у верующих
796|22.07.2019 22:21:19|Григорий Мошорин|Не надо 
797|22.07.2019 22:27:53|Scorpio76Spb|Всем добрый вечер А кто что думает по поводу облигаций ЖКХ Республики Соха Обещают 12,7512,5 ориентир купона. Чем не ВДО 
798|22.07.2019 22:29:58|Alexey Vishnyakov|Качество как у вдо, только купон меньше 
799|22.07.2019 22:32:12|Scorpio76Spb|Я чтото не помню дефлотов субфедов последнее время. Да и рейтинг ruBBB от Эксперт РА имеется. Так что, по поводу качества не совсем согласен.
800|22.07.2019 22:33:28|Максим Кочнев|Заказал вывод средств. Решил посмотреть налог. Налогооблагаемый доход 5 от депо. Налог 0.75 от депо. И это если учитывать что в 2019 у меня только 2 сделки не ВДО были. Мосбиржа и втб, которые принесли 1.3 от депо. Считай ВДО за полгода 2019 принесло только на спекуляции купил продал 3.7 от депо считай плюс 7.4 годовых и это плюс к купону. Вот что ВДО творит. Слижком хорошо, что немного пугает
802|22.07.2019 22:34:14|Alexey Vishnyakov|Так это и не субфед. Это жкх субфеда, что не одно и то же.
803|22.07.2019 22:35:59|Scorpio76Spb|Согласен, полное название ГУП ЖКХ РСЯ
804|22.07.2019 22:36:30|А что ты сделал для котэ!?|Можно изложить проще Это дотационная дочка дотационного субфеда 
805|22.07.2019 22:40:04|Максим Кочнев|Давно известно. В главном офисе стоит барабан как в Поле чудес. Там на каждом секторе имя эмитента. Переодически, как у Якубовича появляется свободное время он приезжает к ним и они крутят барабан. А там на что барабан укажет
806|22.07.2019 22:41:24|Vitaliy Klimenko|Обычно в тиньке появляются новые облигации после выходных, после обновлений. Как они сообщают, что если будут запросы на какуюто облигацию то её быстро добавляют  скорее всего какойто фильтр, что б слишком рискованные не добавлять, чтоб у домохозяек охоту не отбить
807|22.07.2019 22:43:47|Максим Кочнев|Нет там фильтров, суборды доказали
808|22.07.2019 22:45:53|Alexey Vishnyakov|Одно кармани чего стоит.
809|22.07.2019 22:46:11|Vitaliy Klimenko|Причём после появления они не сразу растут, и не все например мясничий 3 выпуск не рос около месяца, в сейчас немного пошёл, легенда тоже не растет
810|22.07.2019 22:46:54|Максим Кочнев|Ну дак тинек тоже не супермен. Всё от ликвидности зависит
811|22.07.2019 22:47:56|Alexey Vishnyakov|На самом деле я бы может быть и взял её по номиналу в спекулятивных целях, в надежде на фонды и рост цены, но минималка на 1,4 миллиона  это слишком много
812|22.07.2019 22:48:22|Vitaliy Klimenko|Один парень на смартлаб писал, что расстроился что не нашёл любимую облигацию евроторга у тинькофф брокера и буквально через несколько дней её добавили
813|22.07.2019 22:49:12|Alexey Vishnyakov|Пр лизинг тоже, вроде, попал с тинек, но, видимо, домохозяек не привлекают жалкие 12,5.
814|22.07.2019 22:50:08|Максим Кочнев|В кармани не было ликвидности никогда до тинька. Ну и купон конечно творит чудеса
815|22.07.2019 22:50:57|Vitaliy Klimenko|Я домохозяйка, как появился кармани 2, он дней 5 не рос где то
816|22.07.2019 22:51:36|Максим Кочнев|Ибо его же сначала увидеть ещё надо в приложении
817|22.07.2019 22:52:03|Vitaliy Klimenko|Не, домохозяйки изучали эмитента
818|22.07.2019 22:57:22|Kir|Кармани2, взял на свободные деньги в день попадания в тинек еще по обычной цене
819|22.07.2019 23:00:21|Максим Кочнев|Я ваще брал в свое время по 99.299.3
821|22.07.2019 23:00:59|Vitaliy Klimenko|Ещё подержать немного и можно слить
822|22.07.2019 23:01:35|Максим Кочнев|Ну груз с купоном 15 по 105 легко идёт. Кармани есть куда рости ещн
823|22.07.2019 23:01:40|Kir|Так под рост от тинька и брал. Так то у них оферта и были риски, теперь думаю спокойно пройдут
824|22.07.2019 23:01:52|Максим Кочнев|Но по 103 можно начинать думать
826|22.07.2019 23:03:06|Григорий Мошорин|Легенда у них давно были
827|22.07.2019 23:04:00|Vitaliy Klimenko|Да, и не растёт наверное потому что эмитент не на слуху
828|22.07.2019 23:05:28|Григорий Мошорин|По мне он вырос,я его брал по 98
830|22.07.2019 23:06:51|А что ты сделал для котэ!?|Откуда инфа проттакую мирималку
831|22.07.2019 23:07:03|Максим Кочнев|Наличие представителя в чате и его общитнльность создали определённую веру в них
832|22.07.2019 23:08:04|Denis Kozlov Septem|Вот тут в Экселе все выпуски по эмитентам и организаторам https//t.me/russianjunkbonds/480 Просто отсортируйте, как удобно
834|22.07.2019 23:19:52|Максим Кочнев|Не надо передергивать.
838|23.07.2019 00:13:52|Максим Кочнев|99.2.
841|23.07.2019 07:35:49|Alexey Vishnyakov|И тут где то писали, и в пробондсе.
842|23.07.2019 08:04:45|Alec|Это не субфед. Муниципальные ЖКХ очень часто банкротят и меняют вывеску
843|23.07.2019 08:22:59|Maksim|Спросим так, с чем можно сравнить Маловат наш рынок для сравнений  с какимнибудь грузовиком то и кармани я бы не стал
845|23.07.2019 08:29:27|Alec|Мое мнение  для такого риска купон мал, эмитента не анализировал, но вверху уже ктото писал, что выручка за год двухкратно меньше займа. В моем городе дважды за 15 лет банкротили единственную компанию ЖКХ, меняли вывеску, к примеру на ЖКО, а лица всё те же.
846|23.07.2019 08:43:30|Harry Lime|А здесь даже банкротить не надо ОСВО и все дела
852|23.07.2019 08:57:11|Alex S| это будет слишком просто для тех, кто таки планирует чисто спекулировать
853|23.07.2019 09:01:46|Soa|Ради текущей дохи
854|23.07.2019 09:06:11|Harry Lime|Лучше Кармани
856|23.07.2019 09:09:40|Aleksandr|А с нами
857|23.07.2019 09:12:13|Alexey Vishnyakov|Вот я думаю о том же, продавая грузовик по 103... Кто эти люди, кто у меня его покупает Неужели на 106  108 надеются
858|23.07.2019 09:12:19|Harry Lime|Куда ж я денусь , но онлайн не могу обещать , скорее порционно.
860|23.07.2019 09:13:52|Alexey Z|они смотрят на доху, а не на то, чтобы спекульнуть и продать по 106108. Их доха устраивает. Все, больше им ничего не нужно
861|23.07.2019 09:15:32|Alexey Vishnyakov|Да, но кисточки или трансмиссия стоят по 100,2  100,5, доходность выше, а качество эмитента точно такое же  может стоит их купить
862|23.07.2019 09:16:05|Alexey Z|а они разве уже в тиньке
863|23.07.2019 09:16:32|Alexey Vishnyakov|Так третий грузовик тоже не в тиньке. Только 1 и 2
864|23.07.2019 09:16:47|Evgeniy Averchenkov|Почему ОСВО не надо
865|23.07.2019 09:17:37|Максим Кочнев|Банкротить не надо, а не осво
866|23.07.2019 09:17:44|Alexey Z|ну грузовик чисто по инерции, я считаю, вслед за 1 и 2. А вот кисти и такси нужно в тинек для существенного роста цены.
867|23.07.2019 09:19:06|Максим Кочнев|Грузовик самый известный. Эксперимент в чате акций доказал. Просто челу который по сути 0 в облигациях скинул нашу табличку. Выбирая кого бы 1 он купил. Он выбрал грузовик
868|23.07.2019 09:41:40|Alexey Z|нету никакой тяги, рассуждения вслух о том, почему люди покупают даже сильно подорожавшие облигации и что должно произойти, чтобы они подорожали 
