|time|user|text
161|01.06.2019 11:17:57|Harry Lime|Если так  это отличный повод оттуда свалить
162|01.06.2019 11:19:09|Александр Кучеренко|Это да, но наврятли с 1 лота, так получится 
164|01.06.2019 11:20:38|Harry Lime|Получается кто берет сплитованные евробонды не получит переоценки , а классический на 200к туда уже и не влазит целиком.
165|01.06.2019 11:21:40|Aleksandr|Подскалите пожалуйста, правильно ли понимаю, чтобы квал инвестором стать достаточно просто принести заверенную трудовую книжку с опытом 3года брокеру и все Или есть подводные камни по этому пути
166|01.06.2019 11:21:44|Harry Lime|Если надо надежно в тот же Сэттл.
167|01.06.2019 11:22:18|Александр Кучеренко|Да 11, лучше чем 9,6 ПИКа
168|01.06.2019 11:22:31|Harry Lime|С опытом работы где
169|01.06.2019 11:22:59|Aleksandr|Рыночные риски в банке
170|01.06.2019 11:23:05|Pavel|Скачайте регламент признания КВАЛ вашего конкретного брокера, там все написано
171|01.06.2019 11:23:20|Harry Lime|Попробуйте , мож и прокатит
172|01.06.2019 11:23:58|Aleksandr|Регламент почитал уже, вроде как должно подойти
173|01.06.2019 11:24:14|Pavel|Тогда несите
174|01.06.2019 11:24:27|Aleksandr|Спасибо Надо будет заняться на досуге
175|01.06.2019 11:24:27|Harry Lime|Реально квалов по образованию  не учитывая ФСФР я не встречал, но это не значит , что это невозможно
176|01.06.2019 11:27:07|Замполит Aleks Kib|Прямо ВДОшная классика КО.. Любите ли вы КО так, как я люблю их, то есть всеми силами души вашей, со всем энтузиазмом, со всем исступлением, к которому только способна пылкая молодость, жадная и страстная до впечатлений.. 
177|01.06.2019 11:38:13|Harry Lime|По идее брокеру выгоднее , чтобы у него было больше квалов.
178|01.06.2019 11:45:15|Aleksandr|Не знаю на счёт выгоднее, но позвонил брокеру, сказали трудовой достаточно. Както не верится что на столько все просто будет. Вот и проверю видимо.
179|01.06.2019 11:46:14|Harry Lime|А брокер формально подходит  соответствует , ништяк
180|01.06.2019 11:47:15|Denis Ipatov|Услуга присвоения Квала платная Или от брокера зависит
181|01.06.2019 11:48:29|Harry Lime|Бесплатная , если ктото берет деньги надо ославить их здесь , чтобы не повадно было
182|01.06.2019 11:50:30|Алексей Чернушевич|Леш, спасибо 
183|01.06.2019 11:59:45|Андрей|Какие молодцы Круто было бы на фото подписать кто есть кто..
184|01.06.2019 12:00:21|Алексей Чернушевич|Друг..
186|01.06.2019 12:07:53|Denis Ipatov|КОМИССИЯ ЗА ПРИЗНАНИЕ КЛИЕНТА КВАЛИФИЦИРОВАННЫМ ИНВЕСТОРОМ  5 000 руб. Это на тарифе ПСБлайт. Что на ПСБдень  пока не вижу. Видимо нужно уточнять у маринок.
188|01.06.2019 12:16:24|Harry Lime|На стену позора
189|01.06.2019 12:20:42|Denis Ipatov|У них изза санкций всё раво не сильно широкий набор инструментов.
191|01.06.2019 12:27:37|Елена Филякина|Из выступления главное не новость, а реакция других трейдеров на неё. Новость вышла плохая, а цена растёт, как так Просто все ждали ещё хуже новостей, а оказалось не страшно  цена вверх. 
193|01.06.2019 12:28:27|Елена Филякина|Берем 20 тысяч рублей, ловим 12 волн на которых всякий раз удваиваем капитал, все  у нас 1,2 миллиона баксов. Весь секрет успеха. Я на калькуляторе проверила
194|01.06.2019 12:28:44|Alex Petroff|Это про что Кто это говорит
195|01.06.2019 12:28:54|Oleg Egorov|Александр Резвяков, профессиональный трейдер.  обрезайте убытки, давайте прибыли течь...
196|01.06.2019 12:29:28|Alex Petroff|Спросите, что он курит
197|01.06.2019 12:29:33|Елена Филякина|Это Резвяков про рост капитала
198|01.06.2019 12:30:39|Dmitry Manzor|
199|01.06.2019 12:30:45|Евгений Инвестор|Грааль. Надо было съездить на конфу
200|01.06.2019 12:31:31|MUSTACHAN|Он так уже сделал
203|01.06.2019 12:33:48|Шура SiberianRanger|
205|01.06.2019 12:34:09|MUSTACHAN|Интересно получается, у кого не спрошу, одни миллиардеры кругом.
206|01.06.2019 12:35:07|Елена Филякина|Ничего не говорите а ботинки у всех в среднем ценовом сегменте 
207|01.06.2019 12:36:17|Шура SiberianRanger|помните этого трейдера  заработал 150к, потом проиграл, потом вернул, потом взял в долг 100к баксов и за пару дней в ноль на фьючерсах на CME. а до этого 3 года торговал аккуратно, но,каждый день, изучая все, готовясь,к сделкам итд итп https//lenta.ru/news/2017/09/30/igral/
208|01.06.2019 12:36:59|MUSTACHAN|Да это 1million помоему
210|01.06.2019 12:37:42|Елена Филякина|Борис Блохин тоже ми хвалится, какието космические цифры прироста своего капитала назвал. Ща ближе посмотрю, мож там ниб уже светит
211|01.06.2019 12:37:48|А что ты сделал для котэ!?|
212|01.06.2019 12:37:56|DIM|Спасибо Вам, приятно было познакомиться, процветания вашей компании, ваш инвестор
213|01.06.2019 12:38:40|Алексей Чернушевич|Тот, кто может, делает. Кто не можетучит.
214|01.06.2019 12:39:08|Alexander Peshkov CEO TEHNOLEASING|DIM Спасибо
215|01.06.2019 12:40:25|Елена Филякина|А самый хитрый возглавляет все это безобразие.
216|01.06.2019 12:40:25|Шура SiberianRanger|Учить норм допдоход, тут упоминалась некая Ольга, Источник Домохозяек
217|01.06.2019 12:42:05|Шура SiberianRanger|Цена от 7,5 до 25к за набор видеороликов и личный чат с Ольгой.
218|01.06.2019 12:42:05|Шура SiberianRanger 20.05.2019 21:55:14|1000 человек по 7.5k это 7.5kk, а чего добился ты D
220|01.06.2019 12:42:49|Елена Филякина|Покупай продукт, который понимаешь
222|01.06.2019 12:43:39|Алексей Чернушевич|Не. Хозяин трактира. 
223|01.06.2019 12:43:43|Елена Филякина|Опытные в бар пошли, ну самые понимающие
224|01.06.2019 12:44:09|Шура SiberianRanger|Знают какое место главное в театре 
225|01.06.2019 12:47:52|DIM|А ну да, говорить то так все могут, резкий рост и все такое, сделать это не так просто, и потом наверное можно, но риски какие, это как я на форекс с 1 тысячи баксов поднялся меньше чем за 1 неделю до 4х,перекресился и вышел и больше туда не заходил тк понял что это за форекс и какие на самом деле шансы все потерять за 13 дня
229|01.06.2019 12:50:53|DIM|Называется с головой дружить всегда надо, жесть конечно, ещё и дочь грохнуть, ладно бы сам ушёл
231|01.06.2019 12:51:19|Шура SiberianRanger| Всё правильно сделал, считай в лотерею выиграл 
232|01.06.2019 12:52:14|DIM|Спасибо, взаимно
235|01.06.2019 12:55:22|Шура SiberianRanger|Да, в таких историях всегда жалко когда страдают невинные люди. Мне кажется ключевое здесь то, что он взял денег в долг и их слил. // к недавнему обсуждению стоит ли инвестировать в кредит
236|01.06.2019 12:57:43|Елена Филякина|Сейчас видос на эту тему.
238|01.06.2019 13:04:26|DIM|100
242|01.06.2019 13:07:57|Елена Филякина|Нет
244|01.06.2019 13:08:19|Елена Филякина|Говорю же все консервативно.
245|01.06.2019 13:12:06|Потапыч|
247|01.06.2019 13:14:55|Елена Филякина|Статистика М/Ж в зале.
248|01.06.2019 13:17:16|Alexey Vishnyakov|Слева от места съёмки дам довольно много, а вот справа  одни мужики 
249|01.06.2019 13:17:40|Dmitry Manzor|То, чем мы занимаемся на бирже, является Игрой
250|01.06.2019 13:24:48|Шура SiberianRanger|Вся жизнь игра 
251|01.06.2019 13:25:15|Dmitry Manzor|вопрос только в том, кто мы актёром я не хочу быть
252|01.06.2019 13:26:03|Шура SiberianRanger|Why though
253|01.06.2019 13:26:50|Dmitry Manzor|душа не лежит тут Гарри говорит, что облигации это математика, какая же это игра
254|01.06.2019 13:28:27|Harry Lime|После цены облиги 50 математика превращается в игру
255|01.06.2019 13:28:46|Dmitry Manzor| конечно не хотелось бы
256|01.06.2019 13:28:57|Harry Lime|Теория игр практически
257|01.06.2019 13:29:58|Елена Филякина|У Морозовой все по полочкам  месяцам. Каждый месяц нужен доход, основной доход это дивы, в остальные месяцы она получает купоны, если нет ни дивов, ни купонов, на эти месяцы у неё приходятся вклада.
260|01.06.2019 13:34:00|Dmitry Manzor|пусть ВДО покупает, ежемесячные купоны в основном, удобно.
262|01.06.2019 13:38:15|Alex|Купон Роделена точно будет, а дивы не факт
263|01.06.2019 13:39:02|Елена Филякина|Она в кругосветку на дивы гоняла.
264|01.06.2019 13:39:05|Шура SiberianRanger|Северсталь точно будет через год, а Поделено не факт
265|01.06.2019 13:39:48|Alex|да, действительно
266|01.06.2019 13:41:17|Harry Lime|Есть куда стремиться , я только в Крым на купоны в этом году
267|01.06.2019 13:41:38|Dmitry Manzor|всё от депо зависит
269|01.06.2019 13:43:40|Елена Филякина|Я вот бургер тут пока себе на купоны от Ломастера позволила и кофе
270|01.06.2019 13:43:51|Alex|А за 30 лет, более 200
273|01.06.2019 13:44:49|Oleg Egorov|Они уточнили, что за прошедшие 3 года
274|01.06.2019 13:45:27|Alex|Историческая доходность абсолютно ничего не гарантирует в будущем
275|01.06.2019 13:46:57|Harry Lime|Вы представляетем, что тогда творит CBOM 24
276|01.06.2019 13:48:33|Kir|CBOM животворящий
277|01.06.2019 13:49:35|Alex|Вот кстати надо было именно СВОМ24 рекламить. Опиум для народа.
279|01.06.2019 13:54:32|Denis Kozlov Septem|Спасибо за отчет Питер  душевный город. Душевные ВДОшники 
280|01.06.2019 13:54:56|Шура SiberianRanger|От депозита D
281|01.06.2019 13:55:54|Alex|смотря что нужно, и каков допустимый риск
283|01.06.2019 14:12:57|Dmitry Manzor|Кир тебе делать нечего
284|01.06.2019 14:21:57|Kir|Я думаю это бот
292|01.06.2019 14:33:33|Dmitry Manzor|на что он намекает
293|01.06.2019 14:35:02|Елена Филякина|Нефть в рост, глава страны в фаворе нефть падает Ельцин виноват, растет Путин молодец.
294|01.06.2019 14:36:36|Шура SiberianRanger|Нефть лучший президент старая фишка 
295|01.06.2019 14:43:09|Елена Филякина|Все обед ПИФы и Фонды в меню.
300|01.06.2019 14:51:06|Pavel Bilenko|Вот вечно как я не приду, так чтото фееричное случается 
301|01.06.2019 15:09:08|DIM|Это сколько же объёма денежного надо иметь чтобы комфортно каждый месяц жить Хотя понятие комфортно у каждого свой
302|01.06.2019 15:11:07|Елена Филякина|Так она в 2008 году начала покупать, после обвала рынка. У неё сбер за копейки. По некоторым эмитентам в ее портфеле дивы выше 300 годовых.
303|01.06.2019 15:13:13|А что ты сделал для котэ!?|Добавлю  еще и реинвестировать существенную васть, чтобы портфель в реальных деньгах не падал
306|01.06.2019 15:26:05|Шура SiberianRanger|Например вот столько https//mashaanyaoleg.livejournal.com/248731.html
307|01.06.2019 15:26:17|DIM|   Всё как обычно
308|01.06.2019 15:26:18|Елена Филякина|Сбер новичков от всего оберегает, кроме ОФЗ никаких им фьючерсов. И в перспективе не будут в приложение добавлять.
309|01.06.2019 15:26:52|DIM|Кстати а там правда обеда вообще нет  Программу смотрел когда смутило что перерыва на обед даже нет
310|01.06.2019 15:27:30|Harry Lime|Они кстати неплохо работают , но доха 911 в рублях
311|01.06.2019 15:28:53|Oleg Egorov|К какому классу их правильнее относить, структурные, ноты
312|01.06.2019 15:29:07|Елена Филякина|Нет, но бар работает. Если скучно  идёшь пить кофе из бумажного стаканчика.
313|01.06.2019 15:29:18|Harry Lime|БСО  биржевые структурные облигации
318|01.06.2019 15:34:26|DIM|Спортсмены на кофе далеко не уедутсмерть 
319|01.06.2019 15:35:32|Елена Филякина|Есть стеклянные бутылочки с иностранными этикетками. Есть кола вроде.
320|01.06.2019 15:35:38|Oleg Egorov|Там столовая рядом, я туда сходил
323|01.06.2019 15:41:54|DIM|Но все же на одном кофе, жесть, нормальное питение неужели организовать нельзя было
325|01.06.2019 15:42:52|Елена Филякина|Картофель фри, бургеры с мясом и свежими помидорами.
326|01.06.2019 15:43:29|DIM|Да если и не спортсмены, это я так шучу, ну как не покушать то нормально  
327|01.06.2019 15:43:31|Denis Ipatov|Мясничего, Трейбери в спонсоры
328|01.06.2019 15:43:49|DIM|Жаль 
329|01.06.2019 15:44:03|Елена Филякина|Вода бесплатно
331|01.06.2019 15:45:43|Harry Lime|Beyond burger был бы ваще на острие тренда
332|01.06.2019 15:47:30|Елена Филякина|Сейчас придут на рынок новые инвесторы, принесут капиталы, организация подтянется.
334|01.06.2019 15:50:29|Oleg Egorov|Захэджировался
338|01.06.2019 15:54:56|Завирюха Александр (МСХ Чувашия)|Это не порядок 
341|01.06.2019 15:59:02|Dmitry Manzor|Правильно, популяризируйте ВДО
348|01.06.2019 16:14:26|DIM|Ждём значит 15й в июне
349|01.06.2019 16:21:37|Шура SiberianRanger|СПРАВЕДЛИВО
350|01.06.2019 16:24:09|Елена Филякина|Но имея детей, деньги у них можно изъять и инвестировать я вот своей 9 пообещала
351|01.06.2019 16:24:40|Шура SiberianRanger|
352|01.06.2019 16:25:55|Елена Филякина|Я честно предложила помочь открыть счет, на меня окоуглила глаза, тогда говорю, гони бабки. Воспитание окончено.
353|01.06.2019 16:26:57|DIM|Типа счёт или не буду давать денег на расходы карманные 
354|01.06.2019 16:27:53|Елена Филякина|Ей 28 лет, что такое карманные расходы
355|01.06.2019 16:28:19|DIM| Упс
357|01.06.2019 16:30:32|Елена Филякина|Они у неё на вкладах, вот забираю под летние разрешения. Пусть себе еще заработает.
358|01.06.2019 16:31:03|DIM|
359|01.06.2019 16:31:29|Anastasiya Gavrilova|Ну мать
361|01.06.2019 16:32:29|Елена Филякина|Я идеальная
362|01.06.2019 16:32:39|DIM|Вклады нафик, я сам сейчас в ближайший год планирую полностью от них Избавится, жаль родственников не пробитьа поколение прошлое вообще не переубедить, страхи, а то что офз надёжнее вкладов как то не задумываются, если дефолт в стране, то и страхование вкладов не поможет уже
363|01.06.2019 16:51:22|A G msk|В общем, закрыл я ИИС в Открытии, открыл в ВТБ. Если нет карты, то надо идти в отделение, по субботам большая часть не работает. Там милая девушка мне за 20 минут оформила карту. Сразу зашёл в приложение, ткнул Оформить ИИС, и через минуту он создался только совместно с обычным брокерским. Минус в том, что карта 200 р. в месяц стоит, чтобы бесплатно, нужно 5к тратить. Например, ЖКХ через госуслуги оплачивать через приложение не считается. Минимальной суммы на счёту иметь не нужно. Девушка сказала, очень много людей приходит за ИИСом, заинтересовалась, дал ссылку на investschet.ru , мб тоже ВДО закупит 
364|01.06.2019 16:53:44|Kir|Ничего не понял по светофору, будет новый выпуск
366|01.06.2019 17:00:21|Шура SiberianRanger|Не ту карту взял, надо было бесплатную карту к мастерсчёту брать.
367|01.06.2019 17:00:56|A G msk|Вроде сейчас только мультикарта
368|01.06.2019 17:01:11|Елена Филякина|Мы уже свалили, Финам не стали слушать. Утром все стулья были заняты и народ в проходах стоял.
369|01.06.2019 17:02:50|Kir|А что там по светофору, новый выпуск или этл про оферту речь
370|01.06.2019 17:03:33|Шура SiberianRanger|Развела тебя девушка скорее всего, потому что за мультикарту ей заплатят, а за бесплатную нет 
371|01.06.2019 17:05:12|A G msk|Ок, погуглю, если так, то поменяю
372|01.06.2019 17:08:42|Alexey Vishnyakov|Да  в втб мне выдали простейшую карту к договору комплексного обслуживания. Она не именная и бесплатная. Больше всего меня Поразило то, что она не безконтактная  пришлось засовывать её и пин вводить, как первый раз пытался совершить покупку. Но мне её возможностей хватает.
373|01.06.2019 17:10:53|DK|Вам выдали пакет мультикарта, пакет платный. Вам нужен пакет базовый
374|01.06.2019 17:10:56|Шура SiberianRanger|https//www.vtb.ru/tarify/ Сборник тарифов по пакетам банковских услуг
375|01.06.2019 17:12:39|A G msk|Спасибо
376|01.06.2019 17:36:25|Sergey Sidorov|Отличная статья, спасибо Чиста канкретно написана
377|01.06.2019 18:00:57|DIM|Иис можно спецом и не закрывать в открытии, или он у вас недолго существовал
381|01.06.2019 18:18:15|Максим Воробьев|И мои двое сыновей уговорились на ежемесячный купон 1 и сдали свои карманные в доверительное управление папе... . Старший только ни в какую, увлеклся потреблением, не желает настоящим ради будущего жертвовать ... 
382|01.06.2019 18:28:56|A G msk|С декабря. Много не успел занести. Нельзя же два ИИС одновременно
383|01.06.2019 18:59:38|DIM|Спасибо
385|01.06.2019 19:10:19|Максим|Можно, 2 на жену , 3 на маму, 4 на папу... Еще теща есть с темтем
386|01.06.2019 19:16:52|Sergey Sidorov|Вы можете прям ЗПИФ семейный иис
387|01.06.2019 19:25:32|Sergei|Ну и правильно делает , ценность денег в его возрасте несколько другая , они дороже для него чем для вас ....
388|01.06.2019 19:26:46|Даниил Иванов|Презентация была
389|01.06.2019 19:41:24|Елена Филякина|
391|01.06.2019 21:16:16|Pavel Nakonechnyy|Да и проценты не радуют. Инфляция выше. А он может быть в курсе 
392|01.06.2019 21:16:49|Sergei|Конечно , не забывайте что для вас и для него инфляция разная
393|01.06.2019 21:23:13|Oleg Egorov|Будет выпуск под более низкую ставку, и про IPO разговор был...
394|01.06.2019 21:25:44|Sergey Sidorov|Текущий выпуск на 2 года, оферта в октябре. Там что будет со ставкой, озвучивал эмитент
395|01.06.2019 21:26:47|Oleg Egorov|Нет, про судьбу текущего не говорили
396|01.06.2019 21:27:21|Shamtu|Подскажите, пожалуйста, rus28 можно всетаки купить на ИИС или нет Брокер втб
398|01.06.2019 21:28:53|Шура SiberianRanger|Можно, но только в рублёвом стакане
400|01.06.2019 21:29:27|Dmitry Manzor|Вы считали доху
401|01.06.2019 21:30:03|Shamtu|А что с купоном В рублях по курсу или как
402|01.06.2019 21:31:19|Шура SiberianRanger|В долларах дополнительно нужно будет написать заявление, ибо по умолчанию долларовый мастерсчёт не привязан к ИИС за ненадобностью
