|time|user|text
174|19.06.2019 09:07:48|Pavel|Сбербанк завернул этот индекс в своё исж
178|19.06.2019 09:09:09|Даниил Иванов|там в презентации 100 процентная защита от Сбербанка. Так что видимо это ИСЖ ДУ Сбера с комиссией от БКС
180|19.06.2019 09:09:41|Pavel|Ахаха. Сбербанк для ВИП клиентов предлагает коэффициент участия 4
182|19.06.2019 09:10:34|Valery Chistyakov|Подскажите, а по МигКредиту заявки вообще ещё принимают В понедельник отправил и тишина в ответ
183|19.06.2019 09:10:56|Шура SiberianRanger|Тишина в ответ это у них норма
185|19.06.2019 09:12:05|Valery Chistyakov|Большие оригиналы
186|19.06.2019 09:13:36|Oleg Egorov|Объем выпуска большой, думаю всем нальют
187|19.06.2019 09:30:44|Harry Lime|И это еще все росло...
188|19.06.2019 09:32:17|Pavel|Клиенту Сбербанка, с которым я общался, предоставили презентацию продукта с эквити индекса по сентябрь 2018 года. Деликатно обойдя осень 2018го дело было в феврале 2019 года
189|19.06.2019 09:32:29|Ilya|Я в смысле пошло инакомыслие в секте
190|19.06.2019 09:32:29|Pavel|Высокие технологии продаж
191|19.06.2019 09:51:40|Alexey Vishnyakov|Мне просто начало казаться, что постоянный вход  выход, парковка денег на неделю и прочая суета попахивает мостурбиной. Много ажиотажа  мало толка.
192|19.06.2019 09:53:22|Максим Кочнев|Да, я тоже начинаю от этого уставать. Понемногу уже блокирую средства в некоторых эмитентах уже без возможности продать.
193|19.06.2019 09:53:55|Шура SiberianRanger|Парковка денег на неделю при одинаковой цене входа и выхода даёт больше нуля. Эффект от постоянный входвыход зависит опять же от цен 
195|19.06.2019 09:55:35|Максим Кочнев|Не всегда
196|19.06.2019 09:55:55|Dmitry Manzor|всё считать надо
197|19.06.2019 09:58:05|Максим Кочнев|Я уже решил, те что у меня не вызывают особого беспокойства довести до 35и вобще не трогать их. А покупать новое только если есть новые деньги или на небольшую часть от спекуля. Но уже не такого глобального
200|19.06.2019 09:59:17|Alexey Vishnyakov|Просто этого в последний месяц стало очень много. Роста цены во всех бумагах что я покупал не просматривается  мясо, ОМ, таксовик, кисточки и прочее. В этих условиях, как мне кажется, была бы покупка всех этих бумаг в размере лимита и получение купонол где то полгода  а потом уж смотреть
202|19.06.2019 10:00:01|Шура SiberianRanger|gt покупка всех этих бумаг в размере лимита и получение купонов Я так и делаю  Брат жив, зависимости никакой 
203|19.06.2019 10:00:42|Alexey Vishnyakov|
204|19.06.2019 10:00:43|Шура SiberianRanger|Рост цены это прост приятный бонус, не нужно его ожидать
205|19.06.2019 10:01:07|Максим Кочнев|Я лично веду речь и об откзе продавать другое взамен новичков, если толка как такового нет
206|19.06.2019 10:01:33|Шура SiberianRanger|Я один раз ожидал, только расстроился на ровном месте 
207|19.06.2019 10:02:26|Максим Кочнев|Кисточки неплохо начали
208|19.06.2019 10:02:57|Oleg Egorov|Тут каждый сам выбирает степень вовлеченности. Вообще это здорово, что есть выбор хочешь мимимум движений  покупай и держи, получай купоны, есть время и возможность спекулировать  строй лесенки, как в Тинькове в свое время.
209|19.06.2019 10:04:37|Александр|Если будет ответ на прямой линии, то с меня шампанское автору
211|19.06.2019 10:05:25|Dmitry Manzor|Легенда на 100.9 подскочила и сразу на исходную
212|19.06.2019 10:06:52|Dmitry Kravchenko|Надо учитывать еще стоимость своего рабочего времени, причем не только то, когда жмешь кнопки, но и когда обдумываешь эту операцию и принимаешь решение.
213|19.06.2019 10:08:45|Alex|А что, микрофинансы уже плитами ниже 99,97 роняют
214|19.06.2019 10:08:45|Шура SiberianRanger|Ну если ктото мегабаксы в секунду на работе делает, то да, а кто в офисе штаны протирает за зарплату, то можно и посидетьподумать.
215|19.06.2019 10:08:51|Aleksandr Mukhin|ОМ льют по 99,98
219|19.06.2019 10:14:59|yuri_che|пожадничала с купоном ОМ, будет ниже
220|19.06.2019 10:16:06|Шура SiberianRanger|Слоны пугают мышей, мыши льют в биды
221|19.06.2019 10:17:47|Ilya|Крамолу глаголешь хоть и верную
222|19.06.2019 10:18:13|Harry Lime|На этом месте звучит песня Circle of life из мультфильма Король лев.
223|19.06.2019 10:19:46|Alex Petroff|Да ладно. Объемы пока детские.
224|19.06.2019 10:20:13|Шура SiberianRanger|Слоны окстились и убрали оффера
226|19.06.2019 10:29:33|In reply|а как вообще Киты себя чувствуют брокер и тп
228|19.06.2019 10:42:22|Harry Lime|На полпроцента от депо
229|19.06.2019 10:57:33|In reply|и ведь вошли люди, раз гуру направил
230|19.06.2019 10:58:37|Harry Lime|Войти можно , выйти без боли нет
232|19.06.2019 11:02:02|Дмитрий Адамидов|Нене, это Элвис и Финмонстр засаживали в Финавиа. Я наоборот  агитировал подождать
233|19.06.2019 11:03:10|Harry Lime|Писали здесь с февраля 18 года , идея с ростом Финавиа не работает
234|19.06.2019 11:07:01|Ilya|Не смотрел, нет интереса к ним
235|19.06.2019 11:10:21|Kir|На оферту роялу видимо ничего не принесут
236|19.06.2019 11:12:22|Sergey Sidorov|Так с 15/06 в Рояле1 уже новые условия 15.5 купон.
237|19.06.2019 11:13:51|Виктор 6-2-4|Напомните механизм при продаже в день выплаты купона. Нкд уже нулевой. Продажа ТО. Кто получит купон, покупатель или продавец
238|19.06.2019 11:14:29|Алексей ayaye :)|продавец
239|19.06.2019 11:15:30|Kir|Да сбор заявок уже прошел, сегодня сама оферта
240|19.06.2019 11:15:34|Dmitry Manzor|Такси залили до 100.08 под ГрузЦ
242|19.06.2019 11:27:11|К& Б:))🍷|Ну здесь дело в вере и жадности... В этом случае разумные доводы не проходят
243|19.06.2019 11:30:52|In reply|интересно как формулируется символ веры Верую что эмитент заплатит полюбому ибо..
244|19.06.2019 11:35:29|Ilya|Все верно, по цифрам видно, что все плохо, но есть идеи вроде такой не дадут умереть
245|19.06.2019 11:47:51|Oleg Egorov|люди брали  хвалили...
246|19.06.2019 11:56:27|Denis Ipatov|ну, кому ноготочки по номиналу не достались...
247|19.06.2019 11:57:51|Dimasik|Побег из таксо
248|19.06.2019 11:59:23|Viacheslav Sofikor|уже ниже
249|19.06.2019 12:00:03|Dmitry Manzor|Новые размещения наводят шорох на старые
250|19.06.2019 12:03:28|Denis|И такси залили и кисточки
251|19.06.2019 12:04:30|Евгений Коломна|Кисточки по 100 наливают без проблем, взял еще чуток
253|19.06.2019 12:12:20|Дмитрий Виноградов|Такси чтото совсем упало
254|19.06.2019 12:12:44|Dmitry Manzor|ГрузЦ встряхнул рынок
255|19.06.2019 12:13:00|Дмитрий Виноградов|взял по 99,72 для усреднения, но такими темпами придется еще усредняться, я чуствую
256|19.06.2019 12:13:26|Aleksey Kormilitsyn|Elegantly wasted
257|19.06.2019 12:14:13|DIM|Такси ещё отыграется, щас размещение закончится грузовикоф и вуаля, цены попрут вверх, особенно если тинькоф добавит бумаги 
258|19.06.2019 12:15:28|Александр Нечаев|Да, чат выдохся по деньгам
259|19.06.2019 12:16:20|Dmitry Manzor|в Таксон 1 инветор взял 46 млн
260|19.06.2019 12:16:21|Максим Кочнев|А ещё ведь миг кредит
262|19.06.2019 12:16:52|Dmitry Manzor|Кamp Ваш выход
263|19.06.2019 12:17:34|Dimasik|После ом думаю никто особо и не рыпнется
264|19.06.2019 12:17:57|Александр Нечаев|Да не только такси, все ушло под воду
265|19.06.2019 12:18:03|Максим Кочнев|Купон все равно хорош и ежемесячно
266|19.06.2019 12:18:09|Александр Нечаев|Только ломбард стоит как скала
267|19.06.2019 12:18:55|Dimasik|Там слобоопых не осталось 
268|19.06.2019 12:23:58|Kir|Ох, а что будет при намеке на дефолт реки крови
269|19.06.2019 12:24:21|Alex|не, не будет, бидов просто будет 0
270|19.06.2019 12:26:14|Максим Кочнев|Не то что в КО. Тишина. В любом случае. Хоть кипишь, хоть загробная, все равно тихо
271|19.06.2019 12:28:09|Soa|кто бы сомневался...вообще не понимаю надежд некоторых
272|19.06.2019 12:28:59|Alex S|и откуда только надежды, что грузовик дешего раздадут 
273|19.06.2019 12:30:12|Alex Petroff|Сколько в стаканах эмоций
274|19.06.2019 12:31:48|Soa|вот ниже номинала взял
276|19.06.2019 12:33:47|Alex S| по ходу ктото много вчера взял, специально чтоб сегодня под грузовик продать ниже номинала
277|19.06.2019 12:34:04|Alex Petroff|Платное обучение в действии.
278|19.06.2019 12:34:09|Roman|на последних размещения в чатах ажиотаж, народ хватает все подряд, не особо задумываясь о рисках
279|19.06.2019 12:34:28|Alex S|робин гуды ей богу
280|19.06.2019 12:37:44|Dmitry Manzor|Потрясёт, потрясёт и успокоится
281|19.06.2019 12:38:01|Soa|это просто курсы по приобритению на первичке...тоже полезный навык
282|19.06.2019 12:41:47|Евгений Коломна|Ну кисти пока ниже 99.99 не ходили
283|19.06.2019 12:42:33|Soa|так в стакане сразу после размещения
284|19.06.2019 12:44:17|Konstantin|Миг кредит когда будет размещаться 23 июня
285|19.06.2019 12:45:55|Oleg Egorov|24 июня. 23  воскресенье
286|19.06.2019 12:47:41|Шура SiberianRanger|
287|19.06.2019 12:48:58|Евгений Коломна|И в миг кредит сразу лезть тоже резона никакого нет
288|19.06.2019 12:50:21|Soa|нас сейчас забанят за такие беседы
289|19.06.2019 12:50:42|Михаил|Вот смех смехом, а объясните, что блэд происходит То есть реально люди влезли в транса, а потом тут грузовик а хле нам льём срочно ниже номинала Что за бред
290|19.06.2019 12:51:29|Soa|психология и вера в хайп..так часто бывает
292|19.06.2019 12:53:44|Евгений Коломна|Слон отказался брать Грузовик и Юнисервис, чтобы его разместить на себя выходит в кеш в других облигах. Вот моя ни на что не претендующая конспирология
293|19.06.2019 12:53:53|Михаил|Мдээ, грустно
295|19.06.2019 12:55:28|Harry Lime|Самое смешное будет , если через месячишко все это потянется на 101102
296|19.06.2019 12:56:05|Alex S|так и будет если новых массовых размещений не будет
298|19.06.2019 12:56:39|Шура SiberianRanger|Время подбирать Такси и Кисти из слабеющих рук 
299|19.06.2019 12:57:05|Dmitry Manzor|В такси всё гуд, больше всего пугает инвестор на 46млн, если ему деньги понадобятся будет шорох
300|19.06.2019 12:57:16|Harry Lime|Надо брать сколько нужно , а сколько не нужно брать не нужно
301|19.06.2019 12:57:25|Шура SiberianRanger|в Кистях комуто налили 173 штуки по 100.05
303|19.06.2019 12:57:38|Евгений Коломна|Кисти уже отскочили
304|19.06.2019 12:58:10|Dmitry Manzor|Сейчас не одобрят комуто на первичке ГрузЦ обратно в такси полезут или ГрузЦ со стакана выше номинала будут забирать
305|19.06.2019 12:58:31|Harry Lime|А то будешь как бабка с 10 летним запасом гречки
306|19.06.2019 12:59:24|Alexey Vishnyakov|
307|19.06.2019 12:59:47|Шура SiberianRanger|В советские времена это была топбабка  Ещё чай помню в кубических упаковках по стенам в авоськах развешан был во многих домах 
308|19.06.2019 13:00:33|Harry Lime|Да нет , это модель 2014 года
310|19.06.2019 13:02:30|Harry Lime|Ну бонды это математика , многие перешли во второй класс. Узнали , что бывают и отрицательные числа. Вполне недорого кстати.
311|19.06.2019 13:03:18|Pavel|Финмонстр это канал такой
312|19.06.2019 13:04:16|Harry Lime|Да.
313|19.06.2019 13:04:34|Pavel|Кажется автор этого канала молодой юный мальчик
314|19.06.2019 13:04:42|Harry Lime|Посмотрите на CBOM . Повел себя как надо после небольшого лага. Математика.
315|19.06.2019 13:04:58|Шура SiberianRanger|Не, Антошка это другой канал вроде
316|19.06.2019 13:05:24|Pavel|А, ну ладно. 
319|19.06.2019 13:06:28|Вячеслав Васильев|нет именно, Антона Щукарева канал
320|19.06.2019 13:06:39|Sergey|Неспроста разом все биды из Юнисервисовских выпусков пропали
321|19.06.2019 13:07:01|Harry Lime|Это же читалось , позитив по снижению ставок с таким купоном не мог не сказаться
322|19.06.2019 13:08:00|Pavel|Просто если я ничего не путаю ещё до всяких телеграммов я имел честь лично общаться с автором. Тогда он был никакой не монстр в общем, он не разбирается. Так же как и Коган. И никогда не будет разбираться
323|19.06.2019 13:08:58|Sky|Лол, все кому не хватило таксы и кистей могли закупиться без всех этих спринтерских предзаявок. С грузовиками тоже самое запросто может быть. Спекулятивная позиция слишком высока.
324|19.06.2019 13:13:26|Dmitry Manzor|подставите тазик
325|19.06.2019 13:19:17|Sky|Нет. В смысле с ОМ я так и поступил  размещение, продажа, откуп. А вот в бумажки Ю особо не верю, взял чутка для коллекции и все. Тут надежда на тинек только 
326|19.06.2019 13:19:19|Елена Филякина| в зимних куртках деньги закончились а ничего сливать не хочу. Диверсификация, мать ее
327|19.06.2019 13:20:29|Dmitry Manzor|вы сколько фиксите 0.1 или 0.5
328|19.06.2019 13:20:46|Елена Филякина|Плакат каждому на потолок в спальне глаза продрал  молитву прочитал.
329|19.06.2019 13:21:37|Harry Lime|Это не я , это Тони Роббинс
330|19.06.2019 13:21:50|Sky|Не понял  доля от первички или что это
331|19.06.2019 13:22:35|Елена Филякина|Я за вами сегодня записывать не успеваю
332|19.06.2019 13:23:33|Михаил|Первый раз орнул, ну а теперь прям не могу остановиться
333|19.06.2019 13:24:12|Шура SiberianRanger|в ОМ 101 было в первые дни
335|19.06.2019 13:24:34|Dmitry Manzor|какая цена для Вас приемлема для продажи Вот вы взяли по номиналу, когда продавать будете 100.1 или 100.5 будете ждать
337|19.06.2019 13:25:11|Sky|Зависит от бумаги
339|19.06.2019 13:26:26|Сергей Ковалев|в вдо сегодня конечно жесткое заливное
340|19.06.2019 13:26:38|Маржинколл Байбекович|Они думали, что они трейдеры. А оказалось инвесторы.
341|19.06.2019 13:26:55|Dmitry Manzor|Кидайте стакан по ГрузЦ как появится
343|19.06.2019 13:28:26|Alex S|а кому не хватит успевайте разбирать то, что подешевело 
345|19.06.2019 13:29:31|Dmitry Manzor|Спасибо
346|19.06.2019 13:30:32|Вячеслав Васильев|Если ГрузЦ3 будет сегодня продаваться по такой цене, у тех кто брал первый и второй по 108 будет очень плохое настроение
347|19.06.2019 13:30:54|Vladimir|На Груз 3 заявки удовлетворять будут с 1400
348|19.06.2019 13:31:44|Сергей Ковалев|продавцы продавят еще больше, и не забывайте что там купон больше
349|19.06.2019 13:31:44|Вячеслав Васильев|Да с 14 до 1630
350|19.06.2019 13:33:18|Pavel|А что это за эмитент такой
351|19.06.2019 13:33:18|Pavel| Черноморский банк торговли и развития размещает 5летние евробонды в долларах Ориентир доходности  midswap  200 б.п. Дата погашения  26 июня 2024 года. С 13 июня банк проводил встречи с инвесторами, посвященные возможному размещению еврооблигаций. Road show прошли в городах Европы и Азии. Организаторы размещения  HSBC, JP Morgan и Societe Generale.
352|19.06.2019 13:33:54|Вячеслав Васильев|По второму 106  это примерно 10,7 по квику, так что либо там падение, либо здесь рост рано или поздно
353|19.06.2019 13:34:47|Евгений Инвестор|Черноморский банк торговли и развития  международная финансовая организация, созданная с целью поддержки регионального развития и кооперации стран Черноморского региона. Целями банка являются развитие торговых связей в регионе, содействие реализации международных проектов, содействие иностранным инвестициям, предоставление гарантий при развитии торговых и экономических связей как на государственном уровне, так и в частном бизнесе. Черноморский банк торговли и развития относится к международной организации Черноморское экономическое сотрудничество. Основополагающим документом, определяющим деятельность ЧБТР является Соглашение о создании Черноморского банка торговли и развития, зарегистрированного ООН. Уставный капитал банка 3 млрд СДР. https//www.bstdb.org/
354|19.06.2019 13:36:05|К& Б:))🍷|Так о чем теперь выходить ПисатьЯ предупреждал, что нальют всем, а вы не верили Так сегодня это вполне свершившийся факт... Больше меня удивляет, что вы регулярно печатаете этот коммент. Не знал бы, подумал, что бот... Или это попытка показать и я там был 
355|19.06.2019 13:36:54|Dmitry Manzor|мне нравятся ваши мысли а так я помню, что вы говорили, что нальют всем, а я не верил
356|19.06.2019 13:37:30|Pavel|Оооо, спасибо
357|19.06.2019 13:37:49|Максим Кочнев|Вы говорили что на грузовик 3 у народа денег не будет. Я вот до сих пор не верю
358|19.06.2019 13:38:29|Sky|А откуда 
359|19.06.2019 13:39:11|Александр|Манимэн 99.04. В чем дело
360|19.06.2019 13:39:24|Максим Кочнев|В ставке 14
361|19.06.2019 13:52:28|Dimasik|К дохе ОМ подбирается
362|19.06.2019 13:52:38|yuri_che|Для меня Международная финансовая и Мошенник  одно и то же
363|19.06.2019 13:57:37|Ilya|ФА. Есть понимание, что заработать можно и на самом плохом активе  это лишь вопрос цены. Вот что интересно, Рестракт идёт как раз по минимальным ценам в прошлом. То есть инсайд и давно. Вывод Заработать можно, только если правильно определить цену актива и за столом нет краплёных карт. Это же касается и кучи размещений в последнее время. Есть надежда на своевременный сброс карт, насколько это работает  увидим. Гарри успеет, не сомневаюсь, и Максим, он дисциплинирован.
365|19.06.2019 14:04:41|Ilya|Где они этого дядьку взяли  забавно так выглядит всегда
366|19.06.2019 14:04:52|Vladimir|Груз 3 налили на счёт
367|19.06.2019 14:05:26|Anton|Груз3 пошла жара
368|19.06.2019 14:05:36|Шура SiberianRanger|ПОЕХАЛИ
369|19.06.2019 14:06:54|Dmitry Manzor|рано
370|19.06.2019 14:07:58|Шура SiberianRanger|ПОЕХАЛИ 2
