|time|user|text
1|23.09.2019 10:47:04|Giovanni Goudini|Хоть измерять квалификацию, пусть измеряют квалификацию
6|23.09.2019 10:48:14|Alex Petroff|Коллеги Есть еще вариант ДУ у Иволги. Ваши деньги, их стулья, грубо говоря. Но это не точно. Я давно говорю, что некий фонд или ETF спас бы ситуацию. И на все про все остался год с небольшим.
7|23.09.2019 10:48:19|Giovanni Goudini|И русагро с полиметалом на мамбе тоже
8|23.09.2019 10:48:21|Denis Kozlov Septem|Коллеги, Эбис внести в Сектор Роста. Ждем регистрационный номер выпуска и сделаем объявление о старте размещения
9|23.09.2019 10:48:24|Alex|Ты закон почитал прежде чем спамить в чате Ора много а толку мало. Там и ценз и квалификация.
10|23.09.2019 10:48:41|Giovanni Goudini|Прочитал
11|23.09.2019 10:49:05|r.alex|Когда же Эбис будет размещаться
12|23.09.2019 10:49:07|Dmitry Manzor|закупимся ETF на ВДОсектор. Его сделают, однозначно.
13|23.09.2019 10:49:35|Alex Petroff|И это...хорош паники. Все последствия мы просчитывали и оценивали. Кто хочет оставаться с ВДО, тот сделает себе квала. Кто нет, найдут себе другие инструменты или ДУ их спасет. Небо не падает на землю. Ситуация в развитии.
14|23.09.2019 10:49:38|Maison|Етф тоже от квала
15|23.09.2019 10:49:49|Giovanni Goudini|Так с последними поправками, даже если ты не прошёл тест на квалификацию, то подписываешь о рисках бумажку, и если есть бабки торгуй чем хош
18|23.09.2019 10:50:06|Alexey|Вы и остальных эмитентов поторопите и поторопитесь. Хоть разместятся до часа Х
19|23.09.2019 10:50:27|Maison|До часа х больше года
20|23.09.2019 10:50:40|Giovanni Goudini|Только ОПИФ сможешь брать
21|23.09.2019 10:51:11|Alexey|Проблема не в нас покупателях. Проблема в эмитентах и оргах. Без спроса розницы они просто не будут размещаться и все
22|23.09.2019 10:51:38|Denis Kozlov Septem|Если в ОПИФ есть инструменты для квалов, то паи могут покупать только квалы если я ничего не перепутал
23|23.09.2019 10:51:46|Giovanni Goudini|Большинство телеграм каналов отвалялтся, групп в контакте...
24|23.09.2019 10:51:52|Alexey|Пролетит время это оч быстро
25|23.09.2019 10:52:40|Maison|Кто хочет тот всегда найдет, и способ квала получить, и закон обойти. Для искушенных ничего не поменяется. А кому надо и денег найдет. А вот то, что будет независимо от трактовки закона  это песочнице нашей конец
28|23.09.2019 10:54:19|Harry Lime|Этот чат покупал и первый ломбард и роял и светлфор. И никто не знал как оно будет еще год назад.
29|23.09.2019 10:55:01|Maison|И вот так и будут проходить размещения, только без крика в чате, а остаток в 10м от выпуска в розницу на 5рых пилить квалов и все
30|23.09.2019 10:55:46|Harry Lime|Тщательнее буду отбирать компании , где можно хоть до погашения
31|23.09.2019 10:56:08|Maison|И это тоже
32|23.09.2019 10:56:38|Alexey|Я почему то уверен что вдо всегда и везде  эгалитарный рынок  любые ограничения его от масс  прибивают его
33|23.09.2019 10:57:08|Maison|Вот его и прибьют
35|23.09.2019 10:59:52|Владимир Тутынин|Не ну если Вы затоскуете. Я всегда Вам продам по 107, и даже по 109
36|23.09.2019 11:01:52|Maison|И кстати да. Перед самым выступлением в силу можно еще на год собрать портфель вдо пусть чуть пониже доходность, но относительно надежный. Просто год получать купоны не заходя в новые размещения... Которых, кстати, не то что бы много и станет.
38|23.09.2019 11:09:23|Dmitry Manzor|Закупаемся пятилетним ломбардом на всю котлету 31 декабря 21 года. Покупать новые мне запретят. Но старые же не заставят продавать
39|23.09.2019 11:09:49|Harry Lime|Бинго
40|23.09.2019 11:16:22|Maison|Про него то я и забыл у меня перед глазами встал портфель из заводов мяса и тд с обувью с доходностью 1314 к погашению... Но я забыл, что у нас есть Мекка
41|23.09.2019 11:17:48|Alexey|А в реальности законодатели льют мельницу на пирамиды. Народ не откажется от мечты о доходности. Они просто отнесут деньги мошенникам любого рода втч от финанс рынка
42|23.09.2019 11:21:02|Maksim|может фишка в том, что эти мошенники любого рода делятся Заносят нужным и уважаемым людям. А у этих банков все по закону
43|23.09.2019 11:21:27|Kir|Кто попробовал высокую доходность уже не уйдут, найдут способы, хорош уже разводить плач ярославны
44|23.09.2019 11:22:05|Giovanni Goudini|А кто разводит плач
47|23.09.2019 11:38:51|Anastasiya Gavrilova|Опять заливное по ОМ обсудили
49|23.09.2019 11:42:44|Dmitry Manzor|ОнлМкфн01
54|23.09.2019 11:46:19|Soa|А кто в пятницу на 5 лямов его купил
56|23.09.2019 11:46:42|Dmitry Manzor|Поговаривают про ММ
57|23.09.2019 11:46:58|Soa|ММ
58|23.09.2019 11:52:27|Aleksandr Mukhin|маркетмейкера
59|23.09.2019 12:20:26|Елена Филякина|Ставлю на Тинькофф, хотя у меня только карта его он придумает как упростить жизнь клиентам в новых реалиях, ну и сам заработает 
60|23.09.2019 12:28:01|Maksim|они ищо живы 
61|23.09.2019 12:29:53|Sheld|https//www.moex.com/ru/makers/stock.aspxtid2678ampmodemain найти не могу
62|23.09.2019 12:44:37|Елена Филякина|Олег живее всех живых
63|23.09.2019 12:51:14|Soa|У них есть все шансы нас с вами пережить.
64|23.09.2019 12:54:40|Giovanni Goudini|Тинькофф живы Ино самый большой онлайн банк в мире
66|23.09.2019 12:55:25|Maksim|я про брокера
67|23.09.2019 12:56:54|Giovanni Goudini|Смотри рейтинг открытых счетов
68|23.09.2019 12:57:20|Maksim|мне больше интересен рейтинг по обороту на этих самых открытых счетах
69|23.09.2019 12:59:43|Шура SiberianRanger|
70|23.09.2019 13:24:35|Ilya|Придётся идти на работу
72|23.09.2019 13:31:27|Dmitry K|А как выходить будем, если что
73|23.09.2019 13:31:42|Soa|Ага...особенно для тех кто продать захочет
74|23.09.2019 13:32:06|Ilya|Если выйдите, то уже все не зайдёте
75|23.09.2019 13:32:27|Soa|А потом у вас же купить, но дешевле. Деньги имеют свойство стать нужными внезапно.
76|23.09.2019 13:32:30|Dmitry K|Если с ломбардом чтото случится, то мне и не надо будет
77|23.09.2019 13:32:48|Ilya|Он вечен
78|23.09.2019 13:32:52|Harry Lime|Примерно так же как и сейчас большим сайзом из Ломбарда , плиточку околономинала , про 105 можно забыть
79|23.09.2019 13:33:54|Ilya|Мало купона от эмитента, ещё и от коллег хочется процентов 5 урвать  
80|23.09.2019 13:34:33|Harry Lime|Ну вот теперь этого не будет
81|23.09.2019 13:37:10|Soa|Так что учимся работать с линкерамиовладеваем смежными профессиями 
82|23.09.2019 13:38:51|Dmitry K|С любым бизнесом чтото может случиться. Все на свете боится времени. А время боится только пирамид.
83|23.09.2019 13:39:23|Sky|Может введем мораторий на обсуждение КВАЛификационного апокалипсиса эдак на полгода 
84|23.09.2019 13:39:39|Ilya|Надо им офис в пирамидах открыть
86|23.09.2019 13:41:09|Giovanni Goudini|Нет, если его вводить, то апокалипсис наступит
87|23.09.2019 13:41:22|Soa|напоминает депутатскую инициативу
88|23.09.2019 13:41:42|Harry Lime|Больше народа будут читать РДВ , ведь Газпромнефть , Сургут и Россетку никто не запрещает.
89|23.09.2019 13:41:55|Soa|зарегулируемся
90|23.09.2019 13:42:05|Ilya|Акции ВТБ попрут наконец
91|23.09.2019 13:42:09|Giovanni Goudini|Нкнх запретят
92|23.09.2019 13:43:49|Sky|Тема будет пустопорожне пережевана ещё сто раз. Единственное, что было по существу это ссыль на петицию.
95|23.09.2019 13:50:11|Giovanni Goudini|Утром было 429 за
97|23.09.2019 13:55:59|Grigoriy Vakhmistrov|JFI сегодня получил квала от Финама по обороту, пообещали бессрочно, без необходимости поддерживать оборот
98|23.09.2019 13:57:05|Giovanni Goudini|Счас требования поменяются
99|23.09.2019 13:58:12|Grigoriy Vakhmistrov|Хотя бы лишний год в запасе будет
100|23.09.2019 14:05:50|Aleksandr|Минус в выручке, плюс в рентабельности  Дядя Дёнер подвел итоги полугодия https//ksonline.ru/356889/minusvvyruchkeplyusvrentabelnostidyadyadyonerpodvelitogipolugodiya/
101|23.09.2019 14:15:03|Olly Milly|Фридом рекламируется на Украине. Украинские госбумаги идут с доходностью 15, как наши ВДО еще недавно. Любопытно. https//24tv.ua/ru/kuda_v_ukraine_vlozhit_dengi_v_2019_vygodnoe_vlozhenie_n1206007
102|23.09.2019 14:19:28|Павел|В Казахстане Фридом тоже очень активный
103|23.09.2019 14:21:42|Olly Milly|Я так понимаю, они там и начинали.
104|23.09.2019 14:33:08|Александр|Итц налит. Бкс
105|23.09.2019 14:34:11|Шура SiberianRanger|Точно, ИТЦ же. Бодрый там бид 100  102
106|23.09.2019 14:39:31|Елена Филякина|ВТБ тоже налил вовремя.
107|23.09.2019 14:40:25|Oleg Egorov|Птичка в клетке ВТБ
109|23.09.2019 15:00:50|Aleksandr|чот у Ресо толком и не отросло ничего
110|23.09.2019 15:02:57|Harry Lime|Так Ресо в нашем апсайдерском списке и не было никогда , в отличие от Балтлизинга
111|23.09.2019 15:03:25|Aleksandr|так а я злился что ВТБ меня прокатил с Ресо
113|23.09.2019 15:31:53|Елена Филякина|Логично. Под ИТЦ порезали.
114|23.09.2019 15:35:04|Alexey|Это квик Х для планшетов у Вас
115|23.09.2019 15:37:59|Aleksandr|да
116|23.09.2019 16:11:25|Шура SiberianRanger|ИТЦТрейд 66 сделок Три крупнейших 19 870 000  17 000 000  800 000  от 360к до 500к  15 сделок на сумму 7 000 000  от 130к до 300к  17 сделок на сумму 3 350 000  до 100к  31 сделка на сумму 1 820 000  Интересное наблюдение в 1425 удовлетворены заявки на сумму 39 380 000  в 1430 удовлетворены заявки на сумму 10 460 000  Куда дели ещё 160 000  я не знаю 
117|23.09.2019 16:13:20|Pavel|Закупался ктонибудь сегодня
118|23.09.2019 16:13:21|Pavel|Купон 11,75 YTP 12.10
119|23.09.2019 16:13:45|Pavel|Атомстроем
120|23.09.2019 16:16:29|Val Z_Sky|а равзе не он недавно дефолтил
121|23.09.2019 16:17:25|nik|подал заявку, 01.10 должны налить.
122|23.09.2019 16:17:32|Pavel|Это дебютный выпуск вроде
123|23.09.2019 16:18:10|Val Z_Sky|хм. просто когда я спрашивал мб и не на этом канале про покупку облигаций от атомки, то мне скидывали ссыль где был дефолт именно от атомной конторы
126|23.09.2019 16:19:01|Pavel|Эти ребята из Екатеринбурга
127|23.09.2019 16:19:04|Harry Lime|УАХМ
128|23.09.2019 16:19:16|Val Z_Sky|значит не они
130|23.09.2019 16:19:31|Harry Lime|Это новое явление  дефолт на размещении
131|23.09.2019 16:19:50|Pavel|Сразу с новацией
132|23.09.2019 16:20:18|Harry Lime|Собрали деньги и такой пресс релиз  нерасчет НКД и рестракт на 100 лет под 0,1
133|23.09.2019 16:20:52|Шура SiberianRanger|
134|23.09.2019 16:25:52|Val Z_Sky|это просто стартап года 
135|23.09.2019 16:26:00|Giovanni Goudini|И купон как у ох, 100 летний
137|23.09.2019 16:26:58|Denis Kozlov Septem|Коллеги, Трейдберри планирует новый выпуск облигаций. Сегодня  интервью с основателем и бенефициаром компании Виктором Шевченко. У вас будет возможность задать в прямом эфире волнующие вас вопросы. Присоединяйтесь  https//redcircule.com/courses/11667
138|23.09.2019 16:27:42|Harry Lime|Крутые новости
139|23.09.2019 16:29:40|Dmitry Manzor|Главный вопрос  какой купон
140|23.09.2019 16:35:14|Rifnur|Главный вопрос  хватит ли на всех
141|23.09.2019 16:40:47|Aleksei Tuv|А сколько по ним минималка 300 т
142|23.09.2019 16:43:41|Pavel|Я тут с 1 апреля ради эксперимента собрал небольшой портфель бондов, буквально на 200 тысяч. Самый лучший результат на этом отрезке у низкодоходных бумаг, если переводить в проценты годовых
143|23.09.2019 16:44:15|Шура SiberianRanger|Тебе повезло, что это было 1 апреля 2019, а не 1 апреля 2018 
144|23.09.2019 16:44:33|Pavel|Ахахаха, не отрицаю
145|23.09.2019 16:46:19|nik|вроде не было. но я пролетел по времени подачи заявки
146|23.09.2019 16:49:23|Pavel|Самый лучший результат у суборда РСХБ
147|23.09.2019 16:54:48|Maksim|так там и обычная облига норм улетела
148|23.09.2019 17:03:49|Soa|
150|23.09.2019 17:04:59|Harry Lime|Со 112 до 120
151|23.09.2019 17:05:51|Pavel|Да, у меня немного другой с купоном по меньше. Он с 90.5 на 99 ушёл
152|23.09.2019 17:06:01|Soa|за квартал
153|23.09.2019 17:06:02|Pavel|С мая
154|23.09.2019 17:27:46|Alexey|Шнайдер там в контроле
155|23.09.2019 17:27:47|Aleksandr|Внимание ВТБ будет брать заявки на книгу ОБУВЬ  Скрипт не нужен.Трейдер сам найдет параметры выпуска.
156|23.09.2019 17:30:02|Roman|есть разница между тем, чтобы подаваться в книгу 24 или в день размещения брать
157|23.09.2019 17:30:13|Aleksandr|Я незнаю
159|23.09.2019 17:31:18|Roman|Ясно. спасибо большое за информацию
160|23.09.2019 17:35:33|Михаил|Есть два Электрощита, облиги у другого
161|23.09.2019 17:35:38|ТЕХНО Лизинг IR| Размещение второго выпуска облигаций ТЕХНО Лизинг объемом 200 млн. руб.  Завершено   Выпуск размещен за 19 рабочих дней  Купон 13,25.  ISIN RU000A100RS0 Дюрация 2,3 Организатор Иволга Капитал Приобрети ТЕХЛиз 1P2 теперь можно только на вторичном рынке
162|23.09.2019 17:44:01|Sky|Забавно, они гдето заявку на 16 потеряли, удовлетворили только через несколько часов. Много без предзаяв накидали
163|23.09.2019 17:44:15|Aram|Понял. Значит не актуально. Удалил дабы не вводить в заблуждение
164|23.09.2019 17:47:18|Шура SiberianRanger|Да, в 1649 налили 16. Возможно это остатки от тех, кто подавал предварительную заявку через сайт, но не подал заявку через брокера сегодня.
165|23.09.2019 17:50:34|Sky|Я решил наоборот  много заяв на 16 и искали кому отдать  Там как раз во втором пуле тоже на 16 есть. И она такая всего одна.
167|23.09.2019 17:58:42|Aleksandr|БКС ввел Вас в заблуждение . ВТБ будет брать заявки у своих клиентов и да , затем разумеется заявка будет передана БКСу.
168|23.09.2019 18:02:26|Шура SiberianRanger|Картина В ожидании апсайда 
169|23.09.2019 18:05:51|Sky|Сети на жирного апсайда 
171|23.09.2019 18:18:11|Harry Lime|Вечерний дайджест Вложения НПФ в корпоративный долг достигли исторического максимума . На середину года корпоративные облигации занимали в пенсионных накоплениях фондов долю в 51.6 1.4 трлн руб. Во многом переток средств в эти инструменты был обеспечен оттоком вложений из госдолга, который становится все менее привлекательным изза падения доходностей. Ультра зарегистрировала дебютную программу облигаций серии 001Р объемом 500 млн рублей на Московской Бирже. Максимальный срок обращения выпусков в рамках программы  3 года. Компания Ультра занимается оптовой торговлей черными металлами. АЙТИАЙ Коммодитиз 24 сентября начнет размещение коммерческих облигаций серии КОПО2 на 29 млн. Номинальная стоимость одной облигации  10 000. Бумаги размещаются по закрытой подписке, потенциальные приобретатели  DAILY TARGET LP, ITI Funds GP Limited, ITI Fund Management Limited Registered, ITI Trade LTD, IT INVEST FINANCIAL SOLUTIONS CYPRUS LIMITED. Cbonds
172|23.09.2019 18:18:41|Harry Lime|Добавилась Ультра
173|23.09.2019 18:19:31|Alex|Брат юниметрикса
174|23.09.2019 18:19:55|Harry Lime|Не исключено , из Магнитогорска
176|23.09.2019 18:22:51|Maison|Такими темпами нашу песочницу через пару лет будет даже слышно и видно для ЦБ
177|23.09.2019 18:23:28|Harry Lime|200 ярдов структурных облигаций обращается на бирже , конечно нет.
178|23.09.2019 18:24:06|Maison|Ну да...глаза комиссиями наглухо закрыты...
179|23.09.2019 18:29:38|Harry Lime|Спойлер ,там 7080 покупок не от физиков
180|23.09.2019 18:30:12|Maison|Воу...они на столько круты и надежный для институционалов
181|23.09.2019 18:30:33|Harry Lime|Сбер и его НПФ
182|23.09.2019 18:31:33|Maison|Сами у себя
184|23.09.2019 18:32:46|А что ты сделал для котэ!?|Не, пенсионеры у сбера 
185|23.09.2019 18:33:16|Harry Lime|Ага , рейтинг то эмитента ААА , можно брать любую каку
186|23.09.2019 18:34:55|Maison|Даже не думал, что у нас на стоооль ко все глухо
187|23.09.2019 18:36:51|Alexey|Это ноу хау не наших банков и не наших эмитентов 
188|23.09.2019 18:39:37|Harry Lime|Это лучшие мировые практики
189|23.09.2019 18:39:54|Artem|по iti знает кто где посмотреть информацию, куда деньги, что, зачем Второй раз за месяц миллионы миллионов размещают. На сайте брокера глянул, не видно раздела для инвестора и подобных, где посмотреть связь этих контор, да и вообще ясность внести
190|23.09.2019 18:45:32|Kirill Streblyanskiy|Коллеги, отличные новости. Респект ВТБ. БКС за всех брокеров не может говорить, если ВТБ консолидирует заявки от своих клиентов и отправляет в БКС. Завтра будет информация по ставке и дате размещения.
193|23.09.2019 18:47:32|Kirill Streblyanskiy|В размещении будет Z0. А в книгу заявку надо будет ждать исполнения до даты размещения.
195|23.09.2019 18:53:30|Alex Petroff|Исчо раз. Просьба повторить для тех, кто в танке. В день размещения Обуви, 26.09, участники чата могут по Вашему скрипту взять некоторое количество облиг в режиме Z0 Или всетаки заморочиться и завтра пойти на букбулдинг
196|23.09.2019 18:56:41|Kirill Streblyanskiy|Да, конечно. Определенный объем будет предусмотрен для размещения. Если не собираетесь брать прям существенный объем, можно через размещение покупать.
197|23.09.2019 18:58:18|Denis Kozlov Septem|Final notice
198|23.09.2019 18:59:33|Aleksandr|я стесняюсь спросить, существенный  это выше скольки 
199|23.09.2019 18:59:47|Alex Petroff|Существенность объемавопрос оценочный. Комуто существенно 100 лотов, кому 1 тыс., а для кого и 10 тыс. маловато будет. В общем получается можно высоковероятно взять через книгу, либо условновероятно по Z0 в день размещения. И основной вопрос в выборе способа, ответ на который мы не знаем  какой сайз вы оставили на Z0.
200|23.09.2019 19:01:23|Aleksandr|Лучше и не спросиш
