|time|user|text
171|11.01.2019 22:00:51|Дмитрий Адамидов|Сегодня у меня ломбард купили второй выпуск по 102,5. А первый стоит по 104 офер и его тоже ктото взял YTM 10,512. По моему ВДО приказали долго жить по причине отсуствия предложения
173|11.01.2019 22:01:43|Harry Lime|Это в моем плане развития к только к середине 19 года , рано паниковать , рано.
174|11.01.2019 22:01:47|Evgeny|Пока рынок мелкий не особо ликвидно это
175|11.01.2019 22:02:39|Harry Lime|Нет , весь такой фонд может быть миллионов 200 от силы , рублей. Один. И упрется в предложение.
176|11.01.2019 22:03:10|Дмитрий Адамидов|Да паники особой нет. Просто к середине года 3 кварталу вернее вообще все кончатся  кого то погасят когото загонят вверх. 200 млн.  это весь рынок по моему. после такого объема бумаг не останется
177|11.01.2019 22:03:34|Evgeny|И в возможные дефолты, так как эмитентов будет не много
178|11.01.2019 22:04:53|Harry Lime|Ещё в 17м году я запланировал свернуть лавочку к концу 20. Септем и Юнисервис явили год чудес.
180|11.01.2019 22:05:52|Дмитрий Адамидов|вот от такой ситуации и появляются мысли купить финавиа по 5 и ОХ по 0,01 
181|11.01.2019 22:07:03|Harry Lime|Я вижу хорошие покупки в НГХ 4. Мне нравится. Сам стартанул позицию перед новым годом.
182|11.01.2019 22:07:34|Дмитрий Адамидов|я по личным причинам туда лезть не хочу. слишком хорошо знаком с менеджментом
183|11.01.2019 22:08:34|Harry Lime|У меня это тоже будет чтото типа попытка номер пять . Но соблюдая принципы диверсификации...
184|11.01.2019 22:08:47|Evgeny|Лучше купить комодити разные.. зерно там, яблоки. Говорят хорошую доху дает, но рынок специфичный и похоже не для физиков
185|11.01.2019 22:10:27|Harry Lime|Посмотрите видео , где плачет Джеймс Кордье , знаменитый торговец опционами на коммоды. В ноябре дело было.
186|11.01.2019 22:10:38|Дмитрий Адамидов|дай бог чтобы все было норм ... кстати сказать, предпосылки к этому выше чем год назад или два
187|11.01.2019 22:11:36|Harry Lime|Там теперь есть аморт
188|11.01.2019 22:12:53|Дмитрий Адамидов|ну он какойто стремный  потом 70 оставшиеся еще раз продлят. с них станется. это даже более вероятно чем в Геотеке
190|11.01.2019 22:13:54|Harry Lime|Безусловно
192|11.01.2019 22:14:14|Evgeny|Без проигравших не бывает выйгрывших.. я знаю очень удачные примеры за прошлый год одного брокера на европейском рынке, но это его проп и приват крупняка
193|11.01.2019 22:23:48|Дмитрий Адамидов|я бы тоже. но есть Денис Козлов который меня сагитировал
195|11.01.2019 22:25:30|Harry Lime|Где же Касса Бокассы  Я заждался уже.
200|11.01.2019 23:05:45|Harry Lime|Мои префакционные бенчи прекрасно работают , что рублёвый ,что валютный. Но во первых , как жить без денежного потока, с одной выплатой дивов  в РФ в год. Во вторых я не вижу возможности делать там 15 процентов каждый год. В третьих  без новых эмитентов вообще скукота.
211|11.01.2019 23:34:27|Zuev Aleksandr|Ягодами
212|11.01.2019 23:34:55|Harry Lime|Не надо смеяться над чужой бедой.
213|11.01.2019 23:35:50|Zuev Aleksandr|Ну если не будет денег, лучше уж ягоды
215|11.01.2019 23:36:41|Harry Lime|Не будет ни денег , ни ягод , ни фруктов и все это понимают . Кафка с нами.
216|11.01.2019 23:38:28|Zuev Aleksandr|Гарри, про ноту с амер вдо, там тоже будет привязка к страйкам
218|11.01.2019 23:39:26|Harry Lime|Сезон оферт открыл Манимен. Скоро Левенгук  темная лошадка .
221|11.01.2019 23:45:53|Zuev Aleksandr|Валюта 
222|11.01.2019 23:45:56|Harry Lime|Кредитное событие  это также рестракт и кроссдефолт. В случае подобного  нота погасится по 2030 процентов от номинала.
224|11.01.2019 23:47:20|Zuev Aleksandr|А кто эмитент
225|11.01.2019 23:47:31|Harry Lime|Он самый
227|11.01.2019 23:49:31|Zuev Aleksandr|Слишком круто для меня
228|11.01.2019 23:51:38|Harry Lime|Была бы моя воля , я бы взял одного Фрипорта Макморана с дохой 7 , а все остальное пустил под откос. Но пока не готов. Чтобы вернуться к долларовым бондам надо зарезать российские ВДО в портфеле. А это невозможно. Мы ещё не досмотрели спектакль до конца.
233|11.01.2019 23:55:32|Zuev Aleksandr|10 выпуска уже страшновато
234|11.01.2019 23:55:45|Harry Lime|Нет конечно.
236|11.01.2019 23:56:40|Zuev Aleksandr|Через стакан даже 2 выпуска сложно будет сдать за день
237|11.01.2019 23:57:09|Harry Lime|Ломбард2 500 за два дня без проблем
238|11.01.2019 23:57:24|Zuev Aleksandr|Мне мсб нравится
239|11.01.2019 23:57:34|Harry Lime|Мне тоже
240|11.01.2019 23:57:37|Zuev Aleksandr|А если кипиш
241|11.01.2019 23:58:05|Oleg Egorov|Интересно, какой купон Левенгук поставит, 14 
242|11.01.2019 23:58:11|Harry Lime|Сижу до погашения , а если кипиш в бумаге все , заперли.
244|11.01.2019 23:59:54|Zuev Aleksandr|Когото в рсхб заперли
246|12.01.2019 00:00:18|Harry Lime|Это уже замуровали , а не заперли.
247|12.01.2019 00:01:33|Pavel Bilenko|в процессе...
248|12.01.2019 00:02:02|Zuev Aleksandr|Интересно
250|12.01.2019 00:02:51|Pavel Bilenko|пока да
251|12.01.2019 00:08:00|Zuev Aleksandr|На какие объемы рассчитываете
253|12.01.2019 00:29:39|Антон|У них оферта в марте этого года, а далее тока погашение в далёкомпредалёком 2027 году .... 15 на 8 лет .... Сомнительно
254|12.01.2019 00:30:55|Harry Lime|Могут на год установить купон , это допускается
255|12.01.2019 00:31:39|Антон|А, точно, извиняюсь Можно ж каждый год, и менять его ... Точняк
258|12.01.2019 00:34:13|Harry Lime|Лучше ВЭБ 23 в евро у нас в РФ, с вычетом на владение
259|12.01.2019 00:34:29|Антон|Saxobank
262|12.01.2019 00:36:22|Harry Lime|Через внебиржу пошукать Вэб23 через персонального брокера. На полтос вам точно найдут , в том же Открытии. Так же получите вычет.
263|12.01.2019 00:37:00|Антон|Какой купон у этого бонда 
265|12.01.2019 00:37:13|Harry Lime|4,03
266|12.01.2019 00:37:49|Антон|Понял. Лучше синтетикой такую доху в евро получить, через своп евробакса, т.к. выбор бумаг в долларах много шире
267|12.01.2019 00:38:07|Harry Lime|Думаю да
268|12.01.2019 00:38:10|Антон|Щас разница в ставках скока, процента 2,8 примерно 
270|12.01.2019 00:38:52|Harry Lime|Да лучше на ликвид типа рус 28 , чтобы не заморачиваться
271|12.01.2019 00:38:57|Замполит Aleks Kib|5,942
272|12.01.2019 00:39:14|Антон|Согласен
273|12.01.2019 00:39:31|Harry Lime|Мы про другого зверя , который в евро
274|12.01.2019 00:40:11|Антон|Да, кстати, даже через рублёвые инструменты и своп еврорубль можно свободно выйти на 3,54 в евро
277|12.01.2019 00:41:06|Harry Lime|Обсуждали многократно  пока лучшая идея своп и рус28.
278|12.01.2019 00:41:15|Антон|
281|12.01.2019 00:44:00|Harry Lime|А не проще наоборот , открыть счёт здесь и закидывать туда.
282|12.01.2019 00:44:50|Антон|Нет В том то вся фишка, что нужно именно направление счёт в европе, но с доступом к торгам в РФ
284|12.01.2019 00:46:28|Harry Lime|По моему проще обзвонить брокеров здесь , думаю ВТБ или Открытие есть , вопрос где Лондон , Франкфурт и берут ли они физиков.
285|12.01.2019 00:46:32|Замполит Aleks Kib|У меня есть евро несколько тонн, решаю со сроком на 23 года  1 либо через Квик eur/usd поменять на  и купить евробонды долларовые наших корпоратов, 2 часть поменять на рубли  и в ВДО прикупить новых выпусков и спекулятивно сдать часть на приросте 1,52,8, остальные оставить на купоны, 3 купить евробонды в Евро. Гарри, похоже, посоветует вариант 1
286|12.01.2019 00:47:00|Harry Lime|Открыть счёт в РФ у брокера в РФ. Заводить туда деньги в евро , дальше по желанию .
287|12.01.2019 00:47:36|Антон|Понял. Не, надо на загнивающем западе
289|12.01.2019 00:50:41|Harry Lime|Я посоветую держать кэш. Бондов ликвидных в евро нет , значит можно зависнуть надолго. А диверсификация нужна.
290|12.01.2019 00:50:51|Замполит Aleks Kib|Про своп вообще не знаю и не задумывался. ОК
293|12.01.2019 00:53:13|Антон|Я имею ввиду, что ты продаёшь евро за рубль на споте, на рубли покупаешь ВДО или что ты планируешь. А чтобы закрыть валютный риск, ты покупаешь фьюч на евро за рубли. И каждый раз, при скором наступлении срока его экспирации, переносишь дальше. Плата за эту операцию  разница в процентных ставках между евро и рублями. Сейчас примерно 7,58 точно не скажу, в понедельник надо глянуть
294|12.01.2019 00:53:45|Замполит Aleks Kib|ОК, взял на заметку
295|12.01.2019 00:53:50|Антон|ВДО  13, цена фьюча  8. Разница 5  твоя доходность в евро
296|12.01.2019 00:54:34|Harry Lime|Это отличная модель , только поощряет развитие финансовой грамотности.
297|12.01.2019 00:54:54|Замполит Aleks Kib|Господа, хороших выходных
298|12.01.2019 00:55:10|Антон|Именно для подобной хренотени мне нужен брок в европе с доступом на мосбиржу
299|12.01.2019 01:00:38|Leo|Как это квази гос Госа там 100 . Флк наследие 90х, немного другая иитория всё таки...
300|12.01.2019 01:01:02|Дмитрий Адамидов|но по обязательствам гос гарантии нет
303|12.01.2019 01:13:29|Leo|Конечно, первыми в надёжности стоят офз, потом уже все остальные структуры с госучастием. Но по мне так в текущей ситуации и до сих пор государство спасает и вэб и втб перпеты спасёт если что.
304|12.01.2019 01:14:33|Дмитрий Адамидов|ВЭБ и ВТБ  все же фигуры другого калибра совершенно.
306|12.01.2019 01:15:44|Leo|Просто флк немного не тот пример для сравнения. Однако тёмные времена могут наступить. При этом все повалится, и ВДО в том числе, вопрос же в вероятносим и доходности на риск
307|12.01.2019 01:15:45|Дмитрий Адамидов|в общем мне данный эмитент не очень нравится. да и дороговат пока
309|12.01.2019 01:17:01|Leo|Согласен, но весь лмзинговый бизнес ждут перемены
310|12.01.2019 01:17:04|Дмитрий Адамидов|Есть ИФК, который тоже слегка дефолтнул в прошлом году. Хотя не в пример более аккуратный.
313|12.01.2019 01:20:10|Leo|Я рассуждаю так, что сейчас банкротство любой структуры со 100 госом невозможно по политическим соображениям
314|12.01.2019 01:21:43|Дмитрий Адамидов|так не будет банкротства  будет рестракт жесткий. по типу Пересвета или Ютейра.
318|12.01.2019 08:23:36|Harry Lime|Спросите своего брокера , скорее всего это будет чистый убыток , так как займ будет 14 процентов годовых , а доходность субфедов 8910.
319|12.01.2019 08:44:23|Harry Lime|Можно занять в валюте и принять валютный риск или заходить в ВДО с доходностью больше кредита. Но это для сильных духом.
321|12.01.2019 09:09:17|Alex|Займ только залоговый имхо, под квартиру. Процентов 1012 дадут.
322|12.01.2019 09:51:17|А что ты сделал для котэ!?|Наблюдение от Романа Некрасова  ФБ . Про РУБЛЬ . Похоже, что физиков на следующей неделе повезут на маржинколлы по доллару США. Очень серьезный дисбаланс в открытых позициях. Физические лица на Московской бирже активно набирают длинные позиции по доллару США. Увидим повторение рождественской истории, произошедшей в нефти. Нет повести печальнее на свете, чем физик, встающий против тренда. Остап Ибрагимович назвал бы биржу 401м честным способом отъема денег у населения .
323|12.01.2019 09:58:09|Harry Lime|Всегда число шортов юриков превышает число лонгов физиков , лет пять такое наблюдаю в разных инструментах  это не позиция по доллару , а фьючи. Автор неожиданно прозрел. Поздравляю его.
324|12.01.2019 11:10:59|Harry Lime|Могут
325|12.01.2019 11:30:20|Kir|В псб 12.65 за лонги
326|12.01.2019 11:36:03|Котофей|А где более предметно можно узнать про торговлю фьючерсами Чтото типа фьючерсы для начинающих
327|12.01.2019 11:38:19|Harry Lime|Здесь точно нет
338|12.01.2019 11:49:33|Alexey Z|Что за массовые наплывы новых пользователей
344|12.01.2019 11:59:18|Олег Вечхайзер|Витаминиз...ВДОизация становится популярной, хотя больше похоже на нашествие спамботов. Имена  как на столбах с телефонами
345|12.01.2019 12:00:50|Alexey Z|Раньше вроде в этой группе боты не замечались. Популярность растёт. Но имена у ботов как на подбор  только женские 
350|12.01.2019 12:22:41|Harry Lime|Отчаянные домохозяйки потянулись в ВДО
352|12.01.2019 12:26:28|Марина|Не боты мы Просто на одном из сайтов продекламировали ваш чат
353|12.01.2019 12:28:34|Олег Вечхайзер|Да, раскройте сайт, может и нам для раскрутки своих проектов пригодится. 
354|12.01.2019 12:29:39|Harry Lime|Здесь недавно были замечены мужики с большим депо...
355|12.01.2019 12:30:46|Alex S|добавьте еще не женатых тут столько домохозяек сбежится 
356|12.01.2019 12:33:22|Сергей|Только бы не с сайта знакомств
358|12.01.2019 12:37:48|Alexey Z|Ну с простыми вопросами поможем Гарри 
359|12.01.2019 12:38:56|Svyatoslav Lebedev|
362|12.01.2019 12:41:15|Harry Lime|Я с первого дня моего пребывания здесь решил , что сделаю все для того , чтобы здесь царили добро , взаимопомощь и взаимовыручка. Не будет никакого снобизма. Мне кажется все у нас получается.
365|12.01.2019 12:43:43|Alexey Z|Нужны FAQ с ответами на простые вопросы, выложенный на сайте. И на него давать ссылку.
367|12.01.2019 12:46:28|Svyatoslav Lebedev|Девушки Если что, это мы так встречаем от смущения и радости Не снобим и не издеваемся
368|12.01.2019 12:51:04|Alexey Z|В телеграмме явно нужна капча я не бот
370|12.01.2019 12:53:09|Анастасия К|Я не бот по рекомендации
371|12.01.2019 12:55:21|Ksenia Lyalikova|Парни, среди международный финансовых аудиторов число женщин значительно выше, так что не переживайте за нас, мы справимся
372|12.01.2019 12:56:01|Alexey Z|Никогда такого не видел, может предложить patsak9876 прикрутить такой к чату
373|12.01.2019 12:56:17|Svyatoslav Lebedev|Пошло встречное внедрение.
374|12.01.2019 12:57:40|А что ты сделал для котэ!?|А что за чат
377|12.01.2019 13:06:02|Сергей|Как много женщин интересуются инвестированием
378|12.01.2019 13:06:44|Ksenia Lyalikova|Ну если международный аудит и операционистка в банке  это для Вас едино, то да будет так мы непротив С удовольствием почитаем умные мысли умной половины человечества а вдруг...
379|12.01.2019 13:07:01|А что ты сделал для котэ!?|Да у меня 15летняя дочь блондинка  и та заинтересовалась 
380|12.01.2019 13:09:06|Alexey Z|Если тот чат закрытый и там все после обучения, то отлично, значит подготовленная аудитория  будут новые идеи, есть чему поучиться
382|12.01.2019 13:10:20|Svyatoslav Lebedev|
384|12.01.2019 13:10:36|А что ты сделал для котэ!?|Нет, у нее есть личный консультант
385|12.01.2019 13:10:58|Harry Lime|Это так , в большой четверке, например
386|12.01.2019 13:11:26|Сергей|Ну и здорово же
387|12.01.2019 13:13:10|Svyatoslav Lebedev|Да, знаю я работал в Андерсене и Делойте, да и до сих пор с бывшими коллегами общаюсь.
389|12.01.2019 13:14:14|Harry Lime|Андерсен , это который того после Энрона , круто
390|12.01.2019 13:14:34|А что ты сделал для котэ!?|На самом деле этому предшествовал долгий процесс постепенного вовлечения ребенка в финансы Но в целом да, я рад
391|12.01.2019 13:15:50|Harry Lime|Это название компанииразработчика Терминатора из фильма.
393|12.01.2019 13:16:57|Svyatoslav Lebedev|Который до Энрона Здесь отвечу неточной цитатой прайсовского партнера своим коллегам прошу вас остановиться в своих шутках над Андерсен, так как это могло произойти в любой компании
394|12.01.2019 13:18:14|Harry Lime|Ладно , один раз про сказки Андерсена , и баста.
395|12.01.2019 13:19:34|Svyatoslav Lebedev|Andersen forever  и по домам
403|12.01.2019 13:54:26|Svyatoslav Lebedev|Denis , а Вы не могли бы узнать у Трейдберри, собираются ли они апдейтить свой сайт В списке/перечне партнеров не указаны Перекрёсток и Мираторг, но там их продукция продаётся. Зато указана Азбука Вкуса, но там их продукции нет. При этом на карте Где купить по Москве Перекрёстки указаны, Азбука Вкуса  слава богу  нет, Мираторг  нет. Сайт вроде хороший, но складывается впечатление, что его апдейтили годдругой назад. Както неправильно это для будущего эмитента.
406|12.01.2019 14:16:49|Дмитрий Адамидов|Это надо скачать самому набор эмодзиина телефон. К чату такое не прикручивается
407|12.01.2019 14:20:37|Alexey Z|Я имел в виду, чтото, что могло бы при присоединению к чату интерактивно отсекать ботов. Но я не знаю, бывает ли такое в Телеграм.
408|12.01.2019 14:20:55|Надежда Che|И я не бот
409|12.01.2019 14:21:04|Дмитрий Адамидов|Всех вновь прибывших  категорически приветствую. У нас тут были почти одни мужчины но народ интеллигеный. Если что не понятно  спрашивайте , не стесняйтесь
410|12.01.2019 14:21:45|Zuev Aleksandr|Надо организовать встречу в реальном секторе с таким наплывом девушек
411|12.01.2019 14:22:49|Ольга|Какое интересное предложение
414|12.01.2019 14:25:41|Мария|Не боты мыыыы, сами пришли Это ещё только начало, всего пару часов от опубликования ссылки прошло В ближайшие дня два ждите пополнения 
416|12.01.2019 14:26:51|Надежда Che|Мы все исключительно по делу, если что Так что ведите себя как раньше
418|12.01.2019 14:29:30|Zuev Aleksandr|Как раньше уже не будет
419|12.01.2019 14:29:40|Alex|Я извиняюсь, по какому делу
420|12.01.2019 14:30:59|Oleg Egorov|Может, ликвидность ВДО увеличится
