|time|user|text
391|08.03.2020 21:17:02|MММ🥕🐹|Производителей протезов 
392|08.03.2020 21:17:20|İldar Rafikov|Ну Ломбарды и МФО будут востребованы
393|08.03.2020 21:17:32|Soa|Если к маю рассосется то все воспрянут и ЦБ пролжит музыку
394|08.03.2020 21:17:38|İldar Rafikov|Лизинг возможно
395|08.03.2020 21:18:11|Soa|ну он станет в чем то выгодней приобретения в собственность
396|08.03.2020 21:18:34|А что ты сделал для котэ!?|Лизинг с валютной закупкой и российской выручкой
397|08.03.2020 21:18:40|Soa|Скажем так..акции Лукойла могут немного припасть на днях
398|08.03.2020 21:18:51|İldar Rafikov|Вообще ВДО это не большой бизнес. Макроэкономика до него ещё не скоро докатится
399|08.03.2020 21:19:14|Soa|Нас же волнуют только наши дефолты..
400|08.03.2020 21:19:27|Андрей ☭ Емельянов|Просядет вместе со спросом на товары, получаемые в лизинг
401|08.03.2020 21:19:42|İldar Rafikov|Думаю, что год можно не дёргаться. Если КС не дернут на верх
403|08.03.2020 21:20:13|Soa|Народ, да вы что уже похоронили экономику А если завтра Америка в небеса
405|08.03.2020 22:15:04|İldar Rafikov| потребитель россия Мужчины взяли на подарки к 8 марта на 4 больше микрозаймов, чем год назад  Юником24  РИА
406|08.03.2020 22:15:40|İldar Rafikov|Плюсик в карму МФО
407|08.03.2020 22:23:21|Harry Lime|Проблема решается глубоким ресерчем и аллокацией по конкретному эмитенту , если я уверен в погашении  можно покупать и по 100 и по 80 и по 50.
408|08.03.2020 22:24:21|MММ🥕🐹| но спекульнуть на фриках и панике тоже не грех 
409|08.03.2020 22:25:09|Mikhail Gashnikov|Почему Конечно люди брать будут больше, но ведь и невозврата будет больше гораздо
410|08.03.2020 22:25:45|Harry Lime|Ломбарду пофиг , у него золото в залоге в основном
412|08.03.2020 22:55:49|Dmitry K|Мфо первой руки  это примерно первая пятерка по размеру
413|08.03.2020 22:59:04|Alex Petroff|Вы про Сбер и ВТБ
414|08.03.2020 22:59:05|Alexey|Это как сорты навоза. Там тоже есть градация
415|08.03.2020 23:07:35|Harry Lime|Если просрочка условно у 50 в топовых МФО против 90 трэшняке , то база первых кужа более качественная , а у вторых нет шансов
416|08.03.2020 23:08:24|А что ты сделал для котэ!?|А кто топовые мфо
417|08.03.2020 23:09:33|Harry Lime|Ну топ 10 по Эксперт РА  Миг , Манимен , Кармани, Быстроденьги , Арифметика  ОР  , знакомые все лица
418|08.03.2020 23:13:23|Eugeni Schukin|Гарри, а как же все остальные  типа Кузин, ИТЦ Трейда, шаверм и прочего  с ними опа будет 
419|08.03.2020 23:15:21|Denis Zimin|Почему с ними должна опа быть
421|08.03.2020 23:16:24|Eugeni Schukin|по сути, я придерживаюсь мнения, что наши ВДО  на внутренний рынок ориентированы и слабо зависят от политических условий. Компании, как работали, так и работают. Тот же таксовичков, как возил людей, так и будет. Ну да, временно, люди будут экономить и спрос на такси снизится. Шаверму как будут есть, так и будут и про пироженки Денис прав.
422|08.03.2020 23:21:46|Harry Lime|Очень сильно зависит от конкретного эмитента , поэтому не надо покупать все подряд , что подешевело
423|08.03.2020 23:38:25|Eugeni Schukin|а если куплено , как у меня  у меня около 30 эмитентов. с одной стороны, я понимаю, что все восстановится и будет нормально, а с другой, вдруг за этот период ктото почувствует себя плохо  вот и выбор стоит, выходить таки в кеш и закрыть монитор 
424|08.03.2020 23:39:05|А что ты сделал для котэ!?|Замените или на и 
425|08.03.2020 23:40:06|Eugeni Schukin|точно 
426|08.03.2020 23:51:10|Harry Lime|Ну почувствует плохо , вы же осознанно шли в ВДО , посмотрим отчетность по году везде и секвестр
429|09.03.2020 00:23:17|İldar Rafikov| бонды корпораты нефтянка макро warning рынки пузыри кризис Deutsche один из самых страшных графиков для финансового сектора сегодня  кредитный рынок США вырос с 2трлн в 2008г до 7трлн в 2020г. Один из наибольших вкладов в этот рост внесли корпбонды с рейтингом BBB. Падение экономики США в рецессию  огромная масса ВВВ может потерять свой рейтинг и превратиться мусорные бонды  катастрофа.   нам пишут  BIS предупреждает  Deutsche об этом же  Gundlach об этом же  Goldman gross and net leverage surpassed their previous peaks in the early 2000s  корпоративный leverage в США и Европе  Gundlach Corporate Bonds Could Be a Repeat of the SubPrime Crisis  колво корпоративных эмитентов бондов с рейтингом BBB  соотношение корпоративного долга к ВВП в США  исторически рекордные уровни
430|09.03.2020 00:23:34|İldar Rafikov|Что то это мне напоминает песочницу
431|09.03.2020 00:25:02|Дмитрий Адамидов|ну это нормально  на выдавали займов кому ни попадя. у них же нет комитета по листингу Мосбиржи
433|09.03.2020 00:26:50|İldar Rafikov|
436|09.03.2020 01:08:04|İldar Rafikov|Ну да, у наших то рейтингов нет. И отбирать нечего
437|09.03.2020 01:08:58|Andrey|Просто мордой в грязь.
439|09.03.2020 01:16:35|Diz|На нефть гляньте
440|09.03.2020 01:16:59|Alexey|Не надо
441|09.03.2020 01:17:07|Diz|Ага
442|09.03.2020 01:17:33|RR ll LL|На сбере ещё можно по 70,75 купить 
443|09.03.2020 01:22:17|Soa|
444|09.03.2020 01:22:22|Andrey|https//ru.investing.com/commodities/brentoil
445|09.03.2020 01:22:51|Soa|ну вот..уже отрастает
449|09.03.2020 07:23:48|Владимир Парцей|Именно. У меня 2000 бумаг
450|09.03.2020 07:24:26|Reed👁 👁Avery|Уже нет
451|09.03.2020 07:34:47|Corax|Что с нефтью происходит
452|09.03.2020 07:35:40|Reed👁 👁Avery|Песец
455|09.03.2020 07:38:01|Corax|Минус 30, чтото я такого не припоминаю. Надо ставку ЦБ задирать
456|09.03.2020 07:38:49|Reed👁 👁Avery|нефть Воскресная новость 1
457|09.03.2020 07:38:52|Тим Тим|Доллар  71 рублей Евро  80 рублей Дно  не предел.
458|09.03.2020 07:39:42|Corax|А что у нас на рынке завтра будет
459|09.03.2020 07:41:26|Reed👁 👁Avery|Зависит от сегодня. Должно быть много заявлений и новостей
460|09.03.2020 07:41:42|Alexey|https//www.moex.com/a775
461|09.03.2020 07:42:28|Reed👁 👁Avery|Но рубль упал лишь на 10, а значит фонда может ещё на 20 наверное вальнуться
462|09.03.2020 07:44:16|Тим Тим|Дед сказал топить будем доллар
463|09.03.2020 07:54:09|Reed👁 👁Avery|А получилось топить будем рублями
466|09.03.2020 07:57:48|Тим Тим|А я репу чешу придержать фиат или в лонг уже лезть.
467|09.03.2020 07:58:28|Reed👁 👁Avery|Частями
469|09.03.2020 08:30:16|Снежко Сергей|Посмотрим завтра устоит ли вдошная скала при таком шторме
472|09.03.2020 09:14:53|Sergey S|О,святая простота...кажется,я начинаю понимать  просто наверно есть инвесторы,которые ДОЛЖНЫ потерять деньги,и никто их не сможет уберечь
474|09.03.2020 09:31:58|Sanek|присоединяюсь к вопросу
475|09.03.2020 09:33:33|S.P.|полагаю имелось в виду что народ пытается покупать в момент падающих ножей, и не видел ещё на практике как падали рынки в 2008 или 2014 году
478|09.03.2020 09:34:34|Владимир Тутынин|Эпидемия Короносечина пройдет и будем думать.
479|09.03.2020 09:34:45|Sergey S|Ну, примерно так
480|09.03.2020 09:35:27|Corax|На каких уровнях покупать большой вопрос, посмотрите графики офз 2008  2014 годов
481|09.03.2020 09:39:02|S.P.|Я думаю сейчас самое время переоценить риски и посмотреть какие эмитенты выиграют от курса доллара, а какие пострадают от текущей ситуации
482|09.03.2020 09:39:43|İldar Rafikov|Главное не паниковать, не сливать бумаги. Дефолты из за обвала нефти маловероятны. Просто упадет тело бонда, купоны ни кто не отменял. Если кс поднимут, то налога 35 не будет. Тоже не большой плюсик.
483|09.03.2020 09:41:46|Елена Филякина|Какой из дедов
484|09.03.2020 09:42:34|İldar Rafikov|На рынке ВДО вроде нет участников ВЭД. Дома строить не перестанут, значит стройка, лизинг, Криал и пр. останутся в деле. МФО и Ломбарды увеличат оборот
489|09.03.2020 09:45:27|S.P.|Уровень нефти говорит что в стране начинается рецессия. Рецессия означает что у народа не остается денег. Нет денегне покупают товары длительного пользования. Так что по моводу квартир не был бы столь оптимистичным обувь россии. В основном зааязаны на импорт
490|09.03.2020 09:46:15|Ghisler|Стройка первая схлопнется
491|09.03.2020 09:46:24|S.P.|Лизинги ещё
493|09.03.2020 09:56:03|İldar Rafikov|Пока ставка низкая шанс есть
494|09.03.2020 09:57:38|S.P.|В мск 50
496|09.03.2020 09:59:41|Alex Petroff|Кто не хочет обсуждать бонды и околобондовые темы и хочет поармагеддонить  проследуйте в Друзя. Не внявшим просьбе будет предоставлена прекрасная возможность развивать навыки чтения на неделю. Пока страсти не улягутся.
497|09.03.2020 09:59:52|Alexey Vishnyakov|Кстати об орехах  да  у них основа, это импорт и расфасовка в РФ. При падение курса рубля им придётся поднимать цены.
499|09.03.2020 10:01:24|İldar Rafikov|Вроде всё про них родных
500|09.03.2020 10:01:59|MММ🥕🐹|Размещения временно отменят  до апреля 
501|09.03.2020 10:02:58|Alexey Vishnyakov|Денис благоразумно не объявлял ни дату, ни ставку по РКС.
502|09.03.2020 10:04:35|MММ🥕🐹|Денис может ехать отдыхать в отпуск на пару неделек  это самое лучшее сейчас 
503|09.03.2020 10:05:03|Alexey Vishnyakov|С другой стороны шаурму расхватали. Но там всего 50 миллионов. Интереснее всего, как пойдёт Шевченко 2 и Калита...
504|09.03.2020 10:06:04|İldar Rafikov|Всё тормознут скорее всего
505|09.03.2020 10:06:25|Harry Lime|Под 18 я возьму
506|09.03.2020 10:06:27|MММ🥕🐹|Шаурма как бы тоже уже под вопросом 
507|09.03.2020 10:06:42|Sergey S|Просто не успели во время разместиться.теперь волосы на себе рвать будут
508|09.03.2020 10:06:59|Aleksandr|Шевченко боюсь пока никуда не идет.Хотя Иволге видней
509|09.03.2020 10:07:03|MММ🥕🐹|Маловато будет 
510|09.03.2020 10:07:54|Alexey Vishnyakov|Ну это верно, если так. Сейчас не лучшее время.
511|09.03.2020 10:08:15|Harry Lime|У мамы Шевченко я так понял кусок валютного долга остался . RIP.
513|09.03.2020 10:08:55|MММ🥕🐹|Кал ищет друзей  таких же вечных размещенцев 
514|09.03.2020 10:11:15|Alexey Vishnyakov|Кот  безусловно. Но чем конкретно в этом случае
515|09.03.2020 10:12:06|Harry Lime|Вышел из Шевченко на последних минутах пятницы ...
516|09.03.2020 10:12:36|А что ты сделал для котэ!?|Коллеги, думаю во вторник лучше вообще ничего не делать в ВДО Продавать на шухере смысле нет Докупаться  мы не знаем позицию ЦБ по ставк, будет повышать или нет. Точно понижать уже не будет Проще посмотреть с забора на ситуацию и что то делать уже в средучетверг
517|09.03.2020 10:20:42|MММ🥕🐹|Очень хотелось бы увидеть 20 доху завтра  почему бы и нет 
519|09.03.2020 10:35:30|Dmitry K|Купите Дэни, сможете ее каждый день видеть
520|09.03.2020 10:36:55|Alex|У шевча валютная выручка на 80
521|09.03.2020 10:38:04|MММ🥕🐹|Уже есть 
522|09.03.2020 10:45:04|Harry Lime|Ну тогда ОК
524|09.03.2020 11:34:31|Alex Petroff|Напоминаю друзья. Но видимо в пустоту.
526|09.03.2020 11:54:08|IURII D.|ЗОЛОТЫЕ СЛОВА 
527|09.03.2020 11:55:30|Sergey S|Это вам не акции  просела/ выросла. Подобные вещи в концеконцов отражаются на платежеспособности эмитентов, в том числе вдо. Можно жить в розовых очках, и думать, что вдо существуют в отрыве от остальной экономики, но это не так. Если кто сможет сделать грамотный анализ, увидит что гдето значительно выросла вероятность дефолта  и продаст именно по этой причине, это будет в высшей степени правильно
528|09.03.2020 12:00:16|Дмитрий Адамидов|В друзя идите акции обсуждать плиз
530|09.03.2020 12:22:36|Alex Petroff|Вы прекрасно поняли о чем я написал. Будете философствовать и полемизировать на эту тему под разными углами и через призмы разных взаимосвязей, формулировать умные мысли и капитаноочевиднеть, перекрою газ и вам.
531|09.03.2020 12:25:07|Aleksei Tuv|Не услышат завтра лить будут
532|09.03.2020 12:26:11|Dmitry Manzor|Ниже сотки
533|09.03.2020 12:26:22|Aleksandr|да
534|09.03.2020 12:26:29|Aleksei Tuv|Легко
535|09.03.2020 12:26:37|Dmitry Manzor|Печаль
536|09.03.2020 12:26:45|Aleksei Tuv|Я офз буду покупать
537|09.03.2020 12:32:01|Alex Petroff|Ок. Чат заразился паниковирусом. Меры по раздаче бана на неделю не помогают. Срок бана увеличивается на месяц. Карантин. Писать про бонды попрежнему можно и нужно.
538|09.03.2020 12:35:47|MММ🥕🐹|Повангую Размещений до апреля не будет 
543|09.03.2020 12:49:26|Aleksei Zzzz|А кто твёрдо знает, что если в букбилдинг вписался, то отказаться уже никак, не так ли
544|09.03.2020 12:56:24|Alexey|Так, тут помню был кто то с псб перпом. Все думали жаль если погасят. Расслабляемся
545|09.03.2020 13:19:17|А что ты сделал для котэ!?|Поздно
547|09.03.2020 13:20:57|Harry Lime|Черная метка от Юнисервиса гарантирована , у меня сумма некритична , кто набирал 3х сам виноват
549|09.03.2020 13:24:38|Aleksandr|Иволга ваще мочит за слив в стакан после покупки на первичке 
550|09.03.2020 13:26:11|Harry Lime|Все это правильно , я все равно считаю ВДОшников более грамотными в среднем по рынку и психологически устойчивыми людьми , прорвемся
551|09.03.2020 13:27:49|Soa|Выкупаем проливы солидарно
552|09.03.2020 13:28:51|Harry Lime|Я точно буду в паре эмитентов
553|09.03.2020 13:28:56|Aleksandr|Еще бы орги догадались выйти со своим видением стресссценария для каждого из эмитентов. Дабы отсечь от слива ту часть инвесторов которая не паникует, а просто заблуждается в прогнозе.
554|09.03.2020 13:29:46|Capricious|Ломбард 
555|09.03.2020 13:30:17|Soa|А вот и проверим на тухлость..
556|09.03.2020 13:30:19|Harry Lime|У меня его много , там коллеги патрулируют
558|09.03.2020 13:34:07|Aleksandr|Речь не о глупости. Ну кто толком понимает как влияет курс валюты на Шевча А насколько это критично для Обуви
559|09.03.2020 13:41:56|Aleksei Tuv|Завтра увидим
561|09.03.2020 13:52:43|Евгений Коломна|Эх, знать бы в каких ВДО сети ставить, когда принудительно плечевиков завтра закрывать будут, проколы до 60 в какихто стаканах должны быть
562|09.03.2020 13:52:59|Alex Petroff|Первый месячный бан таки выдан.
563|09.03.2020 13:56:24|Harry Lime|Септем тоже сначала сделал , потом об,явил
566|09.03.2020 14:06:28|Alex Petroff|Давайте уже лучше увидим Rus28 завтра по 140
567|09.03.2020 14:06:31|Дмитрий Адамидов|Сланцы интересно
572|09.03.2020 14:19:14|Алексей Чернушевич|Вопрос  займётся ли Трамп протекционизмом для них И получится ли у него, если да
573|09.03.2020 14:26:46|Denis Kozlov Septem|Думаю, я сам решу, когда мне ехать в отпуск
575|09.03.2020 14:28:37|MММ🥕🐹|Это отлично Осталось совсем мелочь  решить вопрос со ставкой РКС и узнаете ответ разместится он или нет 
576|09.03.2020 14:28:42|Alexey|Денис, в такие моменты просто слова боюсь так себе смотрятся. Завтра будете защищать эмитентов в стаканах
578|09.03.2020 14:34:30|Denis Kozlov Septem|У вас есть какоето предложение
579|09.03.2020 14:34:55|Sergey S|А при чем здесь нагнетание Я написал как есть  они не разместились во время. Месяц назад разместиться им было бы куда проще, чем сейчас
580|09.03.2020 14:37:09|Denis Kozlov Septem|Вы позволяете себе несколько неуместные эпистолярные вольности типа будут волосы на себе рвать. Это неприемлемо. Всё по плану. Для размещения РКС текущая ситуация не является катастрофой. Разруха в головах, а не в клозетах
581|09.03.2020 14:38:16|Alexey|Заливать панические продажи несоразмерные общему падению
584|09.03.2020 14:39:21|Denis Kozlov Septem|Это не так делается. Мы не при коммунизме живем
585|09.03.2020 14:41:10|Alexey|Причем тут коммунизм. Эмитент выкупит свой долг с дисконтом большим чем заложит широкий рынок чем резко снизит бремя долгов
587|09.03.2020 14:42:21|MММ🥕🐹|Метод Дэнни по поддержанию упавших штанов пойдёт в массы 
588|09.03.2020 14:42:31|Denis Kozlov Septem|Эмитент не может выкупать свой долг. Он должен объявить оферту
589|09.03.2020 14:42:52|Alexey|Денис Мы тут все же не совсем дети Или не все
590|09.03.2020 14:43:04|Denis Kozlov Septem|К моменту проведения оферты котировки уже выправятся
592|09.03.2020 14:44:35|Alexey|Ладно. Завтра и далее узнаем кто плавал не совсем одетым
593|09.03.2020 14:45:29|Светлана|Сколько времени нужно ,чтоб котировки были на минимуме для принятия решения эмитентом об оферте неделя/месяц/квартал/полгодаесть какойто ориентир
594|09.03.2020 14:45:31|А что ты сделал для котэ!?|Денис, аффилированная с эмитентом компания может легально выкупать
595|09.03.2020 14:47:23|Denis Kozlov Septem|Нет правил на этот счет.
596|09.03.2020 14:47:40|Dmitry Manzor|
598|09.03.2020 14:48:12|Denis Kozlov Septem|Тогда у нее должны быть свои деньги, а не кредит от эмитента на выкуп этих облигаций. Иначе это схема.
599|09.03.2020 14:49:17|Евгений Коломна|Добрый день, Денис Котировки КО в Янго будут какимлибо образом поддерживаться
600|09.03.2020 14:50:00|Denis Kozlov Septem|Котировки КО поддерживаются спросом и предложением самих инвесторов.
603|09.03.2020 14:52:45|Soa|сейчас хорошее время что бы купить..в КО дисконт может быть знатный.
604|09.03.2020 14:56:42|Sergey S|Знаете, мне иногда интересно с кемто вступить в острую дискуссию, но никак не в это раз с вами. Не заинтриговали, не смогли, так сказать, вывести из себя. В следующий раз старайтесь лучше.
605|09.03.2020 14:56:58|Евгений Коломна|Спасибо намерений сбрасивать КО не было, но на душе стало спокойнее
