|time|user|text
166|15.06.2018 09:51:36|Harry Lime|СТАВКА ЦБ сегодня в 1330мск основные ожидания, что оставят без изменений. 1500 мск  прессконференция Набиуллиной. После 1800 мск  ЦБР опубликует доклад о ДКП и обновленные экономические прозы
167|15.06.2018 09:51:57|Harry Lime|Мне больше эта картинка нравится , не в бровь , а в глаз
169|15.06.2018 10:49:07|Alex Petroff|Под 7  только если у ЦБ
170|15.06.2018 10:49:42|Harry Lime|Так я про него родимого и говорю.
173|15.06.2018 10:51:29|Harry Lime|Дедолларизация в понимании скажем ВТБ  это собрать все доллары у населения. У ЦБ я так понимаю примерно те же идеи.
176|15.06.2018 10:54:10|Сергей Ковалев|интересно, какая цена продажи будет
177|15.06.2018 10:55:11|Sergey|Лучше сегодня брать или на след.неделе тоже возможности будут
179|15.06.2018 10:57:17|Harry Lime|Я думаю такая вероятность есть по Ломастеру.
181|15.06.2018 13:35:46|Harry Lime|Спасибо тете Эле , большие купоны по свежим бондам рулят.
182|15.06.2018 15:29:21|Oleg Lvov|Мне кажется, здесь трехходовочко может быть. 1 Плодим ВЭБы, лизинги, квазигосагентства и госкорпорации. 2 Эти квазимоды набирают в долг в валюте ОВП держим резервами ЦБ/МФ, которые постоянно увеличиваем. 3 Клиентела с визгом и делёжкой распиливает долги на цифровизацию, импортозамещение, мосты на Сахалин. А когда начинаются дефолты, цб и мф затыкают дыры валютными запасами. Запасы сформированы из сырьевой рентычиновники в такой 3ходовке со всеми поделились, везде один безриск. МВФ хвалит, бумажки летают, бабло моется. Те, кому хочется, даже имеют возможность стрелять на Украине, в Сирии и в Средней Азии. Я открыл вечный двигатель Правда, санкции сломали двигатель.
183|15.06.2018 15:31:07|Harry Lime|Рояль пока в кустах
184|15.06.2018 15:31:51|Сергей Ковалев|рикто не хочет продавать
185|15.06.2018 15:33:38|Alex Petroff|Со 102 начнут в понедельник
186|15.06.2018 15:34:29|Harry Lime|Да ладно
187|15.06.2018 15:36:51|Giovanni Goudini|Вы про лом
188|15.06.2018 15:37:14|Alex Petroff|Про Роялькапиталь
190|15.06.2018 16:07:47|Giovanni Goudini|Лом, рояль и грузовик я реальный бондовик
191|15.06.2018 16:28:00|Alex Petroff|Неплохо летим...ОФЗ 26221 уже можно по 100.75 взять...
192|15.06.2018 16:38:44|Harry Lime|Денис , ждём Роял сегодня 
193|15.06.2018 17:08:22|Alex Petroff|Тяпница расходимся
194|15.06.2018 17:10:40|Denis Kozlov Septem|К сожалению, нет. Начнем торги в понедельник.
195|15.06.2018 17:59:43|Oleg Lvov|Тёплых выходных всем... мой герой старик Трамп думает о помиловании старины МИЛКЕНА Если это состоится на следующей развиртуализации надо будет приподнять стакан за короля джанков
196|15.06.2018 18:05:08|Сергей Ковалев|печаль, я думал уже сегодня Рояль купить
197|15.06.2018 18:07:27|Denis Kozlov Septem|Мы тоже на это рассчитывали. В понедельник всё будет 
198|15.06.2018 18:09:04|Сергей Ковалев|жду
200|15.06.2018 18:09:47|Harry Lime|Вы заметили , как в чате написали , все поснимали заявки сразу.
201|15.06.2018 18:11:10|Сергей Ковалев|треть заяаок снялась только
202|15.06.2018 18:12:04|Harry Lime|ЛоМастер так может не успеть в июне.
203|15.06.2018 18:15:12|Сергей Ковалев|я кстати увидел таксовичкоф и грузовичкоф в Питере, у них хорошо запоминающиеся логотип, и не навящивый.
204|15.06.2018 18:16:55|Harry Lime|ЛоМастер будет ли 19 , вот вопрос  Если нет лучше увеличить аллокацию по Роялу.
205|15.06.2018 18:24:01|Alex Petroff|На рынках какието ужасы ужасные творятся, а мы тут шаурмой балуемся...
206|15.06.2018 18:24:30|Сергей Ковалев|офз долгосрояные просели...
207|15.06.2018 18:24:40|Harry Lime|Хорошо жить в грязи на дне
208|15.06.2018 18:24:43|Сергей Ковалев|хорошо что я их продад
209|15.06.2018 18:24:57|Дмитрий Адамидов|да, нам эти просадки вообще как кино про другую планету
210|15.06.2018 18:31:36|Konstantin Permyakov|Я докупил сбербанк
211|15.06.2018 18:31:58|Сергей Ковалев|префы
212|15.06.2018 18:32:24|Denis Kozlov Septem|Гдето в параллельной вселенной Роял Капитал разместился
213|15.06.2018 18:35:22|Harry Lime|А в нашей то вселенной завершили размещение
214|15.06.2018 18:49:50|Konstantin Permyakov|Да
215|15.06.2018 18:51:40|Denis Kozlov Septem|Нет. В понедельник закончим
216|15.06.2018 19:02:27|Harry Lime|А в продажу поставите с открытия или после обеда
217|15.06.2018 19:41:05|Nikolay Pavlov|А он в тюрьме
218|15.06.2018 19:41:34|Harry Lime|Нет
219|15.06.2018 19:42:06|Oleg Lvov|Нет Но как бы пятно на репе Ещё Ванечку Боски не забыть, и всёТрамп спелся с русскими трейлерами 
220|15.06.2018 19:43:27|Harry Lime|Кстати мне кажется , но директор Ломастера внешне очень похож на Милкена. Посмотрите в презентации на досуге.
222|15.06.2018 21:55:11|Konstantin Permyakov|Не нагнетай
224|16.06.2018 00:41:52|Sergei|В последние два дня СМИ пишут, что налоговая вотвот начнёт автоматически следить за всеми операциями по картам россиян и требовать объяснений каждого перевода. Но вообщето всё не так vc.ru/40031
225|16.06.2018 10:21:21|Иг|Всем привет, что скажите
227|16.06.2018 10:23:40|J T|Не маловато предложили
228|16.06.2018 10:25:01|Alex Petroff|А вам надо чтоб 10  в у.е. купон был
229|16.06.2018 11:00:16|J T|Понимаете, у меня долги...
230|16.06.2018 11:09:02|Giovanni Goudini|Систему 19 с 12 к погашению никто брать не хотел
232|16.06.2018 11:29:38|Alex Petroff|А она уже того...погасилась Я просто в дороге, не посмотреть...
234|16.06.2018 11:33:59|Giovanni Goudini|19 же
235|16.06.2018 11:33:59|Alex Petroff|Средняя продолжительность жизни мужчин по отдельным регионам
236|16.06.2018 11:34:17|Giovanni Goudini|Прямо намёк на 19 год
237|16.06.2018 11:34:36|Alex Petroff|Да понял затупил
238|16.06.2018 11:36:51|А что ты сделал для котэ!?|Чо все так изза этих пенсийтвопят Все равно пенсия будет нищенская И какая разница в какое время на нее НЕ выходить  в 60 или 65 Один хрен, работать всю жизнь надо будет  и это я спокойно воспринимаю
239|16.06.2018 11:41:19|Harry Lime|Про ГТЛК получили полную экспертную сатисфакцию на встрече , кратко  на 15 лет под 6 процентов  кукан. Лучше короткие Bin 19 или Sistema 19 . А там уже ещё 5 рэйт хайков и дохи под 810 процентов по новым бумагам.
240|16.06.2018 11:55:49|А что ты сделал для котэ!?|Система 19  это валюта
241|16.06.2018 11:56:08|Harry Lime|Да , мы ж евробонды обсуждаем.
244|16.06.2018 12:10:11|Giovanni Goudini|Какая разница у кого занимать
245|16.06.2018 12:13:38|Harry Lime|ГТЛК отказались сами весной , посчитали , что 5,55  это очень много , хотели меньше 5 , про политику ФРС не слышали видимо.
247|16.06.2018 12:41:19|Giovanni Goudini|То для своих
248|16.06.2018 12:42:57|Harry Lime|Потом ГТЛК выпустил гордый прессрелиз , что там зашло почти шесть десятков физиков , суммами до 150 млн
249|16.06.2018 12:55:28|Giovanni Goudini|Для своих тобишь
250|16.06.2018 12:56:25|Harry Lime|Прям совсем для своих , не маскировались даже. А потом стали по рынку занимать.
251|16.06.2018 12:57:48|Giovanni Goudini|Значит верят в то, что 10 в РФ это норма
254|16.06.2018 12:58:51|Harry Lime|Я был и в 3 и в 4 ГТЛК.
257|16.06.2018 13:20:43|Giovanni Goudini|Изза повышения ставки фрс
259|16.06.2018 13:55:11|Harry Lime|4,9
260|16.06.2018 15:24:40|J T|коллеги, такой вопрос. среди нас же нет скальперов и интрадейщиков ну почти. Но может у когонибудь есть выходы на какието групповые чаты или форумы скальперов и роботорговцев Очень нужно услышать их мнение по одному вопросу
262|16.06.2018 15:28:19|Alex Petroff|Я сидел на форексе почти 2 года. Очень даже интрадей. Редко переносил позиции, иначе свопы отрицательные кусали меня положительные тоже были. Вопрос в личку. Если знаю, отвечу.
263|16.06.2018 15:28:45|J T|я скорее мосбиржу имел ввиду
268|16.06.2018 15:40:34|Alex Petroff|В указанных условиях целесообразно интрадеить в индексах. Си, Ри, РТС и т.д. Вам в ветку Романа Андреева. Зарегайтесь на срачлабе. Он толково пишет и всегда отвечает. Они интрадеят неплохо. Все сделки и прогнозы прямо в чате.
269|16.06.2018 15:41:07|J T|спасибо. а почему думаешь, что именно в индексах
270|16.06.2018 15:41:45|Alex Petroff|Волатильность дневная позволяет без плеч брать свое и комиссии отдавать безболезненно.
271|16.06.2018 15:42:10|J T|логично
272|16.06.2018 15:42:36|Alex Petroff|Там почти все без плеч сидят. ТА много. Нетнет инасайд бывает.
273|16.06.2018 15:42:55|А что ты сделал для котэ!?|investideibot Есть идеи и по бондам Неоднозначные, но почитать интересно
274|16.06.2018 15:43:18|J T|да не, мне не торговать, мне скорее предоставить площадку для безкомиссионной торговли
276|16.06.2018 15:46:01|Alex Petroff|Мне бонды пока по сравнению с форексом представляются таким тихим болотцем хотелось бы и дальше так
277|16.06.2018 22:15:22|Aleksandr|Я интрадею. Ручками. Акции и облигации. Плачу около 30 штук комиссии в месяц в среднем. Пытался договориться с брокером на фикс комиссию. Сказали, что оборот маловат. Тему больше не поднимал.
280|16.06.2018 22:37:17|J T|Привет Спасибо за ответ, можно пару вопросов в личку
282|18.06.2018 10:14:26|Sergey|Рояль 101.5 200 заявок на продажу
283|18.06.2018 10:14:47|Harry Lime|Всех гонють в ПЮДМ.
284|18.06.2018 10:15:56|Sergey|Точно
285|18.06.2018 10:16:58|Harry Lime|У меня есть чувство , что это не позиция Септема. Подождем.
286|18.06.2018 10:18:07|Sergey|Думаете повкуснее цены будут
287|18.06.2018 10:18:25|Harry Lime|Если они не будут , я буду в другой бумаге.
288|18.06.2018 10:19:03|Alex Petroff|Аналогично
289|18.06.2018 10:22:00|AngelicScale|Так Денис же вроде говорил, что размещать планируют с небольшой премией
290|18.06.2018 10:23:20|Harry Lime|Ну так давайте коллективно спросим , какова она , небольшая премия
292|18.06.2018 10:30:43|Alex Petroff|Обещал по 100.25. Пока ждем.
293|18.06.2018 10:35:05|Denis Kozlov Septem|Коллеги, размещение Роял завершено. В Yango бумаги появятся после 1800. В стакане уже встали те, кто купил на первичке.
294|18.06.2018 10:36:36|Sergey|Денис, есть ли шанс увидеть цены 100.25 и ниже
295|18.06.2018 10:36:54|Denis Kozlov Septem|Ниже точно нет
297|18.06.2018 10:45:07|Harry Lime|Ок, так будет продажа своих бумаг через стакан или все ушло на клиентов Вцелом и так увидим в течение дня, но всётаки.
298|18.06.2018 10:47:31|Alex Petroff|Да и продаван на 200 лотов всего...куцо както...ждать надо.
299|18.06.2018 10:56:03|Harry Lime|В 101 вливают легко. Постою до вечера с премией , надеюсь до ПЮДМа не доведут.
300|18.06.2018 12:13:10|Harry Lime|Спасибо, все что хотел купил
301|18.06.2018 12:13:28|Denis Kozlov Septem|Хорошо
302|18.06.2018 12:39:53|Евгений Коломна|Спасибо, други, за рояль неожиданно налили
303|18.06.2018 13:11:32|Denis Kozlov Septem|Какаято фигня в Левенгуке. 107,67 6 доха
304|18.06.2018 13:12:56|Harry Lime|Кнопки ктото перепутал или их покупает Гугл.
305|18.06.2018 13:13:56|Morkoy|А объем то какой 
306|18.06.2018 13:15:13|Denis Kozlov Septem|2,5 млн руб за неделю прошло
309|18.06.2018 13:17:46|Harry Lime|Готовятся к следующему купону после оферты 1314 я думаю , может и меньше.
310|18.06.2018 13:41:27|Дмитрий Адамидов|продали все микроскопы
311|18.06.2018 13:49:34|Harry Lime|У меня чтото БКСный квик лег.
312|18.06.2018 14:42:23|Sergey|В АПРИ появился крупный покупатель по 108.15
313|18.06.2018 14:49:56|Alex Petroff|Не вижу
315|18.06.2018 14:52:21|Harry Lime|Можно выйти , кто слаб духом, не самый плохой вариант , перед купоном могут быть горки.
316|18.06.2018 14:56:30|Александр|Не думаю, что возникнут проблемы с купоном. Тут даже не надо быть крепким парнем, чтобы их держать
317|18.06.2018 14:57:43|Harry Lime|Проблемы могут быть с погашением.
318|18.06.2018 14:58:07|Denis Kozlov Septem|В чате есть владельцы АПРИ
319|18.06.2018 14:58:57|Harry Lime|В смысле бумаг
320|18.06.2018 14:59:46|Alex Petroff|Владельцы облиг есть. Владельцы АПРИ врядли
321|18.06.2018 14:59:50|Harry Lime|Тогда я например.
322|18.06.2018 15:42:05|Konstantin Permyakov|И я
323|18.06.2018 15:42:57|Александр|Мсье прощупывает почву
324|18.06.2018 15:44:52|Alex Petroff|И у мну тож
325|18.06.2018 15:44:58|Kir|Выкуплен флай уже крупный это сколько
327|18.06.2018 16:37:56|Harry Lime|О Мастер 25 уже размещение , а каков ориентир по купону На Русбондсе не написали .
328|18.06.2018 16:50:42|Alex Petroff|О... СМ5 и 6 уже по 9495
329|18.06.2018 17:00:53|Harry Lime|Давно, подбирается к первому таргету 15 процентов дохи.
330|18.06.2018 17:05:14|Kir|Можно брать или еще рано
331|18.06.2018 17:05:31|Harry Lime|Я в сентябре
332|18.06.2018 17:15:19|Denis Kozlov Septem|Прощупываю для чего
333|18.06.2018 17:17:41|Harry Lime|Денис , какой купон будет у Ломастера, ориентиров не указали на Русбондсе
334|18.06.2018 17:26:58|Denis Kozlov Septem|Ориентир 1819. Завтра начнем собирать предварительные заявки
335|18.06.2018 18:04:13|Сергей Ковалев|я взял Рояль
338|18.06.2018 18:17:44|Giovanni Goudini|Господа, кто в тебе, на валютные бонды эмиссии 20172019 годов действуют новые налоговые правила
339|18.06.2018 18:21:53|Alex Petroff|1. Торговые терки между пиндосами и др. 2. Цикличность в рынках ам. акции. Дикий перегрев. Скоро на юг. 3. Что касается России нерезы уходят из ОФЗ. 4. Наибулина тоже.
341|18.06.2018 18:22:34|Alex Petroff|USD/RUB daily. Пробитый вверх треугольник, отмеренный ход 65.566р, хорошо бьется с разгромом ОФЗ finascop
342|18.06.2018 18:28:19|Harry Lime|Будет 65 , и 66 тоже.
343|18.06.2018 18:29:37|Giovanni Goudini|вопрос времени
345|18.06.2018 18:43:09|Oleg Lvov|Имеет ли смысл брать по нынешним 22го ОПЕК, опять же Минфин может перестать скупать две недели..
346|18.06.2018 18:44:35|Harry Lime|Я набрал в первом квартале , рупь в Роял и ЛоМастер, там ему самое место.
347|18.06.2018 18:54:01|Дмитрий Адамидов|Мущщины, я не понимаю панических настроений по рублю. Если Минфин в апреле продал трежерей на 48 млрд. и еще с рынка пропылесосил за апрельмайиюнь десятчоку, то у него их почти 60 млрд. сейчас. В ОФЗ нерезиденты набрали 35 ну даже если 40. Это все совершенно спокойно может быть погашено безо всякого влияня на курс и даже еще останется. Другое дело  чуть чуть накуканить интуристов, чтобы вышли не по 55, а по 63  это я понимаю. Видимо затем доллар и держат так высоко. Но как только нерезиденты в основе своей выйдут, я думаю доллар пойдет вниз. Ведь продажа тержерей  это еще и следствие того, что в долларе размещать российским резидентам просто уже невозможно ничего пусть и по политическим причинам
349|18.06.2018 18:55:15|Harry Lime|Да я и не паникую, до 70 для исполнения бюджета вполне нормально.
351|18.06.2018 18:58:01|Дмитрий Адамидов|ну пока нет силовых машин надо же себя чемто занять
352|18.06.2018 19:02:59|Harry Lime|Будем надеяться , что рестракта рестракта не будет , но и небываемое бывает. Основной долг однозначно будет реструктуризирован, он огромен.
353|18.06.2018 19:04:50|Nikolay Pavlov|А Морган Стенли шортил бакс по отношению к рублю 
354|18.06.2018 19:05:23|Harry Lime|А Альфа наоборот.
355|18.06.2018 19:06:08|Дмитрий Адамидов|Да это нормально  я думаю, трейдер или начальник отдела сам решет что делать. Ошибся  так перевернется.
357|18.06.2018 19:37:43|Oleg Lvov|Некоторые клевещут, что Кобинет накопил уже 2.1 трлн. просто как текущий резерв, даже не оформленный никаким способом. Лежит на счете в ЦБ и всё. Судя по венесуэльским делам, до сентября, в высокий сезон за федеральный общак можно не волноваться. Если ещё Иран, то так шоколадно не было никогдаувидим по фактическому исполнению от Минфина за 6 мес. Трудно представить курс по 61, но в начале года и Сбер по 206 никто не видел .
358|18.06.2018 20:30:26|Konstantin Permyakov|Кстати по трежерям есть у меня мнение, что это Донни за твиттер. Как бы по майской статистике все или почти все назад не выкупили
359|18.06.2018 20:47:14|Konstantin Permyakov|Он кстати опять твиттер рвёт. На этот раз про мигрантов
360|18.06.2018 20:51:36|Harry Lime|А тем временем Маск с Теслой идёт на перехай , рисуется тройная вершина , на двойной шортистов уже поджарили.
362|18.06.2018 20:53:50|Дмитрий Адамидов|Не исключено. Ибо неясно куда вообще эти деньги делись.
363|18.06.2018 20:54:27|Harry Lime|Наби купила бондов Теслы например.
364|18.06.2018 20:54:55|Дмитрий Адамидов|Вот этого я и боюсь
366|18.06.2018 20:55:22|Harry Lime|Шок это понашему
367|18.06.2018 20:55:31|Дмитрий Адамидов|Их просто столько нет
369|18.06.2018 20:56:19|Harry Lime|Ростех покупает Теслу.
371|18.06.2018 20:56:59|Дмитрий Адамидов|Ужасы нашего городка
372|18.06.2018 20:57:57|Harry Lime|Пусть Saxo bank отдохнёт со своими черными прогнозами.
373|18.06.2018 20:58:04|Дмитрий Адамидов|
374|18.06.2018 21:06:25|Oleg Lvov|Пусть лучше Убер купит  один vc пузырь купит другой vc пузырь. Интересно, сколько лет должно пройтименьше 5 или больше 5 пока водятлы поймут что fully autonomous driving, за которое с них взяли 5000, не будет 
375|18.06.2018 21:07:21|Harry Lime|Я не удивлюсь если Тесла дойдет до 400, там бешеный хайп.
377|18.06.2018 22:31:41|Giovanni Goudini|Мавроди уделал всех по хайпу
378|18.06.2018 23:24:09|Denis Kozlov Septem|Вот я же говорю, надо брать золото в слиточках
