|time|user|text
1|06.09.2018 14:09:17|Harry Lime|Не невероятно.
8|06.09.2018 14:19:42|Konstantin Permyakov|В акциях сегодня новатек обошёл по капитализации Газпром
9|06.09.2018 14:21:07|Harry Lime|Безусловно
11|06.09.2018 14:39:07|Иг|Вэб в рублях 9 дает руки чешется
13|06.09.2018 15:09:11|Alex Petroff|Там же лот от 100к, если не ошибаюсь
14|06.09.2018 15:10:33|Шура SiberianRanger|Косарик
15|06.09.2018 15:13:46|Harry Lime|Ну так как она выше номинала намного то сейчас стоит около 1600 юсд  нкд.
16|06.09.2018 15:14:32|А что ты сделал для котэ!?|Как она называется, эта бумага
17|06.09.2018 15:15:02|Harry Lime|Rus28
18|06.09.2018 15:29:21|Harry Lime|РОССИЯ  БОНДЫ доходности по 10тилеткам бондырф
19|06.09.2018 15:29:47|Harry Lime|Жара начинается от уровня около 10. Недалеко осталось.
20|06.09.2018 15:30:01|Alexander Kozhevnikov|копим кэш
21|06.09.2018 15:30:09|Harry Lime|Безусловно
22|06.09.2018 15:30:36|Иг|Как думаете где остановка
23|06.09.2018 15:32:48|Harry Lime|По графику я бы сказал , что пока сейчас , закрыли гэп от декабря 2016.
24|06.09.2018 15:33:32|ААА|Все больше выпусков выползают за 9.
25|06.09.2018 15:35:14|Harry Lime|Предположу два варианта  поход на 9,5 и стабилизация или откат до 8,5 . Но на санкциях в космац.
26|06.09.2018 15:35:26|А что ты сделал для котэ!?|Странно, натcbonds ее нашёл, а на АльфаДирект  нет Она для каково
27|06.09.2018 15:35:42|Harry Lime|Для всех
28|06.09.2018 15:38:26|Иг|На санкциях это будет в виде прокола наверно, как 9.04. Вот там рус 28 и надо ловить, а вот вопрос если все же закончиться просто пуганием
29|06.09.2018 15:43:05|Harry Lime|Турция и Аргентина ходили до 9 . Можем повторить.
30|06.09.2018 15:44:36|Иг|Боюсь у нас свой путь, санкционный, и возможно уйдем ниже
31|06.09.2018 15:49:19|Harry Lime|Ну это всётаки суверенный госдолг, с нашим уровнем ЗВР риски невелики.
33|06.09.2018 15:59:49|А что ты сделал для котэ!?|Выяснилось, что через альфа директ Rus 28 модно толькотс голоса купить
35|06.09.2018 16:02:22|Harry Lime|Я сейчас не помню точно , считал давно ,навскидку 8,5 кажется
36|06.09.2018 16:04:22|Alexander Balezin|http//rusbonds.ru/BondCalc.aspxbond_stateMarketampftid6044ampBondCalcDate06.09.2018ampbondCalcRate0ampbondCalcType0ampPrice_Type0ampPrice_Clear140ampPrice_Full0ampYield_Type0ampYield_10
39|06.09.2018 16:06:08|Harry Lime|Ну поход на 120  это вообще атас , 2008й год.
40|06.09.2018 16:07:27|Иг|12,75 делим на цену входа доходность. Если с плечем в валюте 4 репо то до 10 легко с мин риском
41|06.09.2018 16:12:06|Harry Lime|Другое дело , что после санкций курс доллара вероятно скакнет , а потом скорректирутется, вопрос насколько скакнет и где заляжет. Просто я к тому, что можно не получить кайфа от отсутствия переоценки , если заходить в момент шухера  бакс очевидно будет на хаях.
42|06.09.2018 16:12:36|Alex Petroff|Сбер на месте, РГБИ на месте почти, долларий к другим валютам тоже на месте почти...а врубель полетел кудато...
43|06.09.2018 16:13:38|Harry Lime|Евро выше 80 , жесть
44|06.09.2018 16:13:42|Иг|Да рашу брать надо на старые баксы
46|06.09.2018 16:17:54|Harry Lime|Рост доллара усилился до 10 копеек в минуту.
47|06.09.2018 16:18:55|А что ты сделал для котэ!?|Мне кажется в момент гузкой надо конвертировать баксы в рубли и покупать ОФЗ с дохой 10 А потом, через годдва обратно в баксы
48|06.09.2018 16:19:59|Harry Lime|Как вариант.
50|06.09.2018 16:21:54|А что ты сделал для котэ!?|Причин для серьезного ослабления рубля в долгосрочной перспективе нет  Орешкин rub
51|06.09.2018 16:22:10|Harry Lime|Написанному верить
52|06.09.2018 16:22:48|А что ты сделал для котэ!?|Посмотри натпрогноз рос официалов и сделай наоборот
55|06.09.2018 16:25:46|Harry Lime|Если действительно начнется удушение роста цен через Магнит это будет вообще пипец.
56|06.09.2018 16:26:13|Иг|Это как
57|06.09.2018 16:27:02|Harry Lime|Госмагазин с госценами.
59|06.09.2018 16:31:06|Иг|Как раз желание пробать сбер в убыток...
61|06.09.2018 16:34:13|А что ты сделал для котэ!?|На полшишечки 
62|06.09.2018 16:39:11|Alexander Kozhevnikov|Рисковый 
64|06.09.2018 16:49:37|Ivan Shirokov|Друзья, почему все так резво выходят из ОФЗ Боятся массовых невыплат
66|06.09.2018 16:49:56|Ivan Shirokov|Ещё в начале недели ЦБ сообщил о резком скачке ставок по депозитам. Max ставка в банках топ10 подскочила с 6.319 до 6.559. Похоже, и банкиры уже не сомневаются в повышении ключевой ставки ЦБ
67|06.09.2018 16:50:27|Harry Lime|Не , боятся , что биды исчезнут в стаканах и разверзнется ад.
68|06.09.2018 16:51:03|А что ты сделал для котэ!?|По баксу  согласен с Арикапитал Доходности ликвидных длинных ОФЗ 26207, 26212 сегодня превысили 9. Рост доходности ОФЗ не является изолированным случаем то же самое и даже хуже происходит в большинстве emerging markets. Если в августе инвесторы сокращали позиции в облигациях emerging markets примерно в соответствии с их кредитным качеством, то в последние 12 недели распродажи стали носить массовый характер. Например, резко выросли доходности локальных облигаций Индонезии, которая не имеет крупных макроэкономических дисбалансов и ранее была относительно изолированной от кризиса в Аргентине и Турции, а также никак не подвержена теме санкций. Снижение рынка ОФЗ вызвано внешними факторами в большей степени, чем возможными санкциями США. Это негативно тем, что в случае ограничений на покупки нерезидентами, российские гос. облигации могут дополнительно просесть в цене. Но и при благоприятном исходе не стоит ожидать чего то большего, чем краткосрочного роста котировок на 12 по наиболее длинным выпускам. Давление на emerging markets до конца года будет только нарастать. 26 сентября ФРС повысит ставку, с 1 октября объём сокращения баланса выйдет на максимальную мощность 50 млрд. в месяц, а ЕЦБ вдвое сократит покупки с 30 до 15 млрд. в месяц.
70|06.09.2018 16:53:26|Ivan Shirokov|Благодарю
71|06.09.2018 16:55:40|Alexander Kozhevnikov|надо было в моменте иглы по десятилетке закупаться фьючами на бакс 
72|06.09.2018 16:56:42|А что ты сделал для котэ!?|А в чем разница между покупкой доллара и фьючерсы на доллар
73|06.09.2018 16:57:20|Alexander Kozhevnikov|объем
74|06.09.2018 16:57:35|А что ты сделал для котэ!?|Не понял
75|06.09.2018 16:57:48|Alexander Kozhevnikov|берем 70к на налик ты купишь только 1000 баксов
83|06.09.2018 17:24:52|Иг|Их раскулачат белоусовы у нас эк законы и частная собственность только для народа
85|06.09.2018 17:27:36|Alex Petroff|Жесть
86|06.09.2018 17:27:36|Alex Petroff|USDRUB если тупо по учебнику  длину консолидации проэцируем вверх и получаем минимальный таргет...  НЕ Орешкин rub
87|06.09.2018 17:40:46|Alex Petroff|Косвенное техническое подтверждение если Сбер обновит августовский лой...даже не хочу об этом думать...Реалии будут иными. А орешкину плакат с этими словами на долгую память подарить с датой.
88|06.09.2018 17:51:02|Иг|Пока дед срым не отдаст будут душить
89|06.09.2018 17:52:10|ААА|А вы думаете, что если его отдать чтото изменится
90|06.09.2018 17:52:43|Иг|Да С этого все началось, ему скучно стало, вот и влез
91|06.09.2018 17:52:47|ААА|Когда тебя бьют нужно бить в ответ, а не вторую щеку подставлять.
92|06.09.2018 17:52:59|0xBADC0FFE|Деда бы отдать вместе с крымом
93|06.09.2018 17:54:09|А что ты сделал для котэ!?|Какой смысл обсуждать вещи, на которые мы никак не можем повлиять Крым никто никогда не отдаст. А если РФ будет доведена до состояния, когда его придется отдать  о фондовых рынках сможете смело забыть
94|06.09.2018 17:55:50|Иг|Согласен, просто, иногда тошнит от бессилия власти в такие дни, только воровать ума хватает
95|06.09.2018 17:57:49|ААА|Даже о бессилии можно было бы говорить, если бы чтото пытались делать. А так, у них то все в порядке.
96|06.09.2018 18:08:00|Harry Lime|Рубль отравился Новичком Доллар взлетел до максимума за 2,5 года Евро превысил 80 рублей на фоне панической распродажи российского госдолга. https//ift.tt/2NSmDnX
97|06.09.2018 18:08:32|Harry Lime|Искусство названий от Финанц
98|06.09.2018 18:08:33|А что ты сделал для котэ!?|Неужели доллар 70 пробьет
99|06.09.2018 18:08:57|А что ты сделал для котэ!?|Британская пресса сегодня
100|06.09.2018 18:11:16|ААА|Reds under the bed.
104|06.09.2018 18:14:43|Евгений|Таймс, Гардиан, Дейлингмэйл... Желтуха, ага. Никто не поверит 
105|06.09.2018 18:15:19|ААА|Я про газету с заголовком, который я озвучил.
106|06.09.2018 18:16:41|Евгений|А, вы про ту что в левом верхнем углу... Эта да, както сомнительно смотрится
107|06.09.2018 18:17:17|ААА|Ну да, чтото развлекательное для масс, уровня передач Малахова.
108|06.09.2018 18:17:56|Deleted Account|Сан и дэйли мэйл желтуха не меньше
109|06.09.2018 18:17:58|А что ты сделал для котэ!?|Вот я не понял  слив изз скрипаля, изза кибератак конгресса США или прсто накипело
110|06.09.2018 18:19:32|Евгений|ОФЗ напугали всех
112|06.09.2018 18:19:53|ААА|Ближний фьюч сишки уже 69700.
113|06.09.2018 18:23:46|А что ты сделал для котэ!?|Комментарии Минфина и ЦБ в очередной раз стали причиной падения рубля. Курс доллара превысил 69,4 руб. Ну не умеют большие чины в России делать вербальные интервенции. То, что российскому ЦБ лучше молчать что он в принципе и делал, когда все ждали сигналов, мы поняли в далеком 2014 году, а сейчас мы стали свидетелями, что и у Минфина большие проблемы с отработкой реакций. У Минфина нет опыта деликатного общения с рынком, и рынок знает, что Минфин не умеет деликатно общаться. Когда замминистра финансов Владимир Колычев заявляет о готовности к экстремальному сценарию, инвесторы понимают  экстремальный сценарий на пороге. А почему так Потому что Минфин, ровно как ЦБ, на протяжении долгих месяцев просто отмахивался от вопросов, упорно утверждая все хорошо, прекрасная маркиза. Резко меняете пластинку господа. Ждем доллар по 75 рублей.
114|06.09.2018 18:32:30|Евгений|Сенат США вещает о санкциях против России обсуждение типа сейчас.
115|06.09.2018 18:32:42|Евгений|Сейчас еще подсыпят...
116|06.09.2018 18:33:43|ААА|Как неожиданно прям перед обсуждением Сайлент ассассинов Путина нашли.
117|06.09.2018 18:33:59|Harry Lime|РОССИЯ  ВНЕШНИЕ ЗАИМСТВОВАНИЯ 2018 РФ вряд ли вернется на внешний рынок заимствований в 2018 г, в дальнейшем будет оценивать конъюнктуру  Силуанов заимствованиярф
118|06.09.2018 18:34:30|Harry Lime|В переводе  больше евробондов не будет.
119|06.09.2018 18:39:46|D G|Ну что .. будем девал джанками отбивать
121|06.09.2018 18:46:01|Harry Lime|Судя по динамике курса к 72 должны уложиться
122|06.09.2018 18:48:10|Harry Lime|ОФЗ  МИНФИН Минфину не нужны дорогие заимствования, последний аукцион ОФЗ https//t.me/markettwits/15850 это показал  Силуанов офз
123|06.09.2018 18:48:36|Harry Lime|В переводе  и аукционов ОФЗ тоже не будет
124|06.09.2018 18:48:48|Евгений|Рабочий день только начался. Завтра будем отыгрывать все что они скажут
127|06.09.2018 18:49:14|ААА|Еще есть вечерняя сессия.
128|06.09.2018 18:49:20|D G|
129|06.09.2018 18:49:52|ААА|Продать РТС или купить Си можно практически в любое время дня и ночи.
130|06.09.2018 18:50:53|Harry Lime|Не хочу загадывать , но наши адрки совсем неплохо смотрятся на рынке США сейчас. Ну нет продаж в пол.
131|06.09.2018 18:51:22|D G|Мне вот не понятно молчание ЦБ, вроде как уже пора или как в прошлый раз действия были правильными, но запоздалыми
133|06.09.2018 18:53:34|Иг|Элька без деда не делает ни чего компетенций нет
134|06.09.2018 18:53:47|А что ты сделал для котэ!?|Нашим терять один хрен нечего  все равно за химоружие будут наказывать
135|06.09.2018 18:54:11|D G|А вроде пока не нашли же..
136|06.09.2018 18:54:25|Harry Lime|У Саддама тоже не нашли
137|06.09.2018 18:54:35|А что ты сделал для котэ!?|Кк не нашли Новичок
139|06.09.2018 18:55:28|Harry Lime|Ехал Путин с проблесковым маячком. А врагов в тылу травили новичком.
140|06.09.2018 19:04:17|Alexander Kozhevnikov|коллеги, а у нас же фьюч на еврорубль существует можете подсказать по памяти
141|06.09.2018 19:04:28|ААА|Да.
143|06.09.2018 19:06:44|Alexander Kozhevnikov|спасибо
144|06.09.2018 19:09:14|D G|САНКЦИИ  РОССИЯ  ОБСУЖДЕНИЕ по сегодняшнему обсуждению в Сенате https//t.me/markettwits/15987 1 Разбили олигархов РФ на хороших и плохих. Хорошие, те кто заработал свое состояние в 1990ые  в том числе Дерипаска и Вексельберг. Плохие, те кто стал олигархом благодаря Путину. 2 говорили про санкции на новые выпуски ОФЗ 3 почти ничего не сказали про банки РФ КОНСЕНСУС в конце обсуждения 1 сильнее давить на плохих олигархов 2 склоняются к санкциям на новые выпуски ОФЗ 3 про банки пока ничего санкциироссия
145|06.09.2018 19:10:05|Harry Lime|Чувак продавший с утра ОФЗ в 3 все знал
146|06.09.2018 19:13:18|ААА|Но ведь если нельзя будет купить новые офз, нужно как можно быстрее накупить офз сейчас.
148|06.09.2018 19:15:23|Harry Lime|ОФЗ становятся токсичными , из них нерезиденты будут выходить в любом случае , наши попытаются их опустить по цене и по курсу выхода.
149|06.09.2018 19:18:23|Евгений|Еще как есть. Бои за Идлиб, даже без инцидентов с хим оружием  гуманитарная катастрофа. Туда боевиков годами свозили, сейчас им уже некуда деться. Даже по сравнению с Алеппо бои будут гораздо ожесточеннее. Натуральный Сталинград получится, притом там живет 3 млн. человек. Мировое сообщество просто офигеет от толп беженцев и количества жертв. При этом Минообороны РФ будет делать покерфейс и говорить что все норм, пилоты работают точно по головам боевиков, мирных жертв нет. За такую жесть отдельных санкций подсыпят, не говоря уже о риске прямого вмешательства Коалиции в эту битву.
151|06.09.2018 19:26:34|Дмитрий Адамидов|Санкций подсыпят вне зависимости.
153|06.09.2018 19:28:01|ААА|Завтра люди начнут идти в обменники.
154|06.09.2018 19:29:06|Alexander Kozhevnikov|и будут ждать доллар по сто
155|06.09.2018 19:33:54|Евгений|Какой смысл вводить санкции просто так Это же потеря денег, потеря рейтинга
157|06.09.2018 19:35:39|ААА|Так рейтинг наоборот вверх же.
162|06.09.2018 19:37:48|ААА|Среди них нет тех офз, которые от базовой ставки пляшут
163|06.09.2018 19:38:09|Сергей Ковалев|есть
164|06.09.2018 19:38:52|Дмитрий Адамидов|Такой же как торговую войну Трампу устраивать сразу со всеми. Другая логика тут работает проблемы индейцев то есть бизнеса уже мало кого волнуют.
165|06.09.2018 19:41:37|Евгений|Особенно дружно голосуют те кто имел бизнес с Россией. А если вдруг выяснится, что плохого парня просто оговорили, эти парни республиканцев разорвут на куски. Это же демократия.
166|06.09.2018 19:43:01|А что ты сделал для котэ!?|Но эти бои будут Будут Нас за это накажут Накажут Вот я и говорю  терять особо нечего, все равно накажут Русский солдат никогда не сдается. один хрен ему терять нечего. Это и есть наша главная военная тайна https//youtu.be/0_vOnTr0fA
167|06.09.2018 19:49:28|ААА|Саддам не согласен.
168|06.09.2018 19:51:11|Евгений|Ну так рейтинг Буша и рухнул нафиг
169|06.09.2018 19:51:29|ААА|Никому не интересно что там было когдато и кого оговорили. Это уже прошлое. Допинговые медали на олимпиаде из этого же разряда. Никому не интересно, что их отбирают. Все помнят золото во время олимпиады и первое место в командном зачете после провала в Канаде в 2010.
170|06.09.2018 20:00:20|Евгений|Это очень большой риск, строить политику на сиюминутных всплесках. Если предположить что все санкции против России введены на пустых основаниях, в любой момент могут появится лидеры которые вокруг этого построят рейтинг, используя риторику борцов за правду. Обвинив во лжи и подлоге сторонников санкций можно очень хорошие рейтинги собрать. Если, конечно, позиция будет обоснована фактами. Пока проще собираются факты противников России. Логично предположить что именно эти факты и имеют место быть.
172|06.09.2018 21:46:14|ААА|https//smartlab.ru/blog/492674.php
174|06.09.2018 22:07:36|Alex|С другой стороны, Буш смог убедить многих что у Хуссеина было оружие массового поражения которое так и не нашли
175|06.09.2018 22:39:30|Oleg Lvov|Я сегодня весь движух пропустил, правда и так почти весь в кэше. А что ето трампий на 69.3 влез Кровькишкичтото новое
176|06.09.2018 22:40:12|Vladimir Sotnikov|в кеше это хорошо 
179|06.09.2018 22:40:40|Oleg Lvov|В рублёвом 
180|06.09.2018 22:41:08|Vladimir Sotnikov|вово  Силуанов знает, кто проспонсирует 
181|06.09.2018 22:42:21|Oleg Lvov|Ага ну да, внутренние инвесторы my ass. 1520 зарплаты отдай на армату. А за долларыпубличная порка.
