|time|user|text
821|24.05.2019 13:34:05|Вадим|В чём смысл Элемента, если не секрет Доходности КО и Элемента както не сопоставляются. 
822|24.05.2019 13:34:16|Максим Кочнев|он гастися 28го мне под вывод
823|24.05.2019 13:34:23|Шура SiberianRanger|Вывод денег
824|24.05.2019 13:39:30|Вадим|Разжуйте, плиз, не понимаю.
825|24.05.2019 13:44:37|Harry Lime|Можно просто сделать вывод , но придется налог заплатить. Настроен вывод на карту от погашения .
826|24.05.2019 13:47:22|Olga|ОМ по 101 как то дико. Чем Кармани2 не альтернатива Или я что то упускаю
827|24.05.2019 13:47:24|And|Вывод с обычного брокерского счета, так
828|24.05.2019 13:47:36|Harry Lime|Да
831|24.05.2019 13:48:40|And|Видать оферта в октябре от Кармани смущает общественность, ещё свежи воспоминания о ДД.
832|24.05.2019 13:49:54|Harry Lime|Безусловно , народ разгружается , возможно куда более вкусные цены увидим на Кармани
833|24.05.2019 13:49:59|And|И много получается сэкономить таким образом поясните плиз расчет выгоды и логику такого вывода с обычного брок счета, если не сложно.
834|24.05.2019 13:51:02|Harry Lime|Вам надо вывести 50 тысяч , у вас налога га 40. Вам выведут 10 тыс.
835|24.05.2019 13:51:52|And|А откуда такой налог может быть на облигах тут же спекуляций минимум, а с купона сразу берут.
836|24.05.2019 13:53:28|Why Aye Man|Если купили с малым нкд, а продали с бОльшим, то разница НКД  положительный налогооблагаемый результат при условии, что цена тела не изменилась
837|24.05.2019 13:54:55|Вадим|gtHarry Lime Настроен вывод на карту от погашения . эээ... А что, в этом случае разве налог не удерживается Под картой имеется в виду карточный счет в банке
838|24.05.2019 13:55:20|Harry Lime|Нет сумма целиком выведется
841|24.05.2019 13:56:27|And|А налог на разницу НКД 13  при этом
842|24.05.2019 13:56:34|Михаил|Ок, а как настроить автоматом гашение на тек счёт Такая фишка у всех брокеров есть
843|24.05.2019 13:56:46|Harry Lime|Спнкуляции купили Грузовик по номиналу продали по 105
844|24.05.2019 13:56:46|Вадим|Удивительный схематоз 
845|24.05.2019 13:57:07|Harry Lime|Используйте , это бесплатно
846|24.05.2019 13:57:09|Михаил|Или речь только про иис
847|24.05.2019 13:57:10|Михаил|Ок, а как настроить автоматом гашение на тек счёт Такая фишка у всех брокеров есть
848|24.05.2019 13:57:18|And|Ну это да, понимаю. Но таких вариантов не то, чтобы очень много.
849|24.05.2019 13:57:32|Why Aye Man|Да
851|24.05.2019 13:59:17|Harry Lime|Ну так об,емы разные у всех , бввает болезненный налог
852|24.05.2019 13:59:41|And|Ну это и хорошо с другой стороны, вот она нологовая база для будущего вычета ИИС кому нужно, вместо 35 которые не вернуть. И много такого налога за год может набежать с Депо 1 млн к примеру, ктонибудь считал
853|24.05.2019 13:59:49|Максим Кочнев|У меня очень много. Я только на спекуляциях таких примерно 4 к годовой доходности получаю
860|24.05.2019 14:02:13|Harry Lime|Выход через Липецкую область , звучит
861|24.05.2019 14:02:18|Максим Кочнев|ибо вывести суммарно надо тыс 150 примерно. Ради этого отдавать налоги не стоит
863|24.05.2019 14:02:55|Alex Petroff|Други Эту ситуацию надо объяснить под другим углом. При схеме, указанной Максимом, налоги платятся, все нормально. Но платятся не сейчас, а как обычно, в конце года. А суть этой фишки лишь в том, чтобы на выводе средств не удержали налоги сразу. Вот и вся разница. А то размусолили тему...
864|24.05.2019 14:03:18|Максим Кочнев|
865|24.05.2019 14:04:30|And|А если удержат сразу, то потом в конце года пересчитают, или наше госво разницу в свою пользу всем прощает
866|24.05.2019 14:05:11|Serg|Удерживает брокер, он с государством сам разбирается 
867|24.05.2019 14:05:12|Harry Lime|Пересчитают, это не государство  брокер налоговый агент
868|24.05.2019 14:05:32|Максим Кочнев|Просто вы эти пол года без этих денег будете
870|24.05.2019 14:08:04|And|Ок, спасибо за разъяснения коллеги.
871|24.05.2019 14:09:04|Максим Кочнев|а ВТБ хорош тем что погашает в этот же день. 28го погашение, гдето в обед деньги уже на карте будут. Останется перекинуть на Тинькоф и тут же в Янго. 29го уже будут на счету, а то может и 28го
872|24.05.2019 14:09:43|Roman|вывод на карту можно настроить в мобильном приложении ВТБ
873|24.05.2019 14:10:04|And|Ктонибудь знает Брок Альфа даёт выводить на свой банковский счёт
874|24.05.2019 14:10:06|Максим Кочнев|я не знаю, у меня при заключении договора сразу было указано на карту
876|24.05.2019 14:11:49|DIM|Узнавал сегодня, нет, заявление вроде как надо писать отдельно
877|24.05.2019 14:18:15|Harry Lime|А там уже и бумажный убыточек подоспел и налог и не нужно платить...
878|24.05.2019 14:22:22|Alex Petroff|Это нужно разъяснить следующим образом. Может показаться, что это запредельный уровень мастерства. Но на самом деле все просто. Берем бумагу условно в начале года по 104 от номинала. Она гасится в начале декабря этого же года по номиналу. Вы получаете бумажный убыток в минус 4  от позиции в этой бумаге. Но По сути купон полностью компенсирует ваши потери. А сформировавшийся бумажный убыток идет в плюс, т.к. он снижает налогооблагаемую базу на всю сумму убытка. Занавес.
879|24.05.2019 14:23:02|Дмитрий Адамидов|Леди и джентельмены Не забываем писать вопросы БКС  до понедельника. https//t.me/angrybonds/1549
880|24.05.2019 14:23:08|Максим Кочнев|Надо просто купить ломмастера 1 и второго И роял первый еще
881|24.05.2019 14:24:45|Harry Lime|Можно еще попробовать выход через оферту Рояля
882|24.05.2019 14:25:07|Максим Кочнев|там все это есть. Про бум убыток
884|24.05.2019 14:26:43|Harry Lime|Я тоже , но ждем ставку
885|24.05.2019 14:27:15|Максим Кочнев|в текущих условиях 15 меня пока устроит, хоть и хочется хотябы 15,5
886|24.05.2019 14:27:38|Why Aye Man|Нет
887|24.05.2019 14:29:05|Harry Lime|А доха по второму сейчас какая  Если ставка будет ниже дохи по второму , есть повод задуматься . Я так считаю.
888|24.05.2019 14:31:22|Максим Кочнев|ПОэтому я еще в начале мая с 50/50 перешел в 30/70 в пользу второго, когда там цена периодами падала доха к оферте 14,76. Цена 101,49 Первый цена в району 100,2 Уже если и играть в спекуль то брать первый в надежде на 15 и рст цены после оферты
890|24.05.2019 14:33:09|Alex Petroff|Там НКД большой
891|24.05.2019 14:33:14|Максим Кочнев|ну у них КЛ на 14,3 по идее нет им смысла полностью погашать выпуск через КЛ. Им же не хочется сразу себе имидж делать такой не хороший. Я все же надеюсь на минимум 15. Так и не ему и ни онвесторам не особо обидно будет  а обидчевые выйдут спокойно 14  уже перебор
893|24.05.2019 14:33:42|DIM|Вы хотите сказать, что гася облигацию со знаком минус или просто продавая облигацию в себе в убыток, в целом мы получается выгоднее отрабатывает, чем если бы было со знаком плюс от продажи облигации плюс нкд
894|24.05.2019 14:33:45|Максим Кочнев| ставка на рост цены после оферты и ставки по купону
897|24.05.2019 14:35:42|Harry Lime|Даже 14,5  не будет , иначе принесут 80 выпуска , 15 тоже вопрос . Будем посмотреть.
898|24.05.2019 14:35:50|Alex Petroff|Не мешайте мух с котлетами. Это две разные стратегии. Я подробно привел одну. Она конечна и самостоятельна по смыслу. Как и стратегия роста тела с ростом купона.
899|24.05.2019 14:36:47|Максим Кочнев|ну и я про то же. Если они хотят еще занимать в будущем через облиги им надо както норм к воблам относиться. купон 14  совсем не норм. Так что 15 это минимум. Но меня правда никто не спрашивал
900|24.05.2019 14:37:28|Deleted Account|Почему народ не переходит из Мясничего2 в Мясничий3
901|24.05.2019 14:38:11|Максим Кочнев|а почему ему переходить
902|24.05.2019 14:38:34|IURII D.|В 3ем при проведении IPO заложен принудительный выкуп.
903|24.05.2019 14:38:38|Deleted Account|Второй дороже при том же купоне.
904|24.05.2019 14:38:48|Harry Lime|Нет там никакого выкупа
906|24.05.2019 14:39:26|BCG|А схема учитывает, что средства посути размещены под 0 на год, а не хотя бы под 7 Этот нереализованный доходт.е. убыток надо также учитывать.
907|24.05.2019 14:39:28|Максим Кочнев|у них и сроки и условия разные. Дороже не дороже  это вы еще плюс коммисию считайте что вы там выиграете мильён
908|24.05.2019 14:39:52|IURII D.|Вчера на вебинаре Хохрин разжёвывал  да, при желании эмитента.
909|24.05.2019 14:40:17|DIM|Ну ок, а если наоборот, купили по 1000,продали за 1030,тут налог в 13 возьмут или 35 за разницу покупки и продажиъ
910|24.05.2019 14:40:22|Harry Lime|Оно может и не появиться
911|24.05.2019 14:40:26|IURII D.|Но только в 3ем у ГГ есть такая возможность.
912|24.05.2019 14:40:31|Максим Кочнев|13 от прибыли
913|24.05.2019 14:40:40|DIM|Как итог то в плюсе будет
914|24.05.2019 14:41:03|Why Aye Man|А это не только в ОАЭ 3, но и в Мясничем 3 такое условие заложено
915|24.05.2019 14:41:09|DIM|Я к тому, что ниразу не хуже
916|24.05.2019 14:41:30|Алексей ayaye :)|а почему в кавычках 
917|24.05.2019 14:41:59|Максим Кочнев|в смысле Причем тут это и бумажный убыток
918|24.05.2019 14:42:11|Harry Lime|Нет уверенности видимо
919|24.05.2019 14:42:41|Alex Petroff|Схема...она применяется инвестором, исходя из его личных соображений. Бумажный убыток, это по сути прибыль. Но при наличии налогооблагаемой прибыли. Если не с чем сальдировать убыток по концу года, вы можете, обратившись в налоговую этот бумажный убыток распространить на следующиий год.
920|24.05.2019 14:42:53|DIM|Ну мы же говорим о том, что закрывать сделку со знаком минус удобно
921|24.05.2019 14:43:09|Максим Кочнев|мы говорим про бумажный убыток
922|24.05.2019 14:43:25|DIM|Ладно, чёт я нифига не понял тогда
923|24.05.2019 14:44:53|Максим Кочнев|мы говорили что при реализации как раз как и вы говорите купить дешевле продать дороже можно заработать. Но потом придется платить налог Но чтобы его не платить, можно в конце года немного себе бумажного убытка сделать и не платить налог
924|24.05.2019 14:44:53|IURII D.|Не Андрей вчера вёл эфир.
925|24.05.2019 14:49:38|Anastasiia Tolnykina|Подскажите, это и правда такая разводка, или просто в расчетах не учтены какието параметры Речь про полную неэффективность а то и убыточность работы с инвестиционным роботом ЯндексYammi. https//zen.yandex.ru/media/id/5cde68f63aa74100b3ca0313/cervisdliaubytkov5ce7d0fbda618900b37d2be3
926|24.05.2019 14:54:13|Максим Кочнев|там же комиссии какието конские
927|24.05.2019 14:55:15|Anastasiia Tolnykina|Ну то есть все правда . А то вдруг напраслину возводят на хороший добрый ресурс.
928|24.05.2019 14:55:58|Максим Кочнев|не. Я не знаю правда там все или нет я не читал, но я знаю точно что комиссий всяких там сдирают будь здоров
929|24.05.2019 14:56:32|Anastasiia Tolnykina|Ну так об том и речь .
930|24.05.2019 15:02:29|Максим Кочнев|ВОт и все, последний МСБ ушел. Не осталось ни одного эмитента со ставкой ниже 14 МСБ я любил, и люблю до сих пор
931|24.05.2019 15:04:13|Aleksandr|он хороший 
932|24.05.2019 15:05:50|Максим Кочнев|ай нет, последняя облигация Нафтатранса не продалась до сих пор
933|24.05.2019 15:18:18|BCG|Я у тому что в этрй схеме надо учитывать не трлько бцмажный убыток, но и нереализованный доход от размещения средств под схему по сути под 0 на период до погашения. Вы снижаете ндфл на 5, купив к примеру по 105. А могли бы получить скажем 14, разместив на период до оферты и уплатив ндфл 1.82. В итоге в схеме в схеме получаем 5, а без схемы 12.18
935|24.05.2019 15:22:15|Alex Petroff|Давайте я вам ломастер1 продам за 113. У него гашение 25.06. Просто идеальный вариант для обоих. Сколько вам завернуть
936|24.05.2019 15:22:15|Максим Кочнев|да это просто пример был. Никто так не делаетю Покупаете бумагу за 3 дня до купона, после продаете и все. Вот вам убыток и срок никакой
937|24.05.2019 15:24:19|okay|А как же диверсификация У вас сколько эмитентов с 15
938|24.05.2019 15:25:24|Максим Кочнев|я в КО частично ухожу, поэтому продал все что ниже 14 не 15 а 14
939|24.05.2019 15:26:30|okay|А в КО и БО сколько эмитентов
940|24.05.2019 15:26:33|Максим Кочнев|17 эмитентов по ставке 14 и будет 6 эмитентов КО по ставке один 16, второй 17,5, третий 18 и остальные 3 по 20
943|24.05.2019 15:29:01|okay|17 в БО это все кто есть на бирже
944|24.05.2019 15:30:11|Максим Кочнев|нет, на бирже больше эмитентов
945|24.05.2019 15:31:20|Anastasiya Gavrilova|Ухты Я даже поняла, мимо проходя Чат явно проникает в мою голову
950|24.05.2019 15:38:37|And|Жаль, получается выводят БКС, ВТБ, и ктото ещё Чтото мне подсказывает, что мне нужно менять брокера
952|24.05.2019 15:39:24|Pavel Bilenko|БЭЛТИ на 3,7 млн рублей осталось разместить...
953|24.05.2019 15:39:55|Andrey Hohrin|круто пора б уж
954|24.05.2019 15:40:23|Pavel Bilenko|на всем экономят, даже лишний купон не хотят платить 
955|24.05.2019 15:40:28|Aleksandr|его не выгодно сейчас брать, купон на носу , заберут налог
956|24.05.2019 16:06:49|BCG|А у него НКД 13
957|24.05.2019 16:12:20|Alex Petroff|Нет такого понятия. Там купон 19 годовых. И он капает каждый день. К 25.06 он будет полный. И гашение.
958|24.05.2019 16:34:19|Aleksandr|да
959|24.05.2019 16:40:23|Alex Petroff|Либо в конце года, либо запросом на брокера через мыло. Хотя в ЛК у ВТБ есть форма запроса по предоставлению информации по неторговым операциям. Может там можно запросить и про налоги.
960|24.05.2019 17:07:04|Дмитрий Адамидов|коллеги не стирайте ДиректЛизинг. Он дело пишет
961|24.05.2019 17:10:45|Alex Petroff|А нефиг неадекватам права админа давать
962|24.05.2019 17:14:49|Olbrnew|Есть. В самом низу можно запросить  рассчитают фифо, подоходный, короткие позы и еще что то.
963|24.05.2019 17:16:01|Максим Воробьев|Не стреляйте в пианиста, он играет, как умеет 
964|24.05.2019 17:17:46|Дмитрий Адамидов|Директлизинг хотел сказать вот это примерно
966|24.05.2019 17:28:46|Дэн Иванов|
967|24.05.2019 17:29:06|ЛК «ДиректЛизинг» Всеволожский пер. 2, стр. 2|Лизинговая компания Директ Лизинг запустила новый сайт ООО Директ Лизинг представляет обновленный корпоративный сайт, отвечающий самым современным стандартам пользовательского интерфейса и дизайна. Разрабатывая новую версию нашего сайта, мы постарались учесть все пожелания нашей аудитории. Особое внимание мы уделили структуре сайта, дополнив и расширив основные разделы  Клиентам и Инвесторам. Для клиентов на сайте появился новый удобный Калькулятор, который позволяет рассчитать приблизительный размер лизингового платежа. На сайте размещена сравнительная оценка эффективности затрат при приобретении имущества в лизинг, кредит или за собственные средства, что позволит клиентам лучше понять преимущества лизинга. На сайте также появились условия совершения лизинговой сделки и список необходимых документов, is что позволит ускорить процессы заключения лизингового договора. В разделе Инвесторам представлена подробная информация о программе биржевых облигаций параметры каждого выпуска, сроки обращения и выплат. Звезда сайта  удобнейший Календарь инвестора, где в наглядной форме отображены ближайшие даты важных корпоративных событий эмитента. Так, например, в июне состоится выплата 5го купона по облигациям серии 001Р02. Рекомендуем всем держателям наших облигаций ознакомиться с обновленным разделом. Не остался без внимания и раздел О компании. В разделе опубликована история компании, менеджмент, финансовые результата ты итоги 2018 года, а также стратегия и тактика компании. Как компания, имеющая сотни инвесторов и клиентов по всей Росси и, возможно, даже за ее пределами, мы считаем важным отобразить на сайте нашу прозрачность, философию, основные деловые принципы в ведении бизнеса, и, как мне кажется, у нас это получилось. Ведь мы меняемся для Вас  наших инвесторов и клиентов.  команда ООО Директ Лизинг. Сохраните ссылки себе в закладки нашего сайта, Телеграммканала и Instagram, чтобы всегда быть рядом и не пропустить важные новости эмитента. DLeasing.ru instagram.com/direct_leasing https//t.me/DirectLeasing
968|24.05.2019 17:31:42|Дэн Иванов|я чувствую предвзятость
969|24.05.2019 17:31:52|Дмитрий Адамидов|Да и все пишем вопросы БКС  не посрамим сообщество
970|24.05.2019 17:33:45|Turgor|Не переживайте, инвесторы тоже свою голову имеют
972|24.05.2019 17:38:13|BCG|Нет такого понятия НКД О как НКД по ломастеру1 в день погашения будет составлять 4.7 от номинала. И покупать у вас его за 13 чтобы получить 4.7... 8.3 от номинала за неделю, что в пересчете в годовые дает какойто космический минус. Пожалуй брать не буду
