|time|user|text
189|06.03.2020 19:09:50|Harry Lime|Проблема в другом , US Steel практически мертвец , котира 84 отражает реальность , у нее куда больше шансов пойти на 50 чем на 100
190|06.03.2020 19:12:20|Serg sv|Рынок Америки более волатилен чем наш. Дело не в US STEEL там куча эмитентов с моменте с просадками. Что все умрем  все мертвецы  Но , сорри, дядя Денер и Дэни колл конечно на порядок интереснее обсуждать . В случае только полного шухера посмотрите в стаканы по ВДО.
191|06.03.2020 19:13:42|Harry Lime|Он более об,ективен , там больше играет фундаментал , там US Steel просто не может стоить 100 , у нас могла бы 105 , купон ведь большой
193|06.03.2020 19:15:34|А что ты сделал для котэ!?|Не готов говорить за ЮС Стил  не смотрел Мне кажется, что фондовые рынок США гораздо более ЭФФЕКТИВЕН чем наш. Если мы, минифизики, можем находить альфу в условном Ломастере, в который никогда не пойдут институционалы, то покупая ЮС стил или SWN ты конкурируешь с институционалам, которые занимаются рынком постоянно, а не вечером после работы Поэтому в целом шанс поймать неэффективность рынка в ВДО СШа гораздо ниже, чем в ВДО РФ
194|06.03.2020 19:16:27|Шура SiberianRanger|GM last week had offered bondholders 8 cents on the dollar in cash, 16 cents on the dollar in new, unsecured debt and a 90 percent stake in the automaker, one person with knowledge of the term sheet told Reuters.
195|06.03.2020 19:18:03|Corax|Нефть Брент минус 9 уже 
196|06.03.2020 19:23:32|Harry Lime|http//www.creditfixings.com/information/affiliations/fixings/auctions/2009/genmtr/results.shtml
198|06.03.2020 19:26:09|Harry Lime|Update. United States Steel Corporation. 4Q19. Part 1. С момента рекомендации X 6 1/4 03/15/26 USD вырос на 3 или на 15 с учетом купона. Драйверами роста выступило резкое снижение ставки ФРС. Производственные показатели за 2019 год  отгрузка 10 700 2 net tons  производство 11 409 4 net tons  средняя цена продажи 753 7 / net ton Индекс промышленного производства в США упал в 2019 году с 3.86 до 0.83, и скорее всего продолжит падение на фоне рисков связанных с распространением коронавируса, что приведет к дальнейшую падению цен на сталь.
199|06.03.2020 19:27:00|Harry Lime|Прекрасное исследование про US Steel , инджой , там еще несколько постов дальше
200|06.03.2020 19:30:47|Serg sv|и что  Северсталь тоже падает. циклические компании. И сегодня я ее набирал по 790. Ибо как упадет, так и вырастет. И Алросу набирал по 69 ибо тоже вырастет. И одно НО. До Ноября с ней ничего не будет если не наступит крах всех экономики США . Ибо для Трампа это основа его кампании  поддержка крупных производителей. Но все это исключительно мои субьективные умозаключения.
201|06.03.2020 19:31:48|Дмитрий Адамидов|коллеги, напоминаю про акции  в Друзя
202|06.03.2020 19:32:40|Harry Lime|Долг/ебитда сравните у Севки и X , и все станет на свои места
203|06.03.2020 19:33:58|Дмитрий Адамидов|Чем Друзь не подходит Специально же создали по просьбам трудящихся
205|06.03.2020 19:34:51|Harry Lime|Мы тут сравниваем Северсталь и US Steel в плане долга
207|06.03.2020 19:41:30|Дмитрий Адамидов|ок
208|06.03.2020 19:41:54|А что ты сделал для котэ!?|ParceyVB коллега, удалось со Слатой пообщаться
209|06.03.2020 19:50:49|Andrey Solyanik|Спасибо большое. Интересная информация. Инвесторам в high yield bonds на заметку.
210|06.03.2020 19:51:44|Harry Lime|Да , очень советую , Ford , LyondellBаsell с рекавери 2 два , отрезвляет
211|06.03.2020 20:03:20|Alexander|А зачем берут фф на первичке, если его по 99.75 сегодня в стакане давали
212|06.03.2020 20:05:24|Harry Lime|Если надо на лимон Не рублей
214|06.03.2020 20:12:46|Alexander|А какие варианты Техничка выкупит разом под конец
215|06.03.2020 20:15:27|Harry Lime|Ну да какойто таинственный покупатель ...
216|06.03.2020 20:15:50|Alexander|Это плохо для обычных воблов
217|06.03.2020 20:16:23|Ruslandd|Наверное им сейчас не до общения  13 человек травонулись их салатами
218|06.03.2020 20:18:02|А что ты сделал для котэ!?|Да, техничка будет продолжать продавать
219|06.03.2020 20:19:24|Дмитрий Адамидов|ну она может продавать по 101 например
222|06.03.2020 20:23:15|Alexander|А что сам фридом по этому поводу говорит, с ним общался ктонибудь
223|06.03.2020 20:24:11|А что ты сделал для котэ!?|Ну если бы не были нужны  не размещали бы бонды  А если нужнытденьги  тогда проще занять их потувеличенной дохе а раз купон увеличить нельзя  увеличим доху за счет снижения цены Простая математика
224|06.03.2020 20:29:19|Alexander|Ну ПионерЛизинг размещается неспешно и вроде бы так и задумано. Может и фридому такое сойдёт, будут после размещения так же медленно продавать через 3е лицо.
225|06.03.2020 20:30:52|Dmitry Manzor|https//t.me/druz_svid
226|06.03.2020 21:04:16|Sky|Фридом может и без бондов раскорячить. Мы не знаем, какие у них позиции на балансе и как они переживают снижение рынков.
227|06.03.2020 21:13:58|Harry Lime|Я общался неоднократно , что именно интересует 
228|06.03.2020 21:24:45|А что ты сделал для котэ!?|Сэйзы же не расскажут про все позиции конторы
229|06.03.2020 21:25:56|Alexander|Да вопрос простой, размещение затягивается  это ожидаемо На что вообще этот займ пойдёт
230|06.03.2020 21:27:38|Harry Lime|Не , я только с корп фином  размещения , эмитенты вот это все , про позиции не могу знать
232|06.03.2020 21:31:11|Sky|Если у них будет маржи на выкуп остатка.
233|06.03.2020 21:34:12|Harry Lime|Вот и посмотрим
235|07.03.2020 00:22:33|Алексей Чернушевич|Так неторопливо приходит мудрость.
236|07.03.2020 03:16:44|Владимир Парцей|Да. У них там чуть чуть бардак. Уже вторую неделю жду ответы на вопросы
240|07.03.2020 14:12:03|А что ты сделал для котэ!?|Леш, сильно заполняемость упала в феврале без китайцев И насколько повлиял хайп по поводу вируса в уже в России В
241|07.03.2020 14:15:04|Оксана|Ктото в цифрах ошибается, ктото в грамматике русского языка за 4 класс...
243|07.03.2020 15:56:21|Елена Филякина|Мягко сказано
245|07.03.2020 19:31:17|Замполит Aleks Kib|Наглядно о ситуации на рынках
246|07.03.2020 23:55:27|Алексей Чернушевич|Выполнение плана за январь 106, за февраль 96.
250|08.03.2020 01:23:58|А что ты сделал для котэ!?|План ещё до коронавируса составлялся
255|08.03.2020 11:45:06|Алексей Чернушевич|Конечно.
257|08.03.2020 13:52:40|ЛК «ДиректЛизинг» Всеволожский пер. 2, стр. 2|С 8 МАРТА ЛК ДиректЛизинг поздравляет с нежным весеннем днем девушек и женщин Гармонии и вечной весны в душе Со Всемирным Женским Днём С 8 МАРТА ЛК ДиректЛизинг раскрывает информацию на странице ООО ИнтерфаксЦРКИ тут Самые последние новости компании Вы найдёте на нашем сайте, в telegram канале и в Instagram лизинг leasing ДиректЛизинг директлизинг лизингмосква
258|08.03.2020 14:54:39|Deni Le|Лизинговая компания Роделен поздравляет прекрасную половину человечества с Международным женским днем Вдохновенья, радости, творчества, моря цветов, настоящей любви и искренних слов
259|08.03.2020 14:57:04|Soa|и регулярных купонов
260|08.03.2020 17:35:44|Алексей Чернушевич|Да просто всего регулярного
261|08.03.2020 17:48:00|DK|Кому интересно Израильский индекс https//ru.investing.com/indices/ta25
262|08.03.2020 17:56:44|Evgeniia Bushunova|
264|08.03.2020 18:02:28|Capricious|В ламповых выпусках обещали тишь благодать. Во вторник проверим 
265|08.03.2020 18:05:17|MММ🥕🐹|В пятницы уже два раза проверяли  нельзя да и нечем там дристать 
266|08.03.2020 18:06:14|Evgeniia Bushunova|Главное, чтобы КалСбыт выжил 
268|08.03.2020 18:10:01|Soa|Мне интересно когда у нас первичка новая будет...успешная
269|08.03.2020 18:11:13|MММ🥕🐹|Шаурму возьмём и на перерыв  повесим табличку закрыто. Меньше чем с 15 не стучать.
270|08.03.2020 18:12:13|Capricious|Тоесть открывающиеся новые возможности в голубых фишках ни кого не соблазнят Нус незнаюс.... 
271|08.03.2020 18:12:25|Soa|надо Иволге сообщить
272|08.03.2020 18:13:24|MММ🥕🐹|Если не дураки сами понимают все. Ветер задул в другую сторону 
273|08.03.2020 18:15:10|Soa|а вдруг они гордые..
274|08.03.2020 18:15:17|MММ🥕🐹|Ну подбор на истерических сливах по 1015 никто не отменял, а медленное сползание только шортить 
276|08.03.2020 18:16:38|Soa|У меня уже
277|08.03.2020 18:20:01|MММ🥕🐹|Мегазастрои недавно конечно отлично кэш лишний абсорбировали и замуровали с бондов  Гарри прав.
278|08.03.2020 18:34:06|Vit|Чето страшно прям Не будут ли офз по дохе как вдо в скорости
279|08.03.2020 18:40:04|Alexey Vishnyakov|В акциях Они там ещё не раз откроются. Все ниже и ниже
280|08.03.2020 18:41:27|Capricious|В облигах тоже. Акции то понятно сейчас будут летать в разные стороны
281|08.03.2020 18:41:35|Alexey Vishnyakov|Да  с Шевченко и нефтетрейлером не помню, как его может быть тяжело.
282|08.03.2020 18:43:34|Soa|думаете
283|08.03.2020 18:46:11|Alexey Vishnyakov|Я уверен. Я думал взять немного, но теперь то точно не буду. Это точно будет не ситуация Лизинг Трейда. С другой стороны мясо 3 размещалось 3 месяца. Может за 3 месяца и успеют
284|08.03.2020 18:47:00|Soa|Может дисконт оформят..
285|08.03.2020 18:47:21|Mister X|импорт из китая кстати тоже должен подорожать
287|08.03.2020 18:47:42|Soa|в рублях однозначно уже
290|08.03.2020 19:04:33|MММ🥕🐹|От похода ниже 40 это её не спасёт 
291|08.03.2020 19:08:49|Soa|это чат про бонды
292|08.03.2020 19:10:30|MММ🥕🐹|Ну на номинале тоже их бонды не удержат если появятся сладкие варики 15 
293|08.03.2020 19:11:29|Soa|не думаю что 15 будет в достаточном колличестве
294|08.03.2020 19:11:52|MММ🥕🐹|Скоро увидим 
295|08.03.2020 19:15:28|Harry Lime|Ждем во вторник праздничных подарков , лучше заранее хорошенько подумать не что продать , а что купить .
296|08.03.2020 19:16:25|Дмитрий Дудко|Тазики
297|08.03.2020 19:16:46|Harry Lime|Безусловно
298|08.03.2020 19:16:54|Alexey Vishnyakov|Поставлю по 80. Может нальют.
299|08.03.2020 19:16:56|MММ🥕🐹|Усе уже продумано ещё в позапрошлую кровавую пятницу  кошелёчки опустошены тазики стоят 
302|08.03.2020 19:34:27|Capricious|Огласите весь список пожалуйста 
303|08.03.2020 19:38:23|Harry Lime|У каждого он должен быть свой
304|08.03.2020 19:40:02|А что ты сделал для котэ!?|Это вкаких именно
306|08.03.2020 19:46:34|MММ🥕🐹|В моих любимых карманных выпусках некому лить 
307|08.03.2020 19:53:08|Шура SiberianRanger|Ставьте ноги в тазик... ТАЗИКЭВТАНАЗИК
308|08.03.2020 19:55:41|Helena Yakh|
309|08.03.2020 20:13:14|Capricious|Да я вот думаю в начале не стоит суетиться. Посмотреть в сторонке пока полгодика не лишним будет. Ну может офз 14 прольют. Это будет подарком 
310|08.03.2020 20:13:41|Alexander|А при какой цене на нефть будет дефолт по ОФЗ
311|08.03.2020 20:16:08|Capricious|Не при какой. Вот если что страшнее тогда тушонка, спички и т. д. И никакого офз
312|08.03.2020 20:18:38|Harry Lime|При отрицательной
313|08.03.2020 20:19:07|Alexey Vishnyakov|Дефолта не будет  что помешает просто напечатать рубли
314|08.03.2020 20:54:21|Aleksandr|У руля были более тупые
315|08.03.2020 20:55:03|Alexander|А что в 98м помешало напечатать
316|08.03.2020 20:56:56|Soa|Тогда слово имидж и РФ были на разных полюсах к тому же
317|08.03.2020 20:57:12|Ivan Z|Так кстати физикам по гкошкам заплатили все, разве нет Ну и количество денег в кубышке тогда было другое. И цену на нефть стоит корректировать на инфляцию.
318|08.03.2020 20:58:00|Soa|Сначала должны кончится ЗВР, потом вы должны набрать долгов у какого нибудь Парижского клуба...и т. д. И тогда дефолт вэлком
320|08.03.2020 20:58:45|İldar Rafikov|Обувь очень сильно выиграет от обувного Игаис. И от перебоев поставок из Китая.
321|08.03.2020 20:59:19|Soa|однозначно..одна из немногих компаний кто будет в выигрыше
322|08.03.2020 20:59:45|Дмитрий Адамидов|а почему если не секрет
324|08.03.2020 21:00:16|Soa|У нее большие товарные запасы были
326|08.03.2020 21:01:16|Дмитрий Адамидов|а, с этой точки зрения. их продать еще надо так то
327|08.03.2020 21:01:52|Soa|эта задача постоянная и им понятная
328|08.03.2020 21:01:58|Ivan Z|Ну да, я бы не дёргался сейчас, но паника завтра будет знатная. И в долларе и в акциях и на вдо проливчики будут
329|08.03.2020 21:02:19|Дмитрий Адамидов|ну не понятно откуда у населения деньги возьмутся. это основное во всем ритейле
331|08.03.2020 21:02:56|Soa|У них и сегмент подходящий..мало Лабутенов и Гучи всяких
332|08.03.2020 21:03:39|İldar Rafikov|Это товар первой необходимости. Если ботинки порвались, в тапочках не пойдешь на работу...
333|08.03.2020 21:04:00|Дмитрий Адамидов|пойдешь в ремонт например
334|08.03.2020 21:05:10|Soa|где
335|08.03.2020 21:05:18|Ivan Z|Я про вторник, перепутал. Но на СПб кстати некоторые российские бумаги торгуются, из акций
336|08.03.2020 21:05:20|Soa|Где ремонт то
337|08.03.2020 21:05:25|İldar Rafikov|Для меня их бизнес более чем понятный. И Игаис очень много с условного Черкизона кого подкосит.... Буду тихонько добирать их на проливах
338|08.03.2020 21:05:43|Дмитрий Адамидов|да появились  чем мельче город кстати и меньше у народа денег тем больше сапожников
339|08.03.2020 21:06:35|Soa|Не особо в теме, но вокруг меня все ремонты исчезли совсем, да и стоимость его..порой смысла не имеет.
340|08.03.2020 21:06:44|Дмитрий Адамидов|просто нет прямой связи между кризисом и ростом выручки от реализации товаров первой необходимости. она скорее падает медленнее чем выручка от лухари и дорогих товаров
341|08.03.2020 21:07:10|Soa|курсовая разница компенсирует многое
342|08.03.2020 21:07:11|İldar Rafikov|Моральное устаревание раз, дорогой ремонт два. Не поднимется рука отдать 30 от стоимости за ремонт хлама
343|08.03.2020 21:07:16|Дмитрий Адамидов|но распродать склад кризис точно не помогает. при прочих равных
344|08.03.2020 21:07:55|Soa|Дмитрий, а что возможен кризис
346|08.03.2020 21:08:19|İldar Rafikov|Речь идёт о доли рынка. Если на рынках будет рост цены и перебои с поставками
347|08.03.2020 21:08:20|Soa|Про кризис знаем мы
348|08.03.2020 21:08:23|Дмитрий Адамидов|ну если народ решил что нефть по 30  то значит это кризис
350|08.03.2020 21:08:53|Soa|не для потребителя когда он пойдет в магазины ОР
351|08.03.2020 21:08:54|Дмитрий Адамидов|ездить на авто все перестанут
352|08.03.2020 21:09:15|Soa|на долго...до мая точно..
353|08.03.2020 21:09:19|Dm Vl|Ломбард 7 вполне успешный заем
354|08.03.2020 21:09:21|İldar Rafikov|Не вижу смысла кипишь наводить. В 14 году ситуация была более неожиданной
355|08.03.2020 21:09:27|Soa|Может и до конца мая
356|08.03.2020 21:09:53|Дмитрий Адамидов|мне логика не понятна. если все плохо то почему все должны усилено пойти в ОР разбирать склад я бы еще понял, если бы выросли доходы
357|08.03.2020 21:10:01|İldar Rafikov|Продавать бумаги точно не стоит. Всё вернется на круги своя
358|08.03.2020 21:10:29|Soa|Не то что бы все пошли,а то что не у многих будут старые цены
359|08.03.2020 21:10:29|Eugeni Schukin|вопрос в том, какие бумаги не стоит продавать 
360|08.03.2020 21:10:39|İldar Rafikov|Перебои из Китая и Игаис
361|08.03.2020 21:11:16|Soa|Если курс снова станет 63 то у ОР исчезнет преимущество напрочь
362|08.03.2020 21:11:17|İldar Rafikov|Есть только один риск, это риск повышения ставки ЦБ
364|08.03.2020 21:11:53|Дмитрий Адамидов|ну если обувь распродаст все по старым ценам а закупать будет по новым  они убытки покажут.
365|08.03.2020 21:11:57|Soa|Мы же уже в уме считаем бакс по 70
367|08.03.2020 21:12:41|А что ты сделал для котэ!?|Да ладно У нас не в самом бедном районе есть мастерские по ремонту обуви
368|08.03.2020 21:12:41|İldar Rafikov|Дело не в курсе, а в том что Китай пока не работает. Игаис убьет серый импорт
369|08.03.2020 21:13:01|Дмитрий Адамидов|Китай по моему с 10 марта опять начинает
370|08.03.2020 21:13:08|Soa|это еще один плюсик, но я его считаю мЕньшим..
371|08.03.2020 21:13:10|Дмитрий Адамидов|к маю следа не останется от спада если так то
372|08.03.2020 21:13:19|Soa|согласен
373|08.03.2020 21:13:28|MММ🥕🐹|Такое ощущение что тут спорят люди с тысячами бумаг ОРа 
374|08.03.2020 21:13:57|İldar Rafikov|Сроки поставок очень длинные. Для сезонной обуви это убийство
375|08.03.2020 21:14:11|Soa|с многими тысячами бумаг тут люди спорят..с десятками тысяч некоторые..
377|08.03.2020 21:14:40|MММ🥕🐹|Ааа... це файно 
378|08.03.2020 21:14:45|İldar Rafikov|То что должны были сшить зимой, пришло бы только летом. А так уже и не придет может
379|08.03.2020 21:14:53|Дмитрий Адамидов|не, у меня то ни одной пока нет
380|08.03.2020 21:15:02|А что ты сделал для котэ!?|Миха, ты заебал своим снобизмом Какая тебе разница какое у кого депо
381|08.03.2020 21:15:04|Дмитрий Адамидов|я как раз хочу посмотреть как распродадут склад
384|08.03.2020 21:16:08|Soa|что еще не утеряна такая функция
385|08.03.2020 21:16:15|Дмитрий Адамидов|естьесть
386|08.03.2020 21:16:18|MММ🥕🐹|Зрадники переможцы обувестрастотерпцы 
387|08.03.2020 21:16:24|Soa|Блин..
388|08.03.2020 21:16:26|İldar Rafikov|Давайте лучше порассуждаем кого этот кризис убить может...
389|08.03.2020 21:16:48|Дмитрий Адамидов|да всех может. многие уже мертвы
390|08.03.2020 21:16:51|Soa|А все зависит от продолжительности в основном
