|time|user|text
1|11.01.2019 12:32:20|Harry Lime|Прям с языка сняли
3|11.01.2019 12:33:46|А что ты сделал для котэ!?|Если цены на нефть будут расти  то объём покупок будет увеличиваться и рубль никак вниз не пойдёт
4|11.01.2019 12:34:28|Harry Lime|Тут за рупь играет сильный платежный баланс, импорт начал падать уже в декабре
5|11.01.2019 12:34:44|YK911|Чет я не понял, ЦБ будет скупать валюту и продавать рубли, с чего рублю то расти, антирынок какойто
6|11.01.2019 12:35:25|Harry Lime|Первый квартал , статистика знает всё
7|11.01.2019 12:35:26|YK911|Если говорить именно об этом факторе
9|11.01.2019 12:36:11|Harry Lime|Он на самом деле индикативен и говорит вам о том , что надо брать пример с Минфина.
11|11.01.2019 12:44:09|Александр|Чтото я тоже не понял, ранее при покупке долларов минфином курс существенно рос, почему сейчас он должен падать при тех же действиях
12|11.01.2019 12:45:30|Harry Lime|Вопрос , когда это происходит . В первом квартале он скорее будет укрепляться чем падать. В 34 вероятно может и снижаться.
13|11.01.2019 12:46:13|YK911|Скупая валюту
14|11.01.2019 12:47:55|Harry Lime|Слова не мальчика , но мужа с Пушкин
17|11.01.2019 12:54:21|Сергей|Не понятно, почему рубль укрепляется в первом квартале, почему именно в первом квартале, кто будет продавать доллары в объемах близким к покупаемым ЦБ
18|11.01.2019 12:54:23|YK911|Речь шла именно о факторе покупки валюты с рынка
20|11.01.2019 12:57:00|Sergey Ustinov|обьемы виноваты
21|11.01.2019 12:57:35|Anton|в ПСБ берут комиссию за депозитарку  это у них называется комиссия биржи, там деститысячные доли процента списываются каждый год вроде
22|11.01.2019 13:00:47|Admiral Benbow|Я жду в этом году USD в коридоре 65  69. Вероятность похода на 63 равна походу на 72. Про форс мажор помолчу, теханалитики ждут и 82 в этом году.
23|11.01.2019 13:01:50|Harry Lime|Об,емы покупки ЦБ несущественны , дневной оборот доллара на Мосбирже 2030 ярдов.
25|11.01.2019 13:05:15|Anton|
26|11.01.2019 13:05:25|YK911|Налоги да, они за рубль.
27|11.01.2019 13:06:22|Harry Lime|Если нет санкций и нефть хотя бы сильно не падает  все за рубль.
28|11.01.2019 13:07:26|YK911|Просто покупки цб валюты никак не способствуют укреплению рубля, то что не рушат его из за небольших объемов соглашусь
29|11.01.2019 13:09:06|Oleg Egorov|После последних заявлений ФРС это еще не конец коррекции доходности, видимо
30|11.01.2019 13:09:13|Максим Кочнев|Из истории в конце года почти всегда максимум по выплатам внешнего долга. Изза этого больший спрос на валюту и т. д. Тоже население на нг едет за бугор и покупает валюту, эффект маленький но есть. В начале года все возвращается на круги своя плюс налоги и тд следовательно курс не то что укрепляется, он восстанавливается от падения в конце года
31|11.01.2019 13:09:41|Harry Lime|В ЦБ тоже стараются купить подешевле.
32|11.01.2019 13:10:01|YK911|Большое влияние правило оказывает на курс национальной валюты. Если раньше при повышении цен на нефть рубль укреплялся изза роста продаж валютной выручки экспортерами, то теперь этот эффект компенсируется за счет покупок валюты Минфином. Аналогично, при падении цен на нефть ниже базовой цены продажи валюты из ФНБ будут поддерживать российский рубль.
34|11.01.2019 13:11:27|Admiral Benbow|Верно на 100. Делайте выводы о будущем курсе
35|11.01.2019 13:12:20|YK911|по бюджетному правилу, интервенции ЦБ направлены именно на сдерживание курса рубля
36|11.01.2019 13:13:32|Oleg Egorov|Слышал мнение, что бюджетное правило навязано нам МВФ, чтобы нивелировать выгоды для нашего бюджета/экономики при повышении цен на нефть
37|11.01.2019 13:14:46|YK911|Это уже второй вопрос  я тоже считаю, что если бы мы доп доходы вкладывали в экономику, а не под матрас, то она бы росла
40|11.01.2019 13:17:09|Oleg Egorov|И на эти бабки тарит трежерис USA, финансируя их бюджет. Очень удобно...
41|11.01.2019 13:17:56|YK911|Ответ на что
46|11.01.2019 13:21:46|А что ты сделал для котэ!?|В период снижения с 70 до 57, этотправило как раз ещё не действовало
47|11.01.2019 13:22:27|Сергей|Много инфы по долларам, спасибо, надо переварить
48|11.01.2019 13:23:59|YK911|Ага продаем ресурсы, выручку даём в кредит штатам по 2.7, а малому бизнесу в рф под 15
51|11.01.2019 13:27:00|Oleg Egorov|Самое пикантное, что штаты являются эмитентом доллара, и для обслуживания своего долга просто печатают деньги, экспортируя свою инфляцию
52|11.01.2019 13:28:05|YK911|Правило, действует с 2018 года, но в рамках правила покупка валюты направлена на сдерживание роста рубля, а не наоборот
55|11.01.2019 13:34:40|Harry Lime|Кстати бабушкины пенсии  серьезный локомотив в экономике. Огромное количество потенциально трудоспособного населения сидит на их шеях. Они же фондируют Сбер в немалой степени.
56|11.01.2019 13:34:42|YK911|У нас в стране крайне не хватает ликвидности, для запуска экономики нужно вкладывать в людей, а не в резервы или олигархов
57|11.01.2019 13:36:00|Harry Lime|Мы теперь в юань больше.
58|11.01.2019 13:36:08|Сергей Ковалев|скажите что уходите к другими, вам там предложили более лучшие условия
59|11.01.2019 13:36:41|YK911|Как всегда удачно
60|11.01.2019 13:37:10|Harry Lime|Да сегодня уже было интересное про Китай
62|11.01.2019 13:39:17|YK911|Даёшь Бабушек на фонду Как в штатах 
63|11.01.2019 13:39:42|Harry Lime|Им Кэшберри помогает инвестировать с умом
65|11.01.2019 13:41:00|Admiral Benbow|Меня все устраивает. Чисто спортивный интерес был в звонке брокеру
66|11.01.2019 13:42:38|Антон|Только ещё не забываем учесть такой немаловажный фактор, как курс евро/доллар, который в начале 2018 года был 1.221.24, а к концу года упал до 1.13. Почти 10 фигур вниз по евро и, соответственно, вверх по доллару. То есть вначале 2018 года ещё действовал фактор дешёвого доллара на мировом рынке
67|11.01.2019 13:43:54|Harry Lime|Евро восстанавливается , если ФРС притормозит со ставкой , а ЕЦБ свернёт QE может уйти к 1,3 и выше.
68|11.01.2019 13:44:46|Антон|Тогда и доллар уедет ниже 60, верно
69|11.01.2019 13:44:56|YK911|Я вижу решение многих проблем очень простым, все сверх доходы напрвалять на кратное увеличение зарплат всем бюджетникам, кроме чиновников, у кот они и так шкалят, а они их уже понесут частному бизнесу и маховик закрутился. Просто у нас ежегодно выделяються ярды на развитие экономики и все они оседают в 23 банках и нескольких госкомпаниях
70|11.01.2019 13:46:37|А что ты сделал для котэ!?|Это все очень замечательно Но может не стоит все жтотобсуждать в теме бондов и валюты
71|11.01.2019 13:46:47|Oleg Egorov|Если доходы направлять на обеспечение 100 го соблюдения законов, то все остальное люди сделают сами
72|11.01.2019 13:47:06|Антон|Но опять же, для ЕЦБ падение цен на нефть по части инфляции есть негативный фактор, т.к. эта самая инфляция перестаёт расти. А даже может быть обратный эффект. И, вероятно, в будущем опять придётся не то, что что останавливать печатный станок, а наоборот, заново запускать
73|11.01.2019 13:47:21|YK911|
74|11.01.2019 13:54:26|А что ты сделал для котэ!?|Если уж говорить про макроэкономику  я бы предложил обсудить, как соотносится падение доходностей по бондам последние пару недель и повышение ставок по депозитам и ипотеке госбанками. Снижение дох временно Или госбанки слишком неоперативно реагируют на рынок
75|11.01.2019 13:57:36|Максим Кочнев|Помоему у банков проблема оттока денег с вкладов. Тут чисто крнкуренция
76|11.01.2019 13:57:57|Zuev Aleksandr|https//ru.m.wikipedia.org/wiki/Голландская_болезнь
78|11.01.2019 13:59:09|Дмитрий Адамидов|Это скорее про то, что в экономике нет хороших объектов для инвестиций. Что и было в Голландии  все построено, вкладывать некуда, все идет в потребсектор
80|11.01.2019 14:01:15|Zuev Aleksandr|Так и у нас также
81|11.01.2019 14:01:49|Дмитрий Адамидов|у нас другая причина  ИгорьИваныч коллективный. вкладывать есть куда, но рейдерство отбивает желание
84|11.01.2019 14:04:06|Zuev Aleksandr|А рентабельность не важна
85|11.01.2019 14:04:26|Дмитрий Адамидов|там рентабельность вполне
87|11.01.2019 14:04:48|Zuev Aleksandr|Круто
88|11.01.2019 14:06:12|Дмитрий Адамидов|На Мосводоканал стоит посмотреть. Империя А ещё региональные водоканалы, которые в концессии у Альфа Групп. И туда не подобраться  я имею в виду концессии водные. Отстреливают на дальних подступах.
90|11.01.2019 14:19:08|Admiral Benbow|А между тем Мордовия 03 уже от сентябрьских lt100 до 103,7 отросла
91|11.01.2019 14:25:31|YK911|Ну уж лучше деньги на пенсии и зарплаты пустить, чем они осядут в банках и оффшорах через госконтракты и поддержку экономики
92|11.01.2019 14:34:09|Mikhail Golovkin|Смотря что считать страной. Если людей которые в ней живут, то может и станет
93|11.01.2019 14:34:32|YK911|Вы правы. Проблем у нас много, скорректирую свою мысль, повышение зарплат это не панацея, все хорошо в комплексе, развитие малого бизнеса, импортозамещение, рост реальных доходов населения. Я про бюджетников написал скорее в том смысле, что малый бизнес и сам попрет если подрастет покупательская способность. Извините за оффтоп
94|11.01.2019 14:39:01|Александр Нечаев|Даже 98 было, но сразу после новостей кто не очканул взять в хорошем профите
95|11.01.2019 14:39:30|Harry Lime|Наши коллеги из чата вестимо
96|11.01.2019 14:40:08|Александр Нечаев|Как раз в чате шутили про Мордор
97|11.01.2019 14:40:10|YK911|Конечно, рынок сам способен развиться, но только в условиях честной конкуренции, а для этого нужна независимая судебная система, прокуратура и честные выборы  основа любого гражданского общества
98|11.01.2019 14:43:43|Admiral Benbow|Я по 101 взял
99|11.01.2019 14:45:14|Siceo|Нефига себе набежало на первый рояль.
100|11.01.2019 14:51:23|Harry Lime|Докладаю, один эмитент структурных бумаг ваяет ноту из американских ВДО с большой дюрацией. Есть даже любимые мной бумаги внутри.
101|11.01.2019 14:52:52|Сергей Ш|А где можно про ноты вообще почитать Их на Московской бирже покупают
102|11.01.2019 14:55:10|Harry Lime|У нас выбор невелик. А из бондов там внутри будет любимый мной ФрипортМакморан.
104|11.01.2019 14:57:58|YK911|BCS Excess BeCauseShit Happens Excess. Канал о подводных камнях инвестиционных нот , структурных продуктов и прочих производных финансовых инструментов. CAVEAT EMTOR  c лат. пусть покупатель будет бдителен  https//t.me/bcsexcess
105|11.01.2019 14:58:44|Сергей Ш|А насчёт почитать Что это и как по ним играть
106|11.01.2019 14:59:15|Harry Lime|Насчёт играть  на свой страх и риск.
107|11.01.2019 15:20:02|Anton E|В Оптимальном ещё будет отдельно комиссия депозитария, уточняйте. В Мобайл её нет
108|11.01.2019 15:43:15|Artem|подскажите по первичному размещению с голоса подать не получается в квике в режиме РПС первичное размещение нашел мсблизинг указал код расчета,цену,количество партнер выставился автоматом, но не совпадает с кодом контрагента в скрипте, в ручную пролистал этих партнеров, не нашел кб сстб как быть просто вставить код из скрипта или как провернуть через квик
110|11.01.2019 15:52:51|Карим|А почему Роял 2 неликвидный такой
112|11.01.2019 16:11:38|Harry Lime| CNY ЦБ Китая обеспокоен резким ростом юаня PBOC SEEN WARY OF SHARP APPRECIATION BY THE YUAN, MNI REPORTS  BBG
113|11.01.2019 16:11:59|Harry Lime|Что значит обеспокоен , а наш ЦБ как же...
114|11.01.2019 16:12:10|Максим Кочнев|Потому что продавать смысла нет. Месяц назад размещение было, куда торопиться. И покупать, это надо о нем знать. А кроме чата о нем мало кто знает
115|11.01.2019 16:13:05|Siceo|По нашему уже давно можно литургию исполнять.
116|11.01.2019 16:23:15|А что ты сделал для котэ!?| В прошлом году евробонды европейских банков UBS, HSBC, Credit Suisse, Nordea, Barclays, Societe Generale и другие потеряли в цене 1520. Повод ли это, чтобы их купить читать текст интервью Дорофеев пятницаидей евробонд UBS HSBC CreditSuisse Nordea Barclays SocieteGenerale
117|11.01.2019 16:26:15|Harry Lime|Я не в этом смысле , ЦБ теперь в юане по уши , только появилась возможность отыграть потери.
118|11.01.2019 16:27:04|Дмитрий Адамидов|да им по фигу на потери кмк
120|11.01.2019 16:27:40|Harry Lime|Конечно пофигу.
122|11.01.2019 16:28:23|Siceo|Дедоллоризация же полным ходом и плевать на всё.
123|11.01.2019 16:29:11|Deleted Account|А сколько в псб мин сумма для открытия счета
124|11.01.2019 16:31:52|BoRo DA|0 руб
125|11.01.2019 16:34:02|Дмитрий Адамидов|на самом деле если ты вышел из трежерей, то реально некуда припарковать в доллларах такую сумму 86 ярдов чтобы рынок не раскачать
129|11.01.2019 16:40:31|Александр Нечаев|Там просто сстб, без кб
130|11.01.2019 16:41:40|Artem|да, уже рахобрался, спасибо
131|11.01.2019 17:55:15|Denis Droga|Наши подписчики и неравнодушные люди задавали ряд вопросов про одного из наших же эмитентов  про ОбъединениеАгроЭлита. Эмитент дал очередную порцию ответов.
132|11.01.2019 17:56:15|Denis Droga|Я смотрю они в основном от Гарри обивались
133|11.01.2019 18:03:49|Artem|да, все купилось, упало на счет по 100, и показывает 0,14 по сделке
134|11.01.2019 18:18:25|Leo|Нам до китайской пирамиды ещё расти и расти, поэтому ГТЛК и Ко пока что не токсичный актив
135|11.01.2019 19:03:58|Mikhail Golovkin|Получается даже прибыль до налогов больше выручки
136|11.01.2019 19:10:13|Alex Petroff|Мясо в смысле инвесторы
137|11.01.2019 19:18:07|Evgeny|Это все реклама иис из каждого утюга
140|11.01.2019 19:44:13|Deleted Account|В открывашке без всяких плясок с бубнами 10 р в месяц Зато в втб вывод купонов на банковский счет Везде свои плюсы
141|11.01.2019 20:11:26|А что ты сделал для котэ!?|Кстати, по тарифам Альфы Щас проверили тариф дочки  у нее таки новичок или как то так  0,3 от сделки. Всем ставится на автомате, потом менять в личном кабинете с большим геммором
142|11.01.2019 20:15:20|Oleg Kopylov|В сбере также
143|11.01.2019 20:15:59|А что ты сделал для котэ!?|А я в сбере посмотрел  там вроде у всех 0.15 от сделки
144|11.01.2019 20:17:28|Harry Lime|Нет конечно , в Китае я так понял вывели на облигационный рынок кучу частногосударственных компаний. В случае с ГТЛК российский аналог чиновника Сяо Чжана уже принял верное решение. На шаг впереди получается.
145|11.01.2019 20:18:42|Дмитрий Адамидов|В том и дело что ГТЛК квази гос. По ее обязательствам государство отвечать не будет
150|11.01.2019 20:23:58|Harry Lime|И самый большой приток был на падении ставок депозитов в мартеапреле. Вообщем кто поумнее не купил Сбер по 285 , тот зашёл в суборды РСХБ по номиналу.
151|11.01.2019 21:16:44|Evgeny|С 200 лям Ну это вряд ли.. ВТБ сразу предложит Прайм пакет и отдать в ДУ.. хотя при сумме от 1 млн баксов большой выбор ДУ в принципе.
153|11.01.2019 21:19:25|Evgeny|И потфель состоит только из облиг ВТБ Сам так решил что ли..
154|11.01.2019 21:23:33|Harry Lime|Мне кажется это разумный вариант , инвестиции на 10 млн и 200 это две большие разницы. В таком варианте только выбор надёжных и ликвидных инструментов.
159|11.01.2019 21:32:55|Evgeny|А... Я думал это вопрос всей суммы в 200м с которой человек на инвест живет, а это только часть..так припарковать. Ну это другой вопрос тогда
160|11.01.2019 21:35:54|Harry Lime|Это мясо , кого надо мясо , ничего ему не будет , так как задача верно поставлена и иллюзий нет. Получит через полтора года 8,15 , больше депозита. Это отлично. Надёжно. А когда люди вкладывают в акции Сбера , потому что они выросли за прошлый год на 30 процентов. Ну ну.
161|11.01.2019 21:39:49|Evgeny|Но сбер всяко лучше, чем в кэшбери нести... 
164|11.01.2019 21:47:54|Harry Lime|Я общался с человеком , кому крупная УК просто купила вечник материнского банка на размещении по 100. Полный лот 200 к usd. И драла за это комсу по ДУ. Есть чего ДУшить по сравнению с таким.
166|11.01.2019 21:53:59|А что ты сделал для котэ!?|Что за канал
167|11.01.2019 21:55:36|Harry Lime|Я цитировал из них про вечники сегодня , Альфа велс вестимо.
169|11.01.2019 21:58:35|Evgeny|Ду из Вдо бысто упрется в наш мелкий рынок, зачит выход на мир, а там валютный риск, значит инструменты защиты.. ну и плюс потенциальные дефолты, которые надо компенсировать.. короче прилично рисковая штука будет
170|11.01.2019 22:00:08|Harry Lime|Это все уже украдено до нас . Давно делают люди. Но я думаю там пороги входа уже от 1 млн долларов и больше. Про рубли разговор.
