|time|user|text
372|14.09.2019 11:52:01|Rifnur|Расчёт на 50 амортизацию в июне 2020, где цена тела в теории будет 100. Конечно вся конструкция не учитывает валидольных случаев
373|14.09.2019 11:53:21|Alex Petroff|По поводу законопроекта, его прохождения и т.д. https//sozd.duma.gov.ru/bill/6188777
374|14.09.2019 11:55:31|Alex|простой квал это от 10 млн
375|14.09.2019 11:57:40|Шура SiberianRanger|Это старая версия, там свежая, которую приняли в первом чтении, в RTF хотя возможно они одинаковые
376|14.09.2019 11:59:41|Дмитрий Адамидов|Если так все и остаётся у нас выпадет 60 соратников по меньшей мере. Если не 70
377|14.09.2019 12:01:06|Rifnur|Был опрос на размер портфеля, может повторить и узнать
378|14.09.2019 12:02:04|Dmitry Manzor|Если ВДО будет от 10млн, то чат потухнет и будет группа И это будет печаль
379|14.09.2019 12:02:19|Алексей ayaye :)|почему 100
380|14.09.2019 12:03:52|Alex Petroff|Законопроект с правками Минфина, принятый Думой в первом чтении.
381|14.09.2019 12:05:17|Maksim|мне интересно, кто лоббирует закон и по какой причине Мы же все понимает, что формализация тех или иных идей и оформление их в виде нормативноправового акта у нас происходит не в результате прений и состязаний в представительном органе о том, как сделать людям еще более лучше. Идею о госбанках я отметаю. Иначе бы они не стали спускать те суммы, которые они спускают на популяризация продукта  брокерский счет. ЦБ я тоже откидываю, так как риторика и действия в противоположном направлении тем более это ЦБ сейчас вводит норму, по которой нормы резервовб банками ниже для компаний, у которых те или иный ценные бумаги обращаются на бирже
382|14.09.2019 12:05:31|Alex Petroff|Иволга уже замутила ДУ... Но это всего лишь один из вариантов развития событий. Поверьте, есть еще один, а может и парочка. Но всему свое время. Терпение
383|14.09.2019 12:07:25|Dmitry K|А почему отметаете Загнать народ на брокерский счет  это одно, а вот терять клиентов, которые раньше занимали у банков, а теперь пошли выпускать облигации  это совсем другое
384|14.09.2019 12:08:29|Maksim|если вы про корп кредитование, то оно стагнирует уже давно и ни одного драйвера не вижу..
385|14.09.2019 12:12:46|Dmitry K|Вот они видимо тоже не видят. И пытаются его подрастить за счет сокращения числа тех, кто сейчас облиги выпускает.
386|14.09.2019 12:13:57|Алексей ayaye :)|как я понимаю, далеко не все эмиссионеры облигаций интересны банкам. это ж мы доверчивые в долг без залога даем 
387|14.09.2019 12:17:44|Maksim|ну, кстати, да.. для банка ведь заработок на кредитах  не самый простой. Нужно маринкам платить, мониторить состояние кредитора, разные технические решения придумывать для взаимодействия, резервы отчислять, еще big4 потом будет проверять все ли правильно отчислили, еще 100500 отчетов ЦБ писать.. А в данном случае комисионный доход  поднял сервак, написал приложуху на коленке это я про сбер и смотри как деньги капают. Но это в теории
388|14.09.2019 12:23:12|Harry Lime|А вы не думали о том , что банк хеджирует так свой выданный займ , когда эмитент занимает через облиги Условный эмитент должен банку , они организуют выпуск , чтото берут на себя , потом выливают в стакан . Займ банку гасят .
389|14.09.2019 12:31:15|Kirill|Из последней редакции следует, что ВДО 3 листинг возможен также для простых неквалов gt400тыр, после некоего тестирования по отдельной группе инструментов. Цитата сделки, направленные на приобретение ценных бумаг, не предусмотренных подпунктами 1 и 2 пункта 5 настоящей статьи, за исключением финансовых инструментов, предназначенных для квалифицированных инвесторов, и или заключение договоров, являющихся производными финансовыми инструментами,  по итогам прохождения простым неквалифицированным инвестором тестирования, проводимого брокером по заявлению такого инвестора в целях оценки приемлимости характеристик данного финансового инструмента, продукта или услуги для конкретного клиента далее  тестирование.
391|14.09.2019 12:40:59|Andrey Solyanik|Спасибо. Это важное уточнение.
392|14.09.2019 12:42:48|Alex|Если платить налог с тела, то 1 выпуск получаетя с доходностью к погашению 14,3, если ставка не упадет ниже 6.
393|14.09.2019 13:04:21|Rifnur|А у меня получилось 14.48. От 30 рублей будет налог 13. Это 3.9 руб. Значит если брать по 970 и плюс данный налог, то будет 973.9, что даст рост 2.61. Купон будет 8.25 за 9 месяцев. Итого 14.48 годовых. ВДО 16 даёт чистыми без роста тела 14.69. Пока похоже рано
394|14.09.2019 13:05:57|Alex|там два аморта, поэтому я считал через XIRR
395|14.09.2019 13:28:13|ПАЕ|По текущему законодательству, статус квала можно получить в т.ч., если совершал сделки с ценными бумагами и или заключал договоры, являющиеся производными финансовыми инструментами, являющиеся Активами, за последние 4 четыре квартала в среднем не реже 10 раз в квартал, но не реже 1 одного раза в месяц. При этом совокупная цена таких сделок должна составлять не менее 6 миллионов рублей. Не понятно, что считать совокупной ценой... ежемесячный оборот Квартальный Годовой 4 квартала Ктото получал квала по данному условию
396|14.09.2019 13:31:50|Harry Lime|Получал по обороту в ВТБ Alex Petroff , можно его попытать в личку
397|14.09.2019 13:33:38|Сергей Бацаца|Исходя из конструкции диспозиции нормы  годовой.
398|14.09.2019 13:35:36|Harry Lime|Если претендент систематически работает с фьючами и за последний квартал прогнал 6 млн , можно получить быстро
399|14.09.2019 13:38:24|Сергей Бацаца|Формулировка за последние 4 квартала меня смущает, какбудто год нужно доказывать, что ты достоин иметь сей статус.
400|14.09.2019 13:48:05|Harry Lime|10 сделок с фьючами в квартал за год и прогон 6млн за последний скажем квартал  вы квал
401|14.09.2019 13:48:22|Елена Филякина|Вот древние римляне законы могли принимать на 12 таблицах гравировку сделали, на центральной площади разместили всё. Мы же миллион чтений мусолить будем, а потом все с ног на голову перевернут.
402|14.09.2019 13:50:34|Сергей Бацаца|Наверное ещё увидим не одно разъяснение ЦБ по грядущему закону
403|14.09.2019 13:51:31|DIM|Да я аналитику читаю, ожидания вижуно время покажет
404|14.09.2019 13:52:43|Елена Филякина|Берем 1 контракт сишки, гоняем 31 раз в месяц, повторяем 3 месяца подряд  звоним брркеру, качаем права. А при должном умении и везении еще и профит получим.
405|14.09.2019 13:53:16|Harry Lime|Мне кажется так и есть
406|14.09.2019 13:54:01|Dmitry Manzor|Сколько за комиссию отдать придётся
407|14.09.2019 13:55:25|Елена Филякина|Это же фьючерсы копейки. ГО на сишку менее 4,5 тыс. 2 рубля за сделку у ВТБ.
408|14.09.2019 13:55:28|Павел|Минфин загнать всех в офз
409|14.09.2019 13:55:34|Harry Lime|Главное , чтобы в законе осталась норма по старым квалам
410|14.09.2019 13:56:34|Aleksandr|Будут квалы в законе
411|14.09.2019 14:00:30|Елена Филякина|Делай что должен и будь что будет.
412|14.09.2019 14:01:35|Alex Petroff|Да. Без проблем. Брокер ВТБ. Заявление ногами в офисе. Три дня ожидания. И здравствуй новый дивный мир.
413|14.09.2019 14:04:02|Елена Филякина|
415|14.09.2019 14:20:31|Maksim|Девиз инвестора на российском рынке
416|14.09.2019 14:22:02|Alex Petroff|Там ситуация была привязана не к августу Я выбрал самый такой путь...как бы сказать, ну в общем как у нас в стране, путь через ж...пу Надо ж было подумать. А думать ну никак. Плюс я же только ВДО покупал/продавал и иными инструментами не пользовался. А попробуй погонять ВДО на всю котлету у меня правда не прям котлета, котлетка скорее В общем начал гонять с января 2019. Не токмо процесса для, но и со спекулятивными целями. В первом квартале до 6 млн. немного не дотянул. Во втором квартале, уже твердо сделал. В третьем сделал...больше, чем в первые два. Посчитал, почитал условия и пошел в офис. А там Маринка подкованная такая сидит...и человеческим голосом спрашивает  а по какому признаку вы Имярек хотите заиметь квала Ну и я говорю  по признаку оборота. А она видимо заявление изпод брокерского компаунда заполняет и кивнула мне головой, дескать прокатит. А в августе просто я на всю котлету переложился дважды тудасюда и только в нем 14 получилось. Но переложился не просто так, а с конкретной целью и результатом, которые достигнуты. Но это уже бравада.
417|14.09.2019 14:24:21|Елена Филякина| Веди нас в Светлое Будущее добрый человек
418|14.09.2019 14:25:12|Alex Petroff|За светлое будущее у нас отвечает OrsonWelles  Я тут так...мусор убрать, пыль протереть
419|14.09.2019 14:25:50|Елена Филякина|Серый Кардинал значит, так и запишем.
421|14.09.2019 15:14:38|And|А сколько в Финам нужно сделать оборот и за какой срок
423|14.09.2019 15:18:28|Alexey|Не дай бог еще в процессе подготовки и обсуждения законопроектов кто нибудь дефолтнет
425|14.09.2019 15:20:29|Михаил Широковских|Нужно оборот 6 млн за квартал или за год
426|14.09.2019 15:22:40|godspeed|берёшь сто тысяч и гоняешь сишку за день столько наберешь
427|14.09.2019 15:30:54|GB|В ВТБ сказано так 3. Иметь оборот по сделкам с ценными бумагами и другими инструментами за последние 12 месяцев  от 6 млн . Частота сделок  не реже 10 в квартал, минимум  одна в месяц.
428|14.09.2019 15:46:04|Михаил Широковских|Спасибо
429|14.09.2019 15:49:40|Marat D|Их самих надо проверять на грамотность Чтобы получить возможность покупать и продавать более 10 000 инструментов, которые торгуются ведущих зарубежных биржах, нужно получить статус квалифицированного инвестора. ..... 2. Иметь опыт работы в профессиональном участнике рынка ценных бумаг от 2 лет в компании со статусом квалифицированного инвестора или от 3 лет в остальных случаях.
430|14.09.2019 15:59:55|Maksim|Была же раньше. В т.ч. У открывашки. Именно столько и стоила. Сейчас почемуто прикрыли
431|14.09.2019 16:17:01|Кирилл|Любят у нас вводить ограничения без всякой логики. Как будто количество денег на счету хоть както коррелирует со знанием рынка. Также как и транспортный налог с л.с.
432|14.09.2019 17:07:10|And|а в Альфе ктото квала получал Какие условия
433|14.09.2019 17:16:51|Bugsy|А что такое Белиз
434|14.09.2019 17:18:19|Dmitry Manzor|Офшор
436|14.09.2019 18:53:07|Шура SiberianRanger|Фридом Финанс вестимо
437|14.09.2019 18:54:28|Marina Bortova|Какие есть вопросы по Башкирской содовой, спрашивайте Правительству Башкирии принадлежит 38, к слову. 
438|14.09.2019 18:54:58|Dmitry Manzor|Когда закончится сода
439|14.09.2019 18:55:43|Marina Bortova|Никогда Сода вечна 
440|14.09.2019 19:10:31|Максим Кочнев|ммм а почему должны быть вопросы по содовой
441|14.09.2019 19:26:50|Harry Lime|Когда доха приблизится к 12 , тогда и стоит задавать вопросы по БСК
442|14.09.2019 19:31:01|Vadim Asanbaev|Либо просто в ПР переложиться без вопросов
443|14.09.2019 19:33:34|Dmitry Manzor|Девушка утверждает, что сода вечна. А лизинг
444|14.09.2019 19:35:41|Vadim Asanbaev|Еще во 2ую мировую лендлиз был, так что тоже тоже вечная тема, а сейчас тем более актуальная, тема шеринга, люди типа хотят не владеть а пользоваться , а это лизинг 
445|14.09.2019 19:36:05|Елена Филякина|
446|14.09.2019 19:58:26|Harry Lime|Я хочу пояснить вам наглядным примером,  сказал президент.  Если горит дом соседа, а у тебя есть садовый шланг, одолжи его соседу, пока не загорелся и твой дом. Когда пожар будет потушен, сосед вернет тебе шланг, а если тот окажется поврежденным, то заплатит за него, когда поднакопит деньжат. Рузвельт про лендлиз
447|14.09.2019 20:15:51|Vadim Asanbaev| не прям бизнес идея лизинга конечно, но очень близко, право собственности позволяет в зависимости от складывающейся ситуации назначать цену за владение
449|14.09.2019 21:10:48|Владимир Тутынин|Не прокатит. Если статус присвоен с нарушениями, брокер обязан покрыть все убытки которые понес инвестор вместе с комиссиями.
451|14.09.2019 23:45:56|DIM|Как какие условия для втб необходимо выполнить, чтобы получить статус квала
454|14.09.2019 23:57:03|DIM|Те главное условие 6 лямов, если не соблдаешь брокер не даст квала
455|14.09.2019 23:58:18|Sergey Ustinov|1 сделка в месяц, 10 в квартал, и так 4 квартала  6 млн. Выполнил и квал твой
456|14.09.2019 23:59:38|DIM|Гдето тут читал, что статус квала дают намного проще какие то брокеры
458|15.09.2019 00:00:00|Sergey Ustinov|Так это самый простой
460|15.09.2019 00:01:54|Viis|Ещё простой вариант это диплом экономиста или несколько лет опыта работы в финансовой компании.
461|15.09.2019 00:03:20|Sergey Ustinov|Да уж проще мне с 7ю классами и оборотом в 6 Лямов дадут, а вам учиться 5 лет в универе 
462|15.09.2019 00:04:03|DIM|Что за диплом экономиста экономисты разные бывают
463|15.09.2019 00:04:34|Viis|Ну а 6 миллионов заработать надо  То же дело не простое. А диплом может уже есть у человека.
464|15.09.2019 00:05:35|Sergey Ustinov|Зачем Берёте фьючерс на доллар и гоняете. На ГО только нужны деньги. А это на порядок меньше
466|15.09.2019 00:05:44|Viis|аттестат о высшем экономическом образовании, или аттестат ФСФР любой серии, или квалификационный аттестат аудитора, или квалификационный аттестат страхового актуария, или CFA, или CHA, или FRM
468|15.09.2019 00:08:34|DIM|Ну у меня например есть второй диплом по экономическому образованию, по теме экономика фирмы
469|15.09.2019 00:12:15|Viis|Насколько я понимаю, вот этот приказ ЦБ описывает все условия http//www.consultant.ru/document/cons_doc_LAW_180527/cd268b0476ee1900eab615ce5a1811ac4063f492/
470|15.09.2019 00:50:58|Алексей RM|В Финаме спрашивал про статус квалифицированного инвестора. Сказали, что или да, обороты нагнать как написано выше. Или иметь на счету не менее 6 млн. руб. в БУМАГАХ, а не просто деньгами НКД, при этом, в расчёт не берётся Т.е. чисто стоимость ценных бумаг должна быть выше 6 млн. и тогда дадут квала Вопрос, что будет если потом денег на счету станет меньше снял, перевёл на другой счёт к этому же борокеру, перевёл к другому брокеру, неудачно инвестировал и получил убыток, изначально это были заёмные деньги чисто получить квала и вернуть и т.д.  не понятно. Когда будет ближе к вопросу получения квала  буду уточнять.
471|15.09.2019 00:55:59|DIM|Спасибо
472|15.09.2019 06:07:42|sergei begreater|В защиту Открытия ногами идти никуда не надо, написал своему менеджеру в WhatsApp, получил по почте заполненное заявление, подписал, сфоткал, отправил. После обеда получил уведомление, что ты квал. Другие вопросы, например, перевод бумаг с ИИС по этой же схеме. В офисе вообще не бываю.
474|15.09.2019 06:59:36|Denis|Как раз таки не вечна....Вроде как проблемы с ресурсами у них намечаются
475|15.09.2019 07:28:36|Потапыч|Лайфхак Квал за 30 тысяч рублей. 1. Переводим 30 тыс. руб. на срочный рынок. 2. В вечернюю сессию с 1900 по 2350 покупаем, а затем продаём по той же цене, или на шаг выше, 1 лот MIX фьючерс на индекс ММВБ Повторяем эту операцию 4 раза. За 15 минут месячная норма выпонена оборот 2 млн. рублей. 3. Выводим 30 тыс. рублей на фондовый рынок. 4. Через месяц повторяем процедуру. Через год пишем брокеру заявление на квала. Почему мы это делаем с фьючерсом MIX Потому, что он самый большой. Почему в вечернюю сессию Потому, что в это время базовый актив расчётный индекс ММВБ не торгуется. Поэтому MIX практически стоит на месте.
476|15.09.2019 07:33:44|Marina Bortova|Язам гендир БСК
477|15.09.2019 07:45:31|Елена Филякина|А если в этом сообщении ктото хоть одно слово не понял, то ему квала точно не нужно  Достаточно для начала сайт Московской биржи поизучать.
478|15.09.2019 08:10:19|Harry Lime|Мне кажется тупой закон прям просится , чтобы его побили подобными методами. На Кафку надо отвечать Кафкой.
479|15.09.2019 08:16:19|AndreyKa|А если у тебя брокерскому счёту меньше года , а обороты 6 млн. квала дадут
480|15.09.2019 08:18:41|Елена Филякина|Как показала практика, в Финам и Тинькофф можно таким способом через полгода после открытия счета получить. Нужно у своего брокера уточнить.
481|15.09.2019 08:19:19|AndreyKa|у меня БКС
482|15.09.2019 08:20:06|Елена Филякина|Уточните у своего менеджера.
483|15.09.2019 08:20:15|AndreyKa|уточнял разные сотрудники говорят разное
