|time|user|text
606|24.09.2019 19:50:48|Сергей Ковалев|добавте меня еще туда мне отдкльное письмо слали еще днем
607|24.09.2019 19:50:50|Alex Petroff| у вас на стройке ВДО были неполной аллокации случаи  нет  будут
608|24.09.2019 19:50:58|Harry Lime|Пара человек из списка ухмыльнулась при этих словах
609|24.09.2019 19:50:59|Alexey|Как же обидно все равно. Если бы не чиновники  получили бы за годдва огненный правда во всех смыслах рынок hy местный
610|24.09.2019 19:51:29|Замполит Aleks Kib|Гарри увидел, Илью, Алексея Вишнякоффф и т. д.
611|24.09.2019 19:51:31|Евгений Коломна|Подать не проблема, стоило ли тогда заморачиваться и надеяться все это время
612|24.09.2019 19:52:40|Evgeny P|Церих обьединяет ...
613|24.09.2019 19:53:30|Harry Lime|Представляете зафигарят всем по одной бумаге и 24 млн на одного клиента
615|24.09.2019 19:54:48|Evgeny P|куплю жевачки на 
616|24.09.2019 19:54:52|Ilya|Усе пришло
619|24.09.2019 19:57:18|Евгений Коломна|с какого адреса я с Онищуком по этому общался onishchukzerich.com , но меня видимо забанил
620|24.09.2019 19:57:31|Ilya|Да с этого
621|24.09.2019 19:57:48|Andrey Hohrin|зато жить весело. мир без чудес чернобел
622|24.09.2019 19:58:16|Евгений Коломна|Ну я ему сейчас написал, пожелал спокойной ночи
623|24.09.2019 19:59:14|Evgeny P|и так 130 раз 
624|24.09.2019 19:59:44|Ilya|Могу им в личку скинуть твоё мыло
625|24.09.2019 20:04:18|Александр Нечаев|Я как раз по этой причине не стал писать
626|24.09.2019 20:04:31|Denis Kozlov Septem|были. только мы мелкие заявки не резали
627|24.09.2019 20:08:40|Евгений Коломна|Пиши им, не пиши  насильно мил не будешь, заявку утром поставлю, но впредь буду брать первичку только у нормальных оргов
628|24.09.2019 20:09:15|Harry Lime|Денис , а правду говорят , что регулятор рекомендовал Ломбарду закрыть точки в Перово и Чертаново 
629|24.09.2019 20:10:35|Denis Kozlov Septem|Нет, там работают ломбарды. Их переформатировали под работу с мелкими заемщиками. Теперь это Ломбард МастерОк
631|24.09.2019 20:12:10|Harry Lime|Это точки Ломастера или франшиза
632|24.09.2019 20:12:42|Denis Kozlov Septem|Пробуют новый формат. Не франшиза
633|24.09.2019 20:13:18|Harry Lime|Отлично , значит недруги клевещут
634|24.09.2019 20:13:29|Denis Kozlov Septem|В Ежеквартальном обзоре раскроем
636|24.09.2019 20:14:27|Даниил Иванов|Регулятор рекомендовал
637|24.09.2019 20:15:20|Denis Kozlov Septem|Этого я не знаю. На Фудсити точка не раскрутилась, поэтому закрыли
638|24.09.2019 21:02:18|S.P.|Фудсити один из крупнейших тональных рынков. Если туда суется банк за исключением гос. то долго у него лицензия банковская не задерживается.
639|24.09.2019 21:04:02|Sergey Sidorov|Мастер и мастеркита роман в цифрах
640|24.09.2019 21:05:04|Pavel Usach|Да, Церих удивил. Если и правда начнут отвечать Онищуку, а ответят всем, будет весело...
641|24.09.2019 21:08:23|Sergey Sidorov|Тональный рынок это что значит
642|24.09.2019 21:08:47|S.P.|Обнальных. Автозамена
643|24.09.2019 22:04:42|Сергей Ковалев|вы поставили заявку на 25 лямов
644|24.09.2019 23:25:52|Владимир|Блин обувь сегодня размещалась. Вроде 26 должна была
645|24.09.2019 23:58:24|Denis Borisov|И мне также письмо пришло...сдаётся интересантов больше 130 человек
649|25.09.2019 00:05:07|Alexey|Дойдем ли до аллокаций по 3 проц Жаль цб вмешался а то было бы красиво  чтобы получить вдошек на 500 бумаг народ ставил бы заявки на 50000 и в один день всем бы все налили по классике как в 2000м доткомов
650|25.09.2019 00:24:15|First Last|да, мне так и сказали по телефону. вы же знаете, что заявок больше и будем резать
651|25.09.2019 00:57:03|Alexey Vishnyakov|Да  и мне письмо по моторам пришло Я уже спал. По местному где то час ночи был. Ну да ладно  скоро домой. По Москве на бирже удобнее.
652|25.09.2019 06:39:09|Kirill Streblyanskiy|24го принимались заявки в книгу. Далее размещение 26го сентября. Объем для физ лиц зарезервирован. Можно будет подавать заявки на первичном рынке
653|25.09.2019 06:46:22|IURII D.|Ждём скрипт для брокера 
654|25.09.2019 08:17:03|Александр Яско|А мы, получается, чудаки, которые его разрисовывают 
655|25.09.2019 08:20:06|Andrey Hohrin|както так. когда я начинал размещать ВДОшные бумаги, наслушался столько эпитетов на тему чудака, с разными заменами первой буквы. но ничего, песочница жива и осваивает новые площади.
656|25.09.2019 08:21:16|Harry Lime|Милкен терпел и нам велел
657|25.09.2019 08:22:11|Алексей Мелехов|
658|25.09.2019 08:27:33|Kir|Во славу милкена и святого ломастера
659|25.09.2019 08:35:43|Harry Lime|Бал хищников , Покер лжецов и Как мы проводили обмен облигаций в качестве сакральных текстов
661|25.09.2019 08:55:27|Aleksandr Mukhin|моторы размещаются через час а isin до сих пор нет. первый раз такая свистопляска
662|25.09.2019 08:56:42|Andrey Mayorov| Моторные технологии  Идентификационный номер выпуска  4B020100483R001P
663|25.09.2019 08:58:01|Даниил Иванов|Есть
665|25.09.2019 08:59:03|Aleksandr Mukhin|спасибо
667|25.09.2019 08:59:56|А что ты сделал для котэ!?|Дура дурой, а свои 5 рублей имею Я так понимаю, вместо 0,10,2 комсы при размещении больших корпоратов у вас комса 12 И с учетом отсутствия огромного количества сотрудников  рентабельность бизнеса должна быть отличной
670|25.09.2019 09:11:34|Andrey Hohrin|да, я занимаюсь строго комеерческой деятельностью. но. что принципиально важно выиграть должны три стороны  инвестор, организатор и эмитент. в общем, деятельность весьма идейная.
671|25.09.2019 09:13:25|Alex|Организатор уже выиграл. А остальные как получится.
672|25.09.2019 09:15:10|Andrey Hohrin|категорически не согласен. Вы много общались напрямую с нашими эмитентами
675|25.09.2019 09:17:36|Harry Lime|Организатор работает над отбором эмитентов  это его его основной труд , который стоит денег , дабы посмотреть примеры приходящих за деньгами компаний просто гляньте на краудфандинговые площадки.
676|25.09.2019 09:17:37|Алексей Мелехов|Красавчиг
677|25.09.2019 09:23:13|Вадим Хавин|Писать надо без ошибок Красавчег
678|25.09.2019 09:24:46|Алексей Мелехов|
679|25.09.2019 09:26:21|Alex|С чем не согласны С тем что вы получаете стейк при размещении бумаг А что вы теряете если у эмитента начинаются проблемы Разве что будущие доходы, и то не факт.
680|25.09.2019 09:28:01|Алексей Мелехов|На сколько я знаю, Андрей размещает свои в тч
681|25.09.2019 09:28:48|Alex|Извиняюсь за оффтоп. Просто хочется чтобы инвесторы не воспринимали организаторов как своих друзей, спасителей от дефолтов. Это рынок, и слабых тут пожирают
682|25.09.2019 09:30:35|Andrey Hohrin|у каждого своя правда. в моей картине мира, организатор  это не посредник, а именно создатель выпуска.
684|25.09.2019 09:31:28|Алексей Мелехов|Дело не в этом. Никто из оргов на крови не клялся и гарантии не даёт. Дело в подходе, выборе, оценке, мониторинге, раскрытии информации и пр эмитента. А не тупо срубил комис и давай до свидания
685|25.09.2019 09:36:30|Aleksandr Mukhin|https//www.kommersant.ru/doc/4103240
688|25.09.2019 09:43:00|Aleksandr|Наши коллеги из Юнисервиса тоже на таких позициях 
689|25.09.2019 09:46:29|Alex Petroff|Да, теперь чтобы в будущем вкладываться в МФО надо быть квалом. В Друзя скинул статейку на эту тему.
690|25.09.2019 09:52:16|Алексей Мелехов|Ну они в чате. Одно могу сказать, юск делает глубокий и качественный анализ своих эмитентов и голосует за них рублем. Это и видно по их размещениям. Посмотрите статистику по срокам размещения их эмитентов
691|25.09.2019 09:53:14|Alex|Кисточки финанс хорошо и качественно проанализировали.
692|25.09.2019 09:54:28|Kir|Ахах, ну прям ваще и связи с эмитентами у них нет
693|25.09.2019 09:57:12|Алексей Мелехов|В большинстве эмитентов нет связей, если вы имеете в виду участие в УК или аффилированность какую либо
694|25.09.2019 09:58:12|Andrey Hohrin|probondsмонитор  в одно флаконе, для Вашего удобства. https//www.probonds.ru/posts/77probondsmonitordohodnostirublevyhobligaciiofzsubfedykorporativnyebumagivdo.html
695|25.09.2019 09:59:18|Денис|На моторы с 10 принимают заявки
696|25.09.2019 10:00:06|Aleksandr Mukhin|да
697|25.09.2019 10:16:27|Sergey Sidorov| Никто не говорил, что работа будет легкой Но и слишком тяжелой она тоже быть не должнас  Омерзительная восьмерка 
698|25.09.2019 10:19:26|Aleksei Tuv|Втб моторы приняли
699|25.09.2019 10:19:48|Giovanni Goudini|В стакан получается поставят
702|25.09.2019 10:22:22|First Last|добрался до калькулятора  я же правильно посчитал, что выгоднее поменять часть орехов по текущей цене на моторы/обувь
703|25.09.2019 10:23:57|А что ты сделал для котэ!?|Альфа до сих пор не может ответить, удовлетворена ли заявка на обвувь Пипец
704|25.09.2019 10:25:25|Harry Lime|Она и не сможет , удовлетворение завтра
705|25.09.2019 10:26:03|Harry Lime| ГТЛК размещает евробонды в долларах Срок обращения выпуска  6 лет. Ориентир доходности по евробондам  5.255.375 годовых. С 2324 сентября компания проводила встречи с инвесторами, посвященные возможному размещению еврооблигаций. Изначально речь шла о размещении в швейцарских франках. Road show прошли в Лондоне, Франкфурте и Цюрихе. Организаторы размещения  Газпромбанк, JP Morgan, Renaissance Capital и ВТБ Капитал.
706|25.09.2019 10:26:25|Harry Lime|ГТЛК  доходней всех пока 
707|25.09.2019 10:27:04|Дмитрий Адамидов|полтора года назад им 5,35 было дорого как я помню
708|25.09.2019 10:27:15|Harry Lime|Северсталь 3,15 , Сибур 3,625, ЧТПЗ  4,5 ,ГТЛК 5,25  Есть чем гордиться
709|25.09.2019 10:27:36|Дмитрий Адамидов|ну да  гении экономии
710|25.09.2019 10:27:45|Giovanni Goudini|Для своих не жалкрг
711|25.09.2019 10:27:53|Дмитрий Адамидов|ну если только
712|25.09.2019 10:28:03|Giovanni Goudini|Они бы и 15 разместили, но неприлично
713|25.09.2019 10:28:08|Harry Lime|Я думаю это адекватная оценка рисков внешними инвесторами
714|25.09.2019 10:28:50|Giovanni Goudini|Да и внутренними тоже, вон минфин сказал на 6,6 трлн валюты купят
716|25.09.2019 10:30:02|Harry Lime|ГТЛК  ПЕМЕКС , который мы заслужили ...
717|25.09.2019 10:30:14|Maison|Что за песня... Бумага еще не разместилась, а уже апсайд
718|25.09.2019 10:30:45|Harry Lime|5,55
719|25.09.2019 10:30:47|А что ты сделал для котэ!?|Я имел в виду  какую дали аллокацию не могут сказать
720|25.09.2019 10:30:59|Alex|Любой обмен на повышенную доходность при сопоставимой дюрации и кредитных рисках выгоднее.
721|25.09.2019 10:31:17|Harry Lime|А они и не узнают до размещения
723|25.09.2019 10:33:43|Дмитрий Адамидов|виноват ну все равно ставка ФРС упала на процент почти
724|25.09.2019 10:33:58|А что ты сделал для котэ!?|Нет Аллокацию книги орги согласовывают с эмитентом и сообщают брокерам инвесторов или самим инвестором вечером в день книги
725|25.09.2019 10:34:26|Harry Lime|И сентимент сменился на прямо противоположный
726|25.09.2019 10:41:50|Наталья|Какой купон у моторов
727|25.09.2019 11:02:18|Harry Lime| VEON бонды VEON намерен разместить облигации на 1 млрд. Бумаги будут выпущены дочерней структурой  VEON Holdings B.V. Привлеченные средства VEON направит на рефинансирование долга, включая погашение кредита, привлеченного для сделки по консолидации GTH, а также на общекорпоративные цели.  сообщение
728|25.09.2019 11:02:22|Harry Lime| NORD бонды календарь NORDGOLD НАЧНЕТ ROAD SHOW ЕВРОБОНДОВ В ДОЛЛАРАХ 26 СЕНТЯБРЯ  ИСТОЧНИК
729|25.09.2019 11:02:50|Harry Lime|Все выстроились в очередь за долларами
730|25.09.2019 11:03:39|Alexey|Не верят что то в падение дальше ставок по доллару
731|25.09.2019 11:04:02|Константин Цехмистренко|Всем добрый день Информирую вас о присвоении номера Программе облигаций ООО Завод КриалЭнергоСтрой В соответствии с Правилами листинга ПАО Московская Биржа Председателем Правления 24 сентября 2019 года принято следующее решение присвоить идентификационный номер Программе биржевых облигаций серии 001P Общества с ограниченной ответственностью Завод КриалЭнергоСтрой, в связи с получением соответствующего заявления. Присвоенный идентификационный номер 400474R001P02E от 24.09.2019 Основные сведения о Программе биржевых облигаций Идентификационные признаки биржевых облигаций, которые могут быть размещены в рамках Программы биржевых облигаций биржевые облигации документарные процентные неконвертируемые на предъявителя с обязательным централизованным хранением, размещаемые по открытой подписке Максимальная сумма номинальных стоимостей биржевых облигаций, которые могут быть размещены в рамках Программы биржевых облигаций 2 000 000 000 Два миллиарда рублей Российской Федерации или эквивалент этой суммы в иностранной валюте Максимальный срок погашения биржевых облигаций, размещаемых в рамках Программы биржевых облигаций 5 096 Пять тысяч девяносто шесть дней с даты начала размещения выпуска биржевых облигаций в рамках программы биржевых облигаций Срок действия Программы биржевых облигаций 15 Пятнадцать лет с даты присвоения идентификационного номера Программе биржевых облигаций
733|25.09.2019 11:10:13|Даниил Иванов|Какая ставка
734|25.09.2019 11:10:17|Denis|Какой купон планируется
735|25.09.2019 11:11:35|Aleksandr Mukhin|http//www.edisclosure.ru/portal/company.aspxid37982 финансовой отчётности за 2018 год нет
737|25.09.2019 11:12:32|Константин Цехмистренко|Пока информационное сообщение о присвоении номера программе. Сейчас идёт бумажная работа по организации выпуска в рамках данной программы. По ставке чуть позже
740|25.09.2019 11:14:24|Шура SiberianRanger|Если будет как Каскад, чатик будет очень рад 
741|25.09.2019 11:14:35|Aleksandr Mukhin|держите нас в курсе
743|25.09.2019 11:15:25|Константин Цехмистренко|Обязательно
744|25.09.2019 11:15:38|Oleg Egorov|...ну а если будет больше, значит будет так, как в Польше
747|25.09.2019 11:23:58|sergei begreater|Там доходность к 11 октября считается, поэтому это не совсем так.
748|25.09.2019 11:24:51|Владимир Тутынин|С 26го же
749|25.09.2019 11:27:13|Elena Yakv|ОбувьРус был выпуск. У меня летом эмитент досрочно выкупил.
751|25.09.2019 11:40:53|Сергей Ковалев|рано еще, после 2 скорее всего
752|25.09.2019 11:43:15|Rifnur|По Обуви, я правильно понял, что завтра если покупать по z0 текст стандартного скрипта не меняется
753|25.09.2019 11:44:41|Evgeniy Averchenkov|Я ни чего не понял с этой обувью. Заранее заявку подавать надо Или завтра по скрипту , а там может нальют
754|25.09.2019 11:44:59|А что ты сделал для котэ!?|Судя по тому, что по обуви дали полную аллокацию  выпуск популярностью не пользуется 
755|25.09.2019 11:45:15|Alex Petroff|Инструкция по завтрашнему размещению Обуви будет дана представителем в чат в скором времени. ждем_скрипт
756|25.09.2019 11:45:45|Rifnur|Тогда ждём
757|25.09.2019 11:48:50|А что ты сделал для котэ!?|Это для ВДО он небольшой Насколько я понимаю  планировались и институционалы
758|25.09.2019 11:54:53|Harry Lime|Так он станет еще ВДОшнее
759|25.09.2019 11:54:55|Maison|Так оно еще больше вдо станет
760|25.09.2019 11:56:16|Harry Lime|Да я старый фетишист обуви , с июля 17 года
761|25.09.2019 11:58:28|Шура SiberianRanger|12 gt 6.75  5 так что коллеги правильно подсказывают, так она станет ещё ВДОшнее
762|25.09.2019 12:01:19|Harry Lime|Да , Атом примем
765|25.09.2019 12:04:50|Константин Цехмистренко|Вопросов нет Если необходимо сконтактирую. Съездит посмотрит производство. Там есть, что показать. Я был в июле
766|25.09.2019 12:05:09|Harry Lime|Отлично
767|25.09.2019 12:09:59|Rifnur|Эмитент из Казани
768|25.09.2019 12:11:28|Aleksandr Mukhin|420108, республика Татарстан, город Казань, улица Ирек, дом 30, помещение 1001
769|25.09.2019 12:11:45|Harry Lime|Да
771|25.09.2019 12:13:26|Savel|А почему вебинары не делают на ютубе А то циркуль какойто
773|25.09.2019 12:13:51|Harry Lime|Да , расскажите про ужасы МаниМена 
774|25.09.2019 12:16:42|Alex|Потому что платные вебинары
775|25.09.2019 12:16:56|Alexander V. Ivanov|Как насчет организованной экскурсии, как у СИнноваций было Я бы поучаствовал.
776|25.09.2019 12:21:45|Aleksandr|это не так . Сначала Обувь планировала выпуск на 1 ярд , потом им стало ясно , что спрос высокий и выпуск увеличили . Сейчас можно было одним днем разместится полностью , но долг был бы в основном у институционалов , чего не желает собственник.
777|25.09.2019 12:21:59|Rifnur|Я тоже За
778|25.09.2019 12:23:19|А что ты сделал для котэ!?|То есть полная аллокацию  только физикам А нстьуионалам  неполная
779|25.09.2019 12:24:10|Aleksandr|То есть с институционалами была понятийка , кому и сколько брать
780|25.09.2019 12:26:18|Savel|Не все
781|25.09.2019 12:27:45|Sky|Предварительный ажиотаж в стакане не такой весёлый, как по кузине/ИТЦ. Вот он, корявый подход к размещению.
782|25.09.2019 12:27:53|Alex|Речь видимо об семинаре их сиятельства. Первый про лизинг был доступен всем. Следующие платные
783|25.09.2019 12:28:53|Александр|Используй сиду, Люк поиск по чату
