|time|user|text
418|11.05.2020 18:35:21|Olga Rouzade|https//t.me/Style4man
419|11.05.2020 18:42:20|Vladimir Kulagin|Процентный риск у ETF на долги компаний России Корпоративных облигаций много. Количество облигаций превышает количество доступных акций. Разнообразие облигаций создает спрос на ETF корп. сектора, так как экономит время и силы инвесторам. Мы подготовили обзор процентных рисков у долговых ETF. Смотрите полный обзор в картинке к посту или в блоге . Краткий вердикт SBRB , GPBS  в меньшей степени подвержены изменениям ключевой ставки. VTBB  в средней степени подвержен процентным рискам. Инвестирует в более доходные облигации, а риск дефолта нивелирует количеством облигаций. GPBM  самый рискованный по отношению к процентным ставкам фонд.
420|11.05.2020 18:45:40|Harry Lime|Презентация компании
421|11.05.2020 18:47:19|Harry Lime|Прочитал вон у Григоряна в канале. Может тоже перейти на сторону зла и замутить консалтинг. Проекты реструктуризации , затыкание ртов воблам и запудривание им мозгов. Чую будет пользоваться спросом. Но нет , спасибо .
422|11.05.2020 18:58:34|DIM|Но я как понял не все смогут воспользоваться
424|11.05.2020 18:59:59|Harry Lime|Да нунафиг , я офигел , что ктото вообще предлагает подобное
425|11.05.2020 19:01:32|Алексей Чернушевич|Борьба с энтропией и есть смысл жизни. Хоть это и бесполезно в долгую. Но на относительно коротком временном отрезке, если очень сосредотачиваться, то может и повезти. Лишь бы не воровали. 
426|11.05.2020 19:01:52|DIM|У людей часто совести нет, а может и просто когда долго без денег и есть хочется идут на любые способы заработка денег
427|11.05.2020 19:04:19|Alexey Vishnyakov|Зависит от размера позиции. Тут один наш коллега писал, что у него 20 депо. Если один , то ладно  продать по 60 и зарезать лося.
428|11.05.2020 19:04:51|Полина Кузнецова|Это правда. Но если депо 10 т.р,то 2 т.р вполне.
429|11.05.2020 19:09:51|Алексей ayaye :)|OrsonWelles , стало ясно, что такое сабражать на троих 
430|11.05.2020 19:24:59|Dmitry|По большому счету, сняли это ограничение на федеральном уровне и передали полномочия на глав регионов, т к каждый регион принимает решения о сроках и мерах ограничений. Например в Москве режим самоизоляции действует в соответствии с нормативными актом мэрии Москвы до 31 мая режим самоизоляции, а для строительных и производственных компаний с 12 можно начать работу. Остальные также сидят по домам
431|11.05.2020 19:36:37|Mikhail FarEast|В КК вроде до 23.05 никаких особых послаблений нет
432|11.05.2020 19:38:08|Dmitry|В каждом регионе будут реализовывать свой план снятия/продления ограничений в соответствии с эпидемиологической ситуацией в данном регионе
434|11.05.2020 20:19:28|annastekloas|Я так поняла, что налоги отложили на полгода, а не списали... может пропустила чтото
435|11.05.2020 20:26:20|DIM|Второй квартал, отложили это было раньше, сегодня было выступление
436|11.05.2020 20:28:38|Savel|Что касается Каскада, который давно на рынке никто не сомневается, что компания вполне себе даже переживёт все эти перепетии. Проблема ведь не в этом, а в том, что онато может их пережить, а вот облигации конкретных выпусков могут и не.
437|11.05.2020 20:32:05|annastekloas| спасибо Надо почитать, спасибо Может попаду в эту категорию
439|11.05.2020 20:40:18|КАН|Если бы 2, то ладно бы. А так дороговато книжки обходятся. Ну, как говорил Шура, тупые должны страдать. Что ж, будем страдать...
440|11.05.2020 21:10:32|DIM|Удачи
441|11.05.2020 21:13:17|annastekloas|спасибо
442|11.05.2020 21:15:48|Alexander G|В КК до 23 пока .
443|11.05.2020 21:28:40|Alex|поэтому помните действующих лиц, и напоминайте всем окружающим. Кто владелец, топ менджмент. Фамилии и личности должны быть изучены. В случае с ВДО это сложнее, но предсталвение можно сформировать. Например условный Роман Гольдман публичен, и дефолты по его обязательствам скорее всего тормозут все инвестции в бизнес в любом направлении на длительный срок. а может и нет
446|11.05.2020 21:48:56|Dmitry Manzor|Завтра к вечеру на купон соберут
447|11.05.2020 21:52:12|Евгений Коломна|Если и соберут, то не факт, что выплатят. Такие вот они оригиналы
448|11.05.2020 21:53:46|Alex|платим купон, собираем осво, отменяем оферту  надеюсь план такой, это лучший вариант для инвестора
449|11.05.2020 21:54:28|Harry Lime|Все осложняется тем фактом , что в опте 350 млн. не заработать и за много лет. Посмотрим.
450|11.05.2020 21:56:06|Andrey Belous|Я бы не спешил. По Мск карантин пока не отменен, по МО вроде как до 18 мая ограничения, по другим регионам тоже не всё так просто
451|11.05.2020 21:59:15|Евгений Коломна|Да уж, в любом случае прощай номинал.
452|11.05.2020 22:01:57|Dmitry Manzor|Ну вы в воду смотрите. Количество лет могут продлить
453|11.05.2020 22:02:41|Harry Lime|Если никто не покупает глушители воблы получат их в счет долга.
454|11.05.2020 22:03:05|Dmitry Manzor|Вы оптимист. Я надеюсь на такой же вариант, хоть и не держу. Но дефолт плохо отразится на рынке ВДО.
456|11.05.2020 22:03:50|Harry Lime|Если деталей у вас полный склад. Воблу отдайте и он будет рад 
457|11.05.2020 22:05:29|Alexey Vishnyakov|Купон выплатят, может тело подрастёт до 70. Тогда, с учётом полученных купонов, потери  20 от позиции при продаже если брали на размещении . Для держателей повод задуматься.
458|11.05.2020 22:54:20|Silverdog|Кроме НДС
459|11.05.2020 22:56:25|Silverdog|Налоги за второй квартал, за исключением НДС, для пострадавших отраслей спишут
460|11.05.2020 23:03:44|Ilya|А шо это такие за налоги, если не ндс
461|11.05.2020 23:09:00|Why Aye Man|налог на прибыль если она у кого была, например
462|11.05.2020 23:09:43|Alexander G|Енвд, усн , прибыль
464|11.05.2020 23:12:23|nik|Взносы в фонды Или взносы не налоги... Кроме одного платим в фнс их.
465|11.05.2020 23:13:16|Alexander G|Со взносами пояснения должны быть . Для ип вроде минус мрот один .
466|11.05.2020 23:13:44|DIM|Ну это оставили на случай полной жопы когда народ начнёт на улицы выходить, кинут тогда самую большую кость народу и все успокоятся
468|11.05.2020 23:21:56|А что ты сделал для котэ!?|patsak9876 аэрофлоту роялти платятся за каждый пролёт иностранного самолета Или некая фиксированна плата в год независимо от пролетов
470|11.05.2020 23:47:21|Oleg Egorov|А что, было бы неплохо, типа Лети, или плати
471|11.05.2020 23:54:08|Stan P|Когда размещение аэрофлота
472|11.05.2020 23:54:29|Евгения|13 мая.
473|11.05.2020 23:54:46|Stan P|Спасибо
476|12.05.2020 00:27:23|Дмитрий Адамидов|мне кажется за пролет. если пролета нет, то и роялти нет
477|12.05.2020 00:36:25|DIM|А кто организатор
478|12.05.2020 00:48:19|Ilya|8,5 значит и не будет
479|12.05.2020 00:52:50|Сергей|Разве есть официальные гарантии по выпуску Могут и рестракт устроить.
480|12.05.2020 00:52:55|Diz|конечно не будет. даже 8 не будет
482|12.05.2020 03:20:10|Павел|Никакой гос гарантии по выпуску не будет, а участие в капитале ни о чем не говорит тот же Татфондбанк, например. Рейтинг у компании откровенно слабый и в планах убыток 1 млрд долл. 8.5 это низкоадекватная ставка
483|12.05.2020 05:07:40|Andrey Belous|По финансам что Долг обслуживать смогут
484|12.05.2020 05:10:28|Павел|знал бы прикуп, жил бы в Сочи но в США такая бумага с таким рейтингом  ВДО.
485|12.05.2020 07:57:02|Harry Lime|Это ерофлот , чо ему будет. Норм логика. Считаю можно полетать до 1034. И приземляться.
488|12.05.2020 08:19:19|Alexey|В Сша в последние недели Дельта заняла под 7 650 к g curve. American под 10,5 1000. Но госов в акционерах нет
489|12.05.2020 08:20:31|Сергей|К тому же  авиа сша мнение прогноз Глава Boeing уровень авиаперевозок в США может восстановиться к концу 2020г на 50 банкротство Глава Boeing возможно банкротство одной из крупных авиакомпаний США
490|12.05.2020 08:21:58|Alexey|Неужели снова АА У них наверное и шаблоны заявлений еще остались с прошлого раза
491|12.05.2020 08:22:08|Александр|Сильно
492|12.05.2020 08:23:02|Alexey|Суровый капитализм
493|12.05.2020 08:23:48|Александр|Вообще наш Аэрофлот невероятно сильно оценён, когда та же дельта падала на 10 на прошлых неделях после новостей выхода баффета, то самолётик стоял. Отсюда есть мнение, что все же в вдо он не пойдет
495|12.05.2020 08:24:50|Alexey|Посмотрите финансы в чем то родственной гтлк например. Всем пофигу. Гос и все
498|12.05.2020 08:25:42|Сергей|Под реструктуризацию долга
499|12.05.2020 08:26:16|Harry Lime|Зачем нужны полеты на Аэрофлоте до погашения , если можно неплохо среднемагистрально полетать полгодика с купоном без налога и ростом тела.
501|12.05.2020 08:30:06|Alexey|В авиации западной жестко. Никаких рестрактов  списать и точка Вместе с акционерами заодно Дмитрий верно пишет  в известной поговорке про способы потерять инвестору деньги  авиацию надо дополнить четвертой
504|12.05.2020 08:31:03|Алексей ayaye :)|в боинге, похоже, нечего спасать, там эффективные менеджеры
505|12.05.2020 08:32:28|Alexey|Как бы получилось не SD без госов
506|12.05.2020 08:33:41|Сергей|Тогда понятны премии к ставке, авиационные суборды
507|12.05.2020 08:35:00|Harry Lime|Это спек бумаги . Отработал рост и давай , до свиданья
508|12.05.2020 08:40:36|Alexey|Честно  я бы с7 купил бы. Там точно были бы вдо ставки. Но видимо банки перехватывают заемщика. Возможно пока перехватывают
509|12.05.2020 08:47:00|Aleksandr|S7 на 35 или 40 государственный , почему ставки ВДО  К тому же S7 активно летает сейчас .
510|12.05.2020 08:49:07|Alexey|В 13м году госы полностью вышли из капитала с7 Учитывая ставку афл, прибавить к ней надбавку за отсутствие госов  выйдет имхо 10,5. Может даже 11
511|12.05.2020 08:49:10|Stan P|Это более вернее. И все будут смотреть на риск государства, а не на текущие проблемы аэрофлота
512|12.05.2020 08:50:01|Aleksandr|а S7 вроде ж прибыльный был в отличии от АФЛ
513|12.05.2020 08:50:51|Stan P|Только он частный и в случае чего его закопают как и трансаэро. Выживет только аэрофлот. Не ужто тут все такие наивные
514|12.05.2020 08:51:08|Alexey|Плюс минус да. Но сейчас это инвесторов не сильно будет волновать. Почему то думаю что с7 мы еще увидим в облигациях. Не заткнут все дыры банки им
515|12.05.2020 08:51:58|Aleksandr|Ну он если не дурак, то прийдет на рынок когда уже совсем все полетят.
516|12.05.2020 08:52:00|Alexey|Есть ощущение что у Царя есть мнение что афл не должен быть один. Не любит когда все в одной корзине.
518|12.05.2020 08:53:01|Stan P|Пока все как раз наоборот
519|12.05.2020 08:53:55|Сергей|Аэрофлот сейчас тоже спекулятивный, заходить или нет будет зависеть от купона
520|12.05.2020 08:53:57|Alexey|Ютейр например тянут из преисподней. Притом самые близкие ему люди.
521|12.05.2020 08:54:56|Biz Ffc|Как думаете с каким ценником на каскад, откроется биржа
522|12.05.2020 08:57:41|Harry Lime|Всем пох , важнее с каким закроется
523|12.05.2020 08:58:27|Stan P|8,5 риск гос компании. Это жир
524|12.05.2020 08:58:38|Vitaliy Klimenko|Самоё логичное, как закрылся в предыдущий
525|12.05.2020 08:59:03|Ilya|Недавно офз давали надолго по 9, эх
526|12.05.2020 08:59:07|Denis|Предполагаю без особых изменений к закрытию....в основном кто хотел выскочил,на покупку тоже показаний нет.
527|12.05.2020 08:59:28|Stan P|То было в прошлой жизни
528|12.05.2020 08:59:35|Ilya|Каскадное падение облигаций
529|12.05.2020 09:00:12|Alexey Vishnyakov|Будет болтаться на 50  60 до завтра. Если купон заплатят, то может и отрасти до 70, если нет, то 20
530|12.05.2020 09:01:18|Сергей|офз быстрее всех восстанавливаются, пропустишь момент и поезд ушел
531|12.05.2020 09:01:22|Harry Lime|Не заплатят  будет планка  40
532|12.05.2020 09:02:15|Ilya|Когда помнишь дефолт офз и каждый раз забываешь их купить
533|12.05.2020 09:03:06|Сергей|или думаешь сейчас ставку повысят
534|12.05.2020 09:03:08|Stan P|Был дефолт ГКО 
535|12.05.2020 09:05:31|Ilya|Или забыл, что ОФЗ никогда не дефолтнут, в этот раз их назвали правильно
536|12.05.2020 09:09:01|Алексей ayaye :)|https//habr.com/ru/post/501256/
537|12.05.2020 09:09:11|Aleksandr|https//www.finanz.ru/novosti/aktsii/sberbankprorabatyvaetvariantyfinansirovaniyauralskikhavialiniyzampred1029181773
538|12.05.2020 09:19:03|IURII D.|https//www.rbc.ru/business/03/05/2020/5eae474e9a794785bc6f1196
539|12.05.2020 09:19:52|Andrey Belous|Полностью солидарен
540|12.05.2020 09:22:09|Harry Lime|Я это тоже проходил  ТМК1 рост , Еврохим 8 рост , Белорусь  рост. Хомяк просек тренд . И тут его отерофлотят.
541|12.05.2020 09:46:35|Andrey Belous|Подрастёт и выйдем
543|12.05.2020 09:49:08|a_|Снова шляпа какаято
544|12.05.2020 09:49:09|a_|MOEX  Департамент клиринга МосБиржи сообщил о новых проблемах. Зачисление и списание средств временно недоступно. Предыдущий сбой на МосБирже прозошел 8 мая  торги не проводились в течение часа.
545|12.05.2020 09:51:10|DIM|Прлизинг красавцы, уже в дискложе инфа что выплатили купон, оперативно работают, обувь пока молчит
546|12.05.2020 09:51:16|Anna Savenko| Люблю ваш юмор Вот кстати очень не хватает сообществу книги с шутками... для поддержания духа в трудные дни
547|12.05.2020 09:52:05|DIM|Мдаа, те сегодня купоны ожидать по пр лизинг и обуви изза тех сбоев не стоит
548|12.05.2020 09:53:19|DIM|План на неделю Выплата купонов 09.05.2020  МФК КарМани БО00101 16 годовых 09.05.2020  ПРЛизинг 001Р03 12 10.05.2020  Дядя Дёнер БОП02 13,5 11.05.2020  СолидЛизинг КОСЛ004 12 11.05.2020  РедСофт 001Р01 14 11.05.2020  ТД Мясничий БОП01 13,5 11.05.2020  ТД Мясничий БОП02 13,5 11.05.2020  ОАЭ БОП02 13,75 12.05.2020  Ламбумиз БОП01 13,5 12.05.2020  Архитектура Финансов КОП01 17 13.05.2020  КисточкиФинанс БОП01 15 13.05.2020  Каскад 001Р01 16 13.05.2020  Кузина БОП01 15 14.05.2020  Дядя Дёнер БОП01 14 14.05.2020  МСБЛизинг 002Р01 13,75 14.05.2020  РедСофт 001Р02 13,5 14.05.2020  ГрузовичкоФЦентр БОП03 15 14.05.2020  БэлтиГранд БОП02 12,5 14.05.2020  АПРИ Флай Плэнинг БОП03 14,25 15.05.2020  БК КО01 16,5 Погашения 11.05.2020  РедСофт 001Р01 полное, 100 млн руб. 14.05.2020  МСБЛизинг 002Р01 частичное, 3,846 от номинала Оферты 20.05.2020  Дядя Дёнер БОП01 период предъявления  до 14.05.2020, дата приобретения  20.05.2020
549|12.05.2020 09:53:46|DIM|Я чёт не понял, а где обувь россии, у них 9 мая выплата купона тоже должна быть, косяк в группе публикации забыли
551|12.05.2020 09:57:36|Павел|и роял капитала тоже нет Дата начала периода приема заявок 21.04.2020 Дата окончания периода приема заявок 18.05.2020 Дата оферты 27.05.2020
552|12.05.2020 10:00:01|Stan P|Тем более скоро снижение ставки
553|12.05.2020 10:00:40|Константин Цехмистренко|Здравствуйте На конец операционного дня Эдуард Авдеев разместит соответствующую информацию. Я с утра созвонился и как любят говорить рейтинговые агентства прогноз позитивный
554|12.05.2020 10:04:41|DIM|Приложение втб упало чтоли Не работает
555|12.05.2020 10:05:07|Archi|Тоже не могу войти
556|12.05.2020 10:05:44|DIM|Приложение то должно работать, даже если и проблемы у биржи
557|12.05.2020 10:08:03|Alex|Сбербанк через Квик не даёт купить никаких корпоратов. Только ОФЗ и акции. ОШИБКА 244 Превышено ограничение для фирмы по деньгам по этой группе финансовых инструментов.
558|12.05.2020 10:08:57|Mikhail FarEast|Через olb зайди
560|12.05.2020 10:10:03|DIM|Так и сделал
561|12.05.2020 10:10:31|Mikhail FarEast|Все работает вроде
562|12.05.2020 10:11:05|Alex|Нет. Но вроде уже дают. Видимо с багами биржи както связано.
563|12.05.2020 10:11:51|Ilya|все еще такая ошибка
564|12.05.2020 10:12:00|DIM|Через сайт работает, да, а я про приложение мобильное
565|12.05.2020 10:12:47|Alex|Да, через раз заявки на покупку принимает.
567|12.05.2020 10:13:23|DIM|Втб приложение заработало
569|12.05.2020 10:21:29|Андрей 9|Тинек работает
570|12.05.2020 10:25:00|Denis Kozlov Septem|Обувь  не ВДО. Это третий эшелон
573|12.05.2020 10:36:29|DIM|А вдо, четвёртыйну просто странно, пр лизинг вдо, а обувь не вдо
574|12.05.2020 10:43:54|Ilya|починили СБербанк
576|12.05.2020 10:48:02|DIM|С обуви иволга чтоли выходит с умеренной скоростью в стакан заливают
578|12.05.2020 10:51:35|Дмитрий Зы|Жидкая плитка
580|12.05.2020 10:52:11|Denis Kozlov Septem|Компания, которая давно вышла IPO, с выручкой 13 млрд руб., которой банки дают под 10, ну, как бы, не совсем это ВДО.
581|12.05.2020 10:56:25|DIM|Понятно, ну ок
583|12.05.2020 10:57:16|Дмитрий Зы|Эх, так бы с Дэни было бы....
584|12.05.2020 10:57:56|DIM|Ну дени и обувь, разные истории
585|12.05.2020 11:07:42|Mikhail FarEast|Ты счастливый вобл Дэни
586|12.05.2020 11:08:25|Дмитрий Зы|Да, причём в прямом смысле счастливый.
587|12.05.2020 11:09:10|Mikhail FarEast|Новостной фон и их сложные для понимания действия по офертам не смущают
588|12.05.2020 11:10:10|Дмитрий Зы|Какие новости кроме сплетен в чате и на форумах Какие сложные действия по оферте были
595|12.05.2020 11:12:28|Dmitry Manzor|тиш тиш, у этого эмитента есть свой чат
596|12.05.2020 11:13:04|Дмитрий Зы|пойду искать, не знал
597|12.05.2020 11:14:21|Эд|Официальный канал ИК Стрим https//t.me/strim_broker
598|12.05.2020 11:15:23|Дмитрий Зы|Ушёл листать
