|time|user|text
223|17.07.2019 19:05:26|Alex|Господа, обновил таблицу по евробондам для народа. Теперь с рейтингами.
224|17.07.2019 19:07:22|Leonid|Уже хорошо, спасибо. Ещё одно условие  чтобы торговались где нибудь на бирже в Европе 
225|17.07.2019 19:07:59|Nikolay Pavlov|https//www.moex.com/n24369/nt0 по финавиа
226|17.07.2019 19:08:47|Григорий Мошорин|Теперь они Т0
228|17.07.2019 19:12:55|Дмитрий Адамидов|То есть РПС нельзя теперь
229|17.07.2019 19:13:51|Nikolay Pavlov|Похоже
230|17.07.2019 19:14:29|Дмитрий Адамидов|И правда  впору книгу писать как мы обменивали облигации, том 2
231|17.07.2019 19:14:54|Nikolay Pavlov|Мхах
232|17.07.2019 19:15:22|Дмитрий Адамидов|Николай  это был намёк кому писать как не вам
233|17.07.2019 19:15:37|Nikolay Pavlov|
234|17.07.2019 19:17:02|Григорий Мошорин|Жаль нельзя эту облигацию в виде бумажки получить,так бы добавил к бонам в коллекцию 
235|17.07.2019 19:17:04|Alex S|а по какому принципу там упорядочены облиги, кто на первом, а кто на последнем  может её тоже добавить в онлайн версию
236|17.07.2019 19:19:22|Дмитрий Адамидов|вообще непонятно зачем их покупать, согласен
237|17.07.2019 19:20:28|Григорий Мошорин|Брокера порадовать что ему комиссия придет 
239|17.07.2019 19:21:00|Дмитрий Адамидов|не я бы тоже бумажку с самолетиком красивую за 50 рублей бы купил. ну за 5 от цены к примеру. А так что это  запись в файле
240|17.07.2019 19:28:45|Alex|Я буду редактировать файлик, мне лучше так. А порядок там исторически сложившийся
241|17.07.2019 19:29:42|Harry Lime|CBOM 24 euro и Gazprom 24 euro точно есть на европейских биржах.
243|17.07.2019 19:32:24|Nikolay Pavlov|А я вот сейчас правила листинга читаю, чтобы понять, можно ли так
244|17.07.2019 19:32:53|Harry Lime|От чего же нельзя , эмитент попросит и привет
246|17.07.2019 19:38:17|Nikolay Pavlov|Только, по идее, у них должен быть иной порядок сначала снять с торгов и потом новацию
247|17.07.2019 19:38:31|Harry Lime|Вот что значит долго запрягают , но быстро ездят , год все гнило в ФА , бах трах ОСВО, новация и снятие с торгов , красота за две недели
248|17.07.2019 19:38:40|Nikolay Pavlov|29 июля новация будет
250|17.07.2019 19:38:53|Андрей|Гарри, считаете, всё таки скупали в стакане ФА, когда началось Т.е. они уже имели план действий
251|17.07.2019 19:39:10|Дмитрий Адамидов|ну им надо было набрать 75
253|17.07.2019 19:39:31|Harry Lime|Может и докупали , кто же скажет , но не более пары процентов
254|17.07.2019 19:39:47|Дмитрий Адамидов|ну в итоге стакан по 1 выпуску был 23 почти
255|17.07.2019 19:39:51|Андрей|Ну я помню, как сразу по объему стали думать
256|17.07.2019 19:40:33|Nikolay Pavlov|Я думаю, скупали. И делали это грамотно, чтобы могли голосовать на осво. И как найти иное  ума не приложу
258|17.07.2019 19:41:04|Андрей|ФА очень правильная история для неофитов ВДО. Чрезвычайно.
259|17.07.2019 19:41:06|Nikolay Pavlov|Гиблое дело
260|17.07.2019 19:41:48|Harry Lime|Отличный кейс , на ваших глазах вершится история , со времен Мечела наглость эмитентов растет в геометрическрй прогрессии.
261|17.07.2019 19:44:10|Андрей|Да, посты Гарри про ДД, Пересвет, и СибГос, возможно, воспринимались как это было у когото и неправда, с нами такого не будет.. И вот что ОСВО животворящее делает..
262|17.07.2019 19:45:10|Harry Lime|Все будет , ВДО эмитенты тоже учатся
263|17.07.2019 19:46:22|Андрей|Судя по описанию Павла, ребята ФА очень грамотные и злые до денег..
265|17.07.2019 19:50:00|Alexander Balezin|Имхо, в сообщении биржи нет запрета на РПС, только ограничение на Т0, т.е. расчеты текущим днем
266|17.07.2019 19:51:02|Nikolay Pavlov|И мы теперь знаем дату, когда бонд ФА будет равен нулю
268|17.07.2019 20:27:25|Alex|допустимым кодом расчетов является только код расчетов Т0.
273|17.07.2019 21:00:17|Потапыч|В соседнем чате вот что про ФА пишут
275|17.07.2019 21:01:51|Григорий Мошорин|Я как подопытный кролик взял по одной 
277|17.07.2019 21:09:38|Harry Lime|Есть мнение , что она через неделю перестанет существовать.
281|17.07.2019 21:22:44|Потапыч|ОАЭ3 может завтра закончить размещение. Осталось 8165 лотов из 400000
285|17.07.2019 21:40:53|Arslan|Рольф скоро 98 будет 
286|17.07.2019 21:41:28|Григорий Мошорин|Это хорошо
287|17.07.2019 21:47:59|Alexander|85 млн. из 120 млн. разместила Ламби
288|17.07.2019 21:49:52|S.P.|А что, там уже уголовное дело закрыли и собственник вернулся в РФ
289|17.07.2019 21:50:47|Harry Lime|Хорошо идут , до конца недели закончат.
290|17.07.2019 22:00:31|S.P.|Ведомости основатель Рольфа не планирует возвращаться в РФ после обысков у автодилера  Происшествия  ТАСС https//tass.ru/proisshestviya/6601725
292|17.07.2019 22:13:53|Максим Кочнев|Лямблию кто брал Чёт размещение не очень
293|17.07.2019 22:17:23|Denis Kozlov Septem|Мути опрос 
295|17.07.2019 22:22:04|Максим Кочнев|Дак вчера был
297|17.07.2019 22:22:51|S.P.|Ну тут его называют собственником https//www.kommersant.ru/doc/4013402 А тут пишут о предложении продать Рольф https//www.rbc.ru/business/27/06/2019/5d14a76e9a7947383ffef598 А как можно продать то что тебе не принадлежит Значит все таки он собственник
298|17.07.2019 22:23:27|Denis Kozlov Septem|Да, точно. Нашел  почти, кстати, соответствует факту 
299|17.07.2019 22:38:40|Дмитрий Адамидов|Номинал там другой конечно, но реальный собственник он
303|17.07.2019 22:49:22|Владимир Тутынин|Старика Хохрина по утрам пузырянка одолевает, вас к вечеру...
304|17.07.2019 22:49:59|Дмитрий Адамидов|что лишни раз доказывает, что мы с ним не один и то же человек а разные люди
305|17.07.2019 22:51:16|Nikolay Pavlov|А все же интересно, как доказать, что бюллетени не заменил эмитент . Всех позвать воблов, чтоб они подписи свои проверяли Странно
306|17.07.2019 22:51:34|Дмитрий Адамидов|а по моему никак это не проверить.
307|17.07.2019 22:52:22|Nikolay Pavlov|Голосование должно быть через личный кабинет нрд или брокера
308|17.07.2019 22:52:42|Дмитрий Адамидов|на могилке так и напишут  юридически претензий не было никаких, но ..... Ни Петрову ни компании от этого не легче
310|17.07.2019 22:53:36|Nikolay Pavlov|Я бы сказал, что это вообще не наука
313|17.07.2019 22:53:55|Nikolay Pavlov|Интересно
315|17.07.2019 22:54:32|Владимир Тутынин|Но, как я понимаю, в пендосии было бы также Миноритарии везде сосут
316|17.07.2019 22:54:49|Дмитрий Адамидов|это слабое утешение если честно
317|17.07.2019 22:55:38|Nikolay Pavlov|Там вообще круть. Я читал зимой их реструктуризации. Так там то кидают, тотговорят, что нельзя
318|17.07.2019 22:58:01|Владимир Тутынин|Но покупая пару облиг я же понимаю, что в случае чего придется принять. Что качать чтото по судам не смогу, да и некогда  надо грузить багаж в Шереметьево, кормить семью...
319|17.07.2019 22:58:03|Nikolay Pavlov|Ассенагон в англии и в сша забыл кто  они судились и Суды сказали, что реструктуризации такие нельзя делать. А их все юристы делали, они обеспокоились и написали открытое письмо, мол, вы, суд, мешаете нам воблов кидать
320|17.07.2019 23:01:31|Alexey|Там чуток по другому. Объявляют чаптер 11 и дальше уж как кривая выведет и какой рекавери будет. Осво там тоже есть в определенной форме. Владею одними дистресс облигами  как раз готовят осво там
321|17.07.2019 23:02:51|Nikolay Pavlov|Там же делают exit consent Обмен одних бумаг на другие того же эмитента
322|17.07.2019 23:03:25|Alexey|Обычно да. Электронное голосование делают
325|17.07.2019 23:04:27|Nikolay Pavlov|А как можно ухудшить условия по этому выпуску, чтобы из него вышли Если процент и срок погашения единогласно, то как тогда они ухудшают суть бонда первоначального
327|17.07.2019 23:06:14|Михаил Широковских|1
328|17.07.2019 23:06:21|Alexey|Например ftr хочет изменить триггеры погашения. Все отдельными пунктами голосования. Какие то пункты могут принять а какие то нет я так понимаю
330|17.07.2019 23:08:10|Nikolay Pavlov|Аааааа, понятно. Интересно.
334|17.07.2019 23:13:47|Arslan|За первый кв 19 года у них убыток от продаж 566 лямов, а прочие доходы более 2 млрд. Ну и как бы чистая прибыль gt623 ляма. За 18 г у них чистая прибыль gt6 млрд. Я так думаю, если уголовное дело окажется не в их пользу, то возможен будет тех дефолт... 
335|17.07.2019 23:15:31|Владимир Тутынин|Если скупил 75, то все триггеры тебе подвластны
336|17.07.2019 23:16:13|S.P.|Когда государство начинает такие игры я знаю только один правильный вариант действий держаться от всего этого подальше. Прогнозы тут неуместны.
337|17.07.2019 23:19:30|Alexey|Вот процентаж пока не изучал...
339|17.07.2019 23:31:07|Потапыч|Как так 75 в одних руках концентрируются В акциях при подобных концентрациях мажор обязан офёрту минорам выставлять.
341|17.07.2019 23:34:08|Harry Lime|А тут легко , лежат они по разным местам , получают купончик , а когда надо голосовать собираются там где надо.
343|17.07.2019 23:50:45|Dmitry Manzor|Ламбумиз 85млн размещено, из них 70млн это 2 заявки. Завтра орг докупит ещё и завершат спектакль
344|17.07.2019 23:53:31|Kir|Это хорошо, когда у орга есть такая возможность
345|17.07.2019 23:59:47|Evgeniy Averchenkov|Круче всех в этом плане мтс разместились
348|18.07.2019 00:07:06|Vladimir|система выводит прибыль через облигации
349|18.07.2019 00:25:19|Sky|первыйденьторгов вдо
350|18.07.2019 00:53:01|Alexey|75 проц отложили. Авось пригодиться
351|18.07.2019 01:30:38|Шура SiberianRanger|КРАСИВО 
355|18.07.2019 06:22:33|Alexander|да за 120 млн. кидать, не солидно
356|18.07.2019 06:30:47|Harry Lime|Расскажите это Ходасу из Сибирского гостинца
357|18.07.2019 07:06:21|Deleted Account|он там на большую сумму гораздо кинул облиги  еврооблиги  акции в т.ч. которые с себя продавал, а потом допники делал, размывая долю остальных, при том что все активы текущие копейки стоят  сарайчик и на коленке сделанное оборудование.
358|18.07.2019 07:10:21|Harry Lime|Не согласен по сараю , я спецом смотрел все видео где он есть. Я последние 15 лет связан со складами. Склад гостинца не может стоить меньше 50 млн.
360|18.07.2019 07:43:46|Григорий Мошорин|Обманывают,минимальная заявка 3 должна быть 
361|18.07.2019 07:45:25|Vladimir|там лот 10, если брать три штуки это 30
362|18.07.2019 07:46:34|Григорий Мошорин|Странно,у меня 3 отображаются
365|18.07.2019 08:41:49|Nikolay Pavlov|По финавиа. Посмотрел, что они делали с ютэйр финансом. Просто погасили облигации в результате предоставления отступного. В этот раз то же самое будет, только через новацию. Новацию подпишут 29 июля, после этой даты облигации как бы погасят, спишут. То есть ноль им цена и даже убыток никто зафиксировать не сможет.
367|18.07.2019 08:48:39|Harry Lime|Будете судиться и когда
368|18.07.2019 08:53:37|Nikolay Pavlov|Я пока думаю над этим. Тут много нюансов. Распутываю потихоньку.
371|18.07.2019 09:00:04|Dmitry Manzor|Вы считаете, что они и 20 обещанных не отдадут
372|18.07.2019 09:00:29|Nikolay Pavlov|Не могу знать.
373|18.07.2019 09:02:29|Dmitry Manzor|Сегодня купить ФинАвиа 01 можно за 12 номинала. . Таким образом одна облигация 17 июля обойдется вам в 161,18 руб. Через год, 31.07.2020 компания погасит треть от 20 от номинала и треть от купона. Суммарно 244,6 руб за 3 года. Доходность такой сделки составит 51,8 за три года, т.е. около 17 годовых
375|18.07.2019 09:04:57|Nikolay Pavlov|Как в анекдоте. Или заплатят, или нет
376|18.07.2019 09:05:19|Dmitry Manzor|Спасибо
377|18.07.2019 09:13:08|Дмитрий Адамидов|Если поток нормально посчитать с НКД и комиссиями, то за три года IRR будет около 1011
378|18.07.2019 09:15:32|Шура SiberianRanger|Возьмите Ломбард, не  мозги
379|18.07.2019 09:23:13|Harry Lime|Это слом парадигмы , чем раньше он происходит у инвестора , тем больше он в итоге заработает.
380|18.07.2019 09:23:15|Dmitry Manzor|Да я рассуждаю, понятно что мало кто это сделает
382|18.07.2019 09:47:55|Владимир Тутынин|Подравляю конечно. Ждем обвала на 10000 или просто коррекцию
383|18.07.2019 10:06:05|Ilya|Обвала чего ждем
384|18.07.2019 10:07:02|Dmitry Manzor|чат походу перепутал
385|18.07.2019 10:10:07|Savel|Коррекцию на 10000
386|18.07.2019 10:11:51|Nikolay Pavlov|А сегодня уже по 9 ещё больше дохода
387|18.07.2019 10:12:37|Harry Lime|То ли еще будет до 27го
388|18.07.2019 10:13:16|Nikolay Pavlov|Такида
389|18.07.2019 10:13:29|Dmitry Manzor|Если завтра цена упадет в район 10 от номинала, тогда доходность составит уже 73 или 24,4 годовых. А это уже интересно
391|18.07.2019 10:14:41|Nikolay Pavlov|Эмтент проводит ОСВО, чтобы освободиться от единственного актива  оферты ЮТэйр. У него же нет больше ничего.
394|18.07.2019 10:15:51|Dmitry Manzor|Справедливо. Значит детишки не скажут спасибо за 80 от номинала в 2054г
395|18.07.2019 10:16:14|Nikolay Pavlov|Уже 8 
396|18.07.2019 10:17:25|Alex|Любители таксогрузокисточек обратите внимание на историю с Финавиа. Эти могут повторить без лишних вопросов.
397|18.07.2019 10:17:47|Harry Lime|Опыт , сын ошибок трудных
398|18.07.2019 10:18:07|Alex Petroff|bondyboss
399|18.07.2019 10:19:32|Alexey Spitsyn|uniscapital Любопытно, что УниверКапитал совсем не защищают своих эмитентов в отличие от Септем, Иволги и Бондибокса...
400|18.07.2019 10:20:04|Nikolay Pavlov|А почему его сейчас скидывает надо
403|18.07.2019 10:28:51|Deleted Account|а чем лобард от них отличается или директ лизинг или другие прочие
407|18.07.2019 10:30:24|Alex|У них нет или вскоре не будет активов. Вообще. У кисточек нет даже офертыпоручительства.
408|18.07.2019 10:30:26|Максим Кочнев|Плохая стратегия защиты конечно у вас.
409|18.07.2019 10:30:32|Deleted Account|т.е. по факту налогов не заплатили и не понятно реальная эта у них прибыль или рисованная
410|18.07.2019 10:31:21|Harry Lime|а пацаны то и не знают ... Тигру мяса не докладывают.
411|18.07.2019 10:31:22|Deleted Account|а в этом контексте, то да
413|18.07.2019 10:32:22|Максим Кочнев|Те по факту бумин сейчас признал что таксокистогруз реал проблемные. Типа а че вы вон на других посмотрите, они не лучше. Защита  огонь
414|18.07.2019 10:32:28|Deleted Account|с учетом их объемомв займов и долгов
416|18.07.2019 10:33:59|Harry Lime|Проблема в том , что кроме ААА эмитентов у всех проблемы и риски в той или иной мере , я вижу свою задачу оценить , насколько адекватен риск предлагаемой доходности .
417|18.07.2019 10:37:49|Alex|Речь о такси А кто сказал что там именно такая выручка Там пул независимых компаний с разными бенефициарами, поэтому некорректно суммировать. Одному чтото не понравится, уйдёт к другому агрегатору, вот и выручка уже не 2 ярда, а 1.
418|18.07.2019 10:38:36|Harry Lime|Да годами все строится на желании платить , если история зайдет в тупик желание тоже пропадет.
419|18.07.2019 10:40:41|Alex|Желание спасать ситуацию у компании прослойки будет гораздо меньше. Если история зайдет в тупик у монолитной компании с активами, собственник будет бороться яростнее. А прослойку на свалку при любом шухере.
420|18.07.2019 10:40:59|Harry Lime|Безусловно , вот и ответ
421|18.07.2019 10:41:01|Артем|Так, вопервых, мы причем здесь мы и УниверКапитал А вовторых, я много раз уже пояснял, что не нахожусь в чате постоянно и в случае вопросов к нам стоит отмечать меня в сообщении, как это сделали вы. Соответственно, на все вопросы мы всегда отвечаем, а что касается домыслов и предположений устанешь комментировать, тем более что содержательная часть сообщения выше стремится к нулю. Почему автор решил сравнить облигации именно этих трех компаний с Финавиа На каком основании и с какой целью делает подобный вброс Ответы на эти и многие другие вопросы видимо надо искать в журнале а кто его знает. Однако, стоит всегда помнить, что если ктото когото поливает, значит, это комунибудь нужно. Иначе никак. С нашей стороны как организатора есть полное спокойствие все три эмитента получили средства и вскоре, по традиции, будут новости об их освоении. Мы следим за их финансовым состоянием, публикуем покрытия, сообщаем обо всех даже негативных значимых событиях. Если покопаетесь в нашей аналитике, то легко обнаружите, что методики оценки вполне объективные и мы не стараемся подтянуть под каждую компанию максимально возможную оценку.
422|18.07.2019 10:41:56|Nikolay Pavlov|Такое может кто угодно сделать.
424|18.07.2019 10:43:29|Владимир Тутынин|Подравляю конечно. Ждем обвала на 10000 или просто коррекцию
425|18.07.2019 10:44:47|Aleksandr Mukhin|вскоре будут новости  есть приблизительные сроки публикации отчёта об освоении средств
426|18.07.2019 10:46:52|Артем|Да, в августе будут подробности.
427|18.07.2019 10:48:15|Dmitry Manzor|Согласен Кричи дефолт и подставляй тазы в стакане
428|18.07.2019 10:48:33|Sky|Минимум 1 лот, что равно 10тыр. Скорее всего от брокера у вас ограничение по этому выпуску
