|time|user|text
295|07.09.2018 19:16:44|А что ты сделал для котэ!?|Со всем уважением к Денису  я бы подождал светофора от Эльвиры Захипзадовны 
296|07.09.2018 19:27:42|Konstantin Permyakov|Через неделю первый светофор от Эльвиры
297|07.09.2018 19:30:03|Шура SiberianRanger|Возможно есть смысл взять флоатеров, пока не подорожали. Или уже в цене
298|07.09.2018 19:31:39|Kir|Или корзинку офз в шорт, ведь если ставку повысят длинные еще упадут, там и до прогнозов райфа в 12 по офз не далеко
299|07.09.2018 19:53:01|Harry Lime|Мой прогноз 1415 на об,явлении санкций против госдолга, по самым длинным ОФЗ. Это исторические уровни декабря 2014. Гэп должен быть закрыт.
302|07.09.2018 20:00:39|А что ты сделал для котэ!?|И сбер по 60
303|07.09.2018 20:03:42|Harry Lime|Мое скромное мнение по акциям в рублях , по Сберу в частности. По графику уровень дна в районе 140. Но мне кажется это малодостижимая цифра, тк уже на нынешних уровнях ,при покупке из доллара по 70 , даже дивдоходность получается фантастической. Игроки понимают , что падение рубля будет резким и моментным , потом начнется рост.
305|07.09.2018 20:04:56|А что ты сделал для котэ!?|Атаоичем здесь доллар и его курс
307|07.09.2018 20:05:47|Harry Lime|170 руб по 60 и 170 руб по скажем 75 , в долларах есть разница.
309|07.09.2018 20:06:17|А что ты сделал для котэ!?|Уточню вопрос Доха по офз 14  это доллар по 80 примерно если не дороже После этого  скорее всего все двинется обратно постепенно, и доллар и доза вниз Вопрос  при долларе 80 и дохе 14 сколько будет стоить сбер
310|07.09.2018 20:06:44|Harry Lime|Мой прогноз  в пределах 140.
311|07.09.2018 20:07:25|А что ты сделал для котэ!?|Значит префы  примерно 120
312|07.09.2018 20:08:25|Harry Lime|Ага
313|07.09.2018 20:43:33|Denis Kozlov Septem|Диалекс вчера разместился. Все 300 млн. руб. отдали в одни руки. Торговли ни вчера, ни сегодня не было. Схемный выпуск, похоже.
315|07.09.2018 20:44:46|Harry Lime|Я думаю у Инфовотча следующий купон будет 1112.
317|07.09.2018 20:49:15|Denis Kozlov Septem|Хотелось бы надеяться. Стремимся выйти на рынок ASAP. Давно не было размещений 
319|07.09.2018 20:51:33|Harry Lime|Это знатный уважаемый эмитент , у него уже был выпуск. До Мясничего однозначно самое веселое название эмитента.
320|07.09.2018 20:52:19|J T|А в чем логика с гепом
321|07.09.2018 20:53:04|Harry Lime|Возврат на исторический уровень при резком негативе, как в декабре 2014.
322|07.09.2018 20:53:29|Denis Kozlov Septem|А вот это уже я не уверен, что понял 05.09.2018 О прекращении торгов биржевых облигации Акционерного общества Племенной завод Комсомолец Публичное акционерное общество СанктПетербургская биржа сообщает о прекращении торгов с 06.09.2018 года биржевых облигаций Акционерного общества Племенной завод Комсомолец, ISIN RU000A0JY0F9, в связи с исключением ценных бумаг из Списка.
323|07.09.2018 20:53:32|J T|Это я понимаю. Я никогда не понимал финансовой логики закрытия гепов в теханализе
324|07.09.2018 20:54:30|Harry Lime|РОССИЯ  БОНДЫ доходности по 10тилеткам бондырф
325|07.09.2018 20:55:21|Harry Lime|Должен был погаситься предыдущий выпуск как раз.
327|07.09.2018 20:56:33|J T|Понял
328|07.09.2018 20:56:39|Denis Kozlov Septem|точно это первый выпуск погасили
329|07.09.2018 21:04:56|Harry Lime|RUB  ОПРОС Ослабление рубля в августе и начале сентября  следствие эмоциональной реакции рынка в ожидании второй волны санкций против России. В случае введения жестких санкций США в ноябре курс доллара может краткосрочно подскочить до 75 рублей, однако долго на такой отметке не удержится, поэтому фундаментально недооцененный рубль все равно постепенно восстановит утраченные позиции. 6263 рубля за доллар  именно к этим отметкам usd может вернуться, если новая порция антироссийских мер окажется менее жесткой.  опрошенные ТАСС эксперты rub опрос
330|07.09.2018 21:05:38|Harry Lime|Такое мнение становится мейнстримом , очень плохо , значит скорее всего будет по другому.
331|07.09.2018 21:12:18|Шура SiberianRanger|75, а потом скачок на 1213, только в другую сторону Или вообще ПОПОЛАМ как в 2014, то есть до 120
332|07.09.2018 21:23:47|Sergei|Щас мы в 64 вернёмся
334|07.09.2018 21:25:25|J T|Ну оно мейнстрим, потому что это фундаментальный курс рубля такой
335|07.09.2018 21:26:41|Sergei|Фундаментальный курс это ППС в перспективе
336|07.09.2018 21:33:51|Oleg Lvov|По всем финансовым показателямразумнымрубль и падатьто не должен. Я не такая, я жду трамваяна Аргентину и Турцию с валютными долгами РФ не похожа, профицит бюджета, нефть выше докризисных хаёв, у ЦБ 400 ярдов резервов, куча рабов которые ходят и работают за еду. Но РФ теперь в одном клубе с Северной Кореей и Ираном, а курс 5860 был до развития истории с санкциями по выборам и двум пуховикам. Санкцииэто финансовая война Treasurys War книга называется, поэтому например резервы в долларах или евро могут просто заморозить. Вот ЦБ и скупает золото. Я к тому, что обычные классические финансовые критерии для страны официально назначенной опасной ядерной бензоколонкой могут и не сработать. Ну и что что investment rating. Сказали не вкладывать, институционалы и не будут вкладывать. Мне кажется, после двух пуховиков вы всё врёте верить в рубль вообще опрометчиво.
337|07.09.2018 21:35:25|Sergei|У каждого свой взгляд
339|07.09.2018 21:36:44|Harry Lime|Мы уже давно, не переживайте.
340|07.09.2018 21:39:11|Oleg Lvov|Это да. 14е покажет, увидим.
341|07.09.2018 21:54:14|А что ты сделал для котэ!?|А вот интересно  как мы жили без нерезов в 11 году И в офз и в сбере их было мало, а и рубль и рынок были на пике
342|07.09.2018 21:57:35|Harry Lime|Кстати да , отличный вопрос
344|07.09.2018 22:00:22|Oleg Lvov|Не знаю статистику по 11му году, я тогда был далеко от рынка. ПИФ акций взял, он и не вырос. Но вообще вопрос в самую точку. Я в 11м машину купил, с тех пор в рублях эта же модель подорожала почти в 2 раза. И уже глупо за такие деньги брать. Буду убивать то что есть  В 11м или в 10м Медведев катался в Силиконовую долину посмотреть, поговорить с умными людьми. Конфликта, по сути, ещё не было.
345|07.09.2018 22:01:34|А что ты сделал для котэ!?|Сегодня где то статистику в телеграме видел В 11 году доля нерезов была гораздо ниже нынешей
346|07.09.2018 22:10:42|Oleg Lvov|Возможно. Давайте не забывать про QE1 в 0809м, QE2 ноябрь 20102кв2011 и QE3 с сентября 2012го. Мир от денег лопался и цена на жижу восстановилась.
347|07.09.2018 22:11:32|Harry Lime|Но капитализация рынка была много меньше же Сбер стоил около сотни кажется.
348|07.09.2018 22:15:31|J T|Я ппс вообще не очень люблю, так как он рассчитывается как будто все покупают каждый год пол тачки, один телевизор, 5 кусков хлеба и корову. При этом я не говорю, что он не может улететь на 75 и даже теоретически на 80
349|07.09.2018 22:15:37|Sergei|Сбербанк прея 20 был
355|07.09.2018 22:17:47|J T|Ну так курс по ППС устанавливается через расчёт определенного набора товаров и услуг
357|07.09.2018 22:18:31|Sergei|Ну спорно
358|07.09.2018 22:18:44|J T|Безусловно, голой правды тут нет
359|07.09.2018 22:18:51|Sergei|Ага
360|07.09.2018 22:19:46|J T|Но насколько я знаю, ппс создавался для правильного подсчета тарифов и таможенных барьеров. Они там как раз не учитываются. Ну и ещё транспортные расходы
361|07.09.2018 22:20:25|Sergei|Бля... вы правы , но ППС это то что я написал
362|07.09.2018 22:21:15|J T|И вы правы
365|07.09.2018 22:21:50|Harry Lime|Индекс Бигмака наше всё
366|07.09.2018 22:21:59|J T|Тот же ППС кстати
367|07.09.2018 22:22:30|Harry Lime|Сейчас самый дешёвый в Турции
368|07.09.2018 22:22:52|Sergei|Да там девальвация в моменте
370|07.09.2018 22:25:53|Harry Lime|Недавно узнал , что индийская рупия почти 1 к 1 с рублем, и так же девальвируется.
371|07.09.2018 22:25:58|Sergei|Кстати у меня есть Теория платёжеспособности как соотношение цены Породистых собак и котов
373|07.09.2018 22:29:13|J T|поясните
374|07.09.2018 22:30:10|Sergei|В австралии пудель сорит 1200 долл  австр в РФ 25 тыс руб
377|07.09.2018 22:32:24|Harry Lime|Факт , недавно обсуждали , шпиц в штатах 5 тыс долларов, у нас в разы меньше.
378|07.09.2018 22:32:43|Sergei|Так это и есть ППС
380|07.09.2018 22:34:41|J T|скорее на транспортировку и торговые барьеры
381|07.09.2018 22:34:53|Sergei|Что вы бредите 
382|07.09.2018 22:34:56|J T|не хамите
384|07.09.2018 22:35:11|Sergei|Вы пуделя в своём городе покупаете
386|07.09.2018 22:35:28|J T|в штаты
387|07.09.2018 22:35:32|А что ты сделал для котэ!?|Пиздец
388|07.09.2018 22:35:32|А что ты сделал для котэ!?|ГЕОПОЛИТИКА  США Хаменеи заявил Путину о возможности вместе сдерживать Америку  Fars Россия и Иран могут вести двустороннее сотрудничество по глобальным вопросам. Один из вопросов  это сдерживание Америки, потому что она представляет опасность для человечества  Хаменеи геополитика
389|07.09.2018 22:35:34|Harry Lime|Тем временем курс 69,92 , 8 копеек до 70.
390|07.09.2018 22:35:36|J T|вот
391|07.09.2018 22:35:45|Sergei|За морем тётушка полушка да перевоз дорог
392|07.09.2018 22:36:08|А что ты сделал для котэ!?|Торговля рабами запрещена 
393|07.09.2018 22:36:09|J T|gtда перевоз дорог
394|07.09.2018 22:36:33|Sergei|Телушка
395|07.09.2018 22:36:50|ААА|70 уже был сегодня ранее
396|07.09.2018 22:37:03|ААА|Так, челики, смотрите доходности.
397|07.09.2018 22:37:17|Harry Lime|Human traffic
398|07.09.2018 22:37:43|Sergei|Скотина это не хьюмен
399|07.09.2018 22:38:15|Harry Lime|More human than the human.
400|07.09.2018 22:38:26|Sergei|Я ранее писал ждём щас 1105
402|07.09.2018 22:39:09|Harry Lime|Поглядим , уж больно резко отскакивает от 1,13.
403|07.09.2018 22:39:22|Sergei|Да да
405|07.09.2018 22:39:28|Harry Lime|Пробьет  пойдет на 1,1
406|07.09.2018 22:39:32|Sergei|Я про тренд
413|07.09.2018 22:41:58|Harry Lime|Это разве доходности Дайте 12, а лучше 15.
414|07.09.2018 22:42:37|ААА|А лучше как в Аргентине
415|07.09.2018 22:43:47|Harry Lime|В Аргентине вообще отлично, мясо обалденное , Мальбек резервный рекой. Особенно когда все это за пару долларов.
416|07.09.2018 22:44:05|Sergei|И Серебро дешевое 
417|07.09.2018 22:45:15|Harry Lime|Там кстати грамотный народ , валютных вкладов было под 90 процентов в банковской системе, отдали только в песо по курсу ниже рынка в 4 раза.
419|07.09.2018 22:45:52|Sergei|Ну так там хуже чем Белорусия
423|07.09.2018 22:46:54|Harry Lime|Пока инфляция до 4 да.
424|07.09.2018 22:47:05|Sergei|Да за период
426|07.09.2018 22:48:29|Harry Lime|Так что сознательный народ , хранящий в Сбере в рублях нас спасет.
427|07.09.2018 22:49:02|Sergei|Или те кто в собаках Хранит
428|07.09.2018 22:49:49|Harry Lime|Это особенно актуально в Северной Корее.
429|07.09.2018 22:50:13|Sergei|Остроумно , но там жрут людей
435|07.09.2018 23:08:58|J T|В челябинском роддоме нашли записку в бутылке водки. Судя по датам, послание написали плотники, жившие в СССР в 1980х годах, которые и построили этот роддом.
436|07.09.2018 23:09:01|J T|сменим тему
437|07.09.2018 23:10:34|Sergei|Да да ППС это плитка пудели и шпитцы тем более
440|08.09.2018 00:05:10|Oleg Lvov|Не, на такую ботву нашего султана не разведут. Это всё мечтыВВП говорил, публично и громко, как он ценит то что Россия не связана никакими союзами. Если его высказывания посмотреть в Тегеране а не этого мистера Х, они супердипломатично обтекаемые. Но следующая неделя с фокусами Деда похоже тоже будет закупкой Si  Интересно он объявит о таможенном унасекомливании до или после фестиваля сяомистов.
443|08.09.2018 09:16:24|А что ты сделал для котэ!?|Какое то резание хвоста по частям. В феврале санкции натгосдолг были неприемлемы. Щас уже приемлемы  но не приемлемы санкции на госбанки
444|08.09.2018 09:16:24|А что ты сделал для котэ!?|САНКЦИИ  РОССИЯ  БАНКИ РФ  МНЕНИЕ Из слушаний https//t.me/markettwits/15999 Сената по санкциям в отношении России Максимально жесткие, блокирующие санкции против всех крупнейших российских госбанков нецелесообразны поскольку могут привести к последствиям, идущим вразрез с интересами как США, так и всего Запада.  бывший координатор санкционной политики Госдепа Дэниел Фрид санкциироссия банкирф санкциибанкирф
445|08.09.2018 10:06:12|Евгений Коломна|Это они не хвост, а связывающую с нами пуповину постепенно перерезают
446|08.09.2018 10:12:22|Harry Lime|Написали же, против ВСЕХ нецелесообразно, а пару штук типа ПСб и Вэба прищучить в самый раз.
447|08.09.2018 10:21:43|Евгений Коломна|Где нерезов в заложниках держим, те не прихлопнут пока
449|08.09.2018 11:06:14|Sergei|Интересно а по другим ох будет примерно такой же растоакт
451|08.09.2018 11:47:17|Harry Lime|Конечно, будет как в том анекдоте про коммунизм , который на горизонте. А горизонт  это линия , удадаляющаяся при приближении. У ОХ на горизонте будет купон.
452|08.09.2018 15:03:56|Oleg Lvov|Фрид там самый главный, он на санкциях в Госдепе сидел 10 лет или больше. К его словам стоит отнестись с вниманием. Видимо он понимает, что дверные и автомобильные ручки измазать могут не только в Англии но и в США, как показано в голливудском киношитдевре Шакал.... я его посмотрел месяц назад всего случайно 
453|08.09.2018 19:55:17|А что ты сделал для котэ!?|Лонгрид. Поднапряжемся. Соберём факты за и против. Для Эльвиры к 14 сентября. Плюсы  по оперативным данным сенаторы на данном этапе не горят желанием вводить санкции на госбанки  остаётся запас по реальной ставке 7.552.5  нефтя под 80  как никак основа основ для сырьевой экономики  ожидаемое отклонение от таргета по инфляции в 2019 пока не выглядит драматичным 4.55  как деревья не растут до небес, так и падение не бывает вечным  раздача на EM затянулась, но по нам не сильно бьет  двойной профицит стобюджет  одна из макрооснов макростабильности  ОФЗ в ценах на 80 можно спорить учитывают санкции на новый госдолг  остаётся в запасе довольно мощный инструмент  бюджетное правило. Мораторий на fxпокупки введён до конца сентября. Можно продлить до ноябрядекабря. С такой нефтью в рублях 5300 руб/барр это 6,5 млрд в месяц  те бабосики, которые останутся в системе, не уйдя в резервы. Сейчас ЦБ напрямую отгружает валюту Минфину сокращает свои резервы, но увеличивая резервы Минфина. На эту же сумму будет сокращаться рублевая ликвидность при 70 руб/долл это около 450 млрд руб в месяц  профит сейчас 3,84 трлн руб. Рубли уходят  ставки на мани маркете подтягиваются выше  уже можно рассматривать как ужесточение.  каменты Набиуллиной и других из ЦБ на этой неделе нельзя назвать было супер ястребиными, которые однозначно готовили бы нас к rate hike. Минуса  санкциями нас держат за яйца. Это факт. Моча в голову сенаторам может ещё ударить.  за первым дном всегда есть второе днище  кризис EM по цепной реакции начинает заражать всех. Туркишмены должны показать себя 13 сентября. Надо зарядить ставочку, чтобы сразу всем спекулям показатьне захотят  жди беды.  Фед продолжит повышать ставки  после пятничных пейролсов в рынке заложены ещё два повышения в этом году. Фед при этом продолжить резать баланс и к началу 2019 впервые за долгие годы мы увидим неттоотток ликвидности с рынков. Больная тема.  торговые войны нас напрямую не касаются, но в целом влияют на глобал маркетс. На повестке тарифное ужесточение на 200250 млрд по Китаю и, что хуже, европейский автопром.  геополитика. В Сирии опять шухер наводят. Может очень больно аукнуться. Скрилей тоже в покое не оставляют.  отток капитала, слабый рубль, ндс  рост инфляционных ожиданий, темп роста инфляции выше прогнозного  рост потребкредита, модель поведения населения  потребление vs сбережения. Не знаю, куда прикрутить каменты премьерминистра по ставке. Решили повторить успех Эрдогана Понятно, что всем хочется более доступного кредита и блаблабла. Но, бл.., сомнения в независимости цб обычно дорого обходятся. Так что из плюса занесём в минус. Итого hold, not hike 60/40. Забыли про снижение. Повышение на радарах, но не сейчас. Рынок, конечно, в ожидания hike по полной закладывает. Но, блин, хорошо помню как до Русала в марте рынок прайсил 6,256,5. Логичным сейчас кажется жёсткий комментарий с сохранением ставки и перечислением всего набора пушек, из которых можно по врагам палить во имя сохранения финансовой стабильности. Заседание опорное. Будет и макропрогноз и прессконференция. Ждемс.
