|time|user|text
1|31.05.2019 18:29:51|MrSmith|...и оставшиеся 87 в прибыль. Что тоже неплохо
2|31.05.2019 18:29:53|Астория|Ну вот Слив сейчас Бэлти с купленным нулевым НКД что с налогом то произойдёт
3|31.05.2019 18:31:18|Aleksandr|с каждой проданной облиги возьмут налог с нкд в сумме 4,33 руб
4|31.05.2019 18:31:38|Максим Кочнев|Ой да ладно, я потерял 13 от купона и то не сейчас а в конце года но заработал 1 от тела зайдя в ом и продав по 100.98. Жду такси. Но рост цены там только в июле
5|31.05.2019 18:32:15|Aleksandr|советские люди в булошную на такси не ездят
6|31.05.2019 18:33:23|Максим Кочнев|Вобщем это был осознанный слив
7|31.05.2019 18:33:49|Aleksandr|Ломастер тоже ты 
8|31.05.2019 18:33:53|Максим Кочнев|Потеря 0.4 чепез полгода взамен прибавка 1 уже сейчас
9|31.05.2019 18:34:23|Aleksandr|а комиссия брокера 
10|31.05.2019 18:34:55|Астория|Точно. Или 13 с купона
11|31.05.2019 18:35:05|Максим Кочнев|Ломастер я ещё в среду слил сколько было нужно
12|31.05.2019 18:35:24|Sergey Tokarev|надеюсь не 27amp
13|31.05.2019 18:35:41|Максим Кочнев|Там стена у 24 по 99.3
14|31.05.2019 18:36:01|Sergey Tokarev|а вообще если без шуток льют его беспощадно. сегодня усилилось
15|31.05.2019 18:36:38|Aleksandr|вот кто Софтлайн ушатал в прошлый раз
16|31.05.2019 18:36:39|Sergey Tokarev|вчера еще эта же стена было по 100
17|31.05.2019 18:36:42|Астория|За 3 месяца
18|31.05.2019 18:37:16|Максим Кочнев|Что за 3 месяца
19|31.05.2019 18:37:38|Астория|Бэлти 3 месяца прошло с начала размещения
20|31.05.2019 18:37:46|Максим Кочнев|Ну да
22|31.05.2019 18:38:53|Шура SiberianRanger|Плитка 50 штук на покупку по 99 ушла
23|31.05.2019 18:42:14|Астория|Если часто прыгать из облиги в облигу по мере их новых размещений, беря их с нулевым или малым НКД, 13 с купона будут накапливаться весь год. Это особенно сказывается на облигах с квартальным или полугодовым купоном.
24|31.05.2019 18:43:49|Максим Кочнев|Я в курсе. Я же вам пишу. Оттого что я продал у меня в конце года заберут 0.4. Но оттого что я продал я уже если считать комиссию заработал 0.9. Те по итогу уже 0.5 в прибыли
25|31.05.2019 18:45:39|Астория|Хорошо, что вы отдаете в этом себе отчёт. Но новички могут недопонимать подводного камня с этим налогом с купона
26|31.05.2019 18:47:17|Максим Кочнев|Это да, тут я целенаправленно шёл в ом на 10,чтобы половину продать по 101. Так что осознанно сливал
27|31.05.2019 18:47:17|Елена Филякина|В понедельник 27 днём наливали по 100.
28|31.05.2019 18:51:11|К& Б:))🍷|Случайно ухватил CBOM24 по 99... Поставил тестовую заявку сильно ниже рынка и забыл.. А тут взяли и пролили... Интересно, до какого порога будут лить Или это плавный переход к санации
34|31.05.2019 19:02:11|Dima Seleznev|А зачем это все в Ленинграде
35|31.05.2019 19:02:14|Alex|санация это идеально, если уйдет в ФКБС, это сразу по 110 цена
36|31.05.2019 19:03:00|Alex Petroff|Так случилось. Совпадение
37|31.05.2019 19:03:16|Oleg Egorov|Завтра там День Петербургского инвестора, соответственно много известных лиц прибыло
38|31.05.2019 19:07:22|Dima Seleznev|Тогда ладно. Нам в МО обидно.
39|31.05.2019 19:07:59|Kir|К вам сам Гарри приезжал, грех жаловаться 
40|31.05.2019 19:08:49|Alex Petroff|В мск встречи тоже проводятся на регулярной основе
41|31.05.2019 19:09:11|Dima Seleznev|Придём
43|31.05.2019 19:12:57|Boris|Этот налог с купона на иис либо вернёшь либо не заплатишь. А вот перешагнув через выплату, 35 с ключевая 5 уже точно отдашь государству. Тут же на днях обсуждали стратегию газтормоз
44|31.05.2019 19:16:29|Sergey Tokarev|вот бы знать. хотел докупить сегодня но что то тормознуло. будем посмотреть. резкого негатива пока не видно. да и думаю если бы был он то лили бы сильнее.
53|31.05.2019 19:39:10|А что ты сделал для котэ!?|Главное  не начать бить морды адвокатам у них тоже сегодня праздник
54|31.05.2019 19:39:11|Dmitry Manzor|Эх, хотелось бы тоже послушать умных людей да далеко живу. 
59|31.05.2019 20:03:24|S.P.|https//www.interfax.ru/business/663269 Доходности по депозитам похоже снизятся ещё больше. Ну а евробонды продолжат радовать народ.
60|31.05.2019 20:04:31|Елена Филякина|Ого, круто.
61|31.05.2019 20:05:11|Alex Petroff|Такая серьезная встреча впервые. Если честно, я не ожидал...
62|31.05.2019 20:08:36|Елена Филякина|Бросила свою работу и тоже еду, раз так все серьезно
63|31.05.2019 20:21:58|Anastasiya Gavrilova|Круто как Хотела бы написать, что бросила все, купила билет на сапсан и еду к вам, но пока нет
69|31.05.2019 20:26:15|Aleksandr|это манипулирование рынком
70|31.05.2019 20:26:47|Максим Кочнев|надо стакан у бeргеров посмотреть, там наверное цена вверх скакнула
72|31.05.2019 20:30:29|Alex|МСФО СВОМ за 1к19 появился
74|31.05.2019 20:33:32|Alex Petroff|И стаутом
75|31.05.2019 20:34:42|Маржинколл Байбекович|На постмаркете наливают
76|31.05.2019 20:39:51|Serg|Уважуха Вам реально Не ожидал. Спасибо Мне кажется пора сделать паузу и пообщаться без камеры. Завтра расскажите 
77|31.05.2019 20:41:24|Alex Petroff|Вячеслав Алексейцев рассказал, что в компании Трансмиссия довольно хорошее ПО, грамотное приложение, которое позволяет хорошо прогнозировать транспортную загрузки и ее пики. Они активно работают с независимыми перевозчиками, которые не хотят вливаться в Яндекстакси. Тоже касается и Грузовичкова. Они активно идут в регионы. В общем уже видно, что это сообщение проплачено. Шутка Все записывал с его слов.
79|31.05.2019 20:43:00|Alex|Прибыль за 1к19 упала в почти 10 раз по сравнению с 1к18.
80|31.05.2019 20:55:51|Serg|Ок тогда, спросите, как хорошее ПО осуществляет контроль подключения к системе нелегальных пользователей Это же не секрет для московских перевозчиков.
83|31.05.2019 21:04:55|Alex|0009 Лекция о том как работает лизинг
88|31.05.2019 21:28:30|Aleksey Kormilitsyn|Не похожа на фото в профиле, как, впрочем, и многие здесь.
89|31.05.2019 21:31:59|Alex Petroff|Это она и есть
92|31.05.2019 21:36:46|Bessmertnaya|Ну,нужно было приходить лично, что бы убедиться
94|31.05.2019 21:47:35|Aleksey Kormilitsyn|Пожалуй, не нужно.
98|31.05.2019 21:54:48|Al|Станция щупает почву на предмет длинных биржевых с амортизацией.
100|31.05.2019 21:56:45|Максим Кочнев|Значит надо бпоть их ко
101|31.05.2019 22:03:37|Alex Petroff|Дорогие друзья, встреча с эмитентами подошла к концу. Спасибо всем, кто принял участие. Спасибо всем, кто внимал
102|31.05.2019 22:13:00|Наталья|
103|31.05.2019 22:17:27|А что ты сделал для котэ!?|Я тоже не похож на фото в профиле ... хотя, может и похож 
104|31.05.2019 22:18:56|Aleksey Kormilitsyn|Я тоже далёк от авы, как многие здесь
105|31.05.2019 22:19:41|А что ты сделал для котэ!?|Биржевые  оно, конечно, лучше
106|31.05.2019 22:19:57|Наталья|Я так понимаю, если собираться всем, стадион нужен
107|31.05.2019 22:23:05|Denis Kozlov Septem|Не пройдут новые правила листинга Биржи
108|31.05.2019 22:35:24|r.alex|Круто у вас там
109|31.05.2019 22:59:19|Kir|Сегодня было очень здорово Спасибо всем кто был и организатору отдельное спасибо Я узнал нужную информацию, решил все таки перейти в втбно это не точно и отлично провел время
110|31.05.2019 23:22:46|Alexey Z|Было действительно приятно увидеть старых знакомых, новых эмитентов и, конечно, самого Андрея Хохрина.
111|31.05.2019 23:25:26|DIM|Спасибо всем, друзья, было очень приятного со всеми вами познакомиться. Такое количество эмитентов в особенности был рад видетьспасибо отдельное тебе Алексей Петров за организацию, надеюсь встречи в Питере приобрету регулярный характер и со своей стороны хотел бы предложить всем вам подумать над вопросом дневного выезда на природу с шашлыками и все такое тем более скоро должно потеплее быть.  Ещё раз, всем спасибо, ну и ждём новые лица. Ps Валерия все Вас сегодня ну прям очень ждали, всетаки дождались, надеюсь после такого мужского нападения на Вас, мы не испугали и Вы присоединитесь к нашей команде единомышленников на постоянной основе
112|31.05.2019 23:26:37|Елена Филякина|Андрею из ВТБ спасибо за консультацию  Мужчины, не забывайте девочкам на чай оставлять копеечку им приятно всем отличного вечера.
113|31.05.2019 23:27:43|DIM|Ну и конечно, Андрей Хохрин, приятного было познакомиться, а также огромное спасибо Рогам и копытам буду знать куда в гости заходить, прогуливаясь мимо сенной площади
114|31.05.2019 23:28:39|Turgor|Встреча инвесторов, организаторов и эмитентов прошла отлично Спасибо Alex Petroff за организацию. Тезисно Станция зондирует почву под бо не знаю насколько серьезно, ПР развивается мои фавориты по личным причинам, Грузовичкоффтаксовичкофкисточки размещаются ничего нового, про это всем известно, Технолизинг щедрые, Роделен знает хорошие истории про вино за 400 тыс., и группу Muse, чета Хохриных великолепна и гармонична, Валерия  реальный человек, Dim  инвестор с фигурой терминатора завидую по хорошему, Елена  интересный собеседник и красивая женщина, Kir  мудр не по годам. Многое мог упустить, прошу прощения. Алексею Чернушевичу  респект за прием
115|31.05.2019 23:30:19|DIM|В втб надо переходить в особенности, если вы в тиньковену а так, смотреть по удобству наверное, борзеет с тарифами и не доступу к бумагам ток тинь на сегодня с брокеров, если я не ошибаюсь
118|31.05.2019 23:32:37|Елена Филякина|Нельзя быть мелочным с официантами, эт меня дочь младшая научила
119|31.05.2019 23:33:03|Alexey Z|Инвестор с фигурой терминатора  это зачёт 
120|31.05.2019 23:33:23|Елена Филякина|Альберт, спасибо
121|31.05.2019 23:34:10|DIM|Быстро вы нас покинули, не успел даже пообщаться, ну надеюсь не в последний раз, а вообще сток народу конечно было, если будет и дальше так, то надо на летний дневной полноценный формат общения перехолить всем нам, чтобы времени было побольше свободного и интересно новое друг у друга почерпнуть ну и отдохнуть, если конечно же народ будет за и поддержат
125|31.05.2019 23:39:59|Елена Филякина|Ща пойду своего терминатора измерять не дай бог бицепс трицепс не такой, будет до утра отжиматься 
126|31.05.2019 23:40:32|DIM|Это правильно, что в счёт включили, но когда в Японии бываешь, это для них унижение
128|31.05.2019 23:44:12|Елена Филякина|Да уже и так все куртки малы, проще убить, чем гардероб обновить. Сколько там у вас терминаторский эталон бицепса Вот девочки, искренне рекомендую следующий раз идти  есть на кого посмотреть, не только послушать.
129|31.05.2019 23:49:14|DIM|Да нет эталона, все индивидуально, как нравится так и лепишь свое тело, Алексей наш организатор точно знает он же на спорте
133|01.06.2019 00:04:12|Bessmertnaya|Спасибо за встречу и интересную беседу с близсидящими
134|01.06.2019 00:20:23|DIM|За это им отдельное спасибо, приятно, не зря я зашёл в их бо
136|01.06.2019 03:32:47|Шура SiberianRanger|Спасибо за трансляцию 
137|01.06.2019 05:26:14|Denis| трансляция 
138|01.06.2019 09:31:58|Alex Petroff|Позволю себе небольшой комментарий по вчерашней встрече с эмитентами и профессиональными участниками рынка ценных бумаг. Честно, я не ожидал такого отклика и такого количества участников. Безусловно это было удачное совпадение. Люди приехали на семинары в Спб. филиал Мосбиржи, которые проходили 31.0501.06. А тут какоето непонятное явление, какието люди из чата собираются. Мне было очень приятно всех видеть и познакомиться с Вами Да, формат таких встреч нуждается в доработке и каждый раз я стремлюсь внести в проведение таких встреч некие организационные моменты и создать теплую и дружескую атмосферу. В этот раз спусковым крючком к открытому общению послужила некая придуманная мной перекличка, когда каждый из участников встречи пояснил кто он, чьи интересы представляет. А потом уже в узком кругу сидящих рядом делились своими мыслями. Отрадно, что на встрече были и простые инвесторы. Отдельное спасибо за реверанс Технолизинга от его генерального директора Александра Александровича Пешкова От души угостили участников мероприятия. Плюс им в карму Участники это запомнят. Спасибо представителю Мосбиржи  начальнику управления продаж департамента долгового рынка Павлу Сергеевичу Лукьянову за интерес к простым инвесторам и его вопросы о тактике и стратегии инвестирования в ВДО. На встрече был финансовый директор ПРЛизинга Вадим Вячеславович Асанбаев, который выделил время на посещение мероприятия, несмотря на его плотный график. Я видел его немного ошалевший взгляд, когда он вошел в зал и увидел количество участников. Признаться честно я и сам не ожидал такого количества столь представительных гостей. Слова благодарности следует сказать и Андрею Хохрину. Он впервые на таком мероприятии в Питере. И ему было с чем сравнить. По душевности, юмору и открытости наши встречи выделяются на фоне иных. В общем старику Хохрину понравилось и это было заметно. Представителю Грузовчкова/Таксовичкова/Кисточек Вячеславу Алеесейцеву накануне размещения ц.б. участники задавали вопросы и он давал на них исчерпывающие ответы. Но по большей части встреча была неформальной. Со своей душевной атмосферой. Ну и спасибо девушке Валерии, которая не постеснялась и пришла в столь солидное и непонятное для нее сообщество. Своим визитом она полностью переключила все внимание Алексея Чернушевича на себя. Вот такое страшное оружие  молодость и привлекательность Несмотря на количество участников Станция и их филиал Рога и Копыта успешно справились с таким количеством посетителей, для чего дополнительно были приглашены два официанта для обеспечения мерориятия. Плюс в карму Алексея Чернушевича и большое спасибо за ритмичное решение организационных вопросов и гостепреимство В целом все задуманное по встрече удалось P.s. под конец встречи начальник отдела брокерского обслуживания в Спб брокера ВТБ Андрей Филиппов был с моей легкой руки растерзан инвесторами и замучан вопросами по тарифам и условиям этого брокера.
139|01.06.2019 09:36:53|Denis|Респект вам Алекс
140|01.06.2019 09:38:43|Capricious|И где инсайды 
141|01.06.2019 09:38:53|Deni Le|Спасибо Вам за то что горите за идею
143|01.06.2019 09:45:30|Alex Petroff|Остались в стенах Рогов и копыт. Приходите и слушайте
144|01.06.2019 09:47:35|Paul P|
145|01.06.2019 09:50:13|Даниил Иванов|А в чем смысл такую ставку делать, да еще и 4 купона в год
146|01.06.2019 10:09:39|Aleksandr|ну квартальные купоны это норма у строителей.Так и у СЭТЛА сейчас и у ЛСР
147|01.06.2019 10:12:42|Alexander Peshkov CEO TEHNOLEASING|Всем доброе утро Присоединяюсь к словам благодарности организаторам мероприятия Все  супер Такое количество и состав был неожиданностью для всех Особенно впечатлило, ОТНОШЕНИЕ организаторов ко всему происходящему.. все это с такой большой любовью и трепетом.... Впечатляет и вдохновляет  Очень жаль , что со всеми не удалось пообщаться.. Надеюсь, на этом наше общение не закончится  Ваш ТЕХНО Лизинг.
148|01.06.2019 10:14:58|Шура SiberianRanger|ТЕХНО лизинг это такое же крутячее название как ТРААААНС МИССИЯ 
149|01.06.2019 10:18:03|Евгений Коломна|Отблагодарите Станцию понастоящему  приобретите их КО
150|01.06.2019 10:18:46|Шура SiberianRanger|Пусть БО делают 
151|01.06.2019 10:18:58|Igor Sugrobov|Один из главных критериев отбора от Хохрина, как открытость к общению у обоих эмитентов соблюдён Отлично
152|01.06.2019 10:19:52|Евгений Коломна|БО слишком буднично
153|01.06.2019 10:23:19|Alexey Vishnyakov|Сложность с покупкой. Если бы ко можно было бы купить так же просто, как в янго, в любом брокер, я бы купил понемногу разных эмитентов. У меня итак уже 3 счета и открывать ещё один чисто под ко нет никакого желания.
154|01.06.2019 10:24:57|Евгений Коломна|А как же подвиги во имя Любви, как в старые добрые времена
155|01.06.2019 10:29:55|Alexey Vishnyakov|Люблю ли я ко  Вот в чем вопрос. Хотя ставки по 20 вызывают интерес.
156|01.06.2019 10:32:24|Евгений Коломна|Эт точно...
157|01.06.2019 11:15:56|Александр Кучеренко|Если держать вэб, более 3х лет  переоценки не будет 
158|01.06.2019 11:16:41|Harry Lime|По телу не будет.
159|01.06.2019 11:16:44|А что ты сделал для котэ!?|Будет, но в размере свыше 9 млн руб
160|01.06.2019 11:17:16|Александр Кучеренко|ПИК Почти отыграл своё Падение
