|time|user|text
696|19.07.2019 08:29:23|Harry Lime| консультируем кейсклиента Диверсификация  важнейшее правило в инвестициях, но на практике не каждый инвестор его придерживается. Значит ли, что такой инвестор делает ошибку Давайте не будем категоричны. Есть инвесторы, которые покупают несколько широких индексов акций, облигаций, металлов и ещё чегонибудь через биржевые фонды etfы и получают огромную диверсификацию, а есть те, кому комфортно купить одну облигацию на всю сумму. Существует ещё множество промежуточных вариантов, и все они имеют право на жизнь, и везде цель одна  сохранить. У каждого подхода свои плюсы и минусы, свои риски и возможности, и мы будем о них рассказывать  каждый вправе выбирать, что для него лучше и комфортнее. А чтобы выбирать, нужна полная картина. Сегодня разберём, на что идёт инвестор, который отказывается от диверсификации и на весь портфель покупает евробонды Газпрома 2034 года погашения . Вернёмся к истории. Бумага была размещена в далёком 2004 году с купоном 8,625 по номинальной стоимости, и с тех пор торгуется на вторичном рынке. За прошедшие 15 лет бумага стоила и 68 номинала в 2008 году, и 145 номинала в 2013ом цена бумаги  красная линия. Но для оценки полного результата синяя линия нужно учитывать не только переоценку стоимости бумаги красная линия, но и регулярные купонные платежей по ней, которые накапливаются каждый день и выплачиваются по этой бумаге раз в полгода. Дополнительно нужно учитывать затраты на комиссии, на налоги и на курсовую переоценку, но для простоты расчётов мы не стали их учитывать. Итак, за 15 лет обращения самые большие коррекции были 2 раза 1. на 33 с января 2008 г. по октябрь 2008 г. Отросла до прежней стоимости к октябрю 2009 г. Чтобы выйти в 0 понадобилось 1 год 10 месяцев 2. на 14 с января 2013 г. по декабрь 2014 г. Отросла до прежней стоимости к марту 2016 г. Чтобы выйти в 0 понадобилось 3 года 2 месяца Можно назвать эту бумагу рисковой Кредитный риск очень низкий, но рыночный риск высокий  цена бумаги растёт и падает очень значительно. Изза того, что погашение будет не скоро, то на стоимость бумаги влияет всё, что можно  процентные ставки, геополитика, ситуация в мировой экономике. Покупая такую длинную бумагу, вы должны понимать, что коррекции периодически случаются, и если вы морально к ним не готовы, стоит воздержаться. Потому что худшее, что бывает во время коррекции  нервы инвестора не выдерживают и он продаёт бумагу по самым плохим ценам. Вспомните 2008 или 2014 год  смогли бы вы выдержать падение на 33 и не продать бумагу А лучше  найти силы, чтобы докупить бумаги, когда все СМИ кричат об ужасной ситуации в экономике Попробуйте смоделировать эту ситуацию, чтобы скорректировать свои ожидания. Что получает инвестор, покупая эту бумагу 1. Сохранность. Кредитное качество Газпрома  и в 2008, и в 2014 году о дефолте не шло и речи, несмотря на глубокое падение цены бумаги. 2. Возможность разместить деньги надолго под высокий процент. Посмотрите на долгосрочную динамику на графике синяя линяя  доход перекрывает инфляцию и выше ставок по валютным вкладам в российских банках.
697|19.07.2019 08:32:11|Александр|Очень неплохая идея, но брать надо ее на просадке, по текущим ценам не симпатично
698|19.07.2019 08:32:47|Harry Lime|Это не важно , тк на ИИС заводятся только рубли.
700|19.07.2019 08:34:18|Александр|А, то есть в динамике то на то и получим
701|19.07.2019 08:34:33|Alex S|на просадке бакса наверно
702|19.07.2019 08:37:21|Harry Lime|Примерно да , то есть сразу надо отдать себе отчет , что она может сложиться на 1020 легко. Но цель инвестирвания у нас накопить на пенсию в валюте без налогов , а не стонать у терминала на просадках.
703|19.07.2019 08:38:30|Александр|Хорошая идея, завести отдельный счёт, где не надо будет страдать. Взять такой пенсионный бонд и забыть о нем
704|19.07.2019 08:38:44|Harry Lime|А я о чем
705|19.07.2019 08:38:53|А что ты сделал для котэ!?|А как тогда покупать долларовую бумагу
706|19.07.2019 08:39:04|Harry Lime|БКС и Финам дают
709|19.07.2019 08:42:46|Alex S|эта идея наверно все таки для зажиточных крестьян. смысла брать один, и даже два лота  наверно особого нет
710|19.07.2019 08:43:10|Harry Lime|Безусловно
712|19.07.2019 08:44:19|Александр|Сначала работаем, копим и увеличиваем капитал, затем думаем как его сохранить к пенсии со снижением валютного риска, на выходе получаем новое поколение российских пенсионеров 
713|19.07.2019 08:44:51|Harry Lime|Важно за кредитное качество эмитента не опасаться , даже Вэб в этлм отношении не кажется мне идеальным
715|19.07.2019 08:50:43|Шура SiberianRanger|По 68 конечно кайф было бы взять
716|19.07.2019 08:51:18|Harry Lime|Еще раз доказывает , когда все рушится  бери качество
717|19.07.2019 08:52:50|Alex S|только в это время надо еще деревянненьких найти, чтоб купить по курсу 80 за бакс
718|19.07.2019 08:53:34|А что ты сделал для котэ!?|10 тыс долл
719|19.07.2019 08:53:58|Шура SiberianRanger|Берёшь доллары с депозита, меняешь на рубли, рубли суёшь в ИИС, покупаешь доллары, покупаешь облигу.
720|19.07.2019 08:54:03|Harry Lime|Ага , но она уже 130  НКД , так что 13 000
722|19.07.2019 08:54:27|Alex|В МСФО обычно есть
723|19.07.2019 08:54:42|Alex S|ну если в заначке есть доллары то оно конечно
724|19.07.2019 08:55:06|r.alex|А что, есть большая вероятность, что вычет по ИИС по типу А закроют
725|19.07.2019 08:55:15|Alex S|глянул щас в приложении 137
726|19.07.2019 08:55:30|Harry Lime|Я считаю да , дело пары лет имхо
727|19.07.2019 08:55:33|Alex S|от 140 отскок небольшой вниз сделали
728|19.07.2019 08:55:59|r.alex|Значит, не зря я первый тип выбрал
729|19.07.2019 08:57:18|Harry Lime|Ну это мое мнение , мы тут обсуждали уже , либо дадут досидеть 3 года , то есть если открыл в 19м до 21 го. Либо ограничат число вычетов 3 и все скажем.
730|19.07.2019 08:57:57|r.alex|У меня уже почти все и вычеты почти все уже пропил
731|19.07.2019 08:58:50|Harry Lime|Самый шоколадный вариант , если скажем вычет будет на ИИС , открытые до определенного года , скажем 20 го.
732|19.07.2019 08:58:55|Алексей ayaye :)|я также поступил, но с иис А и рус28.
733|19.07.2019 09:00:53|r.alex|А, то есть Вы думаете, что если ты этот счёт открыл давно и не закрываешь я знаю много людей, которые открыли пустые счета и ждут, когда будет подходить к концу третий год ИИС, чтобы положить 400 рэ, получить вычет и закрыть счёт. Мне кажется, это все изза них
734|19.07.2019 09:01:42|Harry Lime|И таких полно
735|19.07.2019 09:03:22|S.P.|У меня вот большие сомнение что с долларом все будет хорошо в 34 году. С другой стороны альтернатив особо нет
736|19.07.2019 09:04:08|Алексей ayaye :)|вопрос, если с долларом будет плохо, что будет с рублем
737|19.07.2019 09:04:36|Vladimir|то с рублем все будет хорошо пока у нас есть нефть и газ
738|19.07.2019 09:04:55|Aleksei Tuv|Газпром052034евро лот 1000 
739|19.07.2019 09:05:13|S.P.|Это с олигархами владеющими заводами все будет хорошо 
740|19.07.2019 09:06:16|Nik Alex|Подскажите новичку, это можно купить и забыть
741|19.07.2019 09:09:39|Denis|Нет в мфсо ебидты обычно.В презентации всегда найти можно.
744|19.07.2019 09:17:56|Vladimir|Почта России фгуп. Они деньги из минфина получают. К концу года хотят стать ао и тогда может быть
745|19.07.2019 09:19:20|Aleksei Tuv|Можно но цена сейчас не подходящая 137 от номинала, это дохть к погашению 4,8  где то
746|19.07.2019 09:26:21|Alexi|В отчетности по РСБУ ебидта отдельно не рассчитывается, но можно посчитать ее самому. Сначала считаем ЕБИТ операционная прибыль  прочие доходы  прочие расходы, потом прибавляем к ней амортизацию. Амортизация обычно приводится в пояснениях к отчетности у крупных компаний они есть практически всегда
747|19.07.2019 09:27:34|Nik Alex|Спасибо Вам
748|19.07.2019 09:28:51|Alexey Vishnyakov|А мне кажется, так себе. Вычет больше, чем с 400к не получишь. Это только та б. Тогда уж лучше купить на обычный счёт, да и пусть лежит.
751|19.07.2019 09:32:57|А что ты сделал для котэ!?|Удобно Можно купить достаточно бумаг для реинвестировать купонов в те же облигации
752|19.07.2019 09:34:24|Dmitry Manzor|С ИИС сейчас непонятно, могут прикрыть лавку
754|19.07.2019 09:40:17|А что ты сделал для котэ!?|Россия 35  4.31  доха Газпром 34  5  Проще уж не парится с иис и купить Россию
755|19.07.2019 09:40:30|sergei begreater|Если бонды держать до пенсии т.е. больше 3х летто ИИС типа Б не нужен.
756|19.07.2019 09:40:33|Moar|россия35 200К
757|19.07.2019 09:41:31|А что ты сделал для котэ!?|При доходе 3 млн руб в год А если больше
758|19.07.2019 09:42:01|Maksim|Мне кажется что при нынешнем руководстве ЦБ и минфина такого жёсткого кидка не будет.. Это ж сколько людей уйдёт тогда с рынка и их палкой потом туда не загонишь
759|19.07.2019 09:44:34|Alexey Vishnyakov|Да ладно  я не уйду. Те, у кого есть накопления, тоже не уйдут. У нас средний иис это 117 тысяч. Уверен, есть куча иисов открытых про запас. Пострадают только брокеры, которые дерут комиссии по сделкам с копеечными счетами
760|19.07.2019 09:44:54|sergei begreater|Если больше, то нужен, но 3 млн каждый год до пенсии всётаки не мало.
761|19.07.2019 09:48:28|Maksim|намек на черный и еще один с буквой О в начале
762|19.07.2019 09:53:50|Alexey Vishnyakov|Не понял.
763|19.07.2019 09:56:14|Maksim|Статус грабителя домохозяек, мне кажется, можно приклеивать к Тиньку. и я бы еще открытие приписал, который берет депозитарку вне зависимости от наличия сделок если на счете меньше 50К
764|19.07.2019 09:58:03|Savel|Финам тож берёт вне зависимости от наличия сделок
765|19.07.2019 10:01:21|Alexey Vishnyakov|А  теперь понятно. Но сейчас не только Тиньков тянет людей на биржу. Мне где то с месяц назад звонила сотрудница сбербанка  хотела рассказать мне о иис. Думаю они много кому звонят. Даже если сумма небольшая, то копеечка все равно капает. Комиссии за сделку, депозитарка.
766|19.07.2019 10:02:33|Maksim|и, судя по статам MOEX, сейчас топ попсовый вариант  открыть ИИС и затариться на нем ОФЗ. Если убить вычет А, какой будет профит Никакого. Проще будет занести кэш в ВТБ с ежемесячной капитализацией и без головняков
767|19.07.2019 10:03:39|Alex S|тарифы там gt https//t.me/druz_svid
768|19.07.2019 10:04:23|Harry Lime|С купонов налог заплатите , а купон у газика жирненькой
769|19.07.2019 10:12:59|Scorpio76Spb|Доброе утро всем Гарри, а не подскажите по белорусским ОФЗ вопрос лучше здесь или в Друзе задавать
770|19.07.2019 10:13:34|Harry Lime|Давайте здесь
772|19.07.2019 10:14:38|Маржинколл Байбекович|Закон 4к это компенсирует.
773|19.07.2019 10:17:11|Scorpio76Spb|Вчера спрашивал у ВТБ , что с этими бумагами. Получил интересный ответ Цитирую Информация по облигациям Белоруссии.Завтра размещение 04 и05 выпусков по 5 млрдюр, срок 3 года, индикатив доходности 9.64 . А на вопрос, что надо чтобы подать заявку  молчок. А я думаю, что эти бумаги 102 минимум после размещения стоить будут. Жалко пролететь мимо. Может подскажете, как принять участие в размещении
774|19.07.2019 10:18:30|Alex Petroff|Подскажу. Этот вопрос решать ТОЛЬКО через брокера.
775|19.07.2019 10:18:48|Alexey Vishnyakov|Кстати по белорусским облигациям есть вопрос. Освобождены ли они от налога, ведь по сути это иностранные облигации торгующиеся на мосбирже
776|19.07.2019 10:19:15|Harry Lime|От 300 тыс можно подаваться в книгу в ВТБ , можно найти компетентного человека в ВТБ Брокер. Про 102 не уверен , но 101 да вполне вероятно и быстро.
778|19.07.2019 10:20:42|Aleksei Tuv|Уже зарегистрировали что ли выпуски по белоруссам
779|19.07.2019 10:25:17|Harry Lime|Новая история долгового рынка РФ Белоруссия официально объявила индикативы размещения собственных государственных облигаций на российском рынке. Два выпуска по 5 млрд руб. на три года. Для новых подписчиков объясняю, что размещение долговых инструментов является альтернативной формой привлечения кредита для финансирования личных потребностей страны. Неплохая возможность разбавить свои депозиты или портфели по облигациям новым риском. Правила размещения следующие ставка доходности не должна превышать 250 базисных пунктов или 2.5 относительно бескупонной кривой ОФЗ. В настоящий момент доходность составляет около 9.64 годовых. Это полностью транслируется с моей модельной оценкой позиционирования Белоруссии , однако с небольшим уточнением. Я корректировал на 50 бп межвалютную премию, если не учитывать этот факт получится ставка 9.64. Российские облигации на этом сроке предлагают доходность 7.13 годовых. Налог с купона  0 . Для физических лиц купонные доходы не будут облагаться по ставке 13, что корреспондирует со статьей 217 Налогового кодекса РФ пункт 25. белоруссия облигации
780|19.07.2019 10:25:27|Harry Lime|Пруф по налогам
781|19.07.2019 10:26:12|Тим Тим|
782|19.07.2019 10:26:22|Scorpio76Spb|В том то и дело на русбонде ничего не могу по ним найти. А в ВТБ говорят , что размещение сегодня.
783|19.07.2019 10:27:15|Harry Lime|Но всегда держите в памяти историю с походом белорусов на ММВБ на 80 в 2012м году.
784|19.07.2019 10:27:38|Scorpio76Spb|А что там было
785|19.07.2019 10:28:23|Aleksei Tuv|Позвоню тоже в втб
786|19.07.2019 10:28:27|Harry Lime|Бонды в рублях обвалились на 20 , когда пошли терки с батькой по рефинансу кредитов и цене на газ.
790|19.07.2019 10:30:13|Scorpio76Spb|Спасибо, учтем
791|19.07.2019 10:31:24|Romeo|щас батька уйдёт, может быть повторение украинских бондов. рискованно имхо.
792|19.07.2019 10:33:55|Alexey Vishnyakov|Батька уйдёт  Я бы на неё рассчитывал
793|19.07.2019 10:34:20|Romeo|шеварнадзе тоже не рассчитывал. сердечко ёк, придёт сынок, через год сынку помогут уйти.
794|19.07.2019 10:34:38|Scorpio76Spb|Но у меня остается вопрос, где брать скрипт для подачи заяки Или, так и говорить  Хочу Белорусские ОФЗ 4 или 5 выпуск, столькото, по номиналу
795|19.07.2019 10:35:10|Harry Lime|Там не скрипт , вам надо подавать заявки в книгу
796|19.07.2019 10:36:04|Alexey Vishnyakov|Шеварнадзе старый был, как дерьмо мамонта. Батька ещё вполне ничего. Назарбаеву, вон, 90 скоро а он отлично себя чувствует, хоть и передал власть марионетке
797|19.07.2019 10:36:23|Romeo|а это как делается
798|19.07.2019 10:36:30|sasha bav|Подскажите пожалуйста,по МСБ лизинг нет на счету амортизационной суммы . Раньше всегда утром уже была. У меня одного так брокер БКС.
799|19.07.2019 10:36:43|Scorpio76Spb|
800|19.07.2019 10:37:54|Harry Lime|Звоните брокеру и говорите , что хотите принять участие в букбилдинге по облигациям Белоруссии 03 или 04 серии. Только деньги должны быть на счету.
802|19.07.2019 10:40:27|Romeo|7  это что
804|19.07.2019 10:40:47|Harry Lime|В БКС и Открытии услуга такая стоит 1500 и 2000 руб соответственно
806|19.07.2019 10:41:40|Harry Lime|Минимальная ставка купона , скажете 9,5 , а будет 9,4 вас пошлют на три буквы
807|19.07.2019 10:42:27|Romeo|а если будет 9.4  у меня будет 9.4 если назову 7, верно
808|19.07.2019 10:42:48|Harry Lime|Да , поэтому я и говорю , если точно хотите брать
809|19.07.2019 10:43:41|Антон|bondyboss Павел, по Дени Колл книга открыта  Заявки как вы собираете
810|19.07.2019 10:44:01|Harry Lime|Си бондс говорит открыта
811|19.07.2019 10:44:22|Антон|Я вот тоже сейчас увидел это сообщение
812|19.07.2019 10:44:26|Romeo|а по бел облигам есть исин почитать на рубондс хочется
813|19.07.2019 10:44:43|Harry Lime|Айсин будет в день перед размещением
814|19.07.2019 10:44:48|Pavel Bilenko|Да, книга открыта. Заявки можно подавать в книгу, направив оферту по указанным адресам, или софтзаявку мне здесь.
815|19.07.2019 10:45:02|Антон|Спасибо
816|19.07.2019 10:45:21|Romeo|а когда размещение и закрытие книги
817|19.07.2019 10:46:19|Harry Lime|Думаю гугл в курсе
818|19.07.2019 10:46:49|Romeo|вот пытался загуглить, подумал что по исину гуглить проще
819|19.07.2019 10:47:12|Harry Lime|Не будет айсина , его дают после обеда в день перед размещением
821|19.07.2019 10:48:55|Alexey Z|Коллеги, в итоге в Дэниколл ктонить собрался
823|19.07.2019 10:50:59|Denis Ipatov|Поле Максимальная сумма, на которую мы готовы купить Биржевые облигации рубли РФ можно указать с запасом, а 23го выставить заявку на меньшую сумму
824|19.07.2019 10:54:07|Антон|Кармани 1 ... вот это ценник
826|19.07.2019 11:13:49|Дмитрий Адамидов|Опросы у нас вообще то тут  angrybondspoll
829|19.07.2019 11:15:33|Alexey Z|ок, просто Максим в отпуске, поэтому запостил сразу сюда.
