|time|user|text
629|20.06.2018 00:55:50|Giovanni Goudini|Вот если Kernel или Astsrta брать надо на Варшаву доступ иметь.
630|20.06.2018 00:56:04|Pasha V|у меня есть через ib
631|20.06.2018 00:56:07|Giovanni Goudini|Сам считай
637|20.06.2018 01:00:35|Pasha V|нет, пока не разбирался
640|20.06.2018 01:10:41|Mozart|По МХП, Косюк в лице мажора и его связи с Гройсманом вас не смущают Попадет в опалу могут быть проблемы с дотациями
641|20.06.2018 01:27:45|Giovanni Goudini|Косюк при любой власти выживет
653|20.06.2018 07:45:54|Morkoy|Я не ставлю на спорт , сказал для красного словца
654|20.06.2018 08:48:53|J T|Коллеги, что думаете по поводу уплощеной кривой Скоро увидим десятилетки ниже 2,5
655|20.06.2018 08:54:39|Сергей Ковалев|у нас в повестке завтра мясничий, а 25 ломбард мастер пока ничего интересного больше не предвидется
656|20.06.2018 09:07:41|Harry Lime|Как Наби все продаст , так и увидим, но и 2,5 это както очень оптимистично.
657|20.06.2018 09:08:23|J T|Ну я утрировал
659|20.06.2018 09:10:02|Harry Lime|Теперь майскую статистику по трежерям все будут ждать с нетерпением, кто там ещё в продаваны заделался кроме наших , вот если Китай...
660|20.06.2018 09:33:52|J T|Я, если честно, не уверен, что это именно наши продажи сбили рынок до 3 тогда
661|20.06.2018 09:34:24|Harry Lime|Наши и ещё чьито, вопрос чьи ещё.
662|20.06.2018 09:34:27|J T|А вот что будет, если Китай захочет продавать, или хотя бы скажет, что хочет
669|20.06.2018 09:45:33|Harry Lime|Я вином в два раза дольше занимаюсь, там у меня опыта больше соответственно.
670|20.06.2018 09:46:20|J T|Можно сделать крутую статистику, разложить ряды, найти закономерности
672|20.06.2018 09:47:44|Harry Lime|Она есть
674|20.06.2018 09:48:28|J T|А соотношение качества и текущей цены
675|20.06.2018 09:48:50|Denis Kozlov Septem|Легенда сегодня угощает инвесторов. Ритц, все дела
676|20.06.2018 09:49:13|ААА|Василий Олейник
677|20.06.2018 09:49:22|Denis Kozlov Septem|Хотят 2 млрд. на 3 года с амортом
678|20.06.2018 09:49:24|Harry Lime|Есть список инструментов , есть площадки , торгуй не хочу.
679|20.06.2018 09:49:56|Denis Kozlov Septem|Не знаю 
680|20.06.2018 09:50:30|J T|У меня ток пить пока получается сколько не пытался начать разбираться, стопорюсь на выявлении нюансов вкусов и запахов.
683|20.06.2018 09:52:20|Иг|На фото не олейник
685|20.06.2018 09:52:48|Harry Lime|В вине есть свои голубые фишки и свои энгри так сказать, на энгри заработок всяко больше , но бывает и рост по фундаментально у голубцов.
687|20.06.2018 10:07:41|А что ты сделал для котэ!?|SBER  VTBR  AGROKOR Кредиторы Agrokor d.d. одобрили план урегулирования, который предоставляет двум российским банкам самую большую долю в конгломерате.  Сбербанк получит 39,2 акций после реструктуризации с возможностью обменять свой пакет в Mercator, что увеличит его долю в Agrokor почти до 42  Группа ВТБ получит 7,5 акций  Zagrebacka Banka получит 2,9  BNP Paribas получит 2,9  Privredna Banka Zagreb  2,4,  Splitska Banka  2,4,  Credit Suisse  1,8 Уровень возврата задолженности примерно для половины кредиторов будет составлять от 80 до 100 процентов, при этом полное возмещение получат лишь небольшие компании с учетом обещания правительства защищать хорватскую экономику. Однако более половины локальных и иностранных банков получат менее 20 процентов. Коэффициент возврата для Сбербанка и ВТБ выше, так как у них были лучше гарантии. Владельцы облигаций получат от 40 процентов до 80 процентов.
688|20.06.2018 10:08:06|А что ты сделал для котэ!?|Становится понятной дальнейшая стратегия магнита 
689|20.06.2018 10:24:34|Harry Lime|Мне будет понятна стратегия , когда они закроют 3 из 4 магазинов на одном перекрестке, по крайней мере у нас.
690|20.06.2018 10:24:52|K G|шампиньоны надо продавать
692|20.06.2018 10:25:48|Harry Lime|Лучше псилоцибы пусть запустят.
697|20.06.2018 10:48:55|K G|мне похожую историю рассказывал охранник из пятерочки. как они бьют бутылки так, чтобы их можно было списать. но и чтобы выпить было что. рассказывал что за полгода перепробовал весь дорогой алкоголь, на который денег никогда не нашел бы
698|20.06.2018 10:49:36|Harry Lime|Это только кладовщики, на каждом уровне менеджмента свой условный бой.
699|20.06.2018 10:50:05|Deleted Account|Ну это рф
700|20.06.2018 10:50:06|K G|да это же торговля. в РФ у каждого есть такой же бой
701|20.06.2018 10:50:11|Deleted Account|Чего удивляться
702|20.06.2018 10:50:59|Harry Lime|В Х5 такого я не видел, не значит , что этого нет конечно.
703|20.06.2018 10:56:32|Deleted Account|Х5 евреи, там все под контролем
704|20.06.2018 10:56:38|А что ты сделал для котэ!?|Щас про амазаон читаю книгу  у них тоже это есть
706|20.06.2018 10:57:08|Harry Lime|Контроля в Х5 точно больше , Магнитстрашное кумовство и дербан.
707|20.06.2018 10:57:11|Deleted Account|Магнит уже чекисты
710|20.06.2018 10:58:11|Harry Lime|Я гдето читал , что по ЧА цена Магнита 2500, вот оно дно.
711|20.06.2018 11:21:24|Kir| Новая идея Пионер нового типа облигаций Источник НФКСбережения  НФКСбережения размещают дебютный выпуск облигаций компании ПионерЛизинг. Облигации рискованные, но доходные. Особенностями выпуска являются ежемесячная выплата купона и, кажется, впервые на рынке  право на оферту по желанию инвестора в любой месяц Потенциальная доходность 12.25 годовых, срок 1 год Прогноз цены 1000 RUR gt 1122.5 RUR https//t.me/ivurlhttps//investidei.ru/idea/1023fromtelegramamph13fdamprhashe496b98d68e08d
712|20.06.2018 11:22:13|Harry Lime|Бот про Роял просто не знает.
713|20.06.2018 11:24:02|Giovanni Goudini|Но рынок этого не видит, и считает галицкого идиотом... а ещё магнит стоит больше 10 прибылей
717|20.06.2018 11:25:59|Alex Petroff|Сегодня какойто чудак в Манимэне заявку на 22 лота купить по 101.9 поставил, хотя ближайший покупец был лишь на 100.64. Бывает...
718|20.06.2018 11:25:59|Giovanni Goudini|И с другой стороны сколько стоит 1 рубль годовой прибыль компании
720|20.06.2018 11:26:43|Alex Petroff|Ну я его и удовлетворил. Брал по 100.25.
722|20.06.2018 11:27:12|Konstantin Permyakov|ВТБ хитрые бонды выпускает
723|20.06.2018 11:27:24|Giovanni Goudini|Ну и надо таких удовлетворять я в дд тоже по 80 удволетворял
724|20.06.2018 11:27:29|Harry Lime|Я просто вижу как построили гиперы Магнит и Лента. Лента  лучшие места , дотошный анализ траффика , Магнит  где владельцы земли откатили как следует , в жопе мира в переводе на русский.
725|20.06.2018 11:28:13|Giovanni Goudini|Прокатят на хую
726|20.06.2018 11:28:42|Harry Lime|Я узнал , что ДД  это ещё и дополнительный доход.
727|20.06.2018 11:29:15|Giovanni Goudini|Поэтому Галицкий и продал, но все видят абсолютную цену сделки, но не видят относительной
729|20.06.2018 11:29:54|Harry Lime|Такими структурниками с курсом рубля БКС баловался ещё 8 лет назад.
730|20.06.2018 11:30:08|Konstantin Permyakov|На курсовой разнице
731|20.06.2018 11:30:12|Giovanni Goudini|Это же кукан
732|20.06.2018 11:30:26|Deleted Account|Русские стерпят.
733|20.06.2018 11:30:29|Giovanni Goudini|Можно понять где будет курс по таким эмиссиям
734|20.06.2018 11:30:33|Konstantin Permyakov|И ВТБ им занялся
735|20.06.2018 11:30:51|Giovanni Goudini|Лохов не кинуть  себя не уважать
741|20.06.2018 11:34:45|Harry Lime|ВТБ метит в 68 я так понимаю.
742|20.06.2018 11:36:49|Giovanni Goudini|Главное не в 60
744|20.06.2018 12:00:30|Harry Lime|По Силмашам дохи стабильно 15 , можно идти на 20. Ситуация располагает.
745|20.06.2018 12:05:32|Alex Petroff|Надо ждать осени по СМ. Там будет определенность. И не только по СМ
746|20.06.2018 12:07:16|Harry Lime|Конечно, нервы держателей Силмашин не железные, а если цена пойдет на писят  рестракт будет в цене.
747|20.06.2018 12:12:20|Giovanni Goudini|Вопрос какой рестракт
749|20.06.2018 12:13:17|Harry Lime|Да по цене будет видно 50 или 25.
750|20.06.2018 12:18:58|Konstantin Permyakov|ВТБ даже своих акционеров на брокерском обслуживании пытается накуканить
752|20.06.2018 12:21:38|Alex Petroff|АПРИ начал вставать с колен...
753|20.06.2018 12:22:58|Giovanni Goudini|Не всем будет видно
756|20.06.2018 12:28:14|Konstantin Permyakov|Нрд пишет 19 числа
757|20.06.2018 12:33:12|Giovanni Goudini|Да
759|20.06.2018 12:35:31|Konstantin Permyakov|А пока мы про силовые машины разговариваем в Америке GE из индекса Dow Johnes исключают
760|20.06.2018 12:36:37|Giovanni Goudini|Ещё несколько баксов вниз и войдёт в.зону покупок
762|20.06.2018 12:36:58|Anatoly|фраза верна и при опущенном квалификаторе на брокерском обслуживании, народное IPO anyone
763|20.06.2018 12:37:36|Konstantin Permyakov|Я их брал на зимнем падении
768|20.06.2018 12:40:16|Giovanni Goudini|Костя, ты посмотри сколько там префосг
770|20.06.2018 12:40:52|Konstantin Permyakov|В этом ну них нормальные дивы
772|20.06.2018 12:41:22|Harry Lime|Чьи префы
773|20.06.2018 12:41:30|Konstantin Permyakov|Точнее дивы ещё за 17 год
780|20.06.2018 13:05:26|А что ты сделал для котэ!?|Адидас стоит 40 прибылей
781|20.06.2018 13:33:08|Giovanni Goudini|Адидас оценивается исходя из ставок еврозоны
787|20.06.2018 15:34:05|Giovanni Goudini|ВТБ
790|20.06.2018 21:56:37|А что ты сделал для котэ!?|Сбер с середины июля планирует ставки по кредитам повышать ... что, в принципе, объяснимо, но, блин, это еще один булыжник в окно экономики Они специально все вредят
791|20.06.2018 21:58:35|J T|У меня есть подозрение, что они не думают о степени вредности своих инициатив
795|21.06.2018 02:25:24|Иг|А может сбер опережает цб
796|21.06.2018 05:59:55|AngelicScale|Блин, народ, вы такие негативные. Ну вырастет ставка у Сбера и ЦБ, так она вырастет и у Ломбард мастеров с ДД и Манимэнами. Ну мыслите же вы позитивно 
797|21.06.2018 06:36:30|А что ты сделал для котэ!?|Это понятно. И ставки по депозитам уже растут и доходности по бондам тоже будут расти ... за державу обидно
798|21.06.2018 07:38:56|Harry Lime|Где растут ставки по рублевым депозитам По валюте да, рубль пока скорее наоборот.
799|21.06.2018 07:40:29|Сергей Ковалев|Harry, вы будете сегодня покупать мясничего
800|21.06.2018 07:41:59|Harry Lime|Нет , зачем, ЛоМастер же в понедельник. 13,5 и 1918 , есть разница Я его возьму потом на сдачу от купонов , там месячный , нкд копейки , от 100 он далеко не уйдет.
801|21.06.2018 07:46:10|Сергей Ковалев|у меня есть кэш на оба выпуска, посмотрим как он будет торговаться. как я понимаю помле ломастера пока ничего интересного дальше нет
802|21.06.2018 07:47:57|Harry Lime|Не видать, Легенда с завтраками в Рице только если... Русская аквакультура и ЧЗПСН , но это чисто ради фана.
803|21.06.2018 07:48:57|А что ты сделал для котэ!?|Сбер зимой 44.5 в валюте предлагал Щас 6
804|21.06.2018 07:51:53|Harry Lime|В рублях. Ну это мне кажется для традиционных физиков, а так даже в банках типа Академгашишкомлект 7,5 не найдешь.
807|21.06.2018 08:07:38|Harry Lime|В мае ввод жилья рухнул на 18.4 гг  max падение с начала 2017г. Делать выводы о тенденции рано. Но наблюдавшийся рост выглядел сомнительным на фоне доходов населения https//t.me/russianmacro/2282
808|21.06.2018 08:07:53|Harry Lime|Это обвал...
809|21.06.2018 08:12:08|Сергей Ковалев|продаем Пик
810|21.06.2018 08:15:04|Harry Lime|Я до погашения ибо по номиналу.
812|21.06.2018 08:21:14|Alex|Я выучил такую вещь  если бежать продавать бумаги на плохих новостях, то потеряешь больше. Исключения бывают, но редко.
813|21.06.2018 08:21:29|Harry Lime|Безусловно
818|21.06.2018 08:35:54|J T|А ни у кого под рукой нет последних отчетов пика Мне кажется, что при его объемах у него все равно достаточно кэшфло для по крайней мере купонов
822|21.06.2018 08:48:02|Harry Lime|Все встало на свои места , глянул  6 й выпуск планировался 14 , так что усох он не почти в 2 , а больше чем в 2 раза. Остаток требуемого добили продажей активов Капиталу.
823|21.06.2018 09:12:18|Alex|Гарри, как считаете, стоит сейчас в каркаде3 заходить 103 и аморт смущают, доха получается 1011
824|21.06.2018 09:18:38|Harry Lime|Я не вижу сейчас большого смысла в Каркаде, да они надёжные польские ребята, но в случае встряски или повышения ставок ЦБ пойдут на номинал. Я вижу смысл ловить его на проливах ближе к 100. Кроме того в этом выпуске есть возможность досрочного погашения  в текущей ситуации это практически невероятно , но всетаки. Сейчас же выбор огромен. В дохе и 11 с рейтингом и сопоставимым риском брал бы Софтлайн  у него как раз скоро купон или Пионер.
825|21.06.2018 09:27:49|Alex|Прошла эра каркаде и полипластов 
826|21.06.2018 09:30:07|Harry Lime|Пришла эра пюдма
827|21.06.2018 09:34:20|Alex|И пионер лизинга. На русбондсе огромная плашка с рекламой висит. А чем громче реклама тем больше надувательство
828|21.06.2018 09:34:43|Harry Lime|Рекламадвигатель торговли
830|21.06.2018 10:55:42|Сергей Ковалев|у Мясничего в стакане на продажу пустовато....
831|21.06.2018 10:58:19|Harry Lime|После обеда
832|21.06.2018 10:58:51|Сергей Ковалев|звучит двусмысленно
835|21.06.2018 11:31:52|Сергей Ковалев|нет
836|21.06.2018 11:32:00|Aleksandr|бред какойто
837|21.06.2018 11:32:13|Сергей Ковалев|финам все хорошо делает
839|21.06.2018 11:32:27|Aleksandr|у бкс тоже все нормально
840|21.06.2018 11:33:15|AngelicScale|Понятно, спасибо
841|21.06.2018 11:45:46|Harry Lime|Про БКС  в начале года по новым облигам были задержки на 12 дня , видимо считали и консультировались. По паре бондов прислали двумя суммами за 17й и 18й год, сейчас все правильно , купоны приходят так же , как и по старым выпускам.
842|21.06.2018 11:49:28|AngelicScale|Ну если СТТ не дефолтнет по купону, я скоро проверю на собственном опыте. Правда у меня брокер ВТБ.
843|21.06.2018 11:50:04|Harry Lime|Я думаю с СТТ до декабря все будет ок.
844|21.06.2018 15:53:55|Сергей Ковалев|реклама захотелось купить...
845|21.06.2018 15:53:55|Сергей Ковалев|26 июня 2018 года произойдет размещение на московской бирже пятилетних облигаций ООО ПионерЛизинг . Данные бумаги носят уникальный характер и вы сами можете в этом убедиться  Ставка купона 12,25 годовых  Ежемесячная выплата купона  Доход не облагается НДФЛ  Предусмотренное право инвестора в любой месяц реализовать ценные бумаги самому эмитенту по номинальной стоимости цене размещения  Номинал 1000 рублей Долговые бумаги ООО ПионерЛизинг подойдут как начинающим, так и опытным инвесторам. Более подробная информация  Сайт эмитента со всеми необходимыми отчётностями https//goo.gl/c3pr6j Сайт андеррайтера со всеми необходимыми отчётностями https//goo.gl/kGBNqk Информация, подлежащая раскрытию эмитентом https//disclosure.skrin.ru/disclosure/2128702350 реклама
846|21.06.2018 15:54:33|Harry Lime|СТТ дефолт, пиздаускас этому пионерскому отряду , теперь наверняка.
847|21.06.2018 15:54:44|AngelicScale|Бляяя
848|21.06.2018 15:55:11|Harry Lime|Не люблю мат , но уже можно.
850|21.06.2018 15:56:24|AngelicScale|Слил в стакан, но я так понимаю плакал мой купон 
851|21.06.2018 15:56:30|Harry Lime|Рановато правда...
853|21.06.2018 15:57:21|Сергей Ковалев|стт хана
854|21.06.2018 15:57:39|Harry Lime|Да , дети хоронят коня...
855|21.06.2018 15:57:46|AngelicScale|Заразы, они ведь по другому выпуску на днях завели деньги в НРД, я только поэтому остался
856|21.06.2018 15:59:57|Harry Lime|Я так попал в Пересвете ПО2, в день купона ввели временную, крепитесь.
857|21.06.2018 16:00:23|Сергей Ковалев|а в стаканах покупатели то еще есть по 100
859|21.06.2018 16:01:07|Harry Lime|Ща не будет.
860|21.06.2018 16:01:13|AngelicScale|Я держал 15 лотов, деловто. Легкий испуг, ничего более. К тому же брал по 94
861|21.06.2018 16:02:11|Harry Lime|Или святые люди верят , что выйдет из техдефолта. В декабре им все равно конец , тк у них нет миллиарда...
862|21.06.2018 16:08:46|Сергей Ковалев|я думал день будет скушным, но не тут то было...
863|21.06.2018 16:09:50|Morkoy|Ху из стт
865|21.06.2018 16:10:35|Harry Lime|Самаратранснефтьтерминал
866|21.06.2018 16:12:03|Сергей Ковалев|стт 01 даже вырос на 1
867|21.06.2018 16:12:17|Morkoy|Жаль облиги нельзя шортить
868|21.06.2018 16:18:57|Сергей Ковалев|ребят, в пионер лизинг написано что есть право владельца облигаций реализовать облиги по номиналу эмитенту это как если это не оыерта
869|21.06.2018 16:23:16|K G|http//www.rusbonds.ru/nwsinf.aspid4798240
872|21.06.2018 16:43:24|Alex|Я останусь в СТТ до выяснения обстоятельств. Может и подкуплю как при объявлении о самобанкростве
875|21.06.2018 16:49:28|K G|я не понимаю на чем выкупают
879|21.06.2018 16:59:59|Сергей Ковалев|у месничего до сих пор нет заявок на продажу...
880|21.06.2018 17:11:55|Harry Lime|Ну если он сцуко завтра заплатит...
882|21.06.2018 17:12:10|K G|но они сказали нет денежек
885|21.06.2018 17:13:10|Harry Lime|Это пахло плохо изначально , сейчас весь этот кал всплывает на балансе Благосостояния.
886|21.06.2018 17:13:11|K G|сейчас ребята звонили, трубку не берут
887|21.06.2018 17:13:49|Harry Lime|Тем временем пришел купон от Софтлайна.
890|21.06.2018 17:17:48|Сергей Ковалев|не всем
891|21.06.2018 17:32:05|Harry Lime|Доля доходов населения, отправляемая на покупку валюты, продолжает устойчиво снижаться. Индикатор слабости доходов и меняющегося потребительского поведения.
892|21.06.2018 17:32:49|Harry Lime|По мне так это показатель готовящегося кукана по валюте, ВТБ ещё с чудо облигами 3 рубля.
