|time|user|text
1|18.06.2019 18:05:48|Harry Lime|Привыкайте , заветы Пересвета вечны
2|18.06.2019 18:06:21|Alexander Kozhevnikov|Надо поискать условия пересвета Даже интересно стало
3|18.06.2019 18:07:25|Pavel|Что, думаете наберут 75
4|18.06.2019 18:08:20|Harry Lime|Сценарий фантастического триллера Финавиатор. Из далекого будущего 2054 года в 2019й год на машине времени прибывает жидкокристаллический Мартиросов.
6|18.06.2019 18:09:02|Soa|презервативы...
7|18.06.2019 18:09:20|Harry Lime|Гораздо хуже
9|18.06.2019 18:11:04|Alexander Kozhevnikov|Через 35 лет их 90 мало кому нужны будут  Разве что внукам кто оставит 
10|18.06.2019 18:11:39|Pavel|Оставлю себе на пенсию. Ахахаха, если доживу
11|18.06.2019 18:11:46|Герман|То есть по 2 выпуску за три года выплатят 6  тела Так она сейчас стоит 6.
12|18.06.2019 18:12:04|Harry Lime|Я вам и так расскажу, возврат займов в 203435 годах вместо 1821 го под 0,51 годовых . Все обязательства по купонам прекращаются. Отступное 25  0,20,5 рублей на облигу
13|18.06.2019 18:12:21|Дмитрий Адамидов|Превзошли сами себя
14|18.06.2019 18:12:38|Harry Lime|Эти условия ходили весной
15|18.06.2019 18:13:02|Дмитрий Адамидов|Ну кроме нулевого купона
16|18.06.2019 18:13:12|Harry Lime|Точно
17|18.06.2019 18:14:28|Дмитрий Адамидов|А купон на горизонте 34 года это вообще самое главное
18|18.06.2019 18:16:04|Harry Lime|Худайнатов святой после такого
19|18.06.2019 18:16:21|Alexander Kozhevnikov|Вообще, конечно В стакане на будущую пенсию наверное забавно такое приобрести Но чтото терзают сомнения что спустя 35 лет они исполнят обязательства 
20|18.06.2019 18:20:34|Дмитрий Адамидов|Я думаю через 5 лет там встанет вопрос с обновлением флота
23|18.06.2019 18:21:00|Pavel|Самое интересное, что я эту бумагу продавал по 42 стоял. Жадничал. Даже продал немного и они весной раз такие
27|18.06.2019 18:30:17|Alexander Kozhevnikov|хех а сайт пересвета до сих пор функционирует
28|18.06.2019 18:34:32|Даниил Иванов|Подскажите а почему в стакане столько покупателей по 20, в чем смысл
29|18.06.2019 18:36:27|Dmitry Manzor|А куда их так занесло до 2054 года
30|18.06.2019 18:37:02|Pavel|Будут на летающих тарелках людей возить
31|18.06.2019 18:38:03|Дмитрий Адамидов|Не все ещё прочухались
32|18.06.2019 18:49:40|Harry Lime|Вера в облом ОСВО крепка
33|18.06.2019 19:00:45|Шура SiberianRanger|
35|18.06.2019 19:33:18|Aleksey|Добрый вечер всем
37|18.06.2019 19:47:17|Kir|Хрен там, а не облом, что они зря на купон зимой наскребли
39|18.06.2019 19:48:08|Шура SiberianRanger|ТАК И ВЫШЛО, сегодня ОМ закрылся по 100.00
40|18.06.2019 19:48:14|Denis Kozlov Septem|Вечерний дайджест ... Диомидовский рыбный порт зарегистрировал дебютную программу облигаций серии БО001 на 150 млн рублей. Максимальный срок обращения выпусков в рамках программы  10 лет. Порт расположен во Владивостоке, основная отрасль деятельности  рыбное хозяйство.
42|18.06.2019 19:48:34|Шура SiberianRanger|У них есть порт 
43|18.06.2019 19:49:23|Harry Lime|Только портки от ДВМП инвесторы отстирали...
45|18.06.2019 19:51:12|Alex|СПБ биржа, ложная тревога
46|18.06.2019 19:51:47|Harry Lime|ДМП без В
47|18.06.2019 19:51:49|Denis Kozlov Septem|Фридом на Восход выводит
48|18.06.2019 19:54:37|Alex|Вряд ли, скорее схематозина уровня Племзавод комсомолец.
49|18.06.2019 19:56:45|Denis Kozlov Septem|Так Племзавод на Восходе и продают. Листинг на СПб Бирже, а торговля на Восходе
50|18.06.2019 19:57:12|Alex|Не знал, что этим фридом занимается
51|18.06.2019 19:59:53|Harry Lime|Денис , вроде на понедельник обещались новости про С Инновации , или я чтото путаю
52|18.06.2019 20:01:30|Denis Kozlov Septem|Еще Условия не подали. Мелкие детали с эмитентом согласовываем. Уже всё готово. Скоро объявим. Вот поэтому я не люблю называть точные даты.
54|18.06.2019 20:03:31|Alex|вспомнил
55|18.06.2019 20:04:39|Denis Kozlov Septem|Ага https//t.me/chat_angrybonds/96600
56|18.06.2019 20:11:48|Kosta|Денис, в целом согласен с ответом. Только необходимо внести небольшую ясность. Бест Эффортс Банк попал в организаторы случайно  как сестричка биржи СПБ. Мы технически организовали размещение исполнение заявок по счету эмитента на инвесторов и не участвовали как организатор в привычном понимании этого слова. Можно попросить больше не использовать в суе рядом с этими именами имя Бест Эффортс
57|18.06.2019 20:15:52|Harry Lime|Супер Право на забвение племзавода считаю надо удовлетворить. Я думаю живьем его никто не щупал из участников чата .
58|18.06.2019 20:21:33|Denis Ipatov|Успеют ли разместиться 28 июня
59|18.06.2019 20:21:33|Denis Ipatov|Следственный комитет заинтересовался сетью дорогих супермаркетов Азбука вкуса. Ктото не заплатил налоги на полторы сотни миллионов рублей. Проверка ООО Городской супермаркет  юрлица той самой Азбуки вкуса  началась 17 июня. Следователей заинтересовали странные кредитные договоры, которые Городские супермаркеты заключали с некой Эльлайн с января 2014 года по 31 декабря 2015 года. С помощью такой хитрой схемы Азбука могла уходить от налогов. Сумма налогового маневра оказалась немаленькой  больше 144 миллионов рублей. Случай очень серьёзный следователи подозревают, что документы, которые Азбука подавала в налоговую, были ей подделаны. Конец продуктового люкса.
60|18.06.2019 20:27:55|Evgeny Naumov NFK|Бизнес у Азбуки Вкуса, видимо хорошо пошел, раз кровососы налетели.
61|18.06.2019 20:31:23|Denis Ipatov|Магнит приглянулся ВТБ, Сбер замахнулся на на OKей. Кто, спрашивается, претендует на Азбуку вкуса.
62|18.06.2019 20:31:31|Harry Lime|Началось быстрее чем понеслось...
63|18.06.2019 20:35:48|Evgeny Naumov NFK|Мне вот одно непонятно, там как прессрелизы пишут в этом ведомстве уважаемом. Кредитные договоры с Эльлайн  . Кредитный договор можно по российскому законодательству заключить только с кредитной организацией, фактически только с банком. Если они даже прессрелиз грамотно составить не могут, то и все обвинения шиты белыми нитками.
64|18.06.2019 20:38:16|Sergey|А нет ли новостей
65|18.06.2019 20:41:18|Евгений Инвестор|Прессрелиз же не следователь пишет, а сотрудник прессслужбы, которая вряд ли хорошо разбирается в кредитах, банках и т.д.
66|18.06.2019 20:44:05|Kirill|Какой прессрелиз Это инсайд от базы. Единственный источник. Коммерсант тоже на них сослался и написал, что скр еще не прокомментировал. Все вопросы к базе.
67|18.06.2019 20:44:23|Evgeny Naumov NFK|Я бы с вами не согласился. Недавно прессслужба еще одного уважаемого ведомства опубликовала фотографии из квартиры одного журналиста, где якобы он хранил и даже изготавливал наркотики, а оказалось, что это и не его квартира совсем. В результате двух генералов этого уважаемого ведомства выгнали в шею. Но не будем уходить от темы ВДО.
68|18.06.2019 20:52:18|Harry Lime|облигации Ищем доходность в Индонезии Мы инвестируем в облигации развивающихся рынков, и с начала 2019 года все они здорово выросли. Так, главный индекс развивающихся рынков JPMorgan Emerging Markets Bond Index с начала 2019 года вырос на 9,3 с учётом купонов. Поэтому возникает вопрос  что купить, если всё подорожало За недооценёнными облигациями мы ходим в страны, испытавшие отток капитала и ещё не успевшие в полной мере восстановиться после падения. Это Турция, Мексика и Индонезия, про которую мы ещё не писали, хотя уже давно в неё инвестируем. Суверенные облигации Индонезии уже восстановились в цене, а корпоративные облигации второго эшелона отстают от суверенных облигаций и всё ещё дают премию в доходности, поэтому представляют для нас интерес. Так, 2 недели назад мы купили облигации энергетической компании Indika Energy. Её основной бизнес  полный цикл разведки, добычи и транспортировки угля. Indika Energy принадлежит 91 крупнейшего угледобытчика Индонезии PT Kideco Jaya Agung, 69,8 сервисной компании PT Petrosea Tbk, 51 PT Mitrabahtera Segara Sejati Tbk  компании, занимающейся перевозкой угля водным транспортом. Поэтому внутри компании достигается высокая синергия между сегментами бизнеса. Уголь упал с начала года на 39 и вероятнее всего продолжит падать изза торговых войн  это негативно влияет на кредитное качество компании. Тем не менее, мы считаем, что у компании достаточно ресурсов для погашения облигаций даже в случае более глубокого падения цен. Облигации Indika Energy с погашением в 2024 году стоят 93,3 номинала и дают доходность 7,4 годовых в USD, если держать до погашения.
69|18.06.2019 20:52:48|Harry Lime|Я выбираю Игоря Иваныча вместо Индонезии
70|18.06.2019 20:53:23|George Goognin|интересно, а 7.4 будет с учетом того, что эмитент погасит по 100
72|18.06.2019 20:54:39|Шура SiberianRanger|Купон 5.875
73|18.06.2019 20:56:04|George Goognin|Спасибо 
74|18.06.2019 20:56:18|Harry Lime|Это бондовая магия
75|18.06.2019 20:57:04|Alex|свое ворье роднее
76|18.06.2019 21:12:24|Владимир Тутынин|Если поверить, можно брать по 1516
77|18.06.2019 21:21:24|Sergey Sidorov|Уж сколько их упало в эту бездну, Разверзтую вдали С М.Цветаева
78|18.06.2019 21:29:27|Harry Lime|Пересвет в день об,явления рестракта закрылся на 12. 810 . Не более того. Это возврат максимум 20 от суммы за 3 года.
79|18.06.2019 21:36:20|Владимир Тутынин|Ну если не будет 2го рестракта, то взяв по 15 получим 15годовых
81|18.06.2019 21:37:28|Harry Lime|Вы не учитываете , что через три года цена 12
82|18.06.2019 21:38:29|Владимир Тутынин|Правда, будет ли ликвидность в этот период  на всякий случай.
83|18.06.2019 21:38:54|Harry Lime|После того , как отдадут эти 20 бумага не будет стоить ничего
89|18.06.2019 21:43:59|Владимир Тутынин|я посчитал так 15 на 3 года с 15 с ежегодной рекапитализацией  22.813
90|18.06.2019 21:44:49|Harry Lime|Цена копейки после всех выплат
91|18.06.2019 21:45:24|Владимир Тутынин|6.66 за 2 год 15 это 2, и еще 6.66 за год 1, и еще 6.66  23
92|18.06.2019 21:46:05|Harry Lime|Ну там премии будут, а вдруг банкротство и тд
93|18.06.2019 21:47:19|Владимир Тутынин|да. если придется скинуть через год, то уже будет минус, если как Вы говорите до 8 может опуститься.
94|18.06.2019 21:47:46|Harry Lime|Да может и до нуля
95|18.06.2019 21:50:02|Владимир Тутынин|Вы будете следить
96|18.06.2019 21:52:23|Harry Lime|Да , на полпрцента возьму ниже 10 , если примут условия по первому выпуску.
97|18.06.2019 21:53:34|Denis Kozlov Septem|Да, спасибо за комментарий. Буду обходить стороной. Я просто на официальной информации основывался
99|18.06.2019 22:00:08|Denis Kozlov Septem|В Беларуси нет налога на купонный доход  ни для ФЛ, ни для ЮЛ. Налог на депозиты есть.
102|18.06.2019 22:11:30|Harry Lime|Русскояпонская война в разгаре. Завтра начинается русская революция.
104|18.06.2019 22:32:17|Alexey Vishnyakov|Вот это странно  казалось бы, логичнее было бы наоборот. Кто же в банк понесёт деньги, если на доход от депозита налог А финансовый рынок там, я смотрю, развит не очень
105|18.06.2019 22:32:45|Harry Lime|Риск благородное и доходное дело
106|18.06.2019 22:35:00|Olly Milly|Простой вопрос для тех, кто еще не спит  при расчете доходностей год берется 360 дней или 365
107|18.06.2019 22:37:08|Максим Кочнев|год  это 365. если чтото смущает  давайте детали
108|18.06.2019 22:37:56|Dmitry Manzor|Я считал на калькуляторе. 365
109|18.06.2019 22:38:30|Olly Milly|спасибо. чтото засомневался. доходности в моем расчете не совпали с чужим. ищу, где расхождения.
110|18.06.2019 22:45:04|Dmitry Manzor|Показатели доходности довольно абстрактная вещь. При разных количествах будет разная, т.к. если я буду докупать на купон облиги у меня комиссия все съест. Надо брать калькулятор в руки и считать, сколько можно получить
111|18.06.2019 22:50:46|Soa|Азбука вкуса проведет сбор заявок инвесторов на облигации объемом 5 млрд руб. в третьей декаде июня
113|18.06.2019 22:59:01|DIM|Как и все в нашей стране, что хорошо идёт, сразу государство разрушает или прибегает к рукам своим точнее к рукам чинушей
114|18.06.2019 22:59:44|Soa|налоги надо платить
115|18.06.2019 23:06:17|Denis Kozlov Septem|Банковские депозиты застрахованы на 100 без ограничений. Какой фондовый рынок
116|18.06.2019 23:23:54|Сергей Ковалев|так там инфляция 100500, зачем вообще нести туда деньги только если в валюте
117|18.06.2019 23:26:03|Владимир Тутынин|На процент выше нашей
118|18.06.2019 23:39:03|Viacheslav Petriaev|Так там все в валюте и хранят
120|19.06.2019 00:27:45|DIM|Так может заплачено, повод придуман и все
121|19.06.2019 00:30:03|Soa|ну значит разберутся, не дети
122|19.06.2019 00:52:17|Ilya|Аккуратней, может после Рестракта облигаций и не быть, а только обязательства. Если голосование пройдёт ЗА. И без оферты от Ютейр.
123|19.06.2019 05:32:02|Владимир Тутынин|Это как
124|19.06.2019 05:37:29|Harry Lime|В такое конечно верится с трудом. Но учитывая срок займа до 54 года. Ну например это будет не биржевая облигация ,а долговая расписка Финавиа до 54 года лично держателю на дату.
125|19.06.2019 05:58:19|Владимир Тутынин|А такой долг невозможно продать
126|19.06.2019 06:24:58|Шура SiberianRanger|И это указано в эмиссионных документах. Обычно там Actual/365
127|19.06.2019 06:36:17|Nikolay Pavlov|Я тоже пока вижу, что облигаций не будет. Надо ждать документы к осво. Такого ещё не было, чтобы на осво приняли решение и больше никогда не встречались
129|19.06.2019 08:25:26|К& Б:))🍷|Какие видите перспективы оспорить результаты ОСВО при таком раскладе вместо облигаций  долговое обязательство
130|19.06.2019 08:33:12|Harry Lime|Великая война на горизонте
131|19.06.2019 08:34:57|Ilya|Был уже Кит финанс  бумаги просто погашены, а вы эмитенту отправили реквизиты для платежей. Сори это не ответ на вопрос. А перспективы оспорить осво есть только при наличии голосов ЗА от аффилированных лиц. Вряд ли они попадутся на такое. Хотя....ОСВО редкостное г....но
132|19.06.2019 08:37:03|Nikolay Pavlov|Надо будет читать бумаги к осво, тогда можно будет более уверено говорить
133|19.06.2019 08:46:22|Даниил Иванов|Подскажите пожалуйста Вы будете рассматривать БКС Ротатор в BCS Exess
135|19.06.2019 08:47:08|Harry Lime|Что это такое Впервые слышу 
136|19.06.2019 08:47:09|Vladimir|МигКредиту посей день не сняли блокировки счетов.
137|19.06.2019 08:47:48|Harry Lime|Нет облиг , нет разблокировки походу
139|19.06.2019 08:49:01|Vladimir|Знал бы что такая шляпа с ними будет больше Грузовика заказал бы на сегодня
140|19.06.2019 08:49:21|Шура SiberianRanger|Вот эта штука, судя по всему https//zen.yandex.ru/media/id/5bb480ad7ff96e00aa386e46/chtotakoefaktorrotator5cf7df6b22f0d900afbfac9b
142|19.06.2019 08:50:42|Harry Lime|Одно название наводит на грустные мысли , ротаторанализатор было бы круче
143|19.06.2019 08:51:09|Шура SiberianRanger|
147|19.06.2019 08:51:50|Harry Lime|Спрошу у создателей сегодня
148|19.06.2019 08:51:51|Alexey Vishnyakov|А я решил не участвовать в первичке мига  выпуск большой  будет то же, что и с ОМ  уже месяц льют по номиналу.
149|19.06.2019 08:52:33|Шура SiberianRanger|А как же слить в первый день по 101, если как в ОМ 
150|19.06.2019 08:52:43|Alex Petroff|Из ОМ возможно слоники выходили под Грузовика. Но это не точно.
151|19.06.2019 08:54:10|Alexey Vishnyakov|Ну это может было сделать только в первый день. Потом цена была ниже.
152|19.06.2019 08:54:31|Шура SiberianRanger|Early bird catches the worm 
153|19.06.2019 08:55:30|Даниил Иванов|Спасибо
154|19.06.2019 08:55:49|Ilya|Ну вот, началось
155|19.06.2019 08:55:49|Harry Lime|Но тема беседы FTD ноты
156|19.06.2019 08:56:27|Alexey Vishnyakov|Там слоников на 240 миллионов. Посмотрим, что будет с мигом  я думаю, смогу взять по 100. Если нет, придётся взять что то другое. В любом случае денег нет на него  продавать прям сразу такси, кисти или грузовик не хочу
157|19.06.2019 08:57:10|Harry Lime|Ну на процентик то можно
158|19.06.2019 08:58:08|Alexey Vishnyakov|Слишком много всего размещается  у меня итак обороты за последние 2 месяца дикие.
159|19.06.2019 08:58:26|Konstantin|Возможно кандидат в ряды ВДО
160|19.06.2019 08:58:27|Konstantin|Совет директоров Главстроя утвердил программу выпуска облигаций в 3 млрд руб. В рамках данной программы девелопер сможет размещать облигации со сроком обращения 5 лет. Сама же программа по размещению облигаций в рамках приведённой выше суммы является бессрочной. novostroyman
161|19.06.2019 08:58:53|Harry Lime|Июнь какойто вообще атомный , почти как за весь предыдущий год
162|19.06.2019 08:59:22|Даниил Иванов|Нот мне пока хватит 
165|19.06.2019 09:02:38|Harry Lime|Я не слежу , подпишитесь в дискложеботе на него
167|19.06.2019 09:06:04|Pavel|О, знаю эту тему
168|19.06.2019 09:06:08|Даниил Иванов|8 процентов за 10 лет
170|19.06.2019 09:06:23|Pavel|Сбербанк выпустил ИСЖ на основе этого индекса
173|19.06.2019 09:07:17|Шура SiberianRanger|Отлично, ИСЖ завёрнутое в ДУ, Сбербанк и БКС получают комиссы, клиент получает ротатор D
