|time|user|text
636|12.01.2019 19:40:00|Дмитрий Адамидов|Ну презентация  это просто как опыт. Эксперименты. Я хочу еще сделать руководство по психологии трейдинга инвестора ВДО. Видео же мне надо будет делать в поддержку размещений, но там все более традиционно  интервью, ссылки и т.д. Может быть даже эмитенты сами будут записывать
639|12.01.2019 19:40:58|Дмитрий Адамидов|вот как погоны сделаем, будем звания присваивать
640|12.01.2019 19:42:44|Harry Lime|А вообще отличное видео , грустно правда совсем стало в конце. Инвесторы тех ВДО , высокодефолтных, живут надеждой , нельзя ее так просто отнимать.
641|12.01.2019 19:43:40|Дмитрий Адамидов|ну как сказать  Аленка капитал все же засадила еще народ недавно. Когда первый выпуск до 30 вырос
644|12.01.2019 19:46:03|Harry Lime|Я если честно не уверен в дефолте 30 числа. Дефолт триггернет оферту ЮТЭйра. Но если карточный домик рассыпался уже ничего не поможет . Надо будет проголосовать в канале за недельку до.
646|12.01.2019 19:49:35|Дмитрий Адамидов|дефолт нет либо рестракт, либо денег на купон найдут. Но там сиутация как в Мечеле в свое время деньги на купон могут взяться только от банков за счет увеличения долга по кредитам
648|12.01.2019 19:50:58|Harry Lime|Это факт. Но этот купон  лотерея. И это реально интересно. Насколько у них нет денег.
651|12.01.2019 19:51:25|Дмитрий Адамидов|денег по слухам нет совсем. дебиторка выросла, техобслуживание еле платят.
654|12.01.2019 19:52:44|Harry Lime|Или как в Мечеле  в день оферты
655|12.01.2019 19:52:58|Дмитрий Адамидов|Дада. и ЦБ сказал что это не дефолт а все нормально.
659|12.01.2019 20:05:27|Сергей|Чудеса от вашего брокера зависят. У меня всё на ИИС возвращается
660|12.01.2019 20:05:57|Zuev Aleksandr|У меня мясничий ниже номинала, не хочу перезаходить в ОАЭ, в общем и целом это один эмитент ГГ
662|12.01.2019 20:08:08|Harry Lime|Тело нельзя , если налоговая узнает ИИСу капут.
663|12.01.2019 20:09:40|Дмитрий Адамидов|по моему это только у ВТБ было както. по слухам. у меня сбер до 2017 года и купоны не отдавал на карту
664|12.01.2019 20:10:02|Harry Lime|У ГПб было
665|12.01.2019 20:10:13|Oleg Egorov|Куски тела возвращаются на ИИС
666|12.01.2019 20:10:21|Дмитрий Адамидов|а ну или у ГПБ
667|12.01.2019 20:12:13|Oleg Egorov|Это Кортес чтоли 
668|12.01.2019 20:12:32|Harry Lime|Я пока исследую и публично обсуждаю поциэнта тьфу эмитента, не нахожусь в бумаге. Это очевидный конфликт интересов. Неэтично.
669|12.01.2019 20:12:42|Замполит Aleks Kib|Любимая музыка камидзе органично вписывается в описание надвигающегося краха лётной миниимперии, далее, следуя ироничному совету Сэра Гарри, должно быть церимониальное публичное отсечение мизинца на СВО харакири слишком жестоко сразу.
670|12.01.2019 20:13:06|Дмитрий Адамидов|Это инвестор в ВДО ну во всяком случае художник так понял после моих объяснений
672|12.01.2019 20:14:00|Oleg Egorov|Да, мы тоже ищем, где живет Эль Дорадо...
673|12.01.2019 20:14:00|Harry Lime|Не довелось , как раз первый Ломастер тогда вышел, не до Мясничего было.
674|12.01.2019 20:15:19|Dimasik|Зашёл почти на размещении во второй выпуск, до лета точно буду там. Процент от портфеля ВДО около 23
676|12.01.2019 20:17:28|Ildar|Здравствуйте Через just2trade можно бонды купить
678|12.01.2019 20:22:52|Zuev Aleksandr|Лучше самому разобраться
680|12.01.2019 20:32:40|Дмитрий Адамидов|Рублю придали ускорение а руки все равно заняты
681|12.01.2019 20:37:27|Антон|Коллеги, а вы не в курсе, можно ли на нашем рынке инвестировать и торговать от лица ИП на упрощенке
682|12.01.2019 20:40:22|Дмитрий Адамидов|неа. не откроют счет. узнавал
684|12.01.2019 20:42:01|Dimasik|Мсб давно и не на одном счёте есть..
685|12.01.2019 21:09:00|Антон|Пасиб
686|12.01.2019 21:18:06|Deleted Account|Купи через квик по 100 Как сделать это и все данные выше естьпо 2 бумагам
687|12.01.2019 21:20:44|А что ты сделал для котэ!?|А что в портфель включать Депозиты тоже Или только что на брокерском счете
688|12.01.2019 21:31:23|Михаил Воронин|Необычный жанр  про камикадзе  в тему 
689|12.01.2019 21:35:26|Герман|Тут уточнение, доля от доходов портфеля или от доходов вообще
690|12.01.2019 21:38:47|Виталий Яковлев|А если портфель 4 месяца 
691|12.01.2019 21:39:10|Deleted Account|Да
694|12.01.2019 21:43:25|Сергей|Комиссии не будет
695|12.01.2019 22:37:47|Deleted Account|Я в открытие
696|12.01.2019 22:44:47|Герман|Что то я посмотрел на наши опросы и по прикидкам получается что у участников чата под ярд ВДО
698|12.01.2019 22:47:34|Александр|На банковский или иной счёт только купон или дивиденды. Все остальное на счёт иис, иначе нарушение, налоговая накуканит брокера
699|12.01.2019 22:50:03|А что ты сделал для котэ!?|В опросе сколько вдо в портфеле кроме графы 015, надо было поставить графу 0 еще 
700|12.01.2019 22:58:28|Sergey Sidorov|Отличный опрос Спасибо Давно маялся мыслью где мое место в декартовой системе координат.
701|12.01.2019 23:02:04|Leo|Я зашёл. А в чем вопрос В таблице 47 облигаций, эмитентов поменьше, но все же. Почему вас именно Эмираты интересуют
702|12.01.2019 23:02:41|Sergey Sidorov|Похвала однозначно Это проблема всех соцсетей  в них нет интонации.
704|12.01.2019 23:06:17|Leo|А оттого что они сейчас размещаются что меняется
706|12.01.2019 23:14:59|Harry Lime|Из опроса я убедился ,что МСБ очевидно популярней ОАЭ при одинаковом купоне. Думаю первичка этому не в малой степени способствует.
707|12.01.2019 23:17:17|Александр|Народ в своей массе скорей просто ориентируется на популярность эмитента, оборот и конечно же купон
709|12.01.2019 23:23:38|Harry Lime|Имхо разобравшись в ОАЭ инвесторам предлагается гринфилд за 400 млн руб с полным финансированием за облигационный счёт . При работающем проекте, построенном за бешеные деньги, но с не очень растущей выручкой.
711|12.01.2019 23:27:47|Дмитрий Адамидов|Пекрасное с МФД Собрались как то вместе  Бармалей, Почтальон Печкин, Джек Воробей, Стойкий оловянный солдатик, Буратино и другие сказочные герои .... и купили сказочное гавно ...
713|12.01.2019 23:33:46|Harry Lime|Гораздо хуже , когда очевидно все имущество заложено , и облигационерам достанется дырка от бублика в случае чего. Я пример СТТ имею в виду конечно же.
718|12.01.2019 23:49:42|Evgeny|Но там же не на весь див целиком 30
719|12.01.2019 23:49:49|А что ты сделал для котэ!?|В смысле
720|12.01.2019 23:50:25|Harry Lime|На дистрибуцию REIT налог 30 процентов.
721|12.01.2019 23:52:04|А что ты сделал для котэ!?|У американцев И плюс ещеьнаши 13
722|12.01.2019 23:53:45|Harry Lime|Да у американцев , на остальные дивы 10 , квалифицированный дивиденд , по префам вообще не облагается.
723|12.01.2019 23:54:11|А что ты сделал для котэ!?|А где Вы эту инфу нашли, поделитесь пожалуйста
724|12.01.2019 23:54:26|Harry Lime|Нашего не будет , у нас избежание двойного налогообложения.
729|13.01.2019 00:01:50|Карим|Будете популяризировать  цены вырастут, доходность упадёт
730|13.01.2019 00:04:57|Ildar|За декабрь у меня 15 только отчет посмотрел
732|13.01.2019 00:09:20|Harry Lime|Это ETF возможно там немного другое налогообложение , это в IB
733|13.01.2019 00:09:31|Ildar|Как то тоже читал про квалифицированные дивиденды и так понял что это наоборот льготные для американцев
737|13.01.2019 00:12:53|Harry Lime|А , тогда примерно понятно , напрямую дистрибуция REIT будет облагаться по 30 , а завернутое в ETF  это уже qualified по ставке 15.
739|13.01.2019 00:14:28|Ildar|15 берут у меня как гражданина Казахстана, у вас 10
740|13.01.2019 00:15:37|Harry Lime|Ну значит просто на ETF обычный налог , а напрямую если брать REIT нерезиденту будет 30.
744|13.01.2019 00:34:33|Ольга|Не переживайте, мы не пугливые
745|13.01.2019 01:08:27|Ilya|СНГ введёт в ближайшее время финансовое внешнее управление неофициально или фсе. Четвёртый квартал хуже чем 3ий и там явно дыра. Своих ресурсов вряд ли есть. Это имхо.
747|13.01.2019 01:19:45|Максим|Не верю, что доллар можно будет взять по 60. В прошлом году 100 млрд  из двухсот скушали. В этом году есть реальный шанс уйти в ноль. А дальше стагфляция как в Венесуэлле.
748|13.01.2019 01:28:21|А что ты сделал для котэ!?|100 из 200  это вы о чем
749|13.01.2019 02:15:11|Leo|А я ещё думаю что через месяц шуму про этих эмитентов будет поменьше. Они разместятся и начнётся шум про других. Поэтому интересно как раз сейчас посмотреть на предыдущих, как там у них дела, вероятность дефолта, кто советовал купить и т. д.
755|13.01.2019 06:55:14|Александр Меркушев|А почему на год Решение о выпуске это предусматривает
759|13.01.2019 08:34:25|Harry Lime|Обычно это делается на год в таких случаях , при желании разобраться можно и нужно это сделать. У Левенгука и программа имеется. Как ближайший пример приведу Манимен. На год был купон 16,5. Установили на год 14. Потом ещё один ресет
761|13.01.2019 09:06:05|Alex|Я вот сижу в ОХ5, и тоже не знаю чего ожидать.
766|13.01.2019 11:01:07|Sergey|bondyboss Павел, есть движение с первым бондибоксом Получится через других брокеров приобрести
767|13.01.2019 11:13:07|Zuev Aleksandr|Сегодня карточный ликбез
768|13.01.2019 11:20:38|J T|А какие ВДО атон размещал
769|13.01.2019 11:28:54|Zuev Aleksandr|Все инструменты
770|13.01.2019 11:29:13|J T|Эмитентов, я имею ввиду, каких
771|13.01.2019 11:29:49|Zuev Aleksandr|Компания ВсеИнструменты
772|13.01.2019 11:30:00|J T|Лол да ладно
773|13.01.2019 11:30:09|Zuev Aleksandr|
775|13.01.2019 11:50:53|Denis Kozlov Septem|Всеинстр 700 и Инфовотч 400
776|13.01.2019 12:01:30|Zuev Aleksandr|Спасибо
780|13.01.2019 12:30:23|Pavel Bilenko|движение есть готовим и брокеров и эмитентов  К концу месяца надеюсь управимся
784|13.01.2019 13:05:47|Дмитрий Адамидов|ладно я снесу беседу, все надеюсь поняли что я хотел сказать. общайтесь на здоровье, но не флудите. любые инициативы готов поддержать в меру своих скромных сил.
785|13.01.2019 13:10:54|Harry Lime|Мне стихийные опросы понравились , я что хотел увидел , то что их удалили не проблема , информация уже получена. Многие приятные и интересные вещи происходят спонтанно. Тем и хороши.
787|13.01.2019 13:28:59|Aleksandr|Я был поражен тем что 50 участников главным критерием при покупке считают размер купона.Выходит под 25 можно любую ерунду разместить.
788|13.01.2019 13:29:33|Дмитрий Адамидов|А под 1600 тем более. вспоминая 90е годы
791|13.01.2019 13:30:46|Alexey Vishnyakov|В кешбери было очень много людей  времена ммм ещё не прошли
792|13.01.2019 13:32:47|Aleksandr|Так же я был приятно удивлен что участники чата имеют совокупный портфель не менее 500 млн
794|13.01.2019 13:34:41|Alex Petroff|Ответивших маловато...реальная цифирь может быть повыше будет.
795|13.01.2019 13:34:54|Aleksandr|Чат по идее может сьедать целиком небольшие обьемы выпусков
797|13.01.2019 13:35:39|Svyatoslav Lebedev|Касательно размера купона  мы же про ВДО говорим. Если купон 12, а доходность  10, то покупать бумагу имеет смысл, на мой взгляд, либо апологетам диверсификации, либо верящим/знающим, что бумага ещё вырастет. Иначе зачем
798|13.01.2019 13:36:05|Alex Petroff|Я поэтому и прошу голосовалку широкую сделать. И повесить ее для всеобщего обозрения или оборзения, кому как больше нравится
799|13.01.2019 13:37:10|Дмитрий Адамидов|не проблема  сделайте вопросы. в канал повешу. просто голосовать надо долго, чтоб был хороший охват. и вопросы продумать, чтобы не было как в анекдоте про длинну половойго члена, который вчера уже упоминали.
801|13.01.2019 13:38:00|Aleksandr|Наличие в чате людей с крупными портфелями и закрепленными за ними ПФМ и консультантами , говорит о полезности информации проскакивающей в чате.
802|13.01.2019 13:38:03|Svyatoslav Lebedev|С другой стороны, если конкретно в этот понедельник Ломбард объявит об эмиссии БО с купоном 30, я сильно напрягусь и начну пытать Дениса на предмет, зачем они так.
803|13.01.2019 13:38:30|Дмитрий Адамидов|но никак не говорит о том, насколько плотно они ее используют
804|13.01.2019 13:40:10|Aleksandr|я цифры пишу из того что успел увидеть.Был бы рад увидеть больше.Тогда б и организаторы со всей серьезностью бы поняли с кем имеют дело.
805|13.01.2019 13:41:27|Дмитрий Адамидов|Да они все видят на размещении  за них не переживайте. если бы им было не надо, тут бы столько организаторов не сидело
807|13.01.2019 13:42:21|Aleksandr|я за себя переживаю.Не нравятся их некоторые ответы формальные.
808|13.01.2019 13:43:08|Дмитрий Адамидов|ну а вы других не поулчите  у них есть корпоратвиные правила. Вообще то что они стали общаться вживую уже большое достижение. что потребовало две колелктивных пьянки и пару удачных размещений.
813|13.01.2019 13:46:29|Aleksandr|И потом надо бывает разное. Чем больше они видят для себя выгоды от аудитории , тем больше их надо.
814|13.01.2019 13:47:03|Дмитрий Адамидов|ну это нормально. все себя так ведут по большому счету. Но то, что Септем, Пионер, АПРИ и ССТБ ну то есть Андрей Хохрин активно и в целом нормально общаются  это их заслуга личная. Еще три года назад такое себе представить было сложно. А уж как феерил пиарщик Мясничего на МФД  это отдельная история
815|13.01.2019 13:47:18|Александр|Нам нужно срочно организовать выпуск своих облигаций
818|13.01.2019 14:03:54|Aleksandr|а если Директлизинг снова прийдет на рынок занимать
819|13.01.2019 14:05:33|Svyatoslav Lebedev|Лизинг  лодка уже проплывает мимо. Запрыгивать в лизинги не очень уже и хочется.
822|13.01.2019 14:30:06|🚲|Поясните, пожалуйста, по какой формуле 2.8 по трежерям соответствуют справедливым 4.7 для рус 28.
823|13.01.2019 14:34:51|Aleksandr|рубль же не на 15 каждый год падает.
824|13.01.2019 14:34:53|Harry Lime|Безусловно, сам такой , до первого купона
825|13.01.2019 14:35:34|Svyatoslav Lebedev|Это да. Но я имею в виду, что есть же ещё куча прочих классов различных активов акции, коммодитиз, суверенный долг, депозиты, в конце концов
826|13.01.2019 14:35:59|Harry Lime|Рано , мало оферт и погашений , там начнется шоу
828|13.01.2019 14:38:45|Дмитрий Адамидов|тем более. есть смысл тратить время в чате
829|13.01.2019 14:40:09|Harry Lime|Я думаю он уже наелся
831|13.01.2019 14:43:08|Svyatoslav Lebedev|Я не считаю, что облигации, в частности, ВДО, являются идеальным инструментом. Сейчас они хороши. Когда рухнут акции, буду выходить из облиг и покупать первых.
832|13.01.2019 14:43:10|🚲|А за какой период Нужно брать статистику за 101520 лет
833|13.01.2019 14:44:38|Svyatoslav Lebedev|Да и упадёт ли то же золото, когда полетит вниз рынок акций
834|13.01.2019 14:48:13|🚲|Говорят, что теперь у него ограничен потенциал роста и не ограничен потенциал падения.
836|13.01.2019 14:56:03|Svyatoslav Lebedev|Облигации и в значительно меньшей степени ВДО  тот же кэш. Рынок упал  покупаешь акции. Я вне всяких сомнений несколько утрирую, но, на мой взгляд, это достаточно разумный подход что лучше, Газпром по 100 или ВДО с доходностью 15  тут у каждого свой подход и свой комфорт.
839|13.01.2019 15:10:17|Denis Kozlov Septem|У ВДО ликвидность лучше, чем у первого эшелона. Посмотрите статистику  сколько  от выпуска торгуется в ВДО и в первом эшелоне.
841|13.01.2019 15:14:04|Harry Lime|Аналогично и не в РФ.
842|13.01.2019 15:19:46|Denis Kozlov Septem|За два года сложностей пока не видел. Конечно, два года  не срок, но всё же это хоть какаято статистика. И да, бонды  это ни разу не кэш. Даже офз
843|13.01.2019 15:21:45|Harry Lime|Я насчитал , что спред с суверенной кривой на тот момент был примерно 180 бп. Но так как есть сильная погрешность и доха трежерей была чуть больше 2,85 я тоже накинул ннмного 1,85 и получил 4,7. Потом через калькулятор доходности на русбондс прикинул примерную цену рус 28.
844|13.01.2019 15:23:09|Svyatoslav Lebedev|Разумеется. Мы не исключение.
846|13.01.2019 16:06:33|А что ты сделал для котэ!?|Считать лень Чо там получилось  что выгоднее
847|13.01.2019 16:42:37|Andrey Caesar|Золото было 231 за грамм, сейчас 2780
849|13.01.2019 16:50:52|Михаил Воронин|Камрады, в чате встречались упоминания, но четкого мнения у меня на сложилось ... Величина  купона чемто кемто облигационеру гарантируется или эмитент может его произвольно понизить
852|13.01.2019 17:31:12|Ilya|Может понизить, но после того, как закончатся все купонные периоды, по которым ставка объявлена. Либо, через проведение ОСВО.
