|time|user|text
797|22.01.2019 12:13:57|Сергей Нужнов|Скорее всего на размещение ставите. Ключевое слово режим РПСоблигации
798|22.01.2019 12:14:03|Denis Kozlov Septem|Какой у Вас брокер
800|22.01.2019 12:14:39|Aleksandr|а потому что спекулянты все забрали
801|22.01.2019 12:15:07|Sergey Komarov|хорошо, ждемс
802|22.01.2019 12:15:21|Harry Lime|Вы знаете с чего начинается вопрос в БКС при выставлении заявки в РПС вторичка  Вам продать или купить Учитесь , господа брокеры.
803|22.01.2019 12:15:23|ve365|Если ктото дозвонится  пройдет квест со Сбером, маякните, ладно
804|22.01.2019 12:16:04|Вячеслав Васильев|Альфа, пока поставить по скрипту не удалось, тот режим торгов о котором говорит Денис, только для корпоративных действий, оферта и т.д.
805|22.01.2019 12:19:25|Александр|Бкс заявку принял, по я поздновато брякнул, а раньше времени не было. Ещё будет залив
806|22.01.2019 12:20:09|Сергей|Раз так много заявок не проходят, в стакан ещё будут наливать
807|22.01.2019 12:21:17|Aleksandr|Даеш Ломастер для населения 
808|22.01.2019 12:22:25|Olga|Открытие в стакане без книги за 2000, все ок
809|22.01.2019 12:22:56|Margo|Тоже не прошла заявка в Открытии. Рпсоблигации у них нет, только адресные заявки. По коду пасчетов ошибка
810|22.01.2019 12:24:52|Denis Kozlov Septem|Коллеги, Финам, Открытие и БКС уже выставили заявки на вторичке  мы часть уже закрыли
811|22.01.2019 12:25:30|Aleksandr|нам грустно
812|22.01.2019 12:26:34|Сергей Нужнов|Получил, спасибо
813|22.01.2019 12:28:21|Denis Kozlov Septem|Альфа ушла в отказ
815|22.01.2019 12:28:36|Sergey Sidorov|А я в ОLB Втэбэшном до сих пор стакана не вижу по ЛМ3 
816|22.01.2019 12:28:47|Aleksandr|завтра только будет
817|22.01.2019 12:29:16|Denis Kozlov Septem|Альфа отказывается
818|22.01.2019 12:29:24|Вячеслав Васильев|Пздк, поставил в стакан заявку
819|22.01.2019 12:29:48|Alex Petroff|Стакан в наличии. Нет пока еще согласования с начальником брокера.
820|22.01.2019 12:29:56|Denis|Выставил заявку через БКС
822|22.01.2019 12:31:00|Вячеслав Васильев|В мобильных приложениях позже появляется по опыту
823|22.01.2019 12:31:29|Sergey Sidorov|Ну, да, конек брокериджа втб  это офзн, судя по моему субботнему визиту к ним.
824|22.01.2019 12:32:02|Вячеслав Васильев|Ольга, в Открытии режим облигации РПС вторичка  2000 рублей
825|22.01.2019 12:32:21|Aleksandr|Не, они всегда так , новые выпуски к себе добавляют на следующий день только
826|22.01.2019 12:34:01|Максим Кочнев|Он есть. Я там уже взял
828|22.01.2019 12:35:07|Margo|Оказывается все зависит от специалиста, только что выставили заявку.
829|22.01.2019 12:35:29|V F|Какой же у вас тут фарш из режимов торгов
831|22.01.2019 12:35:36|Aleksandr|нету его в котировках и очередях, вы его видите в портфеле только
832|22.01.2019 12:35:57|Максим Кочнев|Смотрите скрин выше
834|22.01.2019 12:36:21|Вячеслав Васильев|не у нас, у брокеров нам все равно какой режим, нам бумаги надо
835|22.01.2019 12:36:58|V F|У нас то как раз все понятно
836|22.01.2019 12:37:06|Максим Кочнев|Втб олб фондовый рыноккотировки тоблигации ставим все 3 галочкиприменить
838|22.01.2019 12:37:53|Aleksandr|я через квик
839|22.01.2019 12:38:10|Olga|первичка через книгу 2000
840|22.01.2019 12:38:15|Максим Кочнев|Я через олб
841|22.01.2019 12:39:24|Why Aye Man|Альфа не даёт, да. Печально...
842|22.01.2019 12:40:00|AngelicScale|Про разные олб говорим  Александр и я подразумевали тот который по адресу https//lk.olb.ru . А Вы, Максим, про втбшный аналог квика.
843|22.01.2019 12:40:23|Why Aye Man|И даже в стакан Альфа не даёт заявку поставить. Говорят, какаято проблема с инструментом, разбираются
844|22.01.2019 12:40:32|Aleksandr|именно
845|22.01.2019 12:40:45|Александр Нечаев|А мне в открытии сначала сказали, что не видят такой бумаги в портфеле 
846|22.01.2019 12:41:11|Olga|в открытии любят такое
847|22.01.2019 12:41:19|Вячеслав Васильев|поставил завку без проблем
848|22.01.2019 12:41:37|Olga|каждое размещение порождает какой то танец с бубнами..
849|22.01.2019 12:42:11|First Last|не готовы брокеры к толпе частников со 100 рублями на первичке
850|22.01.2019 12:42:49|Sergey Komarov|с голоса или через терминал
851|22.01.2019 12:43:14|Вячеслав Васильев|Через квик в стакан
852|22.01.2019 12:43:41|Harry Lime|Нету книги уже у Ломастера , кончилась книга , глава стоила 4 млн
853|22.01.2019 12:43:55|Olga|брокер работает за комиссию, берешь клиента со 100 рублями, так работай качественно, не
854|22.01.2019 12:44:00|Сергей Ковалев|мы их ночной кошмар
855|22.01.2019 12:44:18|Dimasik|Всем спасибо, всё купил
856|22.01.2019 12:44:34|Sergey Sidorov|Я его в олб тоже не вижу, в моб приложении втбинвестиции вижу по 100.75.
857|22.01.2019 12:44:39|Olga|я не именно про этот выпуск, а в общем и целом про ломовую цену за книгу
858|22.01.2019 12:45:48|Вячеслав Васильев|Вряд ли, ну сколько было клиентов на вторичку через РПС на каждого брокера, в среднем, не думаю, что больше 10. Поэтому просто сказали  нет и все, кошмариться не пришлось.
859|22.01.2019 12:46:07|Svyatoslav Lebedev|У меня Открытие только что зарегистрировал заявку без проблем.
860|22.01.2019 12:47:43|Вячеслав Васильев|Денис писал, с Открытием проблем нет, есть проблема с Альфой и ВТБ
861|22.01.2019 12:51:03|ve365|Все, что не автоматизировано и требует участия живых людей  треш. В Сбере по МСБ через квик хоть по 1 шт участвуй в первичном размещении. А на биржевой трейддеск дозвониться нереально вообще с любыми объемами внебиржевой снимают за 2 минуты, но РПС не принимают 
862|22.01.2019 12:55:01|Максим Кочнев|Продал 8 бумаг комуто по 101
864|22.01.2019 12:57:29|Igor Sugrobov|Выставил заявку через БКС, пока не удовлетворили. Как долго может длиться процесс Подскажите
865|22.01.2019 12:57:39|First Last|комса брокера прибыль не съест
866|22.01.2019 12:58:20|Harry Lime|Вернулся в офис , все на счете
867|22.01.2019 12:58:43|Максим Кочнев|Не, она 0.037. Итого за два раза 0.075. А навра 0.65. Рублей так на 30
869|22.01.2019 12:59:38|Вячеслав Васильев|до 1630 было указано в письме
870|22.01.2019 12:59:45|Harry Lime|Я уже давно отучился так делать , ну если заявка не по 103 конечно
871|22.01.2019 13:00:14|Savel|А мы, клиенты финама, так не можем у нас минимальная комса  41
872|22.01.2019 13:00:41|Максим Кочнев|Это да. 8 бумаг в заявке ну я как писал выше взял 130 от необходимого, поэтому 30 все равно буду сливать потихой
873|22.01.2019 13:00:57|Igor Sugrobov|Спасибо, подождём
874|22.01.2019 13:01:11|Евгений Коломна|В ПСБ заявку в режиме РПС облигации сейчас приняли без проблем, впрочем, как и ранее с грузовиками, роделенами и прочим...
875|22.01.2019 13:01:18|Savel|Да и адресные явки и первичке дорогие 0.236 к цене, кажется поэтому роделен было выгоднее из стакана брать
876|22.01.2019 13:01:45|Harry Lime|По этому я и не с Открытием , у меня давно на второй десяток пошли размещения.
877|22.01.2019 13:01:55|Максим Кочнев|Учитывая ломмастер 2 стабильно по 102. Ломбард 3 может и на 103 уйти через месяц другой
878|22.01.2019 13:02:06|Harry Lime|Охотно верю
879|22.01.2019 13:02:34|Максим Кочнев|Поэтому 30 ждут свой звёздный час
880|22.01.2019 13:04:02|Savel|Он не по 102,фактически его лишь ХОТЯТ продать по 102,а вот покупают его дешевле
881|22.01.2019 13:04:18|Максим Кочнев|А ломбард вырвал у кармани 1 место в портфеле. А так как сегодня и вчера продавал 1 кармани по 100.5 то его обошёл и роял. Так что вот она настойчивость Дениса в отстаивании своих клиентов. Ломбард и роял  первое и второе место в портфеле
883|22.01.2019 13:06:29|Savel|Подождём  чем дальше, тем больше люблю вдо. Ну да это до первого дефолта
884|22.01.2019 13:06:39|Максим Кочнев|Сегодня ломмастер 2 у меня купили по 101.8. Правда 5 штук но это при том что можно купить ломастер 3 дешевле так на 1.5 процента
885|22.01.2019 13:07:26|Harry Lime|В рублёвой части всётаки пока Ломбард и Кармани лидируют.
886|22.01.2019 13:08:18|Максим Кочнев|По сути что роял что кармани что мсб делят 2 место. Разница у них достаточная маленькая измеряется в десятках бумаг.
888|22.01.2019 13:10:38|Harry Lime|Аналогично , но без МСБ
889|22.01.2019 13:12:09|Savel|Вот вы пишете на процент дороже продали, на два. А моей самой большой рыночной удачей считаю избавление от пика и окея. Смог продать их чуть дороже, чем брал, несмотря на неблагоприятных рынок. Правда, с Силмашем ничто не сравнится. Даже жаль, что взял его так мало в сентябре
890|22.01.2019 13:13:18|Максим Кочнев|Ничто не сравнится с мосбирже в конце декабря. Я все жалею что на 7 всего зашёл. Но нет не жалею, кто мог тогда знать всех денег не заработаешь
892|22.01.2019 13:16:39|Lizardking0808|Не наливают больше
893|22.01.2019 13:17:27|Максим Кочнев|Есть возможность купить со стакана по 102
894|22.01.2019 13:18:10|Вячеслав Васильев|Бессмыслено жалеть о больше или меньше, вы тогда брали в рамках какойто позиции или страха, а если нет и на авось, то рано или поздно это слив и писали бы блин зачем я взял так много, надо было в рамках портфеля долю выделять...
895|22.01.2019 13:27:58|Максим Кочнев|Сегодня я полностью вышел из легенды и ред софта. Они и так были на около ноле. А теперь можно сказать им досвиданья
896|22.01.2019 13:30:09|Denis|У когонибудь по рпс на БКС пришли бумаги
897|22.01.2019 13:31:50|Максим Кочнев|У Гарри
898|22.01.2019 13:32:30|Александр|Пока нет, но я час назад звонил
899|22.01.2019 13:32:36|Максим Кочнев|Денис же написал что одну за другой заявки удовлетворяют. Время ещё есть. Они не всем разом. Если вашу приняли значит придет
900|22.01.2019 13:40:03|Alex|Господа, какие бывают риски кредиторов при попадании банка под фкбс, кроме списания младшего долга Речь о МИНДБ
901|22.01.2019 13:41:21|Harry Lime|Никаких , облиги МИндБ старший долг.
902|22.01.2019 13:42:02|Alex|а напомните как в пересвете оферта по 23 была Пересвет же под ФКБС был
903|22.01.2019 13:42:19|Harry Lime|Там другая история совсем
907|22.01.2019 13:46:12|Igor Sugrobov|Аналогично
908|22.01.2019 13:46:18|Harry Lime|Хоть вторичка , хоть размещение
909|22.01.2019 13:47:11|Максим Кочнев|Денис написал что от бкс все заявки поступили, значит а ваши у них. Теперь только ждать
910|22.01.2019 13:47:42|Harry Lime| ПАССАЖИР АВИАРЕЙСА СУРГУТМОСКВА ВО ВРЕМЯ ПОЛЕТА ПОТРЕБОВАЛ НАПРАВИТЬ ЛАЙНЕР В АФГАНИСТАН  ИСТОЧНИК Ну, там поинтересней, чем в Москве 
911|22.01.2019 13:47:56|Alexander Kozhevnikov|поздравляю всех с размещением ломбарда 
912|22.01.2019 13:47:59|Harry Lime|Надеюсь не облигационер Финавиа
913|22.01.2019 13:48:10|Alexander Kozhevnikov|в этот раз не смог поучаствовать 
914|22.01.2019 13:48:36|Максим Кочнев|Ещё есть шанс. Возможен второй залив в стакан
915|22.01.2019 13:48:37|Aleksandr|С ВТБ я вообще не понял, победил его Денис , не победил.В стакан так и не налили мне.
916|22.01.2019 13:49:09|Harry Lime|Ещё будет волна Ломастера
917|22.01.2019 13:50:00|Alexander Kozhevnikov|коллеги, понимаю что не раз обсуждалось уже... но совсем выбило какой брокер лучше для ИИС с минимальными комиссиями за депозитарное обслуживание и сделки
918|22.01.2019 13:50:14|Максим Кочнев|Я по 100.3 взял. Нормально. 5 сотых процента покроются купоном ровно за 1 день
919|22.01.2019 13:51:43|Aleksandr|Да это норм.Я не стал другую бумагу брать, простоял в стакане Ломастера.Теперь и там котира ушла и тут не налили.А двух стаканах мне сегодня неудобно было, не хотел в минус уйти.
920|22.01.2019 13:52:18|Вячеслав Васильев|единого решения не было, скидывали таблицу, смотрите поиском или общие файлы с чатом
921|22.01.2019 13:52:56|Максим Кочнев|Дак Денис вчера же писал что ставить в стакан, а если втб победят он оповестит. Вы бы не ушли в минус
922|22.01.2019 13:53:35|Alex|Читаю. Санация шла через ВБРР игоря иваныча. АСВ под это давал больше 100 ярдов. Не хватило
923|22.01.2019 13:53:55|Aleksandr|Как не ушел бы  Налилась бы и другая бумага и Ломастер .
924|22.01.2019 13:54:34|Максим Кочнев|А вы про другую бумагу
926|22.01.2019 13:54:47|Aleksandr|Я собственно и встал в стакан , тк не верю в ВТБ
927|22.01.2019 13:55:10|Alexey Vishnyakov|У меня рояль появился в мобильном приложении где то через неделю.
929|22.01.2019 13:56:17|Максим Кочнев|Ну надо в стакане всегда чуть выше ставить. Прошлаюый раз с роялом также опустили до 100.25. Но все кто выше ставил все взяли а кто по 100.25 не все. Т. Е. Даже 100.26 достаточно было. Но я всегда страхуюсь и ставлю по 100.3
930|22.01.2019 13:57:10|Harry Lime|ИИСу и целого мира мало...
932|22.01.2019 13:58:39|Евгений Коломна|Да, помню стакан Ломбарда 1 летом прошлого года, выставилось несколько сотен лотов на покупку скромненько и заливали многократно
933|22.01.2019 13:59:29|Kir|Я псб советую, но только для российских бумаг, минималки нет комса 0.06 за все
934|22.01.2019 14:00:27|Сергей|за 2,40 ломастер уже берут
935|22.01.2019 14:01:09|Максим Кочнев|Через месяц и по 103 будут брать
936|22.01.2019 14:01:24|Alex|Так оно. Еще момент  посмотрел динамику цен на старший долг фкбснутых банков. Кажется, что отыгрывать факт вхождения фкбса начинают задолго до реального опубликования факта
937|22.01.2019 14:02:46|Harry Lime|Этот срок сильно сократился. В Открытии было здорово , кто взял правильное ФК Открытие , а не ОХ. В Бине пару дней , в ПСб один день.
940|22.01.2019 14:04:16|Harry Lime|МИндБ  без движения
941|22.01.2019 14:04:22|Alex|Пара дней адекватно. Посмотрим на примере мина, пока в рамках нормы стоит
942|22.01.2019 14:05:01|Harry Lime|Он вырастет до такой же дохи как и Бин с ПСб , вопрос времени
943|22.01.2019 14:06:43|Евгений Коломна|Купили по такой цене 1 бумагу, это для статистики ктото балуется пока
944|22.01.2019 14:07:54|Alex|Заметьте, что цена до 105 на малых объемах прыгает с ноября. Это у банка, который конвульсирует уже N месяцев.
945|22.01.2019 14:08:50|Вячеслав Васильев|Мне кажется, что в прошлый раз Рояль, через Альфаброкер по РПС размещался у коллег в чате или нет Проблемы были только у ВТБ или нет
946|22.01.2019 14:10:04|Евгений Коломна|О, на ПСБ зачислили Ломбард, низкий поклон, спасибо Попугай сегодня себе премиальный орех заработал
947|22.01.2019 14:11:02|Svyatoslav Lebedev|В Открытии Ломбард зачислили. Йоу
948|22.01.2019 14:11:26|Андрей|По Ломбард 3. Кто в Альфе, можете обломаться, извините за выражение. По ИХ регламенту в режиме РПС облигации не дают физикам. Точка. Жалуетесь куда хотите. Не обсуждается. Точка.
950|22.01.2019 14:12:32|Sergey Sterlikov|Господа,проясните плз, не сильно следил. Почему все так в ломастер ломанулись
951|22.01.2019 14:13:02|Harry Lime|Ломануться в Ломастер. Звучит
952|22.01.2019 14:13:11|Вячеслав Васильев|Спекулировать, цену двух первых посмотрите.
953|22.01.2019 14:13:45|Максим Кочнев|Доха хорошая. Принцип работы понятен. Как погашаются выпуски также понятно
954|22.01.2019 14:13:46|Harry Lime|Я просто стою в нем до погашения 1718 годовых в рублях на дороге не валяются.
955|22.01.2019 14:14:28|Максим Кочнев|Через пару месяцев он будет стоить 103. Прибавим купон  неплохая доха. Даже через 34 месяца также
956|22.01.2019 14:15:00|Harry Lime|Я вам говорил про сервис в БКС. Пара минут приятного общения с добрым знакомым.
957|22.01.2019 14:15:10|Максим Кочнев|И да, я в ломмастер тоже до погашения. Есть часть для спекуля, та через 36 мес уходит
959|22.01.2019 14:16:40|Alexey Vishnyakov|Ну не всегда. Я сегодня звонил, парень по голосу был чем то раздражение  возможно моим звонком. Но заявку выставил очень быстро  секунд за 30
961|22.01.2019 14:18:13|Sergey Sterlikov|То есть по всяким роделенам,лизингам,свиньям мы всё пережёвываем, всякие интервью с владельцами оцениваем,прямые эфиры и тд, а тут опа и надежный эмитент
962|22.01.2019 14:19:03|Максим Кочнев|Был бы надёжен 17 бы не давал. Если бы роделен давал тоже 17....
963|22.01.2019 14:19:05|Aleksandr|тут же был опрос, болше половины людей интресует только купон
964|22.01.2019 14:19:35|Harry Lime|Мы всю работу проделали в маеиюне. По Ломастеру и Роялу.
965|22.01.2019 14:22:07|Максим Кочнев|Кстати да, я когда Присоединился к группе тоже не совсем понимал почему про роял так говорят уверенно
968|22.01.2019 14:22:59|Savel|А чего она так рванулато
969|22.01.2019 14:23:47|Максим Кочнев|Рванула  это 120. А 90100  это болен менее норм цена. Она наоборот сильно упала тогда
970|22.01.2019 14:23:56|Sergey Sterlikov|А почем сейчас на вторичке ломастер
971|22.01.2019 14:24:32|Максим Кочнев|Второй по 102. Третий ещё есть шанс по 100.3100.5 взять со стакана на проливе
