|time|user|text
782|10.03.2020 07:46:39|Harry Lime| дкп qeqt поддержка интервенции рынки экономика сша ТРАМП БУДЕТ ПРЕДПРИНЯТ СУЩЕСТВЕННЫЙ ОТВЕТ НА РАСПРОСТРАНЕНИЕ ВИРУСА. МНУЧИН В ЕЖЕДНЕВНОМ КОНТАКТЕ С ПАУЭЛЛОМ МНУЧИН ТРАМП ГОТОВ ИСПОЛЬЗОВАТЬ ВСЕ ИНСТРУМЕНТЫ ДЛЯ ПОДДЕРЖКИ ЭКОНОМИКИ МНУЧИН РАБОТАЕМ С МАЛЫМБИЗНЕСОМ, КОТОРОМУ НУЖНА ДОПЛИКВИДНОСТЬ
783|10.03.2020 07:46:53|Harry Lime|Все инструменты должны просто взлететь
784|10.03.2020 07:51:37|Шура SiberianRanger| То что нужно с утреца
785|10.03.2020 09:18:50|Константин|Ну и как это понимать А если наш ЦБ тоже поднимет на почти 3
786|10.03.2020 09:18:50|Константин| дкп EM казахстан КАЗАХСТАН  СТАВКА ЦБ  12 ПРЕД 9.25
787|10.03.2020 09:21:56|Dmitry Manzor|с утра не подняли хотят продать валюту и погасить панику, посмотрим. Больше всего пострадают акционеры
788|10.03.2020 09:24:56|Kirill|Доброе утро, если оно окажется таковым  Размещение состоится по плану, завтра 
789|10.03.2020 09:26:23|İldar Rafikov|У них огромные проблемы сейчас. Поставки все встали. Импорт подорожал. А там 95 импорта
790|10.03.2020 09:26:45|А что ты сделал для котэ!?|Юмор остался незамеченным 
791|10.03.2020 09:27:26|İldar Rafikov|Замечен. Но не до юмора. Терминал не загружается
792|10.03.2020 09:27:51|Alexander G|Все биржевые инструменты . Не только эмитент Все Инструменты 
793|10.03.2020 09:45:29|Артем|Доброе утро Да, все по плану, размещение запланировано на завтра, 11.03.
794|10.03.2020 09:49:25|Kirill|Ok. Будем считать, что сегодняшний обвал котировок  это распродажи под ДядюДенера 
795|10.03.2020 09:50:02|Замполит Aleks Kib|Наш Дядя, самых честных правил, когда весь мир вдруг занемог  он уважать себя заставил, и разместился...
796|10.03.2020 09:51:07|Дмитрий Адамидов|
797|10.03.2020 09:51:07|Oleg Egorov|... ну как смог.
798|10.03.2020 09:51:40|Aleksandr|и разместился , то есть СМОГ 
799|10.03.2020 09:51:45|Замполит Aleks Kib|
802|10.03.2020 10:09:08|Vishek|Сбербанк со своим Квиком вероятно бережет нервы своих клиентов. Квик не грузится
803|10.03.2020 10:10:23|Kirill|Ну все, размещение ДядиДенера точно состоится, можно закрывать терминал
804|10.03.2020 10:11:11|Vladimir|Сбер работает и покупки проходят
805|10.03.2020 10:11:21|Rifnur|ПСБ тоже отрубился
807|10.03.2020 10:15:01|Mikhail Saratov|кэш, золото, дэни
809|10.03.2020 10:15:46|Тимофей «Кухонные системы» Казань|Дэни, как всегда непредсказуем
810|10.03.2020 10:16:52|Алексей Михайлов|Нет
811|10.03.2020 10:18:46|Rifnur|если ваш брокер лежит/завис, то это нормально трейдинг
812|10.03.2020 10:22:54|Rodion Rasputin|Как обидно, что у меня свободного кэша нет будет для меня уроком
813|10.03.2020 10:24:21|Paul Young|У меня тоже, хотя стаканы пусты, я не вижу чтобы ктото начал лить
814|10.03.2020 10:25:37|Котофей|Финам работает четко.
816|10.03.2020 10:26:46|Helena Yakh|В моменте и хуже были, Легенда  5
817|10.03.2020 10:26:49|Котофей|Средняя просадка по 18 ВДО  минус 1,5
819|10.03.2020 10:27:21|Den|Ор 4
820|10.03.2020 10:27:39|Котофей|По просадке я про свой портфель, а не про весь рынок
821|10.03.2020 10:31:17|Оксана|Все работает
822|10.03.2020 10:33:52|Mikhail Saratov|спасибо Открытию  QUIK работает нормально, добрал со стаканов всего по чутьчуть 
823|10.03.2020 10:34:51|Harry Lime|Ух , знатная сеча ...
824|10.03.2020 10:36:42|Alexander|У кого работает, подскажите что там подобрать ещё можно... Самолёт не предлагать.
825|10.03.2020 10:36:43|Rifnur|Как там ОФЗ торгуются
826|10.03.2020 10:38:57|Евгений Инвестор|Не то чтобы я хотел давать инвестиционные рекомендации, но вдруг интересны Ломбард Мастер 07 по 102 и СЭЗ по 101.
827|10.03.2020 10:39:54|Alexander|Это всё есть, хотел эбиса добрать, но не получилось поставить заявку, а он уже снова выше номинала...
828|10.03.2020 10:41:29|a_|Я чот не пойму, а ВДОошки даже по 80 никто продать не хочет .. Я надеялся
829|10.03.2020 10:42:38|Aleksandr|когда пойдут дожди .
831|10.03.2020 10:43:56|a_|А куда все паникеры делись
832|10.03.2020 10:45:20|Светлана|Не удивлюсь если цена на них даже вырастет , если в течение дня будут продолжаться сбои у брокеров и многие из ливунов сегодня просто технически на бирже не окажутся
833|10.03.2020 10:46:17|Sereja|Пописят нету
834|10.03.2020 10:46:45|a_|Тоже плохо торгуются. Как и ВДО. Пяток бумаг ниже номинала, в районе 9599. Остальные все от номинала и выше
836|10.03.2020 10:47:41|Rifnur|Спасибо
837|10.03.2020 10:51:07|Котофей|Чуть ниже номинала АПРИ 2 и 3. Похоже ВДО стоит, невзирая на мир.
838|10.03.2020 10:53:26|Сергей Конев|Вообще скала. А сколько паники было в чатиках 
839|10.03.2020 10:53:58|Котофей|Так без магедона и жизнь не в радость 
840|10.03.2020 10:54:04|Dmitry Manzor|да, не дают закупиться по нормальному
841|10.03.2020 10:56:23|Сергей|Так себе распродажа
842|10.03.2020 10:57:28|Котофей|Рано, еше не маржинколлы завершились, после 1530 могут пойти распродажи
843|10.03.2020 10:58:09|a_|Не. Ну я по 9799 не буду покупать. Это не серьёзно. Хоть Газпрома по 170 бери
844|10.03.2020 11:02:07|Viacheslav Sofikor|в целом первый удар ВДО на дикой паники выдержали спокойно, но кризис продолжается, поэтому рано говорить что все в сегменте будет хорошо
846|10.03.2020 11:04:09|a_|Ага. А лохи кудато все делись Исчезли, мать их
847|10.03.2020 11:04:45|Harry Lime|Там патрули , все зачистят
849|10.03.2020 11:13:20|Алексей ayaye :)|плохой брокер, говорили они... 
850|10.03.2020 11:14:37|Даниил Жуков|Открытие работает нормально.
851|10.03.2020 11:21:05|Mikhail Saratov|гдето в чатиках было про услугу положить сервера на панике, чтобы лемминги не могли нажать закрыть все позиции 
853|10.03.2020 11:22:20|aleksey|Короткие гос и псевдо гос бумаги почти островок спокойствия
855|10.03.2020 11:39:15|BoRo DA|Отличные цены сегодня в стакане 
856|10.03.2020 11:39:44|Soa|Что у нас есть по 95
857|10.03.2020 11:40:34|Harry Lime|Да ничего , расходимся
858|10.03.2020 11:40:48|Soa|обманули
860|10.03.2020 11:41:19|Alexander|фридом по 95 раздавали
862|10.03.2020 11:41:30|Harry Lime|Я взял ИТЦ Трейд и Эбис 1 восстановил позицию , все в районе 98,599,5
863|10.03.2020 11:41:31|BoRo DA|Я вот сижу как полк в засаде и жду НорНик БО05 ниже номинала 
864|10.03.2020 11:42:49|Alexander|Там какието объёмы никакие только 
866|10.03.2020 11:44:19|Harry Lime|По паре сотен/десятков ИТЦ точно
867|10.03.2020 11:44:31|Alexey Vishnyakov|Вам в акции  недавно сбер по 190 раздавали. Всё 1,5 года безудержного роста насмарку
869|10.03.2020 11:48:40|Alexander|ЭТС раздают
870|10.03.2020 11:52:40|Mark Polishchuk|только покупка от 99,49 в стакане
871|10.03.2020 11:53:22|Soa|не раздают
872|10.03.2020 11:53:35|Alexander|Ну я взял немного себе.
873|10.03.2020 11:55:24|a_|Да это всё Гэррис виноват. Подучил весь чат, что кто пописят сдаёт, тот лох. Вот уже никто и не хочет понормальному поделиться
874|10.03.2020 12:00:58|Mark Polishchuk|гарантИнвест
875|10.03.2020 12:02:28|Soa|пятый
876|10.03.2020 12:07:57|Harry Lime|Не , не видел , беру дюрацию , по Эбису я ликвидировал позицию по 103,8104. Почти все восстановил
877|10.03.2020 12:10:19|Val Z_Sky|забавно, но решил глянуть нзрм  а он не падает 
878|10.03.2020 12:10:36|Harry Lime|Да хрен там , а бумага маст хэв
879|10.03.2020 12:11:01|Val Z_Sky|ну стоит по 102. остальные упали, а этот крепится
880|10.03.2020 12:11:32|Harry Lime|Ее тоже пасут насколько я знаю
881|10.03.2020 12:11:45|Val Z_Sky|Гарри, а можно вопрос в личку
882|10.03.2020 12:11:57|Маркшейдер|Илья день добрый. Эбис это не из портфеля death proof эмитент
883|10.03.2020 12:11:59|Harry Lime|Легко
885|10.03.2020 12:13:14|Маркшейдер|Ясно. Благодарю.
886|10.03.2020 12:14:58|Alexey Vishnyakov|Я покупку cbom 24 поставил по 100,0002. По долили только до 101
887|10.03.2020 12:15:27|Vladimir Nabatchikov|Суборд cbom27 раздают, если не боитесь.
888|10.03.2020 12:22:03|Vladimir|Есть процедура отмены заявки на дядю денер
889|10.03.2020 12:22:58|exploit|Подскажите, смысл продавать ниже номинала Это истерики все пропало
890|10.03.2020 12:23:22|Vladimir|Есть если к вам пришел дядя коля
891|10.03.2020 12:23:59|exploit|В облигациях дядя Коля
892|10.03.2020 12:24:47|Vladimir|Продают облигации те кто хотят или вынуждены платить за акции
894|10.03.2020 12:26:16|exploit|Благодарю
895|10.03.2020 12:26:38|Harry Lime|Ультры очень много
896|10.03.2020 12:32:58|exploit|Стоит сейчас продавать доллар и брать по номиналу с купоном 16 до лета
897|10.03.2020 12:39:12|Viacheslav Sofikor|летом можно будет сказать стоило или нет, сейчас каждый сам принимает решение
898|10.03.2020 12:39:21|Evgeny Naumov NFK|На самом деле многие продают облигации сейчас вынужденно. Например, у инвестора есть позиции с плечом по акциям или деривативам. Естественно, чтобы принудительно не закрыли позиции, такие инвесторы продают облигации и покрывают убытки на рынке акций. Для тех, кто не попал в такую ситуацию, конечно, паниковать нет смысла  просто уже поздно, и рынок уже в целом отыграл новости.
899|10.03.2020 12:41:26|Артем|Да, свои уведомления в системе бумеранг вы можете корректировать или удалять совсем, если передумали принимать участие в завтрашнем размещении. Будем благодарны, если уведомите нас о своих намерениях.
900|10.03.2020 12:47:23|Lizardking0808|Есть варик перенести на недельку Сейчас не самый лучший момент выходить из других активов под дядю. А дядя нужен
901|10.03.2020 12:48:11|Alexey Vishnyakov|Я бы взял 10 штук дяди
902|10.03.2020 12:49:12|Артем|Да, пришлем. Ждем ISINи высылаем
903|10.03.2020 12:49:23|Ivan Z|В случае корректировки/удаления заявки будет достаточно на сайте изменить данные или вам в личку написать
904|10.03.2020 12:49:29|Артем|Такой вариант не рассматриваем.
906|10.03.2020 12:58:36|Михаил|простите, упустил момент, а если на сайте boomin заявка в статусе в обработке, то значит моя заявка не попала в очередь
907|10.03.2020 13:06:41|Артем|Нет, это как раз означает что все хорошо и мы видим ваше намерение приобрести указанное количество бумаг. Спасибо за информацию.
908|10.03.2020 13:07:10|Михаил|спасибо
909|10.03.2020 13:07:32|DIM|Чо происходит, вторая волна паники В быстро деньгах априфлай Каскад
910|10.03.2020 13:08:14|Mikhail Saratov|выходят ради порции 
911|10.03.2020 13:09:23|DIM|Чёт дофига выходят не понимаю, чтобы принудительно не закрылись фьючи чтоли у кого посадка с убытком пошла
913|10.03.2020 13:14:29|Viacheslav Sofikor|многим придется принудительно распродаваться ...ожидаемо
914|10.03.2020 13:38:26|Владимир Парцей|Сегодня пообщался с представителем эмитента CEO Техно Лизинг, Александром Пешковым. Его ответы на мои вопросы помогут сформировать мнение о уровне надёжности эмитента в период кризиса Ссылка на ответы на вопросы https//t.me/RuBonds/182 Так же, если ссылка не открывается  вы можете прочитать опрос в канале RuBonds
915|10.03.2020 13:40:35|Михаил|Два абзаца сверху зачем Просили не пости простыни, пости ссылки. Ок теперь ссылки, но все равно насрано в шапке зачемто
916|10.03.2020 13:41:49|Светлана|
917|10.03.2020 13:46:11|Алексей Мелехов|Я пас. 20 шт взял по 99.8
921|10.03.2020 14:34:11|Sergey K|
922|10.03.2020 14:39:34|Harry Lime|День еще не закончился и Америка не открылась , но можно сказать , что ВДО с честью отбились
923|10.03.2020 14:40:13|Aleksandr|А могли бы с честью вытряхнуть лишних
924|10.03.2020 14:40:15|Dmitry Manzor|не потонули
925|10.03.2020 14:41:20|Harry Lime|Расслабляться не надо , но еще раз повторюсь , в ВДО вцелом квалифицированные инвесторы не по бумажке
926|10.03.2020 14:43:23|Aleksandr|Да не может быть чтоб такой малый процент паникеров был
927|10.03.2020 14:43:25|Harry Lime|Далеко не все , не хватило бидов
928|10.03.2020 14:43:42|Оксана|Хотите отменить Я вот не успела заявку подать. Взяла бы за Вас если можно
929|10.03.2020 14:44:00|Harry Lime|Рынок в ВДО сам себя спасает так то
930|10.03.2020 14:44:12|Alexander|Можете объяснить почему CBOM24 ходит со 108 до до 100101 при таких встрясках, а CBOM25 стоит почти у номинала
931|10.03.2020 14:44:14|Сергей|Америку на предторгах позитивную рисуют
933|10.03.2020 14:45:08|Harry Lime|Могу , маркетмейкер ушел из 24 , там теперь анархия , я еще в декабре по достижении 110 начал мигать двумя глазами , что можно выходить
934|10.03.2020 14:46:00|Alexander|По 101то можно заходить, если вдруг ещё дадут 
935|10.03.2020 14:46:20|Harry Lime|Страна советов в другом месте
936|10.03.2020 14:46:29|Alexander|Ага, спасибо.
937|10.03.2020 14:48:00|Harry Lime|Не ну надо было просто прикоснуться , как потом рассказывать , где ты был 18 декабря 2014 или 9 апреля 2018. Новый день боевой славы теперь
939|10.03.2020 14:49:36|Ivan Z|Объем проливов маленьний все равно
940|10.03.2020 14:49:44|Harry Lime|Да ни о чем
941|10.03.2020 14:49:52|Denis Tsukhlo|Друзья, это косяк сбера или пионер действительно запалит купон 0
942|10.03.2020 15:08:24|Замполит Aleks Kib|Вот не планировал никаких действий до среды, пока паника немного уляжется, но раз появилась возможность 1 Апри 2 взял н
944|10.03.2020 15:10:09|Оксана|Можно забрать отказника
945|10.03.2020 15:10:53|Andrey Mayorov|Похоже, на рынке новостроек Москвы начинается настоящий кризис. Продажи жилья в феврале рухнули год к году к февралю 2019 на 20 в лотах и на 11  в деньгах. данные  dataflat и Росреестр
946|10.03.2020 15:11:40|Harry Lime|Ожидаемо , денег пока заняли , жду выноса тел ближе к зиме
947|10.03.2020 15:12:15|Дмитрий Адамидов|Так в 19 пик был
950|10.03.2020 15:13:35|Артем|Оксана, ответил вам в личной переписке.
951|10.03.2020 15:14:17|ОлегЕ.|https//nsddata.ru/ru/news/view/598730 все нормально
952|10.03.2020 15:15:07|Harry Lime|У меня пока нет , видимо рассылка еще сбоит
953|10.03.2020 15:21:33|Oleg Egorov|Я скрипта тоже пока не получил. Кстати, можно было бы развить успех, полученный при цивилизованном сборе и отображении/корректировке заявок в личном кабинете бумина  там же в ЛК и публиковать соответствующий скрипт...
954|10.03.2020 15:21:50|Dimasik|Всё пришло, ждитесЪ
956|10.03.2020 15:30:44|Владимир|Ктото в ВТБ инвестициях понимает как реазиловать скрипт Денера Можете подсказать Раньше не участвовал в первичных размещениях облигаций.
957|10.03.2020 15:34:07|Sergey Aleshkovich|По моему только по тф звонить трейдерам РПС, адресные заявки, покупка облигаций и далее по скрипту вроде и в офис ножками можно, но это не точно
958|10.03.2020 15:35:29|Владимир|Понял, спасибо. Позвоню им сегодня, уточню.
959|10.03.2020 15:36:25|godspeed|у них опять размер облигации в 50к или нормальный человеческий уже
960|10.03.2020 15:37:12|Дэн Иванов|размер выплаты в денежном эквиваленте составил 3 081 000 рублей. В нашем чате всегда приводим раскрытие тут эта тема запрещена 
961|10.03.2020 15:38:07|Владимир|Не знаю, что ответить, если четно. В первичке первый раз участвую, по ОФЗ и КО на общем рынке  все как у всех без минимальных ограничений.
962|10.03.2020 15:38:52|Sergey Aleshkovich|10к на облигацию на д. денера
963|10.03.2020 15:39:38|Владимир|ааа, вопрос был про номинал Денера...
964|10.03.2020 15:39:58|Sergey Aleshkovich|да, в первом выпуске одна облигация 50к
965|10.03.2020 15:57:18|godspeed|спасибо
966|10.03.2020 16:20:15|exploit|Подскажите, когда облигация ниже номинала торгуется, это негативно сказывается для компании
967|10.03.2020 16:20:44|Dmitry Manzor|позитивно, значит о ней помнят
968|10.03.2020 16:23:41|Евгений|Только если планируется новый выпуск бумаг  люди могут не захотеть покупать новые бумаги компании, видя как дешевеют старые.
970|10.03.2020 17:34:52|A S|А кто нибудь писал статьи, что происходит с облигациями, когда в стране такая ситуация и ставка привязана к ключевой
971|10.03.2020 17:52:58|Alex|Когда фондирование оказывается слишком дорого  гасят по коллу
972|10.03.2020 18:08:18|Илья|есть тут кто через финам торгует c маржиналкой можно в личку
973|10.03.2020 18:10:16|Александр|
974|10.03.2020 18:19:07|Котофей|Есть
975|10.03.2020 18:19:42|Михаил|Ну вперёд  проведите ещё все перекличку
976|10.03.2020 18:22:13|Den|Почему обувь облиги так просела Все бегут в лук
977|10.03.2020 18:23:02|Alex Petroff|А с перрона говорят, не про акции же чат.
978|10.03.2020 18:23:26|OK-63|Задумался а так ли нужна Брусника с 11...
979|10.03.2020 18:43:32|Оксана|Сегодня не нужно звонить. Звоните завтра с 10 до 13 Мск
980|10.03.2020 18:43:47|Алексей Сечин|сорян, не видел
981|10.03.2020 18:44:59|Mel Up|За отмену заявки ВТБ чтото удерживает
982|10.03.2020 18:45:50|A S|не должен
983|10.03.2020 18:47:59|Сергей|Книга собрана, ставки сделаны
984|10.03.2020 18:47:59|Vladimir Nabatchikov|Не получится отменить, это взрослая книга и список покупателей зафиксирован, только во вторичку лить.
986|10.03.2020 19:09:40|Alexander|классная голосовалка Спасибо.
988|10.03.2020 19:14:44|Шура SiberianRanger|Первичка 10 марта
989|10.03.2020 19:16:02|Vladimir Nabatchikov|Зачем эти люди делают это
990|10.03.2020 19:22:53|Alexandr Sharapov|может просто ктото спросил чего можно взять по номиналу. ему и дали скрипт. каков вопрос, таков ответ
