|time|user|text
685|02.06.2019 23:32:31|DIM|Я проходил однажды через возврат средств, когда грохнул я банк юграябыли на счету деньги, которые не успел снять, ждал 3 мес и потом через асв получил, но тогда я уверен был на 100 что до 1,4 млн можно не напрягаться, вернут, тут же получается если заводишь в бумаги желательно держат деньги только в бумагах, на счету около 0 должно быть всегда ну и надеятся и верить что брокер будет жить
686|02.06.2019 23:32:33|Olbrnew|В 20082009 кто там еще кряхтел  Кит и тройка  Тоже были интересные стори.
687|02.06.2019 23:33:08|DIM|Асв я не вкурсе страхует ли брокерский счета как и обычные или нет
689|02.06.2019 23:33:19|Olbrnew|Не страхует.
691|02.06.2019 23:34:20|DIM|Ну вот и ответзначит риски в бумагах у нас у всех, вопрос для меня лично до сих пор непонятный, все же есть доступ крутить моими бумагами если что у любого брокера или нет
692|02.06.2019 23:34:24|Olbrnew|Но решили, что экзамены  это лучше.
693|02.06.2019 23:34:36|DIM|  
694|02.06.2019 23:34:47|Сергей Ковалев|тут наверное у половины чата есть и больше 
695|02.06.2019 23:34:47|Olbrnew|Законный или незаконный 
697|02.06.2019 23:35:18|DIM|Незаконный уголовка, это я понял, те на законно уровне не имеют право, верно
698|02.06.2019 23:35:42|Olbrnew|Имеют.
699|02.06.2019 23:35:42|Dmitry Manzor|Наши ВДО брокеру не нужны он их в репо брать задаром не будет
700|02.06.2019 23:35:44|DIM|Не слышал никогда о таких
702|02.06.2019 23:36:05|Pavel Nakonechnyy|Ну в случае банкротства распродадут твои бумаги, вроде как
703|02.06.2019 23:36:24|Dmitry Manzor|Вопрос другой, есть доказательства того, что ты продавал бумагу или покупал Если брокер скажет вы бумагу продали, а деньги мы не страхуем
704|02.06.2019 23:36:26|Pavel Nakonechnyy|Или за долги перед налоговой в определенных случаях
705|02.06.2019 23:36:33|DIM|Стоп стоп, это не собственность брокера бумаги, которые купил я или вы, как физ лицо
706|02.06.2019 23:36:59|Pavel Nakonechnyy|Да. Но они по требованию суда их продадут и деньги распределят между тем, кому вы должны
708|02.06.2019 23:37:53|DIM|Если продали бумагу накануне банкротства брокера и не смогли вывести деньги со счета брокерского или потом с основного, это понятно, уже другая история, я сейчас про бумаги как таковые говорю
709|02.06.2019 23:38:00|Sergey Sidorov|Их точно крутят Но под присмотром ЦБ. Они не в тупую в там в репо.
710|02.06.2019 23:38:07|Сергей Ковалев|как по мне это эмитент, он платит больше всех и за все комсу брокерам инвесторы платят поменьше. правда если не кукан
711|02.06.2019 23:38:22|Елена Филякина|В этом я не сомневаюсь
712|02.06.2019 23:38:27|Olbrnew|По регламенту/тарифу. У открытия и втб прописано. Тот документ с 100 страницами. Где у тиеькова он я не знаю. У некоторых брокеров ты можешь запретить взятие твоих бумаг в репо. Но это обычно за отдельные деньги и тоже фиг знает как гарантирует. Бумажка с печатью если для суда.
714|02.06.2019 23:39:44|Dmitry Manzor|Я про другое. Брокер сказал вы бумагу сами продали, хотя вы и к терминалу не подходили. Где доказательства Как инвестору доказать обратное.
715|02.06.2019 23:39:56|Pavel Nakonechnyy|Там же есть целый порядок продажи твоих активов, если ты подаешь на банкротство
717|02.06.2019 23:40:11|Dmitry Manzor|Запрос в депозитарий делать
718|02.06.2019 23:40:12|Pavel Nakonechnyy|Или я чтото путаю
719|02.06.2019 23:40:32|DIM|Те у втб прописано что они имеют право брать бумаги в долг твои Но если берут поидее и платить должны за это нам процентик
720|02.06.2019 23:42:13|Pavel Nakonechnyy|А вот по поводу экзаменов инвестора. У нас же родители имеют право открыть ИИС на имя несовершеннолетнего ребенка, а там кто экзамены сдавать будет
722|02.06.2019 23:43:15|Olbrnew|Ну у них прописано, что могут. Но нет тарифной сетки. И они на рынке таким за 12 лет не занимались своих денег дофига походу. У бкс, открытия и финама  бывало брали бумаги, а потом возвращали и  насыпали за это.
723|02.06.2019 23:43:17|DIM|Доказывать уже через суд, написав досудебное письмо с вручением брокерубанкрот у, все детали я не знаю, к сожалению не юрист внутрянку полную и структуру работы с бумагами изнутри я сам не понимаю, знал бы, наверное не задавал тут вопросов об уверенности владения купленными бумагами независимо от банкротства брокера
724|02.06.2019 23:44:07|Olbrnew|Вы еще погуглите старые истории.
729|02.06.2019 23:45:47|DIM|У бкс овернайт был, это я с тиня знаю, те кто тогда ток пришёл к тиню в начале 2018 и потом когда тинь вышел из под бкс функция овернайт осталась, точнее как осталась можно смотреть отдельно бумаги, которые были под овернайт ом и которые уже без него, те тинь как то разделение сделал бумаг до и после полноправного участия в рынке
731|02.06.2019 23:46:47|Olbrnew|Владельцу
734|02.06.2019 23:47:40|Сергей Ковалев|разве
735|02.06.2019 23:47:44|DIM|А владелец физик, верно Ну так получается физик дивы не получал
738|02.06.2019 23:48:59|Сергей Ковалев|то есть вы хотите сказать что если в день закрытия реестра акции в репо то физик не получит дивы
739|02.06.2019 23:49:37|Olbrnew|Смотря как в репо.
740|02.06.2019 23:49:38|Dmitry Manzor|Хитрецы
741|02.06.2019 23:49:56|Сергей Ковалев|у меня в финаме постоянно в репо акции брал брокер, дивы приходили, все нормально было
742|02.06.2019 23:50:04|Olbrnew|Если брокер себе взял, то они ему придут.
743|02.06.2019 23:50:08|Dmitry Manzor|Мне кажется так не сделают, их бы засудили уже. На юристов бы больше потратили
744|02.06.2019 23:50:20|DIM|Я тоже так понял, я думаю это не совсем так, овернайт существовали под взятие бумаг на короткие срок и именно на ночь вроде как, деталей не помню уже, но не так что забирать дивы от них, другая там схема была, щас попробую узнать
745|02.06.2019 23:50:39|Olbrnew|Брокер сам может перечислять дивы вам.
750|02.06.2019 23:52:24|DIM|Я бы сказал, справедливости, иначе бы знающие лли уже давно бы хай подняли, что деньги не пришли
751|02.06.2019 23:52:36|Olbrnew|Ты берешь и покупаешь бумаги с 3 плечом.
755|02.06.2019 23:53:59|Сергей Ковалев|возможно конечно что сами брокеры перечисляют деньги, но тогда вопрос с налогами озникает и не маленький
756|02.06.2019 23:54:03|DIM|А если без плечей и за свои кровные покупаешь
758|02.06.2019 23:54:54|Olbrnew|Естественно. Там целые схемы, как утрясти всю эту ситуацию.
759|02.06.2019 23:55:15|DIM|Вот вот, не могут же банки за всеми следить где и сколько брали у людей чтобы подтасовать что вроде как бумагами не пользовались и тд и тп
760|02.06.2019 23:56:13|Olbrnew|Не помню откуда это. Бухта у нас тихая, но охуительно мутная и глубокая с 
761|02.06.2019 23:57:08|Сергей Ковалев|легче по моему не брать в репо тогда чем эти схемы мутить
762|02.06.2019 23:57:20|Olbrnew|Есть много неудобных вопросов на которые регулятор и брокера предпочитают не отвечать и пока 
763|02.06.2019 23:57:24|К& Б:))🍷|Добрый вечер. Странное вы пишете. На плечевые бумаги владельцу всегда приходят дивы. На то он и владелец. Это закон РФ о РЦБ. Другое дело, что часть брокеров задерживало дивы на плечевые бумаги... То же и про РЕПО. Отдача бумаг в РЕПО не лишает вас дивов. Много раз отдавал в РЕПО у разных брокеров. Всегда получал дивы
764|02.06.2019 23:57:52|Olbrnew|В какие года 
765|02.06.2019 23:57:59|Сергей Ковалев|нас скоро выгонят отсюда
766|02.06.2019 23:58:04|Olbrnew|Начиная с 2010 
768|02.06.2019 23:59:33|К& Б:))🍷|С 2008... Причем тут практика Есть законодательство РФ. Оно в отношении выплаты владельцам бумаг не менялось
769|02.06.2019 23:59:54|Olbrnew|Блин. Окей. На пальцах.
771|03.06.2019 00:00:11|К& Б:))🍷|И все равно, что было в 2008 или в 2010. Главное как сейчас
772|03.06.2019 00:00:22|Olbrnew|Нет.
777|03.06.2019 00:02:50|К& Б:))🍷|Упс. Чатом ошибся эта тема для Друзя
778|03.06.2019 00:03:17|Olbrnew|Пардон. Тогда я тоже останавливаюсь 
779|03.06.2019 00:08:00|DIM|Алексей тему поднял в этой теме об ответственности участников рынка мы и развили ее
780|03.06.2019 00:11:07|Olbrnew|Ну на рынке есть много аспектов, сейчас уже никто о них не рассказывает, а раньше на выставках представители брокеров много интересного раскрывали при общении 
781|03.06.2019 00:45:32|Denis Kozlov Septem|Вы же понимаете, что я не могу ответить
782|03.06.2019 00:47:54|First Last|На таком иис, насколько я знаю. На каждую сделку необходимо согласие опеки. Видимо они и будут сдавать
783|03.06.2019 00:48:41|DIM|В общем в тему овернайтов, что уточнил у бкс, точнее у тинькова, который был когда то под бкс, брали в конце торговых суток, точнее вечером бумаги клиента и в след торговые сутки их крутили при этом бумаги клиент свои видел но физически ими не владел, более того, мог эти бумаги продать даже, какая то хитрая схема в общем там была, но факт остаётся фактом, брокер мог в течении торгового дня использовать их и вечером с процентами возвращали, если же успевали вернуть деньги до закрытия торгового дня, процентов не начисляли
784|03.06.2019 00:49:07|Kregg|А почему бязательно когото должны куканить Про реальный бизнес не думали Фирма производит товар/продукт и делится за предоставленные ресурсы  это из области фантастики От разорения и аферистов никто не защищен, но не всеже вокруг Остапы Бендеры 
785|03.06.2019 00:53:49|Viis|Пострадавшие это конкуренты эмитента. Он получает финансирование и эффективней их давит.
786|03.06.2019 07:13:29|Максим Кочнев|Пострадавший  потребитель. Так как все включено будет в цену
787|03.06.2019 07:27:19|Alexey Vishnyakov|Ничего себе Кто этим занимался и как давно это было
788|03.06.2019 07:37:15|Владимир|Согласен. Поэтому и предпочитаю облигации. Когда берёшь кредит, а банк банкрот  то твой кредит никуда не девается, его покупает другой банк и ты должен другому банку. Так же и с облигациями. А риски они везде. Не только эмитенты дефолтятся. Физики не редко тоже берут кредит и не возвращают.
789|03.06.2019 08:57:35|Andrey Hohrin|Для тех, кто интересовался облигациями ООО ТЕХНО Лизинг купон 13,75 , мы провели этот вебинар. Вторая часть, в исполнении Дмитрия Александрова  про ТЕХНО Лизинг. https//www.youtube.com/watchvQlTsrOsVtBM
791|03.06.2019 09:54:16|DIM|Агонь, спасибо, ждал
792|03.06.2019 09:54:35|Andrey Hohrin|отлично
793|03.06.2019 10:00:22|Black Swan|На такси цену 100 указывать Простите за тупой вопрос, я просто первый раз
794|03.06.2019 10:01:31|DIM|Конечно, цена 100
795|03.06.2019 10:01:33|Шура SiberianRanger|Да
796|03.06.2019 10:01:39|DIM|А иначе у вас заявку не примут
798|03.06.2019 10:03:55|Сергей Ковалев|ломбард 5 кто то купил по 101,56 20 лотов
800|03.06.2019 10:05:46|DIM|Ого, ломбард так скакнул сегодня Был же по 100,5
801|03.06.2019 10:06:12|First Last|у меня роделен по 102 забрали
802|03.06.2019 10:06:39|Сергей Ковалев|скоро вернется
803|03.06.2019 10:10:05|Елена Филякина|То же уже и смс пришло, что счет пополнен, а денежек все нет 
804|03.06.2019 10:12:33|Harry Lime|Когда пишу ТрансМ телега предательски подставляет радужный флажок
805|03.06.2019 10:13:35|Alex Petroff|Ушла заявка на трансов
806|03.06.2019 10:17:51|Denis|
807|03.06.2019 10:20:04|Сергей Ковалев|начался маленький слив всего подряд...
808|03.06.2019 10:23:32|Helena Yakh|А я мсб по 101.93 продала , повезло, как раз на Трансмиссию 45 шт по такой цене
809|03.06.2019 10:25:14|Евгений Коломна|Скоро станем трансмиссионерами
811|03.06.2019 10:31:16|Aleksandr|Апри 104
813|03.06.2019 10:32:52|Sergey Sterlikov|Подскажите,что при адреснрй заявке указать в графах Поручение и Возмещение
814|03.06.2019 10:33:25|Елена Филякина|Ой, сегодня ВТБ с первого менеджера заявку принял на транс на прошлой неделе ОАЭ только с 4го
815|03.06.2019 10:34:11|First Last|ничего
816|03.06.2019 10:38:38|Dmitry Manzor|Поставил на такси, жду бумажки у себя на счёте
817|03.06.2019 10:39:05|Михаил|граждане, а скиньте, пожалуйста скрипт для трансмиссии. у меня пропали письма из gmail за последнюю неделю  подозреваю, что может быть связано както со сбоем, что у них был вчера
818|03.06.2019 10:39:57|Sergey Sterlikov|А Партнер  Акцепт для Трансмиссии выбирать из списка
819|03.06.2019 10:40:10|DIM|Я музыку слушать уже 
820|03.06.2019 10:40:31|Alex Petroff|В пятницу скрипт специально публиковался в чате. Используйте поиск по названию эмитента.
821|03.06.2019 10:41:11|Dmitry Manzor|крипт Таксовичкоф Режим торгов Размещение Адресные заявки путем заключения сделок на основании адресных заявок по фиксированной цене доходности. Код расчетов Z0 Наименование/идентификатор Андеррайтера/краткое наименование АО Банк Акцепт/ NC0040400000/Акцепт Номер выпуска 4B020100447R001P от 27.05.2019. ISIN RU000A100E70 Время проведения торгов в дату начала размещения период сбора заявок 1000  1300 период удовлетворения заявок 1400  1630.
822|03.06.2019 10:41:34|Михаил|спасибо
823|03.06.2019 10:42:02|Dmitry Manzor|у меня только спросили код расчётов, партнёр, название ооо, последние 4 символа isin, номер счёта, номинал и фио
824|03.06.2019 10:43:06|Михаил|номер счёта вашего брокерского или какого я в первый раз просто
825|03.06.2019 10:44:06|Dmitry Manzor|да
826|03.06.2019 10:48:30|Sergey|Ребята, от Сбера приходят комуто смски со входом в Квик
827|03.06.2019 10:49:03|Kleeman|Пробую войти тоже тишина...
828|03.06.2019 10:49:18|Sergey|Жесть
830|03.06.2019 10:50:09|Kleeman|А теперь пишет Вы уже работаете в системе и Net error Удаленный хост принудительно разорвал существующее подключение. 
831|03.06.2019 10:51:40|Sergey|Мне так и не пришла смс
832|03.06.2019 10:51:41|Сергей Ковалев|Софтлайн в Тинькофф добавили
833|03.06.2019 10:52:10|Denis|Так это ещё на прошлой неделе
834|03.06.2019 10:52:37|Сергей Ковалев|я первый раз увидел
835|03.06.2019 10:53:02|Sergey|Короче, в Сбере сбой говорит автоответчик на горячей линии. Попа.
836|03.06.2019 10:54:20|Alex S| отлично, пожалуй на этом стоит завершить обсуждение недоброкеров
838|03.06.2019 10:55:06|Sergey|Да, только Таксовичкоф изза этого похожу мимо проезжает
839|03.06.2019 10:55:09|Елена Филякина|3,40 слушала. Тоже подумала, что музон надо им менять
840|03.06.2019 10:55:25|Alex Petroff|Суди по нижней заявке ктото не умеет первичку.
841|03.06.2019 10:55:33|Vladimir|Брокер Сбер  все работает без глюков
842|03.06.2019 10:56:20|Михаил|ок, хорошо. только у меня спросили наименование контрагента, а таких слов в скрипте нет. сказали выяснить
843|03.06.2019 10:57:22|Дмитрий Адамидов|в мобильный попал с телефона. в обычный сейчас попробую
844|03.06.2019 10:58:14|Boris|Может это клиенты открывашки, желающие сэкономить на налоге матвыгоды
845|03.06.2019 10:59:23|Alexey Vishnyakov|Я выставил. Ждал секунд 10. Похоже ставил не первый  сказал трансмиссия  трейдер мне считай все сам сказал. Только номинал и количество указал.
846|03.06.2019 10:59:58|Сергей Ковалев|у грузовика 1 нет ни одной бумаги на продажу
847|03.06.2019 11:00:14|Dmitry Manzor|налейте коллеге
848|03.06.2019 11:01:25|Герман|Слушайте, мне кажется, или в талане началась типичная история от бкс, как с нотами  плавный загон цены вверх плитами
849|03.06.2019 11:01:57|Aleksandr|1
850|03.06.2019 11:02:30|Dmitry Manzor|нам стакан пожалуйста
851|03.06.2019 11:02:34|Михаил|ребят, есть кто, кто подскажет как выяснить контрагента для заявки в скрипте его нет
853|03.06.2019 11:03:21|К& Б:))🍷|Банк акцепт
854|03.06.2019 11:04:10|DIM|Можно так и по быстрому перепродать будет сразу
855|03.06.2019 11:04:39|Alex Petroff|Это смотря какой объем
856|03.06.2019 11:04:51|akakynah|АО Банк Акцепт/ NC0040400000/Акцепт
857|03.06.2019 11:05:03|Михаил|спасибо, попробую. а почему в скрипте этого не указали
858|03.06.2019 11:05:14|DIM|Согласен до верхнего было который по 100,18 добраться 
859|03.06.2019 11:05:57|Denis|Антирайдер это одно и тоже
860|03.06.2019 11:06:07|DIM|Все указано было
861|03.06.2019 11:06:26|Михаил|ну я ж если первый раз, откуда знаю это 
862|03.06.2019 11:06:26|DIM|У кого втб, заявка у всех отображается размешенная
864|03.06.2019 11:08:09|Шура SiberianRanger|А на меня набурчал все условия заявки назовите  Мне кажется они там немношк устали уже  ВТБ, сделай первичку через QUIK ВТБянка
865|03.06.2019 11:08:38|К& Б:))🍷|Конечно. Заявка тоже должна быть видна
866|03.06.2019 11:09:31|Aleksei Tuv|Да в квике
867|03.06.2019 11:13:04|Alex Petroff|Пока не раздадут деньги так и будут висеть на счете. Но они заморожены. Время раздача налива, удовлетворения заявок указано в объявлении  после 14 час. Читайте же буквы...
869|03.06.2019 11:14:35|DIM|Заявку просто не вижу в приложении самом, про деньги понял
870|03.06.2019 11:14:53|Шура SiberianRanger|Заявку в таблице заявок не видно, но в таблице лимитов по бумагам появляется бумага и указано количество в колонке В покупке, а в таблице лимитов по денежным средствам необходимая на покупку сумма перемещается из Доступно в Заблокировано 
