|time|user|text
1|10.05.2020 14:38:49|Dm Vl|Каскад отменно вещал за день до часа Х
2|10.05.2020 14:39:08|Ilya|Есть один хороший аргумент уже есть инвесторы по 12, если его нет, остальное не оч важно
3|10.05.2020 14:40:37|Dm Vl|Думаю, что эмитент хочет 10,, но справедливо будет с т зрения инвестора 1111.5
4|10.05.2020 14:40:51|Сергей|В январе размещались по 12, сейчас другое время
5|10.05.2020 14:42:14|Dm Vl|Сейчас время еще лучше, ориентиры по ставке заданы, ликвидность избыточная, линии от ЦБ крупняку увеличены, переоценку заморозили
6|10.05.2020 14:45:42|Сергей|Возросший риск у девелопмента и наличие 15 доходности на рынке
7|10.05.2020 14:47:31|Neimann Alexey|Судя по тому что я вижу, народ крайне боится девальвации, паркует деньги в недвижимость. По крайней мере в Новосибирске.
9|10.05.2020 14:47:44|Сергей|Когда Брусника и Легенда по 15, как эмитент сможет разместиться по 12
10|10.05.2020 14:47:47|Neimann Alexey|Скорее наооборот
11|10.05.2020 14:48:32|Ilya|МФЦ работают у вас
12|10.05.2020 14:48:52|Neimann Alexey|Вроде да. Сделки идут
15|10.05.2020 14:50:04|Ilya|Так бронь не продажа вроде Вот вам критерий сколько у застройщика доля льготных квартир
16|10.05.2020 14:50:18|Mikhail FarEast|Не верю. У Вас есть данные, что кол во сделок в апреле выросло Или это просто очущения на уровне хотелок
17|10.05.2020 14:51:07|Neimann Alexey|Ну брони мало в основном продано.
20|10.05.2020 14:52:04|Dm Vl|Всему свое время.
21|10.05.2020 14:52:32|Mikhail FarEast|Поделитесь пжл тогда данными по марту
22|10.05.2020 14:52:53|Neimann Alexey|Может конечно, весь отложенный спрос реализовался в марте и в апреле будет падение.
23|10.05.2020 14:52:59|Ilya|Так это да известно
24|10.05.2020 14:53:18|Neimann Alexey|Не под рукой. Надо искать
25|10.05.2020 14:53:44|Dm Vl|Замените девелопмент на любое другое, и получиться тоже самое.
26|10.05.2020 14:53:44|Harry Lime|1415 минимум
28|10.05.2020 14:54:38|Dm Vl|
29|10.05.2020 14:56:04|Harry Lime|Там 250 возьмет МСП. МСП хочет большую ставку , инвесторы хотят большую ставку льгота 0,7 ключевой. Так что 16 я бы прям побежал туда на 3х ногах.
30|10.05.2020 14:56:29|In|Что надо искать Продажи стоят. Даже ипотека по 6.5 мало помогает. Сегодня в мск предлагали в аренду неплохую однушку около метро за 20 тыс. Без депозита
32|10.05.2020 14:59:48|Mikhail FarEast|Спорить не буду, но мне кажется Вы не корректные данные дали. Я весь апрель мониторю цены на недвигу в Краснодаре. Последние две недели появились предложения марта с дисконтом, те цена пошла вниз. Зимой не было этого и подавно. Про программу ничего сказать точно не могу, кроме того что она запущена и возможность покупки есть. Счас и здесь в первичку не полезу, риск велик.
34|10.05.2020 15:01:39|In|Понаехавшие уехали. Потом цены на аренду конешно вернутся. Только вопрос  когда.
35|10.05.2020 15:02:37|Dm Vl|Не надо волноваться, если вам спекутивно денег поднять. Недавний пример, софтлайн, как тут его не ... 103 фига сейчас.
37|10.05.2020 15:03:27|In|Самолет до сих пор 99
38|10.05.2020 15:05:06|Dm Vl|Это 8ой , а 7  102 , ПИК вообще в ломбарде не путать с Мастером, а туда джанк не берут
39|10.05.2020 15:15:54|Harry Lime|Расскажите это Пересвету и ОХ
41|10.05.2020 15:16:26|Дмитрий Адамидов|Мечел был в ломбарде кстати
43|10.05.2020 15:18:01|Harry Lime|А виноваты будут все равно ВДО. Там вон ЕврофинансыНедвижимость дефолтнули по купону с выпуском на 2 ярда . Скоро момент истины в Гаранте
44|10.05.2020 15:19:54|Дмитрий Адамидов|Да мы всегда виноваты
47|10.05.2020 15:20:52|Dm Vl|Это один из критериев отбора бумаги, а не панацея. 100 никто не даст особенно в таких одиозных эмитентах
48|10.05.2020 15:23:11|Oleg Malakhov|Я не знаю, что автор понимает под равновесной ставкой. Есть понятие средневзвешенной ставки по портфелю вклад каждой ставки в зависимости от доли облигации в портфеле. Возможно это одно и тоже.
49|10.05.2020 15:25:18|Neimann Alexey|Я про Новосибирск. Про Москву не знаю
51|10.05.2020 15:30:17|Stan P|Это торговый дом в г Сочи
52|10.05.2020 15:31:48|Dm Vl|Это хаты в сочах
53|10.05.2020 15:32:37|Stan P|И правильно делаете. Хотя они лучшие в рынке. Ну еще рсг, лср и эталон
55|10.05.2020 15:34:23|Dm Vl|Там не только Сочи
56|10.05.2020 15:35:53|Stan P|Ок. Но я из недвижки только Пик и возьму. Хотя доха по нему как то не высокая. Это не на все. А так для повышения доходности портфеля 25
58|10.05.2020 15:37:07|Дмитрий Адамидов|Если Собянина снимут или кудато переведут  ПИК сдохнет с высокой вероятностью. Как СУ155
59|10.05.2020 15:37:18|Stan P|В недвижке очень главное кто акционер. Все проекты по факту могут ничего не стоить. Все O1 помнят
61|10.05.2020 15:37:42|Dm Vl|ОХ, если ... А если Воробьев, то , а если Евтушенков, то эталон и эту логическую цепочку можно продолжать до ...
62|10.05.2020 15:37:58|In|УК прокладка с уставным 10к. Мда начали сыпаться арендодатели.
63|10.05.2020 15:38:31|Дмитрий Адамидов|вот это и пугает традиции кинуть всех при первом удобном случае никто не отменял
66|10.05.2020 15:40:01|In|Какая разница, облигации будут выпущены прокладкой, без залога. Скорее всего.
67|10.05.2020 15:40:42|Mikhail FarEast|Вы сейчас все тут, вместе взятые, последних воблов распугаете. И действующих и потенциальных. Куда податься то бедным хомячкам
68|10.05.2020 15:42:55|Dm Vl|Из девелоперов на балансах больше кэша у ЛСР и ПИК
69|10.05.2020 15:45:05|In|Лср, если не ошибаюсь, в мск почти нет. А граждане в смутные времена предпочитают недвижимость в столице. Верят в кирпич. Некоторые и в новосибе
70|10.05.2020 15:48:03|Harry Lime|More pain soon
71|10.05.2020 15:49:44|In|No pain  no gain..
72|10.05.2020 15:50:50|Alexey|Только на рынке  pain у одних, а gain  у других
73|10.05.2020 15:51:07|Alexey Vishnyakov|В чате ко Денис обмолвился о 13,5, с эффективной доходностью 14,1. Но все же надеюсь на 14. Выпуск большой.
74|10.05.2020 15:51:18|Dm Vl|У многих залог видели Да и эмиссионные доки уже есть, полагаю
75|10.05.2020 15:53:02|Alexander|Аудио от Александр
76|10.05.2020 15:53:39|Mikhail FarEast|Хорошо, так это и есть, кэша полно. Вы считаете , что при спаде продаж в условные 40 на интервале до октября они им будут рисковать для покрытия своих репутационных рисков перед акционерами Лср уже дивы срезал с 78 до 30. Хотя на дату принятия решения ещё все было не так критично хреново
77|10.05.2020 15:53:41|Alexander|Это касаемо Екатеринбурга
78|10.05.2020 15:54:10|In|Меня слово ТД с 90х пугает.
79|10.05.2020 15:56:25|Alexander|Пытаюсь добиться именно сделок , количество в цифрах, за март апрель по Екатеринбургу.
80|10.05.2020 15:57:47|Dm Vl|Лучше контора с кэшем, чем без него, это факт. А дивы кто не срезал тенденция сейчас
81|10.05.2020 15:59:06|Mikhail FarEast|У них попа сейчас, сделок нет от слова совсем. Знакомая риелтор в Краснодаре рассказывала, что с середины марта сделок у нее нет. На рынке она лет 10 примерно, типа опытная.
82|10.05.2020 15:59:36|Ilya|Судя по дохам лучший АСК
83|10.05.2020 15:59:46|In|Завершается целая эпоха ТЦ с их невозвратными обеспечительными платежами, залогом товара и прочим беспределом. https//www.rbc.ru/business/10/05/2020/5eb7de099a7947f666febce2
84|10.05.2020 16:00:29|Ilya|Нифига, ставки в банках вниз, воблы на рынок, вот и вся песня
85|10.05.2020 16:00:58|Сергей|Облигационерам важен долг, дивы пусть режут, если это поможет кредитоспособности
86|10.05.2020 16:03:16|DIM|Фото от DIM
88|10.05.2020 16:04:27|nik|Ясно. Значит про обслуживание 1го клиента на 10 метров это пока только хотелки.
89|10.05.2020 16:04:36|DIM|Возможно
90|10.05.2020 16:05:01|Dm Vl|Кстати, каскаду банального кэша не хватило. А сколько еще каскадов может быть Вот и делайте выводы. Cash is king
91|10.05.2020 16:11:52|А что ты сделал для котэ!?|Речь про РКс Мне кажется, Денисы тоже это понимают И возможно даже Зак, Кац и Сагирян  понимают
92|10.05.2020 16:14:58|Dm Vl|Ну вот и с топами познакомились
93|10.05.2020 16:15:58|Harry Lime|Ну да .После кейса МСП и Каскад возможно новыми красками заиграет история
94|10.05.2020 16:22:35|А что ты сделал для котэ!?|Каца я придумал ... для красоты
95|10.05.2020 16:23:10|Mikhail FarEast|Я не об этом. Я про то, что в целом стройка сейчас подвисла и ждать от них роста/подвигов/развития до октября месяца 2020 года не приходится.
98|10.05.2020 16:26:23|Dm Vl|Там котэ топменеджеров ркса представлял
99|10.05.2020 16:27:21|Harry Lime|Вашу маму и там и тут передают
100|10.05.2020 16:27:39|Stan P|Не помню этого застроя под кем он
101|10.05.2020 16:28:13|Ilya|Атомстройкомплекс  Ананьев из Екб, был вместе с Чернецким Самый что ни на есть родной застройщик Екатеринбурга. Роднее не бывает.
102|10.05.2020 16:28:18|Dm Vl|Берите шире, их вообще на рынке 2
103|10.05.2020 16:29:21|Harry Lime|В данном случае один в двух лицах
104|10.05.2020 16:30:03|А что ты сделал для котэ!?|В далекие годы мы готовили IPO в Лондоне. И там были некторые сложные вопросы по регистрации эмиссии. Старшим партнеров в лондонском офисе юридической фирмы был какой то индус, не помню уже его имя. И вот как то читаем мы от него письмо, в котором говорится, что завтра он встретится с представителями FSA в СИНАГОГЕ, все обсудит и постарается решить ... Таки решил Тогда я понял, что евреи даже если с виду они индусы есть везде и они могут решить любой вопрос
105|10.05.2020 16:31:19|Dm Vl|А там какой Вот еще есть https//events.vedomosti.ru/speakers/zakmihail546
106|10.05.2020 16:34:17|Harry Lime|Там другой , с этим я сталкивался по Русту кстати
107|10.05.2020 16:41:36|Stan P|Не знаю такого, в рус форбс 100 входит
108|10.05.2020 16:42:00|Dm Vl|По большому счёту холдерам все равно, лишь бы купоны и тела гасились
109|10.05.2020 16:42:41|Stan P|Знаю такого, лет 15 точно. Раньше в гпб работал. Все в кипе ходит 
110|10.05.2020 16:43:46|Ilya|Тут таких нету, это же Angry Bonds
111|10.05.2020 16:44:16|Stan P|
112|10.05.2020 16:49:06|Ilya|Весь смак angry в том, что нам пофиг на то, что офз с середины марта дали больше 15 процентов, пофиг на Интел бонды которого выросли на 60 процентов и мы забили на конвертабл Петропавловска, который вообще всех укуканил. Нет, мы залезли в сектор мсб, который самый дефолтный банковские кредиты по статистике и мужественно пытаемся доказать, что мы не тупые и можем тут выжить. Свой путь так сказать.
113|10.05.2020 16:53:14|Alexander G|Никто не знает такого застройщика в Сочи как РКС . На сайте их тоже никаких проектов не значится по Сочи . Рынок живёт . Смели много за 2 месяца , цены подняли все   частники , застройщики , на землю также . Мфц работают по записи на 710 дней все расписано . По РКС Сочи по больше инфо бы , может что то проектируют пока . В свою очередь если надо что то посмотреть проверить на месте  могу съездить глнянуть .
114|10.05.2020 16:54:16|Alex|обязательно съездите, только название компании другое
115|10.05.2020 16:56:26|Stan P|Я меня квартира в их ilove. Хорошо строят, квартиры раскупаются
117|10.05.2020 16:57:04|Ilya|РГС или Кортрос
118|10.05.2020 16:57:05|Stan P|Всетки это вексель. Там все надежно
122|10.05.2020 16:58:02|Ilya|Тут просто с разными буквами много стало. Да РСГ держу. Чего нет то.
123|10.05.2020 16:59:19|Alexander G|Нет тут уже рисков пару лет как все приструнили всех кого надо и не надо посадили  сейчас на 95 все чётко и прозрачно . Есть один застрой по старому но там канаты ведут к собственнику топ 1020 политиков рф .
124|10.05.2020 16:59:33|Denis Kozlov Septem|У ЛСР огромный проект в Мск на сотни тысяч кв.м со сроком реализации лет 20  Зиларт
125|10.05.2020 17:00:55|Stan P|Мы 5 лет назад брали. Одни Армяне, все с нарушением закона. Типа дали разрешение на хибарку, они 30 этажей отгрохали. Типа потом через своих судей узаконивают 
126|10.05.2020 17:01:05|Alexander G|Исправил
127|10.05.2020 17:01:18|Alexey Vishnyakov|Ну ВДО тоже неплохо так показали себя. Не 15, но купленный Эбис по 91,66 почти 10, такси по 90 12. Кармани по 92  94 тоже хорошо пошёл.
128|10.05.2020 17:01:45|Stan P|Еле нашли хорошей питерский проект по адекватной цене
130|10.05.2020 17:04:33|Harry Lime|Быстроденьги и Кармани 3 с 85  15  купоны
131|10.05.2020 17:05:04|Alexander G|Все поменялось примерно 2 года как . До этого да , 95 строилось по принципу мамой клянусь сдам дом скоро.
132|10.05.2020 17:11:38|Stan P|Это когда Пахомова убрали а его зама по стройке посадили
133|10.05.2020 17:17:09|Denis Kozlov Septem|1. У Обуви нет ковенантов по кроссдефолту. 2. У нас нет оснований для объявления техдефолта, так как ситуация требует разъяснений судами.
134|10.05.2020 17:20:27|Alexander G|Чуть раньше на год примерно , 3 замов не 1  и ещё кучу народу как из власти так и застройщиков .
135|10.05.2020 17:26:42|Aleksei Zzzz|Есть правила налогообложения купонов текущие и есть новые с 01.01.21. Равновесная ставка  это такая, которая и при тех, и при других правилах даёт на выходе одинаковый результат после налогообложения.
136|10.05.2020 17:27:13|Alexander G|Самому интересно что за ркс такой и что он тут строить собрался . На сайте ничего нет у них по Сочи .
137|10.05.2020 17:28:32|Alexey|Зил  Север  Лср. Зил  Юг  Эталон. Больше никого нет
138|10.05.2020 17:44:48|Dm Vl|Из презентации
139|10.05.2020 17:45:54|Aleksandr|123 у них уже частично распродан, люди живут. Они его перекупили в незавершенной стадии.
140|10.05.2020 17:47:50|Alexey Vishnyakov|Я, к сожалению, по 85 не взял. Набрал много Эбиса и такси. Такси продал уже по 101  101,4. Когда деньги появились, цен 85 на кармани уже небыло. Но, я думаю, 92 тоже нормально. Тем более сейчас выше номинала.
141|10.05.2020 17:48:34|Dm Vl|Ещё
142|10.05.2020 18:04:59|Alexander G|Спасибо , презентаху пропустил . На сайте их смотрел . 123 Сдан и полностью распродан кроме 1 ой секции на которую не подписывают ввод изза парковки . Парковку заканчивают скоро и его введут .
143|10.05.2020 18:06:52|Harry Lime|Суть правильно , не все бумаги отрастают одновременно. Этим надо пользоваться .
144|10.05.2020 18:07:49|Alexander G|Это хороший застройщик  единственный в Сочи кто при старой власти не дал ни рубля взяток из принципа  поэтому и строили 123 несколько лет 
146|10.05.2020 18:18:47|Дмитрий Адамидов|При старой это при какой
147|10.05.2020 18:19:02|Dm Vl|Ок. В Твери и Пензе есть проекты. Есть кто из этих мест
148|10.05.2020 18:20:25|Alexander G|Мэр Пахомов был такой и есть где то . Очень одиозная личность . Лет 5 никто скинуть его не мог вкл губеров , полпредов и тд 
150|10.05.2020 18:22:25|Дмитрий Адамидов|Больше пяти Я помню хорошо как его ставили. У нас был олимпийский объект по светофорам. Он был федеральный но по понятным причинам удалось понаблюдать как работают краевые и городские стройки. То что там хоть кто то мог без взяток чтото построить  я, извините, не поверю. При мне выгоняли тех, кто дал взятку не тому или недостаточно.
152|10.05.2020 18:23:06|Дмитрий Адамидов|самострой на месте сарая без документов и без коммуникаций построить  поверю.
153|10.05.2020 18:26:41|Alexander G|Это скинуть пытались после олимпиады  а проработал он лет 10 кажется . Я и говорю что только 1 застройщик из принципа встал в позу в итоге 67 лет и строит и сдаёт потихоньку объект  он оч принципиальный дядька . Интересно что это как то с ркс связано . Выясню .
156|10.05.2020 18:40:14|А что ты сделал для котэ!?|Чечни
157|10.05.2020 18:41:09|Alexander G|Да да . И мощно работают кстати .
159|10.05.2020 18:42:34|Pavel|Первый дом он построил в 15 лет
160|10.05.2020 18:59:22|Алексей ayaye :)|остальные извинятся и уйдут
161|10.05.2020 19:09:56|Alexander G|Вообще сочинские застрои могут легко давать 15 тк примерно такая же доходность у них по м2 .
162|10.05.2020 19:32:50|Oleg Egorov|Я на проливе по 100.4  100.5 его набрал 28 апреля. Кстати, спасибо 
163|10.05.2020 19:38:15|Антон|Ща немного выдам инфы по Бруснике. Общался с человеком, который в свою очередь разговаривал с боссом отдела продаж Брусники
166|10.05.2020 19:55:10|exploit|кто бы еще инфу подобную дал по Легенде
167|10.05.2020 20:12:42|Alexander G|Уточнил по ркс и комплексу 123 . Как и говорил ранее строил комплекс совершенно другой застройщик Сакс , гМосква ркс просто выкупили год назад ,когда комплекс был построен и 2 из 3 корпусов были сданы, порядка 200 оставшихся квартир у застройщика и продают их с премией . Те по сути они инвесторы в этом проекте , причем зашли на конечной стадии .
168|10.05.2020 20:18:16|Alexey|Спасибо. Всегда рады подкупить у Бкса
169|10.05.2020 20:52:19|Dm Vl|А откуда такая стенограмма
170|10.05.2020 20:53:48|Антон|Ватс ап
171|10.05.2020 21:35:42|Zeev|Это Брусника
172|10.05.2020 21:35:55|Антон|Да
173|10.05.2020 21:38:36|Zeev|Обычно они начинают рассказывать, что ДОМ.РФ выкупил у них целый квартал арендного жилья
