|time|user|text
201|23.09.2019 19:07:31|Kirill Streblyanskiy|Мы до конца не можем знать весь объем, который заявят в книгу. Но, по предварительной оценке глубины книги, и учитывая размер выпуска 1,5 млрд. Руб., на заявленный объем чатлан должно хватить
202|23.09.2019 19:14:24|Alex Petroff|Спасибо за ответ
204|23.09.2019 19:21:33|А что ты сделал для котэ!?|Для слоупоков Я правильно понял, что по обувьрусу могу не париться и ставить заявку на букбилдинге И z0  это для тех, кто не хочет морозить деньги на 2 дня
205|23.09.2019 19:24:42|Aleksandr|Верно
207|23.09.2019 19:27:39|Andrey Khrulev|А минимальный объем в книгу какой  300 лотов или меньше
208|23.09.2019 19:28:23|Aleksandr|у ВТБ  300
210|23.09.2019 19:32:58|А что ты сделал для котэ!?|А как z0 этому поможет
212|23.09.2019 19:34:53|Sky|Продам в книгу на 12, если уменьшиться и не дадут, то и фиг с ними 
213|23.09.2019 19:36:24|Aleksandr|никак, просто не пойдете в Z0 если купон будет неинтересен
215|23.09.2019 19:42:05|А что ты сделал для котэ!?|А что нужно сделать чтобы участвовать в z0, если я не клиент втб у меня альфа
216|23.09.2019 19:43:32|Aleksandr|позвонить брокеру и спросить порядок подачи заявки на Z0 Альфе . А что , Альфа завтра берет заявки в книгу обуви 
217|23.09.2019 19:45:02|А что ты сделал для котэ!?|Да, берет Ок, позвоню  спрошу
218|23.09.2019 19:45:46|Aleksandr|Я мантру знаю только для ВТБ . Альфа может в нюансах отличаться
219|23.09.2019 19:52:28|Kirill Streblyanskiy|Коллеги, завтра будут более подробные инструкции по подаче заявки в режиме Z0
220|23.09.2019 19:54:12|Сергей Ковалев|а стоимость книги какая
221|23.09.2019 19:54:22|Aleksandr|Бесплатно
222|23.09.2019 19:56:34|Замполит Aleks Kib|Вот и раскрыта интрига Трейдберри КО в октябре с купоном 17
223|23.09.2019 20:35:12|Andrey Hohrin|малышам на биржу путь перекрыли
224|23.09.2019 20:35:47|Dmitry Manzor|
225|23.09.2019 20:35:56|Замполит Aleks Kib|Давят малый бизнес, паразиты.
226|23.09.2019 20:36:14|Alex|И сноска покупайте бэлти
227|23.09.2019 20:36:41|Замполит Aleks Kib|
228|23.09.2019 20:36:51|Andrey Hohrin|тактак. а причем тут БЭЛТИ это особо крупная компания
229|23.09.2019 20:37:57|Alex|У бэлти то есть новый выпуск. Вот его и покупайте.
230|23.09.2019 20:38:19|Andrey Hohrin|мне почестному интересно, как разместятся ПР и БЭЛТИ без организаторов. не уверен, что это будут истории большого успеха.
231|23.09.2019 20:39:05|Vadim Asanbaev|Всё будет хорошо Андрей, по крайней мере за ПР говорю 
232|23.09.2019 20:39:06|Andrey Hohrin|О, Вадим пишет
234|23.09.2019 20:40:29|Vadim Asanbaev|Спс, стараемся, уверен что так и должно быть
235|23.09.2019 20:42:50|Andrey Hohrin|заметно, и это очень неплохо по крайней мере знаешь, что если есть вопрос к ПРу, можно найти в сети Вадима Асанбаева. я серьезно.
236|23.09.2019 20:45:48|Vadim Asanbaev|Были примеры когда одним комментарием в чате пару млн бумаг сразу брали инвесторы, открытость и готовность участвовать в диалоге даёт результат, так и продаем сами по сути, 2ой же выпуск на 150 млн правда не 400 конечно так и продали. Спасибо Андрей за высокую оценку 
237|23.09.2019 20:49:38|Andrey Hohrin|ого всегда рад
238|23.09.2019 20:50:07|Dmitry Manzor|Я тоже брал ПР потому что видел, что есть обратная связь это большой плюс. Только это для лизинга хорошо, размещаться несколько недель или месяцев, привлекая деньги с меньшими потерями не тратя денег на организаторов и тд. А тем, кто деньги нужны на финансирование новых площадей, оборудования и тд такой вариант не подойдёт
239|23.09.2019 21:00:39|Сергей Ковалев|https//vk.com/wall122515244_10489
242|23.09.2019 21:29:40|Arslan|Уважаемые коллеги, а что, в законопроекте сказано, что ВДО смогут покупать только квалы
243|23.09.2019 21:55:25|Ilya|10 млн, а шуму
244|23.09.2019 21:55:33|Sky|Малыш это какой объем
245|23.09.2019 21:56:30|Ilya|А зачем им это, если БО должно дешевле выйти Или нет
248|23.09.2019 21:58:26|Замполит Aleks Kib|БО выпустить по затратам дороже обходится чем КО, и по времени тоже дольше.
249|23.09.2019 21:58:47|Ilya|Понял. А как там с бизнесом у ребят
251|23.09.2019 21:59:30|Andrey Hohrin|Так я по своему усмотрению решаю, что публиковать.
252|23.09.2019 21:59:47|Ilya|Никогда не оспаривал ваших прав даже поддерживаю в мыслях. Я к тому, что вы в канале пишете, что почти Ок, а тут пишете, что вам интересно а Ок ли там
253|23.09.2019 22:00:21|Замполит Aleks Kib|Развиваются, новые контракты с сетями, новые Вкусы, набрали команду продажников и т.д.
254|23.09.2019 22:01:05|Andrey Hohrin|Я к тому, что Бэлти есть в портфеле , первый выпуск, ибо 14  неплохо очень для этого эмитента. Но вот 12,5 уже не так интересны
256|23.09.2019 22:04:24|Ilya|Мега пардон Я то понял, что им 22 млн осталось, а это всего размещено, ок спасибо, теперь и мне интересно
258|23.09.2019 22:05:46|Замполит Aleks Kib|Да
260|23.09.2019 22:12:58|Ilya|
262|24.09.2019 02:37:00|Anton Moiseev|У меня бот чуть получше есть, ещё и НРД мониторит. Я его под ВДО бонды потихоньку точу. Если надо, пишите в личку кину ссылку 
263|24.09.2019 08:04:50|Evgeny P|Да киньте здесь, чего уж скромничать
264|24.09.2019 08:06:24|Giovanni Goudini|Поддерживаю
265|24.09.2019 09:14:01|Mozg Company|Да уж все бы глянули  Интересующихся много 
266|24.09.2019 09:14:23|Шура SiberianRanger|Встал в очередь за ботом D
267|24.09.2019 09:26:54|Юрий Хлыстов|Я чур четвертый в очереди
268|24.09.2019 09:32:47|Елена Филякина|Сегодня Антон Моисеев проснётся знаменитым.
269|24.09.2019 09:34:10|DIM|Все ждут бота, но его все не публикуют
270|24.09.2019 09:34:17|Alexey Z|Хороший бот ещё никому не вредил  хочу посмотреть
271|24.09.2019 09:39:35|Даниил Иванов|Кто последний за ботом
272|24.09.2019 09:41:50|Dmitry K|Тоже встал в очередь, за вами буду
273|24.09.2019 09:46:35|Elena Yakv|Прошу, не скрывать бота от наших глаз
274|24.09.2019 09:48:54|Kirill Ameleshin|Кто последний
276|24.09.2019 09:49:55|Elena Yakv|Электронная очередь
278|24.09.2019 09:51:03|Елена Филякина|Смотрю, уже можно место в очереди продавать. 
279|24.09.2019 09:51:42|Даниил Иванов|Так скоро уже как у Юнисервиса будет
280|24.09.2019 09:51:56|Elena Yakv|Кроме, первого вопроса остальные можно было не писать
281|24.09.2019 09:52:18|Александр|Коллеги  в Друзя
282|24.09.2019 09:57:10|Alex Petroff|Даже мне страшно стало от этого окрика Но чтобы мое сообщение не было мной же идентифицировано как флуд и мной же стерто, напомню, что сегодня книга, которая книга по БО Обуви, предположительно 12 купон. Размещение 26.09. Представители эмитента угрожали выдачей чату скрипта_Обуви накануне дня размещения.
283|24.09.2019 10:03:58|Aleksandr|Не нужен скрипт сейчас для книги .Брокеры сами находят нужный выпуск , ты говориш им лишь обьем и минимальный купон
284|24.09.2019 10:36:51|Andrey Hohrin|роделен На 2 октября намечен старт размещения второго выпуска облигаций ЗАО ЛК Роделен. Предварительные параметры выпуска Размер выпуска 300 млн.р. 300 тыс. бумаг номиналом 1 000 р. Купон 12,00 годовых YTM 12,75, ежемесячно Срок до погашения 3 года, линейная амортизация с 7 месяца обращения Андеррайтер ПАО Бест Эффортс Банк Организатор ООО Иволга Капитал Краткая презентация ЗАО ЛК Роделен  прилагается.
285|24.09.2019 10:43:19|Aleksandr|На всякий случай , график по Обувь
288|24.09.2019 10:52:51|nik|Это обычная книга которая у некоторых брокеров платная
289|24.09.2019 10:53:05|Mikhail Saratov|стейк  это прикол от стека, или какой то особый термин
291|24.09.2019 10:53:23|Aleksandr|это участие в букбилдинге
295|24.09.2019 11:09:09|Михаил|Есть stake, а есть stack
296|24.09.2019 11:09:15|Mikhail Saratov|осознал, спасибо
297|24.09.2019 11:14:36|Евгений Коломна|Через ПСБ заявился в книгу по Обуви, приняли без проблем
298|24.09.2019 11:20:55|Andrey Mayorov|Деньги заморозили А сколько стоит участие
300|24.09.2019 11:22:49|Михаил|Мне под обувь надо чтото продавать, так что лучше я посмотрю на ставку и дождусь обещаного z0
301|24.09.2019 11:23:20|Aleksandr|я уже продаю под Обувь .Часть с книги возьму , часть Z0
302|24.09.2019 11:23:24|DIM|Коллеги подскажите, почему в рус 30 покупая 1 лот1000 облигаций я по 112,9 и заплатил 438 баксо, продавая по 113,2 получу ток 424 бакса не понимаю то ли втб глючит толи чего и потом куда нкд Девается в этом случае Потому что я его не вижу вообще
303|24.09.2019 11:26:49|А что ты сделал для котэ!?|Алтфа заявки берет, но деньги или маргинальную позицию блокирует сразу
304|24.09.2019 11:27:11|Aleksandr|ВТБ так же
305|24.09.2019 11:28:43|Евгений Коломна|Участие сказали бесплатное, как обычно 0,05 возьмут по факту сделки, и говорят, что деньги заморозят
306|24.09.2019 11:30:45|E N|Деньги не морозят
307|24.09.2019 11:32:35|Евгений Коломна|А, ну ясно вчера сказали заморозят, а сейчас просто не у терминала, не знаю что там твориться
308|24.09.2019 11:38:13|Alex|Аморт
309|24.09.2019 11:41:05|DIM|Так аморт будет только 30 сентября
310|24.09.2019 11:50:14|Aleksandr|тут сегодня крупные сделки с утра идут
311|24.09.2019 11:52:20|Aleksandr Mukhin|подспустили цену, и закупились
312|24.09.2019 11:57:42|Irina R|А комунибудь, кто подавал заявку на моторы, скрипт выслали можно еще подождать, или уже надо им звонить
313|24.09.2019 11:58:53|Виталий Яковлев|Мне мой брокер из Цериха пока ничего не высылал по моторам
314|24.09.2019 11:59:24|Irina R|значит, ждем 
315|24.09.2019 12:00:05|Евгений Коломна|Смотрите сообщения от мосбиржи, пока Моторам isin не дадут, ждать скрипт бесполезно.
316|24.09.2019 12:01:24|Max|Мне позвонили 30 мин назад. Сказали в течении 12 часов скинут скрипт на почту. Заявка принята. Размещение завтра
317|24.09.2019 12:02:48|Evgeny P|Дали уже исин вроде
318|24.09.2019 12:04:39|Вячеслав Васильев|Торговое поручение надо отправлять из личного кабинета или по другому
319|24.09.2019 12:05:15|Evgeny P|Лучше по тел , в кабинете сгенерить кодовую таблицу
320|24.09.2019 12:05:57|Вячеслав Васильев|Зачем кодовая таблица для подачи в книгу
321|24.09.2019 12:06:17|Evgeny P|Идентификация вас по тел
322|24.09.2019 12:10:04|Вячеслав Васильев|По АльфаДирект. Ещё раз уточню у вас, то есть, чтобы податься в книгу на размещение обуви, мне не надо отправлять подписанное поручение, а так же как в адресной заявке просто отдать торговое поручение или я не так понял
323|24.09.2019 12:21:35|Aleksandr|это одно из самых качественных имен в ключе5
324|24.09.2019 12:27:51|Aleksandr|первичка  Обувь России. Книга сегодня до 1500. Ориентир купона 11,5012,00
326|24.09.2019 12:33:13|А что ты сделал для котэ!?|Голосом
328|24.09.2019 12:35:26|Андрей|Я только что подал заявку в Альфе по Обуви. Специально уточнил у разных людей по комиссиям. Утверждают, что за подачу в книгу не будут брать комсу, только за сделку. Посмотрим.
329|24.09.2019 12:36:33|Вячеслав Васильев|Спасибо. свободные деньги нужны под заявку
330|24.09.2019 12:36:42|Андрей|Да, морозят
331|24.09.2019 12:36:53|Вячеслав Васильев|ок
332|24.09.2019 12:37:10|Evgeny P|Я просто звонил и проговаривал скрипт, и все
333|24.09.2019 12:37:49|А что ты сделал для котэ!?|Или маржиналка
334|24.09.2019 12:38:07|Вячеслав Васильев|Отлично, а то меня консультатнт отправил в личный кабинет заполнять заявку
335|24.09.2019 12:40:01|Evgeny P|Простте соединить с трейдингом
336|24.09.2019 12:41:27|Андрей|Ну это они по новым правилам работают, но последние размещения я без ЛК подаю, если спрашивают, говорю, что отправлял, они по моему, не смотрят. Говорю, дайте трейдеров, и всё
337|24.09.2019 12:42:27|Вячеслав Васильев|Это хорошо, а то у меня есть сомнения, что их вообще просматривают ли
338|24.09.2019 12:43:30|Андрей|Да вот, тоже думаю, что укатают, рейтинг же.
339|24.09.2019 12:43:47|Андрей Шадрин|ВТБ на Обувь России в книгу ввёл свое ограничение  от 300 штук. Есть возможность заявиться в книгу с меньшим количеством
340|24.09.2019 12:45:27|Андрей|ВТБ это давно за правило по любым размещениям через книгу. А за меньшее часто отказывают
341|24.09.2019 12:53:34|Евгений Коломна|В ПСБ на этот вопрос ответили, что у них по минимальности ограничений нет, если сам организатор не заявляет минимальный лот.
342|24.09.2019 13:00:30|Aleksandr|Нет такой возможности
343|24.09.2019 13:03:34|Sergey Ageykin|Друзья, хотелось бы напомнить, что прошло ровно три месяца с момента первичного размещения дебютных облигаций МигКредит. Можно подвести некоторые итоги  Бумага торгуется выше номинала с самого начала размещения.  Текущая цена на уровне 103,5 /.  Есть ликвидность.  Бумага инвестиционная, а не спекулятивная.
344|24.09.2019 13:06:02|Konstantin|Подался на Обувь в Альфе по телефону. Обещали налить автоматом 26ого, если пройду по размеру купона.
345|24.09.2019 13:08:43|Aleksandr|YTM нового выпуска Обувь России в сравнении с другими облигациями с рейтингом BBB от Эксперт РА
346|24.09.2019 13:12:00|Harry Lime|Отлично , реально одно из лучших размещений года , как по форме так и по содержанию. Спасибо
347|24.09.2019 13:12:30|Павел|Вот он возможный апсайд  ну или риск эмитента
348|24.09.2019 13:14:33|Anton Moiseev|Приветствую бот поумолчанию делал для трекинга цен на мосбирже, потом сделал мониторинг дискложе и НРД. Еще немного, будет мониторинг судебных дел по эмитентам  Если у когото есть какието предложения или нашли баги  пишите в личку  Всех, кого интересует мониторинг дискложа и НРД  используйте команду /track ISIN Ссылка на бота  moexPriceAlertBot
350|24.09.2019 13:19:46|Сергей Ковалев|моторы дали скрипт
351|24.09.2019 13:21:07|Rifnur|На почту скинули
352|24.09.2019 13:21:14|Сергей Ковалев|да
353|24.09.2019 13:21:20|Rifnur|Отлично
354|24.09.2019 13:21:21|Denis Ipatov|заряжайте вторую очередь
355|24.09.2019 13:23:38|Evgeny P|Мне нет пока
357|24.09.2019 13:24:02|Юрий Хлыстов|Ну так делитесь
358|24.09.2019 13:24:05|Сергей Ковалев|да
360|24.09.2019 13:31:17|Aleksei Tuv|Мне тоже по Моторам звонили, сказали что переподписка и будет аллокация, но это не точно
361|24.09.2019 13:35:40|IURII D.|ISIN 
362|24.09.2019 13:36:02|First Last|а мне даже на письмо не ответили 
363|24.09.2019 13:36:06|Harry Lime|Вообщем бардак
364|24.09.2019 13:38:37|Sky|Ожидаемо 
365|24.09.2019 13:38:48|Сергей Ковалев|исина по холу еще нет
366|24.09.2019 13:39:26|[GR] Дубовой Алексей (МСК-ПВЗ-19)|RU000A100V38 не этот
367|24.09.2019 13:55:15|Andrey Mayorov|По моторам переподписка Размещают 25 млн, заявок ориентировочно 5560млн Нальют 50 Информация из цериха
370|24.09.2019 13:59:40|Harry Lime|Вот вам отличный пример как не надо проводить размещение
371|24.09.2019 14:00:15|Alex|А как надо в условиях повышенного спроса и нежелания понижать ставку
372|24.09.2019 14:00:52|Harry Lime|Варианты Септема , да даже Юнисервиса имхо лучше
373|24.09.2019 14:01:09|Андрей ☭ Емельянов|То есть выставлять заявку народную суму а удовлетворено будет 50
374|24.09.2019 14:01:46|Harry Lime|Я думаю удовлетворение заявок будет носить случайный характер
375|24.09.2019 14:02:44|Alex|Септем грамотно выбирает ставку или снижает ее кейс трейдберри. Поэтому огромной переподписки нет. Это правильный подход. Остальное лажа
376|24.09.2019 14:03:07|Евгений Коломна|Ага, неспроста со скриптом мутят
377|24.09.2019 14:03:27|Andrey Mayorov|Да У них таблица куда занесены все звонящие, писавшие И объемы там указаны От них и будут минусить
378|24.09.2019 14:03:28|Alex|А сейчас получается, что эмитенту как будто и не нужно удешевлять фондирование. Рыночный абсурд
379|24.09.2019 14:04:11|Harry Lime|Ну давайте сыграем в аллокацию , интересно кстати
380|24.09.2019 14:05:54|Алексей Мелехов|Да ладно такая же практика у слонов была 20152017 года когда рынок рос, ставки падали...совок и пр на субфедах институционалов жоско резали или вообще заявки не удовлетворялись...нормальная история жадность оргов тоже хорошо
381|24.09.2019 14:07:20|Andrey Mayorov|Создаётся ощущение бардака какогото И да, по результатам размещения можно опрос замутить, кто какой процент получил по факту Посмотрим что получиться
382|24.09.2019 14:07:49|Harry Lime|Безусловно
383|24.09.2019 14:08:55|Alex|Почему ставку не опускали для регуляции спроса
384|24.09.2019 14:08:59|Евгений Коломна|Если честно нальют, то уж лучше так, чем Юнисервтрэш  успей за 10 сек
385|24.09.2019 14:09:48|Harry Lime|Интересно , если поступят поновому , дадут всем сестрам по серьгам. Тоже тема.
386|24.09.2019 14:09:59|Шура SiberianRanger|
387|24.09.2019 14:10:54|DIM|Это те моторы в которые удалось зайти по букингу тебе Илья 
388|24.09.2019 14:11:25|Harry Lime|Кому куда удалось мы узнаем , если бумаги будут на счету
389|24.09.2019 14:11:55|Alex Petroff|Замутим. Посчитаем. Проанализируем. Сделаем выводы. Сами же эти выводы оспорим...и будем ждать новых размещений в условиях действия старого закона до принятия и вступиление в действие закона 4к.
390|24.09.2019 14:12:17|Harry Lime|news ЦБ РФ ИЗУЧАЕТ ВОЗМОЖНОСТЬ УСТАНОВКИ ОТРИЦАТЕЛЬНЫХ СТАВОК ПО ВАЛЮТНЫМ ВКЛАДАМ В РФ, РЕШЕНИЕ ПОКА НЕ ПРИНЯТО  ДИРЕКТОР ДЕПАРТАМЕНТА ЦБ
391|24.09.2019 14:12:27|Harry Lime|Вот это поворот
