|time|user|text
372|19.06.2019 14:08:51|Alex|Это не слоники, это ослы. Если запорят котировки сейчас, то вероятность роста уменьшится.
373|19.06.2019 14:09:04|Dmitry Manzor|
374|19.06.2019 14:09:27|Маржинколл Байбекович|В понедельник миг кредит, за ним маячат ломбард, с инновации, про всякие дэниколлы вообще молчу. Стратегия зайду на первичке и сдам по 101102 не работает этим жарким летом.
375|19.06.2019 14:09:31|Шура SiberianRanger|слонослы
376|19.06.2019 14:09:46|Denis|Да и ладно пусть не растет,чо такого то
377|19.06.2019 14:09:55|Маржинколл Байбекович|Не ПОЕХАЛИ, а ПРИЕХАЛИ.
378|19.06.2019 14:10:48|Dmitry Manzor|Мне интересно, вот фиксанут они сейчас эти 0.7, смех, дальше куда они побегут Сейчас нет выпусков с таким потенциалом роста
379|19.06.2019 14:11:35|Alex|Откупят такси, которые уже по 100. Классека
380|19.06.2019 14:12:16|Dmitry Manzor|А потом опять зайдут в ГрузЦ по 102 и подождут 103
381|19.06.2019 14:12:27|Alex|Именно
382|19.06.2019 14:12:41|Иван Хз|Да грузовик налит
383|19.06.2019 14:12:49|Alex S| в пионер, куда еще то
384|19.06.2019 14:13:01|Sky|Ещё про плечи не стоит забывать
385|19.06.2019 14:13:17|Alex S|в первичке не учавствовал, для коллекции взял один лот щас по 99,99
386|19.06.2019 14:13:48|Шура SiberianRanger|БЕГАЙ КРУГАМИ  КОРМИ БРОКЕРА
388|19.06.2019 14:14:57|Sky|В пионере, кстати, почти плиты на 99.99 и 100 
390|19.06.2019 14:16:48|Dimasik|Отпустило до пт/пн ВДО почти что 
391|19.06.2019 14:16:55|Aleksey Kormilitsyn|
392|19.06.2019 14:17:11|Valery Chistyakov|А со скольки было окно грузовика
393|19.06.2019 14:19:58|Oleg Egorov|Закройте глаза Видите, как стало темно   это вкратце суть всех этих коучеров
394|19.06.2019 14:20:50|Igor Sugrobov|БКС , груз3 получил
395|19.06.2019 14:22:09|Dmitry Manzor|тут уже продают вовсю 0.5 прибыли не желаете
396|19.06.2019 14:22:39|Igor Sugrobov|Я подержу
397|19.06.2019 14:23:41|Aleksei Tuv|Что за бред пол процента ловить
398|19.06.2019 14:26:28|Dimasik|Так ведь и 0.3 ловят особо житрожадные
399|19.06.2019 14:27:58|Шура SiberianRanger|Это 182 годовых D
400|19.06.2019 14:28:41|Aleksei Tuv|Согласен в годовых впечатляет
401|19.06.2019 14:29:16|Alex Petroff|Кому исчо ОнлМкф
403|19.06.2019 14:29:29|Dmitry Manzor|Вот ГрузЦ разместился, начался и в Такси рост
404|19.06.2019 14:30:46|Максим Кочнев|Ну все, трио Юнисервиса восстанавливается
405|19.06.2019 14:31:20|Шура SiberianRanger|ВСТАЛА С КОЛЕН
406|19.06.2019 14:36:19|Alex S| кто успел прихватить по дешевке  молодэц
407|19.06.2019 14:37:31|Максим Кочнев|Кто может таблицу рпс сделок по грузу скинуть
408|19.06.2019 14:40:18|Евгений Коломна|Как все эпично было, хотя день еще не кончился
409|19.06.2019 14:51:24|Aleksei Tuv|Покупай груз3 по 100,5 продавай груз2 по 106 не хитрый бизнес
410|19.06.2019 14:54:29|Ilya|Некоторые верят, что все ещё светло
411|19.06.2019 14:57:50|DIM|Агонь, с начала июля начнут сливки снимать кто на первичку зашел
412|19.06.2019 14:59:38|Dmitry Manzor|Да тут я так понял не брезгуют и 0,1 снять. Я буду держать до осени и такси и груз, ставка купона устраивает, потенциал роста есть.
414|19.06.2019 15:08:20|Максим Кочнев|где бы еще офис взят а можно скриншет
415|19.06.2019 15:11:36|Igor Sugrobov|
418|19.06.2019 15:14:32|Dmitry Manzor|за 8 секунд весь выпуск отгрузили
419|19.06.2019 15:15:33|Шура SiberianRanger|Запилил summary 
420|19.06.2019 15:16:22|George Goognin|а как проверить, что это реально продали в ритейле, а не маркетмейкер/организатор сам имитировал
421|19.06.2019 15:16:25|DIM|Ну дык все ж было подготовлено
422|19.06.2019 15:16:40|Шура SiberianRanger|первыйденьторгов ВДО
423|19.06.2019 15:17:10|George Goognin|я без сарказма, просто мы в шоке от того, как растет рынок ВДО, и не можем понять, почему люди так охотно наливают в местами противоречивых заемщиков под скромные 
424|19.06.2019 15:17:25|Шура SiberianRanger|потому что они могут 
425|19.06.2019 15:17:27|Alex Petroff|Можно попросить участников чата скрины выгрузить сюда из ЛК.
426|19.06.2019 15:17:45|Шура SiberianRanger|биржа это просто и удобно, в отличие от КО и всякого краудлендинга
427|19.06.2019 15:18:14|George Goognin|а чем корпоративные облигации сложнеенеудобнее, чем ВДО..
429|19.06.2019 15:18:52|Вячеслав Васильев|Сегодня купил, а завтра продал
431|19.06.2019 15:19:27|Aleksey Kormilitsyn|Сложно с вторичкой
432|19.06.2019 15:19:28|George Goognin|а, вы про такие  понял, спасибо
433|19.06.2019 15:19:29|Oleg Egorov|Потому что люди устали смотреть, как их сбережения на депозитах съедает инфляция
434|19.06.2019 15:21:18|Denis Ipatov|почему в FAQ нет ссылки на голосовалки навигации нет, я вечно забываю название этой группы
435|19.06.2019 15:24:36|Шура SiberianRanger|Норм 
436|19.06.2019 15:26:06|Aleksei Tuv|Ну дак и нахрена надо было скидывать, страх подержать
437|19.06.2019 15:28:27|Dimasik|Побег из пионера все продолжается
438|19.06.2019 15:32:26|Михаил|Таки прям побег Не сгущайте краски
439|19.06.2019 15:32:57|ANDREI|Объясните мне такой спрос на грузовичкофф, когда рядом такие же Кисти и Трансмиссия, но в районе 100,2
440|19.06.2019 15:33:13|Дэн Иванов|с пионера не убежишь
441|19.06.2019 15:33:39|Сергей Т|Надеются что вырастет больше других
442|19.06.2019 15:34:01|Dimasik|Посмотрите внимательно на остальных, встали, отряхнулись.. Не сгущаю, а грущу
443|19.06.2019 15:34:13|ANDREI|Это я понимаю. Но почему растет Ломастер вообще 16,5 купон, АПРИ 16 купон
444|19.06.2019 15:34:14|Denis Ipatov|объём продажи в пионе примерно равен объёму покупки груза по 101
446|19.06.2019 15:35:10|Сергей Т|Предыдущие выпуски выросли до 105 и выше
447|19.06.2019 15:36:27|Dmitry Manzor|мой друг говорит Акварель разбавь
448|19.06.2019 15:36:34|ANDREI|я слежу за ними, но не понимаю причин. Кисти вообще 40 млн выпуск, но по 101 вчера их никто особо не брал, также как и сегодня
449|19.06.2019 15:37:07|Aleksei Tuv|Лом5 по 101,2 забрали
450|19.06.2019 15:38:19|Михаил|
452|19.06.2019 15:38:56|Harry Lime|Вижу свою заявку
453|19.06.2019 15:39:15|Максим Кочнев|
454|19.06.2019 15:41:58|Harry Lime|Its a kind of magic . За редким исключением , что будет расти , а что нет можно просчитать.
456|19.06.2019 15:44:10|Denis Ipatov|пипец просто, элементарнейшую же вещь попросил
457|19.06.2019 15:44:22|Dmitry Manzor|
458|19.06.2019 15:45:08|Denis Ipatov|ссылку на голосовалку по объёмам в грузе3
459|19.06.2019 15:45:58|Dmitry Manzor|https//t.me/angrybondspoll
460|19.06.2019 15:45:58|Denis Ipatov|ну или название группы, на худой конец
461|19.06.2019 15:48:18|Roman|присоединюсь к мнению. а также Мосбиржа как структура внушает большее доверие, чем малоизвестные платформы
462|19.06.2019 15:49:46|Denis Ipatov|10 человек в голосовалке обещали зайти с объёмом gt 1 000 000, по факту таких сделок оказалось 7. ну с определённой погрешностью обещание сдержали 
463|19.06.2019 15:51:05|Alexey Vishnyakov|Всё в нем будем. Он займёт свои 3 в моем портфеле, как только появятся деньги. Мясо продал, но возму Эмираты на размещении.
464|19.06.2019 15:51:25|Шура SiberianRanger|Пошла жара 
465|19.06.2019 15:52:17|Alexey Vishnyakov|Ломбард, это все же где то около мфо. А к ним отношение особое. Многие ещё дд помнят
466|19.06.2019 15:52:52|Алексей ayaye :)|не все могли голосовать и вообще присутствовать в чате
467|19.06.2019 15:52:58|DIM|Рынок закладывает свои риски, вот и цена такая, грузовики многие знают, более лояльно отношение
469|19.06.2019 15:53:27|Denis Ipatov|это укладывается в определённую погрешность
470|19.06.2019 15:53:32|ANDREI|при цене 102 прибыльнее взять мясо3
471|19.06.2019 15:53:57|Максим Кочнев|я также думал когда Грузовик 2 по 104,5 продавал
473|19.06.2019 15:54:20|ANDREI|так то продавать
474|19.06.2019 15:54:25|Алексей ayaye :)|вообще, я вчера считал  175 сделок на первичке, 167 заявок в голосовалке
475|19.06.2019 15:54:26|Шура SiberianRanger|Но мясо не может сходить на 105, а грузовик может 
476|19.06.2019 15:54:55|DIM|Ещё бы блин таксовик как груз зашёл, бог с ними с кистями
477|19.06.2019 15:55:08|ANDREI|может быть все что угодно Просто кто их покупает по такой цене
478|19.06.2019 15:55:22|Шура SiberianRanger|ТУПЫЕ 
480|19.06.2019 15:55:44|ANDREI|я прям щас могу такси и кисти по 105 поставить, и ломастер тоже Но врял ли зайдет
481|19.06.2019 15:56:18|DIM|Ктото кто плохо умеет считать, а кто орехи берет по 105там тинь правда пооог
484|19.06.2019 15:57:03|Alexey Vishnyakov|Мяса слишком много  там выпуски по 400 миллионов и из 3. А ещё 3 эмирата. Общий объем ГГ больше 2 миллиардов в обращении. Всем хватит.
485|19.06.2019 15:57:13|Алексей ayaye :)|чтото я вас не понимаю. купонный доход и спекуляции почти взаимоисключающие. если б я хотел спекулировать, я б в другое место пошел, а не на вдо два процента ловить 
486|19.06.2019 15:57:18|Denis Ipatov|там 354 голоса, 3 от миллиона  10 с половиной человек
487|19.06.2019 15:59:30|Alexey Vishnyakov|Кроме 2 всегда с тобой купон. Полгода под 15  рост 2  это 9,5  19 годовых. А в акциях все это время можно сидеть в  или в 0
488|19.06.2019 16:00:06|Алексей ayaye :)|да, только половина ответила, что не планирует участвовать
489|19.06.2019 16:00:34|Denis Ipatov|врут 
490|19.06.2019 16:01:49|Алексей ayaye :)|ну вот купил я орешки, они выросли. либо сейчас продавать, либо полгода купоны получать. а через полгода опять опуститься смогут. так что эти 2  приятный, но не гарантированный бонус, не более.
491|19.06.2019 16:02:07|Roman|консервативные инвесторы, готовые поделиться кэшем с ближним своим. святые люди
492|19.06.2019 16:06:36|Alex Petroff|Куплю Ломастер3 БО. Много. Через неделю. Обращаться в личку.
493|19.06.2019 16:09:27|Дмитрий Адамидов|По 105
494|19.06.2019 16:20:30|Алексей Мелехов|Какой там Ломастер 3 Идола давно надо менять на Груз.
495|19.06.2019 16:28:37|Сергей|груз 102 покоряет
496|19.06.2019 16:28:40|Alex Petroff|Не по околорыночной цене вопрос объема. Может кому в хозяйстве не нужно, мало ли.
499|19.06.2019 16:33:45|Alexey Vishnyakov|Первая русская революция...
500|19.06.2019 16:33:56|Дмитрий Адамидов|Вот так низвергаются вчерашние кумиры
501|19.06.2019 16:34:27|Максим Кочнев|да не, круче ломмастера пока не придумали
502|19.06.2019 16:34:50|Alexey Vishnyakov|Где груз, а где ломбард
503|19.06.2019 16:35:49|First Last|ну все таки это КО
504|19.06.2019 16:36:35|Дмитрий Адамидов|Да понятно. Но .... 
505|19.06.2019 16:36:36|A L|Мне вот интересно другое, почему такие низкие ставки доходности Те же самые кисти от частников не через биржу дешевле 2530 не привлекли. Есть понимание какую комсу снимают посредники за вывод займа в 40млн на биржу
506|19.06.2019 16:37:04|Harry Lime|До 5
507|19.06.2019 16:38:33|Alex Petroff|Хотите я их с вами познакомлю Но забегая вперед скажу сразу, им проще взять через биржу, пройдя экспертный совет, чем собирать через краундплатформу. И быстрее и эффективнее. А да, еще и дешевле.
508|19.06.2019 16:38:58|A L|если кисти прод 15, то условная Мосигра на что могла бы расчитывать
509|19.06.2019 16:39:05|Harry Lime|Поэтому нежелание той же Мосигры делать облигации , биржевые или КО я рассматриваю в двух вариантах  непрозрачная структура долга и бенефециаров или фрод.
511|19.06.2019 16:41:04|A L|Все это очень интересно, я смотрю на это скорее как на временную неэффективность рынка
513|19.06.2019 16:42:26|Максим Кочнев|15, но в замен ликвидность. Кисточкам до погашения под 20 я бы не дал, а под 15 до любого момента  без проблем
514|19.06.2019 16:42:35|Harry Lime|Это же группа компаний, многие знают других участников , в том числе и лично
515|19.06.2019 16:42:48|Максим Кочнев|Кисточки уже занимали, это по факту второй займ
519|19.06.2019 16:44:10|A L|а вы покупаете и держите до погашения или сливаете через короткий период
520|19.06.2019 16:45:06|Максим Кочнев|из ВДО большую часть я не держу до погашения, но есть всего несколько где до погашения. К слову все трио Юнисервиса, а тем более Кисточки  это на 36 месяцев не более
522|19.06.2019 16:46:34|A L|Я много лет отработал в инвестиционке, и знаю как по молодости делались похожие размещения делается первый выпуск на небольшой объем, который скупается аффелированными структурами, завышается рынок на вторичке, потом делается следующий выпуск, куда народ глядя на успешность первого встает в очередь. Когда услышал про Кисти, именно такая и была первая мысль
523|19.06.2019 16:47:10|Harry Lime|Назовите примеры плиз , с маленьким выпуском сначала
524|19.06.2019 16:47:39|A L|уже не всмомню, это в начала 10х было
525|19.06.2019 16:47:47|Harry Lime|Я так и думал
526|19.06.2019 16:47:51|Максим Кочнев|вполне, Кисти  это чисто спекуль, сидеть в них до погашения под 15  спасибо не надо вот этим биржа выигрывает. Если бы у вас в карме я мог перепрадавать право на долг
527|19.06.2019 16:48:27|Harry Lime|Еще есть 51 статья , можно не свидетельствовать против себя
528|19.06.2019 16:48:44|A L|простите, не понял иронии
529|19.06.2019 16:49:17|Igor Sugrobov|Ирония часть нашего сайта
531|19.06.2019 16:50:07|Igor Sugrobov|Особенно хорошо это получается у Ильи
532|19.06.2019 16:51:03|A L|реально очень интересно все это хочу получше понять подводные камни. поэтому и спрашиваю прямо
533|19.06.2019 16:52:13|Harry Lime|Мне кажется сама Мосигра с олдскульными торговыми точками  это каменный век в мире победившего Амазона.
534|19.06.2019 16:52:24|Максим Кочнев|что конкретно вы спрашиваете на бирже 2 момента дают плюс 1. Ликвидность 2. Налог ниже. Да, ставка 15, но по факту после налога эти 15 равны 16 если через платформу
535|19.06.2019 16:52:59|A L|Это вопрос приоритетов разработке. Мне кажется что в будущем к этому и придет. Я бы даже с удовольствием в Карме помогал заемщикам, дошедшим до кредитного портфеля 100м рефинансироваться через бонды
536|19.06.2019 16:54:13|Alex Petroff|Давно пора на биржу. В чате масса андеррайтеров, если вы знаете о чем я.
538|19.06.2019 16:54:37|Герман|Заливного в грузе 2 нет, только потому что он почти весь кулуарный
539|19.06.2019 16:55:17|Дмитрий Адамидов|http//angrybonds.ru
541|19.06.2019 16:55:31|Oleg Egorov|Биржа еще публичность дает, для многих это тоже важно.
543|19.06.2019 16:56:38|Harry Lime|Да многие очень приличные и интересные компании не могут разместить БО только изза структурирования бизнеса , я про Станцию например.
545|19.06.2019 16:57:28|Дмитрий Адамидов|Именно поэтому будем приглашать краудлендинговые платформы
546|19.06.2019 16:57:29|A L|нужно налаживать синергию тогда
547|19.06.2019 16:58:00|Дмитрий Адамидов|Ну что  думаю можно начинать готовы ли каверзные вопросы
548|19.06.2019 16:58:49|A L|с публичностью нет проблемы, запилить публичный реестр держателей долга на блокчейне еще надежнее будет. Думаю на него даже ссылаться в юр документах уже можно, так как скоро примут закон о цифровых активах
549|19.06.2019 16:58:54|Harry Lime|Если эмитент на УСНО скажем или в группе несколько юрлиц. Все , для БО он не годится. Нужна консолидация под одной компанией.
550|19.06.2019 17:00:06|A L| вернемся к этому вопросу
552|19.06.2019 17:00:52|Harry Lime|КО при всем уважении , вам еще талант продавца и клиентская база понадобятся
553|19.06.2019 17:02:07|A L|это стандартная проблема, поэтому заемщик за два три года до выхода на биржу уже об этом должен думать и готовить свою структуру
554|19.06.2019 17:04:05|Harry Lime|Пусть возьмут под залог в ломбарде или в Кармани. Всем будет хорошо.
555|19.06.2019 17:04:28|George Goognin|при наличии залога можно и в банке взять 
556|19.06.2019 17:04:29|A L|у большинства нет залого
557|19.06.2019 17:05:38|Harry Lime|Это как правило залоги бенефициаров, они нищие
558|19.06.2019 17:06:25|Kirill L|как то в 2014 году брали займ на фирму у частного инвестора на 100 годовых. Теперь мечтаю выдавать такие
559|19.06.2019 17:06:40|A L|Проще на примерах. Мосигра, портфель займов 150млн. У владельца авто стоимостью 5 млн руб. Это не решает проблему. Афекс, портфель 50 млн, у владельца авто 3 млн, аналогично
560|19.06.2019 17:07:39|Harry Lime|А там по одному юрлицу у Мосигры и у Афекса или веер разных 
562|19.06.2019 17:09:57|A L|и там и там раньше была жесть, в одном случае 4, во втором 2 ЮЛ. НО в 2019 году первые уже провели реструктуризацию долю купила другая сетка  hobby games вторые планируют реструктуризацию
563|19.06.2019 17:10:29|Максим Кочнев|Как долго вы на рынке Сколько погашенных займов
564|19.06.2019 17:11:01|A L|Тут очевидно что нужно растить заемщика с того момента, когда ему понадобились первые 510 млн, и чтобы он уже тогда понимал, что через дватри года пойдет на биржу и какая у него быдет структура
566|19.06.2019 17:13:02|Максим Кочнев|Как много погашенных 10,100,1000
567|19.06.2019 17:13:17|A L|Ближе всего были к дефолту с Брио Финанс, в свое время давали им деньги, но мы закрылись до проблем у них а по новому траншу не договорились. Там либо повезло, либо Брио специально не захотели брать у нас деньги
569|19.06.2019 17:14:55|Harry Lime|Про БО можно забыть. Только КО , имея базу инвесторов проще краудлендинг.
570|19.06.2019 17:15:40|Максим Кочнев|Ну 1015 это мягко говоря очень мало для понимания картины. Тут ничего удивительного что нет дефолтов. Почему за 6 лет всего 1015 Вы в год по две компании кредитуете
