|time|user|text
1|21.01.2019 14:13:24|J T|Ну меня в моей шараге учили, что предпринимательство тоже типа начало считаться фактором производства, не знаю, насколько они правы
2|21.01.2019 14:13:54|Harry Lime|Настраивайтесь на 100,5101
3|21.01.2019 14:14:02|Дмитрий Адамидов|ну это влажные мечты предпринимателей и парадигма такая была действительно. Илон Маск и всякое такое. Политика
4|21.01.2019 14:14:13|Александр Нечаев|Подскажите, а рпс на вторичке это считается биржевой сделкой Или внебиржевой
5|21.01.2019 14:14:15|J T|Согласен, логично
6|21.01.2019 14:14:29|Harry Lime|Биржевая , вторичка
7|21.01.2019 14:14:53|Svyatoslav Lebedev|Комиссия на сумму ниже 100000 руб.  45 руб., на сумму выше  0.045 от оборота сделки.
8|21.01.2019 14:18:09|J T|Но рпс же и на внебирже есть, нет
10|21.01.2019 14:22:35|Александр Нечаев|Если больше 100 тысяч, то эти ниже стандартной комиссии
11|21.01.2019 14:23:27|Андрей|Денис, а заявки, которые мы вам давали, они в книгу попадают Или в книге только мин 4млн лоты
12|21.01.2019 14:25:43|Denis Kozlov Septem|Все заявки, поданные в Книгу заявок, будут удовлетворены через РПС  и больше и меньше 4 млн руб. Это точно. Остается проблема с ВТБ  они отказываются ставить адресные заявки в РПС на вторичке. Только первичку. Сейчас ведем с ними переговоры, до конца дня сообщим результат. Остальные брокеры делают адресные заявки без проблем.
13|21.01.2019 14:27:29|Андрей|Спасибо Тогда ждём скрипт, по возможности.
14|21.01.2019 14:29:46|Svyatoslav Lebedev|Так сказали клиентщики Открытия.
16|21.01.2019 14:33:16|Denis Kozlov Septem|В прошлый раз вебинары были бесплатные и видеозапись была бесплатной. Сейчас вебинар платный, но цена символическая. Я постараюсь, чтобы запись была доступна бесплатно.
17|21.01.2019 14:34:26|Svyatoslav Lebedev|Денис, спасибо Я, в любом случае, уже оплатил 100 руб.  просто обычно смотрю вебинары не в онлайне, а в записи.
20|21.01.2019 14:41:22|Giovanni Goudini|По номиналу
21|21.01.2019 14:42:43|Denis Kozlov Septem|Первичка от 4 млн руб.  по номиналу, вторичка в РПС у кого меньше 4 млн.  с небольшой премией. Сейчас разошлем скрипт для всех, кто подавал заявки в Книгу
28|21.01.2019 15:24:14|Harry Lime|Опа , 15 января Финавиа запросило раскрытие держателей по обоим выпускам
29|21.01.2019 15:27:19|Sergey Sidorov|Эх, добрый ты человек, бояринс
30|21.01.2019 15:30:05|Маргарита|А что это означает
31|21.01.2019 15:30:33|Harry Lime|Скорее всего об,явят ОСВО в самое ближайшее время.
34|21.01.2019 15:41:24|Маргарита|Что такое освоНовичок я
36|21.01.2019 15:43:12|Harry Lime|Участие  ну или хотя бы наблюдение со стороны в корпоративных процедурах  путь к повышению знания об облигациях.
39|21.01.2019 15:47:52|Nikolay Pavlov|Я думаю, они запросили чтобы обсуждать условия за спиной 25 воблов
41|21.01.2019 15:52:51|J T|В рпс через любого брокера модно выставляться кстати, Денис Или должны быть линии открыты у вас на него
42|21.01.2019 15:54:08|Harry Lime|Я тоже так думаю
43|21.01.2019 15:54:10|Denis Kozlov Septem|Любой брокер подойдет. Это через Биржу проходит. Взаимные отношения не нужны. Но мы исполним только те заявки, которые у нас есть в Книге.
44|21.01.2019 15:54:27|J T|Понял
45|21.01.2019 15:55:32|Harry Lime|Кейс ДД , классика жанра
48|21.01.2019 15:59:08|sveta|Скиньте ктонибудь лидеры роста м падения сегодня
49|21.01.2019 15:59:43|Harry Lime|НРД вестимо
51|21.01.2019 16:00:58|Ilya|Ну там срок сбора информации до 30, и они в принципе такое для аудита делают каждый год
52|21.01.2019 16:01:44|Harry Lime|Даты отличаются от предыдущих лет , это самоуспокоение.
53|21.01.2019 16:02:17|Ilya|Они вообще каждый год разные
57|21.01.2019 16:03:53|Harry Lime|Да , все уже запаслись , кто бумагами , кто попкорном
58|21.01.2019 16:07:32|Nikolay Pavlov|Зачем тогда они его попросили интересно
59|21.01.2019 16:07:55|Дмитрий Адамидов|На МФД хорошо было сказано по Ютейру обычное явление  чем ближе крах, тем больше планов генерит банкрот грядущий.
60|21.01.2019 16:08:32|Harry Lime|Ну если не хватает для контроля 1015 процентов , могут договориться с кемто крупным
61|21.01.2019 16:08:53|Alexey Z|Коллеги, а скрипты для брокера для покупки завтра Ломмастера через рпс на вторичке сегодня уже были в чате Чтото не увидел.
62|21.01.2019 16:09:07|Harry Lime|Второй за компанию скорее всего .
64|21.01.2019 16:09:45|Alexey Z|Спасибо. Значит ждемс...
65|21.01.2019 16:11:28|Denis Kozlov Septem|В 17 часов должен появится Регламент размещения от Биржи и сразу мы разошлем скрипт
66|21.01.2019 16:12:26|Alexey Z|Спасибо
67|21.01.2019 16:26:39|Alexey Z|Планы по размещениям дебютный выпуск АО ММЦБ  Акционерное общество Международный Медицинский Центр Обработки и Криохранения Биоматериалов входит в группу АО Институт стволовых клеток человека 25 января начинает размещение 1 выпуска биржевых облигаций  30 млн руб.  объем размещения  14,2 годовых  ставка 14 купонов  выплата купонов  ежеквартально  10 лет  срок обращения  1 год  оферта  организаторы  Универ, Фридом Финанс Пост информационный. Редакция канала не несет отвественности за результаты инвестиций в данные ценные бумаги.
68|21.01.2019 16:32:05|Kir|Самые длинные вдо
69|21.01.2019 16:32:28|Alex|Есть оферта и ладно
70|21.01.2019 16:34:57|Максим Кочнев|А что за Эмитент Жесть или сойдёт
71|21.01.2019 16:37:07|Harry Lime|Что такое 10 лет , по сравнению с вечностью в криокамере. Это же как Хана Соло заморозили в Империи наносит ответный удар
72|21.01.2019 16:37:42|Alex Petroff|Я был на их презентации на Мосбирже в Спб в прошлом году. На рынке они стоят крепко. База клиентов очень большая. Деньги есть. Но я не понял смысла выпуска. Основной тезис  хотим айпио, но после бондов. Считают свой бизнес недооцененным в России в сравнении с мировыми аналогами.
73|21.01.2019 16:38:29|Kir|Они его хотят продать за дорого, а за дорого не берут
75|21.01.2019 16:38:36|Максим Кочнев|Интересно будет посмотреть но если и брать то со стакана и при 14
76|21.01.2019 16:39:12|Harry Lime|Да , я тоже подумал взять полпроцента чисто по приколу.
77|21.01.2019 16:40:16|Denis Kozlov Septem|Не факт, что будет активный стакан, так как выпуск небольшой
78|21.01.2019 16:41:25|Максим Кочнев|Это да поэтому посмотрим
79|21.01.2019 16:41:49|Harry Lime|Будут раздавать по номиналу, можно ради фана взять на купоны от ПЮДМаСветофора немного .
80|21.01.2019 16:42:03|Максим Кочнев|Denis втб по итогу бреет так
81|21.01.2019 16:42:25|Denis Kozlov Septem|По агентурным данным, объем уже расписан в узком кругу ограниченных людей
82|21.01.2019 16:43:02|Harry Lime|Да и фиг бы с ним
83|21.01.2019 16:43:05|Alex Petroff|В ограниченном кругу, иначе люди обидятся
84|21.01.2019 16:43:20|Harry Lime|Не успел...
85|21.01.2019 16:43:20|Alex Petroff|Узкие люди
86|21.01.2019 16:43:28|Harry Lime|Отмороженные
87|21.01.2019 16:43:51|Максим Кочнев|Итак. Звание самого доходного ВДО в моем портфеле перешло от Легиона к акциям мосбиржи. За месяц 18. И год ждать не пришлось заходил на 7 от портфеля . Потихой начал фиксировать
88|21.01.2019 16:44:35|Harry Lime| экономикакитай Число дефолтов по корпоративным облигациям в Китае выросло до рекордного уровня в 2018 году  это новый сигнал проблем на финансовых рынках страны в условиях ослабления темпов экономического подъема.  Fitch Согласно данным Fitch, 45 компаний материкового Китая объявили в минувшем году о дефолте по 117 выпускам облигаций общей номинальной стоимостью 110,5 млрд юаней 16,3 млрд. Рекордно высокими были как количество эмитентов, объявивших о дефолте, так и совокупный показатель номинальной стоимости проблемных бондов, отмечают в Fitch. Львиная доля дефолтов по корпоративным облигациям в материковом Китае пришлась на негосударственные компании  86,7 компаний и 90 от общей номинальной стоимости дефолтных бондов. Также отмечаются сигналы ослабления аппетита к риску среди инвесторов на фоне роста числа корпоративных дефолтов.  Fitch
90|21.01.2019 16:48:20|V F|Время выставления рпс со скольки до скольки
91|21.01.2019 16:50:59|Zuev Aleksandr|URKA  УРАЛХИМ  IPO УРАЛКАЛИЙ ПОСЛЕ ЗАВЕРШЕНИЯ SQUEEZE OUT ЛЕТОМ 2019 Г. РАССМОТРИТ ВАРИАНТЫ ВОЗВРАТА НА БИРЖУ  ОСНОВНОЙ АКЦИОНЕР УРАЛХИМ И УРАЛКАЛИЙ МОГУТ ВЫЙТИ НА БИРЖУ ЕДИНОВРЕМЕННО ДЛЯ СНИЖЕНИЯ ДОЛГОВОЙ НАГРУЗКИ  ОСНОВНОЙ АКЦИОНЕР УРАЛХИМ МОЖЕТ ВОЗОБНОВИТЬ ПРОЦЕДУРУ IPO  ОСНОВНОЙ АКЦИОНЕР УРАЛКАЛИЙ И УРАЛХИМ ИЗУЧАЮТ АЗИАТСКИЕ БИРЖИ ДЛЯ ВОЗМОЖНОГО ВЫХОДА НА НИХ  ОСНОВНОЙ АКЦИОНЕР urka ipo календарь
93|21.01.2019 16:57:31|Why Aye Man|Ранее было сообщение от Дениса, что первичка с 10.00 до 11.30, вторичка с 11.30 до 14.00
94|21.01.2019 16:58:34|Сергей Ковалев| но я подержу до дивидентов
95|21.01.2019 16:59:35|Максим Кочнев|Ну часть я тоже оставлю, продаётся спекуляционная
96|21.01.2019 17:22:00|Denis Kozlov Septem|Скрипт по Ломбарду разослан.
97|21.01.2019 17:22:19|Harry Lime|Акра рейтинг Элемента А , как у Системы.
98|21.01.2019 17:23:12|Denis Kozlov Septem|Клиентам ВТБ просим завтра попробовать позвонить вашему брокеру и пройти по скрипту. Сегодня провели работу с ВТБ, возможно, завтра они смогут принять заявки на вторичке в РПС
99|21.01.2019 17:26:07|Максим Кочнев|А как это может получится Тебя соединяют с брокером а он просто говорит что мы рпс на вторичке не проводим вообще. Всё. Смысл дальнейшего диалога теряется
100|21.01.2019 17:27:42|Denis Kozlov Septem|Берёте контакты и ФИО брокера, который отказал, и сообщаете мне. Я ему звоню и вежливо интересуюсь причиной отказа.
101|21.01.2019 17:28:35|Максим Кочнев|Ок. Но мне сегодня объяснили что они не проводят их просто и все. Типа такой услуги на вторичке не предоставляется
102|21.01.2019 17:28:59|Denis Kozlov Septem|Город Москва Есть контакты брокера
103|21.01.2019 17:29:18|Harry Lime|Это какой то позор...
104|21.01.2019 17:30:09|Евгений|ВТБ такой ВТБ
105|21.01.2019 17:31:33|Максим Кочнев|Ну я звонил просто по горячей линии. С каким соединили с таким соединили. Могу завтра позвонить конечно и передать вам информацию. Но мне как бы прямо сказали. Дело не в желании, бумагах и т. д. Дело в том что этого не оказывается вобще. Т. Е. Бессмысленно говорить о том что они не осуществляют
106|21.01.2019 17:31:37|Евгений|Я ни Светофор ни Рояль не смог взять почеловечески через них. Вот и сейчас проверю. Часть портфеля уже перевел на БКС, чувствую, к весне окончательно попрощаемся
107|21.01.2019 17:34:44|YK911|Денис, пришел скрипт на почту по ломастеру, смотрю время приёма заявок на втричке сдвинулось до 1245  1430
108|21.01.2019 17:35:43|Aleksei Tuv|Только что позвонил трейдерам в втб сказали рпс не делаем три раза повторил. ФИО не спрашивал
109|21.01.2019 17:38:02|Denis Kozlov Septem|Сначала первичку проведем, потом вторичку. Можете на вторичке в РПС поставить заявку раньше, если брокер примет
110|21.01.2019 17:38:32|YK911|Ок, спасибо. Решил уточнить на всякий
111|21.01.2019 17:42:47|Denis Lentyaev|Такая же история, сказали, что с РПС работают только по первичке
112|21.01.2019 17:51:43|Harry Lime|Похоже уже можно ставить в эфир для ВТБброкер песню группы НОМ 7 процентов.
115|21.01.2019 18:03:17|Sergey Sidorov|ВТБэшный персонал действительно очень тугой. Я в субботу пошел вносить изменения в договор иис, чтобы купоны/дивиденты оставались на брок.счете. Так это потребовало участие аж 3 менеджеров. И это г.Москва и благополучный район. По телефону думаю вообще, кто в лес, кто по дрова.
116|21.01.2019 18:06:20|Дмитрий Адамидов|Много не набирайте главное это последний год с дольщиками, теперь через год полтора на самом деле будут совсем другая реальность. У ПИКа ещё фонд ренвации взял 200 тыс квадратов. Поддержал неплохо, хотя и не критичный объем. Но как там дальше пойдет  вопрос не очевидный для меня
117|21.01.2019 18:07:45|Aleksandr|я знаю обратный пример
118|21.01.2019 18:09:45|Евгений|ВТБ мне кажется очень слабым в плане пофессионализма сотрудниковброкеров. Все подразделение создано на основе ВИПотделов, основные клиенты  бывшие депозитчики банка ВТБ24, люди не особо притязательные и разборчивые в фин услугах. В таких условиях нет особо стимула к активному развитию, да и ЗП по сути, не за что платить. В отличии от тогоже БКС или Открытия, где фин советники упахиваются ради клиентов, работа клиентщика ВТБ сводится к перепрофилированию депозитчиков в инвесторов. Модель вполне рабочая, затрат минимум, бизнес рентабелен. Так что изменения будут наврядли
119|21.01.2019 18:11:49|Aleksandr|А ВТБКапитал  Там как 
120|21.01.2019 18:19:14|Евгений|Это управляющая компания, они как раз и управляют деньгами вчерашних депозитчиков ВТБ24, которых сотрудники уговорили на фондовый рынок. Хорошо или плохо управляют  не знаю, не пользовался услугами. В целом менеджеру ВТБброкер гораздо проще пылесосить действующую розничную базу банка ВТБ и оттуда дёргать клиентов на простейшие продукты  ДУ и ИСЖ, на это бизнес и заточен, и особо развивать чтото нет надобности
121|21.01.2019 18:20:45|Aleksandr|ДУ и ИСЖ продают менеджеры в отделениях.Брокерских отделов нет в регионах.
122|21.01.2019 18:22:22|Евгений|Есть, обычно это одиндва сотрудника на область, они сами прозванивают базу и обучают перброкеров
124|21.01.2019 18:23:46|Aleksandr|Впервые слышу.Из моего опыта , все что не решает отделение  решает Москва. ВТБ капитал так то мощная контора , я не уверен что она депозитчиков только пылесосит.
125|21.01.2019 18:28:57|Евгений|На нескольких обычных випов приходится один с брокеркой, который всех остальных обучает по отделения, ну и сам работает. По поводу мощной конторы  не спорю, в мтллионниках навярняка есть спецы прайвета, но вот в регионах бизнес модель именно такая, какую я описал. Звони депозитчикам, продавай ДУ и ИСЖ, просто и эффективно
127|21.01.2019 18:31:02|Alexey Z|Denis , а рпс заявки на вторичку только голосом или через квик тоже работает Первичка до этого через квик проходила брокер Открытие.
128|21.01.2019 18:41:43|Denis Kozlov Septem|Это у Вашего брокера уточняйте. У всех поразному
129|21.01.2019 18:42:21|Alexey Z|Спасибо.
130|21.01.2019 18:43:11|First Last|в сбере и в открытии не нашел такого раздела. видимо только голосом
131|21.01.2019 18:43:50|Harry Lime| ритейлерырф На российском рынке продовольственного ритейла готовится одна из крупнейших сделок сети Дикси, Бристоль и Красное amp белое объединятся в одну компанию. В ней 51 будет принадлежать Игорю Кесаеву и Сергею Кациеву, бенефициарам Дикси и Бристоля, 49 получит основатель и владелец Красного amp белого Сергей Студенников. Объединенная компания станет третьим по величине продовольственным ритейлером в России после X5 Retail FIVE Group и Магнита MGNT  Ъ
132|21.01.2019 18:45:01|Harry Lime|Много раз говорил ,КиБ готовят под продажу , прибыли там нет.
133|21.01.2019 18:51:29|YK911|Это они после маски шоу решили объединиться
134|21.01.2019 18:53:06|Harry Lime|Не думаю , что это както повлияло , для того , кто работает серьезно с алкоголем маскишоу практически обыденный элемент работы.
135|21.01.2019 18:54:46|YK911|Странное совпадение, вам не кажется 
137|21.01.2019 18:56:10|Harry Lime|Не , а , послать масок конкуренту под новый год  бесценно
138|21.01.2019 18:58:15|YK911|Поживем увидим, но закрыть алкашку на новый год, кто то очень серьезный в деле, имхо
139|21.01.2019 19:02:17|Harry Lime|Вообще ничего сложного. Там операция алкоголь каждый декабрь. Даже обращения граждан отрабатывают.
140|21.01.2019 19:03:38|Ilya|ВТБ. Они не делают вторичку, так как там цена может быть ниже, чем стакан. И эта схема ещё является способом обойти ограничения на объём заявки, они нарушать так не горят желанием. А так нет проблем сделать, ума хватает 
141|21.01.2019 19:15:10|Максим Кочнев|Давайте както определимся что по итогу нам втбшникам делать Вставать с утра в стакан или звонить брокеру снова Или и то и то
142|21.01.2019 19:18:42|Ilya|Забил
143|21.01.2019 19:20:33|Максим Кочнев|Из Лигиона я вывел весь спекулятивный капитал по цене 101.5.последнее дак и по 103. Осталось чётко 3 вот это до осени и просидит
144|21.01.2019 19:20:49|Aleksandr|Легенду никто не видел на улице  Как там они  Переживаю
