|time|user|text
1|17.07.2019 12:14:36|A S|А что за пример голых
2|17.07.2019 12:15:32|Harry Lime|Открытие Холдинг видимо
3|17.07.2019 12:15:37|A S|
4|17.07.2019 12:16:07|Harry Lime|Это даже не голые , это агрессивные эксгибиционисты
5|17.07.2019 12:16:07|Nikolay Pavlov|Вечные  да. А вот именно чтоб срок максимальный был.
6|17.07.2019 12:16:16|Alexey|
7|17.07.2019 12:17:45|Andrey Malyarov|Поясните. Что может быть больше вечности
8|17.07.2019 12:18:06|Harry Lime|Такая картина уже год в стакане СЛТ , и сейчас уровни очень даже высокие , то же бывало и по 9597
9|17.07.2019 12:18:46|Andrey Malyarov|https//www.marketwatch.com/story/thisbondstillpaysinterest280yearslater20190104
10|17.07.2019 12:19:19|Nikolay Pavlov|Это отсутствие срока. Они бессрочные. Хотелось бы найти облигации, погашение которых через 50 лет хотя бы
11|17.07.2019 12:19:46|Mikhail Saratov|https//www.amusingplanet.com/2018/08/the17thcenturybondthatsstill.html
12|17.07.2019 12:20:29|Andrey Malyarov|Так и надо тогда искать с таким сроком. Аргентина, япония, австрия 50 и 100 летние выпуски..
13|17.07.2019 12:20:46|Mikhail Saratov|ха, в комментариях к первой статье линканули вторую 
15|17.07.2019 12:24:48|Ilya|Владислав Деминский 
16|17.07.2019 12:24:57|Pavel Bilenko|да
17|17.07.2019 12:26:03|Alex Petroff|Прошло раскрытие по Дэниколу https//www.edisclosure.ru/portal/event.aspxEventIdT4z9xzCjpke0s255DBYuggBB
18|17.07.2019 12:28:44|Ilya|С точки зрения бизнес модели круто, что сказать, мое почтение, как говорится, найти нужный ход надо уметь.
19|17.07.2019 12:29:52|Alexey|Финавиа 
20|17.07.2019 12:29:53|Harry Lime|Это же мвно
21|17.07.2019 12:31:47|Ilya|Мвно для оптовой продажи смс  я об этом. И только.
22|17.07.2019 12:32:52|Harry Lime|Памятка для облигационера Дени Колл. Одним словом мы купили мвно.
23|17.07.2019 12:35:48|Alex|Я не совсем понял, а в чем ноухау Они покупают смс за дёшево как мвно, а продают клиентам дороже. Разве таких поставщиков мало
24|17.07.2019 12:36:48|Ilya|Мвно вроде как больше нет в таком амплуа... могу ошибаться, критика приветствуется.
25|17.07.2019 12:47:09|Andrey Malyarov|Вчера в блюмберге была интересная статья, как секьюритизированный займ компании, занимающейся переработкой всего и вся, практически за сутки потерял треть стоимости. Сумма займа немаленькая, почти 700 млн долл. Займ из категории с облегченными ковенантами. Debt/ebitda около 6. Причина обвала  сообщение компании о потере 2 крупнейших клиентов. Ну и по классике после сообщения рейтинговые агенства порезали рейтинги. Веселые времена впереди.
26|17.07.2019 12:48:23|Harry Lime|Это обычная история дистресс , сплошь и рядом , надо анализироватт и возможно брать
27|17.07.2019 12:50:04|Andrey Malyarov|До 09/07 это был не дистресс, а leveraged loan. Тот сектор, который бьет рекорды выпуска.
28|17.07.2019 12:53:08|Ilya|Главное правильный ярлык
29|17.07.2019 12:54:13|Andrey Malyarov|Гугл говорит, что на май 2019 объем рынка в сша 1,2 трлн и 80  с облегченными ковенантами. Вспоминается фильм The big short. Вот только сколько времени ждать...
30|17.07.2019 12:55:39|Ilya|Ну вот и топливо подвезли для костра
31|17.07.2019 13:02:17|Alexey|Особенно учитывая что у большинства ebitda то нулевая или отрицательная как в знаменитой сцене Прибыль Туда куда мы направляемся, прибыль не нужна
32|17.07.2019 13:14:40|Lizardking0808|Оставалось 3 штуки финавиа
35|17.07.2019 13:16:36|Nikolay Pavlov|ГОЭЛРО_2 Рынок так ждёт разрешения ситуации с ТГК1 и Форумом, что любую новость в том числе и грядущее ВОСА трактует не иначе как выход фиников. С утра сгоняли на 5 но потом оказалось, что тревога ложная. На самом деле о чем договорились Газпром с Форумом одному богу известно, а может статься так, что вообще ни о чем не договорились, кроме плавного повышения дивидендов.
36|17.07.2019 13:16:46|Nikolay Pavlov|Финики
37|17.07.2019 13:17:13|Lizardking0808|Осво просто феерический способ поиметь воблов. И самое интересное, что теперь ЭТО с нами может проделать любой эмитент
38|17.07.2019 13:17:16|Nikolay Pavlov|patsak9876 ,финики
39|17.07.2019 13:20:50|Alexey|В кейсе псн и без осво послали всех лесом. Пошли вон
41|17.07.2019 13:22:28|Nikolay Pavlov|Проблема будет в тех, кто их не продаст до снятия с торгов, которое, по моему. Гению, обязательно будет до конца следующей недели
42|17.07.2019 13:23:09|Harry Lime|А точно будет новое обязательство , а не облиги
43|17.07.2019 13:28:36|Ilya|Имхо да
44|17.07.2019 13:32:24|Nikolay Pavlov|Да
46|17.07.2019 13:46:20|Екатерина|Это про деникол
47|17.07.2019 13:47:19|Nikolay Pavlov|Про финавиа
48|17.07.2019 13:47:24|Harry Lime|Ну если когданибудь будет новация в нем , то тоже . Почти любая облигация. А сейчас разговор про ФинАвиа.
49|17.07.2019 14:13:20|Alexi|Если оба выпуска скоро прекращаются новацией, то на что рассчитывают эти товарищи
51|17.07.2019 14:19:36|Alex|Там же несколько выплат заложено в ближайшие три года. По этому выпуску как раз по 6, но могу ошибаться
52|17.07.2019 14:22:20|Kir|Сомневаюсь я что дениколл расписан на 1млрд, сколько заберут в первый день Какие ставки
53|17.07.2019 14:22:54|Alexi|То есть соглашение о новации будет подписано не в ближайшие дни/месяцы, а только через 3 года Я полагал, что в теории есть смысл брать только с расчётом на рост цены, а не ради зыбкого купона
54|17.07.2019 14:49:22|Дмитрий Адамидов|100 лет как раз. Говорят в США есть вечные  ж/д компании в 19 веке выпускали
55|17.07.2019 14:49:49|Alexander|добрый день. как ламбуз размещается есть информация
56|17.07.2019 14:49:52|Alex|Нет, новация прямо сейчас. По условиям облигацию меняют на несколько платежей в течении нескольких лет. Роста цены не будет имхо, будет фиксация списка и гэп цены в ноль. Но надо внимательно читать условия
57|17.07.2019 14:52:34|Alex Petroff|Размещается своим чередом. Эмитент ажиотажа со стороны чата не вызвал. Результаты размещения можно узнать по итогу дня на Мосбирже.
58|17.07.2019 14:53:30|Дмитрий Адамидов|а почему ноль ноль будет через три года после выплаты 20 и 6 соотвественно
60|17.07.2019 14:57:18|Alexi|Так а после подписания соглашения о новации новое обязательство будет чем Это будут старые бонды с новыми условиями, новые бонды или вообще не бонды
61|17.07.2019 14:57:39|Дмитрий Адамидов|старые бонды с новыми условиями
62|17.07.2019 15:01:49|Harry Lime|Николай говорит не будет бондов
63|17.07.2019 15:01:54|Alexi|А, теперь понятно. С новацией никогда не сталкивался, но по ГК это вроде как прекращение старых обязательств с заменой из новыми. Поэтому и подумал, что это будет юридически новое обязательство
64|17.07.2019 15:02:36|Дмитрий Адамидов|а чего будет
65|17.07.2019 15:04:42|Nikolay Pavlov|Потому что обязательство новое возникает перед теми, кто был воблом на дату подписания новации. А те, кто после этой даты  перед ними не возникает. То есть бумага будет стоить ноль
67|17.07.2019 15:05:51|Дмитрий Адамидов|ну так а если он продал почему должно исчезнуть право у новых владельцев, если выпуск в обращении
68|17.07.2019 15:05:54|Nikolay Pavlov|У нас тоже вечные теперь есть. В ФЗ о рцб внесли изменения недавно
71|17.07.2019 15:07:14|Дмитрий Адамидов|а где почитать
76|17.07.2019 15:11:06|Дмитрий Адамидов|Ну а разве в прочих соглашениях по новации не также писали
79|17.07.2019 15:13:05|Nikolay Pavlov|Нет. Там меняли условие по бумаге и копеечку платили
80|17.07.2019 15:13:27|Дмитрий Адамидов|ну посмотрим как пойдет это любопытно конечно
81|17.07.2019 15:13:58|Nikolay Pavlov|Мы свидетели исторического события
82|17.07.2019 15:14:09|Дмитрий Адамидов|да уж
83|17.07.2019 15:14:19|Nikolay Pavlov|Такого российский облигационный мир ещё не видал.
85|17.07.2019 15:14:39|Дмитрий Адамидов|а как то оспорить это реально
86|17.07.2019 15:14:48|Nikolay Pavlov|Да
87|17.07.2019 15:15:31|Григорий Мошорин|А можно подробнее что произошло
88|17.07.2019 15:16:21|Alexi|Там в проекте соглашения исполнение обязательства осуществляется на банковский счёт владельца, не через депозитарий
89|17.07.2019 15:16:29|Alex|А зачем им убивать оферту ЮТ, если исполнять ее и так не придется минимум до 2054 года Или это такой задел не будущее
90|17.07.2019 15:18:52|Nikolay Pavlov|Они убивают оферту через исчезновение облиг. Если оставить платежи по облигам, то всегда может быть дефолт. А по новому заемному обязательсву нет оферты.
91|17.07.2019 15:19:49|Alex|Т.е. даже первый платеж можно не выполнить. И оферта ЮТ будет неприменима вообще
92|17.07.2019 15:20:22|Nikolay Pavlov|Верно
95|17.07.2019 15:24:10|Дмитрий Адамидов|купить чтоли финавиа немного и посудиться
98|17.07.2019 15:26:06|Григорий Мошорин|А сколько она стоит
100|17.07.2019 15:26:27|Дмитрий Адамидов|ну пока не 0,01
101|17.07.2019 15:26:39|Harry Lime|Первая 12, вторая 5
102|17.07.2019 15:26:58|Дмитрий Адамидов|а интересно  жалоба в ЦБ поможет или опять через 30 дней ответ ни о чем
103|17.07.2019 15:27:36|Harry Lime|Безусловно, вы понимали и принимали рыночные риски , идите на йух
104|17.07.2019 15:28:31|Дмитрий Адамидов|Николай, а вы бы могли сформулировать сжато правильным языком основные претензии  я бы пост сделал
105|17.07.2019 15:29:07|Harry Lime|У них рыба ответа воблам еще с пересветовских времен сохранилась
106|17.07.2019 15:29:25|Дмитрий Адамидов|ну пообщаться можно и через СМИ если что
108|17.07.2019 15:30:33|Alexey|Погашение Обуви пришло Эх
109|17.07.2019 15:30:45|Дмитрий Адамидов|и не как воблы, а как аналитики  на тему того что мало того что трилион в открываху влили, так ещё и мух не ловят совсем.
110|17.07.2019 15:31:39|Harry Lime|Да можно мониторить
111|17.07.2019 15:32:35|Григорий Мошорин|Купил по одной 
113|17.07.2019 15:32:48|Harry Lime|Помог сидельцу
115|17.07.2019 15:33:43|Григорий Мошорин|Первый выпуск вообще пипец
117|17.07.2019 15:34:03|Дмитрий Адамидов|там уже планка вниз
119|17.07.2019 15:34:30|Harry Lime|Почитайте выше , это собственно нормально.
120|17.07.2019 15:34:31|Григорий Мошорин|Screenshot 17 июл. 2019 г. 153423
122|17.07.2019 15:34:58|Дмитрий Адамидов|когда цена будет 0,01 то доходность будет еще лучше
123|17.07.2019 15:35:34|Harry Lime|Это Бу наверное стоит плитой
124|17.07.2019 15:36:20|Дмитрий Адамидов|не Бу сказал что все продал еще месяц назад
126|17.07.2019 15:36:32|Nikolay Pavlov|Да не, бестолку это все
127|17.07.2019 15:36:38|Harry Lime|Ну хоть один отмучился
128|17.07.2019 15:36:40|Nikolay Pavlov|Надо сидеть и дальше думать как быть 
130|17.07.2019 15:37:48|Harry Lime|Не хочет к нам
131|17.07.2019 15:37:59|Nikolay Pavlov|Открыл первый выпуск ФА. Жесть. Ну, собственно гдето около 0 и должна быть цена
132|17.07.2019 15:40:03|Дмитрий Адамидов|о в первом выпуске плиту съели
133|17.07.2019 15:40:22|Владимир Тутынин|Вопрос по ФА должен быть в тесте на квалификацию инвестора
134|17.07.2019 15:40:49|Дмитрий Адамидов|лучше при приёме в ЦБ
135|17.07.2019 15:42:20|Григорий Мошорин|Ктото скупил 
138|17.07.2019 15:43:19|Дмитрий Адамидов|Гриша признайтесь  это были вы а то ... одну возьму одну
139|17.07.2019 15:44:42|Владимир Тутынин|Одну,  это лотами
140|17.07.2019 15:46:17|Григорий Мошорин|Одну одну,за 161 рубль 
143|17.07.2019 15:48:17|Kregg|В коллекцию 
144|17.07.2019 15:48:39|Nikolay Pavlov|Интересно, а какой смысл покупать первый выпуск
145|17.07.2019 15:48:52|Alexi|В качестве сувенира
146|17.07.2019 15:48:52|Nikolay Pavlov|Второй ещё ладно, там купон 0,01
147|17.07.2019 15:48:57|Григорий Мошорин|Ага
148|17.07.2019 15:49:06|Harry Lime|Завтра будет еще на 40 дешевле
149|17.07.2019 15:49:45|Alexi|Я так понимаю цена дальше не падает изза ограничений биржи
150|17.07.2019 15:50:11|Григорий Мошорин|Налили,ПСБ
151|17.07.2019 15:50:16|Kregg|Настоящему коллекционеру  цена не важна
152|17.07.2019 15:50:20|Harry Lime|Ага
153|17.07.2019 15:50:59|Григорий Мошорин|У меня банкноты,монеты,теперь ещё облигации 
154|17.07.2019 15:51:07|Aleksandr Mukhin|в псб налили
155|17.07.2019 15:51:08|Григорий Мошорин|В детстве значки 
156|17.07.2019 15:51:14|Alexi|То есть 0,01 это реальность если успеют до делистинга
157|17.07.2019 15:51:47|Alex S|кормите, кормите брокеров  они любят комиссию, особенно за покупку чего то ненужного
158|17.07.2019 15:51:55|Владимир Тутынин|Будешь показывать друзьям в квике
159|17.07.2019 15:52:00|Nikolay Pavlov|Даже при 0,01 с купоном я бы вообще не брал. Вот после 31 июля за 0,01 можно
161|17.07.2019 15:54:06|Григорий Мошорин|Ага 
165|17.07.2019 16:15:55|Nikolay Pavlov|Я так татфондбанк ловил
166|17.07.2019 16:20:04|Alexi|Я рассматриваю кейс на покупку исключительно в целях самообучения. Лучше пройти через это на одном лоте, чем в крупной позиции.
167|17.07.2019 16:21:55|Nikolay Pavlov|Так это ж совсем не те ощущения
168|17.07.2019 16:22:28|Alexi|Ну сначала надо на кошках потренироваться
169|17.07.2019 16:25:51|sergei begreater|ПРЛизинг по 100 кому надо
171|17.07.2019 16:34:10|Alexander|И этих горе бизнесменов просят не кощмарить. В открввашку влили бабла , никто не отвечает, ОХ также рестракт провел и всё. хотя уж какие люди были в акционерах этого ОХ. Даже Алекперов. Кинул всех холдинг. так и ютейр этот. самолеты есть перевозки есть бабло рекой течёт плати. Бизнесмены мать их
172|17.07.2019 16:35:35|Harry Lime|Да я вот и на погашение Инфовотча поглядываю с подозрением. Медийные персоны по опыту оказываются куда более толерантными к кидку облигационеров
173|17.07.2019 16:38:10|Alexander|news РФ выпустит ОФЗ на 212 млрд.руб что бы покрыть убытки Связьбанка РЕЙТЕР
174|17.07.2019 16:38:25|Mikhail Saratov|
175|17.07.2019 16:38:30|Alexander|из той же серии новости
176|17.07.2019 16:41:59|Dima|праведный гнев ....
177|17.07.2019 16:45:03|Виталий B|Про Касперскую
178|17.07.2019 16:45:31|Harry Lime|Ага
179|17.07.2019 16:47:00|Виталий B|Думаю норм будет. Всётаки IT продукт, репутация, Ашманов и все дела 
180|17.07.2019 16:47:56|Максим Кочнев|Из серии у них же Сургут и нао
181|17.07.2019 16:48:47|Harry Lime|Сколько людей , столько и мнений
182|17.07.2019 16:51:43|Виталий B|Сам в IT работаю. Не могу представить, что бы софтверная контора обанкротилась. Слишком хорошая маржинальность. https//i.imgur.com/T9UjHAS.png
183|17.07.2019 16:56:19|Harry Lime|В России платят по бондам по желанию , а не по возможности. Привыкайте. Фин Авиа вам в помощь.
186|17.07.2019 16:57:39|Alexey|Вот и дилемма. Думаю продам после предпоследнего купона
187|17.07.2019 16:58:02|Harry Lime|Тем более дорого , есть куда более доходные инструменты
188|17.07.2019 16:58:11|Mikhail Saratov|софтверная контора банкротится очень легко
189|17.07.2019 16:58:27|Alexey|Факт. Слт бы тоже подрезать думаю еще
190|17.07.2019 16:58:28|Mikhail Saratov|23 месяца провала в поступлениях и к тебе приходят за налогами, сборами  физики с их зарплатой
192|17.07.2019 16:59:41|Виталий B|Логику не прослеживаю. После банкротства что она будет дальше делать Фамилию оставила для бренда, не вижу причин терять репутацию для них. Поглядим, посмотрим.
193|17.07.2019 17:00:33|Harry Lime|Не будет никакого банкротства. Посмотрите на Финавиа , легко и непринужденно проголосовали на ОСВО и швырнули воблов
194|17.07.2019 17:01:02|Alexey|Псн еще круче. Даже осво провалили и ничего  домики строяться
195|17.07.2019 17:01:06|Harry Lime|Потерь для репутации ноль
196|17.07.2019 17:04:22|Виталий B|Если есть связи, отзыва не будет. Как реально у них с договорённостями нет информации.
198|17.07.2019 17:04:50|Harry Lime|Не будет никакого отзыва
200|17.07.2019 17:06:16|Alexey|Армада. По сути техносерв как пример тоже де факто
201|17.07.2019 17:09:19|Alexi|По кармани прошло раскрытие одобрение займов акционера на 50 млн руб. 7 займов. Опять кэш уплывает https//www.edisclosure.ru/portal/event.aspxEventIdMyogFnlvzkW5Cl9HApI9dABB
202|17.07.2019 17:09:38|Alexey|Ваше мнение  в выпусках значительно превышающих метрики клиента и разумный его капекс условно  шанс что 75 процентов сразу откладывают для осво
204|17.07.2019 17:10:21|Mikhail Saratov|да, выборка по 62 оквэду среди банкротов 
206|17.07.2019 17:10:38|Alexi|Эмитенту владелец даёт
207|17.07.2019 17:11:02|Harry Lime|Это факт , но не совсем так , эти 75 эмитент оплачивает афилятам , а потом использует для кидка
208|17.07.2019 17:11:24|Mikhail Saratov|большинству на бренд и репутацию наплевать, к сожалению. А запаса на кассовый разрыв никто не держит. Либо в кредиты ныряешь, либо сливаешь ОООшку, выводя персонал на новую
211|17.07.2019 17:15:32|Alexey|Дождемся ли такого у нас
213|17.07.2019 17:15:40|Максим Кочнев|Айти любые рисковпнные. особенно если в долг
214|17.07.2019 17:15:59|Alex Petroff|Все норм. Обсуждение эмитента.
215|17.07.2019 17:18:41|Виталий B|Облигации обсуждаем  Я чутка другое вкладывал в понятие software  это подобие продуктовых компаний аля microsoft, Kaspersky и т.д. продающих лицензии воздух. Я бы держал инфовотч до погашения, но цена до 103 выросла, пришлось продать.
217|17.07.2019 17:38:42|S.P.|По софтлайну всё таки налили сегодня. 0.5
219|17.07.2019 18:58:01|Leonidas|Сейчас нас начнут банить... Так что пора в Друзя.
221|17.07.2019 19:03:35|Leonid|Посоветуйте плиз надёжные бонды в евро под 23 к погашению, с минимальным лотом 1000 евро
222|17.07.2019 19:05:04|Alex|скоро появятся такие, правда под 2
