|time|user|text
1|14.06.2018 13:42:17|Konstantin Permyakov|Пенсионную реформу объявили
4|14.06.2018 13:46:07|Alex Petroff|Радуемся молча...
5|14.06.2018 13:46:08|Alex Petroff|ГосДума после завершения реформы социальная пенсия по старости будет назначаться женщинам не в 60 лет,а в 68 лет. Мужчинам  не 65 лет, а в 70 лет.
6|14.06.2018 13:46:48|K G|замечательно
7|14.06.2018 13:47:44|Alex Petroff|Жаль, что в то время прекрасное, жить не придется ни мне, ни тебе
8|14.06.2018 13:48:18|Anatoly|вотвот, до завершения реформы тут половина помрёт
11|14.06.2018 13:51:25|Harry Lime|Я же обещал рестракт пенсии, получите.
12|14.06.2018 13:51:45|K G|а голосование будет ОСВО
13|14.06.2018 13:52:04|Konstantin Permyakov|Голосование было
14|14.06.2018 13:52:06|Harry Lime|В думе сидит ПВО.
15|14.06.2018 13:52:12|K G|ПВО номинал
16|14.06.2018 13:52:18|Konstantin Permyakov|Все согласились
17|14.06.2018 13:52:24|K G|76  согласились
18|14.06.2018 13:52:27|Anatoly|Ещё до Харри я без проблем верил обещаниям Алексея Леонидовича
19|14.06.2018 13:52:30|K G|интересные совпадения да
20|14.06.2018 13:54:35|Harry Lime|2034  это они как раз к погашению Пересветов, а что , хорошая прибавка к пенсии.
21|14.06.2018 13:55:39|Anatoly| ловим писят концов к 34му
23|14.06.2018 14:19:39|Konstantin Permyakov|Старику Донни сегодня 72. Теперь ясно кто виноват в повышении возраста
24|14.06.2018 14:20:51|Harry Lime|Кстати коегде читаю , что будет отменён налог на движимое имущество , только для юриков интересно.
25|14.06.2018 14:25:47|K G|там где читал, говорилось про юриков
26|14.06.2018 14:26:43|Harry Lime|Бентли и Майбахи косяком пойдут на конторы...
27|14.06.2018 14:26:44|Anatoly|а для физиков немного жареного о челябинском стройкомплексе и основателях Флай Плэнинг, Академии финансов и биржи и ОКИнвест http//uraldaily.ru/politika/fevral/09/soskuchilispomne
28|14.06.2018 14:29:18|Harry Lime|Примерно так выглядит стройка и ее бенефициары в любом регионе.
29|14.06.2018 14:34:12|Morkoy|Там штрафы же больше
30|14.06.2018 14:34:21|Anatoly|о чём не мешает помнить потенциальным облигационерам девелоперов
31|14.06.2018 14:35:21|Harry Lime|Рожи как наши, не отличишь.
33|14.06.2018 14:37:42|Anatoly|Здесь вопрос не о стройке даже, с ней ясно, а о том, кто и как идёт в наш любимый рынок, воблов обольщать
34|14.06.2018 14:38:05|Konstantin Permyakov|И ещё подарок Донни
36|14.06.2018 14:38:49|Harry Lime|А банкиры местные  вообще песня.
37|14.06.2018 14:46:47|Anatoly|увы, джанкоманам остаётся уповать на божий промысел и неимоверные усилия Дениса
38|14.06.2018 14:53:08|Harry Lime|Меня больше интересует Церих и птенцы гнезда его , непонятно существующий ли в реальности Директлизинг, Ред Софт, теперь вот Мясничий. Тоже рефинанс кредита наверное, куда ему 100 млн с 25 магазами.
39|14.06.2018 14:55:06|Alex|А что с редсофтом У госкормушки плотненько сидит вроде
40|14.06.2018 14:56:28|Harry Lime|Зачем ему 100 млн раз , при падающей выручке, без нового займа он первый не отдаст два.
43|14.06.2018 15:05:21|Alex Petroff|ЕЦБ объявил планы сворачивание QE  ЕЦБ УСТАНОВИЛ КЛЮЧЕВУЮ СТАВКУ НА УРОВНЕ 0,0, ПРОГНОЗ 0,0  ЕЦБ УСТАНОВИЛ ДЕПОЗИТНУЮ СТАВКУ НА УРОВНЕ 0,40  ЕЦБ ПРОДОЛЖИТ СКУПАТЬ АКТИВЫ ПО 30 МЛРД ЕВРО В МЕСЯЦ ДО КОНЦА СЕН 18Г  С КОНЦА СЕНТЯБРЯ ЕЦБ СОКРАТИТ ЕЖЕМЕСЯЧНУЮ СКУПКУ АКТИВОВ ДО 15 МЛРД ЕВРО ДО КОНЦА ДЕКАБРЯ  С КОНЦА ДЕКАБРЯ СКУПКА АКТИВОВ ПРЕКРАТИТСЯ  ЕЦБ ОЖИДАЕТ, ЧТО СТАВКИ БУДУТ НАХОДИТЬСЯ НА ТЕКУЩЕМ УРОВНЕ КАК МИНИМУМ ДО ОСЕНИ 19Г ИЛИ ТАК ДОЛГО КАК НЕОБХОДИМО Чёткое обещание, что до следующей осени ставки меняться не будут, вызвало позитивную реакцию в облигациях и негативную в евро. Долговые рынки реагируют падением доходности, курс евро/доллар резко пошёл вниз.
44|14.06.2018 15:06:58|Anatoly|чиво это может и канало бы, если б все эмитенты были как директ  т.е. церих. что насчёт остальных очень сомнительно.
45|14.06.2018 15:10:06|Harry Lime|Без теории заговора скучно жить. Я думаю Церих вывалит ещё несколько эмитентов такого плана. Они могут как угодно кредитовать друг друга и кидаться деньгами между собой и бенефициаров может быть много.
46|14.06.2018 15:16:18|Anatoly|Без теории заговора скучно жить. это точно, их можно придумывать сотнями например, у Харри, как у opinion makera чята, есть договорённость  с Денисом на топилово конкурентов септема и поддержание к септему интереса that was easy
47|14.06.2018 15:16:39|Harry Lime|Безусловно
49|14.06.2018 15:17:41|Denis Kozlov Septem|Блин, раскусили. Всё пропало, шеф
50|14.06.2018 15:18:08|Anatoly|теории заговора, они такие
52|14.06.2018 15:18:38|Harry Lime|Я просто излагаю вероятности. Она к сожалению есть. И это совершенно не значит, что не надо в этом участвовать.
55|14.06.2018 15:28:46|А что ты сделал для котэ!?|вестисполейАрмагеддонщины В ответ на заявления ФРС ЕЦБ сказал, что не будет менять ставки до лета 2019 года. Что удивительно, ибо раньше они действовали с ФРС боеле или менее синхронно. Далее по классике рост разрыва в процентных ставках означает что доллар будет дешеветь по отношению к евро. Но мне кажется, что отказ от синхронизации денежнокредитной политики имеет более важное символическое значение США уже не только в военном, но и в экономическом отношении снимает с себя бремя мирового лидерства. И из доллара похорошему надо выходить. Правда большинству игроков в трежеря и американские бонды выходить некуда  масштабы несопоставимы.
56|14.06.2018 15:29:25|А что ты сделал для котэ!?|Если ставки по баксу выше чем по евро  по идее бакс должентрасти к евро ... не
57|14.06.2018 15:29:57|Harry Lime|Именно
58|14.06.2018 15:31:14|Дмитрий Адамидов|в краткосроке  да. но при долгосрочной сбалансированности как раз наоборот. Разница в ставках нивелируется разницей в движении валют
60|14.06.2018 15:34:05|Harry Lime|Я ж говорю  заявления самоуничтожились и теперь все будет ходить туда сюда на очередных хайпах. Выходах из еврозоны или импичментах Трампа .
61|14.06.2018 15:34:56|Дмитрий Адамидов|нене, хайп сам по себе, а вот разбалансировка рынка  это серьезно
64|14.06.2018 15:37:22|Harry Lime|Драги надо было не переукрепить евро , но и не обвалить , сказал бы поднимаем ставку с декабря  был бы евро/доллар 1,25 уже.
65|14.06.2018 15:38:51|Дмитрий Адамидов|ну возможно. меня больше беспокоит момент начала веселья в США. Явно что оттуда начнутся приключения
68|14.06.2018 15:58:35|J T|Дим, сделал небольшой комментарий к твоей записи
69|14.06.2018 15:58:35|J T|К предыдущему посту хотелось бы добавить, что действительно, в средне и долгосрочной перспективе изза разницы форвардных курсов доллар действительно будет дешеветь к евро. В краткосрочной же скорее более важным фактором выглядит керри и разница в доходностях в пользу долларовых инструментов. А также, безусловно, лаг в сворачивании QE  доллары уже изымаются из системы, а евро только планируют начать изымать. Да и экономика США пока что в среднесрочной перспективе выглядит более устойчивой, чем экономика еврозоны.
70|14.06.2018 16:00:56|Дмитрий Адамидов|о надо подписаться
71|14.06.2018 16:01:33|J T|Ну я там свои мысли редко пишу, чаще стараюсь просто репостить более умных людей
74|14.06.2018 16:02:40|Дмитрий Адамидов|
75|14.06.2018 16:03:13|J T|И да, никакой крипты и банкстеров конечно же
76|14.06.2018 16:57:49|А что ты сделал для котэ!?|Итак, на предыдущих занятиях нашего курса Английский с Марио мы уже хорошо усвоили такие слова, как resilience и convergence . Сегодня у нас для вас совсем новое слово Unanimous . Unanimous йунанимуус  единогласный.
78|14.06.2018 16:57:56|А что ты сделал для котэ!?|Закрепим на примере Traders have unanimously decided that Euro is fucked up after the ECBs statement. Трейдеры единогласно решили, что пора валить из евры после заявления ЕЦБ.
79|14.06.2018 16:59:35|Harry Lime|Да, движняк пошел , 1 процент уже есть.
81|14.06.2018 17:06:56|K G|https//www.moex.com/ru/contract.aspxcodeED6.18
85|14.06.2018 17:07:00|K G|я правильно посчитал
87|14.06.2018 17:25:23|Deleted Account|Нет, надо в табличке все считать
88|14.06.2018 17:27:05|J T|Нет, они ж каждый день новые
89|14.06.2018 18:19:52|Oleg Lvov| ой я умер сейчас  утираю слезу, JT  супер 
90|14.06.2018 18:20:25|K G|король умер да здравствует король
91|14.06.2018 18:20:31|J T|
92|14.06.2018 18:20:42|K G|10 тем временем
93|14.06.2018 19:01:37|Сергей Ковалев|ндс 20... дожили
94|14.06.2018 19:02:20|Morkoy|европейский опыт....
95|14.06.2018 19:05:31|Сергей Ковалев|инфляуия вырастет, все подорожает и инвемтиционный климпт ухудшится если они не понизят с 30 взносы в фонды работадателей, то бизнес побежит из России...
96|14.06.2018 19:10:30|Harry Lime|Климат инвестиционный ухудшится , ага , да все умерло уже малое и негосударственное , сдохло и разложилось. Куда бежать то...
97|14.06.2018 19:11:44|Дмитрий Адамидов|Да, климат уже никого особо не беспокоит
99|14.06.2018 19:12:03|Harry Lime|Кого может беспокоить климат на кладбище
100|14.06.2018 19:12:16|Дмитрий Адамидов|ну копать неудобно если грунт мерзлый
101|14.06.2018 19:13:45|Harry Lime|Вообщем так грустно не было ни в 2008 , ни в 2014м , а разница простая , надежды не стало никакой.
102|14.06.2018 19:14:06|Дмитрий Адамидов|Это просто возраст
104|14.06.2018 19:15:36|K G|Надо делать гос контракты и не париться
106|14.06.2018 19:16:19|Harry Lime|Да дело не в зарабатывании денег , за державу обидно.
107|14.06.2018 19:16:44|Дмитрий Адамидов|Чтото мне после Сочинской эпопеи не очень хочется связываться с государством. Более мерзкого контрагента трудно сыскать. Еще и подставит в случае чего
108|14.06.2018 19:17:10|Morkoy|ну народ доволен, стабильно голосует
109|14.06.2018 19:19:33|Oleg Lvov|Бизнес побежит из Россиикуда он побежит, если его посадят . Купипродай бизнес, а в РФ не под государством остался именно такой, проиграл ebay, aliexpress и прочим вебсайтам уже лет 8 как. Наоборот, скажем спасибо понижению беспошлинности до 100 евро и созданию возможностей родственникам чиновников по купипродай. Высокий уровень доходов обеспечивает только монопольный или квазимонопольный бизнес. У них IP, в РФ ресурсы. Для перехода в РФ к IP кмк изменения должны быть такого масштаба, что я скорее поверю в то, что старик Трамп обрядится в рубище и уйдёт в монастырь Афон добровольно.
110|14.06.2018 19:24:47|Harry Lime|Когда грустные мысли такого плана находят , я беру свой альбом с бонами разных правительств времён гражданской войны , поверчу , поддержу в руках и знаете , отступает , ибо нефиг.
111|14.06.2018 19:24:58|Дмитрий Адамидов|
114|14.06.2018 19:26:53|Oleg Lvov|Красивый 
115|14.06.2018 19:27:09|Сергей Ковалев|https//vk.com/wall23482909_1181362
116|14.06.2018 19:27:38|Harry Lime|Удивляет , как они успели их столько разных наклепать за какихто пару тройку лет.
117|14.06.2018 19:29:15|Nikolay Pavlov|
118|14.06.2018 19:45:58|Oleg Lvov|У Ротбарда читал про то что конфедератские штаты наклепали банкнотов тоже много. У него паноптикум был ну для общей мысли про золотой стандарт. А по ГВ в те годыачотакованалог эмиссией, дело для комиссара любого цвета очень милое. Мне вот интереснее, придётся ли племянникам объяснять выражения пустить в расход и к стенке из той поры, надеюсь они уже не будут понимать о чём это, как мыоктябрята.
119|14.06.2018 20:00:28|Alex|Неужели 98 был хуже, или 91
121|14.06.2018 20:02:04|Harry Lime|В 98 было весело, 91 помню смутно , зато хорошо помню октябрь 93 го.
122|14.06.2018 20:04:28|Oleg Lvov|Весело было 2 января 1992го. Прихожу в столовую, вижу ценники на всё на 30 или около того выше. Мелкий был, но запомнил.
123|14.06.2018 20:06:52|Alex|Интересно именно узнать о вложения в финансовые инструменты в начале 90ых. Например как бывшие граждане СССР повалили на американские биржи, если повалили вообще.
124|14.06.2018 20:07:43|Harry Lime|НГХ жжот , ему пред,явили 4 серии 3 214 304 бумаги , он обязался купить 250 000 штук  коэффициент 0,077777... , купил внимание 140 584 бумаги. Вот как с ним быть.
128|14.06.2018 20:20:35|Deleted Account|А как он выбирал эти 10 
130|14.06.2018 20:21:19|Harry Lime|Конечно, я других вариантов не вижу , остальным можно сказать , что заявок не было или они были выставлены неверно.
132|14.06.2018 20:32:01|Oleg Lvov|Тут такое делобывшие граждане СССР, кроме самых умных, держали свои сбережения в сберкассе в рублях. Уже к 1990му инфляция была двузначнойа 1991й просто всё распылил. Самые прошаренные занимались сделками безнал в нал с 1987 г.это всё криминал был. Кто поднялся на совместных предприятиях и кооперативах, вкладывался во всё подряд, если хотелось экшена. Если не хотелось, многие переезжали, мне в США так и сказали бывшие русскиепапа заработал столько денег что понял что его убьют. Дочка изучала как раз Фабоцци кстати  массовые инвестиции шли в пирамиды, которые крышевали властине в американскую биржу.
134|14.06.2018 21:06:16|Alex|А была ли техническая возможность вообще идти на американский рынок и инвестировать в доллар, живя в РФ начала 90ых. В СССР ведь мечтали о долларах, но низя, а тут бах и границу открыли, покупай  не хочу. К тому же минимум криминала, честная доха.
135|14.06.2018 21:07:01|Harry Lime|Я первый раз доллар увидел в 1994м году.
136|14.06.2018 21:14:57|Oleg Lvov|Порядки в позднем ссср были очень непрозрачные. До 1988 г. всё что связано с валютой было в цепких руках государства. После был полный бедлам. Стрелецкий в книге пишет что они у многих чиновников нашли запрещённые валютные счета, у Шохина например. Минимум криминала честная дохапонимаете, тогда другое отношение было к криминалу и доходности. Я был совсем мелкий, но например РТСБ на мясницкой видел. А там оказывается стояли кидалы прямо у входа. Никому не была нужна доха 6 в валюте в год. Упакованные люди на распиле госимущества делали столько в неделю. Неупакованные сажали картошку и кормились с огородов. Хуже всего было в воинских частях, особенно на острове Русский. Ну фильм Брат1 он довольно правдиво показал. Мне это время не нравилось тогда и не нравится сейчас. Самой популярной инвестицией за рубеж была покупка недвижки в Испании.
137|14.06.2018 21:23:47|Alex|Интересно
139|14.06.2018 21:39:58|Oleg Lvov|Нет, массово 300 валютных годовых масштабных сейчас на госимуществе не поднять. Сейчас присмотр от конторы и просто распилить вчёрную невозможно. Вы не думайте, что это тогда было легко и в бесконфликтном пространстве происходило бандиты тогда не прятались и стреляли активно. Сейчас надо выстраивать структуры с ролями, поэтому и таких людей как Шестун убирают, это всё индивидуальный пошив теперь. Но быстро, околозаконно и масштабноgt только землякормилица. Реновация, метроподряды, ну ещё будут дороги.
140|14.06.2018 21:41:45|Sergey|только по 100 нашел
142|14.06.2018 21:46:17|Harry Lime|Значит откат.
143|14.06.2018 21:49:28|Sergey|Видимо, если эмитент не может разместиться по 100, то на вторичке точно никто брать не будет
145|14.06.2018 22:12:00|Harry Lime|Завтра buy.
146|14.06.2018 23:35:24|Giovanni Goudini|Это мфо
148|14.06.2018 23:36:09|Sergey|Это ломбард, как я понимаю
149|14.06.2018 23:36:32|Harry Lime|Лизинг
153|15.06.2018 01:29:27|Oleg Lvov|Мясо, бензин, зерноэто почти нефтьалмазинвест
154|15.06.2018 08:01:50|А что ты сделал для котэ!?|Странно, что эти парни не написали в меморандуме, что американский то голдман  сосет, а они  нет 
155|15.06.2018 08:05:19|Harry Lime|Ритейл родимый. Выручка 548 млн на 25 магазинов , верю, рентабельность 30 процентов  на своем мясе частично , верю. В меморандуме про прибыль ни слова. Дальнейшее масштабирование сети под большим вопросом , тк выручка и рентабельность каждого следующего магазина будет скорее всего падать. Поэтому развивать дальше планируют по франшизе. Основной вопрос снова  на что деньги
156|15.06.2018 09:36:49|Kir|USDRUB  MORGAN ШОРТАНУЛ Morgan Stanley went short USDRUB at the NY close on Thursday, with a stop at 64.20 and a target of 59.50. пожелаем банку удачи 
157|15.06.2018 09:37:06|Kir|Мне бы такую увереность
158|15.06.2018 09:37:15|Harry Lime|Морган , продай мне по 59,5
159|15.06.2018 09:37:46|Nikolay Pavlov|Это они ждут доллар по 59.50
160|15.06.2018 09:37:51|Harry Lime|Ага
161|15.06.2018 09:38:26|Nikolay Pavlov|Ммммммммм, то есть не надо в обменник пока идти, если им следовать
162|15.06.2018 09:38:50|K G|надо идти в обменник и сдавать баксы
163|15.06.2018 09:39:59|Nikolay Pavlov|Я прикупить хотел. Теперь посижу, посмотрю
164|15.06.2018 09:40:31|Harry Lime|Есть вероятность прохода до 60 , мундиаль всётаки.
