|time|user|text
403|01.06.2019 21:32:57|А что ты сделал для котэ!?|Какие мысли про УОМЗ По отчетности ЧД/ЕБИТДА  около 5 Купон по новому 3 летнему выпуску 9.75
404|01.06.2019 21:33:57|Sergey Sidorov|Это хто  уомз
405|01.06.2019 21:34:10|Shamtu|В общем если цель держать часть депо в долларах, то имеет смысл на обычном брокерском счёте покупать. Правильно
406|01.06.2019 21:34:28|Шура SiberianRanger|Да.
407|01.06.2019 21:34:40|Shamtu|Текущая получается 7.1
409|01.06.2019 21:37:09|А что ты сделал для котэ!?|Уральский оптихомеханический завод Читаю их отчет  погравилось Создана уникальная, не имеющая аналогов в мире, система управления залповым огнем для вертолета Ка52.
410|01.06.2019 21:40:18|Sergey Sidorov|Понятно Ждем ракету с термоядерным двигателем на DMC. А че, кроме нас ее никто не профинансирует, а мультик отрабатывать надо
414|01.06.2019 23:02:48|MrSmith|Never say never. На прошедшей неделе Московский кредитный банк предоставил отчетность по международным стандартам, которая отразила не самые лучшие результаты. Я не собирался уделять этому внимание, если бы не уважаемые читатели. Многих насторожил сильный отток корпоративных депозитов с начала года и ускорение процентных расходов, опередившее по темпам роста динамику доходов. В результате банк показал слабую процентную маржу и рентабельность бизнеса относительно капитала. Естественно не очень приятный момент и хочется задать вопросы со стороны, что произошло На конференц звонке как обычно выступали топ менеджеры и всё разложили по полочкам. Перечислю основные моменты, которые запомнились  Отток корпоративных депозитов обеспечил один пенсионный фонд, не имеющий больше права держать денежные средства согласно регуляторным требованиям.  Отток был компенсирован притоком розничных депозитов, однако повышение ставок во втором полугодии 2018 оказало негативное влияние на стоимость фондирования.  Низкая процентная маржа также связана с созданием резервов на одного крупного клиента происходит смена собственников.  На вопрос ожидаются ли ещё такие крупные резервы  ответ нет. Но как говорят в жизни never say never  добавил топ менеджер.  Крупные убытки по валютным операциям произошли изза укрепления рубля. Кроме того, банк активно размещал валютные облигации, поэтому их переоценка также внесла временный неприятный вклад в общий результат. мбк отчетность
415|01.06.2019 23:03:29|MrSmith|Так что свом по 99 неспроста
417|01.06.2019 23:46:26|Потапыч|Чего то не понял про ИИС Игорь Иванович чего натворил
419|01.06.2019 23:52:47|BoRo DA|Ноги Сечина и тут засветились
422|02.06.2019 00:20:58|Sergey Tokarev|Never say never. На прошедшей неделе Московский кредитный банк предоставил отчетность по международным стандартам, которая отразила не самые лучшие результаты. Я не собирался уделять этому внимание, если бы не уважаемые читатели. Многих насторожил сильный отток корпоративных депозитов с начала года и ускорение процентных расходов, опередившее по темпам роста динамику доходов. В результате банк показал слабую процентную маржу и рентабельность бизнеса относительно капитала. Естественно не очень приятный момент и хочется задать вопросы со стороны, что произошло На конференц звонке как обычно выступали топ менеджеры и всё разложили по полочкам. Перечислю основные моменты, которые запомнились  Отток корпоративных депозитов обеспечил один пенсионный фонд, не имеющий больше права держать денежные средства согласно регуляторным требованиям.  Отток был компенсирован притоком розничных депозитов, однако повышение ставок во втором полугодии 2018 оказало негативное влияние на стоимость фондирования.  Низкая процентная маржа также связана с созданием резервов на одного крупного клиента происходит смена собственников.  На вопрос ожидаются ли ещё такие крупные резервы  ответ нет. Но как говорят в жизни never say never  добавил топ менеджер.  Крупные убытки по валютным операциям произошли изза укрепления рубля. Кроме того, банк активно размещал валютные облигации, поэтому их переоценка также внесла временный неприятный вклад в общий результат. мбк отчетность
423|02.06.2019 00:21:36|Sergey Tokarev|расшифруйте кто как видит, я криминала не заметил
424|02.06.2019 00:28:30|Alex Sha|Финам пишет, что финальная ставка 9,4. Начальный диапазон был 9,5...9,75.
425|02.06.2019 00:46:30|Ilya|Никакого криминала  все как обычно. Менеджеры за зарплату и бонусы играют чужими деньгами. Им вообще то все равно на лосей. Будет плохо, заплатят как обычно, хорошо  будет премия. Порочный подход.
427|02.06.2019 07:44:30|Harry Lime|Вы нарушили главный базовый принцип сообщества , а именно взаимоуважение . Прощайте.
428|02.06.2019 08:26:02|Alex Petroff|Исполнено.
429|02.06.2019 08:27:49|Aleksandr|чо я пропустил
430|02.06.2019 08:28:47|Leonidas|Не стоит внимания. Пример полной деградации.
431|02.06.2019 08:28:48|Максим Кочнев|Да я даже с факи удалил
432|02.06.2019 08:29:12|Aleksandr|Имя деграданта хоть скажите
434|02.06.2019 08:31:14|Шура SiberianRanger|Он там есть. В Друзя зайдите, там есть обсуждение.
435|02.06.2019 08:31:23|Aleksandr|Блин, вас нельзя даже на полдня оставить.Опять чото случилось 
436|02.06.2019 08:41:41|Kregg|Тогда  в организаторы 
437|02.06.2019 08:53:37|Елена Филякина|Кокой полдня, глаз нельзя смыкать 
438|02.06.2019 09:08:01|MUSTACHAN|Подкат не удался
439|02.06.2019 09:08:25|Harry Lime|МКБ ни разу не подарок. Это нужно понимать и отдавать себе отчет. Я в их облигах давно и видел и не такое в отчетности. 7 запросто не бывает. Поэтому лимиты , лимиты и еще раз лимиты. А самое главное у нас в чате есть кому задать вопросы по облигам МКБ , если они возникнут.
441|02.06.2019 09:11:17|А что ты сделал для котэ!?|А кредит Европа Смотрю на 11ю доху которая, правда, не растёт и никак не могу понять, это рынок перестраховывается на турецкую маму и не эффективен или наоборот рынок прав и надо соскакивать с бумаги, пока не поздно
442|02.06.2019 09:12:52|Harry Lime|Я когда начал покупать евробонды , мне и в голову не приходило , что они когдато были номинал и выше. ТМК тот же годами был по 8590 с купоном 5. Да чего там , Полюс20 был 9294 пять лет назад.
445|02.06.2019 09:48:53|Александр Кучеренко|Harry подскажи пожалуйста Еврооблигация Veb23, если купить и держать более 3х лет, валютной переоценки не будет 
446|02.06.2019 09:52:09|First Last|Я хоть и не harry, но главное тут 3 года, а не эмитент Налог не удерживается в случае отнесения еврооблигаций к ценным бумагам, обращающимся на ОРЦБ согласно ст.280 НК РФ, владения ими более 3х лет и выполнении других условий, указанных в ст.219.1 НК РФ см. письмо Минфина РФ от 01.09.2016  030406/51247 . https//www.moex.com/s453
447|02.06.2019 09:55:32|Александр Кучеренко|Да, этот закон я читал Рассматривал гтлк24 Но этой бумаге не нашёл в списках значит она попадает под переоценку
449|02.06.2019 09:56:37|Harry Lime|По телу не будет ,но в об,еме до 9 млн рублей , есть ограничение по налогооблагаемой базе сверху. Коллеги подсказали.
452|02.06.2019 10:01:12|Александр Кучеренко|2 банка не все решают  Но если так сделают,  в любом случае станут меньше По еврооблигации  тело Бонда не должно быть больше 9 млн. 
453|02.06.2019 10:03:26|Alexey Vishnyakov|А им нужны физики в евробондах Если бы минимальные лоты были по 1000, так и физиков было бы много в евробондах. Купить то считай и нечего. Старые выпуски погашаются, скоро один рус28, пара вэбов и новый cbom останется.
454|02.06.2019 10:06:32|Harry Lime|Я не разбирался по 9 млн , честно скажу , почитайте  напишите, будет супер
455|02.06.2019 10:07:11|Александр Кучеренко|Ок, залам вопрос брокеру Открытие
456|02.06.2019 10:08:31|Harry Lime|Снова повышены ставки резервирования по валютным вкладам , я не помню здесь или в пробондсе разбирали кейс , когда ВТБ продал пожилым клиентам газпром34 вместо вклада. Так что процесс то идет.
457|02.06.2019 10:08:53|А что ты сделал для котэ!?|Если вы льготу по переоценке  она не более 9 млн руб Посмотрите НК Насколько я помню  там не облагается прибыль в размере 3 млн в год Но это не точно с
458|02.06.2019 10:09:17|Александр Кучеренко|Ок
460|02.06.2019 10:12:03|Kir|На сайте Мосбиржи есть раздел про налоговые льготы для частных инвесторов https//www.moex.com/s188 Там есть чудесная презентация по налогообложению купонов разных видов облигаций https//fs.moex.com/files/17661
461|02.06.2019 10:12:23|First Last|Да 3 в год. Там даже формула в налоговом кодексе http//www.consultant.ru/document/cons_doc_LAW_28165/2b69106f66601ba5b58aaeb82395674581c66c20/
462|02.06.2019 10:12:33|Kir|Нее от 9млн, 3 года за каждый по три 3млн
464|02.06.2019 10:16:56|Alexey Vishnyakov|Почитал про повышение ставки резервирования по валютным вкладам... Врядли это поможет цб снизить количество долларовых вкладов. За последние 5 лет количество людей, хранящих иной раз все свои сбережения в долларах сильно увеличилось. Про прошлый год и не говорю.
465|02.06.2019 10:26:33|Alex|Если имеете ввиду долларовый бонд Гтлк 2024 номиналом 1000, то аккуратнее, там аморты, с них переоценку будете платить сразу.
466|02.06.2019 10:27:42|Harry Lime|Вот кстати да и НДФЛ на кусочек от прибыли при погашении , если брали ниже номинала. Все это помноженное на переоценку.
469|02.06.2019 11:28:45|Александр Кучеренко|Спасибо
471|02.06.2019 11:54:34|Denis Kozlov Septem|Мы не включаем фпк гарантинвест в список вдо, но в понедельник посмотрим за динамикой
472|02.06.2019 11:54:34|Denis Kozlov Septem|Банк ГарантИнвест просрочил возврат нескольких сотен миллионов рублей Банку России. Ранее регулятор провел в нем ЦБ проверку, также в группу заходили силовики. Через банк Гарант инвест отмываются деньги московского ЖКХ и финансируются активы членов семьи вицемэра Москвы по ЖКХ Петра Бирюкова. Основной владелец банка и одноименной группы Алексей Панфилов был советником Бирюкова и держит бизнес в интересах вицемэра. banksta
473|02.06.2019 12:06:41|Kosta|Посмотрите в сторону санктпетербургской биржи. Там есть несколько тикеров и они будут добавляться.
474|02.06.2019 12:09:29|Дмитрий Адамидов|риск по Гаранту будет когда Бирюкова снимут. А это наверное вместе с Собяниным.
475|02.06.2019 12:16:39|Savel|Ахаха. Сколько противоречивые мнений по гарантинвесту А ведь скоро летом будет погашение
476|02.06.2019 12:49:00|Pavel|Желтый ведь канальчикто, Банкста
477|02.06.2019 12:56:45|Дмитрий Адамидов|Банкста через раз пишет дело
479|02.06.2019 14:11:33|Aleksandr|вчера смогу  Вчера я тоже много что умею 
480|02.06.2019 14:12:43|Евгений Инвестор|Ещё по левой части графика удобно искать точки входа и выхода 
481|02.06.2019 14:13:54|Даниил Иванов|Здесь купил, тут продал
484|02.06.2019 15:56:09|Максим Кочнев|Полугодовой это софтлайн и чзпсн 1
485|02.06.2019 15:56:59|Alexey|да, но это только 4 раза в год  а остальные как
486|02.06.2019 16:01:36|Максим Кочнев|Ну для остального уже только трейдбери и ломастер
488|02.06.2019 16:12:56|First Last|ОФЗ с плечом обычно рекомендуют, позволяет увеличить сумму. но я не считал
491|02.06.2019 16:17:45|Даниил Иванов|И валерьяной сразу запастись
492|02.06.2019 16:26:06|Harry Lime|Да , это выбор профессионального комбайнера
493|02.06.2019 16:33:47|Шура SiberianRanger|Имея 400 тысяч к началу 2019 можно было вывести их все с помощью ОФЗ без плеч и длинных ОФЗ
494|02.06.2019 16:40:34|Sergey Sidorov|Ээх..., накомбайнерете вы всем в итоге отмену иис А 
495|02.06.2019 16:40:49|Денис|А где почитать про такую технологию
496|02.06.2019 16:41:16|Harry Lime|В факе должно быть
497|02.06.2019 16:43:34|Sergey Sidorov|На сайте investschet в начале 2018 помню читал, там очень подробная ветка была типа для продвинутых
498|02.06.2019 16:43:57|А что ты сделал для котэ!?|что такое документарные
499|02.06.2019 16:44:36|Harry Lime|http//investschet.ru/kuponnyjkombajntehnikabezopasnosti/
500|02.06.2019 16:46:54|Aleksey Kormilitsyn|Пока нет, но нужно включить.
501|02.06.2019 16:49:43|Harry Lime|Да , я напишу на досуге. Я на втором году доставал порядка 50 штук за раз через Полипласт3
502|02.06.2019 16:50:14|Aleksey Kormilitsyn|Это будет здорово, спасибо.
503|02.06.2019 16:52:42|Olbrnew|С плечом дешевле выходит, если тариф переключить на оборотный, то комиссия ниже выходит.
504|02.06.2019 17:11:14|DIM|Я так понимаю, люди за счёт большого количества итераций по покупке продажи в короткие срок различных офз добиваются получения на свой счёт обратно 400 тр за год, те на основном счёте 400 тр остаётся и за счёт купонов делается возврат этих же 400 тр А итераций по каждой офз надо проделать 266,всего офз 37 помоему в примере участвует, верно я мысль понял данной схемы по выводу средств с иис от купонов Ну про риски понятно, что при сильной посадке в цене офз при продаже свои 400 тр за год можно и не вернуть,, в идеале если продаёшь по той же цене что и покупаешь то на счёт вывести можно свои же 400 тр за 266 итераций за год по каждой офз
505|02.06.2019 17:13:02|Harry Lime|Я ОФЗ никогда не использовал , только ВДО  Полипласт3 или Каркаде2, купоны 16 ии15,75 соотвественно
506|02.06.2019 17:13:24|Olbrnew|Нет. Неверно.
508|02.06.2019 17:14:06|DIM|А сколько, там про это вроде бы написано было
509|02.06.2019 17:14:14|Olbrnew|Не обязательно все 400к выводить.
510|02.06.2019 17:14:45|DIM|Ну я про то, что максимум если пытаться сделать, вывести в течение года 400 тр
511|02.06.2019 17:14:55|Olbrnew|У вас купон сколько  7 годовых 
512|02.06.2019 17:15:17|DIM|Вопрос в том, что количество офз и купоны и правда в разрезе года позволят вывести такое количество денег во вне иис
514|02.06.2019 17:15:43|Анастасия Борискина|Сколько там брокеру перепадёт
515|02.06.2019 17:16:06|Olbrnew|Значит 3.5 полугодовой 
516|02.06.2019 17:16:26|DIM|Гдето так, да
517|02.06.2019 17:17:11|Olbrnew|То есть при одной покупке на 400к выводится 14к
519|02.06.2019 17:17:56|Harry Lime|Самый верный вопрос. Несколько сделок за год , не более того. Задачи достать все не было никогда. Купон имхо надо побольше , годовой  полугодовой и побольше.
520|02.06.2019 17:18:33|Olbrnew|Комиссия примерно 0.05 Это 190 рублей примерно.
521|02.06.2019 17:19:21|DIM|Те исходя из наших расчётов те на руки 13800 падает
522|02.06.2019 17:19:29|Olbrnew|Если в начале года с плечом вывести под полугодовой купон, то получится комса 564 рубля и 42к на счете
525|02.06.2019 17:20:49|DIM|А что насчёт того, что мы вощвращаем перед покупкой офз ещё сам купон
527|02.06.2019 17:21:35|Olbrnew|Только в комиссии.
528|02.06.2019 17:21:39|DIM|Те мы платим за купон, потом через условно 34 дня возвращаем но с меньшей цифрой
529|02.06.2019 17:21:52|Olbrnew|Да.
530|02.06.2019 17:22:11|DIM|Или мы тут говорим исключительно как вывести с иис деньги по максимум и реинвестировать их
531|02.06.2019 17:22:42|Olbrnew|Смысл в том, что вы не хотите 400к держать в облигах и акциях. Разгружаете счет например до 200 к
532|02.06.2019 17:22:52|DIM|Ну тогда чем больше итераций в году с офз делаем, тем больше вывод получаем
533|02.06.2019 17:22:53|Olbrnew|Их инвестируете.
538|02.06.2019 17:25:37|DIM|С 200 тр не много ведь по депозит у прийдет, я все равно до конца не понимаю смысл этой игры, ведь выигрыш там такой мелочные, а трудозатраты немаленькие, ведь это не одну итераций сделать надо, как я понимаю не меньше 30 за год
540|02.06.2019 17:26:54|Olbrnew|Почему 30  С плечом вы сразу 40к выводите. 5 раз. А если годовой купон то еще лучше.
543|02.06.2019 17:28:38|DIM|С плечом Вы про кредитное плечо Я не сторонник его использования просто
544|02.06.2019 17:28:56|Olbrnew|А чем оно плохо 
545|02.06.2019 17:29:25|DIM|Ну иис упирается в 400 тр, с которых можно максимум ещё и по ндфл вернуть 13
546|02.06.2019 17:30:04|Olbrnew|То что лошье, которое на форексе насливало с 200 плечами разнесли по инету его боязнь 
547|02.06.2019 17:30:15|DIM|В Иис честно не пробовал даже, так можно В тинькове нельзя было, в втб иис нет и не пробовал даже
548|02.06.2019 17:30:36|Olbrnew|Вы инвестор. Для инвестора математика и риски прежде всего.
550|02.06.2019 17:31:07|Alexey Vishnyakov|Это все имеет смысл только в случае, если денег на пополнение иис нет, но вычет в 52к очень хочется. Во всех остальных случаях слишком много мороки
551|02.06.2019 17:31:33|DIM|Надо думать, за мысли спасибо
552|02.06.2019 17:31:43|Alexey Vishnyakov|Можно взять те, которым доверяешь.  И сидеть с ними
